[OUTPUT] Logging to: /home/ws/ugv_cont/mission/outputs/20251221_212057
[OUTPUT] Log file: /home/ws/ugv_cont/mission/outputs/20251221_212057/logs/navigation.log
=======================================================
NEXT-BEST-VIEW (NBV) NAVIGATION
=======================================================
Speed: 0.08 m/s
Goal distance: 0.5-2.0m
Press Ctrl+C to stop

[DEBUG] Marker publishing enabled - check /nav_goal in RViz
[MARKER] Persistent marker publisher started - add /nav_goal in RViz
[START] Initial position: (0.01, -0.00)
[MARKER] Origin marker (blue) started at (0.01, -0.00) - add /nav_origin in RViz

[  2.3s] [GOAL SELECT] robot@(0.01,-0.00) | 13 candidates (scanned=43 walls=19 visited=1):
  #1 ang=-107° d=2.00m pos=(0.58,1.91) score=+36.1 [O=+2.5 U=+34.0 V=-0.0 W=-1.0 R=-0.0 F=+0.0] <-- BEST
  #2 ang= -58° d=0.50m pos=(-0.26,0.42) score=+30.0 [O=+1.6 U=+41.2 V=-0.0 W=-3.0 R=-0.0 F=+0.0 T=-10.0]
  #3 ang=-107° d=1.50m pos=(0.44,1.44) score=+30.0 [O=+2.5 U=+28.0 V=-0.0 W=-1.0 R=-0.0 F=+0.0]
  #4 ang= -64° d=0.50m pos=(-0.21,0.45) score=+27.9 [O=+1.6 U=+39.2 V=-0.0 W=-3.0 R=-0.0 F=+0.0 T=-10.0]
  #5 ang= -70° d=0.50m pos=(-0.16,0.47) score=+25.9 [O=+1.6 U=+37.2 V=-0.0 W=-3.0 R=-0.0 F=+0.0 T=-10.0]
  #6 ang=-113° d=1.00m pos=(0.40,0.92) score=+24.5 [O=+2.0 U=+23.2 V=-0.0 W=-1.0 R=-0.0 F=+0.0]
  #7 ang= -76° d=0.50m pos=(-0.11,0.48) score=+24.2 [O=+1.8 U=+35.2 V=-0.0 W=-3.0 R=-0.0 F=+0.0 T=-10.0]
  #8 ang= -82° d=0.50m pos=(-0.06,0.49) score=+16.7 [O=+2.3 U=+27.2 V=-0.0 W=-3.0 R=-0.0 F=+0.0 T=-10.0]
[  2.3s] [GOAL] Selected: (0.58, 1.91) dist=2.00m timeout=50s angle=-107° reason=no goal
[  1] DRIVE goal=(0.58,1.91) dist=2.00m front=0.41m cells=1 rms=0.0cm[  2] DRIVE goal=(0.58,1.91) dist=2.00m front=0.41m cells=1 rms=0.0cm[  3] DRIVE goal=(0.58,1.91) dist=2.00m front=0.41m cells=1 rms=0.1cm[  4] DRIVE goal=(0.58,1.91) dist=2.00m front=0.41m cells=1 rms=0.1cm[  5] DRIVE goal=(0.58,1.91) dist=2.00m front=0.42m cells=1 rms=0.2cm[  6] DRIVE goal=(0.58,1.91) dist=2.00m front=0.42m cells=1 rms=0.3cm[  7] DRIVE goal=(0.58,1.91) dist=2.00m front=0.43m cells=1 rms=0.3cm[  8] DRIVE goal=(0.58,1.91) dist=2.00m front=0.45m cells=1 rms=0.4cm[  9] DRIVE goal=(0.58,1.91) dist=2.00m front=0.57m cells=1 rms=0.4cm[ 10] DRIVE goal=(0.58,1.91) dist=2.00m front=0.57m cells=1 rms=0.4cm[ 11] DRIVE goal=(0.58,1.91) dist=2.01m front=0.57m cells=1 rms=0.4cm[ 12] DRIVE goal=(0.58,1.91) dist=2.00m front=0.57m cells=1 rms=0.4cm[ 13] DRIVE goal=(0.58,1.91) dist=2.01m front=0.57m cells=1 rms=0.4cm[ 14] DRIVE goal=(0.58,1.91) dist=2.01m front=0.57m cells=1 rms=0.4cm[ 15] DRIVE goal=(0.58,1.91) dist=2.01m front=0.57m cells=1 rms=0.4cm[ 16] DRIVE goal=(0.58,1.91) dist=2.01m front=0.57m cells=1 rms=0.4cm[ 17] DRIVE goal=(0.58,1.91) dist=2.01m front=0.57m cells=1 rms=0.4cm[ 18] DRIVE goal=(0.58,1.91) dist=2.01m front=0.62m cells=1 rms=0.4cm[ 19] DRIVE goal=(0.58,1.91) dist=2.01m front=0.60m cells=1 rms=0.5cm[ 20] DRIVE goal=(0.58,1.91) dist=2.01m front=0.62m cells=1 rms=0.5cm[ 21] DRIVE goal=(0.58,1.91) dist=2.01m front=0.63m cells=1 rms=0.5cm[ 22] DRIVE goal=(0.58,1.91) dist=2.01m front=0.63m cells=1 rms=0.5cm[ 23] DRIVE goal=(0.58,1.91) dist=2.01m front=0.63m cells=1 rms=0.5cm[ 24] DRIVE goal=(0.58,1.91) dist=2.01m front=0.65m cells=1 rms=0.5cm[ 25] DRIVE goal=(0.58,1.91) dist=2.02m front=0.69m cells=1 rms=0.5cm
[  7.8s] [TURN ENTER] Entering TURN mode

[BLOCKED DEBUG] Goal angle: -39.1° (sector 53), goal_dist: 2.02m, goal_dir_min: 1.84m, margin: 0.15m
[BLOCKED DEBUG] Checking 1 sectors (robot angular width at 2.0m = 5.1°): {53: 1.843}
[BLOCKED DEBUG] Check: 1.84 < 2.02 - 0.15 = 1.87? True
[BLOCKED DEBUG] (Full front arc for reference: {55: 3.715, 56: 3.776, 57: 1.781, 58: 1.78, 59: 1.308, 0: 1.088, 1: 1.061, 2: 1.08, 3: 1.113, 4: 0.797, 5: 0.745})

[BLOCKED TURN] goal_sector=53, best_sector=53 (dist=1.84m), target_angle=-42.0°, angle_error=-42.0°, v=0.00, w=-0.50
[ 26] TURN goal=(0.58,1.91) dist=2.02m front=0.74m cells=1 rms=0.5cm[ 27] TURN goal=(0.58,1.91) dist=2.03m front=0.76m cells=1 rms=0.5cm[ 28] DRIVE goal=(0.58,1.91) dist=2.02m front=0.78m cells=1 rms=0.5cm[ 29] DRIVE goal=(0.58,1.91) dist=2.03m front=0.78m cells=1 rms=0.5cm[ 30] DRIVE goal=(0.58,1.91) dist=2.02m front=0.78m cells=1 rms=0.5cm[ 31] DRIVE goal=(0.58,1.91) dist=2.02m front=0.81m cells=1 rms=0.5cm
[  9.0s] [TURN ENTER] Entering TURN mode

[BLOCKED DEBUG] Goal angle: -27.2° (sector 55), goal_dist: 2.02m, goal_dir_min: 1.87m, margin: 0.15m
[BLOCKED DEBUG] Checking 1 sectors (robot angular width at 2.0m = 5.1°): {55: 1.868}
[BLOCKED DEBUG] Check: 1.87 < 2.02 - 0.15 = 1.87? True
[BLOCKED DEBUG] (Full front arc for reference: {55: 1.868, 56: 3.72, 57: 3.705, 58: 5.205, 59: 1.77, 0: 1.774, 1: 1.299, 2: 1.058, 3: 1.058, 4: 1.083, 5: 1.12})

[BLOCKED TURN] goal_sector=55, best_sector=55 (dist=1.87m), target_angle=-30.0°, angle_error=-30.0°, v=0.00, w=-0.50
[ 32] TURN goal=(0.58,1.91) dist=2.02m front=1.06m cells=1 rms=0.5cm[ 33] DRIVE goal=(0.58,1.91) dist=2.02m front=1.06m cells=1 rms=0.5cm
[  9.4s] [TURN ENTER] Entering TURN mode

[BLOCKED DEBUG] Goal angle: -27.0° (sector 55), goal_dist: 2.02m, goal_dir_min: 1.87m, margin: 0.15m
[BLOCKED DEBUG] Checking 1 sectors (robot angular width at 2.0m = 5.1°): {55: 1.866}
[BLOCKED DEBUG] Check: 1.87 < 2.02 - 0.15 = 1.87? True
[BLOCKED DEBUG] (Full front arc for reference: {55: 1.866, 56: 3.748, 57: 3.702, 58: 5.035, 59: 1.769, 0: 1.77, 1: 1.299, 2: 1.058, 3: 1.056, 4: 1.081, 5: 1.117})

[BLOCKED TURN] goal_sector=55, best_sector=55 (dist=1.87m), target_angle=-30.0°, angle_error=-30.0°, v=0.00, w=-0.50
[ 34] TURN goal=(0.58,1.91) dist=2.02m front=1.06m cells=1 rms=0.5cm[ 35] TURN goal=(0.58,1.91) dist=2.02m front=0.88m cells=1 rms=0.5cm[ 36] TURN goal=(0.58,1.91) dist=2.02m front=0.80m cells=1 rms=0.5cm[ 37] TURN goal=(0.58,1.91) dist=2.01m front=0.74m cells=1 rms=0.5cm[ 38] TURN goal=(0.58,1.91) dist=2.01m front=0.72m cells=1 rms=0.5cm[ 39] TURN goal=(0.58,1.91) dist=2.01m front=0.69m cells=1 rms=0.5cm[ 40] TURN goal=(0.58,1.91) dist=2.01m front=0.68m cells=1 rms=0.5cm[ 41] TURN goal=(0.58,1.91) dist=2.01m front=0.69m cells=1 rms=0.5cm[ 42] DRIVE goal=(0.58,1.91) dist=2.01m front=0.70m cells=1 rms=0.5cm
[ 11.3s] [TURN ENTER] Entering TURN mode

[BLOCKED DEBUG] Goal angle: -9.0° (sector 58), goal_dist: 2.01m, goal_dir_min: 1.85m, margin: 0.15m
[BLOCKED DEBUG] Checking 1 sectors (robot angular width at 2.0m = 5.1°): {58: 1.848}
[BLOCKED DEBUG] Check: 1.85 < 2.01 - 0.15 = 1.86? True
[BLOCKED DEBUG] (Full front arc for reference: {55: 0.693, 56: 0.737, 57: 0.814, 58: 1.848, 59: 3.74, 0: 3.688, 1: 5.086, 2: 1.759, 3: 1.761, 4: 1.291, 5: 1.068})

[BLOCKED TURN] goal_sector=58, best_sector=58 (dist=1.85m), target_angle=-12.0°, angle_error=-12.0°, v=0.00, w=-0.31
[ 43] TURN goal=(0.58,1.91) dist=2.01m front=0.69m cells=1 rms=0.5cm[ 44] TURN goal=(0.58,1.91) dist=2.00m front=0.68m cells=1 rms=0.6cm[ 45] TURN goal=(0.58,1.91) dist=2.00m front=0.67m cells=1 rms=0.6cm[ 46] TURN goal=(0.58,1.91) dist=2.00m front=0.67m cells=1 rms=0.6cm[ 47] TURN goal=(0.58,1.91) dist=2.00m front=0.66m cells=1 rms=0.6cm[ 48] TURN goal=(0.58,1.91) dist=2.00m front=0.66m cells=1 rms=0.6cm[ 49] TURN goal=(0.58,1.91) dist=2.00m front=0.66m cells=1 rms=0.7cm[ 50] TURN goal=(0.58,1.91) dist=2.00m front=0.66m cells=1 rms=0.7cm[ 51] TURN goal=(0.58,1.91) dist=2.00m front=0.66m cells=1 rms=0.7cm[ 52] TURN goal=(0.58,1.91) dist=2.00m front=0.65m cells=1 rms=0.7cm[ 53] TURN goal=(0.58,1.91) dist=1.98m front=0.65m cells=1 rms=0.7cm[ 54] DRIVE goal=(0.58,1.91) dist=1.98m front=0.65m cells=1 rms=0.8cm
[ 13.7s] [TURN ENTER] Entering TURN mode

[BLOCKED DEBUG] Goal angle: -6.8° (sector 58), goal_dist: 1.97m, goal_dir_min: 0.82m, margin: 0.15m
[BLOCKED DEBUG] Checking 1 sectors (robot angular width at 2.0m = 5.2°): {58: 0.819}
[BLOCKED DEBUG] Check: 0.82 < 1.97 - 0.15 = 1.82? True
[BLOCKED DEBUG] (Full front arc for reference: {55: 0.65, 56: 0.683, 57: 0.739, 58: 0.819, 59: 1.934, 0: 3.668, 1: 3.659, 2: 5.129, 3: 1.729, 4: 1.732, 5: 1.262})

[BLOCKED TURN] goal_sector=58, best_sector=58 (dist=0.82m), target_angle=-12.0°, angle_error=-12.0°, v=0.00, w=-0.31
[ 55] TURN goal=(0.58,1.91) dist=1.97m front=0.65m cells=1 rms=0.8cm[ 56] TURN goal=(0.58,1.91) dist=1.96m front=0.65m cells=1 rms=0.8cm[ 57] TURN goal=(0.58,1.91) dist=1.94m front=0.65m cells=1 rms=0.8cm[ 58] TURN goal=(0.58,1.91) dist=1.92m front=0.63m cells=1 rms=0.9cm[ 59] TURN goal=(0.58,1.91) dist=1.92m front=0.63m cells=1 rms=0.9cm[ 60] TURN goal=(0.58,1.91) dist=1.92m front=0.64m cells=1 rms=0.9cm[ 61] TURN goal=(0.58,1.91) dist=1.92m front=0.64m cells=1 rms=1.0cm[ 62] TURN goal=(0.58,1.91) dist=1.92m front=0.65m cells=1 rms=1.0cm[ 63] TURN goal=(0.58,1.91) dist=1.92m front=0.64m cells=1 rms=1.0cm[ 64] TURN goal=(0.58,1.91) dist=1.92m front=0.64m cells=1 rms=1.1cm[ 65] TURN goal=(0.58,1.91) dist=1.92m front=0.64m cells=1 rms=1.1cm[ 66] TURN goal=(0.58,1.91) dist=1.92m front=0.64m cells=1 rms=1.1cm[ 67] TURN goal=(0.58,1.91) dist=1.92m front=0.63m cells=1 rms=1.1cm[ 68] TURN goal=(0.58,1.91) dist=1.92m front=0.63m cells=1 rms=1.2cm[ 69] TURN goal=(0.58,1.91) dist=1.91m front=0.60m cells=1 rms=1.2cm[ 70] TURN goal=(0.58,1.91) dist=1.91m front=0.59m cells=1 rms=1.2cm[ 71] DRIVE goal=(0.58,1.91) dist=1.89m front=0.58m cells=1 rms=1.3cm
[ 17.1s] [TURN ENTER] Entering TURN mode

[BLOCKED DEBUG] Goal angle: 8.1° (sector 1), goal_dist: 1.89m, goal_dir_min: 1.73m, margin: 0.15m
[BLOCKED DEBUG] Checking 1 sectors (robot angular width at 1.9m = 5.4°): {1: 1.734}
[BLOCKED DEBUG] Check: 1.73 < 1.89 - 0.15 = 1.74? True
[BLOCKED DEBUG] (Full front arc for reference: {55: 0.681, 56: 0.58, 57: 0.592, 58: 0.619, 59: 0.668, 0: 0.733, 1: 1.734, 2: 3.659, 3: 3.587, 4: 3.598, 5: 5.358})

[BLOCKED TURN] goal_sector=1, best_sector=1 (dist=1.73m), target_angle=6.0°, angle_error=6.0°, v=0.05, w=0.16
[ 72] TURN goal=(0.58,1.91) dist=1.89m front=0.58m cells=1 rms=1.3cm[ 73] TURN goal=(0.58,1.91) dist=1.89m front=0.57m cells=1 rms=1.3cm[ 74] TURN goal=(0.58,1.91) dist=1.87m front=0.56m cells=1 rms=1.3cm[ 75] DRIVE goal=(0.58,1.91) dist=1.85m front=0.54m cells=1 rms=1.3cm
[ 17.9s] [TURN ENTER] Entering TURN mode

[BLOCKED DEBUG] Goal angle: 8.2° (sector 1), goal_dist: 1.84m, goal_dir_min: 1.68m, margin: 0.15m
[BLOCKED DEBUG] Checking 1 sectors (robot angular width at 1.8m = 5.6°): {1: 1.68}
[BLOCKED DEBUG] Check: 1.68 < 1.84 - 0.15 = 1.69? True
[BLOCKED DEBUG] (Full front arc for reference: {55: 0.529, 56: 0.531, 57: 0.551, 58: 0.576, 59: 0.627, 0: 0.687, 1: 1.68, 2: 3.604, 3: 3.533, 4: 3.575, 5: 5.346})

[BLOCKED TURN] goal_sector=1, best_sector=1 (dist=1.68m), target_angle=6.0°, angle_error=6.0°, v=0.05, w=0.16
[ 76] TURN goal=(0.58,1.91) dist=1.84m front=0.53m cells=1 rms=1.4cm[ 77] TURN goal=(0.58,1.91) dist=1.82m front=0.51m cells=1 rms=1.4cm[ 78] TURN goal=(0.58,1.91) dist=1.80m front=0.50m cells=1 rms=1.4cm[ 79] TURN goal=(0.58,1.91) dist=1.78m front=0.48m cells=1 rms=1.3cm[ 80] TURN goal=(0.58,1.91) dist=1.76m front=0.48m cells=1 rms=1.3cm[ 81] DRIVE goal=(0.58,1.91) dist=1.75m front=0.49m cells=1 rms=1.3cm
[ 19.1s] [TURN ENTER] Entering TURN mode

[BLOCKED DEBUG] Goal angle: -8.3° (sector 58), goal_dist: 1.73m, goal_dir_min: 1.56m, margin: 0.15m
[BLOCKED DEBUG] Checking 1 sectors (robot angular width at 1.7m = 6.0°): {58: 1.565}
[BLOCKED DEBUG] Check: 1.56 < 1.73 - 0.15 = 1.58? True
[BLOCKED DEBUG] (Full front arc for reference: {55: 0.523, 56: 0.567, 57: 0.603, 58: 1.565, 59: 3.513, 0: 3.427, 1: 3.429, 2: 5.221, 3: 1.509, 4: 1.51, 5: 1.534})

[BLOCKED TURN] goal_sector=58, best_sector=58 (dist=1.56m), target_angle=-12.0°, angle_error=-12.0°, v=0.00, w=-0.31
[ 82] TURN goal=(0.58,1.91) dist=1.73m front=0.52m cells=1 rms=1.3cm[ 83] TURN goal=(0.58,1.91) dist=1.72m front=0.56m cells=1 rms=1.3cm[ 84] DRIVE goal=(0.58,1.91) dist=1.69m front=0.56m cells=2 rms=1.3cm[ 85] DRIVE goal=(0.58,1.91) dist=1.67m front=0.51m cells=2 rms=1.3cm[ 86] DRIVE goal=(0.58,1.91) dist=1.67m front=0.51m cells=2 rms=1.4cm
[ 20.1s] [TURN ENTER] Entering TURN mode

[BLOCKED DEBUG] Goal angle: -7.9° (sector 58), goal_dist: 1.66m, goal_dir_min: 1.51m, margin: 0.15m
[BLOCKED DEBUG] Checking 1 sectors (robot angular width at 1.7m = 6.2°): {58: 1.507}
[BLOCKED DEBUG] Check: 1.51 < 1.66 - 0.15 = 1.51? True
[BLOCKED DEBUG] (Full front arc for reference: {55: 0.503, 56: 0.532, 57: 1.347, 58: 1.507, 59: 2.509, 0: 3.362, 1: 3.362, 2: 5.156, 3: 1.443, 4: 1.44, 5: 1.456})

[BLOCKED TURN] goal_sector=58, best_sector=58 (dist=1.51m), target_angle=-12.0°, angle_error=-12.0°, v=0.00, w=-0.31
[ 87] TURN goal=(0.58,1.91) dist=1.66m front=0.50m cells=2 rms=1.4cm[ 88] DRIVE goal=(0.58,1.91) dist=1.66m front=0.50m cells=2 rms=1.4cm[ 89] DRIVE goal=(0.58,1.91) dist=1.66m front=0.49m cells=2 rms=1.4cm
[ 20.7s] [TURN ENTER] Entering TURN mode

[BLOCKED DEBUG] Goal angle: -6.5° (sector 58), goal_dist: 1.66m, goal_dir_min: 1.48m, margin: 0.15m
[BLOCKED DEBUG] Checking 1 sectors (robot angular width at 1.7m = 6.2°): {58: 1.481}
[BLOCKED DEBUG] Check: 1.48 < 1.66 - 0.15 = 1.51? True
[BLOCKED DEBUG] (Full front arc for reference: {55: 0.492, 56: 0.525, 57: 1.328, 58: 1.481, 59: 1.681, 0: 3.376, 1: 3.356, 2: 5.146, 3: 5.241, 4: 1.438, 5: 1.448})

[BLOCKED TURN] goal_sector=58, best_sector=58 (dist=1.48m), target_angle=-12.0°, angle_error=-12.0°, v=0.00, w=-0.31
[ 90] TURN goal=(0.58,1.91) dist=1.66m front=0.49m cells=2 rms=1.4cm[ 91] TURN goal=(0.58,1.91) dist=1.65m front=0.49m cells=2 rms=1.4cm[ 92] TURN goal=(0.58,1.91) dist=1.64m front=0.48m cells=2 rms=1.5cm[ 93] DRIVE goal=(0.58,1.91) dist=1.63m front=0.47m cells=2 rms=1.5cm[ 94] DRIVE goal=(0.58,1.91) dist=1.63m front=0.47m cells=2 rms=1.5cm[ 95] DRIVE goal=(0.58,1.91) dist=1.63m front=0.47m cells=2 rms=1.5cm[ 96] DRIVE goal=(0.58,1.91) dist=1.62m front=0.46m cells=2 rms=1.6cm[ 97] DRIVE goal=(0.58,1.91) dist=1.60m front=0.43m cells=2 rms=1.6cm[ 98] DRIVE goal=(0.58,1.91) dist=1.58m front=0.41m cells=2 rms=1.6cm[ 99] DRIVE goal=(0.58,1.91) dist=1.56m front=0.40m cells=2 rms=1.6cm[100] DRIVE goal=(0.58,1.91) dist=1.55m front=0.41m cells=2 rms=1.6cm[101] DRIVE goal=(0.58,1.91) dist=1.53m front=0.41m cells=2 rms=1.6cm[102] DRIVE goal=(0.58,1.91) dist=1.51m front=0.40m cells=2 rms=1.7cm[103] DRIVE goal=(0.58,1.91) dist=1.49m front=0.39m cells=2 rms=1.7cm[104] DRIVE goal=(0.58,1.91) dist=1.47m front=0.38m cells=2 rms=1.7cm[105] DRIVE goal=(0.58,1.91) dist=1.44m front=0.36m cells=2 rms=1.7cm[106] DRIVE goal=(0.58,1.91) dist=1.43m front=1.02m cells=2 rms=1.7cm[107] DRIVE goal=(0.58,1.91) dist=1.42m front=1.05m cells=2 rms=1.8cm[108] DRIVE goal=(0.58,1.91) dist=1.41m front=1.08m cells=2 rms=1.8cm[109] DRIVE goal=(0.58,1.91) dist=1.39m front=1.02m cells=2 rms=1.8cm[110] DRIVE goal=(0.58,1.91) dist=1.38m front=1.13m cells=3 rms=1.8cm[111] DRIVE goal=(0.58,1.91) dist=1.37m front=1.12m cells=3 rms=1.9cm[112] DRIVE goal=(0.58,1.91) dist=1.37m front=1.08m cells=3 rms=1.9cm[113] DRIVE goal=(0.58,1.91) dist=1.37m front=1.09m cells=3 rms=1.9cm[114] DRIVE goal=(0.58,1.91) dist=1.36m front=1.07m cells=3 rms=2.0cm[115] DRIVE goal=(0.58,1.91) dist=1.35m front=1.05m cells=3 rms=2.0cm[116] DRIVE goal=(0.58,1.91) dist=1.34m front=1.02m cells=3 rms=2.0cm[117] DRIVE goal=(0.58,1.91) dist=1.33m front=1.01m cells=3 rms=2.1cm[118] DRIVE goal=(0.58,1.91) dist=1.33m front=1.01m cells=3 rms=2.1cm[119] DRIVE goal=(0.58,1.91) dist=1.32m front=0.99m cells=3 rms=2.2cm[120] DRIVE goal=(0.58,1.91) dist=1.31m front=0.97m cells=3 rms=2.2cm[121] DRIVE goal=(0.58,1.91) dist=1.30m front=0.95m cells=3 rms=2.3cm[122] DRIVE goal=(0.58,1.91) dist=1.29m front=0.94m cells=3 rms=2.3cm[123] DRIVE goal=(0.58,1.91) dist=1.27m front=0.93m cells=3 rms=2.4cm[124] DRIVE goal=(0.58,1.91) dist=1.25m front=0.93m cells=3 rms=2.4cm[125] DRIVE goal=(0.58,1.91) dist=1.23m front=0.91m cells=3 rms=2.5cm[126] DRIVE goal=(0.58,1.91) dist=1.21m front=0.90m cells=3 rms=2.5cm[127] DRIVE goal=(0.58,1.91) dist=1.19m front=0.89m cells=3 rms=2.6cm[128] DRIVE goal=(0.58,1.91) dist=1.18m front=0.89m cells=3 rms=2.6cm[129] DRIVE goal=(0.58,1.91) dist=1.16m front=0.88m cells=3 rms=2.7cm[130] DRIVE goal=(0.58,1.91) dist=1.13m front=0.88m cells=3 rms=2.7cm[131] DRIVE goal=(0.58,1.91) dist=1.11m front=0.88m cells=3 rms=2.8cm[132] DRIVE goal=(0.58,1.91) dist=1.08m front=0.86m cells=3 rms=2.8cm[133] DRIVE goal=(0.58,1.91) dist=1.07m front=0.85m cells=4 rms=2.9cm[134] DRIVE goal=(0.58,1.91) dist=1.04m front=0.84m cells=4 rms=3.0cm[135] DRIVE goal=(0.58,1.91) dist=1.02m front=0.82m cells=4 rms=3.0cm[136] DRIVE goal=(0.58,1.91) dist=1.00m front=0.82m cells=4 rms=3.1cm[137] DRIVE goal=(0.58,1.91) dist=0.98m front=0.81m cells=4 rms=3.1cm[138] DRIVE goal=(0.58,1.91) dist=0.97m front=0.80m cells=4 rms=3.2cm[139] DRIVE goal=(0.58,1.91) dist=0.95m front=0.79m cells=4 rms=3.2cm[140] DRIVE goal=(0.58,1.91) dist=0.93m front=0.79m cells=4 rms=3.3cm[141] DRIVE goal=(0.58,1.91) dist=0.91m front=0.77m cells=4 rms=3.4cm[142] DRIVE goal=(0.58,1.91) dist=0.89m front=0.76m cells=4 rms=3.4cm[143] DRIVE goal=(0.58,1.91) dist=0.87m front=0.75m cells=4 rms=3.5cm[144] DRIVE goal=(0.58,1.91) dist=0.85m front=0.74m cells=4 rms=3.5cm[145] DRIVE goal=(0.58,1.91) dist=0.83m front=0.72m cells=4 rms=3.6cm[146] DRIVE goal=(0.58,1.91) dist=0.81m front=0.72m cells=4 rms=3.6cm[147] DRIVE goal=(0.58,1.91) dist=0.79m front=0.70m cells=4 rms=3.7cm[148] DRIVE goal=(0.58,1.91) dist=0.78m front=0.70m cells=4 rms=3.7cm[149] DRIVE goal=(0.58,1.91) dist=0.77m front=0.69m cells=5 rms=3.8cm[150] DRIVE goal=(0.58,1.91) dist=0.75m front=0.69m cells=5 rms=3.8cm[151] DRIVE goal=(0.58,1.91) dist=0.73m front=0.67m cells=5 rms=3.8cm[152] DRIVE goal=(0.58,1.91) dist=0.71m front=0.66m cells=6 rms=3.9cm[153] DRIVE goal=(0.58,1.91) dist=0.69m front=0.68m cells=6 rms=3.9cm[154] DRIVE goal=(0.58,1.91) dist=0.66m front=0.69m cells=6 rms=4.0cm[155] DRIVE goal=(0.58,1.91) dist=0.65m front=0.69m cells=6 rms=4.0cm[156] DRIVE goal=(0.58,1.91) dist=0.63m front=0.69m cells=6 rms=4.1cm[157] DRIVE goal=(0.58,1.91) dist=0.61m front=1.24m cells=6 rms=4.1cm[158] DRIVE goal=(0.58,1.91) dist=0.60m front=1.13m cells=6 rms=4.1cm[159] DRIVE goal=(0.58,1.91) dist=0.59m front=1.20m cells=6 rms=4.2cm[160] DRIVE goal=(0.58,1.91) dist=0.58m front=0.67m cells=6 rms=4.2cm[161] DRIVE goal=(0.58,1.91) dist=0.58m front=0.63m cells=6 rms=4.3cm[162] DRIVE goal=(0.58,1.91) dist=0.58m front=0.64m cells=6 rms=4.3cm[163] DRIVE goal=(0.58,1.91) dist=0.57m front=0.63m cells=6 rms=4.4cm[164] DRIVE goal=(0.58,1.91) dist=0.56m front=0.63m cells=6 rms=4.4cm[165] DRIVE goal=(0.58,1.91) dist=0.56m front=0.62m cells=6 rms=4.5cm[166] DRIVE goal=(0.58,1.91) dist=0.55m front=0.61m cells=6 rms=4.5cm[167] DRIVE goal=(0.58,1.91) dist=0.54m front=0.60m cells=6 rms=4.6cm[168] DRIVE goal=(0.58,1.91) dist=0.53m front=0.59m cells=6 rms=4.6cm[169] DRIVE goal=(0.58,1.91) dist=0.52m front=0.58m cells=6 rms=4.7cm[170] DRIVE goal=(0.58,1.91) dist=0.51m front=0.57m cells=6 rms=4.7cm[171] DRIVE goal=(0.58,1.91) dist=0.50m front=0.56m cells=6 rms=4.7cm[172] DRIVE goal=(0.58,1.91) dist=0.48m front=0.55m cells=6 rms=4.8cm[173] DRIVE goal=(0.58,1.91) dist=0.46m front=0.53m cells=7 rms=4.8cm[174] DRIVE goal=(0.58,1.91) dist=0.44m front=0.52m cells=7 rms=4.8cm[175] DRIVE goal=(0.58,1.91) dist=0.42m front=0.51m cells=7 rms=4.9cm[176] DRIVE goal=(0.58,1.91) dist=0.40m front=0.50m cells=7 rms=4.9cm
[ 38.2s] [GOAL SELECT] robot@(0.40,1.58) | 15 candidates (scanned=119 walls=71 visited=7):
  #1 ang=  +9° d=1.50m pos=(0.75,3.04) score=+50.2 [O=+1.7 U=+34.1 V=-0.0 W=-1.0 R=-0.0 F=+15.0] <-- BEST
  #2 ang= +27° d=1.50m pos=(0.27,3.07) score=+47.8 [O=+1.6 U=+31.6 V=-0.0 W=-0.0 R=-0.0 F=+14.2]
  #3 ang= +15° d=1.50m pos=(0.59,3.07) score=+44.0 [O=+1.6 U=+28.0 V=-0.0 W=-1.0 R=-0.0 F=+14.9]
  #4 ang= +21° d=1.50m pos=(0.43,3.08) score=+43.7 [O=+1.6 U=+28.0 V=-0.0 W=-1.0 R=-0.0 F=+14.6]
  #5 ang=  +9° d=1.00m pos=(0.63,2.55) score=+42.6 [O=+2.2 U=+26.1 V=-0.0 W=-1.0 R=-0.0 F=+15.0]
  #6 ang= +15° d=1.00m pos=(0.53,2.57) score=+34.3 [O=+2.1 U=+20.0 V=-0.0 W=-1.0 R=-2.0 F=+14.9]
  #7 ang= +21° d=1.00m pos=(0.42,2.58) score=+34.0 [O=+2.1 U=+20.0 V=-0.0 W=-1.0 R=-2.0 F=+14.6]
  #8 ang= +27° d=1.00m pos=(0.31,2.58) score=+33.6 [O=+2.1 U=+20.0 V=-0.0 W=-1.0 R=-2.0 F=+14.2]
[ 38.2s] [GOAL] Selected: (0.75, 3.04) dist=1.50m timeout=42s angle=9° reason=reached
[177] DRIVE goal=(0.75,3.04) dist=1.50m front=0.48m cells=7 rms=4.9cm[178] DRIVE goal=(0.75,3.04) dist=1.47m front=0.48m cells=7 rms=4.9cm[179] DRIVE goal=(0.75,3.04) dist=1.45m front=0.46m cells=7 rms=4.8cm[180] DRIVE goal=(0.75,3.04) dist=1.44m front=0.46m cells=7 rms=4.8cm[181] DRIVE goal=(0.75,3.04) dist=1.43m front=0.46m cells=7 rms=4.8cm[182] DRIVE goal=(0.75,3.04) dist=1.42m front=0.50m cells=7 rms=4.8cm[183] DRIVE goal=(0.75,3.04) dist=1.41m front=0.49m cells=7 rms=4.8cm[184] DRIVE goal=(0.75,3.04) dist=1.40m front=0.50m cells=7 rms=4.8cm[185] DRIVE goal=(0.75,3.04) dist=1.38m front=0.85m cells=7 rms=4.8cm[186] DRIVE goal=(0.75,3.04) dist=1.36m front=0.84m cells=7 rms=4.8cm[187] DRIVE goal=(0.75,3.04) dist=1.34m front=0.86m cells=7 rms=4.8cm[188] DRIVE goal=(0.75,3.04) dist=1.33m front=0.85m cells=7 rms=4.7cm[189] DRIVE goal=(0.75,3.04) dist=1.31m front=0.85m cells=7 rms=4.7cm[190] DRIVE goal=(0.75,3.04) dist=1.29m front=0.86m cells=7 rms=4.7cm[191] DRIVE goal=(0.75,3.04) dist=1.27m front=0.85m cells=7 rms=4.7cm[192] DRIVE goal=(0.75,3.04) dist=1.25m front=0.84m cells=8 rms=4.7cm[193] DRIVE goal=(0.75,3.04) dist=1.24m front=0.85m cells=8 rms=4.7cm[194] DRIVE goal=(0.75,3.04) dist=1.22m front=0.89m cells=8 rms=4.7cm[195] DRIVE goal=(0.75,3.04) dist=1.19m front=0.82m cells=8 rms=4.7cm[196] DRIVE goal=(0.75,3.04) dist=1.18m front=0.82m cells=8 rms=4.7cm[197] DRIVE goal=(0.75,3.04) dist=1.15m front=0.81m cells=8 rms=4.7cm[198] DRIVE goal=(0.75,3.04) dist=1.14m front=0.77m cells=8 rms=4.7cm[199] DRIVE goal=(0.75,3.04) dist=1.12m front=0.75m cells=8 rms=4.7cm[200] DRIVE goal=(0.75,3.04) dist=1.09m front=0.74m cells=8 rms=4.6cm[201] DRIVE goal=(0.75,3.04) dist=1.07m front=0.72m cells=8 rms=4.6cm[202] DRIVE goal=(0.75,3.04) dist=1.05m front=0.75m cells=8 rms=4.6cm[203] DRIVE goal=(0.75,3.04) dist=1.04m front=0.73m cells=8 rms=4.6cm[204] DRIVE goal=(0.75,3.04) dist=1.02m front=0.72m cells=8 rms=4.6cm[205] DRIVE goal=(0.75,3.04) dist=1.01m front=0.73m cells=8 rms=4.6cm[206] DRIVE goal=(0.75,3.04) dist=0.99m front=0.75m cells=8 rms=4.6cm[207] DRIVE goal=(0.75,3.04) dist=0.97m front=0.73m cells=8 rms=4.6cm[208] DRIVE goal=(0.75,3.04) dist=0.95m front=0.70m cells=9 rms=4.6cm[209] DRIVE goal=(0.75,3.04) dist=0.93m front=0.71m cells=9 rms=4.6cm[210] DRIVE goal=(0.75,3.04) dist=0.90m front=0.70m cells=9 rms=4.6cm[211] DRIVE goal=(0.75,3.04) dist=0.89m front=0.70m cells=9 rms=4.6cm[212] DRIVE goal=(0.75,3.04) dist=0.87m front=0.70m cells=9 rms=4.6cm[213] DRIVE goal=(0.75,3.04) dist=0.84m front=0.69m cells=9 rms=4.6cm[214] DRIVE goal=(0.75,3.04) dist=0.82m front=0.67m cells=9 rms=4.6cm[215] DRIVE goal=(0.75,3.04) dist=0.80m front=0.67m cells=10 rms=4.6cm[216] DRIVE goal=(0.75,3.04) dist=0.79m front=0.66m cells=10 rms=4.6cm[217] DRIVE goal=(0.75,3.04) dist=0.77m front=1.33m cells=10 rms=4.6cm[218] DRIVE goal=(0.75,3.04) dist=0.75m front=1.31m cells=10 rms=4.6cm[219] DRIVE goal=(0.75,3.04) dist=0.73m front=1.29m cells=10 rms=4.6cm[220] DRIVE goal=(0.75,3.04) dist=0.71m front=1.27m cells=10 rms=4.6cm[221] DRIVE goal=(0.75,3.04) dist=0.70m front=1.25m cells=10 rms=4.6cm[222] DRIVE goal=(0.75,3.04) dist=0.67m front=1.23m cells=10 rms=4.6cm[223] DRIVE goal=(0.75,3.04) dist=0.65m front=1.21m cells=10 rms=4.6cm[224] DRIVE goal=(0.75,3.04) dist=0.64m front=1.19m cells=11 rms=4.6cm[225] DRIVE goal=(0.75,3.04) dist=0.61m front=1.17m cells=11 rms=4.6cm[226] DRIVE goal=(0.75,3.04) dist=0.60m front=1.15m cells=11 rms=4.6cm[227] DRIVE goal=(0.75,3.04) dist=0.58m front=1.13m cells=11 rms=4.6cm[228] DRIVE goal=(0.75,3.04) dist=0.56m front=1.11m cells=11 rms=4.6cm[229] DRIVE goal=(0.75,3.04) dist=0.54m front=1.09m cells=11 rms=4.6cm[230] DRIVE goal=(0.75,3.04) dist=0.52m front=1.07m cells=11 rms=4.5cm[231] DRIVE goal=(0.75,3.04) dist=0.50m front=1.05m cells=11 rms=4.5cm[232] DRIVE goal=(0.75,3.04) dist=0.48m front=1.03m cells=11 rms=4.5cm[233] DRIVE goal=(0.75,3.04) dist=0.47m front=1.02m cells=11 rms=4.5cm[234] DRIVE goal=(0.75,3.04) dist=0.45m front=1.01m cells=11 rms=4.5cm[235] DRIVE goal=(0.75,3.04) dist=0.43m front=0.99m cells=11 rms=4.5cm[236] DRIVE goal=(0.75,3.04) dist=0.41m front=0.97m cells=11 rms=4.5cm
[ 50.4s] [GOAL SELECT] robot@(0.69,2.65) | 29 candidates (scanned=166 walls=86 visited=11):
  #1 ang= +27° d=2.00m pos=(0.11,4.57) score=+51.5 [O=+1.7 U=+36.4 V=-0.0 W=-0.0 R=-0.0 F=+12.9] <-- BEST
  #2 ang= -15° d=0.50m pos=(0.91,3.10) score=+45.5 [O=+1.6 U=+38.0 V=-0.0 W=-1.0 R=-8.0 F=+14.7]
  #3 ang= -64° d=2.00m pos=(2.62,3.16) score=+43.4 [O=+1.5 U=+34.0 V=-0.0 W=-0.0 R=-0.0 F=+7.3]
  #4 ang= +58° d=0.50m pos=(0.32,2.99) score=+42.1 [O=+1.8 U=+38.0 V=-0.0 W=-1.0 R=-4.0 F=+7.1]
  #5 ang= -21° d=0.50m pos=(0.95,3.07) score=+41.2 [O=+1.7 U=+34.0 V=-0.0 W=-1.0 R=-8.0 F=+14.3]
  #6 ang=  -9° d=0.50m pos=(0.86,3.12) score=+39.7 [O=+1.6 U=+36.0 V=-0.0 W=-1.0 R=-12.0 F=+14.9]
  #7 ang= -58° d=1.50m pos=(2.09,3.19) score=+38.7 [O=+2.5 U=+28.1 V=-0.0 W=-1.0 R=-0.0 F=+8.7]
  #8 ang=  -3° d=0.50m pos=(0.81,3.14) score=+37.7 [O=+1.5 U=+34.0 V=-0.0 W=-1.0 R=-12.0 F=+15.0]
[ 50.4s] [GOAL] Selected: (0.11, 4.57) dist=2.00m timeout=50s angle=27° reason=reached
[237] DRIVE goal=(0.11,4.57) dist=2.00m front=0.94m cells=11 rms=4.5cm[238] DRIVE goal=(0.11,4.57) dist=1.98m front=0.92m cells=11 rms=4.5cm[239] DRIVE goal=(0.11,4.57) dist=1.95m front=0.90m cells=12 rms=4.5cm[240] DRIVE goal=(0.11,4.57) dist=1.94m front=0.88m cells=12 rms=4.5cm[241] DRIVE goal=(0.11,4.57) dist=1.94m front=0.88m cells=12 rms=4.5cm[242] DRIVE goal=(0.11,4.57) dist=1.94m front=0.88m cells=12 rms=4.5cm[243] DRIVE goal=(0.11,4.57) dist=1.94m front=0.87m cells=12 rms=4.5cm[244] DRIVE goal=(0.11,4.57) dist=1.94m front=0.87m cells=12 rms=4.5cm[245] DRIVE goal=(0.11,4.57) dist=1.94m front=0.87m cells=12 rms=4.5cm[246] DRIVE goal=(0.11,4.57) dist=1.94m front=0.87m cells=12 rms=4.5cm[247] DRIVE goal=(0.11,4.57) dist=1.93m front=0.87m cells=12 rms=4.5cm[248] DRIVE goal=(0.11,4.57) dist=1.93m front=0.86m cells=12 rms=4.5cm[249] DRIVE goal=(0.11,4.57) dist=1.92m front=0.85m cells=12 rms=4.5cm[250] DRIVE goal=(0.11,4.57) dist=1.89m front=0.84m cells=12 rms=4.5cm[251] DRIVE goal=(0.11,4.57) dist=1.88m front=0.82m cells=12 rms=4.5cm[252] DRIVE goal=(0.11,4.57) dist=1.87m front=0.81m cells=12 rms=4.5cm[253] DRIVE goal=(0.11,4.57) dist=1.84m front=0.79m cells=12 rms=4.5cm[254] DRIVE goal=(0.11,4.57) dist=1.83m front=0.78m cells=12 rms=4.5cm[255] DRIVE goal=(0.11,4.57) dist=1.82m front=0.77m cells=12 rms=4.5cm[256] DRIVE goal=(0.11,4.57) dist=1.81m front=0.77m cells=12 rms=4.5cm[257] DRIVE goal=(0.11,4.57) dist=1.80m front=0.76m cells=12 rms=4.5cm[258] DRIVE goal=(0.11,4.57) dist=1.78m front=0.74m cells=12 rms=4.5cm[259] DRIVE goal=(0.11,4.57) dist=1.77m front=0.72m cells=12 rms=4.5cm[260] DRIVE goal=(0.11,4.57) dist=1.75m front=0.71m cells=12 rms=4.4cm[261] DRIVE goal=(0.11,4.57) dist=1.74m front=0.69m cells=12 rms=4.4cm[262] DRIVE goal=(0.11,4.57) dist=1.72m front=0.68m cells=12 rms=4.4cm[263] DRIVE goal=(0.11,4.57) dist=1.71m front=0.67m cells=12 rms=4.4cm[264] DRIVE goal=(0.11,4.57) dist=1.69m front=0.64m cells=12 rms=4.4cm[265] DRIVE goal=(0.11,4.57) dist=1.67m front=0.63m cells=12 rms=4.4cm[266] DRIVE goal=(0.11,4.57) dist=1.64m front=0.60m cells=13 rms=4.4cm[267] DRIVE goal=(0.11,4.57) dist=1.62m front=0.60m cells=13 rms=4.4cm[268] DRIVE goal=(0.11,4.57) dist=1.60m front=0.76m cells=13 rms=4.4cm[269] DRIVE goal=(0.11,4.57) dist=1.58m front=0.74m cells=13 rms=4.4cm[270] DRIVE goal=(0.11,4.57) dist=1.57m front=0.74m cells=13 rms=4.4cm[271] DRIVE goal=(0.11,4.57) dist=1.56m front=0.73m cells=13 rms=4.4cm[272] DRIVE goal=(0.11,4.57) dist=1.55m front=0.68m cells=14 rms=4.4cm[273] DRIVE goal=(0.11,4.57) dist=1.54m front=0.68m cells=14 rms=4.4cm[274] DRIVE goal=(0.11,4.57) dist=1.54m front=0.68m cells=14 rms=4.4cm[275] DRIVE goal=(0.11,4.57) dist=1.53m front=0.68m cells=14 rms=4.4cm[276] DRIVE goal=(0.11,4.57) dist=1.53m front=0.68m cells=14 rms=4.4cm[277] DRIVE goal=(0.11,4.57) dist=1.52m front=0.71m cells=14 rms=4.4cm[278] DRIVE goal=(0.11,4.57) dist=1.51m front=0.81m cells=14 rms=4.4cm[279] DRIVE goal=(0.11,4.57) dist=1.50m front=0.80m cells=14 rms=4.4cm[280] DRIVE goal=(0.11,4.57) dist=1.49m front=0.79m cells=14 rms=4.4cm[281] DRIVE goal=(0.11,4.57) dist=1.49m front=0.74m cells=14 rms=4.4cm[282] DRIVE goal=(0.11,4.57) dist=1.48m front=0.72m cells=14 rms=4.4cm[283] DRIVE goal=(0.11,4.57) dist=1.46m front=0.71m cells=14 rms=4.4cm[284] DRIVE goal=(0.11,4.57) dist=1.45m front=0.69m cells=14 rms=4.4cm[285] DRIVE goal=(0.11,4.57) dist=1.43m front=0.69m cells=14 rms=4.4cm[286] DRIVE goal=(0.11,4.57) dist=1.41m front=0.71m cells=14 rms=4.4cm[287] DRIVE goal=(0.11,4.57) dist=1.39m front=0.71m cells=14 rms=4.4cm[288] DRIVE goal=(0.11,4.57) dist=1.37m front=0.73m cells=14 rms=4.3cm[289] DRIVE goal=(0.11,4.57) dist=1.35m front=0.75m cells=14 rms=4.3cm[290] DRIVE goal=(0.11,4.57) dist=1.33m front=0.74m cells=14 rms=4.3cm[291] DRIVE goal=(0.11,4.57) dist=1.31m front=0.77m cells=15 rms=4.3cm[292] DRIVE goal=(0.11,4.57) dist=1.29m front=0.77m cells=15 rms=4.3cm[293] DRIVE goal=(0.11,4.57) dist=1.27m front=0.78m cells=15 rms=4.3cm[294] DRIVE goal=(0.11,4.57) dist=1.25m front=0.80m cells=15 rms=4.3cm[295] DRIVE goal=(0.11,4.57) dist=1.23m front=0.75m cells=15 rms=4.3cm[296] DRIVE goal=(0.11,4.57) dist=1.22m front=0.62m cells=15 rms=4.3cm[297] DRIVE goal=(0.11,4.57) dist=1.20m front=0.64m cells=15 rms=4.3cm[298] DRIVE goal=(0.11,4.57) dist=1.18m front=0.54m cells=15 rms=4.3cm[299] DRIVE goal=(0.11,4.57) dist=1.15m front=0.52m cells=15 rms=4.3cm[300] DRIVE goal=(0.11,4.57) dist=1.14m front=0.56m cells=15 rms=4.3cm[301] DRIVE goal=(0.11,4.57) dist=1.13m front=0.52m cells=15 rms=4.3cm[302] DRIVE goal=(0.11,4.57) dist=1.11m front=0.48m cells=15 rms=4.2cm[303] DRIVE goal=(0.11,4.57) dist=1.10m front=0.48m cells=15 rms=4.2cm[304] DRIVE goal=(0.11,4.57) dist=1.09m front=0.52m cells=15 rms=4.2cm[305] DRIVE goal=(0.11,4.57) dist=1.09m front=0.52m cells=15 rms=4.2cm[306] DRIVE goal=(0.11,4.57) dist=1.08m front=0.53m cells=15 rms=4.2cm[307] DRIVE goal=(0.11,4.57) dist=1.06m front=0.57m cells=15 rms=4.2cm[308] DRIVE goal=(0.11,4.57) dist=1.05m front=0.55m cells=15 rms=4.2cm[309] DRIVE goal=(0.11,4.57) dist=1.05m front=0.54m cells=15 rms=4.2cm[310] DRIVE goal=(0.11,4.57) dist=1.05m front=0.52m cells=15 rms=4.2cm[311] DRIVE goal=(0.11,4.57) dist=1.04m front=0.51m cells=15 rms=4.2cm[312] DRIVE goal=(0.11,4.57) dist=1.02m front=0.50m cells=15 rms=4.2cm[313] DRIVE goal=(0.11,4.57) dist=1.02m front=0.54m cells=16 rms=4.2cm[314] DRIVE goal=(0.11,4.57) dist=1.01m front=0.56m cells=16 rms=4.2cm[315] DRIVE goal=(0.11,4.57) dist=1.00m front=0.61m cells=16 rms=4.2cm[316] DRIVE goal=(0.11,4.57) dist=1.00m front=0.60m cells=16 rms=4.2cm[317] DRIVE goal=(0.11,4.57) dist=1.00m front=0.60m cells=16 rms=4.2cm[318] DRIVE goal=(0.11,4.57) dist=1.00m front=0.53m cells=16 rms=4.2cm[319] DRIVE goal=(0.11,4.57) dist=0.99m front=0.49m cells=16 rms=4.2cm[320] DRIVE goal=(0.11,4.57) dist=0.99m front=0.51m cells=16 rms=4.2cm[321] DRIVE goal=(0.11,4.57) dist=0.99m front=0.49m cells=16 rms=4.2cm[322] DRIVE goal=(0.11,4.57) dist=0.99m front=0.49m cells=16 rms=4.2cm[323] DRIVE goal=(0.11,4.57) dist=0.99m front=0.50m cells=16 rms=4.2cm[324] DRIVE goal=(0.11,4.57) dist=0.99m front=0.50m cells=16 rms=4.2cm[325] DRIVE goal=(0.11,4.57) dist=1.00m front=0.50m cells=16 rms=4.2cm[326] DRIVE goal=(0.11,4.57) dist=1.00m front=0.51m cells=16 rms=4.2cm[327] DRIVE goal=(0.11,4.57) dist=0.99m front=0.49m cells=16 rms=4.1cm[328] DRIVE goal=(0.11,4.57) dist=1.00m front=0.50m cells=16 rms=4.1cm[329] DRIVE goal=(0.11,4.57) dist=1.00m front=0.50m cells=16 rms=4.1cm[330] DRIVE goal=(0.11,4.57) dist=1.00m front=0.51m cells=16 rms=4.1cm[331] DRIVE goal=(0.11,4.57) dist=1.00m front=0.49m cells=16 rms=4.1cm[332] DRIVE goal=(0.11,4.57) dist=1.00m front=0.51m cells=16 rms=4.1cm[333] DRIVE goal=(0.11,4.57) dist=0.99m front=0.49m cells=16 rms=4.1cm[334] DRIVE goal=(0.11,4.57) dist=1.00m front=0.50m cells=16 rms=4.1cm[335] DRIVE goal=(0.11,4.57) dist=0.99m front=0.49m cells=16 rms=4.1cm[336] DRIVE goal=(0.11,4.57) dist=1.00m front=0.49m cells=16 rms=4.1cm[337] DRIVE goal=(0.11,4.57) dist=1.00m front=0.50m cells=16 rms=4.1cm[338] DRIVE goal=(0.11,4.57) dist=1.00m front=0.50m cells=16 rms=4.1cm[339] DRIVE goal=(0.11,4.57) dist=1.00m front=0.51m cells=16 rms=4.1cm[340] DRIVE goal=(0.11,4.57) dist=1.00m front=0.50m cells=16 rms=4.1cm
[ 71.7s] [DRIVE STUCK] Goal distance unchanged for 6.8s
[DRIVE STUCK] dist_oldest=1.06m, dist_now=1.00m, change=0.06m < margin=0.08m
[DRIVE STUCK] Front sectors: s55=0.50 s56=0.57 s57=0.68 s58=0.83 s59=1.42 s0=1.86 s1=1.92 s2=2.69 s3=2.73 s4=2.79 s5=2.87 
[DRIVE STUCK] Marked front sectors [55, 56, 57, 58, 59, 0, 1, 2, 3, 4, 5] as blocked for 30s

[BACKUP CLEAR] Reversing and turning toward clearer side...
[BACKUP CLEAR] Turning left (L_avg=2.60m R_avg=0.80m)

[ 76.6s] [GOAL SELECT] robot@(0.44,3.53) | 16 candidates (scanned=200 walls=115 visited=16):
  #1 ang=-113° d=2.00m pos=(2.42,3.25) score=+32.2 [O=+1.8 U=+31.0 V=-0.0 W=-1.0 R=-0.0 F=-0.2] <-- BEST
  #2 ang=-125° d=1.50m pos=(1.85,3.01) score=+20.5 [O=+1.7 U=+24.7 V=-0.0 W=-3.0 R=-0.0 F=-3.4]
  #3 ang=-119° d=1.50m pos=(1.90,3.17) score=+20.2 [O=+1.8 U=+22.8 V=-0.0 W=-3.0 R=-0.0 F=-1.8]
  #4 ang=-125° d=1.00m pos=(1.38,3.18) score=+11.2 [O=+2.2 U=+16.9 V=-0.0 W=-3.0 R=-1.8 F=-3.4]
  #5 ang=-119° d=1.00m pos=(1.41,3.29) score=+10.8 [O=+2.3 U=+14.9 V=-0.0 W=-3.0 R=-1.8 F=-1.8]
  #6 ang= +15° d=2.00m pos=(-0.58,5.24) score=-101.6 [O=+1.9 U=+34.0 V=-0.0 W=-0.0 R=-0.0 F=+11.9 B=-150.0]
  #7 ang=  +9° d=2.00m pos=(-0.40,5.34) score=-102.8 [O=+1.9 U=+32.0 V=-0.0 W=-0.0 R=-0.0 F=+12.8 B=-150.0]
  #8 ang=  +3° d=2.00m pos=(-0.20,5.42) score=-103.1 [O=+1.8 U=+32.0 V=-0.0 W=-1.0 R=-0.0 F=+13.5 B=-150.0]
[ 76.6s] [GOAL] Selected: (2.42, 3.25) dist=2.00m timeout=50s angle=-113° reason=no goal
[342] DRIVE goal=(2.42,3.25) dist=2.00m front=0.70m cells=16 rms=4.1cm[343] DRIVE goal=(2.42,3.25) dist=2.00m front=0.70m cells=16 rms=4.1cm[344] DRIVE goal=(2.42,3.25) dist=2.00m front=0.70m cells=16 rms=4.1cm[345] DRIVE goal=(2.42,3.25) dist=2.00m front=0.68m cells=16 rms=4.1cm[346] DRIVE goal=(2.42,3.25) dist=2.00m front=0.70m cells=16 rms=4.1cm[347] DRIVE goal=(2.42,3.25) dist=2.00m front=0.70m cells=16 rms=4.1cm[348] DRIVE goal=(2.42,3.25) dist=2.00m front=0.63m cells=16 rms=4.1cm[349] DRIVE goal=(2.42,3.25) dist=2.01m front=0.55m cells=16 rms=4.1cm[350] DRIVE goal=(2.42,3.25) dist=2.01m front=0.53m cells=16 rms=4.1cm[351] DRIVE goal=(2.42,3.25) dist=2.01m front=0.50m cells=16 rms=4.0cm[352] DRIVE goal=(2.42,3.25) dist=2.01m front=0.43m cells=16 rms=4.0cm[353] DRIVE goal=(2.42,3.25) dist=2.01m front=0.42m cells=16 rms=4.0cm[354] DRIVE goal=(2.42,3.25) dist=2.01m front=0.42m cells=16 rms=4.0cm[355] DRIVE goal=(2.42,3.25) dist=2.01m front=0.41m cells=16 rms=4.0cm[356] DRIVE goal=(2.42,3.25) dist=2.02m front=0.35m cells=16 rms=4.0cm[357] DRIVE goal=(2.42,3.25) dist=2.01m front=0.34m cells=16 rms=4.0cm[358] DRIVE goal=(2.42,3.25) dist=2.01m front=0.34m cells=16 rms=4.0cm[359] DRIVE goal=(2.42,3.25) dist=2.01m front=0.34m cells=16 rms=4.0cm[360] DRIVE goal=(2.42,3.25) dist=2.02m front=0.34m cells=16 rms=4.0cm[361] DRIVE goal=(2.42,3.25) dist=2.02m front=0.35m cells=16 rms=4.0cm[362] DRIVE goal=(2.42,3.25) dist=2.02m front=0.35m cells=16 rms=4.0cm[363] DRIVE goal=(2.42,3.25) dist=2.02m front=0.35m cells=16 rms=4.0cm[364] DRIVE goal=(2.42,3.25) dist=2.03m front=0.36m cells=16 rms=4.0cm[365] DRIVE goal=(2.42,3.25) dist=2.03m front=0.36m cells=16 rms=4.0cm[366] DRIVE goal=(2.42,3.25) dist=2.04m front=0.37m cells=16 rms=4.0cm[367] DRIVE goal=(2.42,3.25) dist=2.04m front=0.38m cells=16 rms=4.0cm[368] DRIVE goal=(2.42,3.25) dist=2.04m front=0.38m cells=16 rms=4.0cm[369] DRIVE goal=(2.42,3.25) dist=2.04m front=0.38m cells=16 rms=4.0cm[370] DRIVE goal=(2.42,3.25) dist=2.05m front=0.39m cells=16 rms=4.0cm[371] DRIVE goal=(2.42,3.25) dist=2.05m front=0.40m cells=16 rms=4.0cm[372] DRIVE goal=(2.42,3.25) dist=2.05m front=0.40m cells=16 rms=4.0cm[373] DRIVE goal=(2.42,3.25) dist=2.06m front=0.40m cells=16 rms=4.0cm[374] DRIVE goal=(2.42,3.25) dist=2.06m front=0.41m cells=16 rms=4.0cm[375] DRIVE goal=(2.42,3.25) dist=2.07m front=0.41m cells=16 rms=4.0cm[376] DRIVE goal=(2.42,3.25) dist=2.07m front=0.41m cells=16 rms=4.0cm[377] DRIVE goal=(2.42,3.25) dist=2.07m front=0.41m cells=16 rms=4.0cm[378] DRIVE goal=(2.42,3.25) dist=2.07m front=0.42m cells=16 rms=4.0cm[379] DRIVE goal=(2.42,3.25) dist=2.07m front=0.42m cells=16 rms=4.0cm[380] DRIVE goal=(2.42,3.25) dist=2.07m front=0.42m cells=16 rms=4.0cm[381] DRIVE goal=(2.42,3.25) dist=2.07m front=0.42m cells=16 rms=4.0cm[382] DRIVE goal=(2.42,3.25) dist=2.07m front=0.42m cells=16 rms=4.0cm[383] DRIVE goal=(2.42,3.25) dist=2.07m front=0.42m cells=16 rms=4.0cm[384] DRIVE goal=(2.42,3.25) dist=2.07m front=0.42m cells=16 rms=4.0cm[385] DRIVE goal=(2.42,3.25) dist=2.07m front=0.42m cells=16 rms=4.0cm[386] DRIVE goal=(2.42,3.25) dist=2.07m front=0.42m cells=16 rms=4.0cm[387] DRIVE goal=(2.42,3.25) dist=2.08m front=0.42m cells=16 rms=4.0cm[388] DRIVE goal=(2.42,3.25) dist=2.08m front=0.43m cells=16 rms=4.0cm[389] DRIVE goal=(2.42,3.25) dist=2.08m front=0.43m cells=16 rms=4.0cm[390] DRIVE goal=(2.42,3.25) dist=2.08m front=0.43m cells=16 rms=4.0cm[391] DRIVE goal=(2.42,3.25) dist=2.08m front=0.43m cells=16 rms=4.0cm[392] DRIVE goal=(2.42,3.25) dist=2.09m front=0.45m cells=16 rms=4.0cm[393] DRIVE goal=(2.42,3.25) dist=2.08m front=0.46m cells=16 rms=4.0cm[394] DRIVE goal=(2.42,3.25) dist=2.08m front=0.50m cells=16 rms=4.0cm[395] DRIVE goal=(2.42,3.25) dist=2.07m front=0.61m cells=16 rms=4.0cm[396] DRIVE goal=(2.42,3.25) dist=2.04m front=0.72m cells=16 rms=4.1cm[397] DRIVE goal=(2.42,3.25) dist=2.01m front=0.77m cells=16 rms=4.1cm[398] DRIVE goal=(2.42,3.25) dist=1.99m front=0.80m cells=16 rms=4.1cm[399] DRIVE goal=(2.42,3.25) dist=1.96m front=1.01m cells=16 rms=4.1cm[400] DRIVE goal=(2.42,3.25) dist=1.94m front=1.00m cells=16 rms=4.1cm[401] DRIVE goal=(2.42,3.25) dist=1.93m front=0.99m cells=16 rms=4.1cm[402] DRIVE goal=(2.42,3.25) dist=1.92m front=0.59m cells=16 rms=4.1cm[403] DRIVE goal=(2.42,3.25) dist=1.90m front=0.61m cells=16 rms=4.1cm[404] DRIVE goal=(2.42,3.25) dist=1.87m front=0.46m cells=16 rms=4.1cm[405] DRIVE goal=(2.42,3.25) dist=1.84m front=0.38m cells=16 rms=4.1cm[406] DRIVE goal=(2.42,3.25) dist=1.83m front=0.31m cells=16 rms=4.1cm[407] DRIVE goal=(2.42,3.25) dist=1.81m front=0.33m cells=17 rms=4.1cm[408] DRIVE goal=(2.42,3.25) dist=1.79m front=0.34m cells=17 rms=4.1cm[409] DRIVE goal=(2.42,3.25) dist=1.78m front=0.36m cells=17 rms=4.1cm[410] DRIVE goal=(2.42,3.25) dist=1.77m front=0.31m cells=17 rms=4.1cm[411] DRIVE goal=(2.42,3.25) dist=1.76m front=0.29m cells=17 rms=4.1cm[412] DRIVE goal=(2.42,3.25) dist=1.76m front=0.31m cells=17 rms=4.1cm[413] DRIVE goal=(2.42,3.25) dist=1.74m front=0.33m cells=17 rms=4.1cm[414] DRIVE goal=(2.42,3.25) dist=1.73m front=0.45m cells=17 rms=4.1cm[415] DRIVE goal=(2.42,3.25) dist=1.71m front=0.64m cells=17 rms=4.1cm[416] DRIVE goal=(2.42,3.25) dist=1.70m front=0.83m cells=17 rms=4.1cm[417] DRIVE goal=(2.42,3.25) dist=1.67m front=0.80m cells=17 rms=4.1cm[418] DRIVE goal=(2.42,3.25) dist=1.65m front=0.94m cells=17 rms=4.1cm[419] DRIVE goal=(2.42,3.25) dist=1.63m front=0.97m cells=17 rms=4.1cm[420] DRIVE goal=(2.42,3.25) dist=1.61m front=0.92m cells=17 rms=4.1cm[421] DRIVE goal=(2.42,3.25) dist=1.59m front=0.91m cells=17 rms=4.1cm[422] DRIVE goal=(2.42,3.25) dist=1.56m front=0.88m cells=17 rms=4.1cm[423] DRIVE goal=(2.42,3.25) dist=1.54m front=0.88m cells=17 rms=4.1cm[424] DRIVE goal=(2.42,3.25) dist=1.53m front=0.97m cells=18 rms=4.1cm[425] DRIVE goal=(2.42,3.25) dist=1.51m front=0.97m cells=18 rms=4.1cm[426] DRIVE goal=(2.42,3.25) dist=1.49m front=0.97m cells=18 rms=4.1cm[427] DRIVE goal=(2.42,3.25) dist=1.47m front=0.67m cells=18 rms=4.1cm[428] DRIVE goal=(2.42,3.25) dist=1.46m front=0.61m cells=18 rms=4.1cm[429] DRIVE goal=(2.42,3.25) dist=1.43m front=0.68m cells=18 rms=4.1cm[430] DRIVE goal=(2.42,3.25) dist=1.41m front=0.69m cells=18 rms=4.1cm[431] DRIVE goal=(2.42,3.25) dist=1.40m front=0.65m cells=18 rms=4.1cm[432] DRIVE goal=(2.42,3.25) dist=1.38m front=0.64m cells=18 rms=4.1cm[433] DRIVE goal=(2.42,3.25) dist=1.37m front=0.66m cells=18 rms=4.1cm[434] DRIVE goal=(2.42,3.25) dist=1.36m front=0.61m cells=18 rms=4.1cm[435] DRIVE goal=(2.42,3.25) dist=1.33m front=1.22m cells=18 rms=4.1cm[436] DRIVE goal=(2.42,3.25) dist=1.32m front=1.21m cells=18 rms=4.1cm[437] DRIVE goal=(2.42,3.25) dist=1.32m front=1.21m cells=18 rms=4.0cm[438] DRIVE goal=(2.42,3.25) dist=1.31m front=1.19m cells=18 rms=4.0cm[439] DRIVE goal=(2.42,3.25) dist=1.30m front=1.17m cells=18 rms=4.0cm[440] DRIVE goal=(2.42,3.25) dist=1.28m front=1.16m cells=18 rms=4.0cm[441] DRIVE goal=(2.42,3.25) dist=1.25m front=1.14m cells=18 rms=4.0cm[442] DRIVE goal=(2.42,3.25) dist=1.23m front=1.12m cells=18 rms=4.0cm[443] DRIVE goal=(2.42,3.25) dist=1.21m front=1.11m cells=19 rms=4.0cm[444] DRIVE goal=(2.42,3.25) dist=1.19m front=1.09m cells=19 rms=4.0cm[445] DRIVE goal=(2.42,3.25) dist=1.18m front=1.08m cells=19 rms=4.0cm[446] DRIVE goal=(2.42,3.25) dist=1.16m front=1.06m cells=19 rms=4.0cm[447] DRIVE goal=(2.42,3.25) dist=1.13m front=1.05m cells=19 rms=4.0cm[448] DRIVE goal=(2.42,3.25) dist=1.12m front=1.03m cells=19 rms=4.0cm[449] DRIVE goal=(2.42,3.25) dist=1.10m front=1.02m cells=19 rms=4.0cm[450] DRIVE goal=(2.42,3.25) dist=1.08m front=1.01m cells=19 rms=4.0cm[451] DRIVE goal=(2.42,3.25) dist=1.06m front=1.15m cells=19 rms=4.0cm[452] DRIVE goal=(2.42,3.25) dist=1.04m front=1.13m cells=19 rms=4.0cm[453] DRIVE goal=(2.42,3.25) dist=1.02m front=1.11m cells=19 rms=4.0cm[454] DRIVE goal=(2.42,3.25) dist=1.01m front=1.10m cells=19 rms=4.0cm[455] DRIVE goal=(2.42,3.25) dist=0.98m front=1.07m cells=19 rms=4.0cm[456] DRIVE goal=(2.42,3.25) dist=0.97m front=1.06m cells=19 rms=4.0cm[457] DRIVE goal=(2.42,3.25) dist=0.94m front=1.03m cells=19 rms=4.0cm[458] DRIVE goal=(2.42,3.25) dist=0.92m front=1.09m cells=20 rms=4.0cm[459] DRIVE goal=(2.42,3.25) dist=0.91m front=1.07m cells=20 rms=4.0cm[460] DRIVE goal=(2.42,3.25) dist=0.88m front=0.86m cells=20 rms=3.9cm[461] DRIVE goal=(2.42,3.25) dist=0.86m front=0.84m cells=20 rms=3.9cm[462] DRIVE goal=(2.42,3.25) dist=0.83m front=0.85m cells=20 rms=3.9cm[463] DRIVE goal=(2.42,3.25) dist=0.82m front=0.81m cells=20 rms=3.9cm[464] DRIVE goal=(2.42,3.25) dist=0.79m front=0.80m cells=20 rms=3.9cm[465] DRIVE goal=(2.42,3.25) dist=0.78m front=0.97m cells=20 rms=3.9cm[466] DRIVE goal=(2.42,3.25) dist=0.78m front=0.96m cells=20 rms=3.9cm[467] DRIVE goal=(2.42,3.25) dist=0.77m front=0.95m cells=20 rms=3.9cm[468] DRIVE goal=(2.42,3.25) dist=0.76m front=0.94m cells=20 rms=3.9cm[469] DRIVE goal=(2.42,3.25) dist=0.75m front=0.93m cells=20 rms=3.9cm[470] DRIVE goal=(2.42,3.25) dist=0.74m front=0.92m cells=20 rms=3.9cm[471] DRIVE goal=(2.42,3.25) dist=0.73m front=0.75m cells=20 rms=3.9cm[472] DRIVE goal=(2.42,3.25) dist=0.71m front=0.73m cells=20 rms=3.9cm[473] DRIVE goal=(2.42,3.25) dist=0.71m front=0.73m cells=20 rms=3.9cm[474] DRIVE goal=(2.42,3.25) dist=0.71m front=0.73m cells=20 rms=3.9cm[475] DRIVE goal=(2.42,3.25) dist=0.70m front=0.89m cells=20 rms=3.9cm[476] DRIVE goal=(2.42,3.25) dist=0.68m front=0.88m cells=20 rms=3.9cm[477] DRIVE goal=(2.42,3.25) dist=0.68m front=0.87m cells=20 rms=3.9cm[478] DRIVE goal=(2.42,3.25) dist=0.67m front=0.87m cells=20 rms=3.9cm[479] DRIVE goal=(2.42,3.25) dist=0.66m front=0.86m cells=20 rms=3.9cm[480] DRIVE goal=(2.42,3.25) dist=0.64m front=0.84m cells=20 rms=3.9cm[481] DRIVE goal=(2.42,3.25) dist=0.62m front=0.80m cells=21 rms=3.9cm[482] DRIVE goal=(2.42,3.25) dist=0.60m front=0.81m cells=21 rms=3.9cm[483] DRIVE goal=(2.42,3.25) dist=0.59m front=0.81m cells=21 rms=3.9cm[484] DRIVE goal=(2.42,3.25) dist=0.58m front=0.80m cells=21 rms=3.9cm[485] DRIVE goal=(2.42,3.25) dist=0.57m front=0.79m cells=21 rms=3.9cm[486] DRIVE goal=(2.42,3.25) dist=0.55m front=0.77m cells=21 rms=3.8cm[487] DRIVE goal=(2.42,3.25) dist=0.53m front=0.75m cells=21 rms=3.8cm[488] DRIVE goal=(2.42,3.25) dist=0.51m front=0.74m cells=21 rms=3.8cm[489] DRIVE goal=(2.42,3.25) dist=0.49m front=0.72m cells=21 rms=3.8cm[490] DRIVE goal=(2.42,3.25) dist=0.48m front=0.72m cells=21 rms=3.8cm[491] DRIVE goal=(2.42,3.25) dist=0.47m front=0.70m cells=21 rms=3.8cm[492] DRIVE goal=(2.42,3.25) dist=0.45m front=0.69m cells=21 rms=3.8cm[493] DRIVE goal=(2.42,3.25) dist=0.43m front=0.68m cells=21 rms=3.8cm
[107.7s] [GOAL SELECT] robot@(2.03,3.33) | 6 candidates (scanned=297 walls=171 visited=21):
  #1 ang= +94° d=1.00m pos=(2.01,4.33) score=+31.8 [O=+1.8 U=+20.0 V=-0.0 W=-3.0 R=-0.0 F=+12.7] <-- BEST
  #2 ang=+101° d=1.00m pos=(1.91,4.32) score=+30.9 [O=+1.8 U=+20.0 V=-0.0 W=-3.0 R=-0.0 F=+11.8]
  #3 ang=  -3° d=0.50m pos=(2.53,3.27) score=+28.6 [O=+1.6 U=+30.9 V=-0.0 W=-3.0 R=-7.2 F=+6.2]
  #4 ang=  -9° d=0.50m pos=(2.52,3.22) score=+27.1 [O=+1.5 U=+31.0 V=-0.0 W=-3.0 R=-7.2 F=+4.7]
  #5 ang= +94° d=0.50m pos=(2.02,3.83) score=+14.2 [O=+2.3 U=+12.0 V=-0.0 W=-3.0 R=-0.0 F=+12.7 T=-10.0]
  #6 ang=+101° d=0.50m pos=(1.97,3.83) score=+3.8 [O=+2.3 U=+12.0 V=-0.0 W=-3.0 R=-0.0 F=+11.8 T=-19.5]
[107.7s] [GOAL] Selected: (2.01, 4.33) dist=1.00m timeout=35s angle=94° reason=reached
[494] DRIVE goal=(2.01,4.33) dist=1.00m front=0.66m cells=21 rms=3.8cm[495] DRIVE goal=(2.01,4.33) dist=1.00m front=0.67m cells=21 rms=3.8cm[496] DRIVE goal=(2.01,4.33) dist=0.99m front=0.67m cells=21 rms=3.8cm[497] DRIVE goal=(2.01,4.33) dist=1.00m front=0.64m cells=22 rms=3.8cm[498] DRIVE goal=(2.01,4.33) dist=1.00m front=0.65m cells=22 rms=3.8cm[499] DRIVE goal=(2.01,4.33) dist=1.00m front=0.65m cells=22 rms=3.8cm[500] DRIVE goal=(2.01,4.33) dist=1.00m front=0.67m cells=22 rms=3.9cm[501] DRIVE goal=(2.01,4.33) dist=1.00m front=0.67m cells=22 rms=3.9cm[502] DRIVE goal=(2.01,4.33) dist=1.00m front=0.68m cells=22 rms=3.9cm[503] DRIVE goal=(2.01,4.33) dist=1.01m front=0.75m cells=22 rms=3.9cm[504] DRIVE goal=(2.01,4.33) dist=1.00m front=0.98m cells=22 rms=3.9cm[505] DRIVE goal=(2.01,4.33) dist=1.00m front=0.98m cells=22 rms=3.9cm[506] DRIVE goal=(2.01,4.33) dist=1.00m front=0.98m cells=22 rms=3.9cm[507] DRIVE goal=(2.01,4.33) dist=1.00m front=0.98m cells=22 rms=4.0cm[508] DRIVE goal=(2.01,4.33) dist=1.00m front=0.99m cells=22 rms=4.0cm[509] DRIVE goal=(2.01,4.33) dist=1.00m front=0.99m cells=22 rms=4.0cm[510] DRIVE goal=(2.01,4.33) dist=1.01m front=1.00m cells=22 rms=4.0cm[511] DRIVE goal=(2.01,4.33) dist=1.01m front=0.54m cells=22 rms=4.0cm[512] DRIVE goal=(2.01,4.33) dist=1.01m front=1.02m cells=22 rms=4.0cm[513] DRIVE goal=(2.01,4.33) dist=1.01m front=0.56m cells=22 rms=4.0cm[514] DRIVE goal=(2.01,4.33) dist=1.01m front=0.52m cells=22 rms=4.0cm[515] DRIVE goal=(2.01,4.33) dist=1.01m front=0.52m cells=22 rms=4.1cm[516] DRIVE goal=(2.01,4.33) dist=1.01m front=0.53m cells=22 rms=4.1cm[517] DRIVE goal=(2.01,4.33) dist=1.01m front=0.52m cells=22 rms=4.1cm[518] DRIVE goal=(2.01,4.33) dist=1.01m front=0.52m cells=22 rms=4.1cm[519] DRIVE goal=(2.01,4.33) dist=1.00m front=0.52m cells=22 rms=4.1cm[520] DRIVE goal=(2.01,4.33) dist=1.00m front=0.51m cells=22 rms=4.1cm[521] DRIVE goal=(2.01,4.33) dist=1.00m front=0.51m cells=22 rms=4.1cm[522] DRIVE goal=(2.01,4.33) dist=1.00m front=0.51m cells=22 rms=4.2cm[523] DRIVE goal=(2.01,4.33) dist=1.00m front=0.51m cells=22 rms=4.2cm[524] DRIVE goal=(2.01,4.33) dist=1.01m front=0.51m cells=22 rms=4.2cm[525] DRIVE goal=(2.01,4.33) dist=1.01m front=0.52m cells=22 rms=4.2cm[526] DRIVE goal=(2.01,4.33) dist=1.01m front=0.53m cells=22 rms=4.2cm[527] DRIVE goal=(2.01,4.33) dist=1.00m front=0.53m cells=22 rms=4.2cm[528] DRIVE goal=(2.01,4.33) dist=1.00m front=0.53m cells=22 rms=4.2cm[529] DRIVE goal=(2.01,4.33) dist=1.00m front=0.53m cells=22 rms=4.2cm[530] DRIVE goal=(2.01,4.33) dist=0.99m front=0.52m cells=22 rms=4.2cm[531] DRIVE goal=(2.01,4.33) dist=1.00m front=0.53m cells=22 rms=4.2cm[532] DRIVE goal=(2.01,4.33) dist=1.00m front=0.55m cells=22 rms=4.2cm[533] DRIVE goal=(2.01,4.33) dist=1.01m front=0.55m cells=22 rms=4.2cm[534] DRIVE goal=(2.01,4.33) dist=1.01m front=0.57m cells=22 rms=4.3cm[535] DRIVE goal=(2.01,4.33) dist=1.02m front=0.59m cells=22 rms=4.3cm[536] DRIVE goal=(2.01,4.33) dist=1.01m front=0.63m cells=22 rms=4.3cm[537] DRIVE goal=(2.01,4.33) dist=1.00m front=0.68m cells=22 rms=4.3cm[538] DRIVE goal=(2.01,4.33) dist=1.01m front=0.72m cells=22 rms=4.3cm[539] DRIVE goal=(2.01,4.33) dist=1.00m front=0.72m cells=22 rms=4.3cm[540] DRIVE goal=(2.01,4.33) dist=0.97m front=0.93m cells=22 rms=4.3cm[541] DRIVE goal=(2.01,4.33) dist=0.96m front=0.92m cells=22 rms=4.3cm[542] DRIVE goal=(2.01,4.33) dist=0.94m front=0.69m cells=22 rms=4.3cm[543] DRIVE goal=(2.01,4.33) dist=0.91m front=0.69m cells=22 rms=4.3cm[544] DRIVE goal=(2.01,4.33) dist=0.89m front=0.65m cells=22 rms=4.3cm[545] DRIVE goal=(2.01,4.33) dist=0.88m front=0.61m cells=22 rms=4.3cm[546] DRIVE goal=(2.01,4.33) dist=0.85m front=0.66m cells=22 rms=4.3cm[547] DRIVE goal=(2.01,4.33) dist=0.84m front=0.64m cells=22 rms=4.3cm[548] DRIVE goal=(2.01,4.33) dist=0.82m front=0.69m cells=22 rms=4.3cm[549] DRIVE goal=(2.01,4.33) dist=0.81m front=0.80m cells=22 rms=4.3cm[550] DRIVE goal=(2.01,4.33) dist=0.79m front=0.79m cells=22 rms=4.3cm[551] DRIVE goal=(2.01,4.33) dist=0.78m front=0.78m cells=22 rms=4.3cm[552] DRIVE goal=(2.01,4.33) dist=0.76m front=0.81m cells=22 rms=4.3cm[553] DRIVE goal=(2.01,4.33) dist=0.73m front=0.75m cells=22 rms=4.3cm[554] DRIVE goal=(2.01,4.33) dist=0.71m front=0.77m cells=23 rms=4.3cm[555] DRIVE goal=(2.01,4.33) dist=0.70m front=0.76m cells=23 rms=4.3cm[556] DRIVE goal=(2.01,4.33) dist=0.69m front=0.75m cells=23 rms=4.3cm[557] DRIVE goal=(2.01,4.33) dist=0.67m front=0.73m cells=23 rms=4.3cm[558] DRIVE goal=(2.01,4.33) dist=0.65m front=0.71m cells=23 rms=4.3cm[559] DRIVE goal=(2.01,4.33) dist=0.63m front=0.69m cells=23 rms=4.3cm[560] DRIVE goal=(2.01,4.33) dist=0.61m front=0.67m cells=23 rms=4.3cm[561] DRIVE goal=(2.01,4.33) dist=0.60m front=1.05m cells=23 rms=4.3cm[562] DRIVE goal=(2.01,4.33) dist=0.58m front=1.03m cells=23 rms=4.3cm[563] DRIVE goal=(2.01,4.33) dist=0.56m front=1.02m cells=23 rms=4.3cm[564] DRIVE goal=(2.01,4.33) dist=0.55m front=1.01m cells=23 rms=4.3cm[565] DRIVE goal=(2.01,4.33) dist=0.53m front=0.98m cells=23 rms=4.3cm[566] DRIVE goal=(2.01,4.33) dist=0.51m front=0.96m cells=23 rms=4.3cm[567] DRIVE goal=(2.01,4.33) dist=0.50m front=0.94m cells=23 rms=4.3cm[568] DRIVE goal=(2.01,4.33) dist=0.47m front=0.92m cells=23 rms=4.3cm[569] DRIVE goal=(2.01,4.33) dist=0.46m front=0.92m cells=23 rms=4.3cm[570] DRIVE goal=(2.01,4.33) dist=0.45m front=1.21m cells=23 rms=4.3cm[571] DRIVE goal=(2.01,4.33) dist=0.44m front=0.90m cells=23 rms=4.3cm[572] DRIVE goal=(2.01,4.33) dist=0.42m front=0.88m cells=24 rms=4.3cm[573] DRIVE goal=(2.01,4.33) dist=0.40m front=0.86m cells=24 rms=4.3cm
[124.2s] [GOAL SELECT] robot@(2.03,3.95) | 6 candidates (scanned=350 walls=206 visited=24):
  #1 ang=-125° d=1.00m pos=(2.87,3.41) score=+31.3 [O=+1.5 U=+35.0 V=-0.0 W=-3.0 R=-1.0 F=-1.4] <-- BEST
  #2 ang=-107° d=1.00m pos=(3.00,3.70) score=+27.0 [O=+1.7 U=+24.6 V=-0.0 W=-3.0 R=-0.0 F=+3.3]
  #3 ang=  -9° d=0.50m pos=(2.08,4.44) score=+6.9 [O=+2.1 U=+14.5 V=-0.0 W=-3.0 R=-10.9 F=+14.0 T=-10.0]
  #4 ang=  -3° d=0.50m pos=(2.03,4.45) score=+5.3 [O=+1.7 U=+14.0 V=-0.0 W=-3.0 R=-10.9 F=+13.4 T=-10.0]
  #5 ang=  +3° d=0.50m pos=(1.98,4.44) score=+0.7 [O=+1.7 U=+10.2 V=-0.0 W=-3.0 R=-10.9 F=+12.6 T=-10.0]
  #6 ang=  +9° d=0.50m pos=(1.92,4.44) score=-0.2 [O=+1.6 U=+10.3 V=-0.0 W=-3.0 R=-10.9 F=+11.6 T=-10.0]
[124.2s] [GOAL] Selected: (2.87, 3.41) dist=1.00m timeout=35s angle=-125° reason=reached
[574] DRIVE goal=(2.87,3.41) dist=1.00m front=1.14m cells=24 rms=4.3cm[575] DRIVE goal=(2.87,3.41) dist=1.01m front=1.12m cells=24 rms=4.3cm[576] DRIVE goal=(2.87,3.41) dist=1.01m front=1.12m cells=24 rms=4.3cm[577] DRIVE goal=(2.87,3.41) dist=1.02m front=1.10m cells=24 rms=4.3cm[578] DRIVE goal=(2.87,3.41) dist=1.02m front=1.10m cells=24 rms=4.3cm[579] DRIVE goal=(2.87,3.41) dist=1.03m front=1.09m cells=24 rms=4.3cm[580] DRIVE goal=(2.87,3.41) dist=1.02m front=1.09m cells=24 rms=4.3cm[581] DRIVE goal=(2.87,3.41) dist=1.02m front=1.10m cells=24 rms=4.3cm[582] DRIVE goal=(2.87,3.41) dist=1.02m front=1.10m cells=24 rms=4.3cm[583] DRIVE goal=(2.87,3.41) dist=1.03m front=1.09m cells=24 rms=4.3cm[584] DRIVE goal=(2.87,3.41) dist=1.03m front=1.10m cells=24 rms=4.3cm[585] DRIVE goal=(2.87,3.41) dist=1.03m front=0.49m cells=24 rms=4.3cm[586] DRIVE goal=(2.87,3.41) dist=1.03m front=0.49m cells=24 rms=4.3cm[587] DRIVE goal=(2.87,3.41) dist=1.03m front=0.48m cells=24 rms=4.3cm[588] DRIVE goal=(2.87,3.41) dist=1.03m front=0.48m cells=24 rms=4.3cm[589] DRIVE goal=(2.87,3.41) dist=1.03m front=0.48m cells=24 rms=4.3cm[590] DRIVE goal=(2.87,3.41) dist=1.03m front=0.48m cells=24 rms=4.3cm[591] DRIVE goal=(2.87,3.41) dist=1.03m front=0.48m cells=24 rms=4.3cm[592] DRIVE goal=(2.87,3.41) dist=1.03m front=0.48m cells=24 rms=4.3cm[593] DRIVE goal=(2.87,3.41) dist=1.03m front=0.48m cells=24 rms=4.3cm[594] DRIVE goal=(2.87,3.41) dist=1.03m front=0.48m cells=24 rms=4.3cm[595] DRIVE goal=(2.87,3.41) dist=1.03m front=0.48m cells=24 rms=4.3cm[596] DRIVE goal=(2.87,3.41) dist=1.03m front=0.48m cells=24 rms=4.3cm[597] DRIVE goal=(2.87,3.41) dist=1.03m front=0.48m cells=24 rms=4.3cm[598] DRIVE goal=(2.87,3.41) dist=1.03m front=0.48m cells=24 rms=4.3cm[599] DRIVE goal=(2.87,3.41) dist=1.03m front=0.48m cells=24 rms=4.3cm[600] DRIVE goal=(2.87,3.41) dist=1.04m front=0.48m cells=24 rms=4.3cm[601] DRIVE goal=(2.87,3.41) dist=1.04m front=0.48m cells=24 rms=4.3cm[602] DRIVE goal=(2.87,3.41) dist=1.04m front=0.48m cells=24 rms=4.3cm[603] DRIVE goal=(2.87,3.41) dist=1.04m front=0.48m cells=24 rms=4.3cm[604] DRIVE goal=(2.87,3.41) dist=1.04m front=0.48m cells=24 rms=4.3cm[605] DRIVE goal=(2.87,3.41) dist=1.04m front=0.48m cells=24 rms=4.3cm[606] DRIVE goal=(2.87,3.41) dist=1.04m front=0.48m cells=24 rms=4.3cm[607] DRIVE goal=(2.87,3.41) dist=1.04m front=0.48m cells=24 rms=4.3cm[608] DRIVE goal=(2.87,3.41) dist=1.04m front=0.48m cells=24 rms=4.3cm[609] DRIVE goal=(2.87,3.41) dist=1.04m front=0.48m cells=24 rms=4.3cm[610] DRIVE goal=(2.87,3.41) dist=1.04m front=0.48m cells=24 rms=4.3cm[611] DRIVE goal=(2.87,3.41) dist=1.04m front=0.57m cells=24 rms=4.3cm[612] DRIVE goal=(2.87,3.41) dist=1.05m front=0.57m cells=24 rms=4.3cm[613] DRIVE goal=(2.87,3.41) dist=1.05m front=0.57m cells=24 rms=4.3cm[614] DRIVE goal=(2.87,3.41) dist=1.05m front=0.57m cells=24 rms=4.3cm[615] DRIVE goal=(2.87,3.41) dist=1.05m front=0.57m cells=24 rms=4.3cm[616] DRIVE goal=(2.87,3.41) dist=1.06m front=0.57m cells=24 rms=4.3cm[617] DRIVE goal=(2.87,3.41) dist=1.05m front=0.58m cells=24 rms=4.3cm[618] DRIVE goal=(2.87,3.41) dist=1.05m front=0.57m cells=24 rms=4.3cm[619] DRIVE goal=(2.87,3.41) dist=1.05m front=0.57m cells=24 rms=4.3cm[620] DRIVE goal=(2.87,3.41) dist=1.06m front=0.57m cells=24 rms=4.3cm[621] DRIVE goal=(2.87,3.41) dist=1.06m front=0.57m cells=24 rms=4.3cm[622] DRIVE goal=(2.87,3.41) dist=1.06m front=0.57m cells=24 rms=4.3cm[623] DRIVE goal=(2.87,3.41) dist=1.05m front=0.56m cells=24 rms=4.3cm[624] DRIVE goal=(2.87,3.41) dist=1.06m front=0.57m cells=24 rms=4.3cm[625] DRIVE goal=(2.87,3.41) dist=1.06m front=0.56m cells=24 rms=4.3cm[626] DRIVE goal=(2.87,3.41) dist=1.05m front=0.56m cells=24 rms=4.3cm[627] DRIVE goal=(2.87,3.41) dist=1.05m front=0.56m cells=24 rms=4.3cm[628] DRIVE goal=(2.87,3.41) dist=1.05m front=0.56m cells=24 rms=4.3cm[629] DRIVE goal=(2.87,3.41) dist=1.04m front=0.55m cells=24 rms=4.3cm[630] DRIVE goal=(2.87,3.41) dist=1.04m front=0.54m cells=24 rms=4.3cm[631] DRIVE goal=(2.87,3.41) dist=1.03m front=0.53m cells=24 rms=4.3cm[632] DRIVE goal=(2.87,3.41) dist=1.02m front=0.52m cells=24 rms=4.3cm[633] DRIVE goal=(2.87,3.41) dist=1.01m front=0.51m cells=24 rms=4.3cm[634] DRIVE goal=(2.87,3.41) dist=0.99m front=0.49m cells=24 rms=4.3cm[635] DRIVE goal=(2.87,3.41) dist=0.97m front=0.47m cells=24 rms=4.3cm[636] DRIVE goal=(2.87,3.41) dist=0.95m front=0.46m cells=25 rms=4.3cm[637] DRIVE goal=(2.87,3.41) dist=0.93m front=0.43m cells=25 rms=4.3cm[638] DRIVE goal=(2.87,3.41) dist=0.91m front=0.41m cells=25 rms=4.3cm[639] DRIVE goal=(2.87,3.41) dist=0.89m front=0.40m cells=25 rms=4.4cm[640] DRIVE goal=(2.87,3.41) dist=0.87m front=0.38m cells=25 rms=4.4cm[641] DRIVE goal=(2.87,3.41) dist=0.85m front=0.36m cells=25 rms=4.4cm[642] DRIVE goal=(2.87,3.41) dist=0.84m front=0.34m cells=25 rms=4.4cm[643] DRIVE goal=(2.87,3.41) dist=0.81m front=0.32m cells=26 rms=4.4cm[644] DRIVE goal=(2.87,3.41) dist=0.79m front=0.30m cells=26 rms=4.4cm[645] DRIVE goal=(2.87,3.41) dist=0.78m front=0.28m cells=26 rms=4.4cm[646] DRIVE goal=(2.87,3.41) dist=0.76m front=0.27m cells=26 rms=4.4cm[647] DRIVE goal=(2.87,3.41) dist=0.75m front=0.25m cells=26 rms=4.4cm[648] DRIVE goal=(2.87,3.41) dist=0.74m front=0.24m cells=26 rms=4.4cm[649] DRIVE goal=(2.87,3.41) dist=0.73m front=0.23m cells=26 rms=4.4cm[650] DRIVE goal=(2.87,3.41) dist=0.72m front=0.22m cells=26 rms=4.4cm[651] DRIVE goal=(2.87,3.41) dist=0.70m front=0.20m cells=26 rms=4.4cm[652] DRIVE goal=(2.87,3.41) dist=0.69m front=0.19m cells=26 rms=4.4cm[653] DRIVE goal=(2.87,3.41) dist=0.67m front=0.18m cells=26 rms=4.4cm[654] DRIVE goal=(2.87,3.41) dist=0.66m front=0.17m cells=26 rms=4.4cm[655] DRIVE goal=(2.87,3.41) dist=0.65m front=0.15m cells=26 rms=4.4cm
[141.1s] [BACKUP] front=0.14m

[BACKUP] Reversing...
[BACKUP] Turning right (L_openings=5 R_openings=5)

[144.8s] [REFINE] only 4 candidates, resampling with 150 angles (level 1)

[144.8s] [GOAL SELECT] robot@(2.32,3.83) | 15 candidates (refined 1x) (scanned=356 walls=215 visited=26):
  #1 ang= +23° d=0.50m pos=(2.77,3.61) score=+22.7 [O=+1.6 U=+29.3 V=-0.0 W=-3.0 R=-6.6 F=+1.3] <-- BEST
  #2 ang= +55° d=0.50m pos=(2.82,3.88) score=+22.4 [O=+1.3 U=+21.5 V=-0.0 W=-3.0 R=-6.6 F=+9.1]
  #3 ang= +57° d=0.50m pos=(2.82,3.90) score=+22.2 [O=+1.3 U=+20.9 V=-0.0 W=-3.0 R=-6.6 F=+9.5]
  #4 ang= -43° d=0.50m pos=(2.30,3.33) score=-19.0 [O=+1.7 U=+22.4 V=-2.2 W=-3.0 R=-3.3 F=-13.2 T=-21.5]
  #5 ang= -47° d=0.50m pos=(2.26,3.33) score=-20.9 [O=+1.7 U=+20.9 V=-2.2 W=-3.0 R=-3.3 F=-13.7 T=-21.5]
  #6 ang= -45° d=0.50m pos=(2.28,3.33) score=-21.0 [O=+1.7 U=+20.6 V=-2.2 W=-3.0 R=-3.3 F=-13.4 T=-21.5]
  #7 ang= -49° d=0.50m pos=(2.25,3.33) score=-21.2 [O=+1.7 U=+20.8 V=-2.2 W=-3.0 R=-3.3 F=-13.9 T=-21.5]
  #8 ang= -35° d=0.50m pos=(2.37,3.33) score=-21.2 [O=+2.5 U=+18.2 V=-2.2 W=-3.0 R=-3.3 F=-12.1 T=-21.5]
[144.8s] [GOAL] Selected: (2.77, 3.61) dist=0.50m timeout=28s angle=23° reason=no goal
[657] DRIVE goal=(2.77,3.61) dist=0.50m front=0.74m cells=26 rms=4.4cm[658] DRIVE goal=(2.77,3.61) dist=0.50m front=0.73m cells=26 rms=4.4cm[659] DRIVE goal=(2.77,3.61) dist=0.50m front=0.73m cells=26 rms=4.4cm[660] DRIVE goal=(2.77,3.61) dist=0.50m front=0.75m cells=26 rms=4.4cm[661] DRIVE goal=(2.77,3.61) dist=0.50m front=0.72m cells=26 rms=4.4cm[662] DRIVE goal=(2.77,3.61) dist=0.49m front=0.67m cells=26 rms=4.4cm[663] DRIVE goal=(2.77,3.61) dist=0.49m front=0.21m cells=26 rms=4.4cm[664] DRIVE goal=(2.77,3.61) dist=0.49m front=0.22m cells=26 rms=4.4cm[665] DRIVE goal=(2.77,3.61) dist=0.49m front=0.18m cells=26 rms=4.4cm[666] DRIVE goal=(2.77,3.61) dist=0.48m front=0.17m cells=26 rms=4.4cm[667] DRIVE goal=(2.77,3.61) dist=0.48m front=0.16m cells=26 rms=4.4cm
[147.2s] [BACKUP] front=0.14m

[BACKUP] Reversing...
[BACKUP] Turning right (L_openings=5 R_openings=5)

[150.8s] [REFINE] only 2 candidates, resampling with 150 angles (level 1)

[150.8s] [REFINE] best score 10.8 < 20.0, resampling with 450 angles (level 2)

[150.8s] [REFINE] best score 10.9 < 20.0, resampling with 1350 angles (level 3)

[150.8s] [GOAL SELECT] robot@(2.29,3.83) | 62 candidates (refined 3x) (scanned=356 walls=217 visited=26):
  #1 ang= +45° d=0.50m pos=(2.79,3.88) score=+10.9 [O=+1.3 U=+22.3 V=-0.0 W=-3.0 R=-19.0 F=+9.1] <-- BEST
  #2 ang= +45° d=0.50m pos=(2.79,3.88) score=+10.9 [O=+1.3 U=+22.3 V=-0.0 W=-3.0 R=-19.0 F=+9.1]
  #3 ang= +45° d=0.50m pos=(2.79,3.88) score=+10.8 [O=+1.3 U=+22.4 V=-0.0 W=-3.0 R=-19.0 F=+9.0]
  #4 ang= +45° d=0.50m pos=(2.79,3.88) score=+10.8 [O=+1.3 U=+22.4 V=-0.0 W=-3.0 R=-19.0 F=+9.0]
  #5 ang= +45° d=0.50m pos=(2.79,3.88) score=+10.8 [O=+1.3 U=+22.4 V=-0.0 W=-3.0 R=-19.0 F=+8.9]
  #6 ang= +44° d=0.50m pos=(2.79,3.87) score=+10.7 [O=+1.3 U=+22.4 V=-0.0 W=-3.0 R=-19.0 F=+8.9]
  #7 ang= +47° d=0.50m pos=(2.78,3.90) score=+10.7 [O=+1.3 U=+21.8 V=-0.0 W=-3.0 R=-19.0 F=+9.5]
  #8 ang= +44° d=0.50m pos=(2.79,3.87) score=+10.7 [O=+1.3 U=+22.4 V=-0.0 W=-3.0 R=-19.0 F=+8.8]
[150.8s] [GOAL] Selected: (2.79, 3.88) dist=0.50m timeout=27s angle=45° reason=no goal
[669] DRIVE goal=(2.79,3.88) dist=0.50m front=0.22m cells=26 rms=4.4cm[670] DRIVE goal=(2.79,3.88) dist=0.51m front=0.93m cells=26 rms=4.3cm[671] DRIVE goal=(2.79,3.88) dist=0.51m front=0.94m cells=26 rms=4.3cm[672] DRIVE goal=(2.79,3.88) dist=0.51m front=0.94m cells=26 rms=4.3cm[673] DRIVE goal=(2.79,3.88) dist=0.51m front=0.94m cells=26 rms=4.3cm[674] DRIVE goal=(2.79,3.88) dist=0.51m front=0.94m cells=26 rms=4.3cm[675] DRIVE goal=(2.79,3.88) dist=0.51m front=0.94m cells=26 rms=4.3cm[676] DRIVE goal=(2.79,3.88) dist=0.51m front=0.94m cells=26 rms=4.3cm[677] DRIVE goal=(2.79,3.88) dist=0.51m front=0.93m cells=26 rms=4.3cm
[152.9s] [TURN ENTER] Entering TURN mode

[BLOCKED DEBUG] Goal angle: 43.2° (sector 7), goal_dist: 0.50m, goal_dir_min: 0.23m, margin: 0.15m
[BLOCKED DEBUG] Checking 3 sectors (robot angular width at 0.5m = 20.4°): {7: 1.333, 8: 0.803, 6: 0.232}
[BLOCKED DEBUG] Check: 0.23 < 0.50 - 0.15 = 0.35? True
[BLOCKED DEBUG] (Full front arc for reference: {55: 0.928, 56: 0.925, 57: 0.933, 58: 0.985, 59: 1.148, 0: 1.144, 1: 1.152, 2: 1.245, 3: 1.59, 4: 0.242, 5: 0.225})

[BLOCKED TURN] goal_sector=7, best_sector=7 (dist=1.33m), target_angle=42.0°, angle_error=42.0°, v=0.00, w=0.50
[678] TURN goal=(2.79,3.88) dist=0.50m front=0.23m cells=26 rms=4.3cm[679] DRIVE goal=(2.79,3.88) dist=0.49m front=0.21m cells=26 rms=4.3cm
[153.3s] [TURN ENTER] Entering TURN mode

[BLOCKED DEBUG] Goal angle: 35.1° (sector 5), goal_dist: 0.49m, goal_dir_min: 0.22m, margin: 0.15m
[BLOCKED DEBUG] Checking 3 sectors (robot angular width at 0.5m = 20.8°): {5: 1.318, 6: 0.797, 4: 0.216}
[BLOCKED DEBUG] Check: 0.22 < 0.49 - 0.15 = 0.34? True
[BLOCKED DEBUG] (Full front arc for reference: {55: 0.923, 56: 0.962, 57: 1.104, 58: 1.131, 59: 1.134, 0: 1.195, 1: 1.356, 2: 0.224, 3: 0.209, 4: 0.216, 5: 1.318})

[BLOCKED TURN] goal_sector=5, best_sector=5 (dist=1.32m), target_angle=30.0°, angle_error=30.0°, v=0.00, w=0.50
[680] TURN goal=(2.79,3.88) dist=0.49m front=0.21m cells=26 rms=4.3cm[681] TURN goal=(2.79,3.88) dist=0.49m front=0.21m cells=26 rms=4.3cm[682] TURN goal=(2.79,3.88) dist=0.50m front=0.22m cells=26 rms=4.3cm[683] DRIVE goal=(2.79,3.88) dist=0.51m front=0.22m cells=26 rms=4.3cm[684] DRIVE goal=(2.79,3.88) dist=0.51m front=0.22m cells=26 rms=4.3cm
[154.3s] [TURN ENTER] Entering TURN mode

[BLOCKED DEBUG] Goal angle: 22.7° (sector 3), goal_dist: 0.51m, goal_dir_min: 0.23m, margin: 0.15m
[BLOCKED DEBUG] Checking 3 sectors (robot angular width at 0.5m = 20.2°): {3: 1.33, 4: 0.797, 2: 0.234}
[BLOCKED DEBUG] Check: 0.23 < 0.51 - 0.15 = 0.36? True
[BLOCKED DEBUG] (Full front arc for reference: {55: 1.121, 56: 1.144, 57: 1.15, 58: 1.225, 59: 1.582, 0: 0.22, 1: 0.22, 2: 0.234, 3: 1.33, 4: 0.797, 5: 0.789})

[BLOCKED TURN] goal_sector=3, best_sector=3 (dist=1.33m), target_angle=18.0°, angle_error=18.0°, v=0.00, w=0.47
[685] TURN goal=(2.79,3.88) dist=0.51m front=0.22m cells=26 rms=4.3cm[686] TURN goal=(2.79,3.88) dist=0.51m front=0.22m cells=26 rms=4.3cm[687] DRIVE goal=(2.79,3.88) dist=0.52m front=0.23m cells=26 rms=4.3cm[688] DRIVE goal=(2.79,3.88) dist=0.52m front=0.23m cells=26 rms=4.3cm[689] DRIVE goal=(2.79,3.88) dist=0.52m front=0.23m cells=26 rms=4.3cm[690] DRIVE goal=(2.79,3.88) dist=0.51m front=0.22m cells=26 rms=4.3cm[691] DRIVE goal=(2.79,3.88) dist=0.50m front=0.21m cells=26 rms=4.3cm[692] DRIVE goal=(2.79,3.88) dist=0.50m front=0.20m cells=26 rms=4.3cm[693] DRIVE goal=(2.79,3.88) dist=0.48m front=0.19m cells=26 rms=4.3cm[694] DRIVE goal=(2.79,3.88) dist=0.47m front=0.18m cells=26 rms=4.3cm[695] DRIVE goal=(2.79,3.88) dist=0.45m front=0.16m cells=26 rms=4.3cm[696] DRIVE goal=(2.79,3.88) dist=0.44m front=0.15m cells=26 rms=4.3cm
[156.8s] [BACKUP] front=0.15m

[BACKUP] Reversing...
[BACKUP] Turning right (L_openings=4 R_openings=5)

[160.5s] [REFINE] best score 10.3 < 20.0, resampling with 150 angles (level 1)

[160.5s] [REFINE] best score 13.3 < 20.0, resampling with 450 angles (level 2)

[160.5s] [REFINE] best score 15.5 < 20.0, resampling with 1350 angles (level 3)

[160.5s] [GOAL SELECT] robot@(2.27,3.80) | 130 candidates (refined 3x) (scanned=359 walls=221 visited=26):
  #1 ang=-129° d=2.00m pos=(0.63,2.66) score=+15.5 [O=+1.7 U=+29.9 V=-0.0 W=-3.0 R=-0.0 F=-13.7] <-- BEST
  #2 ang=-129° d=2.00m pos=(0.63,2.65) score=+13.3 [O=+1.7 U=+27.7 V=-0.0 W=-3.0 R=-0.0 F=-13.7]
  #3 ang=-129° d=2.00m pos=(0.64,2.65) score=+11.9 [O=+1.7 U=+26.3 V=-0.0 W=-3.0 R=-0.0 F=-13.7]
  #4 ang=-124° d=2.00m pos=(0.74,2.52) score=+10.8 [O=+1.7 U=+25.7 V=-0.0 W=-3.0 R=-0.0 F=-14.2]
  #5 ang=-129° d=2.00m pos=(0.64,2.64) score=+10.7 [O=+1.7 U=+25.2 V=-0.0 W=-3.0 R=-0.0 F=-13.7]
  #6 ang=-129° d=2.00m pos=(0.65,2.63) score=+10.7 [O=+1.7 U=+25.2 V=-0.0 W=-3.0 R=-0.0 F=-13.8]
  #7 ang=-128° d=2.00m pos=(0.65,2.63) score=+10.7 [O=+1.7 U=+25.2 V=-0.0 W=-3.0 R=-0.0 F=-13.8]
  #8 ang=-124° d=2.00m pos=(0.74,2.51) score=+10.7 [O=+1.7 U=+25.5 V=-0.0 W=-3.0 R=-0.0 F=-14.2]
[160.5s] [GOAL] Selected: (0.63, 2.66) dist=2.00m timeout=50s angle=-129° reason=no goal
[698] DRIVE goal=(0.63,2.66) dist=2.00m front=0.23m cells=26 rms=4.3cm[699] DRIVE goal=(0.63,2.66) dist=2.00m front=0.23m cells=26 rms=4.3cm[700] DRIVE goal=(0.63,2.66) dist=2.00m front=0.23m cells=26 rms=4.3cm[701] DRIVE goal=(0.63,2.66) dist=2.00m front=0.23m cells=26 rms=4.3cm[702] DRIVE goal=(0.63,2.66) dist=2.00m front=0.23m cells=26 rms=4.3cm[703] DRIVE goal=(0.63,2.66) dist=2.00m front=0.24m cells=26 rms=4.3cm[704] DRIVE goal=(0.63,2.66) dist=2.00m front=0.24m cells=26 rms=4.3cm[705] DRIVE goal=(0.63,2.66) dist=2.00m front=0.24m cells=26 rms=4.3cm[706] DRIVE goal=(0.63,2.66) dist=2.00m front=0.25m cells=26 rms=4.2cm[707] DRIVE goal=(0.63,2.66) dist=2.00m front=0.25m cells=26 rms=4.2cm[708] DRIVE goal=(0.63,2.66) dist=1.99m front=0.25m cells=26 rms=4.2cm[709] DRIVE goal=(0.63,2.66) dist=1.99m front=0.25m cells=26 rms=4.2cm[710] DRIVE goal=(0.63,2.66) dist=1.99m front=0.26m cells=26 rms=4.2cm[711] DRIVE goal=(0.63,2.66) dist=1.99m front=0.26m cells=26 rms=4.2cm[712] DRIVE goal=(0.63,2.66) dist=1.98m front=0.27m cells=26 rms=4.2cm[713] DRIVE goal=(0.63,2.66) dist=1.98m front=0.28m cells=26 rms=4.2cm[714] DRIVE goal=(0.63,2.66) dist=1.98m front=0.28m cells=26 rms=4.2cm[715] DRIVE goal=(0.63,2.66) dist=1.98m front=0.29m cells=26 rms=4.2cm[716] DRIVE goal=(0.63,2.66) dist=1.98m front=0.30m cells=26 rms=4.2cm[717] DRIVE goal=(0.63,2.66) dist=1.98m front=0.96m cells=26 rms=4.3cm[718] DRIVE goal=(0.63,2.66) dist=1.98m front=0.96m cells=26 rms=4.3cm[719] DRIVE goal=(0.63,2.66) dist=1.98m front=0.97m cells=26 rms=4.3cm[720] DRIVE goal=(0.63,2.66) dist=1.98m front=0.97m cells=26 rms=4.3cm[721] DRIVE goal=(0.63,2.66) dist=1.98m front=0.97m cells=26 rms=4.3cm[722] DRIVE goal=(0.63,2.66) dist=1.98m front=0.97m cells=26 rms=4.3cm[723] DRIVE goal=(0.63,2.66) dist=1.98m front=0.97m cells=26 rms=4.3cm[724] DRIVE goal=(0.63,2.66) dist=1.98m front=0.97m cells=26 rms=4.3cm[725] DRIVE goal=(0.63,2.66) dist=1.98m front=0.97m cells=26 rms=4.3cm[726] DRIVE goal=(0.63,2.66) dist=1.98m front=0.97m cells=26 rms=4.3cm[727] DRIVE goal=(0.63,2.66) dist=1.98m front=0.97m cells=26 rms=4.3cm[728] DRIVE goal=(0.63,2.66) dist=1.98m front=0.97m cells=26 rms=4.3cm[729] DRIVE goal=(0.63,2.66) dist=1.98m front=0.97m cells=26 rms=4.3cm[730] DRIVE goal=(0.63,2.66) dist=1.98m front=0.93m cells=26 rms=4.3cm[731] DRIVE goal=(0.63,2.66) dist=1.98m front=0.92m cells=26 rms=4.3cm[732] DRIVE goal=(0.63,2.66) dist=1.98m front=0.92m cells=26 rms=4.3cm[733] DRIVE goal=(0.63,2.66) dist=1.98m front=0.92m cells=26 rms=4.4cm

Stopping (Ctrl+C)...
[MARKER] Publisher stopped

=======================================================
NBV NAVIGATION COMPLETE
=======================================================
Final state: exploring
Duration: 167.9s
Iterations: 733
Goals reached: 4
Backups: 4
Unique cells visited: 26
Cells scanned by LiDAR: 363
Walls detected: 221

--- Drive Accuracy ---
Cross-track RMS error: 4.4cm
Total distance traveled: 8.05m
Ideal distance (sum of goals): 12.50m
Drive efficiency: 155.3%
Revisit rate: 100.0%

--- Map Accuracy Suggestions ---
To measure map accuracy, consider:
1. Ground truth comparison: Place markers at known positions,
   compare measured vs actual distances between them
2. Loop closure error: After returning to origin, check
   odometry drift (final_dist to origin should be ~0)
3. Feature alignment: Compare map walls to actual room layout
4. Consistency check: Run multiple times, overlay maps
5. Tape measure validation: Measure actual room dimensions,
   compare to map scale (resolution * pixels)
