[OUTPUT] Logging to: /home/ws/ugv_cont/mission/outputs/20251222_202946
[OUTPUT] Log file: /home/ws/ugv_cont/mission/outputs/20251222_202946/logs/navigation.log
=======================================================
NEXT-BEST-VIEW (NBV) NAVIGATION
=======================================================
Speed: 0.08 m/s
Goal distance: 0.5-2.0m
Press Ctrl+C to stop

[DEBUG] Marker publishing enabled - check /nav_goal in RViz
[MARKER] Persistent marker publisher started - add /nav_goal in RViz
[START] Initial position: (0.02, 0.01)
[MARKER] Origin marker (blue) started at (0.02, 0.01) - add /nav_origin in RViz

[  2.4s] [GOAL SELECT] robot@(0.02,0.01) | 20 candidates (scanned=51 walls=20 visited=1):
  #1 ang=-107° d=2.00m pos=(0.67,1.90) score=+37.1 [O=+2.5 U=+34.0 V=-0.0 W=-0.0 R=-0.0 F=+0.0] <-- BEST
  #2 ang= -82° d=1.00m pos=(-0.07,1.00) score=+33.1 [O=+1.8 U=+34.0 V=-0.0 W=-3.0 R=-0.0 F=+0.0]
  #3 ang=-101° d=1.50m pos=(0.35,1.47) score=+30.0 [O=+2.5 U=+28.0 V=-0.0 W=-1.0 R=-0.0 F=+0.0]
  #4 ang= -88° d=1.00m pos=(0.03,1.01) score=+29.1 [O=+1.8 U=+30.0 V=-0.0 W=-3.0 R=-0.0 F=+0.0]
  #5 ang=-107° d=1.50m pos=(0.51,1.42) score=+28.0 [O=+2.5 U=+26.0 V=-0.0 W=-1.0 R=-0.0 F=+0.0]
  #6 ang= -58° d=0.50m pos=(-0.23,0.44) score=+25.2 [O=+1.9 U=+39.2 V=-3.0 W=-3.0 R=-0.0 F=+0.0 T=-10.0]
  #7 ang=-113° d=1.00m pos=(0.45,0.91) score=+23.3 [O=+2.0 U=+22.0 V=-0.0 W=-1.0 R=-0.0 F=+0.0]
  #8 ang= -64° d=0.50m pos=(-0.18,0.46) score=+21.2 [O=+1.9 U=+35.2 V=-3.0 W=-3.0 R=-0.0 F=+0.0 T=-10.0]
[  2.4s] [GOAL] Selected: (0.67, 1.90) dist=2.00m timeout=50s angle=-107° reason=no goal
[  1] DRIVE goal=(0.67,1.90) dist=2.00m front=0.45m cells=1 rms=0.0cm[  2] DRIVE goal=(0.67,1.90) dist=2.00m front=0.45m cells=1 rms=0.0cm[  3] DRIVE goal=(0.67,1.90) dist=2.00m front=0.46m cells=1 rms=0.0cm[  4] DRIVE goal=(0.67,1.90) dist=2.00m front=0.47m cells=1 rms=0.1cm[  5] DRIVE goal=(0.67,1.90) dist=2.00m front=0.51m cells=1 rms=0.1cm[  6] DRIVE goal=(0.67,1.90) dist=2.00m front=0.54m cells=1 rms=0.2cm[  7] DRIVE goal=(0.67,1.90) dist=2.00m front=0.53m cells=1 rms=0.2cm[  8] DRIVE goal=(0.67,1.90) dist=2.00m front=0.54m cells=1 rms=0.2cm[  9] DRIVE goal=(0.67,1.90) dist=2.00m front=0.54m cells=1 rms=0.3cm[ 10] DRIVE goal=(0.67,1.90) dist=2.01m front=0.54m cells=1 rms=0.3cm[ 11] DRIVE goal=(0.67,1.90) dist=2.01m front=0.54m cells=1 rms=0.3cm[ 12] DRIVE goal=(0.67,1.90) dist=2.01m front=0.54m cells=1 rms=0.3cm[ 13] DRIVE goal=(0.67,1.90) dist=2.01m front=0.54m cells=1 rms=0.4cm[ 14] DRIVE goal=(0.67,1.90) dist=2.01m front=0.54m cells=1 rms=0.4cm[ 15] DRIVE goal=(0.67,1.90) dist=2.01m front=0.55m cells=1 rms=0.4cm[ 16] DRIVE goal=(0.67,1.90) dist=2.02m front=0.56m cells=1 rms=0.4cm[ 17] DRIVE goal=(0.67,1.90) dist=2.02m front=0.56m cells=1 rms=0.4cm[ 18] DRIVE goal=(0.67,1.90) dist=2.02m front=0.58m cells=1 rms=0.4cm[ 19] DRIVE goal=(0.67,1.90) dist=2.02m front=0.59m cells=1 rms=0.4cm[ 20] DRIVE goal=(0.67,1.90) dist=2.02m front=0.60m cells=1 rms=0.4cm[ 21] DRIVE goal=(0.67,1.90) dist=2.02m front=0.61m cells=1 rms=0.5cm[ 22] DRIVE goal=(0.67,1.90) dist=2.02m front=0.62m cells=1 rms=0.5cm[ 23] DRIVE goal=(0.67,1.90) dist=2.02m front=0.64m cells=1 rms=0.5cm[ 24] DRIVE goal=(0.67,1.90) dist=2.02m front=0.66m cells=1 rms=0.5cm[ 25] DRIVE goal=(0.67,1.90) dist=2.02m front=0.69m cells=1 rms=0.5cm[ 26] DRIVE goal=(0.67,1.90) dist=2.02m front=0.71m cells=1 rms=0.5cm[ 27] DRIVE goal=(0.67,1.90) dist=2.03m front=0.72m cells=1 rms=0.5cm[ 28] DRIVE goal=(0.67,1.90) dist=2.03m front=0.83m cells=1 rms=0.5cm[ 29] DRIVE goal=(0.67,1.90) dist=2.03m front=0.83m cells=1 rms=0.5cm[ 30] DRIVE goal=(0.67,1.90) dist=2.03m front=0.83m cells=1 rms=0.5cm[ 31] DRIVE goal=(0.67,1.90) dist=2.03m front=0.83m cells=1 rms=0.5cm[ 32] DRIVE goal=(0.67,1.90) dist=2.03m front=0.83m cells=1 rms=0.5cm[ 33] DRIVE goal=(0.67,1.90) dist=2.03m front=0.83m cells=1 rms=0.5cm[ 34] DRIVE goal=(0.67,1.90) dist=2.03m front=0.84m cells=1 rms=0.5cm[ 35] DRIVE goal=(0.67,1.90) dist=2.03m front=0.86m cells=1 rms=0.5cm[ 36] DRIVE goal=(0.67,1.90) dist=2.03m front=0.89m cells=1 rms=0.5cm
[  9.8s] [TURN ENTER] Entering TURN mode

[BLOCKED DEBUG] Goal angle: -25.2° (sector 55), goal_dist: 2.03m, goal_dir_min: 1.82m, margin: 0.15m
[BLOCKED DEBUG] Checking 1 sectors (robot angular width at 2.0m = 5.1°): {55: 1.823}
[BLOCKED DEBUG] Check: 1.82 < 2.03 - 0.15 = 1.88? True
[BLOCKED DEBUG] (Full front arc for reference: {55: 1.823, 56: 3.777, 57: 3.721, 58: 5.233, 59: 1.779, 0: 1.778, 1: 1.301, 2: 1.305, 3: 1.329, 4: 1.366, 5: 0.948})

[BLOCKED TURN] goal_sector=55, best_sector=55 (dist=1.82m), target_angle=-30.0°, angle_error=-30.0°, v=0.00, w=-0.50
[ 37] TURN goal=(0.67,1.90) dist=2.03m front=0.95m cells=1 rms=0.5cm[ 38] DRIVE goal=(0.67,1.90) dist=2.03m front=1.30m cells=1 rms=0.5cm[ 39] DRIVE goal=(0.67,1.90) dist=2.03m front=1.30m cells=1 rms=0.5cm
[ 10.3s] [TURN ENTER] Entering TURN mode

[BLOCKED DEBUG] Goal angle: -19.4° (sector 56), goal_dist: 2.03m, goal_dir_min: 1.88m, margin: 0.15m
[BLOCKED DEBUG] Checking 1 sectors (robot angular width at 2.0m = 5.1°): {56: 1.875}
[BLOCKED DEBUG] Check: 1.88 < 2.03 - 0.15 = 1.88? True
[BLOCKED DEBUG] (Full front arc for reference: {55: 1.661, 56: 1.875, 57: 3.778, 58: 3.721, 59: 3.855, 0: 1.778, 1: 1.779, 2: 1.303, 3: 1.305, 4: 1.325, 5: 1.358})

[BLOCKED TURN] goal_sector=56, best_sector=56 (dist=1.88m), target_angle=-24.0°, angle_error=-24.0°, v=0.00, w=-0.50
[ 40] TURN goal=(0.67,1.90) dist=2.03m front=1.30m cells=1 rms=0.5cm[ 41] DRIVE goal=(0.67,1.90) dist=2.03m front=0.81m cells=1 rms=0.5cm
[ 10.7s] [TURN ENTER] Entering TURN mode

[BLOCKED DEBUG] Goal angle: -14.1° (sector 57), goal_dist: 2.03m, goal_dir_min: 1.86m, margin: 0.15m
[BLOCKED DEBUG] Checking 1 sectors (robot angular width at 2.0m = 5.1°): {57: 1.857}
[BLOCKED DEBUG] Check: 1.86 < 2.03 - 0.15 = 1.88? True
[BLOCKED DEBUG] (Full front arc for reference: {55: 0.761, 56: 1.643, 57: 1.857, 58: 3.776, 59: 3.717, 0: 3.8, 1: 1.775, 2: 1.775, 3: 1.3, 4: 1.304, 5: 1.332})

[BLOCKED TURN] goal_sector=57, best_sector=57 (dist=1.86m), target_angle=-18.0°, angle_error=-18.0°, v=0.00, w=-0.47
[ 42] TURN goal=(0.67,1.90) dist=2.03m front=0.76m cells=1 rms=0.5cm[ 43] TURN goal=(0.67,1.90) dist=2.03m front=0.74m cells=1 rms=0.5cm[ 44] DRIVE goal=(0.67,1.90) dist=2.03m front=0.70m cells=1 rms=0.5cm
[ 11.3s] [TURN ENTER] Entering TURN mode

[BLOCKED DEBUG] Goal angle: -9.1° (sector 58), goal_dist: 2.03m, goal_dir_min: 1.86m, margin: 0.15m
[BLOCKED DEBUG] Checking 1 sectors (robot angular width at 2.0m = 5.1°): {58: 1.859}
[BLOCKED DEBUG] Check: 1.86 < 2.03 - 0.15 = 1.88? True
[BLOCKED DEBUG] (Full front arc for reference: {55: 0.697, 56: 0.762, 57: 1.644, 58: 1.859, 59: 3.754, 0: 3.706, 1: 3.859, 2: 1.768, 3: 1.769, 4: 1.293, 5: 1.295})

[BLOCKED TURN] goal_sector=58, best_sector=58 (dist=1.86m), target_angle=-12.0°, angle_error=-12.0°, v=0.00, w=-0.31
[ 45] TURN goal=(0.67,1.90) dist=2.03m front=0.70m cells=1 rms=0.5cm[ 46] TURN goal=(0.67,1.90) dist=2.02m front=0.69m cells=1 rms=0.5cm[ 47] DRIVE goal=(0.67,1.90) dist=2.02m front=0.65m cells=1 rms=0.5cm[ 48] DRIVE goal=(0.67,1.90) dist=2.02m front=0.64m cells=1 rms=0.5cm[ 49] DRIVE goal=(0.67,1.90) dist=2.02m front=0.65m cells=1 rms=0.5cm
[ 12.4s] [TURN ENTER] Entering TURN mode

[BLOCKED DEBUG] Goal angle: -2.0° (sector 59), goal_dist: 2.01m, goal_dir_min: 1.82m, margin: 0.15m
[BLOCKED DEBUG] Checking 1 sectors (robot angular width at 2.0m = 5.1°): {59: 1.819}
[BLOCKED DEBUG] Check: 1.82 < 2.01 - 0.15 = 1.86? True
[BLOCKED DEBUG] (Full front arc for reference: {55: 0.624, 56: 0.668, 57: 0.739, 58: 1.612, 59: 1.819, 0: 3.791, 1: 3.697, 2: 3.697, 3: 1.78, 4: 1.758, 5: 1.285})

[BLOCKED TURN] goal_sector=59, best_sector=59 (dist=1.82m), target_angle=-6.0°, angle_error=-6.0°, v=0.05, w=-0.16
[ 50] TURN goal=(0.67,1.90) dist=2.01m front=0.62m cells=1 rms=0.5cm[ 51] TURN goal=(0.67,1.90) dist=2.00m front=0.61m cells=1 rms=0.4cm[ 52] DRIVE goal=(0.67,1.90) dist=1.97m front=0.59m cells=1 rms=0.4cm[ 53] DRIVE goal=(0.67,1.90) dist=1.96m front=0.59m cells=1 rms=0.4cm[ 54] DRIVE goal=(0.67,1.90) dist=1.95m front=0.58m cells=1 rms=0.4cm[ 55] DRIVE goal=(0.67,1.90) dist=1.93m front=0.57m cells=1 rms=0.4cm[ 56] DRIVE goal=(0.67,1.90) dist=1.91m front=0.56m cells=1 rms=0.4cm[ 57] DRIVE goal=(0.67,1.90) dist=1.89m front=0.56m cells=1 rms=0.4cm[ 58] DRIVE goal=(0.67,1.90) dist=1.87m front=0.55m cells=1 rms=0.4cm[ 59] DRIVE goal=(0.67,1.90) dist=1.85m front=0.55m cells=1 rms=0.4cm
[ 14.4s] [TURN ENTER] Entering TURN mode

[BLOCKED DEBUG] Goal angle: -0.5° (sector 59), goal_dist: 1.84m, goal_dir_min: 1.59m, margin: 0.15m
[BLOCKED DEBUG] Checking 1 sectors (robot angular width at 1.8m = 5.6°): {59: 1.593}
[BLOCKED DEBUG] Check: 1.59 < 1.84 - 0.15 = 1.69? True
[BLOCKED DEBUG] (Full front arc for reference: {55: 0.534, 56: 0.574, 57: 0.63, 58: 1.433, 59: 1.593, 0: 1.817, 1: 3.534, 2: 3.513, 3: 5.028, 4: 1.582, 5: 1.583})

[BLOCKED TURN] goal_sector=59, best_sector=59 (dist=1.59m), target_angle=-6.0°, angle_error=-6.0°, v=0.05, w=-0.16
[ 60] TURN goal=(0.67,1.90) dist=1.84m front=0.53m cells=1 rms=0.4cm[ 61] TURN goal=(0.67,1.90) dist=1.81m front=0.53m cells=1 rms=0.4cm[ 62] DRIVE goal=(0.67,1.90) dist=1.79m front=0.56m cells=1 rms=0.4cm[ 63] DRIVE goal=(0.67,1.90) dist=1.78m front=0.55m cells=1 rms=0.4cm[ 64] DRIVE goal=(0.67,1.90) dist=1.76m front=0.55m cells=1 rms=0.4cm[ 65] DRIVE goal=(0.67,1.90) dist=1.75m front=0.54m cells=1 rms=0.4cm[ 66] DRIVE goal=(0.67,1.90) dist=1.73m front=0.52m cells=1 rms=0.4cm[ 67] DRIVE goal=(0.67,1.90) dist=1.71m front=0.53m cells=1 rms=0.4cm[ 68] DRIVE goal=(0.67,1.90) dist=1.69m front=0.50m cells=1 rms=0.4cm[ 69] DRIVE goal=(0.67,1.90) dist=1.67m front=0.49m cells=2 rms=0.4cm[ 70] DRIVE goal=(0.67,1.90) dist=1.65m front=0.47m cells=2 rms=0.4cm[ 71] DRIVE goal=(0.67,1.90) dist=1.64m front=1.11m cells=2 rms=0.4cm[ 72] DRIVE goal=(0.67,1.90) dist=1.62m front=1.10m cells=2 rms=0.5cm[ 73] DRIVE goal=(0.67,1.90) dist=1.60m front=1.10m cells=2 rms=0.5cm[ 74] DRIVE goal=(0.67,1.90) dist=1.56m front=1.08m cells=2 rms=0.5cm[ 75] DRIVE goal=(0.67,1.90) dist=1.56m front=1.08m cells=2 rms=0.5cm[ 76] DRIVE goal=(0.67,1.90) dist=1.54m front=1.06m cells=2 rms=0.6cm[ 77] DRIVE goal=(0.67,1.90) dist=1.52m front=1.05m cells=2 rms=0.6cm[ 78] DRIVE goal=(0.67,1.90) dist=1.50m front=1.05m cells=2 rms=0.6cm[ 79] DRIVE goal=(0.67,1.90) dist=1.48m front=1.04m cells=2 rms=0.6cm[ 80] DRIVE goal=(0.67,1.90) dist=1.46m front=1.03m cells=2 rms=0.7cm[ 81] DRIVE goal=(0.67,1.90) dist=1.44m front=1.03m cells=2 rms=0.7cm[ 82] DRIVE goal=(0.67,1.90) dist=1.43m front=1.02m cells=2 rms=0.7cm[ 83] DRIVE goal=(0.67,1.90) dist=1.41m front=1.01m cells=2 rms=0.8cm[ 84] DRIVE goal=(0.67,1.90) dist=1.39m front=1.00m cells=2 rms=0.8cm[ 85] DRIVE goal=(0.67,1.90) dist=1.37m front=0.99m cells=3 rms=0.8cm[ 86] DRIVE goal=(0.67,1.90) dist=1.35m front=0.99m cells=3 rms=0.9cm[ 87] DRIVE goal=(0.67,1.90) dist=1.32m front=0.98m cells=3 rms=0.9cm[ 88] DRIVE goal=(0.67,1.90) dist=1.31m front=0.99m cells=3 rms=1.0cm[ 89] DRIVE goal=(0.67,1.90) dist=1.30m front=0.97m cells=3 rms=1.0cm[ 90] DRIVE goal=(0.67,1.90) dist=1.27m front=0.97m cells=3 rms=1.0cm[ 91] DRIVE goal=(0.67,1.90) dist=1.25m front=0.96m cells=3 rms=1.1cm[ 92] DRIVE goal=(0.67,1.90) dist=1.23m front=0.94m cells=3 rms=1.1cm[ 93] DRIVE goal=(0.67,1.90) dist=1.21m front=0.94m cells=3 rms=1.2cm[ 94] DRIVE goal=(0.67,1.90) dist=1.18m front=0.92m cells=3 rms=1.2cm[ 95] DRIVE goal=(0.67,1.90) dist=1.17m front=0.92m cells=3 rms=1.3cm[ 96] DRIVE goal=(0.67,1.90) dist=1.15m front=0.92m cells=3 rms=1.3cm[ 97] DRIVE goal=(0.67,1.90) dist=1.13m front=0.91m cells=3 rms=1.4cm[ 98] DRIVE goal=(0.67,1.90) dist=1.10m front=0.90m cells=3 rms=1.4cm[ 99] DRIVE goal=(0.67,1.90) dist=1.08m front=0.89m cells=3 rms=1.5cm[100] DRIVE goal=(0.67,1.90) dist=1.06m front=0.87m cells=4 rms=1.5cm[101] DRIVE goal=(0.67,1.90) dist=1.04m front=0.86m cells=4 rms=1.6cm[102] DRIVE goal=(0.67,1.90) dist=1.03m front=0.87m cells=4 rms=1.6cm[103] DRIVE goal=(0.67,1.90) dist=1.02m front=0.86m cells=4 rms=1.7cm[104] DRIVE goal=(0.67,1.90) dist=1.00m front=0.84m cells=5 rms=1.7cm[105] DRIVE goal=(0.67,1.90) dist=0.98m front=0.82m cells=5 rms=1.8cm[106] DRIVE goal=(0.67,1.90) dist=0.96m front=0.82m cells=5 rms=1.8cm[107] DRIVE goal=(0.67,1.90) dist=0.94m front=0.81m cells=5 rms=1.9cm[108] DRIVE goal=(0.67,1.90) dist=0.92m front=0.80m cells=5 rms=1.9cm[109] DRIVE goal=(0.67,1.90) dist=0.90m front=0.79m cells=5 rms=2.0cm[110] DRIVE goal=(0.67,1.90) dist=0.88m front=0.77m cells=5 rms=2.0cm[111] DRIVE goal=(0.67,1.90) dist=0.86m front=0.76m cells=5 rms=2.1cm[112] DRIVE goal=(0.67,1.90) dist=0.84m front=0.75m cells=5 rms=2.1cm[113] DRIVE goal=(0.67,1.90) dist=0.82m front=0.74m cells=5 rms=2.2cm[114] DRIVE goal=(0.67,1.90) dist=0.79m front=0.73m cells=5 rms=2.2cm[115] DRIVE goal=(0.67,1.90) dist=0.79m front=0.73m cells=5 rms=2.3cm[116] DRIVE goal=(0.67,1.90) dist=0.77m front=0.73m cells=5 rms=2.3cm[117] DRIVE goal=(0.67,1.90) dist=0.75m front=0.71m cells=6 rms=2.4cm[118] DRIVE goal=(0.67,1.90) dist=0.73m front=0.70m cells=6 rms=2.4cm[119] DRIVE goal=(0.67,1.90) dist=0.71m front=0.70m cells=6 rms=2.4cm[120] DRIVE goal=(0.67,1.90) dist=0.69m front=0.69m cells=6 rms=2.5cm[121] DRIVE goal=(0.67,1.90) dist=0.66m front=0.68m cells=6 rms=2.5cm[122] DRIVE goal=(0.67,1.90) dist=0.64m front=0.67m cells=6 rms=2.6cm[123] DRIVE goal=(0.67,1.90) dist=0.63m front=0.67m cells=6 rms=2.6cm[124] DRIVE goal=(0.67,1.90) dist=0.62m front=0.66m cells=6 rms=2.6cm[125] DRIVE goal=(0.67,1.90) dist=0.60m front=0.65m cells=6 rms=2.7cm[126] DRIVE goal=(0.67,1.90) dist=0.58m front=0.64m cells=6 rms=2.7cm[127] DRIVE goal=(0.67,1.90) dist=0.56m front=0.63m cells=6 rms=2.7cm[128] DRIVE goal=(0.67,1.90) dist=0.54m front=0.62m cells=6 rms=2.8cm[129] DRIVE goal=(0.67,1.90) dist=0.51m front=0.61m cells=6 rms=2.8cm[130] DRIVE goal=(0.67,1.90) dist=0.49m front=0.60m cells=6 rms=2.8cm[131] DRIVE goal=(0.67,1.90) dist=0.47m front=0.59m cells=6 rms=2.8cm[132] DRIVE goal=(0.67,1.90) dist=0.45m front=0.58m cells=6 rms=2.9cm[133] DRIVE goal=(0.67,1.90) dist=0.43m front=0.61m cells=7 rms=2.9cm[134] DRIVE goal=(0.67,1.90) dist=0.41m front=0.62m cells=7 rms=2.9cm
[ 29.5s] [GOAL SELECT] robot@(0.49,1.55) | 18 candidates (scanned=115 walls=59 visited=7):
  #1 ang=  -3° d=1.50m pos=(1.05,2.94) score=+46.2 [O=+1.8 U=+36.0 V=-0.0 W=-0.0 R=-0.0 F=+8.0] <-- BEST
  #2 ang=  +3° d=1.50m pos=(0.89,2.99) score=+42.1 [O=+1.7 U=+32.0 V=-0.0 W=-0.0 R=-0.0 F=+8.0]
  #3 ang=  +9° d=1.50m pos=(0.74,3.02) score=+37.0 [O=+1.6 U=+28.0 V=-0.0 W=-1.0 R=-0.0 F=+7.9]
  #4 ang=  -3° d=1.00m pos=(0.86,2.47) score=+35.8 [O=+2.3 U=+28.0 V=-0.0 W=-0.0 R=-2.7 F=+8.0]
  #5 ang= +15° d=1.50m pos=(0.58,3.04) score=+32.9 [O=+1.6 U=+24.1 V=-0.0 W=-1.0 R=-0.0 F=+7.8]
  #6 ang=  +3° d=1.00m pos=(0.76,2.51) score=+31.8 [O=+2.2 U=+24.0 V=-0.0 W=-0.0 R=-2.7 F=+8.0]
  #7 ang=  +9° d=1.00m pos=(0.65,2.53) score=+27.6 [O=+2.1 U=+20.0 V=-0.0 W=-0.0 R=-2.7 F=+7.9]
  #8 ang= +15° d=1.00m pos=(0.55,2.54) score=+23.2 [O=+2.1 U=+16.0 V=-0.0 W=-3.0 R=-0.0 F=+7.8]
[ 29.5s] [GOAL] Selected: (1.05, 2.94) dist=1.50m timeout=42s angle=-3° reason=reached
[135] DRIVE goal=(1.05,2.94) dist=1.50m front=0.60m cells=7 rms=2.9cm[136] DRIVE goal=(1.05,2.94) dist=1.49m front=0.97m cells=7 rms=2.9cm[137] DRIVE goal=(1.05,2.94) dist=1.48m front=0.59m cells=7 rms=2.9cm[138] DRIVE goal=(1.05,2.94) dist=1.46m front=0.93m cells=7 rms=2.9cm[139] DRIVE goal=(1.05,2.94) dist=1.44m front=0.93m cells=7 rms=2.9cm[140] DRIVE goal=(1.05,2.94) dist=1.42m front=0.93m cells=7 rms=2.9cm[141] DRIVE goal=(1.05,2.94) dist=1.40m front=0.91m cells=7 rms=2.9cm[142] DRIVE goal=(1.05,2.94) dist=1.38m front=0.91m cells=7 rms=2.9cm[143] DRIVE goal=(1.05,2.94) dist=1.37m front=0.91m cells=7 rms=2.8cm[144] DRIVE goal=(1.05,2.94) dist=1.34m front=0.89m cells=7 rms=2.8cm[145] DRIVE goal=(1.05,2.94) dist=1.32m front=0.88m cells=7 rms=2.8cm[146] DRIVE goal=(1.05,2.94) dist=1.30m front=0.86m cells=7 rms=2.8cm[147] DRIVE goal=(1.05,2.94) dist=1.28m front=0.86m cells=7 rms=2.8cm[148] DRIVE goal=(1.05,2.94) dist=1.27m front=0.85m cells=7 rms=2.8cm[149] DRIVE goal=(1.05,2.94) dist=1.24m front=0.85m cells=7 rms=2.8cm[150] DRIVE goal=(1.05,2.94) dist=1.22m front=0.84m cells=8 rms=2.8cm[151] DRIVE goal=(1.05,2.94) dist=1.21m front=0.84m cells=8 rms=2.8cm[152] DRIVE goal=(1.05,2.94) dist=1.18m front=0.82m cells=8 rms=2.8cm[153] DRIVE goal=(1.05,2.94) dist=1.16m front=0.81m cells=9 rms=2.8cm[154] DRIVE goal=(1.05,2.94) dist=1.15m front=0.81m cells=9 rms=2.8cm[155] DRIVE goal=(1.05,2.94) dist=1.13m front=0.80m cells=9 rms=2.8cm[156] DRIVE goal=(1.05,2.94) dist=1.11m front=0.79m cells=9 rms=2.8cm[157] DRIVE goal=(1.05,2.94) dist=1.09m front=0.79m cells=9 rms=2.7cm[158] DRIVE goal=(1.05,2.94) dist=1.07m front=0.78m cells=9 rms=2.7cm[159] DRIVE goal=(1.05,2.94) dist=1.06m front=0.78m cells=9 rms=2.7cm[160] DRIVE goal=(1.05,2.94) dist=1.05m front=0.78m cells=9 rms=2.7cm[161] DRIVE goal=(1.05,2.94) dist=1.03m front=0.77m cells=9 rms=2.7cm[162] DRIVE goal=(1.05,2.94) dist=1.00m front=0.75m cells=9 rms=2.7cm[163] DRIVE goal=(1.05,2.94) dist=0.99m front=0.75m cells=9 rms=2.7cm[164] DRIVE goal=(1.05,2.94) dist=0.97m front=0.74m cells=9 rms=2.7cm[165] DRIVE goal=(1.05,2.94) dist=0.95m front=0.73m cells=9 rms=2.7cm[166] DRIVE goal=(1.05,2.94) dist=0.93m front=0.73m cells=9 rms=2.7cm[167] DRIVE goal=(1.05,2.94) dist=0.91m front=0.72m cells=10 rms=2.7cm[168] DRIVE goal=(1.05,2.94) dist=0.89m front=0.71m cells=10 rms=2.7cm[169] DRIVE goal=(1.05,2.94) dist=0.87m front=0.69m cells=10 rms=2.7cm[170] DRIVE goal=(1.05,2.94) dist=0.86m front=0.69m cells=10 rms=2.7cm[171] DRIVE goal=(1.05,2.94) dist=0.85m front=0.70m cells=10 rms=2.7cm[172] DRIVE goal=(1.05,2.94) dist=0.82m front=1.40m cells=10 rms=2.7cm[173] DRIVE goal=(1.05,2.94) dist=0.80m front=1.36m cells=10 rms=2.7cm[174] DRIVE goal=(1.05,2.94) dist=0.77m front=1.33m cells=10 rms=2.7cm[175] DRIVE goal=(1.05,2.94) dist=0.75m front=1.33m cells=10 rms=2.7cm[176] DRIVE goal=(1.05,2.94) dist=0.75m front=1.32m cells=10 rms=2.7cm[177] DRIVE goal=(1.05,2.94) dist=0.75m front=1.32m cells=10 rms=2.8cm[178] DRIVE goal=(1.05,2.94) dist=0.72m front=1.30m cells=10 rms=2.8cm[179] DRIVE goal=(1.05,2.94) dist=0.72m front=1.29m cells=10 rms=2.8cm[180] DRIVE goal=(1.05,2.94) dist=0.70m front=1.28m cells=10 rms=2.8cm[181] DRIVE goal=(1.05,2.94) dist=0.68m front=1.26m cells=10 rms=2.8cm[182] DRIVE goal=(1.05,2.94) dist=0.67m front=1.25m cells=10 rms=2.8cm[183] DRIVE goal=(1.05,2.94) dist=0.66m front=1.24m cells=10 rms=2.8cm[184] DRIVE goal=(1.05,2.94) dist=0.64m front=1.23m cells=10 rms=2.9cm[185] DRIVE goal=(1.05,2.94) dist=0.64m front=1.21m cells=10 rms=2.9cm[186] DRIVE goal=(1.05,2.94) dist=0.63m front=1.21m cells=10 rms=2.9cm[187] DRIVE goal=(1.05,2.94) dist=0.63m front=1.21m cells=10 rms=2.9cm[188] DRIVE goal=(1.05,2.94) dist=0.63m front=1.20m cells=10 rms=2.9cm[189] DRIVE goal=(1.05,2.94) dist=0.62m front=1.20m cells=10 rms=3.0cm[190] DRIVE goal=(1.05,2.94) dist=0.62m front=1.19m cells=10 rms=3.0cm[191] DRIVE goal=(1.05,2.94) dist=0.61m front=0.53m cells=10 rms=3.0cm[192] DRIVE goal=(1.05,2.94) dist=0.60m front=0.52m cells=11 rms=3.0cm[193] DRIVE goal=(1.05,2.94) dist=0.58m front=0.50m cells=11 rms=3.1cm[194] DRIVE goal=(1.05,2.94) dist=0.56m front=0.48m cells=11 rms=3.1cm[195] DRIVE goal=(1.05,2.94) dist=0.56m front=0.48m cells=11 rms=3.1cm[196] DRIVE goal=(1.05,2.94) dist=0.54m front=0.47m cells=11 rms=3.1cm[197] DRIVE goal=(1.05,2.94) dist=0.53m front=0.46m cells=11 rms=3.1cm[198] DRIVE goal=(1.05,2.94) dist=0.52m front=0.46m cells=11 rms=3.1cm[199] DRIVE goal=(1.05,2.94) dist=0.51m front=0.46m cells=11 rms=3.1cm[200] DRIVE goal=(1.05,2.94) dist=0.49m front=0.45m cells=11 rms=3.1cm[201] DRIVE goal=(1.05,2.94) dist=0.48m front=1.07m cells=11 rms=3.1cm[202] DRIVE goal=(1.05,2.94) dist=0.48m front=1.06m cells=11 rms=3.1cm[203] DRIVE goal=(1.05,2.94) dist=0.47m front=1.05m cells=11 rms=3.1cm[204] DRIVE goal=(1.05,2.94) dist=0.46m front=1.04m cells=11 rms=3.1cm[205] DRIVE goal=(1.05,2.94) dist=0.44m front=1.02m cells=11 rms=3.1cm[206] DRIVE goal=(1.05,2.94) dist=0.43m front=1.01m cells=11 rms=3.1cm[207] DRIVE goal=(1.05,2.94) dist=0.41m front=0.99m cells=11 rms=3.1cm
[ 44.2s] [GOAL SELECT] robot@(0.89,2.59) | 26 candidates (scanned=157 walls=79 visited=11):
  #1 ang= +45° d=2.00m pos=(0.30,4.50) score=+44.4 [O=+1.7 U=+35.6 V=-0.0 W=-0.0 R=-0.0 F=+6.5] <-- BEST
  #2 ang= -33° d=1.50m pos=(2.22,3.29) score=+41.4 [O=+2.0 U=+34.2 V=-0.0 W=-1.0 R=-0.0 F=+5.8]
  #3 ang= -39° d=1.50m pos=(2.28,3.14) score=+38.6 [O=+2.0 U=+32.0 V=-0.0 W=-1.0 R=-0.0 F=+5.1]
  #4 ang= -21° d=1.00m pos=(1.65,3.23) score=+38.4 [O=+2.0 U=+30.3 V=-0.0 W=-1.0 R=-0.0 F=+6.8]
  #5 ang=  +3° d=0.50m pos=(1.10,3.04) score=+35.3 [O=+1.7 U=+34.1 V=-0.0 W=-1.0 R=-7.5 F=+7.9]
  #6 ang=  +9° d=0.50m pos=(1.05,3.06) score=+35.3 [O=+1.6 U=+34.1 V=-0.0 W=-1.0 R=-7.5 F=+8.0]
  #7 ang=  -3° d=0.50m pos=(1.15,3.02) score=+35.3 [O=+1.8 U=+34.1 V=-0.0 W=-1.0 R=-7.5 F=+7.8]
  #8 ang= +15° d=0.50m pos=(1.00,3.08) score=+35.1 [O=+1.5 U=+34.0 V=-0.0 W=-1.0 R=-7.5 F=+8.0]
[ 44.2s] [GOAL] Selected: (0.30, 4.50) dist=2.00m timeout=50s angle=45° reason=reached
[208] DRIVE goal=(0.30,4.50) dist=2.00m front=0.97m cells=11 rms=3.1cm[209] DRIVE goal=(0.30,4.50) dist=2.00m front=0.94m cells=11 rms=3.1cm[210] DRIVE goal=(0.30,4.50) dist=1.97m front=0.93m cells=12 rms=3.1cm[211] DRIVE goal=(0.30,4.50) dist=1.97m front=0.92m cells=12 rms=3.1cm[212] DRIVE goal=(0.30,4.50) dist=1.96m front=0.91m cells=12 rms=3.1cm[213] DRIVE goal=(0.30,4.50) dist=1.96m front=0.91m cells=12 rms=3.1cm[214] DRIVE goal=(0.30,4.50) dist=1.96m front=0.91m cells=12 rms=3.1cm[215] DRIVE goal=(0.30,4.50) dist=1.96m front=0.91m cells=12 rms=3.1cm[216] DRIVE goal=(0.30,4.50) dist=1.96m front=0.91m cells=12 rms=3.1cm[217] DRIVE goal=(0.30,4.50) dist=1.96m front=0.91m cells=12 rms=3.1cm[218] DRIVE goal=(0.30,4.50) dist=1.96m front=0.91m cells=12 rms=3.1cm[219] DRIVE goal=(0.30,4.50) dist=1.96m front=0.91m cells=12 rms=3.1cm[220] DRIVE goal=(0.30,4.50) dist=1.96m front=0.91m cells=12 rms=3.1cm[221] DRIVE goal=(0.30,4.50) dist=1.96m front=0.91m cells=12 rms=3.1cm[222] DRIVE goal=(0.30,4.50) dist=1.95m front=0.90m cells=12 rms=3.1cm[223] DRIVE goal=(0.30,4.50) dist=1.95m front=0.90m cells=12 rms=3.1cm[224] DRIVE goal=(0.30,4.50) dist=1.94m front=0.89m cells=12 rms=3.1cm[225] DRIVE goal=(0.30,4.50) dist=1.93m front=0.89m cells=12 rms=3.1cm[226] DRIVE goal=(0.30,4.50) dist=1.93m front=0.88m cells=12 rms=3.1cm[227] DRIVE goal=(0.30,4.50) dist=1.91m front=0.87m cells=12 rms=3.1cm[228] DRIVE goal=(0.30,4.50) dist=1.90m front=0.85m cells=13 rms=3.1cm[229] DRIVE goal=(0.30,4.50) dist=1.88m front=0.84m cells=14 rms=3.2cm[230] DRIVE goal=(0.30,4.50) dist=1.86m front=0.82m cells=14 rms=3.2cm[231] DRIVE goal=(0.30,4.50) dist=1.84m front=0.80m cells=14 rms=3.2cm[232] DRIVE goal=(0.30,4.50) dist=1.83m front=0.79m cells=14 rms=3.2cm[233] DRIVE goal=(0.30,4.50) dist=1.80m front=0.77m cells=14 rms=3.2cm[234] DRIVE goal=(0.30,4.50) dist=1.78m front=0.75m cells=14 rms=3.2cm[235] DRIVE goal=(0.30,4.50) dist=1.76m front=0.74m cells=14 rms=3.2cm[236] DRIVE goal=(0.30,4.50) dist=1.75m front=0.72m cells=14 rms=3.2cm[237] DRIVE goal=(0.30,4.50) dist=1.73m front=0.70m cells=14 rms=3.2cm[238] DRIVE goal=(0.30,4.50) dist=1.71m front=0.69m cells=14 rms=3.2cm[239] DRIVE goal=(0.30,4.50) dist=1.69m front=0.67m cells=14 rms=3.2cm[240] DRIVE goal=(0.30,4.50) dist=1.67m front=0.66m cells=14 rms=3.3cm[241] DRIVE goal=(0.30,4.50) dist=1.65m front=0.64m cells=14 rms=3.3cm[242] DRIVE goal=(0.30,4.50) dist=1.63m front=0.63m cells=14 rms=3.3cm[243] DRIVE goal=(0.30,4.50) dist=1.61m front=0.62m cells=14 rms=3.3cm[244] DRIVE goal=(0.30,4.50) dist=1.59m front=0.61m cells=14 rms=3.3cm[245] DRIVE goal=(0.30,4.50) dist=1.57m front=0.61m cells=15 rms=3.3cm[246] DRIVE goal=(0.30,4.50) dist=1.55m front=0.60m cells=15 rms=3.3cm[247] DRIVE goal=(0.30,4.50) dist=1.54m front=0.59m cells=15 rms=3.3cm[248] DRIVE goal=(0.30,4.50) dist=1.52m front=0.59m cells=15 rms=3.3cm[249] DRIVE goal=(0.30,4.50) dist=1.50m front=0.59m cells=15 rms=3.3cm[250] DRIVE goal=(0.30,4.50) dist=1.47m front=0.59m cells=15 rms=3.3cm[251] DRIVE goal=(0.30,4.50) dist=1.46m front=0.57m cells=15 rms=3.3cm[252] DRIVE goal=(0.30,4.50) dist=1.44m front=0.57m cells=15 rms=3.3cm[253] DRIVE goal=(0.30,4.50) dist=1.41m front=0.57m cells=15 rms=3.3cm[254] DRIVE goal=(0.30,4.50) dist=1.40m front=0.60m cells=15 rms=3.3cm[255] DRIVE goal=(0.30,4.50) dist=1.38m front=0.64m cells=15 rms=3.3cm[256] DRIVE goal=(0.30,4.50) dist=1.36m front=0.65m cells=15 rms=3.3cm[257] DRIVE goal=(0.30,4.50) dist=1.34m front=0.68m cells=15 rms=3.3cm[258] DRIVE goal=(0.30,4.50) dist=1.32m front=0.66m cells=15 rms=3.3cm[259] DRIVE goal=(0.30,4.50) dist=1.30m front=0.69m cells=15 rms=3.3cm[260] DRIVE goal=(0.30,4.50) dist=1.28m front=0.70m cells=15 rms=3.3cm[261] DRIVE goal=(0.30,4.50) dist=1.26m front=0.73m cells=16 rms=3.3cm[262] DRIVE goal=(0.30,4.50) dist=1.25m front=0.76m cells=16 rms=3.3cm[263] DRIVE goal=(0.30,4.50) dist=1.23m front=0.75m cells=16 rms=3.3cm[264] DRIVE goal=(0.30,4.50) dist=1.21m front=0.78m cells=16 rms=3.3cm[265] DRIVE goal=(0.30,4.50) dist=1.19m front=0.78m cells=16 rms=3.3cm[266] DRIVE goal=(0.30,4.50) dist=1.17m front=0.82m cells=16 rms=3.3cm[267] DRIVE goal=(0.30,4.50) dist=1.15m front=0.82m cells=16 rms=3.3cm[268] DRIVE goal=(0.30,4.50) dist=1.13m front=0.80m cells=16 rms=3.3cm[269] DRIVE goal=(0.30,4.50) dist=1.12m front=0.79m cells=16 rms=3.3cm[270] DRIVE goal=(0.30,4.50) dist=1.09m front=0.81m cells=16 rms=3.3cm[271] DRIVE goal=(0.30,4.50) dist=1.07m front=0.78m cells=16 rms=3.3cm[272] DRIVE goal=(0.30,4.50) dist=1.06m front=0.80m cells=16 rms=3.3cm[273] DRIVE goal=(0.30,4.50) dist=1.04m front=0.76m cells=16 rms=3.3cm[274] DRIVE goal=(0.30,4.50) dist=1.01m front=0.78m cells=16 rms=3.3cm[275] DRIVE goal=(0.30,4.50) dist=1.00m front=0.75m cells=16 rms=3.3cm[276] DRIVE goal=(0.30,4.50) dist=0.98m front=0.77m cells=17 rms=3.3cm[277] DRIVE goal=(0.30,4.50) dist=0.96m front=0.75m cells=17 rms=3.2cm[278] DRIVE goal=(0.30,4.50) dist=0.95m front=0.75m cells=17 rms=3.2cm[279] DRIVE goal=(0.30,4.50) dist=0.95m front=0.75m cells=17 rms=3.2cm[280] DRIVE goal=(0.30,4.50) dist=0.94m front=0.65m cells=18 rms=3.2cm[281] DRIVE goal=(0.30,4.50) dist=0.93m front=0.54m cells=18 rms=3.2cm[282] DRIVE goal=(0.30,4.50) dist=0.93m front=0.55m cells=18 rms=3.2cm[283] DRIVE goal=(0.30,4.50) dist=0.93m front=0.54m cells=18 rms=3.2cm[284] DRIVE goal=(0.30,4.50) dist=0.93m front=0.56m cells=18 rms=3.2cm[285] DRIVE goal=(0.30,4.50) dist=0.93m front=0.53m cells=18 rms=3.2cm[286] DRIVE goal=(0.30,4.50) dist=0.94m front=0.56m cells=18 rms=3.2cm[287] DRIVE goal=(0.30,4.50) dist=0.93m front=0.53m cells=18 rms=3.2cm[288] DRIVE goal=(0.30,4.50) dist=0.93m front=0.55m cells=18 rms=3.2cm[289] DRIVE goal=(0.30,4.50) dist=0.94m front=0.55m cells=18 rms=3.2cm[290] DRIVE goal=(0.30,4.50) dist=0.93m front=0.54m cells=18 rms=3.2cm[291] DRIVE goal=(0.30,4.50) dist=0.94m front=0.55m cells=18 rms=3.2cm[292] DRIVE goal=(0.30,4.50) dist=0.94m front=0.55m cells=18 rms=3.2cm[293] DRIVE goal=(0.30,4.50) dist=0.94m front=0.54m cells=18 rms=3.2cm[294] DRIVE goal=(0.30,4.50) dist=0.93m front=0.54m cells=18 rms=3.2cm[295] DRIVE goal=(0.30,4.50) dist=0.93m front=0.54m cells=18 rms=3.1cm[296] DRIVE goal=(0.30,4.50) dist=0.93m front=0.56m cells=18 rms=3.1cm[297] DRIVE goal=(0.30,4.50) dist=0.93m front=0.55m cells=18 rms=3.1cm[298] DRIVE goal=(0.30,4.50) dist=0.94m front=0.55m cells=18 rms=3.1cm[299] DRIVE goal=(0.30,4.50) dist=0.94m front=0.55m cells=18 rms=3.1cm[300] DRIVE goal=(0.30,4.50) dist=0.93m front=0.56m cells=18 rms=3.1cm[301] DRIVE goal=(0.30,4.50) dist=0.93m front=0.55m cells=18 rms=3.1cm[302] DRIVE goal=(0.30,4.50) dist=0.93m front=0.54m cells=18 rms=3.1cm[303] DRIVE goal=(0.30,4.50) dist=0.94m front=0.55m cells=18 rms=3.1cm[304] DRIVE goal=(0.30,4.50) dist=0.93m front=0.54m cells=18 rms=3.1cm[305] DRIVE goal=(0.30,4.50) dist=0.94m front=0.55m cells=18 rms=3.1cm[306] DRIVE goal=(0.30,4.50) dist=0.93m front=0.54m cells=18 rms=3.1cm[307] DRIVE goal=(0.30,4.50) dist=0.93m front=0.56m cells=18 rms=3.1cm[308] DRIVE goal=(0.30,4.50) dist=0.93m front=0.54m cells=18 rms=3.1cm[309] DRIVE goal=(0.30,4.50) dist=0.93m front=0.55m cells=18 rms=3.1cm
[ 64.6s] [DRIVE STUCK] Goal distance unchanged for 7.0s
[DRIVE STUCK] dist_oldest=1.00m, dist_now=0.93m, change=0.06m < margin=0.08m
[DRIVE STUCK] Front sectors: s55=0.57 s56=0.67 s57=0.79 s58=1.00 s59=1.43 s0=1.85 s1=1.90 s2=2.70 s3=2.74 s4=2.80 s5=2.89 
[DRIVE STUCK] Marked front sectors [55, 56, 57, 58, 59, 0, 1, 2, 3, 4, 5] as blocked for 30s

[BACKUP CLEAR] Reversing and turning toward clearer side...
[BACKUP CLEAR] Turning left (L_avg=2.61m R_avg=0.89m)

[ 69.4s] [REFINE] best score -60.0 < 20.0, resampling with 150 angles (level 1)

[ 69.4s] [REFINE] best score -56.0 < 20.0, resampling with 450 angles (level 2)

[ 69.4s] [REFINE] best score -56.0 < 20.0, resampling with 1350 angles (level 3)

[ 69.5s] [GOAL SELECT] robot@(0.59,3.49) | 475 candidates (refined 3x) (scanned=197 walls=117 visited=18):
  #1 ang= -29° d=1.50m pos=(0.83,4.97) score=-56.0 [O=+2.5 U=+36.1 V=-0.0 W=-3.0 R=-0.0 F=+8.0 B=-100.0] <-- BEST
  #2 ang= -29° d=1.50m pos=(0.82,4.97) score=-56.0 [O=+2.5 U=+36.1 V=-0.0 W=-3.0 R=-0.0 F=+8.0 B=-100.0]
  #3 ang= -29° d=1.50m pos=(0.82,4.97) score=-56.0 [O=+2.5 U=+36.1 V=-0.0 W=-3.0 R=-0.0 F=+8.0 B=-100.0]
  #4 ang= -29° d=1.50m pos=(0.81,4.97) score=-56.0 [O=+2.5 U=+36.1 V=-0.0 W=-3.0 R=-0.0 F=+8.0 B=-100.0]
  #5 ang= -28° d=1.50m pos=(0.81,4.97) score=-56.0 [O=+2.5 U=+36.1 V=-0.0 W=-3.0 R=-0.0 F=+8.0 B=-100.0]
  #6 ang= -28° d=1.50m pos=(0.80,4.97) score=-56.0 [O=+2.5 U=+36.1 V=-0.0 W=-3.0 R=-0.0 F=+8.0 B=-100.0]
  #7 ang= -28° d=1.50m pos=(0.79,4.97) score=-56.0 [O=+2.5 U=+36.1 V=-0.0 W=-3.0 R=-0.0 F=+8.0 B=-100.0]
  #8 ang= -28° d=1.50m pos=(0.79,4.98) score=-56.0 [O=+2.5 U=+36.1 V=-0.0 W=-3.0 R=-0.0 F=+8.0 B=-100.0]
[ 69.5s] [GOAL] Selected: (0.83, 4.97) dist=1.50m timeout=42s angle=-29° reason=no goal
[311] DRIVE goal=(0.83,4.97) dist=1.50m front=0.71m cells=18 rms=3.1cm
[ 69.7s] [TURN ENTER] Entering TURN mode

[BLOCKED DEBUG] Goal angle: -33.5° (sector 54), goal_dist: 1.51m, goal_dir_min: 0.89m, margin: 0.15m
[BLOCKED DEBUG] Checking 1 sectors (robot angular width at 1.5m = 6.8°): {54: 0.887}
[BLOCKED DEBUG] Check: 0.89 < 1.51 - 0.15 = 1.36? True
[BLOCKED DEBUG] (Full front arc for reference: {55: 1.684, 56: 1.837, 57: 1.908, 58: 2.851, 59: 2.878, 0: 2.943, 1: 3.025, 2: 3.116, 3: 0.861, 4: 0.76, 5: 0.681})

[BLOCKED TURN] goal_sector=54, best_sector=54 (dist=0.89m), target_angle=-36.0°, angle_error=-36.0°, v=0.00, w=-0.50
[312] TURN goal=(0.83,4.97) dist=1.51m front=0.68m cells=18 rms=3.1cm[313] TURN goal=(0.83,4.97) dist=1.51m front=0.70m cells=18 rms=3.1cm[314] TURN goal=(0.83,4.97) dist=1.51m front=0.70m cells=18 rms=3.1cm[315] TURN goal=(0.83,4.97) dist=1.51m front=0.70m cells=18 rms=3.0cm[316] TURN goal=(0.83,4.97) dist=1.51m front=0.78m cells=18 rms=3.0cm[317] TURN goal=(0.83,4.97) dist=1.51m front=0.78m cells=18 rms=3.0cm[318] TURN goal=(0.83,4.97) dist=1.51m front=0.80m cells=18 rms=3.0cm[319] TURN goal=(0.83,4.97) dist=1.51m front=0.81m cells=18 rms=3.0cm[320] DRIVE goal=(0.83,4.97) dist=1.51m front=0.76m cells=18 rms=3.0cm
[ 71.6s] [TURN ENTER] Entering TURN mode

[BLOCKED DEBUG] Goal angle: -24.4° (sector 55), goal_dist: 1.51m, goal_dir_min: 0.79m, margin: 0.15m
[BLOCKED DEBUG] Checking 1 sectors (robot angular width at 1.5m = 6.8°): {55: 0.787}
[BLOCKED DEBUG] Check: 0.79 < 1.51 - 0.15 = 1.36? True
[BLOCKED DEBUG] (Full front arc for reference: {55: 0.787, 56: 5.0, 57: 1.687, 58: 1.862, 59: 1.958, 0: 2.866, 1: 2.921, 2: 2.984, 3: 3.085, 4: 3.188, 5: 0.834})

[BLOCKED TURN] goal_sector=55, best_sector=55 (dist=0.79m), target_angle=-30.0°, angle_error=-30.0°, v=0.00, w=-0.50
[321] TURN goal=(0.83,4.97) dist=1.51m front=0.79m cells=18 rms=3.0cm[322] TURN goal=(0.83,4.97) dist=1.51m front=0.77m cells=18 rms=3.0cm[323] DRIVE goal=(0.83,4.97) dist=1.51m front=0.77m cells=18 rms=3.0cm
[ 72.2s] [TURN ENTER] Entering TURN mode

[BLOCKED DEBUG] Goal angle: -20.2° (sector 56), goal_dist: 1.51m, goal_dir_min: 0.84m, margin: 0.15m
[BLOCKED DEBUG] Checking 1 sectors (robot angular width at 1.5m = 6.8°): {56: 0.843}
[BLOCKED DEBUG] Check: 0.84 < 1.51 - 0.15 = 1.36? True
[BLOCKED DEBUG] (Full front arc for reference: {55: 0.691, 56: 0.843, 57: 5.0, 58: 1.86, 59: 1.898, 0: 2.853, 1: 2.873, 2: 2.934, 3: 3.009, 4: 3.109, 5: 0.879})

[BLOCKED TURN] goal_sector=56, best_sector=56 (dist=0.84m), target_angle=-24.0°, angle_error=-24.0°, v=0.00, w=-0.50
[324] TURN goal=(0.83,4.97) dist=1.51m front=0.69m cells=18 rms=3.0cm[325] TURN goal=(0.83,4.97) dist=1.51m front=0.58m cells=18 rms=3.0cm[326] TURN goal=(0.83,4.97) dist=1.51m front=0.58m cells=18 rms=3.0cm[327] TURN goal=(0.83,4.97) dist=1.51m front=0.57m cells=18 rms=3.0cm[328] TURN goal=(0.83,4.97) dist=1.52m front=0.55m cells=18 rms=3.0cm[329] TURN goal=(0.83,4.97) dist=1.52m front=0.52m cells=18 rms=3.0cm[330] TURN goal=(0.83,4.97) dist=1.52m front=0.53m cells=18 rms=3.0cm[331] DRIVE goal=(0.83,4.97) dist=1.52m front=0.53m cells=18 rms=3.0cm
[ 73.8s] [TURN ENTER] Entering TURN mode

[BLOCKED DEBUG] Goal angle: -11.6° (sector 58), goal_dist: 1.52m, goal_dir_min: 0.91m, margin: 0.15m
[BLOCKED DEBUG] Checking 1 sectors (robot angular width at 1.5m = 6.8°): {58: 0.911}
[BLOCKED DEBUG] Check: 0.91 < 1.52 - 0.15 = 1.37? True
[BLOCKED DEBUG] (Full front arc for reference: {55: 0.523, 56: 0.604, 57: 0.73, 58: 0.911, 59: 1.327, 0: 1.868, 1: 1.915, 2: 2.871, 3: 2.905, 4: 2.962, 5: 3.07})

[BLOCKED TURN] goal_sector=58, best_sector=58 (dist=0.91m), target_angle=-12.0°, angle_error=-12.0°, v=0.00, w=-0.31
[332] TURN goal=(0.83,4.97) dist=1.52m front=0.52m cells=18 rms=3.0cm[333] TURN goal=(0.83,4.97) dist=1.52m front=0.52m cells=18 rms=3.0cm[334] TURN goal=(0.83,4.97) dist=1.51m front=0.47m cells=18 rms=3.0cm[335] TURN goal=(0.83,4.97) dist=1.52m front=0.47m cells=18 rms=3.0cm[336] TURN goal=(0.83,4.97) dist=1.52m front=0.47m cells=18 rms=3.0cm[337] TURN goal=(0.83,4.97) dist=1.52m front=0.47m cells=18 rms=2.9cm[338] TURN goal=(0.83,4.97) dist=1.51m front=0.46m cells=18 rms=2.9cm[339] TURN goal=(0.83,4.97) dist=1.51m front=0.45m cells=18 rms=2.9cm[340] TURN goal=(0.83,4.97) dist=1.50m front=0.44m cells=18 rms=2.9cm[341] TURN goal=(0.83,4.97) dist=1.48m front=0.43m cells=18 rms=2.9cm[342] TURN goal=(0.83,4.97) dist=1.47m front=0.43m cells=18 rms=2.9cm[343] TURN goal=(0.83,4.97) dist=1.46m front=0.42m cells=18 rms=2.9cm[344] TURN goal=(0.83,4.97) dist=1.44m front=0.41m cells=18 rms=2.9cm[345] TURN goal=(0.83,4.97) dist=1.43m front=0.40m cells=18 rms=2.9cm[346] TURN goal=(0.83,4.97) dist=1.43m front=0.39m cells=18 rms=2.9cm[347] TURN goal=(0.83,4.97) dist=1.41m front=0.39m cells=18 rms=2.9cm[348] TURN goal=(0.83,4.97) dist=1.40m front=0.38m cells=18 rms=2.9cm[349] TURN goal=(0.83,4.97) dist=1.39m front=0.38m cells=18 rms=2.9cm[350] TURN goal=(0.83,4.97) dist=1.38m front=0.37m cells=19 rms=2.9cm[351] TURN goal=(0.83,4.97) dist=1.38m front=0.39m cells=19 rms=2.9cm[352] TURN goal=(0.83,4.97) dist=1.37m front=0.43m cells=19 rms=2.9cm[353] TURN goal=(0.83,4.97) dist=1.36m front=0.46m cells=19 rms=2.9cm[354] TURN goal=(0.83,4.97) dist=1.37m front=0.47m cells=19 rms=2.9cm[355] TURN goal=(0.83,4.97) dist=1.37m front=0.47m cells=19 rms=2.9cm[356] TURN goal=(0.83,4.97) dist=1.37m front=0.46m cells=19 rms=2.9cm[357] TURN goal=(0.83,4.97) dist=1.37m front=0.47m cells=19 rms=2.9cm
[ 78.9s] [TURN STUCK] In TURN mode for 5.2s, backing up
[TURN STUCK] Position history (26 samples):
  First: (0.59, 3.46) heading=92.3°
  Mid:   (0.61, 3.56) heading=79.9°
  Last:  (0.62, 3.62) heading=92.6°
  Movement: 0.155m, heading change: 0.4°
[TURN STUCK] Current front sectors: s55=0.46 s56=0.53 s57=0.63 s58=0.77 s59=5.00 s0=1.82 s1=1.84 s2=2.69 s3=2.71 s4=2.78 s5=2.86 

[BACKUP CLEAR] Reversing and turning toward clearer side...
[BACKUP CLEAR] Turning left (L_avg=2.58m R_avg=1.48m)

[ 83.7s] [GOAL SELECT] robot@(0.62,3.55) | 18 candidates (scanned=200 walls=124 visited=19):
  #1 ang= -94° d=1.50m pos=(2.11,3.38) score=+30.3 [O=+2.5 U=+29.9 V=-0.0 W=-3.0 R=-0.0 F=+0.5] <-- BEST
  #2 ang=-125° d=0.50m pos=(1.02,3.25) score=-11.2 [O=+1.8 U=+24.8 V=-6.4 W=-3.0 R=-1.0 F=-3.7 T=-23.9]
  #3 ang=-119° d=0.50m pos=(1.05,3.29) score=-11.5 [O=+2.0 U=+19.0 V=-6.4 W=-3.0 R=-1.0 F=-2.9 T=-19.3]
  #4 ang= +39° d=0.50m pos=(0.31,3.94) score=-48.9 [O=+2.5 U=+16.4 V=-4.3 W=-3.0 R=-0.0 F=+5.4 B=-50.0 T=-16.0]
  #5 ang= +33° d=2.00m pos=(-0.45,5.24) score=-58.2 [O=+1.9 U=+33.3 V=-0.0 W=-0.0 R=-0.0 F=+6.0 B=-100.0]
  #6 ang= +33° d=1.50m pos=(-0.18,4.82) score=-72.3 [O=+2.4 U=+26.1 V=-0.0 W=-0.0 R=-7.2 F=+6.0 B=-100.0]
  #7 ang= +27° d=2.00m pos=(-0.26,5.34) score=-85.8 [O=+1.9 U=+32.0 V=-0.0 W=-0.0 R=-1.7 F=+6.5 B=-125.0]
  #8 ang= +27° d=1.50m pos=(-0.04,4.89) score=-98.9 [O=+2.4 U=+24.1 V=-0.0 W=-0.0 R=-7.2 F=+6.5 B=-125.0]
[ 83.7s] [GOAL] Selected: (2.11, 3.38) dist=1.50m timeout=42s angle=-94° reason=no goal
[359] DRIVE goal=(2.11,3.38) dist=1.50m front=0.45m cells=19 rms=2.9cm[360] DRIVE goal=(2.11,3.38) dist=1.50m front=0.46m cells=19 rms=2.9cm[361] DRIVE goal=(2.11,3.38) dist=1.50m front=0.46m cells=19 rms=2.9cm[362] DRIVE goal=(2.11,3.38) dist=1.50m front=0.47m cells=19 rms=2.9cm[363] DRIVE goal=(2.11,3.38) dist=1.50m front=0.46m cells=19 rms=2.8cm[364] DRIVE goal=(2.11,3.38) dist=1.50m front=0.48m cells=19 rms=2.8cm[365] DRIVE goal=(2.11,3.38) dist=1.50m front=0.44m cells=19 rms=2.8cm[366] DRIVE goal=(2.11,3.38) dist=1.50m front=0.43m cells=19 rms=2.8cm[367] DRIVE goal=(2.11,3.38) dist=1.50m front=0.43m cells=19 rms=2.8cm[368] DRIVE goal=(2.11,3.38) dist=1.50m front=0.41m cells=19 rms=2.8cm[369] DRIVE goal=(2.11,3.38) dist=1.50m front=0.40m cells=19 rms=2.8cm[370] DRIVE goal=(2.11,3.38) dist=1.50m front=0.40m cells=19 rms=2.8cm[371] DRIVE goal=(2.11,3.38) dist=1.50m front=0.38m cells=19 rms=2.8cm[372] DRIVE goal=(2.11,3.38) dist=1.50m front=0.36m cells=19 rms=2.8cm[373] DRIVE goal=(2.11,3.38) dist=1.50m front=0.34m cells=19 rms=2.8cm[374] DRIVE goal=(2.11,3.38) dist=1.51m front=0.33m cells=19 rms=2.8cm[375] DRIVE goal=(2.11,3.38) dist=1.51m front=0.33m cells=19 rms=2.8cm[376] DRIVE goal=(2.11,3.38) dist=1.51m front=0.34m cells=19 rms=2.8cm[377] DRIVE goal=(2.11,3.38) dist=1.51m front=0.34m cells=19 rms=2.8cm[378] DRIVE goal=(2.11,3.38) dist=1.52m front=0.34m cells=19 rms=2.8cm[379] DRIVE goal=(2.11,3.38) dist=1.52m front=0.35m cells=19 rms=2.8cm[380] DRIVE goal=(2.11,3.38) dist=1.52m front=0.35m cells=19 rms=2.8cm[381] DRIVE goal=(2.11,3.38) dist=1.53m front=0.36m cells=19 rms=2.8cm[382] DRIVE goal=(2.11,3.38) dist=1.54m front=0.37m cells=19 rms=2.8cm[383] DRIVE goal=(2.11,3.38) dist=1.54m front=0.38m cells=19 rms=2.9cm[384] DRIVE goal=(2.11,3.38) dist=1.55m front=0.38m cells=19 rms=2.9cm[385] DRIVE goal=(2.11,3.38) dist=1.55m front=0.39m cells=19 rms=2.9cm[386] DRIVE goal=(2.11,3.38) dist=1.56m front=0.40m cells=19 rms=2.9cm[387] DRIVE goal=(2.11,3.38) dist=1.56m front=0.40m cells=19 rms=2.9cm[388] DRIVE goal=(2.11,3.38) dist=1.56m front=0.41m cells=19 rms=3.0cm[389] DRIVE goal=(2.11,3.38) dist=1.57m front=0.42m cells=19 rms=3.0cm[390] DRIVE goal=(2.11,3.38) dist=1.57m front=0.42m cells=19 rms=3.0cm[391] DRIVE goal=(2.11,3.38) dist=1.57m front=0.42m cells=19 rms=3.1cm[392] DRIVE goal=(2.11,3.38) dist=1.57m front=0.42m cells=19 rms=3.1cm[393] DRIVE goal=(2.11,3.38) dist=1.57m front=0.42m cells=19 rms=3.1cm[394] DRIVE goal=(2.11,3.38) dist=1.57m front=0.42m cells=19 rms=3.1cm[395] DRIVE goal=(2.11,3.38) dist=1.57m front=0.42m cells=19 rms=3.2cm[396] DRIVE goal=(2.11,3.38) dist=1.57m front=0.42m cells=19 rms=3.2cm[397] DRIVE goal=(2.11,3.38) dist=1.57m front=0.42m cells=19 rms=3.2cm[398] DRIVE goal=(2.11,3.38) dist=1.57m front=0.42m cells=19 rms=3.2cm[399] DRIVE goal=(2.11,3.38) dist=1.56m front=0.42m cells=19 rms=3.3cm[400] DRIVE goal=(2.11,3.38) dist=1.56m front=0.41m cells=19 rms=3.3cm[401] DRIVE goal=(2.11,3.38) dist=1.55m front=0.41m cells=19 rms=3.3cm[402] DRIVE goal=(2.11,3.38) dist=1.54m front=0.41m cells=19 rms=3.3cm[403] DRIVE goal=(2.11,3.38) dist=1.53m front=0.40m cells=19 rms=3.4cm[404] DRIVE goal=(2.11,3.38) dist=1.51m front=0.39m cells=19 rms=3.4cm[405] DRIVE goal=(2.11,3.38) dist=1.50m front=0.38m cells=19 rms=3.4cm[406] DRIVE goal=(2.11,3.38) dist=1.48m front=0.38m cells=19 rms=3.4cm[407] DRIVE goal=(2.11,3.38) dist=1.45m front=0.39m cells=19 rms=3.4cm[408] DRIVE goal=(2.11,3.38) dist=1.43m front=0.41m cells=19 rms=3.4cm[409] DRIVE goal=(2.11,3.38) dist=1.41m front=0.39m cells=19 rms=3.4cm[410] DRIVE goal=(2.11,3.38) dist=1.40m front=0.40m cells=19 rms=3.4cm[411] DRIVE goal=(2.11,3.38) dist=1.38m front=0.44m cells=19 rms=3.5cm[412] DRIVE goal=(2.11,3.38) dist=1.36m front=0.45m cells=19 rms=3.5cm[413] DRIVE goal=(2.11,3.38) dist=1.34m front=0.46m cells=19 rms=3.5cm[414] DRIVE goal=(2.11,3.38) dist=1.32m front=0.51m cells=19 rms=3.5cm[415] DRIVE goal=(2.11,3.38) dist=1.30m front=0.50m cells=19 rms=3.5cm[416] DRIVE goal=(2.11,3.38) dist=1.28m front=0.49m cells=19 rms=3.5cm[417] DRIVE goal=(2.11,3.38) dist=1.26m front=0.48m cells=19 rms=3.5cm[418] DRIVE goal=(2.11,3.38) dist=1.24m front=0.52m cells=19 rms=3.5cm[419] DRIVE goal=(2.11,3.38) dist=1.22m front=0.54m cells=19 rms=3.5cm[420] DRIVE goal=(2.11,3.38) dist=1.20m front=0.61m cells=20 rms=3.5cm[421] DRIVE goal=(2.11,3.38) dist=1.18m front=0.60m cells=20 rms=3.5cm[422] DRIVE goal=(2.11,3.38) dist=1.16m front=0.60m cells=20 rms=3.5cm[423] DRIVE goal=(2.11,3.38) dist=1.15m front=0.61m cells=20 rms=3.5cm[424] DRIVE goal=(2.11,3.38) dist=1.12m front=0.56m cells=20 rms=3.5cm[425] DRIVE goal=(2.11,3.38) dist=1.10m front=0.57m cells=20 rms=3.5cm[426] DRIVE goal=(2.11,3.38) dist=1.09m front=0.61m cells=20 rms=3.5cm[427] DRIVE goal=(2.11,3.38) dist=1.07m front=0.62m cells=20 rms=3.5cm[428] DRIVE goal=(2.11,3.38) dist=1.05m front=0.62m cells=20 rms=3.5cm[429] DRIVE goal=(2.11,3.38) dist=1.04m front=0.68m cells=20 rms=3.5cm[430] DRIVE goal=(2.11,3.38) dist=1.03m front=0.73m cells=20 rms=3.5cm[431] DRIVE goal=(2.11,3.38) dist=0.99m front=0.71m cells=20 rms=3.5cm[432] DRIVE goal=(2.11,3.38) dist=0.98m front=0.69m cells=20 rms=3.5cm[433] DRIVE goal=(2.11,3.38) dist=0.96m front=0.69m cells=20 rms=3.5cm[434] DRIVE goal=(2.11,3.38) dist=0.94m front=0.98m cells=20 rms=3.5cm[435] DRIVE goal=(2.11,3.38) dist=0.92m front=0.98m cells=20 rms=3.5cm[436] DRIVE goal=(2.11,3.38) dist=0.91m front=1.26m cells=20 rms=3.5cm[437] DRIVE goal=(2.11,3.38) dist=0.89m front=1.25m cells=21 rms=3.5cm[438] DRIVE goal=(2.11,3.38) dist=0.88m front=1.23m cells=21 rms=3.5cm[439] DRIVE goal=(2.11,3.38) dist=0.86m front=1.22m cells=21 rms=3.5cm[440] DRIVE goal=(2.11,3.38) dist=0.84m front=1.20m cells=21 rms=3.5cm[441] DRIVE goal=(2.11,3.38) dist=0.82m front=1.19m cells=21 rms=3.5cm[442] DRIVE goal=(2.11,3.38) dist=0.80m front=1.17m cells=21 rms=3.5cm[443] DRIVE goal=(2.11,3.38) dist=0.79m front=1.16m cells=21 rms=3.5cm[444] DRIVE goal=(2.11,3.38) dist=0.78m front=1.13m cells=21 rms=3.5cm[445] DRIVE goal=(2.11,3.38) dist=0.73m front=1.12m cells=21 rms=3.5cm[446] DRIVE goal=(2.11,3.38) dist=0.71m front=1.10m cells=21 rms=3.5cm[447] DRIVE goal=(2.11,3.38) dist=0.69m front=1.09m cells=21 rms=3.5cm[448] DRIVE goal=(2.11,3.38) dist=0.67m front=1.09m cells=21 rms=3.5cm[449] DRIVE goal=(2.11,3.38) dist=0.65m front=1.20m cells=21 rms=3.5cm[450] DRIVE goal=(2.11,3.38) dist=0.63m front=1.17m cells=21 rms=3.5cm[451] DRIVE goal=(2.11,3.38) dist=0.61m front=1.15m cells=22 rms=3.5cm[452] DRIVE goal=(2.11,3.38) dist=0.59m front=1.13m cells=22 rms=3.5cm[453] DRIVE goal=(2.11,3.38) dist=0.58m front=1.12m cells=22 rms=3.5cm[454] DRIVE goal=(2.11,3.38) dist=0.56m front=1.09m cells=22 rms=3.5cm[455] DRIVE goal=(2.11,3.38) dist=0.53m front=1.07m cells=22 rms=3.5cm[456] DRIVE goal=(2.11,3.38) dist=0.50m front=1.05m cells=22 rms=3.5cm[457] DRIVE goal=(2.11,3.38) dist=0.49m front=1.04m cells=22 rms=3.5cm[458] DRIVE goal=(2.11,3.38) dist=0.48m front=1.02m cells=22 rms=3.5cm[459] DRIVE goal=(2.11,3.38) dist=0.46m front=1.00m cells=22 rms=3.5cm[460] DRIVE goal=(2.11,3.38) dist=0.44m front=0.98m cells=22 rms=3.5cm[461] DRIVE goal=(2.11,3.38) dist=0.43m front=0.98m cells=22 rms=3.5cm[462] DRIVE goal=(2.11,3.38) dist=0.42m front=0.96m cells=22 rms=3.5cm
[104.6s] [REFINE] only 4 candidates, resampling with 150 angles (level 1)

[104.6s] [GOAL SELECT] robot@(1.72,3.41) | 14 candidates (refined 1x) (scanned=255 walls=153 visited=22):
  #1 ang= +11° d=0.50m pos=(2.21,3.52) score=+23.8 [O=+2.5 U=+28.9 V=-0.0 W=-3.0 R=-9.8 F=+5.1] <-- BEST
  #2 ang=  +1° d=0.50m pos=(2.22,3.43) score=+20.6 [O=+2.5 U=+26.8 V=-0.0 W=-3.0 R=-9.8 F=+3.9]
  #3 ang=  +9° d=0.50m pos=(2.21,3.50) score=+20.5 [O=+2.5 U=+25.7 V=-0.0 W=-3.0 R=-9.8 F=+4.9]
  #4 ang=  -1° d=0.50m pos=(2.22,3.41) score=+20.4 [O=+2.5 U=+26.8 V=-0.0 W=-3.0 R=-9.8 F=+3.7]
  #5 ang=  +7° d=0.50m pos=(2.21,3.48) score=+17.4 [O=+2.5 U=+22.9 V=-0.0 W=-3.0 R=-9.8 F=+4.6]
  #6 ang= -47° d=1.00m pos=(2.42,2.69) score=+17.3 [O=+2.5 U=+20.1 V=-0.0 W=-3.0 R=-0.0 F=-2.6]
  #7 ang=  -9° d=0.50m pos=(2.21,3.34) score=+16.5 [O=+2.5 U=+24.0 V=-0.0 W=-3.0 R=-9.8 F=+2.6]
  #8 ang= -11° d=0.50m pos=(2.21,3.33) score=+16.3 [O=+2.5 U=+24.0 V=-0.0 W=-3.0 R=-9.8 F=+2.4]
[104.6s] [GOAL] Selected: (2.21, 3.52) dist=0.50m timeout=28s angle=11° reason=reached
[463] DRIVE goal=(2.21,3.52) dist=0.50m front=0.94m cells=22 rms=3.5cm[464] DRIVE goal=(2.21,3.52) dist=0.48m front=0.92m cells=22 rms=3.5cm[465] DRIVE goal=(2.21,3.52) dist=0.46m front=0.90m cells=22 rms=3.5cm[466] DRIVE goal=(2.21,3.52) dist=0.45m front=0.88m cells=22 rms=3.5cm[467] DRIVE goal=(2.21,3.52) dist=0.43m front=0.85m cells=22 rms=3.5cm
[105.6s] [GOAL SELECT] robot@(1.82,3.42) | 11 candidates (scanned=267 walls=158 visited=23):
  #1 ang= +58° d=1.50m pos=(2.28,4.85) score=+47.0 [O=+2.5 U=+37.2 V=-0.0 W=-1.0 R=-0.0 F=+7.9] <-- BEST
  #2 ang= +52° d=1.50m pos=(2.43,4.79) score=+42.9 [O=+2.5 U=+32.0 V=-0.0 W=-0.0 R=-0.0 F=+8.0]
  #3 ang= +58° d=1.00m pos=(2.13,4.38) score=+40.7 [O=+2.5 U=+30.0 V=-0.0 W=-0.0 R=-0.0 F=+7.9]
  #4 ang= +52° d=1.00m pos=(2.23,4.34) score=+36.8 [O=+2.5 U=+26.0 V=-0.0 W=-0.0 R=-0.0 F=+8.0]
  #5 ang= -76° d=1.50m pos=(2.51,2.09) score=+24.9 [O=+2.0 U=+30.0 V=-0.0 W=-3.0 R=-0.0 F=-4.6]
  #6 ang= -64° d=1.00m pos=(2.46,2.65) score=+18.9 [O=+2.5 U=+22.2 V=-0.0 W=-3.0 R=-0.0 F=-3.1]
  #7 ang=  -3° d=0.50m pos=(2.31,3.52) score=-5.7 [O=+2.5 U=+26.9 V=-3.0 W=-3.0 R=-24.2 F=+5.0 T=-10.0]
  #8 ang=  -9° d=0.50m pos=(2.32,3.46) score=-10.4 [O=+2.5 U=+22.9 V=-3.0 W=-3.0 R=-24.2 F=+4.3 T=-10.0]
[105.6s] [GOAL] Selected: (2.28, 4.85) dist=1.50m timeout=42s angle=58° reason=reached
[468] DRIVE goal=(2.28,4.85) dist=1.50m front=0.84m cells=23 rms=3.5cm[469] DRIVE goal=(2.28,4.85) dist=1.49m front=0.82m cells=23 rms=3.5cm[470] DRIVE goal=(2.28,4.85) dist=1.47m front=0.79m cells=23 rms=3.5cm[471] DRIVE goal=(2.28,4.85) dist=1.47m front=0.77m cells=23 rms=3.5cm[472] DRIVE goal=(2.28,4.85) dist=1.46m front=0.77m cells=23 rms=3.5cm[473] DRIVE goal=(2.28,4.85) dist=1.47m front=0.77m cells=23 rms=3.5cm[474] DRIVE goal=(2.28,4.85) dist=1.47m front=0.77m cells=23 rms=3.5cm[475] DRIVE goal=(2.28,4.85) dist=1.47m front=0.77m cells=23 rms=3.5cm[476] DRIVE goal=(2.28,4.85) dist=1.47m front=0.77m cells=23 rms=3.5cm[477] DRIVE goal=(2.28,4.85) dist=1.47m front=0.77m cells=23 rms=3.5cm[478] DRIVE goal=(2.28,4.85) dist=1.47m front=0.77m cells=23 rms=3.5cm[479] DRIVE goal=(2.28,4.85) dist=1.47m front=0.78m cells=23 rms=3.5cm[480] DRIVE goal=(2.28,4.85) dist=1.47m front=0.78m cells=23 rms=3.5cm[481] DRIVE goal=(2.28,4.85) dist=1.47m front=0.79m cells=23 rms=3.6cm[482] DRIVE goal=(2.28,4.85) dist=1.48m front=0.79m cells=23 rms=3.6cm[483] DRIVE goal=(2.28,4.85) dist=1.47m front=0.78m cells=23 rms=3.6cm[484] DRIVE goal=(2.28,4.85) dist=1.47m front=0.78m cells=23 rms=3.6cm[485] DRIVE goal=(2.28,4.85) dist=1.47m front=0.78m cells=23 rms=3.6cm[486] DRIVE goal=(2.28,4.85) dist=1.47m front=0.78m cells=23 rms=3.6cm[487] DRIVE goal=(2.28,4.85) dist=1.47m front=0.78m cells=23 rms=3.6cm[488] DRIVE goal=(2.28,4.85) dist=1.47m front=0.78m cells=23 rms=3.6cm[489] DRIVE goal=(2.28,4.85) dist=1.47m front=0.78m cells=23 rms=3.6cm[490] DRIVE goal=(2.28,4.85) dist=1.47m front=0.78m cells=23 rms=3.6cm[491] DRIVE goal=(2.28,4.85) dist=1.47m front=0.78m cells=23 rms=3.6cm[492] DRIVE goal=(2.28,4.85) dist=1.47m front=0.79m cells=23 rms=3.6cm[493] DRIVE goal=(2.28,4.85) dist=1.47m front=0.79m cells=23 rms=3.6cm[494] DRIVE goal=(2.28,4.85) dist=1.47m front=0.79m cells=23 rms=3.6cm[495] DRIVE goal=(2.28,4.85) dist=1.47m front=0.79m cells=23 rms=3.6cm[496] DRIVE goal=(2.28,4.85) dist=1.48m front=0.80m cells=23 rms=3.6cm[497] DRIVE goal=(2.28,4.85) dist=1.48m front=0.83m cells=23 rms=3.7cm[498] DRIVE goal=(2.28,4.85) dist=1.48m front=0.23m cells=23 rms=3.7cm[499] DRIVE goal=(2.28,4.85) dist=1.47m front=0.22m cells=23 rms=3.7cm[500] DRIVE goal=(2.28,4.85) dist=1.46m front=0.20m cells=23 rms=3.7cm[501] DRIVE goal=(2.28,4.85) dist=1.45m front=0.19m cells=23 rms=3.7cm[502] DRIVE goal=(2.28,4.85) dist=1.44m front=0.18m cells=23 rms=3.7cm[503] DRIVE goal=(2.28,4.85) dist=1.44m front=0.18m cells=23 rms=3.7cm[504] DRIVE goal=(2.28,4.85) dist=1.43m front=0.17m cells=23 rms=3.7cm[505] DRIVE goal=(2.28,4.85) dist=1.44m front=0.17m cells=23 rms=3.7cm[506] DRIVE goal=(2.28,4.85) dist=1.44m front=0.18m cells=23 rms=3.7cm[507] DRIVE goal=(2.28,4.85) dist=1.44m front=0.17m cells=23 rms=3.7cm[508] DRIVE goal=(2.28,4.85) dist=1.43m front=0.17m cells=23 rms=3.7cm[509] DRIVE goal=(2.28,4.85) dist=1.43m front=0.17m cells=23 rms=3.7cm[510] DRIVE goal=(2.28,4.85) dist=1.42m front=0.15m cells=23 rms=3.7cm
[114.4s] [BACKUP] front=0.14m

[BACKUP] Reversing...
[BACKUP] Turning right (L_openings=0 R_openings=6)

[117.9s] [GOAL SELECT] robot@(1.85,3.40) | 9 candidates (scanned=289 walls=173 visited=23):
  #1 ang=  +9° d=1.50m pos=(2.40,4.79) score=+38.0 [O=+2.5 U=+36.1 V=-0.0 W=-1.0 R=-8.0 F=+7.9] <-- BEST
  #2 ang=  +9° d=1.00m pos=(2.21,4.33) score=+36.8 [O=+2.5 U=+30.1 V=-0.0 W=-0.0 R=-4.0 F=+7.9]
  #3 ang=  +3° d=1.50m pos=(2.54,4.73) score=+34.2 [O=+2.5 U=+28.2 V=-0.0 W=-1.0 R=-4.0 F=+8.0]
  #4 ang=  +3° d=1.00m pos=(2.31,4.28) score=+27.0 [O=+2.5 U=+20.2 V=-0.0 W=-0.0 R=-4.0 F=+8.0]
  #5 ang=-107° d=1.00m pos=(2.52,2.66) score=+19.8 [O=+2.5 U=+22.7 V=-0.0 W=-3.0 R=-0.0 F=-2.7]
  #6 ang=-113° d=1.00m pos=(2.44,2.59) score=+17.4 [O=+2.5 U=+21.1 V=-0.0 W=-3.0 R=-0.0 F=-3.4]
  #7 ang= -58° d=0.50m pos=(2.35,3.41) score=+0.5 [O=+2.5 U=+28.0 V=-3.0 W=-3.0 R=-18.1 F=+4.0 T=-10.0]
  #8 ang= -52° d=0.50m pos=(2.35,3.46) score=-3.7 [O=+2.5 U=+23.1 V=-3.0 W=-3.0 R=-18.1 F=+4.7 T=-10.0]
[117.9s] [GOAL] Selected: (2.40, 4.79) dist=1.50m timeout=42s angle=9° reason=no goal
[512] DRIVE goal=(2.40,4.79) dist=1.50m front=0.85m cells=23 rms=3.7cm[513] DRIVE goal=(2.40,4.79) dist=1.50m front=0.84m cells=23 rms=3.7cm[514] DRIVE goal=(2.40,4.79) dist=1.50m front=0.84m cells=23 rms=3.7cm[515] DRIVE goal=(2.40,4.79) dist=1.50m front=0.83m cells=23 rms=3.7cm[516] DRIVE goal=(2.40,4.79) dist=1.49m front=0.83m cells=23 rms=3.7cm[517] DRIVE goal=(2.40,4.79) dist=1.48m front=0.83m cells=23 rms=3.7cm[518] DRIVE goal=(2.40,4.79) dist=1.48m front=0.84m cells=23 rms=3.7cm[519] DRIVE goal=(2.40,4.79) dist=1.47m front=0.84m cells=23 rms=3.7cm[520] DRIVE goal=(2.40,4.79) dist=1.47m front=0.83m cells=23 rms=3.7cm[521] DRIVE goal=(2.40,4.79) dist=1.45m front=0.82m cells=23 rms=3.7cm[522] DRIVE goal=(2.40,4.79) dist=1.44m front=0.81m cells=23 rms=3.7cm[523] DRIVE goal=(2.40,4.79) dist=1.42m front=0.81m cells=23 rms=3.7cm[524] DRIVE goal=(2.40,4.79) dist=1.41m front=0.78m cells=23 rms=3.7cm[525] DRIVE goal=(2.40,4.79) dist=1.39m front=0.77m cells=23 rms=3.7cm[526] DRIVE goal=(2.40,4.79) dist=1.37m front=0.76m cells=23 rms=3.7cm[527] DRIVE goal=(2.40,4.79) dist=1.36m front=0.75m cells=23 rms=3.6cm[528] DRIVE goal=(2.40,4.79) dist=1.34m front=0.76m cells=23 rms=3.6cm[529] DRIVE goal=(2.40,4.79) dist=1.34m front=0.77m cells=23 rms=3.6cm[530] DRIVE goal=(2.40,4.79) dist=1.33m front=0.78m cells=23 rms=3.6cm[531] DRIVE goal=(2.40,4.79) dist=1.32m front=0.79m cells=23 rms=3.6cm[532] DRIVE goal=(2.40,4.79) dist=1.31m front=0.81m cells=23 rms=3.7cm[533] DRIVE goal=(2.40,4.79) dist=1.31m front=0.81m cells=23 rms=3.7cm[534] DRIVE goal=(2.40,4.79) dist=1.30m front=0.81m cells=23 rms=3.7cm[535] DRIVE goal=(2.40,4.79) dist=1.30m front=1.54m cells=23 rms=3.7cm[536] DRIVE goal=(2.40,4.79) dist=1.29m front=1.52m cells=23 rms=3.7cm[537] DRIVE goal=(2.40,4.79) dist=1.29m front=1.53m cells=23 rms=3.7cm[538] DRIVE goal=(2.40,4.79) dist=1.29m front=1.52m cells=23 rms=3.7cm[539] DRIVE goal=(2.40,4.79) dist=1.29m front=1.52m cells=23 rms=3.7cm[540] DRIVE goal=(2.40,4.79) dist=1.28m front=1.52m cells=23 rms=3.7cm[541] DRIVE goal=(2.40,4.79) dist=1.28m front=1.52m cells=23 rms=3.7cm[542] DRIVE goal=(2.40,4.79) dist=1.28m front=1.52m cells=23 rms=3.7cm[543] DRIVE goal=(2.40,4.79) dist=1.28m front=1.52m cells=23 rms=3.7cm[544] DRIVE goal=(2.40,4.79) dist=1.27m front=0.30m cells=23 rms=3.7cm[545] DRIVE goal=(2.40,4.79) dist=1.27m front=0.27m cells=23 rms=3.7cm[546] DRIVE goal=(2.40,4.79) dist=1.27m front=0.28m cells=23 rms=3.7cm[547] DRIVE goal=(2.40,4.79) dist=1.27m front=0.27m cells=23 rms=3.7cm[548] DRIVE goal=(2.40,4.79) dist=1.27m front=0.25m cells=23 rms=3.7cm[549] DRIVE goal=(2.40,4.79) dist=1.26m front=0.26m cells=23 rms=3.8cm[550] DRIVE goal=(2.40,4.79) dist=1.26m front=0.27m cells=23 rms=3.8cm[551] DRIVE goal=(2.40,4.79) dist=1.27m front=0.30m cells=23 rms=3.8cm[552] DRIVE goal=(2.40,4.79) dist=1.27m front=1.51m cells=23 rms=3.8cm[553] DRIVE goal=(2.40,4.79) dist=1.28m front=1.52m cells=23 rms=3.8cm[554] DRIVE goal=(2.40,4.79) dist=1.28m front=1.51m cells=23 rms=3.8cm[555] DRIVE goal=(2.40,4.79) dist=1.27m front=0.76m cells=23 rms=3.8cm[556] DRIVE goal=(2.40,4.79) dist=1.27m front=0.75m cells=23 rms=3.8cm[557] DRIVE goal=(2.40,4.79) dist=1.26m front=0.74m cells=23 rms=3.8cm[558] DRIVE goal=(2.40,4.79) dist=1.26m front=0.75m cells=23 rms=3.8cm[559] DRIVE goal=(2.40,4.79) dist=1.24m front=0.73m cells=24 rms=3.8cm[560] DRIVE goal=(2.40,4.79) dist=1.22m front=1.44m cells=24 rms=3.8cm[561] DRIVE goal=(2.40,4.79) dist=1.21m front=1.43m cells=24 rms=3.8cm[562] DRIVE goal=(2.40,4.79) dist=1.19m front=0.72m cells=24 rms=3.8cm[563] DRIVE goal=(2.40,4.79) dist=1.18m front=0.68m cells=24 rms=3.8cm[564] DRIVE goal=(2.40,4.79) dist=1.17m front=0.67m cells=24 rms=3.9cm[565] DRIVE goal=(2.40,4.79) dist=1.16m front=0.65m cells=24 rms=3.9cm[566] DRIVE goal=(2.40,4.79) dist=1.13m front=0.63m cells=24 rms=3.9cm[567] DRIVE goal=(2.40,4.79) dist=1.11m front=0.62m cells=24 rms=3.9cm[568] DRIVE goal=(2.40,4.79) dist=1.09m front=0.60m cells=24 rms=3.9cm[569] DRIVE goal=(2.40,4.79) dist=1.06m front=0.58m cells=24 rms=3.9cm[570] DRIVE goal=(2.40,4.79) dist=1.04m front=0.57m cells=24 rms=3.9cm[571] DRIVE goal=(2.40,4.79) dist=1.04m front=0.55m cells=24 rms=3.9cm[572] DRIVE goal=(2.40,4.79) dist=1.02m front=0.54m cells=24 rms=3.9cm[573] DRIVE goal=(2.40,4.79) dist=1.01m front=0.54m cells=24 rms=3.9cm[574] DRIVE goal=(2.40,4.79) dist=1.01m front=0.54m cells=24 rms=3.9cm[575] DRIVE goal=(2.40,4.79) dist=1.01m front=0.54m cells=24 rms=3.9cm[576] DRIVE goal=(2.40,4.79) dist=1.01m front=0.53m cells=24 rms=3.9cm[577] DRIVE goal=(2.40,4.79) dist=1.01m front=0.53m cells=24 rms=3.9cm[578] DRIVE goal=(2.40,4.79) dist=1.00m front=0.52m cells=24 rms=3.9cm[579] DRIVE goal=(2.40,4.79) dist=0.99m front=0.51m cells=24 rms=3.9cm[580] DRIVE goal=(2.40,4.79) dist=0.99m front=0.51m cells=24 rms=3.9cm[581] DRIVE goal=(2.40,4.79) dist=0.98m front=0.51m cells=25 rms=3.9cm[582] DRIVE goal=(2.40,4.79) dist=0.98m front=0.50m cells=25 rms=3.9cm[583] DRIVE goal=(2.40,4.79) dist=0.97m front=0.50m cells=25 rms=3.9cm[584] DRIVE goal=(2.40,4.79) dist=0.96m front=1.19m cells=25 rms=3.9cm[585] DRIVE goal=(2.40,4.79) dist=0.95m front=1.19m cells=25 rms=4.0cm[586] DRIVE goal=(2.40,4.79) dist=0.95m front=1.18m cells=25 rms=4.0cm[587] DRIVE goal=(2.40,4.79) dist=0.93m front=1.17m cells=25 rms=4.0cm[588] DRIVE goal=(2.40,4.79) dist=0.92m front=1.15m cells=26 rms=4.0cm[589] DRIVE goal=(2.40,4.79) dist=0.90m front=1.13m cells=26 rms=4.0cm[590] DRIVE goal=(2.40,4.79) dist=0.89m front=1.13m cells=26 rms=4.0cm[591] DRIVE goal=(2.40,4.79) dist=0.87m front=1.11m cells=26 rms=4.0cm[592] DRIVE goal=(2.40,4.79) dist=0.85m front=1.12m cells=26 rms=4.0cm[593] DRIVE goal=(2.40,4.79) dist=0.84m front=1.10m cells=26 rms=4.0cm[594] DRIVE goal=(2.40,4.79) dist=0.83m front=1.08m cells=26 rms=4.0cm[595] DRIVE goal=(2.40,4.79) dist=0.81m front=1.07m cells=26 rms=4.0cm[596] DRIVE goal=(2.40,4.79) dist=0.80m front=1.05m cells=26 rms=4.0cm[597] DRIVE goal=(2.40,4.79) dist=0.79m front=1.04m cells=26 rms=4.0cm[598] DRIVE goal=(2.40,4.79) dist=0.77m front=1.02m cells=26 rms=4.0cm[599] DRIVE goal=(2.40,4.79) dist=0.75m front=1.00m cells=26 rms=4.1cm[600] DRIVE goal=(2.40,4.79) dist=0.73m front=0.98m cells=26 rms=4.1cm[601] DRIVE goal=(2.40,4.79) dist=0.71m front=0.97m cells=26 rms=4.1cm[602] DRIVE goal=(2.40,4.79) dist=0.69m front=0.95m cells=26 rms=4.1cm[603] DRIVE goal=(2.40,4.79) dist=0.68m front=0.93m cells=26 rms=4.1cm[604] DRIVE goal=(2.40,4.79) dist=0.65m front=0.91m cells=26 rms=4.1cm[605] DRIVE goal=(2.40,4.79) dist=0.63m front=0.89m cells=26 rms=4.1cm[606] DRIVE goal=(2.40,4.79) dist=0.62m front=0.87m cells=27 rms=4.1cm[607] DRIVE goal=(2.40,4.79) dist=0.59m front=0.85m cells=27 rms=4.1cm[608] DRIVE goal=(2.40,4.79) dist=0.58m front=0.83m cells=27 rms=4.1cm[609] DRIVE goal=(2.40,4.79) dist=0.56m front=0.81m cells=27 rms=4.1cm[610] DRIVE goal=(2.40,4.79) dist=0.54m front=0.80m cells=27 rms=4.1cm[611] DRIVE goal=(2.40,4.79) dist=0.52m front=0.78m cells=27 rms=4.1cm[612] DRIVE goal=(2.40,4.79) dist=0.50m front=0.76m cells=27 rms=4.1cm[613] DRIVE goal=(2.40,4.79) dist=0.48m front=0.74m cells=27 rms=4.1cm[614] DRIVE goal=(2.40,4.79) dist=0.46m front=0.73m cells=27 rms=4.1cm[615] DRIVE goal=(2.40,4.79) dist=0.45m front=0.71m cells=27 rms=4.1cm[616] DRIVE goal=(2.40,4.79) dist=0.42m front=0.69m cells=27 rms=4.1cm[617] DRIVE goal=(2.40,4.79) dist=0.41m front=0.68m cells=27 rms=4.1cm
[139.2s] [GOAL SELECT] robot@(2.28,4.42) | 25 candidates (scanned=350 walls=211 visited=27):
  #1 ang= -52° d=1.50m pos=(3.65,5.02) score=+44.6 [O=+2.0 U=+36.0 V=-0.0 W=-0.0 R=-0.0 F=+6.2] <-- BEST
  #2 ang= -45° d=1.50m pos=(3.58,5.16) score=+41.9 [O=+1.7 U=+34.0 V=-0.0 W=-1.0 R=-0.0 F=+6.7]
  #3 ang= -58° d=1.50m pos=(3.71,4.87) score=+40.1 [O=+2.0 U=+32.0 V=-0.0 W=-0.0 R=-0.0 F=+5.6]
  #4 ang= -64° d=1.50m pos=(3.75,4.72) score=+36.0 [O=+2.5 U=+28.0 V=-0.0 W=-0.0 R=-0.0 F=+5.0]
  #5 ang= -58° d=1.00m pos=(3.23,4.72) score=+31.4 [O=+2.5 U=+24.0 V=-0.0 W=-1.0 R=-0.0 F=+5.6]
  #6 ang= +52° d=1.00m pos=(1.67,5.21) score=+29.2 [O=+2.5 U=+26.0 V=-0.0 W=-3.0 R=-0.0 F=+3.4]
  #7 ang= -70° d=1.00m pos=(3.27,4.51) score=+27.5 [O=+1.9 U=+22.0 V=-0.0 W=-1.0 R=-0.0 F=+4.3]
  #8 ang= -64° d=1.00m pos=(3.26,4.62) score=+26.8 [O=+2.5 U=+20.0 V=-0.0 W=-1.0 R=-0.0 F=+5.0]
[139.2s] [GOAL] Selected: (3.65, 5.02) dist=1.50m timeout=42s angle=-52° reason=reached
[618] DRIVE goal=(3.65,5.02) dist=1.50m front=0.66m cells=27 rms=4.1cm[619] DRIVE goal=(3.65,5.02) dist=1.49m front=0.65m cells=27 rms=4.1cm[620] DRIVE goal=(3.65,5.02) dist=1.48m front=0.63m cells=27 rms=4.1cm[621] DRIVE goal=(3.65,5.02) dist=1.47m front=0.62m cells=27 rms=4.1cm[622] DRIVE goal=(3.65,5.02) dist=1.46m front=0.62m cells=27 rms=4.1cm[623] DRIVE goal=(3.65,5.02) dist=1.46m front=0.61m cells=27 rms=4.1cm[624] DRIVE goal=(3.65,5.02) dist=1.46m front=0.61m cells=27 rms=4.1cm[625] DRIVE goal=(3.65,5.02) dist=1.46m front=0.61m cells=27 rms=4.1cm[626] DRIVE goal=(3.65,5.02) dist=1.46m front=0.61m cells=27 rms=4.1cm[627] DRIVE goal=(3.65,5.02) dist=1.47m front=0.62m cells=27 rms=4.1cm[628] DRIVE goal=(3.65,5.02) dist=1.47m front=0.62m cells=27 rms=4.1cm[629] DRIVE goal=(3.65,5.02) dist=1.47m front=0.62m cells=27 rms=4.1cm[630] DRIVE goal=(3.65,5.02) dist=1.47m front=0.62m cells=27 rms=4.1cm[631] DRIVE goal=(3.65,5.02) dist=1.47m front=0.62m cells=27 rms=4.1cm[632] DRIVE goal=(3.65,5.02) dist=1.47m front=0.69m cells=27 rms=4.1cm[633] DRIVE goal=(3.65,5.02) dist=1.47m front=0.71m cells=27 rms=4.1cm[634] DRIVE goal=(3.65,5.02) dist=1.47m front=0.71m cells=27 rms=4.1cm[635] DRIVE goal=(3.65,5.02) dist=1.47m front=0.71m cells=27 rms=4.1cm[636] DRIVE goal=(3.65,5.02) dist=1.47m front=0.74m cells=27 rms=4.1cm[637] DRIVE goal=(3.65,5.02) dist=1.47m front=0.78m cells=27 rms=4.1cm[638] DRIVE goal=(3.65,5.02) dist=1.47m front=0.78m cells=27 rms=4.1cm[639] DRIVE goal=(3.65,5.02) dist=1.47m front=0.77m cells=27 rms=4.1cm[640] DRIVE goal=(3.65,5.02) dist=1.46m front=0.78m cells=27 rms=4.1cm[641] DRIVE goal=(3.65,5.02) dist=1.47m front=0.79m cells=27 rms=4.1cm[642] DRIVE goal=(3.65,5.02) dist=1.45m front=0.83m cells=28 rms=4.1cm[643] DRIVE goal=(3.65,5.02) dist=1.45m front=0.89m cells=28 rms=4.1cm[644] DRIVE goal=(3.65,5.02) dist=1.44m front=0.89m cells=28 rms=4.1cm[645] DRIVE goal=(3.65,5.02) dist=1.43m front=0.91m cells=28 rms=4.2cm[646] DRIVE goal=(3.65,5.02) dist=1.42m front=0.91m cells=28 rms=4.2cm[647] DRIVE goal=(3.65,5.02) dist=1.42m front=0.90m cells=28 rms=4.2cm[648] DRIVE goal=(3.65,5.02) dist=1.38m front=0.88m cells=28 rms=4.2cm[649] DRIVE goal=(3.65,5.02) dist=1.37m front=0.88m cells=28 rms=4.2cm[650] DRIVE goal=(3.65,5.02) dist=1.36m front=0.88m cells=28 rms=4.2cm[651] DRIVE goal=(3.65,5.02) dist=1.33m front=0.84m cells=28 rms=4.2cm[652] DRIVE goal=(3.65,5.02) dist=1.31m front=0.81m cells=29 rms=4.2cm[653] DRIVE goal=(3.65,5.02) dist=1.28m front=0.83m cells=29 rms=4.2cm[654] DRIVE goal=(3.65,5.02) dist=1.26m front=0.86m cells=29 rms=4.2cm[655] DRIVE goal=(3.65,5.02) dist=1.26m front=1.50m cells=29 rms=4.3cm[656] DRIVE goal=(3.65,5.02) dist=1.24m front=1.49m cells=29 rms=4.3cm[657] DRIVE goal=(3.65,5.02) dist=1.23m front=0.80m cells=29 rms=4.3cm[658] DRIVE goal=(3.65,5.02) dist=1.22m front=0.72m cells=29 rms=4.3cm[659] DRIVE goal=(3.65,5.02) dist=1.18m front=0.70m cells=29 rms=4.3cm[660] DRIVE goal=(3.65,5.02) dist=1.14m front=0.65m cells=29 rms=4.3cm[661] DRIVE goal=(3.65,5.02) dist=1.12m front=0.63m cells=29 rms=4.3cm[662] DRIVE goal=(3.65,5.02) dist=1.10m front=0.64m cells=29 rms=4.3cm[663] DRIVE goal=(3.65,5.02) dist=1.08m front=0.61m cells=29 rms=4.3cm[664] DRIVE goal=(3.65,5.02) dist=1.07m front=0.66m cells=29 rms=4.3cm[665] DRIVE goal=(3.65,5.02) dist=1.06m front=0.67m cells=29 rms=4.4cm[666] DRIVE goal=(3.65,5.02) dist=1.06m front=0.68m cells=29 rms=4.4cm[667] DRIVE goal=(3.65,5.02) dist=1.04m front=1.39m cells=29 rms=4.4cm[668] DRIVE goal=(3.65,5.02) dist=1.01m front=1.39m cells=29 rms=4.4cm[669] DRIVE goal=(3.65,5.02) dist=1.00m front=1.35m cells=30 rms=4.4cm[670] DRIVE goal=(3.65,5.02) dist=0.98m front=1.33m cells=30 rms=4.4cm[671] DRIVE goal=(3.65,5.02) dist=0.96m front=1.32m cells=30 rms=4.4cm[672] DRIVE goal=(3.65,5.02) dist=0.94m front=1.30m cells=30 rms=4.4cm[673] DRIVE goal=(3.65,5.02) dist=0.92m front=1.28m cells=30 rms=4.5cm[674] DRIVE goal=(3.65,5.02) dist=0.90m front=1.28m cells=30 rms=4.5cm[675] DRIVE goal=(3.65,5.02) dist=0.88m front=1.27m cells=30 rms=4.5cm[676] DRIVE goal=(3.65,5.02) dist=0.86m front=1.26m cells=30 rms=4.5cm[677] DRIVE goal=(3.65,5.02) dist=0.84m front=1.28m cells=30 rms=4.5cm[678] DRIVE goal=(3.65,5.02) dist=0.82m front=1.26m cells=30 rms=4.5cm[679] DRIVE goal=(3.65,5.02) dist=0.80m front=1.27m cells=30 rms=4.5cm[680] DRIVE goal=(3.65,5.02) dist=0.78m front=1.32m cells=30 rms=4.5cm[681] DRIVE goal=(3.65,5.02) dist=0.76m front=1.33m cells=30 rms=4.5cm[682] DRIVE goal=(3.65,5.02) dist=0.74m front=1.33m cells=30 rms=4.5cm[683] DRIVE goal=(3.65,5.02) dist=0.73m front=1.35m cells=30 rms=4.5cm[684] DRIVE goal=(3.65,5.02) dist=0.71m front=1.39m cells=30 rms=4.5cm[685] DRIVE goal=(3.65,5.02) dist=0.69m front=1.34m cells=31 rms=4.5cm[686] DRIVE goal=(3.65,5.02) dist=0.67m front=1.35m cells=32 rms=4.5cm[687] DRIVE goal=(3.65,5.02) dist=0.65m front=1.33m cells=32 rms=4.5cm[688] DRIVE goal=(3.65,5.02) dist=0.63m front=1.31m cells=32 rms=4.5cm[689] DRIVE goal=(3.65,5.02) dist=0.61m front=1.29m cells=32 rms=4.5cm[690] DRIVE goal=(3.65,5.02) dist=0.59m front=1.27m cells=32 rms=4.5cm[691] DRIVE goal=(3.65,5.02) dist=0.57m front=1.25m cells=32 rms=4.5cm[692] DRIVE goal=(3.65,5.02) dist=0.55m front=1.24m cells=32 rms=4.5cm[693] DRIVE goal=(3.65,5.02) dist=0.54m front=1.22m cells=32 rms=4.5cm[694] DRIVE goal=(3.65,5.02) dist=0.52m front=1.20m cells=32 rms=4.5cm[695] DRIVE goal=(3.65,5.02) dist=0.50m front=1.18m cells=32 rms=4.5cm[696] DRIVE goal=(3.65,5.02) dist=0.48m front=1.16m cells=32 rms=4.5cm[697] DRIVE goal=(3.65,5.02) dist=0.46m front=1.14m cells=32 rms=4.5cm[698] DRIVE goal=(3.65,5.02) dist=0.45m front=1.12m cells=32 rms=4.5cm[699] DRIVE goal=(3.65,5.02) dist=0.43m front=1.10m cells=32 rms=4.5cm[700] DRIVE goal=(3.65,5.02) dist=0.41m front=1.08m cells=32 rms=4.5cm
[155.9s] [GOAL SELECT] robot@(3.28,4.90) | 34 candidates (scanned=384 walls=231 visited=32):
  #1 ang= +58° d=1.50m pos=(3.59,6.37) score=+49.4 [O=+2.5 U=+40.0 V=-0.0 W=-1.0 R=-0.0 F=+7.4] <-- BEST
  #2 ang= +64° d=1.50m pos=(3.43,6.40) score=+48.2 [O=+1.6 U=+40.0 V=-0.0 W=-1.0 R=-0.0 F=+7.1]
  #3 ang= +70° d=1.50m pos=(3.27,6.40) score=+47.6 [O=+1.6 U=+40.0 V=-0.0 W=-1.0 R=-0.0 F=+6.6]
  #4 ang= +70° d=1.00m pos=(3.27,5.90) score=+45.0 [O=+2.1 U=+36.0 V=-0.0 W=-0.0 R=-0.0 F=+6.6]
  #5 ang= +58° d=1.00m pos=(3.49,5.88) score=+44.2 [O=+2.5 U=+34.0 V=-0.0 W=-0.0 R=-0.0 F=+7.4]
  #6 ang= +64° d=1.00m pos=(3.38,5.90) score=+43.5 [O=+2.1 U=+34.0 V=-0.0 W=-0.0 R=-0.0 F=+7.1]
  #7 ang= +82° d=1.00m pos=(3.06,5.88) score=+41.9 [O=+1.9 U=+34.1 V=-0.0 W=-0.0 R=-0.0 F=+5.5]
  #8 ang=  +9° d=0.50m pos=(3.72,5.15) score=+41.6 [O=+1.6 U=+40.0 V=-0.0 W=-0.0 R=-7.2 F=+7.1]
[155.9s] [GOAL] Selected: (3.59, 6.37) dist=1.50m timeout=42s angle=58° reason=reached
[701] DRIVE goal=(3.59,6.37) dist=1.50m front=1.06m cells=32 rms=4.5cm[702] DRIVE goal=(3.59,6.37) dist=1.49m front=1.04m cells=33 rms=4.5cm[703] DRIVE goal=(3.59,6.37) dist=1.48m front=1.02m cells=33 rms=4.5cm[704] DRIVE goal=(3.59,6.37) dist=1.48m front=1.01m cells=33 rms=4.5cm[705] DRIVE goal=(3.59,6.37) dist=1.48m front=1.01m cells=33 rms=4.5cm[706] DRIVE goal=(3.59,6.37) dist=1.48m front=1.01m cells=33 rms=4.5cm[707] DRIVE goal=(3.59,6.37) dist=1.48m front=1.01m cells=33 rms=4.5cm[708] DRIVE goal=(3.59,6.37) dist=1.48m front=1.01m cells=33 rms=4.5cm[709] DRIVE goal=(3.59,6.37) dist=1.48m front=1.01m cells=33 rms=4.5cm[710] DRIVE goal=(3.59,6.37) dist=1.48m front=1.01m cells=33 rms=4.5cm[711] DRIVE goal=(3.59,6.37) dist=1.48m front=1.01m cells=33 rms=4.5cm[712] DRIVE goal=(3.59,6.37) dist=1.48m front=1.01m cells=33 rms=4.5cm[713] DRIVE goal=(3.59,6.37) dist=1.48m front=1.01m cells=33 rms=4.5cm[714] DRIVE goal=(3.59,6.37) dist=1.48m front=1.01m cells=33 rms=4.5cm[715] DRIVE goal=(3.59,6.37) dist=1.48m front=1.01m cells=33 rms=4.5cm[716] DRIVE goal=(3.59,6.37) dist=1.48m front=1.01m cells=33 rms=4.5cm[717] DRIVE goal=(3.59,6.37) dist=1.48m front=1.01m cells=33 rms=4.5cm[718] DRIVE goal=(3.59,6.37) dist=1.48m front=1.01m cells=33 rms=4.5cm[719] DRIVE goal=(3.59,6.37) dist=1.48m front=1.01m cells=33 rms=4.5cm[720] DRIVE goal=(3.59,6.37) dist=1.48m front=1.01m cells=33 rms=4.5cm[721] DRIVE goal=(3.59,6.37) dist=1.48m front=1.01m cells=33 rms=4.5cm[722] DRIVE goal=(3.59,6.37) dist=1.48m front=1.05m cells=33 rms=4.5cm[723] DRIVE goal=(3.59,6.37) dist=1.49m front=1.05m cells=33 rms=4.5cm[724] DRIVE goal=(3.59,6.37) dist=1.48m front=1.05m cells=33 rms=4.5cm[725] DRIVE goal=(3.59,6.37) dist=1.48m front=1.05m cells=33 rms=4.5cm[726] DRIVE goal=(3.59,6.37) dist=1.47m front=1.04m cells=33 rms=4.5cm[727] DRIVE goal=(3.59,6.37) dist=1.46m front=1.03m cells=33 rms=4.5cm[728] DRIVE goal=(3.59,6.37) dist=1.45m front=1.02m cells=33 rms=4.5cm[729] DRIVE goal=(3.59,6.37) dist=1.44m front=1.01m cells=33 rms=4.5cm[730] DRIVE goal=(3.59,6.37) dist=1.43m front=1.01m cells=33 rms=4.5cm[731] DRIVE goal=(3.59,6.37) dist=1.42m front=1.00m cells=33 rms=4.5cm[732] DRIVE goal=(3.59,6.37) dist=1.40m front=1.06m cells=33 rms=4.5cm[733] DRIVE goal=(3.59,6.37) dist=1.37m front=1.03m cells=33 rms=4.5cm[734] DRIVE goal=(3.59,6.37) dist=1.35m front=0.95m cells=33 rms=4.5cm[735] DRIVE goal=(3.59,6.37) dist=1.33m front=0.93m cells=33 rms=4.5cm[736] DRIVE goal=(3.59,6.37) dist=1.31m front=0.91m cells=33 rms=4.5cm[737] DRIVE goal=(3.59,6.37) dist=1.30m front=0.91m cells=33 rms=4.5cm[738] DRIVE goal=(3.59,6.37) dist=1.28m front=0.89m cells=34 rms=4.5cm[739] DRIVE goal=(3.59,6.37) dist=1.26m front=0.88m cells=34 rms=4.5cm[740] DRIVE goal=(3.59,6.37) dist=1.26m front=0.87m cells=34 rms=4.5cm[741] DRIVE goal=(3.59,6.37) dist=1.24m front=0.87m cells=34 rms=4.6cm[742] DRIVE goal=(3.59,6.37) dist=1.24m front=0.91m cells=34 rms=4.6cm[743] DRIVE goal=(3.59,6.37) dist=1.22m front=0.94m cells=34 rms=4.6cm[744] DRIVE goal=(3.59,6.37) dist=1.21m front=0.85m cells=34 rms=4.6cm[745] DRIVE goal=(3.59,6.37) dist=1.20m front=0.83m cells=34 rms=4.6cm[746] DRIVE goal=(3.59,6.37) dist=1.18m front=0.87m cells=34 rms=4.6cm[747] DRIVE goal=(3.59,6.37) dist=1.18m front=0.87m cells=34 rms=4.6cm[748] DRIVE goal=(3.59,6.37) dist=1.17m front=0.87m cells=34 rms=4.6cm[749] DRIVE goal=(3.59,6.37) dist=1.15m front=0.80m cells=34 rms=4.6cm[750] DRIVE goal=(3.59,6.37) dist=1.15m front=0.83m cells=34 rms=4.6cm[751] DRIVE goal=(3.59,6.37) dist=1.14m front=0.86m cells=34 rms=4.6cm[752] DRIVE goal=(3.59,6.37) dist=1.12m front=0.85m cells=34 rms=4.6cm[753] DRIVE goal=(3.59,6.37) dist=1.11m front=0.85m cells=34 rms=4.6cm[754] DRIVE goal=(3.59,6.37) dist=1.09m front=0.85m cells=34 rms=4.6cm[755] DRIVE goal=(3.59,6.37) dist=1.08m front=0.89m cells=34 rms=4.6cm[756] DRIVE goal=(3.59,6.37) dist=1.08m front=0.91m cells=34 rms=4.6cm[757] DRIVE goal=(3.59,6.37) dist=1.06m front=0.92m cells=34 rms=4.6cm[758] DRIVE goal=(3.59,6.37) dist=1.05m front=0.91m cells=34 rms=4.6cm[759] DRIVE goal=(3.59,6.37) dist=1.03m front=0.89m cells=34 rms=4.7cm[760] DRIVE goal=(3.59,6.37) dist=1.01m front=0.90m cells=34 rms=4.7cm[761] DRIVE goal=(3.59,6.37) dist=0.99m front=0.89m cells=34 rms=4.7cm[762] DRIVE goal=(3.59,6.37) dist=0.97m front=0.88m cells=35 rms=4.7cm[763] DRIVE goal=(3.59,6.37) dist=0.95m front=0.88m cells=35 rms=4.7cm[764] DRIVE goal=(3.59,6.37) dist=0.93m front=0.88m cells=35 rms=4.7cm[765] DRIVE goal=(3.59,6.37) dist=0.91m front=0.86m cells=35 rms=4.7cm[766] DRIVE goal=(3.59,6.37) dist=0.89m front=0.85m cells=35 rms=4.7cm[767] DRIVE goal=(3.59,6.37) dist=0.87m front=0.85m cells=35 rms=4.7cm[768] DRIVE goal=(3.59,6.37) dist=0.85m front=0.85m cells=35 rms=4.7cm[769] DRIVE goal=(3.59,6.37) dist=0.83m front=0.84m cells=35 rms=4.7cm[770] DRIVE goal=(3.59,6.37) dist=0.81m front=0.82m cells=35 rms=4.7cm[771] DRIVE goal=(3.59,6.37) dist=0.79m front=0.82m cells=35 rms=4.7cm[772] DRIVE goal=(3.59,6.37) dist=0.78m front=0.83m cells=35 rms=4.7cm[773] DRIVE goal=(3.59,6.37) dist=0.75m front=0.81m cells=35 rms=4.7cm[774] DRIVE goal=(3.59,6.37) dist=0.74m front=0.81m cells=35 rms=4.7cm[775] DRIVE goal=(3.59,6.37) dist=0.72m front=0.80m cells=35 rms=4.7cm[776] DRIVE goal=(3.59,6.37) dist=0.70m front=0.78m cells=35 rms=4.7cm[777] DRIVE goal=(3.59,6.37) dist=0.68m front=0.78m cells=35 rms=4.7cm[778] DRIVE goal=(3.59,6.37) dist=0.66m front=0.77m cells=36 rms=4.7cm[779] DRIVE goal=(3.59,6.37) dist=0.64m front=0.77m cells=36 rms=4.7cm[780] DRIVE goal=(3.59,6.37) dist=0.62m front=0.76m cells=36 rms=4.7cm[781] DRIVE goal=(3.59,6.37) dist=0.60m front=0.76m cells=36 rms=4.7cm[782] DRIVE goal=(3.59,6.37) dist=0.58m front=0.76m cells=36 rms=4.7cm[783] DRIVE goal=(3.59,6.37) dist=0.57m front=0.75m cells=36 rms=4.7cm[784] DRIVE goal=(3.59,6.37) dist=0.55m front=0.74m cells=36 rms=4.7cm[785] DRIVE goal=(3.59,6.37) dist=0.53m front=0.74m cells=36 rms=4.7cm[786] DRIVE goal=(3.59,6.37) dist=0.51m front=0.73m cells=36 rms=4.7cm[787] DRIVE goal=(3.59,6.37) dist=0.49m front=0.73m cells=36 rms=4.7cm[788] DRIVE goal=(3.59,6.37) dist=0.47m front=0.72m cells=36 rms=4.7cm[789] DRIVE goal=(3.59,6.37) dist=0.45m front=0.71m cells=36 rms=4.7cm[790] DRIVE goal=(3.59,6.37) dist=0.43m front=0.71m cells=36 rms=4.7cm[791] DRIVE goal=(3.59,6.37) dist=0.41m front=0.69m cells=36 rms=4.7cm
[174.1s] [REFINE] best score 19.8 < 20.0, resampling with 150 angles (level 1)

[174.1s] [GOAL SELECT] robot@(3.52,5.99) | 25 candidates (refined 1x) (scanned=401 walls=249 visited=36):
  #1 ang= +67° d=0.50m pos=(3.09,6.23) score=+20.3 [O=+1.5 U=+25.4 V=-3.0 W=-0.0 R=-3.5 F=-0.2] <-- BEST
  #2 ang= +69° d=0.50m pos=(3.08,6.21) score=+20.0 [O=+1.5 U=+25.2 V=-3.0 W=-0.0 R=-3.5 F=-0.5]
  #3 ang= +71° d=0.50m pos=(3.07,6.19) score=+18.2 [O=+1.5 U=+23.7 V=-3.0 W=-0.0 R=-3.5 F=-0.8]
  #4 ang= +73° d=0.50m pos=(3.06,6.18) score=+18.0 [O=+1.6 U=+23.7 V=-3.0 W=-0.0 R=-3.5 F=-1.1]
  #5 ang= +75° d=0.50m pos=(3.06,6.16) score=+15.4 [O=+1.6 U=+21.4 V=-3.0 W=-0.0 R=-3.5 F=-1.3]
  #6 ang= +77° d=0.50m pos=(3.05,6.15) score=+5.3 [O=+1.6 U=+21.7 V=-3.0 W=-0.0 R=-3.5 F=-1.6 T=-10.0]
  #7 ang= +79° d=0.50m pos=(3.04,6.13) score=+2.6 [O=+1.7 U=+19.1 V=-3.0 W=-0.0 R=-3.5 F=-1.9 T=-10.0]
  #8 ang= +81° d=0.50m pos=(3.04,6.11) score=+2.3 [O=+1.7 U=+19.1 V=-3.0 W=-0.0 R=-3.5 F=-2.2 T=-10.0]
[174.1s] [GOAL] Selected: (3.09, 6.23) dist=0.50m timeout=28s angle=67° reason=reached
[792] DRIVE goal=(3.09,6.23) dist=0.50m front=0.69m cells=36 rms=4.7cm[793] DRIVE goal=(3.09,6.23) dist=0.49m front=0.68m cells=37 rms=4.7cm[794] DRIVE goal=(3.09,6.23) dist=0.49m front=0.68m cells=37 rms=4.7cm[795] DRIVE goal=(3.09,6.23) dist=0.48m front=0.69m cells=37 rms=4.7cm[796] DRIVE goal=(3.09,6.23) dist=0.48m front=0.70m cells=37 rms=4.7cm[797] DRIVE goal=(3.09,6.23) dist=0.48m front=0.72m cells=37 rms=4.7cm[798] DRIVE goal=(3.09,6.23) dist=0.48m front=0.73m cells=37 rms=4.7cm[799] DRIVE goal=(3.09,6.23) dist=0.48m front=0.77m cells=37 rms=4.7cm[800] DRIVE goal=(3.09,6.23) dist=0.48m front=0.78m cells=37 rms=4.7cm[801] DRIVE goal=(3.09,6.23) dist=0.48m front=0.79m cells=37 rms=4.7cm[802] DRIVE goal=(3.09,6.23) dist=0.48m front=0.79m cells=37 rms=4.7cm[803] DRIVE goal=(3.09,6.23) dist=0.48m front=0.79m cells=37 rms=4.7cm[804] DRIVE goal=(3.09,6.23) dist=0.48m front=0.79m cells=37 rms=4.7cm[805] DRIVE goal=(3.09,6.23) dist=0.48m front=0.79m cells=37 rms=4.7cm[806] DRIVE goal=(3.09,6.23) dist=0.48m front=0.79m cells=37 rms=4.7cm[807] DRIVE goal=(3.09,6.23) dist=0.48m front=0.79m cells=37 rms=4.7cm[808] DRIVE goal=(3.09,6.23) dist=0.48m front=0.79m cells=37 rms=4.7cm[809] DRIVE goal=(3.09,6.23) dist=0.49m front=0.79m cells=37 rms=4.7cm[810] DRIVE goal=(3.09,6.23) dist=0.48m front=0.79m cells=37 rms=4.7cm[811] DRIVE goal=(3.09,6.23) dist=0.48m front=0.79m cells=37 rms=4.7cm[812] DRIVE goal=(3.09,6.23) dist=0.49m front=0.79m cells=37 rms=4.7cm[813] DRIVE goal=(3.09,6.23) dist=0.49m front=0.79m cells=37 rms=4.7cm[814] DRIVE goal=(3.09,6.23) dist=0.48m front=0.79m cells=37 rms=4.7cm[815] DRIVE goal=(3.09,6.23) dist=0.48m front=0.79m cells=37 rms=4.7cm[816] DRIVE goal=(3.09,6.23) dist=0.49m front=0.79m cells=37 rms=4.7cm[817] DRIVE goal=(3.09,6.23) dist=0.48m front=0.79m cells=37 rms=4.7cm[818] DRIVE goal=(3.09,6.23) dist=0.48m front=0.79m cells=37 rms=4.7cm[819] DRIVE goal=(3.09,6.23) dist=0.49m front=0.80m cells=37 rms=4.7cm[820] DRIVE goal=(3.09,6.23) dist=0.48m front=0.80m cells=37 rms=4.7cm[821] DRIVE goal=(3.09,6.23) dist=0.48m front=0.80m cells=37 rms=4.7cm[822] DRIVE goal=(3.09,6.23) dist=0.47m front=0.80m cells=37 rms=4.7cm[823] DRIVE goal=(3.09,6.23) dist=0.46m front=0.80m cells=37 rms=4.7cm[824] DRIVE goal=(3.09,6.23) dist=0.45m front=0.79m cells=37 rms=4.7cmWaiting for LiDAR...


Stopping (Ctrl+C)...
[MARKER] Publisher stopped

=======================================================
NBV NAVIGATION COMPLETE
=======================================================
Final state: exploring
Duration: 182.7s
Iterations: 825
Goals reached: 7
Backups: 3
Unique cells visited: 37
Cells scanned by LiDAR: 403
Walls detected: 250

--- Drive Accuracy ---
Cross-track RMS error: 4.7cm
Total distance traveled: 10.00m
Ideal distance (sum of goals): 15.50m
Drive efficiency: 154.9%
Revisit rate: 100.0%

--- Map Accuracy Suggestions ---
To measure map accuracy, consider:
1. Ground truth comparison: Place markers at known positions,
   compare measured vs actual distances between them
2. Loop closure error: After returning to origin, check
   odometry drift (final_dist to origin should be ~0)
3. Feature alignment: Compare map walls to actual room layout
4. Consistency check: Run multiple times, overlay maps
5. Tape measure validation: Measure actual room dimensions,
   compare to map scale (resolution * pixels)
[OUTPUT] Map saved to: /home/ws/ugv_cont/mission/outputs/20251222_202946/maps
