[OUTPUT] Logging to: /home/ws/ugv_cont/mission/outputs/20251221_205457
[OUTPUT] Log file: /home/ws/ugv_cont/mission/outputs/20251221_205457/logs/navigation.log
=======================================================
NEXT-BEST-VIEW (NBV) NAVIGATION
=======================================================
Speed: 0.08 m/s
Goal distance: 0.5-2.0m
Press Ctrl+C to stop

[DEBUG] Marker publishing enabled - check /nav_goal in RViz
[MARKER] Persistent marker publisher started - add /nav_goal in RViz
[START] Initial position: (0.00, -0.00)
[MARKER] Origin marker (blue) started at (0.00, -0.00) - add /nav_origin in RViz

[  3.3s] [GOAL SELECT] robot@(0.00,-0.00) | 15 candidates (scanned=45 walls=20 visited=1):
  #1 ang= -58° d=0.50m pos=(-0.25,0.43) score=+40.0 [O=+1.6 U=+41.2 V=-0.0 W=-3.0 R=-0.0 F=+0.0] <-- BEST
  #2 ang= -64° d=0.50m pos=(-0.20,0.46) score=+37.9 [O=+1.6 U=+39.2 V=-0.0 W=-3.0 R=-0.0 F=+0.0]
  #3 ang=-101° d=2.00m pos=(0.46,1.94) score=+36.1 [O=+2.5 U=+34.0 V=-0.0 W=-1.0 R=-0.0 F=+0.0]
  #4 ang=-107° d=2.00m pos=(0.67,1.88) score=+34.1 [O=+2.5 U=+32.0 V=-0.0 W=-1.0 R=-0.0 F=+0.0]
  #5 ang= -70° d=0.50m pos=(-0.15,0.48) score=+33.9 [O=+1.6 U=+35.2 V=-0.0 W=-3.0 R=-0.0 F=+0.0]
  #6 ang= -76° d=0.50m pos=(-0.10,0.49) score=+30.2 [O=+1.8 U=+31.2 V=-0.0 W=-3.0 R=-0.0 F=+0.0]
  #7 ang=-101° d=1.50m pos=(0.35,1.46) score=+28.0 [O=+2.5 U=+26.0 V=-0.0 W=-1.0 R=-0.0 F=+0.0]
  #8 ang=-107° d=1.50m pos=(0.50,1.41) score=+28.0 [O=+2.5 U=+26.0 V=-0.0 W=-1.0 R=-0.0 F=+0.0]
[  3.3s] [GOAL] Selected: (-0.25, 0.43) dist=0.50m timeout=28s angle=-58° reason=no goal
[  1] DRIVE goal=(-0.25,0.43) dist=0.50m front=0.41m cells=1 rms=0.0cm[  2] DRIVE goal=(-0.25,0.43) dist=0.50m front=0.41m cells=1 rms=0.0cm[  3] DRIVE goal=(-0.25,0.43) dist=0.50m front=0.43m cells=1 rms=0.4cm[  4] DRIVE goal=(-0.25,0.43) dist=0.51m front=0.43m cells=1 rms=0.5cm[  5] DRIVE goal=(-0.25,0.43) dist=0.51m front=0.44m cells=1 rms=0.6cm[  6] DRIVE goal=(-0.25,0.43) dist=0.52m front=0.60m cells=1 rms=0.8cm[  7] DRIVE goal=(-0.25,0.43) dist=0.53m front=0.61m cells=1 rms=1.2cm[  8] DRIVE goal=(-0.25,0.43) dist=0.52m front=0.60m cells=1 rms=1.3cm[  9] DRIVE goal=(-0.25,0.43) dist=0.52m front=0.60m cells=1 rms=1.4cm[ 10] DRIVE goal=(-0.25,0.43) dist=0.52m front=0.60m cells=1 rms=1.4cm[ 11] DRIVE goal=(-0.25,0.43) dist=0.52m front=0.60m cells=1 rms=1.5cm[ 12] DRIVE goal=(-0.25,0.43) dist=0.52m front=0.60m cells=1 rms=1.5cm[ 13] DRIVE goal=(-0.25,0.43) dist=0.52m front=0.61m cells=1 rms=1.5cm[ 14] DRIVE goal=(-0.25,0.43) dist=0.52m front=0.60m cells=1 rms=1.5cm[ 15] DRIVE goal=(-0.25,0.43) dist=0.52m front=0.61m cells=1 rms=1.5cm[ 16] DRIVE goal=(-0.25,0.43) dist=0.52m front=0.63m cells=1 rms=1.5cm[ 17] DRIVE goal=(-0.25,0.43) dist=0.51m front=0.89m cells=1 rms=1.4cm[ 18] DRIVE goal=(-0.25,0.43) dist=0.51m front=0.89m cells=1 rms=1.4cm[ 19] DRIVE goal=(-0.25,0.43) dist=0.51m front=0.89m cells=1 rms=1.4cm[ 20] DRIVE goal=(-0.25,0.43) dist=0.50m front=0.88m cells=1 rms=1.4cm[ 21] DRIVE goal=(-0.25,0.43) dist=0.49m front=0.87m cells=1 rms=1.3cm[ 22] DRIVE goal=(-0.25,0.43) dist=0.47m front=0.86m cells=1 rms=1.3cm[ 23] DRIVE goal=(-0.25,0.43) dist=0.47m front=0.85m cells=1 rms=1.3cm[ 24] DRIVE goal=(-0.25,0.43) dist=0.46m front=0.84m cells=1 rms=1.3cm[ 25] DRIVE goal=(-0.25,0.43) dist=0.45m front=0.83m cells=1 rms=1.2cm[ 26] DRIVE goal=(-0.25,0.43) dist=0.44m front=0.83m cells=1 rms=1.2cm[ 27] DRIVE goal=(-0.25,0.43) dist=0.44m front=0.82m cells=1 rms=1.2cm[ 28] DRIVE goal=(-0.25,0.43) dist=0.42m front=0.80m cells=1 rms=1.2cm[ 29] DRIVE goal=(-0.25,0.43) dist=0.41m front=0.79m cells=1 rms=1.2cm
[  9.3s] [GOAL SELECT] robot@(-0.07,0.09) | 12 candidates (scanned=70 walls=36 visited=1):
  #1 ang= -58° d=2.00m pos=(0.49,2.01) score=+32.1 [O=+2.5 U=+32.0 V=-0.0 W=-3.0 R=-0.0 F=+0.0] <-- BEST
  #2 ang= -58° d=1.50m pos=(0.35,1.53) score=+24.0 [O=+2.5 U=+24.0 V=-0.0 W=-3.0 R=-0.0 F=+0.0]
  #3 ang= -70° d=1.00m pos=(0.41,0.97) score=+23.0 [O=+1.7 U=+22.0 V=-0.0 W=-1.0 R=-0.0 F=+0.0]
  #4 ang= -64° d=1.00m pos=(0.31,1.02) score=+21.2 [O=+1.9 U=+20.0 V=-0.0 W=-1.0 R=-0.0 F=+0.0]
  #5 ang= -27° d=0.50m pos=(-0.19,0.58) score=+19.3 [O=+1.7 U=+34.0 V=-0.0 W=-3.0 R=-13.5 F=+0.0]
  #6 ang= -33° d=0.50m pos=(-0.14,0.59) score=+13.8 [O=+2.2 U=+28.0 V=-0.0 W=-3.0 R=-13.5 F=+0.0]
  #7 ang= -45° d=0.50m pos=(-0.03,0.59) score=+4.2 [O=+2.5 U=+18.0 V=-0.0 W=-3.0 R=-13.5 F=+0.0]
  #8 ang= -39° d=0.50m pos=(-0.09,0.59) score=+1.8 [O=+2.2 U=+16.0 V=-0.0 W=-3.0 R=-13.5 F=+0.0]
[  9.3s] [GOAL] Selected: (0.49, 2.01) dist=2.00m timeout=50s angle=-58° reason=reached
[ 30] DRIVE goal=(0.49,2.01) dist=2.00m front=0.77m cells=1 rms=1.2cm[ 31] DRIVE goal=(0.49,2.01) dist=1.98m front=0.73m cells=1 rms=1.2cm[ 32] DRIVE goal=(0.49,2.01) dist=1.98m front=0.72m cells=1 rms=1.4cm[ 33] DRIVE goal=(0.49,2.01) dist=1.98m front=0.72m cells=1 rms=1.5cm[ 34] DRIVE goal=(0.49,2.01) dist=1.98m front=0.73m cells=1 rms=1.6cm[ 35] DRIVE goal=(0.49,2.01) dist=1.98m front=0.73m cells=1 rms=1.7cm[ 36] DRIVE goal=(0.49,2.01) dist=1.98m front=0.73m cells=1 rms=1.7cm[ 37] DRIVE goal=(0.49,2.01) dist=1.98m front=0.73m cells=1 rms=1.8cm[ 38] DRIVE goal=(0.49,2.01) dist=1.98m front=0.76m cells=1 rms=1.8cm[ 39] DRIVE goal=(0.49,2.01) dist=1.98m front=0.77m cells=1 rms=1.9cm[ 40] DRIVE goal=(0.49,2.01) dist=1.98m front=0.78m cells=1 rms=2.0cm[ 41] DRIVE goal=(0.49,2.01) dist=1.98m front=0.82m cells=1 rms=2.0cm[ 42] DRIVE goal=(0.49,2.01) dist=1.98m front=0.89m cells=1 rms=2.1cm[ 43] DRIVE goal=(0.49,2.01) dist=1.98m front=0.89m cells=1 rms=2.1cm[ 44] DRIVE goal=(0.49,2.01) dist=1.98m front=0.89m cells=1 rms=2.2cm[ 45] DRIVE goal=(0.49,2.01) dist=1.98m front=0.89m cells=1 rms=2.2cm[ 46] DRIVE goal=(0.49,2.01) dist=1.99m front=0.81m cells=1 rms=2.3cm[ 47] DRIVE goal=(0.49,2.01) dist=1.99m front=0.78m cells=1 rms=2.3cm[ 48] DRIVE goal=(0.49,2.01) dist=1.98m front=0.74m cells=1 rms=2.4cm[ 49] DRIVE goal=(0.49,2.01) dist=1.98m front=0.72m cells=1 rms=2.4cm[ 50] DRIVE goal=(0.49,2.01) dist=1.97m front=0.70m cells=1 rms=2.5cm[ 51] DRIVE goal=(0.49,2.01) dist=1.96m front=0.67m cells=1 rms=2.5cm
[ 13.9s] [TURN ENTER] Entering TURN mode

[BLOCKED DEBUG] Goal angle: 4.3° (sector 0), goal_dist: 1.95m, goal_dir_min: 1.79m, margin: 0.15m
[BLOCKED DEBUG] Checking 1 sectors (robot angular width at 1.9m = 5.3°): {0: 1.794}
[BLOCKED DEBUG] Check: 1.79 < 1.95 - 0.15 = 1.80? True
[BLOCKED DEBUG] (Full front arc for reference: {55: 0.659, 56: 0.68, 57: 0.716, 58: 0.766, 59: 1.606, 0: 1.794, 1: 3.632, 2: 3.556, 3: 3.609, 4: 1.605, 5: 1.598})

[BLOCKED TURN] goal_sector=0, best_sector=0 (dist=1.79m), target_angle=0.0°, angle_error=0.0°, v=0.05, w=0.00
[ 52] TURN goal=(0.49,2.01) dist=1.95m front=0.66m cells=1 rms=2.6cm[ 53] TURN goal=(0.49,2.01) dist=1.93m front=0.64m cells=1 rms=2.6cm[ 54] DRIVE goal=(0.49,2.01) dist=1.92m front=0.64m cells=1 rms=2.6cm
[ 14.5s] [TURN ENTER] Entering TURN mode

[BLOCKED DEBUG] Goal angle: 4.2° (sector 0), goal_dist: 1.90m, goal_dir_min: 1.75m, margin: 0.15m
[BLOCKED DEBUG] Checking 1 sectors (robot angular width at 1.9m = 5.4°): {0: 1.749}
[BLOCKED DEBUG] Check: 1.75 < 1.90 - 0.15 = 1.75? True
[BLOCKED DEBUG] (Full front arc for reference: {55: 0.632, 56: 0.654, 57: 0.694, 58: 0.73, 59: 1.583, 0: 1.749, 1: 3.597, 2: 3.512, 3: 3.536, 4: 1.562, 5: 1.553})

[BLOCKED TURN] goal_sector=0, best_sector=0 (dist=1.75m), target_angle=0.0°, angle_error=0.0°, v=0.05, w=0.00
[ 55] TURN goal=(0.49,2.01) dist=1.90m front=0.63m cells=1 rms=2.6cm[ 56] TURN goal=(0.49,2.01) dist=1.89m front=0.62m cells=1 rms=2.7cm[ 57] TURN goal=(0.49,2.01) dist=1.87m front=0.61m cells=1 rms=2.7cm[ 58] DRIVE goal=(0.49,2.01) dist=1.86m front=0.61m cells=1 rms=2.7cm[ 59] DRIVE goal=(0.49,2.01) dist=1.84m front=0.60m cells=1 rms=2.7cm[ 60] DRIVE goal=(0.49,2.01) dist=1.83m front=0.59m cells=1 rms=2.7cm[ 61] DRIVE goal=(0.49,2.01) dist=1.82m front=0.59m cells=1 rms=2.7cm[ 62] DRIVE goal=(0.49,2.01) dist=1.79m front=0.57m cells=1 rms=2.7cm[ 63] DRIVE goal=(0.49,2.01) dist=1.78m front=0.57m cells=2 rms=2.7cm[ 64] DRIVE goal=(0.49,2.01) dist=1.76m front=0.56m cells=2 rms=2.7cm[ 65] DRIVE goal=(0.49,2.01) dist=1.73m front=0.55m cells=2 rms=2.7cm[ 66] DRIVE goal=(0.49,2.01) dist=1.71m front=0.54m cells=2 rms=2.7cm[ 67] DRIVE goal=(0.49,2.01) dist=1.70m front=0.53m cells=2 rms=2.6cm[ 68] DRIVE goal=(0.49,2.01) dist=1.68m front=0.52m cells=2 rms=2.6cm[ 69] DRIVE goal=(0.49,2.01) dist=1.66m front=0.52m cells=2 rms=2.6cm[ 70] DRIVE goal=(0.49,2.01) dist=1.63m front=0.50m cells=2 rms=2.6cm[ 71] DRIVE goal=(0.49,2.01) dist=1.62m front=1.10m cells=2 rms=2.6cm[ 72] DRIVE goal=(0.49,2.01) dist=1.59m front=1.11m cells=2 rms=2.6cm[ 73] DRIVE goal=(0.49,2.01) dist=1.58m front=1.11m cells=2 rms=2.6cm[ 74] DRIVE goal=(0.49,2.01) dist=1.56m front=1.09m cells=2 rms=2.5cm[ 75] DRIVE goal=(0.49,2.01) dist=1.54m front=1.08m cells=2 rms=2.5cm[ 76] DRIVE goal=(0.49,2.01) dist=1.52m front=1.07m cells=2 rms=2.5cm[ 77] DRIVE goal=(0.49,2.01) dist=1.50m front=1.06m cells=2 rms=2.5cm[ 78] DRIVE goal=(0.49,2.01) dist=1.47m front=1.06m cells=3 rms=2.5cm[ 79] DRIVE goal=(0.49,2.01) dist=1.46m front=1.05m cells=3 rms=2.5cm[ 80] DRIVE goal=(0.49,2.01) dist=1.44m front=1.04m cells=3 rms=2.5cm[ 81] DRIVE goal=(0.49,2.01) dist=1.42m front=1.07m cells=3 rms=2.4cm[ 82] DRIVE goal=(0.49,2.01) dist=1.40m front=1.04m cells=3 rms=2.4cm[ 83] DRIVE goal=(0.49,2.01) dist=1.38m front=1.04m cells=3 rms=2.4cm[ 84] DRIVE goal=(0.49,2.01) dist=1.36m front=1.03m cells=3 rms=2.4cm[ 85] DRIVE goal=(0.49,2.01) dist=1.35m front=1.02m cells=3 rms=2.4cm[ 86] DRIVE goal=(0.49,2.01) dist=1.32m front=1.01m cells=3 rms=2.4cm[ 87] DRIVE goal=(0.49,2.01) dist=1.30m front=0.99m cells=3 rms=2.4cm[ 88] DRIVE goal=(0.49,2.01) dist=1.28m front=0.97m cells=3 rms=2.4cm[ 89] DRIVE goal=(0.49,2.01) dist=1.26m front=0.95m cells=3 rms=2.4cm[ 90] DRIVE goal=(0.49,2.01) dist=1.24m front=0.93m cells=3 rms=2.3cm[ 91] DRIVE goal=(0.49,2.01) dist=1.22m front=0.91m cells=3 rms=2.3cm[ 92] DRIVE goal=(0.49,2.01) dist=1.20m front=0.89m cells=3 rms=2.3cm[ 93] DRIVE goal=(0.49,2.01) dist=1.17m front=0.87m cells=3 rms=2.3cm[ 94] DRIVE goal=(0.49,2.01) dist=1.17m front=0.85m cells=3 rms=2.3cm[ 95] DRIVE goal=(0.49,2.01) dist=1.14m front=0.84m cells=4 rms=2.3cm[ 96] DRIVE goal=(0.49,2.01) dist=1.13m front=0.83m cells=4 rms=2.3cm[ 97] DRIVE goal=(0.49,2.01) dist=1.10m front=0.80m cells=4 rms=2.3cm[ 98] DRIVE goal=(0.49,2.01) dist=1.09m front=0.79m cells=4 rms=2.3cm[ 99] DRIVE goal=(0.49,2.01) dist=1.07m front=0.76m cells=4 rms=2.3cm[100] DRIVE goal=(0.49,2.01) dist=1.04m front=0.75m cells=4 rms=2.3cm[101] DRIVE goal=(0.49,2.01) dist=1.02m front=0.75m cells=4 rms=2.3cm[102] DRIVE goal=(0.49,2.01) dist=1.01m front=0.82m cells=4 rms=2.3cm[103] DRIVE goal=(0.49,2.01) dist=0.99m front=0.80m cells=4 rms=2.3cm[104] DRIVE goal=(0.49,2.01) dist=0.97m front=0.86m cells=4 rms=2.3cm[105] DRIVE goal=(0.49,2.01) dist=0.96m front=0.85m cells=4 rms=2.2cm[106] DRIVE goal=(0.49,2.01) dist=0.94m front=0.85m cells=4 rms=2.2cm[107] DRIVE goal=(0.49,2.01) dist=0.91m front=0.84m cells=4 rms=2.2cm[108] DRIVE goal=(0.49,2.01) dist=0.90m front=0.83m cells=4 rms=2.2cm[109] DRIVE goal=(0.49,2.01) dist=0.87m front=0.83m cells=4 rms=2.2cm[110] DRIVE goal=(0.49,2.01) dist=0.85m front=0.81m cells=5 rms=2.2cm[111] DRIVE goal=(0.49,2.01) dist=0.84m front=0.81m cells=5 rms=2.2cm[112] DRIVE goal=(0.49,2.01) dist=0.83m front=0.80m cells=5 rms=2.2cm[113] DRIVE goal=(0.49,2.01) dist=0.81m front=0.79m cells=5 rms=2.2cm[114] DRIVE goal=(0.49,2.01) dist=0.79m front=0.78m cells=5 rms=2.2cm[115] DRIVE goal=(0.49,2.01) dist=0.77m front=0.77m cells=5 rms=2.2cm[116] DRIVE goal=(0.49,2.01) dist=0.75m front=0.77m cells=5 rms=2.2cm[117] DRIVE goal=(0.49,2.01) dist=0.73m front=0.76m cells=5 rms=2.2cm[118] DRIVE goal=(0.49,2.01) dist=0.71m front=0.74m cells=5 rms=2.2cm[119] DRIVE goal=(0.49,2.01) dist=0.69m front=0.74m cells=5 rms=2.2cm[120] DRIVE goal=(0.49,2.01) dist=0.67m front=0.72m cells=5 rms=2.2cm[121] DRIVE goal=(0.49,2.01) dist=0.65m front=0.72m cells=5 rms=2.2cm[122] DRIVE goal=(0.49,2.01) dist=0.63m front=0.72m cells=5 rms=2.2cm[123] DRIVE goal=(0.49,2.01) dist=0.62m front=0.71m cells=6 rms=2.2cm[124] DRIVE goal=(0.49,2.01) dist=0.59m front=1.12m cells=6 rms=2.2cm[125] DRIVE goal=(0.49,2.01) dist=0.57m front=1.10m cells=6 rms=2.2cm[126] DRIVE goal=(0.49,2.01) dist=0.56m front=1.09m cells=6 rms=2.1cm[127] DRIVE goal=(0.49,2.01) dist=0.53m front=1.08m cells=7 rms=2.1cm[128] DRIVE goal=(0.49,2.01) dist=0.51m front=1.08m cells=7 rms=2.1cm[129] DRIVE goal=(0.49,2.01) dist=0.50m front=1.08m cells=7 rms=2.1cm[130] DRIVE goal=(0.49,2.01) dist=0.47m front=1.07m cells=7 rms=2.1cm[131] DRIVE goal=(0.49,2.01) dist=0.45m front=1.06m cells=7 rms=2.1cm[132] DRIVE goal=(0.49,2.01) dist=0.43m front=1.04m cells=7 rms=2.1cm[133] DRIVE goal=(0.49,2.01) dist=0.42m front=1.04m cells=7 rms=2.1cm
[ 30.4s] [GOAL SELECT] robot@(0.37,1.64) | 17 candidates (scanned=132 walls=77 visited=7):
  #1 ang=  -9° d=1.50m pos=(0.95,3.02) score=+44.1 [O=+1.7 U=+38.0 V=-0.0 W=-1.0 R=-0.0 F=+4.9] <-- BEST
  #2 ang=  -3° d=1.50m pos=(0.80,3.08) score=+42.1 [O=+1.6 U=+36.0 V=-0.0 W=-1.0 R=-0.0 F=+5.0]
  #3 ang=  +3° d=1.50m pos=(0.64,3.11) score=+38.0 [O=+1.5 U=+32.0 V=-0.0 W=-1.0 R=-0.0 F=+5.0]
  #4 ang=  -9° d=1.00m pos=(0.75,2.56) score=+37.5 [O=+2.2 U=+30.0 V=-0.0 W=-0.0 R=-0.0 F=+4.9]
  #5 ang=  -3° d=1.00m pos=(0.65,2.60) score=+35.4 [O=+2.1 U=+28.0 V=-0.0 W=-0.0 R=-0.0 F=+5.0]
  #6 ang=  +9° d=1.50m pos=(0.48,3.13) score=+33.9 [O=+1.5 U=+28.0 V=-0.0 W=-1.0 R=-0.0 F=+4.9]
  #7 ang=-125° d=0.50m pos=(0.70,1.26) score=+32.0 [O=+1.7 U=+36.1 V=-0.0 W=-3.0 R=-0.0 F=-3.0]
  #8 ang=-131° d=0.50m pos=(0.65,1.23) score=+31.7 [O=+1.7 U=+36.2 V=-0.0 W=-3.0 R=-0.0 F=-3.4]
[ 30.4s] [GOAL] Selected: (0.95, 3.02) dist=1.50m timeout=42s angle=-9° reason=reached
[134] DRIVE goal=(0.95,3.02) dist=1.50m front=1.05m cells=7 rms=2.1cm[135] DRIVE goal=(0.95,3.02) dist=1.48m front=1.12m cells=7 rms=2.1cm[136] DRIVE goal=(0.95,3.02) dist=1.48m front=1.10m cells=7 rms=2.1cm[137] DRIVE goal=(0.95,3.02) dist=1.45m front=1.01m cells=7 rms=2.1cm[138] DRIVE goal=(0.95,3.02) dist=1.43m front=0.99m cells=7 rms=2.1cm[139] DRIVE goal=(0.95,3.02) dist=1.41m front=0.96m cells=7 rms=2.1cm[140] DRIVE goal=(0.95,3.02) dist=1.39m front=0.92m cells=7 rms=2.1cm[141] DRIVE goal=(0.95,3.02) dist=1.36m front=0.90m cells=7 rms=2.1cm[142] DRIVE goal=(0.95,3.02) dist=1.33m front=0.86m cells=7 rms=2.1cm[143] DRIVE goal=(0.95,3.02) dist=1.32m front=0.84m cells=8 rms=2.1cm[144] DRIVE goal=(0.95,3.02) dist=1.30m front=0.80m cells=8 rms=2.1cm[145] DRIVE goal=(0.95,3.02) dist=1.27m front=0.79m cells=8 rms=2.1cm[146] DRIVE goal=(0.95,3.02) dist=1.24m front=0.77m cells=8 rms=2.0cm[147] DRIVE goal=(0.95,3.02) dist=1.24m front=0.77m cells=8 rms=2.0cm[148] DRIVE goal=(0.95,3.02) dist=1.23m front=0.77m cells=8 rms=2.0cm[149] DRIVE goal=(0.95,3.02) dist=1.20m front=0.79m cells=8 rms=2.0cm[150] DRIVE goal=(0.95,3.02) dist=1.19m front=0.80m cells=8 rms=2.0cm[151] DRIVE goal=(0.95,3.02) dist=1.17m front=0.80m cells=8 rms=2.0cm[152] DRIVE goal=(0.95,3.02) dist=1.16m front=0.85m cells=8 rms=2.0cm[153] DRIVE goal=(0.95,3.02) dist=1.14m front=0.91m cells=8 rms=2.0cm[154] DRIVE goal=(0.95,3.02) dist=1.12m front=0.86m cells=8 rms=2.0cm[155] DRIVE goal=(0.95,3.02) dist=1.11m front=0.85m cells=8 rms=2.0cm[156] DRIVE goal=(0.95,3.02) dist=1.09m front=0.80m cells=8 rms=2.0cm[157] DRIVE goal=(0.95,3.02) dist=1.08m front=0.80m cells=8 rms=2.0cm[158] DRIVE goal=(0.95,3.02) dist=1.05m front=0.80m cells=8 rms=2.0cm[159] DRIVE goal=(0.95,3.02) dist=1.04m front=0.80m cells=8 rms=2.0cm[160] DRIVE goal=(0.95,3.02) dist=1.03m front=0.78m cells=8 rms=2.0cm[161] DRIVE goal=(0.95,3.02) dist=1.02m front=0.75m cells=8 rms=2.0cm[162] DRIVE goal=(0.95,3.02) dist=0.99m front=0.71m cells=9 rms=2.0cm[163] DRIVE goal=(0.95,3.02) dist=0.97m front=0.69m cells=9 rms=2.0cm[164] DRIVE goal=(0.95,3.02) dist=0.96m front=0.68m cells=9 rms=1.9cm[165] DRIVE goal=(0.95,3.02) dist=0.95m front=0.67m cells=9 rms=1.9cm[166] DRIVE goal=(0.95,3.02) dist=0.92m front=0.66m cells=9 rms=1.9cm[167] DRIVE goal=(0.95,3.02) dist=0.91m front=0.65m cells=9 rms=1.9cm[168] DRIVE goal=(0.95,3.02) dist=0.89m front=0.65m cells=10 rms=1.9cm[169] DRIVE goal=(0.95,3.02) dist=0.88m front=0.66m cells=10 rms=1.9cm[170] DRIVE goal=(0.95,3.02) dist=0.86m front=0.62m cells=10 rms=1.9cm[171] DRIVE goal=(0.95,3.02) dist=0.83m front=0.61m cells=10 rms=1.9cm[172] DRIVE goal=(0.95,3.02) dist=0.81m front=0.59m cells=10 rms=1.9cm[173] DRIVE goal=(0.95,3.02) dist=0.79m front=0.58m cells=10 rms=1.9cm[174] DRIVE goal=(0.95,3.02) dist=0.77m front=0.58m cells=10 rms=1.9cm[175] DRIVE goal=(0.95,3.02) dist=0.75m front=0.56m cells=10 rms=1.9cm[176] DRIVE goal=(0.95,3.02) dist=0.73m front=0.56m cells=10 rms=1.9cm[177] DRIVE goal=(0.95,3.02) dist=0.71m front=0.56m cells=10 rms=1.9cm[178] DRIVE goal=(0.95,3.02) dist=0.69m front=1.21m cells=10 rms=1.9cm[179] DRIVE goal=(0.95,3.02) dist=0.68m front=1.20m cells=10 rms=1.9cm[180] DRIVE goal=(0.95,3.02) dist=0.66m front=1.19m cells=11 rms=1.9cm[181] DRIVE goal=(0.95,3.02) dist=0.64m front=1.17m cells=11 rms=1.9cm[182] DRIVE goal=(0.95,3.02) dist=0.61m front=1.14m cells=11 rms=1.9cm[183] DRIVE goal=(0.95,3.02) dist=0.58m front=1.11m cells=11 rms=1.9cm[184] DRIVE goal=(0.95,3.02) dist=0.56m front=1.09m cells=11 rms=1.9cm[185] DRIVE goal=(0.95,3.02) dist=0.56m front=1.08m cells=11 rms=1.9cm[186] DRIVE goal=(0.95,3.02) dist=0.55m front=1.06m cells=11 rms=1.9cm[187] DRIVE goal=(0.95,3.02) dist=0.50m front=1.03m cells=11 rms=1.9cm[188] DRIVE goal=(0.95,3.02) dist=0.49m front=1.01m cells=11 rms=1.9cm[189] DRIVE goal=(0.95,3.02) dist=0.47m front=0.99m cells=11 rms=1.9cm[190] DRIVE goal=(0.95,3.02) dist=0.45m front=0.97m cells=11 rms=1.9cm[191] DRIVE goal=(0.95,3.02) dist=0.44m front=0.96m cells=11 rms=1.9cm[192] DRIVE goal=(0.95,3.02) dist=0.44m front=0.96m cells=11 rms=1.9cm[193] DRIVE goal=(0.95,3.02) dist=0.43m front=0.94m cells=11 rms=1.9cm[194] DRIVE goal=(0.95,3.02) dist=0.42m front=0.94m cells=11 rms=1.9cm[195] DRIVE goal=(0.95,3.02) dist=0.41m front=0.93m cells=11 rms=1.9cm
[ 43.2s] [GOAL SELECT] robot@(0.78,2.66) | 34 candidates (scanned=185 walls=103 visited=11):
  #1 ang= +39° d=2.00m pos=(0.17,4.56) score=+42.8 [O=+1.7 U=+36.4 V=-0.0 W=-0.0 R=-0.0 F=+4.1] <-- BEST
  #2 ang= +70° d=0.50m pos=(0.41,2.99) score=+41.1 [O=+1.9 U=+38.0 V=-0.0 W=-1.0 R=-0.0 F=+2.1]
  #3 ang= +76° d=0.50m pos=(0.37,2.95) score=+40.4 [O=+1.6 U=+38.0 V=-0.0 W=-1.0 R=-0.0 F=+1.6]
  #4 ang= +82° d=0.50m pos=(0.35,2.91) score=+39.8 [O=+1.5 U=+38.0 V=-0.0 W=-1.0 R=-0.0 F=+1.1]
  #5 ang= -52° d=2.00m pos=(2.70,3.21) score=+38.2 [O=+2.0 U=+34.0 V=-0.0 W=-1.0 R=-0.0 F=+2.7]
  #6 ang= -58° d=2.00m pos=(2.75,3.00) score=+35.3 [O=+1.5 U=+32.0 V=-0.0 W=-1.0 R=-0.0 F=+2.2]
  #7 ang= -39° d=1.50m pos=(2.10,3.37) score=+35.1 [O=+2.1 U=+32.0 V=-0.0 W=-3.0 R=-0.0 F=+3.5]
  #8 ang= -45° d=1.50m pos=(2.17,3.22) score=+33.1 [O=+2.5 U=+28.0 V=-0.0 W=-1.0 R=-0.0 F=+3.1]
[ 43.2s] [GOAL] Selected: (0.17, 4.56) dist=2.00m timeout=50s angle=39° reason=reached
[196] DRIVE goal=(0.17,4.56) dist=2.00m front=0.92m cells=11 rms=1.9cm[197] DRIVE goal=(0.17,4.56) dist=1.99m front=0.90m cells=11 rms=1.9cm[198] DRIVE goal=(0.17,4.56) dist=1.99m front=0.90m cells=11 rms=1.9cm
[ 43.9s] [TURN ENTER] Entering TURN mode

[BLOCKED DEBUG] Goal angle: 41.5° (sector 6), goal_dist: 1.99m, goal_dir_min: 1.00m, margin: 0.15m
[BLOCKED DEBUG] Checking 1 sectors (robot angular width at 2.0m = 5.2°): {6: 1.004}
[BLOCKED DEBUG] Check: 1.00 < 1.99 - 0.15 = 1.84? True
[BLOCKED DEBUG] (Full front arc for reference: {55: 2.05, 56: 2.144, 57: 1.332, 58: 1.204, 59: 1.106, 0: 1.033, 1: 0.978, 2: 0.933, 3: 0.905, 4: 0.891, 5: 0.897})

[BLOCKED TURN] goal_sector=6, best_sector=6 (dist=1.00m), target_angle=36.0°, angle_error=36.0°, v=0.00, w=0.50
[199] TURN goal=(0.17,4.56) dist=1.99m front=0.89m cells=11 rms=1.9cm[200] DRIVE goal=(0.17,4.56) dist=1.99m front=0.89m cells=11 rms=1.9cm[201] DRIVE goal=(0.17,4.56) dist=1.98m front=0.89m cells=11 rms=1.9cm[202] DRIVE goal=(0.17,4.56) dist=1.99m front=0.89m cells=11 rms=1.9cm[203] DRIVE goal=(0.17,4.56) dist=1.99m front=0.90m cells=11 rms=1.9cm[204] DRIVE goal=(0.17,4.56) dist=1.99m front=0.90m cells=11 rms=1.9cm[205] DRIVE goal=(0.17,4.56) dist=1.99m front=0.90m cells=11 rms=1.8cm[206] DRIVE goal=(0.17,4.56) dist=1.99m front=0.89m cells=11 rms=1.8cm[207] DRIVE goal=(0.17,4.56) dist=1.98m front=0.89m cells=11 rms=1.8cm[208] DRIVE goal=(0.17,4.56) dist=1.98m front=0.89m cells=11 rms=1.8cm[209] DRIVE goal=(0.17,4.56) dist=1.97m front=0.88m cells=11 rms=1.9cm[210] DRIVE goal=(0.17,4.56) dist=1.97m front=0.88m cells=11 rms=1.9cm[211] DRIVE goal=(0.17,4.56) dist=1.96m front=0.87m cells=12 rms=1.9cm[212] DRIVE goal=(0.17,4.56) dist=1.96m front=0.86m cells=12 rms=1.9cm[213] DRIVE goal=(0.17,4.56) dist=1.95m front=0.84m cells=12 rms=1.9cm[214] DRIVE goal=(0.17,4.56) dist=1.92m front=0.83m cells=12 rms=1.9cm[215] DRIVE goal=(0.17,4.56) dist=1.90m front=0.81m cells=12 rms=1.9cm[216] DRIVE goal=(0.17,4.56) dist=1.89m front=0.79m cells=12 rms=1.9cm[217] DRIVE goal=(0.17,4.56) dist=1.84m front=0.77m cells=12 rms=1.9cm[218] DRIVE goal=(0.17,4.56) dist=1.83m front=0.76m cells=12 rms=1.9cm[219] DRIVE goal=(0.17,4.56) dist=1.83m front=0.76m cells=12 rms=1.9cm[220] DRIVE goal=(0.17,4.56) dist=1.82m front=0.75m cells=12 rms=1.9cm[221] DRIVE goal=(0.17,4.56) dist=1.81m front=0.74m cells=12 rms=1.9cm[222] DRIVE goal=(0.17,4.56) dist=1.80m front=0.77m cells=12 rms=1.9cm[223] DRIVE goal=(0.17,4.56) dist=1.79m front=0.77m cells=12 rms=1.9cm[224] DRIVE goal=(0.17,4.56) dist=1.76m front=0.74m cells=12 rms=1.9cm[225] DRIVE goal=(0.17,4.56) dist=1.75m front=0.77m cells=12 rms=1.9cm[226] DRIVE goal=(0.17,4.56) dist=1.74m front=0.75m cells=12 rms=1.9cm[227] DRIVE goal=(0.17,4.56) dist=1.73m front=0.75m cells=12 rms=1.9cm[228] DRIVE goal=(0.17,4.56) dist=1.73m front=0.71m cells=12 rms=1.9cm[229] DRIVE goal=(0.17,4.56) dist=1.72m front=0.71m cells=12 rms=1.9cm[230] DRIVE goal=(0.17,4.56) dist=1.72m front=0.72m cells=12 rms=1.9cm[231] DRIVE goal=(0.17,4.56) dist=1.72m front=0.76m cells=12 rms=1.9cm[232] DRIVE goal=(0.17,4.56) dist=1.71m front=0.76m cells=12 rms=1.9cm[233] DRIVE goal=(0.17,4.56) dist=1.71m front=0.77m cells=12 rms=1.9cm[234] DRIVE goal=(0.17,4.56) dist=1.71m front=0.77m cells=12 rms=1.9cm[235] DRIVE goal=(0.17,4.56) dist=1.70m front=0.78m cells=12 rms=1.9cm[236] DRIVE goal=(0.17,4.56) dist=1.68m front=0.76m cells=12 rms=1.9cm[237] DRIVE goal=(0.17,4.56) dist=1.67m front=0.73m cells=12 rms=1.9cm[238] DRIVE goal=(0.17,4.56) dist=1.67m front=0.66m cells=12 rms=1.9cm[239] DRIVE goal=(0.17,4.56) dist=1.65m front=0.63m cells=12 rms=1.9cm[240] DRIVE goal=(0.17,4.56) dist=1.63m front=0.68m cells=13 rms=1.9cm[241] DRIVE goal=(0.17,4.56) dist=1.62m front=0.68m cells=13 rms=1.9cm[242] DRIVE goal=(0.17,4.56) dist=1.61m front=0.77m cells=13 rms=1.9cm[243] DRIVE goal=(0.17,4.56) dist=1.60m front=0.76m cells=13 rms=1.9cm[244] DRIVE goal=(0.17,4.56) dist=1.58m front=0.65m cells=13 rms=1.9cm[245] DRIVE goal=(0.17,4.56) dist=1.57m front=0.62m cells=13 rms=1.9cm[246] DRIVE goal=(0.17,4.56) dist=1.57m front=0.63m cells=13 rms=1.9cm[247] DRIVE goal=(0.17,4.56) dist=1.56m front=0.60m cells=13 rms=1.9cm[248] DRIVE goal=(0.17,4.56) dist=1.54m front=0.61m cells=13 rms=1.9cm[249] DRIVE goal=(0.17,4.56) dist=1.52m front=0.65m cells=13 rms=1.9cm[250] DRIVE goal=(0.17,4.56) dist=1.50m front=0.64m cells=13 rms=1.9cm[251] DRIVE goal=(0.17,4.56) dist=1.48m front=0.71m cells=13 rms=1.8cm[252] DRIVE goal=(0.17,4.56) dist=1.46m front=0.74m cells=13 rms=1.8cm[253] DRIVE goal=(0.17,4.56) dist=1.45m front=0.67m cells=14 rms=1.8cm[254] DRIVE goal=(0.17,4.56) dist=1.44m front=0.53m cells=14 rms=1.8cm[255] DRIVE goal=(0.17,4.56) dist=1.41m front=0.63m cells=14 rms=1.8cm[256] DRIVE goal=(0.17,4.56) dist=1.38m front=0.71m cells=14 rms=1.8cm[257] DRIVE goal=(0.17,4.56) dist=1.37m front=0.74m cells=14 rms=1.8cm[258] DRIVE goal=(0.17,4.56) dist=1.35m front=0.67m cells=14 rms=1.8cm[259] DRIVE goal=(0.17,4.56) dist=1.33m front=0.76m cells=14 rms=1.8cm[260] DRIVE goal=(0.17,4.56) dist=1.31m front=0.78m cells=15 rms=1.8cm[261] DRIVE goal=(0.17,4.56) dist=1.30m front=0.75m cells=15 rms=1.8cm[262] DRIVE goal=(0.17,4.56) dist=1.28m front=0.69m cells=15 rms=1.8cm[263] DRIVE goal=(0.17,4.56) dist=1.26m front=0.61m cells=15 rms=1.8cm[264] DRIVE goal=(0.17,4.56) dist=1.24m front=0.65m cells=15 rms=1.8cm[265] DRIVE goal=(0.17,4.56) dist=1.24m front=0.65m cells=15 rms=1.9cm[266] DRIVE goal=(0.17,4.56) dist=1.23m front=0.70m cells=15 rms=1.9cm[267] DRIVE goal=(0.17,4.56) dist=1.22m front=0.71m cells=15 rms=1.9cm[268] DRIVE goal=(0.17,4.56) dist=1.22m front=0.71m cells=15 rms=1.9cm[269] DRIVE goal=(0.17,4.56) dist=1.21m front=0.71m cells=15 rms=1.9cm[270] DRIVE goal=(0.17,4.56) dist=1.20m front=0.69m cells=15 rms=1.9cm[271] DRIVE goal=(0.17,4.56) dist=1.18m front=0.74m cells=15 rms=1.9cm[272] DRIVE goal=(0.17,4.56) dist=1.18m front=0.72m cells=15 rms=1.9cm[273] DRIVE goal=(0.17,4.56) dist=1.17m front=0.72m cells=15 rms=1.9cm[274] DRIVE goal=(0.17,4.56) dist=1.17m front=0.72m cells=15 rms=1.9cm[275] DRIVE goal=(0.17,4.56) dist=1.15m front=0.72m cells=15 rms=1.9cm[276] DRIVE goal=(0.17,4.56) dist=1.12m front=0.77m cells=15 rms=1.9cm[277] DRIVE goal=(0.17,4.56) dist=1.09m front=0.79m cells=15 rms=1.9cm[278] DRIVE goal=(0.17,4.56) dist=1.08m front=0.66m cells=15 rms=1.9cm[279] DRIVE goal=(0.17,4.56) dist=1.06m front=0.61m cells=15 rms=1.9cm[280] DRIVE goal=(0.17,4.56) dist=1.04m front=0.56m cells=15 rms=2.0cm[281] DRIVE goal=(0.17,4.56) dist=1.01m front=0.55m cells=15 rms=2.0cm[282] DRIVE goal=(0.17,4.56) dist=1.00m front=0.53m cells=15 rms=2.0cm[283] DRIVE goal=(0.17,4.56) dist=0.99m front=0.59m cells=16 rms=2.0cm[284] DRIVE goal=(0.17,4.56) dist=0.99m front=0.58m cells=16 rms=2.0cm[285] DRIVE goal=(0.17,4.56) dist=0.99m front=0.62m cells=16 rms=2.0cm[286] DRIVE goal=(0.17,4.56) dist=0.99m front=0.63m cells=16 rms=2.1cm[287] DRIVE goal=(0.17,4.56) dist=0.98m front=0.65m cells=16 rms=2.1cm[288] DRIVE goal=(0.17,4.56) dist=0.99m front=0.72m cells=16 rms=2.1cm[289] DRIVE goal=(0.17,4.56) dist=0.97m front=0.70m cells=16 rms=2.1cm[290] DRIVE goal=(0.17,4.56) dist=0.97m front=0.67m cells=16 rms=2.2cm[291] DRIVE goal=(0.17,4.56) dist=0.97m front=0.64m cells=16 rms=2.2cm[292] DRIVE goal=(0.17,4.56) dist=0.97m front=0.65m cells=16 rms=2.2cm[293] DRIVE goal=(0.17,4.56) dist=0.97m front=0.65m cells=16 rms=2.2cm[294] DRIVE goal=(0.17,4.56) dist=0.97m front=0.63m cells=16 rms=2.3cm[295] DRIVE goal=(0.17,4.56) dist=0.97m front=0.63m cells=16 rms=2.3cm[296] DRIVE goal=(0.17,4.56) dist=0.97m front=0.64m cells=16 rms=2.3cm[297] DRIVE goal=(0.17,4.56) dist=0.97m front=0.63m cells=16 rms=2.3cm[298] DRIVE goal=(0.17,4.56) dist=0.97m front=0.65m cells=16 rms=2.3cm[299] DRIVE goal=(0.17,4.56) dist=0.97m front=0.64m cells=16 rms=2.4cm[300] DRIVE goal=(0.17,4.56) dist=0.97m front=0.64m cells=16 rms=2.4cm[301] DRIVE goal=(0.17,4.56) dist=0.97m front=0.64m cells=16 rms=2.4cm[302] DRIVE goal=(0.17,4.56) dist=0.97m front=0.64m cells=16 rms=2.4cm[303] DRIVE goal=(0.17,4.56) dist=0.97m front=0.63m cells=16 rms=2.4cm[304] DRIVE goal=(0.17,4.56) dist=0.98m front=0.63m cells=16 rms=2.5cm[305] DRIVE goal=(0.17,4.56) dist=0.97m front=0.66m cells=16 rms=2.5cm[306] DRIVE goal=(0.17,4.56) dist=0.97m front=0.65m cells=16 rms=2.5cm[307] DRIVE goal=(0.17,4.56) dist=0.97m front=0.64m cells=16 rms=2.5cm[308] DRIVE goal=(0.17,4.56) dist=0.97m front=0.64m cells=16 rms=2.5cm[309] DRIVE goal=(0.17,4.56) dist=0.97m front=0.64m cells=16 rms=2.5cm[310] DRIVE goal=(0.17,4.56) dist=0.97m front=0.64m cells=16 rms=2.6cm[311] DRIVE goal=(0.17,4.56) dist=0.97m front=0.65m cells=16 rms=2.6cm[312] DRIVE goal=(0.17,4.56) dist=0.97m front=0.66m cells=16 rms=2.6cm[313] DRIVE goal=(0.17,4.56) dist=0.97m front=0.64m cells=16 rms=2.6cm
[ 67.0s] [DRIVE STUCK] Goal distance unchanged for 6.9s
[DRIVE STUCK] dist_oldest=1.04m, dist_now=0.97m, change=0.07m < margin=0.08m
[DRIVE STUCK] Front sectors: s55=0.63 s56=0.71 s57=0.85 s58=1.03 s59=1.48 s0=1.86 s1=1.91 s2=2.69 s3=2.72 s4=2.77 s5=2.85 
[DRIVE STUCK] Marked front sectors [55, 56, 57, 58, 59, 0, 1, 2, 3, 4, 5] as blocked for 30s

[BACKUP CLEAR] Reversing and turning toward clearer side...
[BACKUP CLEAR] Turning left (L_avg=2.59m R_avg=0.94m)

[ 72.0s] [GOAL SELECT] robot@(0.42,3.51) | 14 candidates (scanned=220 walls=132 visited=16):
  #1 ang=-119° d=2.00m pos=(2.38,3.11) score=+28.6 [O=+2.0 U=+27.0 V=-0.0 W=-1.0 R=-0.0 F=+0.0] <-- BEST
  #2 ang=-125° d=1.50m pos=(1.85,3.06) score=+20.1 [O=+2.0 U=+20.7 V=-0.0 W=-3.0 R=-0.0 F=+0.0]
  #3 ang=-119° d=1.50m pos=(1.89,3.21) score=+18.9 [O=+2.5 U=+19.0 V=-0.0 W=-3.0 R=-0.0 F=+0.0]
  #4 ang=-125° d=1.00m pos=(1.37,3.21) score=+9.4 [O=+2.5 U=+12.7 V=-0.0 W=-3.0 R=-3.1 F=+0.0]
  #5 ang= -27° d=0.50m pos=(0.50,4.00) score=-80.8 [O=+1.5 U=+20.6 V=-0.0 W=-3.0 R=-0.0 F=+0.0 B=-100.0]
  #6 ang= -21° d=0.50m pos=(0.45,4.01) score=-109.8 [O=+1.9 U=+16.2 V=-0.0 W=-3.0 R=-0.0 F=+0.0 B=-125.0]
  #7 ang=  +9° d=2.00m pos=(-0.49,5.29) score=-115.2 [O=+1.9 U=+32.3 V=-0.0 W=-0.0 R=-0.0 F=+0.0 B=-150.0]
  #8 ang=  +3° d=2.00m pos=(-0.30,5.38) score=-119.2 [O=+1.8 U=+32.0 V=-0.0 W=-1.0 R=-2.6 F=+0.0 B=-150.0]
[ 72.0s] [GOAL] Selected: (2.38, 3.11) dist=2.00m timeout=50s angle=-119° reason=no goal
[315] DRIVE goal=(2.38,3.11) dist=2.00m front=0.67m cells=16 rms=2.6cm[316] DRIVE goal=(2.38,3.11) dist=2.00m front=0.62m cells=16 rms=2.6cm[317] DRIVE goal=(2.38,3.11) dist=2.00m front=0.59m cells=16 rms=2.6cm[318] DRIVE goal=(2.38,3.11) dist=2.00m front=0.56m cells=16 rms=2.6cm[319] DRIVE goal=(2.38,3.11) dist=2.01m front=0.58m cells=16 rms=2.6cm[320] DRIVE goal=(2.38,3.11) dist=2.00m front=0.63m cells=16 rms=2.6cm[321] DRIVE goal=(2.38,3.11) dist=2.00m front=0.63m cells=16 rms=2.6cm[322] DRIVE goal=(2.38,3.11) dist=2.00m front=0.62m cells=16 rms=2.6cm[323] DRIVE goal=(2.38,3.11) dist=2.00m front=0.65m cells=16 rms=2.6cm[324] DRIVE goal=(2.38,3.11) dist=2.00m front=0.63m cells=16 rms=2.6cm[325] DRIVE goal=(2.38,3.11) dist=2.00m front=0.65m cells=16 rms=2.6cm[326] DRIVE goal=(2.38,3.11) dist=2.00m front=0.69m cells=16 rms=2.6cm[327] DRIVE goal=(2.38,3.11) dist=2.00m front=0.68m cells=16 rms=2.6cm[328] DRIVE goal=(2.38,3.11) dist=2.00m front=0.69m cells=16 rms=2.6cm[329] DRIVE goal=(2.38,3.11) dist=2.01m front=0.70m cells=16 rms=2.6cm[330] DRIVE goal=(2.38,3.11) dist=2.01m front=0.72m cells=16 rms=2.6cm[331] DRIVE goal=(2.38,3.11) dist=2.00m front=0.69m cells=16 rms=2.5cm[332] DRIVE goal=(2.38,3.11) dist=2.01m front=0.67m cells=16 rms=2.5cm[333] DRIVE goal=(2.38,3.11) dist=2.01m front=0.63m cells=16 rms=2.5cm[334] DRIVE goal=(2.38,3.11) dist=2.01m front=0.58m cells=16 rms=2.5cm[335] DRIVE goal=(2.38,3.11) dist=2.01m front=0.54m cells=16 rms=2.5cm[336] DRIVE goal=(2.38,3.11) dist=2.01m front=0.54m cells=16 rms=2.5cm[337] DRIVE goal=(2.38,3.11) dist=2.01m front=0.53m cells=16 rms=2.5cm[338] DRIVE goal=(2.38,3.11) dist=2.01m front=0.53m cells=16 rms=2.5cm[339] DRIVE goal=(2.38,3.11) dist=2.01m front=0.52m cells=16 rms=2.5cm[340] DRIVE goal=(2.38,3.11) dist=2.01m front=0.51m cells=16 rms=2.5cm[341] DRIVE goal=(2.38,3.11) dist=2.01m front=0.51m cells=16 rms=2.5cm[342] DRIVE goal=(2.38,3.11) dist=2.01m front=0.51m cells=16 rms=2.5cm[343] DRIVE goal=(2.38,3.11) dist=2.01m front=0.51m cells=16 rms=2.5cm[344] DRIVE goal=(2.38,3.11) dist=2.01m front=0.48m cells=16 rms=2.5cm[345] DRIVE goal=(2.38,3.11) dist=2.01m front=0.44m cells=16 rms=2.5cm[346] DRIVE goal=(2.38,3.11) dist=2.01m front=0.44m cells=16 rms=2.5cm[347] DRIVE goal=(2.38,3.11) dist=2.01m front=0.44m cells=16 rms=2.5cm[348] DRIVE goal=(2.38,3.11) dist=2.01m front=0.44m cells=16 rms=2.5cm[349] DRIVE goal=(2.38,3.11) dist=2.01m front=0.44m cells=16 rms=2.5cm[350] DRIVE goal=(2.38,3.11) dist=2.01m front=0.44m cells=16 rms=2.5cm[351] DRIVE goal=(2.38,3.11) dist=2.01m front=0.43m cells=16 rms=2.5cm[352] DRIVE goal=(2.38,3.11) dist=2.01m front=0.43m cells=16 rms=2.5cm[353] DRIVE goal=(2.38,3.11) dist=2.01m front=0.43m cells=16 rms=2.5cm[354] DRIVE goal=(2.38,3.11) dist=2.01m front=0.43m cells=16 rms=2.5cm[355] DRIVE goal=(2.38,3.11) dist=2.02m front=0.43m cells=16 rms=2.5cm[356] DRIVE goal=(2.38,3.11) dist=2.02m front=0.43m cells=16 rms=2.5cm[357] DRIVE goal=(2.38,3.11) dist=2.02m front=0.43m cells=16 rms=2.5cm[358] DRIVE goal=(2.38,3.11) dist=2.02m front=0.43m cells=16 rms=2.5cm[359] DRIVE goal=(2.38,3.11) dist=2.02m front=0.43m cells=16 rms=2.4cm[360] DRIVE goal=(2.38,3.11) dist=2.02m front=0.43m cells=16 rms=2.4cm[361] DRIVE goal=(2.38,3.11) dist=2.02m front=0.43m cells=16 rms=2.4cm[362] DRIVE goal=(2.38,3.11) dist=2.02m front=0.43m cells=16 rms=2.4cm[363] DRIVE goal=(2.38,3.11) dist=2.02m front=0.43m cells=16 rms=2.4cm[364] DRIVE goal=(2.38,3.11) dist=2.01m front=0.43m cells=16 rms=2.4cm[365] DRIVE goal=(2.38,3.11) dist=2.01m front=0.44m cells=16 rms=2.4cm[366] DRIVE goal=(2.38,3.11) dist=2.01m front=0.44m cells=16 rms=2.4cm[367] DRIVE goal=(2.38,3.11) dist=2.01m front=0.44m cells=16 rms=2.4cm[368] DRIVE goal=(2.38,3.11) dist=2.01m front=0.44m cells=16 rms=2.4cm[369] DRIVE goal=(2.38,3.11) dist=2.01m front=0.44m cells=16 rms=2.4cm[370] DRIVE goal=(2.38,3.11) dist=2.01m front=0.44m cells=16 rms=2.4cm[371] DRIVE goal=(2.38,3.11) dist=2.00m front=0.43m cells=16 rms=2.4cm[372] DRIVE goal=(2.38,3.11) dist=1.99m front=0.42m cells=16 rms=2.4cm[373] DRIVE goal=(2.38,3.11) dist=1.99m front=0.41m cells=16 rms=2.4cm[374] DRIVE goal=(2.38,3.11) dist=1.98m front=0.40m cells=16 rms=2.4cm[375] DRIVE goal=(2.38,3.11) dist=1.96m front=0.39m cells=16 rms=2.4cm[376] DRIVE goal=(2.38,3.11) dist=1.96m front=0.40m cells=16 rms=2.4cm[377] DRIVE goal=(2.38,3.11) dist=1.95m front=0.39m cells=16 rms=2.4cm[378] DRIVE goal=(2.38,3.11) dist=1.95m front=0.40m cells=16 rms=2.4cm[379] DRIVE goal=(2.38,3.11) dist=1.93m front=0.40m cells=16 rms=2.4cm[380] DRIVE goal=(2.38,3.11) dist=1.93m front=0.37m cells=16 rms=2.4cm[381] DRIVE goal=(2.38,3.11) dist=1.92m front=0.37m cells=16 rms=2.4cm[382] DRIVE goal=(2.38,3.11) dist=1.89m front=0.36m cells=16 rms=2.4cm[383] DRIVE goal=(2.38,3.11) dist=1.88m front=0.41m cells=16 rms=2.4cm[384] DRIVE goal=(2.38,3.11) dist=1.87m front=0.48m cells=16 rms=2.4cm[385] DRIVE goal=(2.38,3.11) dist=1.82m front=0.64m cells=17 rms=2.4cm[386] DRIVE goal=(2.38,3.11) dist=1.82m front=0.64m cells=17 rms=2.4cm[387] DRIVE goal=(2.38,3.11) dist=1.79m front=0.56m cells=17 rms=2.4cm[388] DRIVE goal=(2.38,3.11) dist=1.77m front=0.46m cells=17 rms=2.4cm[389] DRIVE goal=(2.38,3.11) dist=1.75m front=0.39m cells=17 rms=2.4cm[390] DRIVE goal=(2.38,3.11) dist=1.73m front=0.28m cells=17 rms=2.4cm[391] DRIVE goal=(2.38,3.11) dist=1.72m front=0.27m cells=17 rms=2.4cm[392] DRIVE goal=(2.38,3.11) dist=1.71m front=0.29m cells=17 rms=2.4cm[393] DRIVE goal=(2.38,3.11) dist=1.70m front=0.31m cells=17 rms=2.4cm[394] DRIVE goal=(2.38,3.11) dist=1.69m front=0.28m cells=17 rms=2.4cm[395] DRIVE goal=(2.38,3.11) dist=1.69m front=0.47m cells=17 rms=2.4cm[396] DRIVE goal=(2.38,3.11) dist=1.68m front=0.43m cells=17 rms=2.5cm[397] DRIVE goal=(2.38,3.11) dist=1.66m front=0.95m cells=17 rms=2.5cm[398] DRIVE goal=(2.38,3.11) dist=1.65m front=0.93m cells=17 rms=2.5cm[399] DRIVE goal=(2.38,3.11) dist=1.64m front=0.91m cells=17 rms=2.5cm[400] DRIVE goal=(2.38,3.11) dist=1.62m front=0.89m cells=17 rms=2.5cm[401] DRIVE goal=(2.38,3.11) dist=1.61m front=0.87m cells=17 rms=2.5cm[402] DRIVE goal=(2.38,3.11) dist=1.60m front=0.86m cells=17 rms=2.5cm[403] DRIVE goal=(2.38,3.11) dist=1.58m front=0.85m cells=17 rms=2.5cm[404] DRIVE goal=(2.38,3.11) dist=1.55m front=0.82m cells=17 rms=2.5cm[405] DRIVE goal=(2.38,3.11) dist=1.54m front=0.81m cells=17 rms=2.5cm[406] DRIVE goal=(2.38,3.11) dist=1.52m front=0.84m cells=17 rms=2.5cm[407] DRIVE goal=(2.38,3.11) dist=1.53m front=0.85m cells=17 rms=2.5cm[408] DRIVE goal=(2.38,3.11) dist=1.52m front=0.87m cells=17 rms=2.5cm[409] DRIVE goal=(2.38,3.11) dist=1.50m front=0.86m cells=18 rms=2.5cm[410] DRIVE goal=(2.38,3.11) dist=1.49m front=0.84m cells=18 rms=2.5cm[411] DRIVE goal=(2.38,3.11) dist=1.47m front=0.81m cells=18 rms=2.5cm[412] DRIVE goal=(2.38,3.11) dist=1.44m front=0.81m cells=18 rms=2.5cm[413] DRIVE goal=(2.38,3.11) dist=1.44m front=0.80m cells=18 rms=2.5cm[414] DRIVE goal=(2.38,3.11) dist=1.41m front=0.76m cells=18 rms=2.5cm[415] DRIVE goal=(2.38,3.11) dist=1.39m front=0.76m cells=18 rms=2.5cm[416] DRIVE goal=(2.38,3.11) dist=1.35m front=0.76m cells=18 rms=2.5cm[417] DRIVE goal=(2.38,3.11) dist=1.36m front=0.78m cells=18 rms=2.5cm[418] DRIVE goal=(2.38,3.11) dist=1.35m front=0.79m cells=18 rms=2.5cm[419] DRIVE goal=(2.38,3.11) dist=1.34m front=0.84m cells=18 rms=2.5cm[420] DRIVE goal=(2.38,3.11) dist=1.33m front=0.84m cells=18 rms=2.5cm[421] DRIVE goal=(2.38,3.11) dist=1.31m front=0.78m cells=18 rms=2.5cm[422] DRIVE goal=(2.38,3.11) dist=1.28m front=0.71m cells=18 rms=2.5cm[423] DRIVE goal=(2.38,3.11) dist=1.26m front=0.70m cells=18 rms=2.5cm[424] DRIVE goal=(2.38,3.11) dist=1.25m front=0.70m cells=18 rms=2.5cm[425] DRIVE goal=(2.38,3.11) dist=1.23m front=0.78m cells=18 rms=2.5cm[426] DRIVE goal=(2.38,3.11) dist=1.23m front=0.79m cells=18 rms=2.5cm[427] DRIVE goal=(2.38,3.11) dist=1.22m front=0.79m cells=18 rms=2.5cm[428] DRIVE goal=(2.38,3.11) dist=1.22m front=0.79m cells=18 rms=2.5cm[429] DRIVE goal=(2.38,3.11) dist=1.20m front=0.82m cells=18 rms=2.5cm[430] DRIVE goal=(2.38,3.11) dist=1.19m front=0.80m cells=19 rms=2.5cm[431] DRIVE goal=(2.38,3.11) dist=1.16m front=0.78m cells=19 rms=2.5cm[432] DRIVE goal=(2.38,3.11) dist=1.14m front=1.09m cells=19 rms=2.5cm[433] DRIVE goal=(2.38,3.11) dist=1.12m front=1.34m cells=19 rms=2.5cm[434] DRIVE goal=(2.38,3.11) dist=1.11m front=1.33m cells=19 rms=2.5cm[435] DRIVE goal=(2.38,3.11) dist=1.08m front=1.30m cells=19 rms=2.5cm[436] DRIVE goal=(2.38,3.11) dist=1.06m front=1.04m cells=19 rms=2.5cm[437] DRIVE goal=(2.38,3.11) dist=1.06m front=1.03m cells=19 rms=2.5cm[438] DRIVE goal=(2.38,3.11) dist=1.05m front=1.02m cells=19 rms=2.5cm[439] DRIVE goal=(2.38,3.11) dist=1.04m front=1.01m cells=19 rms=2.5cm[440] DRIVE goal=(2.38,3.11) dist=1.02m front=0.72m cells=19 rms=2.5cm[441] DRIVE goal=(2.38,3.11) dist=0.99m front=0.97m cells=19 rms=2.5cm[442] DRIVE goal=(2.38,3.11) dist=0.97m front=0.96m cells=19 rms=2.5cm[443] DRIVE goal=(2.38,3.11) dist=0.96m front=0.94m cells=19 rms=2.4cm[444] DRIVE goal=(2.38,3.11) dist=0.94m front=1.18m cells=19 rms=2.4cm[445] DRIVE goal=(2.38,3.11) dist=0.93m front=1.17m cells=20 rms=2.4cm[446] DRIVE goal=(2.38,3.11) dist=0.93m front=1.15m cells=20 rms=2.4cm[447] DRIVE goal=(2.38,3.11) dist=0.91m front=1.14m cells=20 rms=2.4cm[448] DRIVE goal=(2.38,3.11) dist=0.89m front=1.11m cells=21 rms=2.4cm[449] DRIVE goal=(2.38,3.11) dist=0.88m front=1.32m cells=21 rms=2.4cm[450] DRIVE goal=(2.38,3.11) dist=0.86m front=1.31m cells=21 rms=2.4cm[451] DRIVE goal=(2.38,3.11) dist=0.85m front=1.30m cells=21 rms=2.4cm[452] DRIVE goal=(2.38,3.11) dist=0.85m front=1.29m cells=21 rms=2.4cm[453] DRIVE goal=(2.38,3.11) dist=0.83m front=1.28m cells=21 rms=2.4cm[454] DRIVE goal=(2.38,3.11) dist=0.82m front=1.27m cells=21 rms=2.4cm[455] DRIVE goal=(2.38,3.11) dist=0.80m front=0.85m cells=21 rms=2.4cm[456] DRIVE goal=(2.38,3.11) dist=0.78m front=1.23m cells=21 rms=2.4cm[457] DRIVE goal=(2.38,3.11) dist=0.75m front=1.00m cells=21 rms=2.4cm[458] DRIVE goal=(2.38,3.11) dist=0.73m front=1.19m cells=21 rms=2.4cm[459] DRIVE goal=(2.38,3.11) dist=0.72m front=1.18m cells=21 rms=2.4cm[460] DRIVE goal=(2.38,3.11) dist=0.70m front=0.96m cells=21 rms=2.4cm[461] DRIVE goal=(2.38,3.11) dist=0.70m front=0.97m cells=21 rms=2.4cm[462] DRIVE goal=(2.38,3.11) dist=0.70m front=0.96m cells=21 rms=2.4cm[463] DRIVE goal=(2.38,3.11) dist=0.68m front=0.94m cells=21 rms=2.4cm[464] DRIVE goal=(2.38,3.11) dist=0.67m front=0.93m cells=21 rms=2.4cm[465] DRIVE goal=(2.38,3.11) dist=0.67m front=0.92m cells=21 rms=2.4cm[466] DRIVE goal=(2.38,3.11) dist=0.66m front=0.91m cells=21 rms=2.4cm[467] DRIVE goal=(2.38,3.11) dist=0.66m front=0.91m cells=21 rms=2.4cm[468] DRIVE goal=(2.38,3.11) dist=0.65m front=0.91m cells=21 rms=2.4cm[469] DRIVE goal=(2.38,3.11) dist=0.65m front=1.11m cells=21 rms=2.4cm[470] DRIVE goal=(2.38,3.11) dist=0.63m front=1.10m cells=21 rms=2.4cm[471] DRIVE goal=(2.38,3.11) dist=0.62m front=1.09m cells=21 rms=2.4cm[472] DRIVE goal=(2.38,3.11) dist=0.61m front=1.08m cells=21 rms=2.4cm[473] DRIVE goal=(2.38,3.11) dist=0.60m front=1.08m cells=21 rms=2.4cm[474] DRIVE goal=(2.38,3.11) dist=0.59m front=1.07m cells=22 rms=2.4cm[475] DRIVE goal=(2.38,3.11) dist=0.59m front=1.06m cells=22 rms=2.4cm[476] DRIVE goal=(2.38,3.11) dist=0.59m front=1.06m cells=22 rms=2.5cm[477] DRIVE goal=(2.38,3.11) dist=0.57m front=1.05m cells=22 rms=2.5cm[478] DRIVE goal=(2.38,3.11) dist=0.55m front=1.03m cells=22 rms=2.5cm[479] DRIVE goal=(2.38,3.11) dist=0.54m front=1.02m cells=22 rms=2.5cm[480] DRIVE goal=(2.38,3.11) dist=0.53m front=1.00m cells=22 rms=2.5cm[481] DRIVE goal=(2.38,3.11) dist=0.52m front=0.79m cells=22 rms=2.5cm[482] DRIVE goal=(2.38,3.11) dist=0.52m front=1.00m cells=22 rms=2.5cm[483] DRIVE goal=(2.38,3.11) dist=0.50m front=0.98m cells=22 rms=2.5cm[484] DRIVE goal=(2.38,3.11) dist=0.49m front=0.98m cells=22 rms=2.5cm[485] DRIVE goal=(2.38,3.11) dist=0.47m front=0.96m cells=22 rms=2.5cm[486] DRIVE goal=(2.38,3.11) dist=0.46m front=0.95m cells=22 rms=2.5cm[487] DRIVE goal=(2.38,3.11) dist=0.46m front=0.95m cells=22 rms=2.6cm[488] DRIVE goal=(2.38,3.11) dist=0.46m front=0.94m cells=22 rms=2.6cm[489] DRIVE goal=(2.38,3.11) dist=0.44m front=0.93m cells=22 rms=2.6cm[490] DRIVE goal=(2.38,3.11) dist=0.44m front=0.93m cells=22 rms=2.6cm[491] DRIVE goal=(2.38,3.11) dist=0.42m front=0.91m cells=22 rms=2.6cm[492] DRIVE goal=(2.38,3.11) dist=0.40m front=0.90m cells=22 rms=2.6cm
[107.8s] [GOAL SELECT] robot@(2.02,3.25) | 23 candidates (scanned=301 walls=182 visited=22):
  #1 ang= -27° d=1.50m pos=(3.19,2.31) score=+38.4 [O=+1.6 U=+38.0 V=-0.0 W=-1.0 R=-0.0 F=-0.6] <-- BEST
  #2 ang=  +9° d=1.00m pos=(3.02,3.21) score=+36.0 [O=+1.8 U=+34.5 V=-0.0 W=-3.0 R=-0.0 F=+2.5]
  #3 ang= -33° d=1.50m pos=(3.08,2.19) score=+34.4 [O=+2.1 U=+34.0 V=-0.0 W=-1.0 R=-0.0 F=-1.1]
  #4 ang= -39° d=1.50m pos=(2.96,2.08) score=+33.8 [O=+2.0 U=+34.0 V=-0.0 W=-1.0 R=-0.0 F=-1.6]
  #5 ang= -52° d=1.50m pos=(2.69,1.91) score=+32.7 [O=+1.8 U=+34.0 V=-0.0 W=-1.0 R=-0.0 F=-2.6]
  #6 ang= +52° d=0.50m pos=(2.40,3.57) score=+31.7 [O=+1.8 U=+32.0 V=-0.0 W=-3.0 R=-4.0 F=+4.8]
  #7 ang=  +3° d=0.50m pos=(2.51,3.18) score=+29.0 [O=+1.8 U=+30.0 V=-0.0 W=-1.0 R=-4.0 F=+2.0]
  #8 ang=  -3° d=0.50m pos=(2.50,3.12) score=+26.7 [O=+1.8 U=+28.3 V=-0.0 W=-1.0 R=-4.0 F=+1.5]
[107.8s] [GOAL] Selected: (3.19, 2.31) dist=1.50m timeout=42s angle=-27° reason=reached
[493] DRIVE goal=(3.19,2.31) dist=1.50m front=0.88m cells=22 rms=2.6cm[494] DRIVE goal=(3.19,2.31) dist=1.50m front=0.88m cells=22 rms=2.6cm[495] DRIVE goal=(3.19,2.31) dist=1.49m front=0.87m cells=22 rms=2.6cm[496] DRIVE goal=(3.19,2.31) dist=1.49m front=0.87m cells=22 rms=2.6cm[497] DRIVE goal=(3.19,2.31) dist=1.49m front=0.87m cells=22 rms=2.6cm[498] DRIVE goal=(3.19,2.31) dist=1.49m front=0.87m cells=22 rms=2.6cm[499] DRIVE goal=(3.19,2.31) dist=1.48m front=0.86m cells=22 rms=2.6cm[500] DRIVE goal=(3.19,2.31) dist=1.48m front=0.85m cells=22 rms=2.6cm[501] DRIVE goal=(3.19,2.31) dist=1.48m front=0.86m cells=22 rms=2.6cm[502] DRIVE goal=(3.19,2.31) dist=1.46m front=0.84m cells=22 rms=2.6cm[503] DRIVE goal=(3.19,2.31) dist=1.45m front=0.82m cells=22 rms=2.6cm[504] DRIVE goal=(3.19,2.31) dist=1.45m front=0.83m cells=22 rms=2.6cm[505] DRIVE goal=(3.19,2.31) dist=1.45m front=0.82m cells=22 rms=2.6cm[506] DRIVE goal=(3.19,2.31) dist=1.41m front=0.79m cells=22 rms=2.6cm[507] DRIVE goal=(3.19,2.31) dist=1.40m front=0.77m cells=23 rms=2.6cm[508] DRIVE goal=(3.19,2.31) dist=1.39m front=0.76m cells=23 rms=2.6cm[509] DRIVE goal=(3.19,2.31) dist=1.37m front=0.73m cells=23 rms=2.6cm[510] DRIVE goal=(3.19,2.31) dist=1.34m front=0.70m cells=23 rms=2.6cm[511] DRIVE goal=(3.19,2.31) dist=1.35m front=0.69m cells=23 rms=2.6cm[512] DRIVE goal=(3.19,2.31) dist=1.30m front=0.66m cells=23 rms=2.6cm[513] DRIVE goal=(3.19,2.31) dist=1.29m front=0.65m cells=23 rms=2.6cm[514] DRIVE goal=(3.19,2.31) dist=1.29m front=0.64m cells=23 rms=2.6cm[515] DRIVE goal=(3.19,2.31) dist=1.26m front=0.62m cells=23 rms=2.6cm[516] DRIVE goal=(3.19,2.31) dist=1.24m front=0.59m cells=23 rms=2.6cm[517] DRIVE goal=(3.19,2.31) dist=1.22m front=0.57m cells=23 rms=2.6cm[518] DRIVE goal=(3.19,2.31) dist=1.20m front=0.56m cells=23 rms=2.6cm[519] DRIVE goal=(3.19,2.31) dist=1.18m front=0.54m cells=23 rms=2.6cm[520] DRIVE goal=(3.19,2.31) dist=1.17m front=0.51m cells=23 rms=2.6cm[521] DRIVE goal=(3.19,2.31) dist=1.14m front=0.49m cells=23 rms=2.6cm[522] DRIVE goal=(3.19,2.31) dist=1.13m front=0.48m cells=23 rms=2.6cm[523] DRIVE goal=(3.19,2.31) dist=1.10m front=0.46m cells=23 rms=2.6cm[524] DRIVE goal=(3.19,2.31) dist=1.09m front=0.45m cells=24 rms=2.6cm[525] DRIVE goal=(3.19,2.31) dist=1.08m front=0.45m cells=24 rms=2.6cm[526] DRIVE goal=(3.19,2.31) dist=1.08m front=0.44m cells=24 rms=2.6cm[527] DRIVE goal=(3.19,2.31) dist=1.06m front=0.43m cells=24 rms=2.6cm[528] DRIVE goal=(3.19,2.31) dist=1.02m front=0.39m cells=24 rms=2.6cm[529] DRIVE goal=(3.19,2.31) dist=1.01m front=0.38m cells=25 rms=2.6cm[530] DRIVE goal=(3.19,2.31) dist=0.99m front=0.36m cells=25 rms=2.6cm[531] DRIVE goal=(3.19,2.31) dist=0.97m front=0.34m cells=25 rms=2.6cm[532] DRIVE goal=(3.19,2.31) dist=0.96m front=0.33m cells=25 rms=2.6cm[533] DRIVE goal=(3.19,2.31) dist=0.95m front=0.32m cells=25 rms=2.6cm[534] DRIVE goal=(3.19,2.31) dist=0.93m front=0.30m cells=25 rms=2.6cm[535] DRIVE goal=(3.19,2.31) dist=0.92m front=0.29m cells=25 rms=2.6cm[536] DRIVE goal=(3.19,2.31) dist=0.92m front=0.28m cells=25 rms=2.6cm[537] DRIVE goal=(3.19,2.31) dist=0.91m front=0.27m cells=25 rms=2.6cm[538] DRIVE goal=(3.19,2.31) dist=0.90m front=0.26m cells=25 rms=2.6cm
[117.1s] [TURN ENTER] Entering TURN mode

[BLOCKED DEBUG] Goal angle: -5.3° (sector 59), goal_dist: 0.88m, goal_dir_min: 0.28m, margin: 0.15m
[BLOCKED DEBUG] Checking 1 sectors (robot angular width at 0.9m = 11.7°): {59: 0.278}
[BLOCKED DEBUG] Check: 0.28 < 0.88 - 0.15 = 0.73? True
[BLOCKED DEBUG] (Full front arc for reference: {55: 1.875, 56: 1.923, 57: 1.883, 58: 1.453, 59: 0.278, 0: 0.244, 1: 0.244, 2: 1.418, 3: 1.347, 4: 1.287, 5: 1.237})

[BLOCKED TURN] goal_sector=59, best_sector=58 (dist=1.45m), target_angle=-12.0°, angle_error=-12.0°, v=0.00, w=-0.31
[539] TURN goal=(3.19,2.31) dist=0.88m front=0.24m cells=25 rms=2.6cm[540] TURN goal=(3.19,2.31) dist=0.87m front=0.23m cells=25 rms=2.6cm[541] DRIVE goal=(3.19,2.31) dist=0.86m front=0.23m cells=25 rms=2.6cm[542] DRIVE goal=(3.19,2.31) dist=0.86m front=0.22m cells=25 rms=2.6cm[543] DRIVE goal=(3.19,2.31) dist=0.86m front=0.22m cells=25 rms=2.6cm[544] DRIVE goal=(3.19,2.31) dist=0.84m front=0.21m cells=25 rms=2.6cm[545] DRIVE goal=(3.19,2.31) dist=0.84m front=0.20m cells=25 rms=2.6cm[546] DRIVE goal=(3.19,2.31) dist=0.82m front=0.18m cells=25 rms=2.5cm[547] DRIVE goal=(3.19,2.31) dist=0.81m front=0.18m cells=25 rms=2.5cm
[118.9s] [TURN ENTER] Entering TURN mode

[BLOCKED DEBUG] Goal angle: 1.1° (sector 0), goal_dist: 0.80m, goal_dir_min: 0.20m, margin: 0.15m
[BLOCKED DEBUG] Checking 1 sectors (robot angular width at 0.8m = 12.9°): {0: 0.195}
[BLOCKED DEBUG] Check: 0.20 < 0.80 - 0.15 = 0.65? True
[BLOCKED DEBUG] (Full front arc for reference: {55: 1.224, 56: 1.808, 57: 1.858, 58: 1.807, 59: 1.383, 0: 0.195, 1: 0.184, 2: 0.162, 3: 1.38, 4: 1.298, 5: 1.236})

[BLOCKED TURN] goal_sector=0, best_sector=59 (dist=1.38m), target_angle=-6.0°, angle_error=-6.0°, v=0.00, w=-0.16
[548] TURN goal=(3.19,2.31) dist=0.80m front=0.16m cells=25 rms=2.5cm[549] TURN goal=(3.19,2.31) dist=0.78m front=0.15m cells=25 rms=2.5cm
[119.3s] [BACKUP] front=0.14m

[BACKUP] Reversing...
[BACKUP] Turning right (L_openings=7 R_openings=7)

[123.0s] [GOAL SELECT] robot@(2.53,2.86) | 17 candidates (scanned=329 walls=203 visited=25):
  #1 ang= -21° d=1.00m pos=(2.85,1.91) score=+31.4 [O=+1.8 U=+34.0 V=-0.0 W=-1.0 R=-3.7 F=+0.0] <-- BEST
  #2 ang= -27° d=1.00m pos=(2.74,1.88) score=+31.4 [O=+1.8 U=+34.0 V=-0.0 W=-1.0 R=-3.7 F=+0.0]
  #3 ang= -39° d=0.50m pos=(2.53,2.36) score=+27.4 [O=+2.0 U=+32.0 V=-0.0 W=-3.0 R=-3.7 F=+0.0]
  #4 ang= +70° d=0.50m pos=(3.00,3.03) score=+26.2 [O=+1.7 U=+27.3 V=-0.0 W=-3.0 R=-0.0 F=+0.0]
  #5 ang= -58° d=0.50m pos=(2.38,2.38) score=+25.9 [O=+1.8 U=+26.9 V=-0.0 W=-3.0 R=-0.0 F=+0.0]
  #6 ang=  -9° d=1.00m pos=(3.04,2.00) score=+25.8 [O=+1.9 U=+34.1 V=-0.0 W=-3.0 R=-7.5 F=+0.0]
  #7 ang= -45° d=0.50m pos=(2.48,2.36) score=+25.5 [O=+2.0 U=+30.1 V=-0.0 W=-3.0 R=-3.7 F=+0.0]
  #8 ang= -33° d=0.50m pos=(2.59,2.36) score=+25.0 [O=+1.6 U=+30.0 V=-0.0 W=-3.0 R=-3.7 F=+0.0]
[123.0s] [GOAL] Selected: (2.85, 1.91) dist=1.00m timeout=35s angle=-21° reason=no goal
[551] DRIVE goal=(2.85,1.91) dist=1.00m front=0.23m cells=25 rms=2.5cm[552] DRIVE goal=(2.85,1.91) dist=1.01m front=0.23m cells=25 rms=2.5cm[553] DRIVE goal=(2.85,1.91) dist=1.01m front=0.24m cells=25 rms=2.5cm[554] DRIVE goal=(2.85,1.91) dist=1.00m front=0.24m cells=25 rms=2.5cm[555] DRIVE goal=(2.85,1.91) dist=1.00m front=0.27m cells=25 rms=2.5cm[556] DRIVE goal=(2.85,1.91) dist=0.96m front=1.07m cells=25 rms=2.5cm[557] DRIVE goal=(2.85,1.91) dist=0.95m front=1.06m cells=25 rms=2.5cm[558] DRIVE goal=(2.85,1.91) dist=0.94m front=1.13m cells=25 rms=2.5cm[559] DRIVE goal=(2.85,1.91) dist=0.93m front=1.03m cells=25 rms=2.5cm[560] DRIVE goal=(2.85,1.91) dist=0.91m front=1.03m cells=25 rms=2.5cm[561] DRIVE goal=(2.85,1.91) dist=0.89m front=1.09m cells=25 rms=2.5cm[562] DRIVE goal=(2.85,1.91) dist=0.87m front=1.08m cells=25 rms=2.5cm[563] DRIVE goal=(2.85,1.91) dist=0.84m front=0.96m cells=25 rms=2.5cm[564] DRIVE goal=(2.85,1.91) dist=0.82m front=1.04m cells=26 rms=2.5cm[565] DRIVE goal=(2.85,1.91) dist=0.80m front=1.02m cells=26 rms=2.5cm[566] DRIVE goal=(2.85,1.91) dist=0.79m front=0.91m cells=26 rms=2.5cm[567] DRIVE goal=(2.85,1.91) dist=0.77m front=1.00m cells=26 rms=2.5cm[568] DRIVE goal=(2.85,1.91) dist=0.75m front=0.97m cells=26 rms=2.5cm[569] DRIVE goal=(2.85,1.91) dist=0.72m front=0.93m cells=26 rms=2.5cm[570] DRIVE goal=(2.85,1.91) dist=0.70m front=0.84m cells=26 rms=2.5cm[571] DRIVE goal=(2.85,1.91) dist=0.69m front=0.97m cells=26 rms=2.5cm[572] DRIVE goal=(2.85,1.91) dist=0.66m front=0.95m cells=26 rms=2.5cm[573] DRIVE goal=(2.85,1.91) dist=0.64m front=0.88m cells=26 rms=2.5cm[574] DRIVE goal=(2.85,1.91) dist=0.62m front=0.92m cells=26 rms=2.5cm[575] DRIVE goal=(2.85,1.91) dist=0.60m front=0.74m cells=26 rms=2.5cm[576] DRIVE goal=(2.85,1.91) dist=0.58m front=0.73m cells=26 rms=2.5cm[577] DRIVE goal=(2.85,1.91) dist=0.57m front=0.71m cells=26 rms=2.5cm[578] DRIVE goal=(2.85,1.91) dist=0.55m front=0.84m cells=26 rms=2.5cm[579] DRIVE goal=(2.85,1.91) dist=0.52m front=0.67m cells=27 rms=2.5cm[580] DRIVE goal=(2.85,1.91) dist=0.50m front=0.66m cells=27 rms=2.5cm[581] DRIVE goal=(2.85,1.91) dist=0.49m front=0.65m cells=27 rms=2.5cm[582] DRIVE goal=(2.85,1.91) dist=0.47m front=0.62m cells=27 rms=2.5cm[583] DRIVE goal=(2.85,1.91) dist=0.45m front=0.60m cells=27 rms=2.5cm[584] DRIVE goal=(2.85,1.91) dist=0.42m front=0.59m cells=27 rms=2.5cm[585] DRIVE goal=(2.85,1.91) dist=0.41m front=0.65m cells=27 rms=2.5cm
[130.2s] [GOAL SELECT] robot@(2.68,2.27) | 11 candidates (scanned=329 walls=206 visited=27):
  #1 ang= +82° d=0.50m pos=(3.18,2.34) score=+29.2 [O=+1.6 U=+40.0 V=-0.0 W=-3.0 R=-13.8 F=+4.2] <-- BEST
  #2 ang= +76° d=0.50m pos=(3.18,2.28) score=+28.9 [O=+1.6 U=+40.0 V=-0.0 W=-3.0 R=-13.8 F=+3.9]
  #3 ang= +88° d=0.50m pos=(3.17,2.39) score=+28.1 [O=+1.6 U=+38.6 V=-0.0 W=-3.0 R=-13.8 F=+4.5]
  #4 ang= +70° d=0.50m pos=(3.18,2.23) score=+26.7 [O=+1.7 U=+38.0 V=-0.0 W=-3.0 R=-13.8 F=+3.6]
  #5 ang= +64° d=0.50m pos=(3.18,2.18) score=+26.3 [O=+1.8 U=+38.0 V=-0.0 W=-3.0 R=-13.8 F=+3.2]
  #6 ang= +58° d=0.50m pos=(3.16,2.12) score=+26.0 [O=+1.8 U=+38.0 V=-0.0 W=-3.0 R=-13.8 F=+2.8]
  #7 ang= +39° d=0.50m pos=(3.10,1.98) score=+19.3 [O=+1.8 U=+34.1 V=-0.0 W=-3.0 R=-15.1 F=+1.3]
  #8 ang= +21° d=0.50m pos=(2.98,1.87) score=+18.4 [O=+1.8 U=+34.0 V=-0.0 W=-1.0 R=-16.3 F=-0.3]
[130.2s] [GOAL] Selected: (3.18, 2.34) dist=0.50m timeout=28s angle=82° reason=reached
[586] DRIVE goal=(3.18,2.34) dist=0.50m front=0.64m cells=27 rms=2.5cm[587] DRIVE goal=(3.18,2.34) dist=0.50m front=0.57m cells=27 rms=2.5cm[588] DRIVE goal=(3.18,2.34) dist=0.50m front=0.55m cells=27 rms=2.5cm[589] DRIVE goal=(3.18,2.34) dist=0.50m front=0.51m cells=27 rms=2.5cm[590] DRIVE goal=(3.18,2.34) dist=0.50m front=0.62m cells=27 rms=2.5cm[591] DRIVE goal=(3.18,2.34) dist=0.50m front=0.59m cells=27 rms=2.5cm[592] DRIVE goal=(3.18,2.34) dist=0.50m front=0.63m cells=27 rms=2.5cm[593] DRIVE goal=(3.18,2.34) dist=0.50m front=0.63m cells=27 rms=2.5cm[594] DRIVE goal=(3.18,2.34) dist=0.50m front=0.63m cells=27 rms=2.6cm[595] DRIVE goal=(3.18,2.34) dist=0.50m front=0.62m cells=28 rms=2.6cm[596] DRIVE goal=(3.18,2.34) dist=0.50m front=0.62m cells=28 rms=2.6cm[597] DRIVE goal=(3.18,2.34) dist=0.50m front=0.62m cells=28 rms=2.6cm[598] DRIVE goal=(3.18,2.34) dist=0.50m front=0.63m cells=28 rms=2.6cm[599] DRIVE goal=(3.18,2.34) dist=0.49m front=0.62m cells=28 rms=2.6cm[600] DRIVE goal=(3.18,2.34) dist=0.50m front=0.62m cells=28 rms=2.6cm[601] DRIVE goal=(3.18,2.34) dist=0.50m front=0.63m cells=28 rms=2.6cm[602] DRIVE goal=(3.18,2.34) dist=0.50m front=0.86m cells=28 rms=2.6cm[603] DRIVE goal=(3.18,2.34) dist=0.50m front=0.86m cells=28 rms=2.6cm[604] DRIVE goal=(3.18,2.34) dist=0.50m front=0.86m cells=28 rms=2.6cm[605] DRIVE goal=(3.18,2.34) dist=0.50m front=0.86m cells=28 rms=2.6cm[606] DRIVE goal=(3.18,2.34) dist=0.50m front=0.86m cells=28 rms=2.7cm[607] DRIVE goal=(3.18,2.34) dist=0.50m front=0.86m cells=28 rms=2.7cm[608] DRIVE goal=(3.18,2.34) dist=0.50m front=0.86m cells=28 rms=2.7cm[609] DRIVE goal=(3.18,2.34) dist=0.50m front=0.86m cells=28 rms=2.7cm[610] DRIVE goal=(3.18,2.34) dist=0.50m front=0.86m cells=28 rms=2.7cm[611] DRIVE goal=(3.18,2.34) dist=0.50m front=0.86m cells=28 rms=2.7cm[612] DRIVE goal=(3.18,2.34) dist=0.50m front=0.86m cells=28 rms=2.7cm[613] DRIVE goal=(3.18,2.34) dist=0.50m front=0.86m cells=28 rms=2.7cm[614] DRIVE goal=(3.18,2.34) dist=0.50m front=0.86m cells=28 rms=2.7cm[615] DRIVE goal=(3.18,2.34) dist=0.50m front=0.86m cells=28 rms=2.7cm[616] DRIVE goal=(3.18,2.34) dist=0.50m front=0.86m cells=28 rms=2.7cm[617] DRIVE goal=(3.18,2.34) dist=0.50m front=0.86m cells=28 rms=2.7cm[618] DRIVE goal=(3.18,2.34) dist=0.50m front=0.87m cells=28 rms=2.8cm[619] DRIVE goal=(3.18,2.34) dist=0.51m front=1.06m cells=28 rms=2.8cm[620] DRIVE goal=(3.18,2.34) dist=0.51m front=1.06m cells=28 rms=2.8cm[621] DRIVE goal=(3.18,2.34) dist=0.49m front=1.04m cells=28 rms=2.8cm[622] DRIVE goal=(3.18,2.34) dist=0.49m front=1.04m cells=28 rms=2.8cm[623] DRIVE goal=(3.18,2.34) dist=0.48m front=1.03m cells=28 rms=2.8cm[624] DRIVE goal=(3.18,2.34) dist=0.47m front=0.70m cells=28 rms=2.8cm[625] DRIVE goal=(3.18,2.34) dist=0.46m front=0.69m cells=28 rms=2.8cm[626] DRIVE goal=(3.18,2.34) dist=0.45m front=0.67m cells=28 rms=2.8cm[627] DRIVE goal=(3.18,2.34) dist=0.42m front=0.65m cells=28 rms=2.8cm
[138.8s] [REFINE] best score 18.3 < 20.0, resampling with 150 angles (level 1)

[138.8s] [GOAL SELECT] robot@(2.80,2.24) | 41 candidates (refined 1x) (scanned=340 walls=218 visited=28):
  #1 ang= +43° d=1.00m pos=(3.07,3.20) score=+21.1 [O=+2.5 U=+17.2 V=-0.0 W=-3.0 R=-0.0 F=+4.1] <-- BEST
  #2 ang= -47° d=0.50m pos=(3.28,2.10) score=+19.0 [O=+1.6 U=+38.2 V=-0.0 W=-3.0 R=-20.8 F=+2.9]
  #3 ang= -49° d=0.50m pos=(3.27,2.08) score=+18.9 [O=+1.6 U=+38.2 V=-0.0 W=-3.0 R=-20.8 F=+2.7]
  #4 ang= -51° d=0.50m pos=(3.26,2.06) score=+18.8 [O=+1.6 U=+38.2 V=-0.0 W=-3.0 R=-20.8 F=+2.6]
  #5 ang= -37° d=0.50m pos=(3.29,2.18) score=+18.4 [O=+1.5 U=+40.0 V=-0.0 W=-3.0 R=-23.8 F=+3.5]
  #6 ang= -39° d=0.50m pos=(3.29,2.17) score=+18.3 [O=+1.5 U=+40.0 V=-0.0 W=-3.0 R=-23.8 F=+3.4]
  #7 ang= +51° d=1.00m pos=(2.93,3.23) score=+17.0 [O=+2.5 U=+13.6 V=-0.0 W=-3.0 R=-0.0 F=+3.6]
  #8 ang= +49° d=1.00m pos=(2.97,3.22) score=+16.7 [O=+2.5 U=+13.2 V=-0.0 W=-3.0 R=-0.0 F=+3.7]
[138.8s] [GOAL] Selected: (3.07, 3.20) dist=1.00m timeout=35s angle=43° reason=reached
[628] DRIVE goal=(3.07,3.20) dist=1.00m front=0.62m cells=28 rms=2.8cm[629] DRIVE goal=(3.07,3.20) dist=0.99m front=0.61m cells=28 rms=2.8cm[630] DRIVE goal=(3.07,3.20) dist=0.99m front=0.60m cells=28 rms=2.8cm[631] DRIVE goal=(3.07,3.20) dist=0.99m front=0.60m cells=28 rms=2.8cm[632] DRIVE goal=(3.07,3.20) dist=0.99m front=0.60m cells=28 rms=2.8cm[633] DRIVE goal=(3.07,3.20) dist=0.99m front=0.60m cells=28 rms=2.8cm[634] DRIVE goal=(3.07,3.20) dist=0.99m front=0.60m cells=28 rms=2.8cm[635] DRIVE goal=(3.07,3.20) dist=0.99m front=0.59m cells=28 rms=2.8cm[636] DRIVE goal=(3.07,3.20) dist=0.98m front=0.59m cells=28 rms=2.8cm[637] DRIVE goal=(3.07,3.20) dist=0.98m front=0.59m cells=28 rms=2.8cm[638] DRIVE goal=(3.07,3.20) dist=0.98m front=0.59m cells=28 rms=2.8cm[639] DRIVE goal=(3.07,3.20) dist=0.97m front=0.59m cells=28 rms=2.8cm[640] DRIVE goal=(3.07,3.20) dist=0.98m front=0.59m cells=28 rms=2.8cm[641] DRIVE goal=(3.07,3.20) dist=0.98m front=0.59m cells=28 rms=2.8cm[642] DRIVE goal=(3.07,3.20) dist=0.99m front=0.59m cells=28 rms=2.8cm[643] DRIVE goal=(3.07,3.20) dist=0.99m front=0.59m cells=28 rms=2.8cm[644] DRIVE goal=(3.07,3.20) dist=0.98m front=0.59m cells=28 rms=2.8cm[645] DRIVE goal=(3.07,3.20) dist=0.98m front=0.59m cells=28 rms=2.8cm[646] DRIVE goal=(3.07,3.20) dist=0.99m front=0.59m cells=28 rms=2.8cm[647] DRIVE goal=(3.07,3.20) dist=1.00m front=0.60m cells=28 rms=2.8cm[648] DRIVE goal=(3.07,3.20) dist=0.99m front=0.60m cells=28 rms=2.8cm[649] DRIVE goal=(3.07,3.20) dist=0.99m front=0.60m cells=28 rms=2.8cm[650] DRIVE goal=(3.07,3.20) dist=0.97m front=0.58m cells=28 rms=2.8cm[651] DRIVE goal=(3.07,3.20) dist=0.96m front=0.33m cells=28 rms=2.8cm[652] DRIVE goal=(3.07,3.20) dist=0.94m front=0.56m cells=28 rms=2.8cm[653] DRIVE goal=(3.07,3.20) dist=0.92m front=0.56m cells=28 rms=2.8cm[654] DRIVE goal=(3.07,3.20) dist=0.91m front=0.31m cells=28 rms=2.8cm[655] DRIVE goal=(3.07,3.20) dist=0.89m front=0.27m cells=28 rms=2.8cm[656] DRIVE goal=(3.07,3.20) dist=0.87m front=0.25m cells=28 rms=2.8cm[657] DRIVE goal=(3.07,3.20) dist=0.86m front=0.24m cells=28 rms=2.8cm[658] DRIVE goal=(3.07,3.20) dist=0.84m front=1.15m cells=28 rms=2.8cm[659] DRIVE goal=(3.07,3.20) dist=0.82m front=1.14m cells=29 rms=2.8cm[660] DRIVE goal=(3.07,3.20) dist=0.82m front=1.14m cells=29 rms=2.8cm[661] DRIVE goal=(3.07,3.20) dist=0.81m front=1.13m cells=29 rms=2.8cm[662] DRIVE goal=(3.07,3.20) dist=0.80m front=1.11m cells=29 rms=2.8cm[663] DRIVE goal=(3.07,3.20) dist=0.79m front=1.11m cells=29 rms=2.8cm[664] DRIVE goal=(3.07,3.20) dist=0.77m front=1.09m cells=29 rms=2.8cm[665] DRIVE goal=(3.07,3.20) dist=0.77m front=1.09m cells=29 rms=2.8cm[666] DRIVE goal=(3.07,3.20) dist=0.74m front=1.06m cells=29 rms=2.8cm[667] DRIVE goal=(3.07,3.20) dist=0.71m front=1.04m cells=29 rms=2.8cm[668] DRIVE goal=(3.07,3.20) dist=0.71m front=1.02m cells=29 rms=2.8cm[669] DRIVE goal=(3.07,3.20) dist=0.70m front=1.03m cells=29 rms=2.8cm[670] DRIVE goal=(3.07,3.20) dist=0.69m front=1.02m cells=29 rms=2.8cm[671] DRIVE goal=(3.07,3.20) dist=0.68m front=1.01m cells=29 rms=2.8cm[672] DRIVE goal=(3.07,3.20) dist=0.68m front=1.01m cells=29 rms=2.8cm[673] DRIVE goal=(3.07,3.20) dist=0.68m front=0.99m cells=29 rms=2.8cm[674] DRIVE goal=(3.07,3.20) dist=0.68m front=1.00m cells=29 rms=2.8cm[675] DRIVE goal=(3.07,3.20) dist=0.67m front=0.99m cells=29 rms=2.8cm[676] DRIVE goal=(3.07,3.20) dist=0.67m front=0.99m cells=29 rms=2.8cm[677] DRIVE goal=(3.07,3.20) dist=0.60m front=0.90m cells=29 rms=2.8cm[678] DRIVE goal=(3.07,3.20) dist=0.58m front=0.88m cells=29 rms=2.8cm[679] DRIVE goal=(3.07,3.20) dist=0.58m front=0.88m cells=29 rms=2.8cm[680] DRIVE goal=(3.07,3.20) dist=0.58m front=0.88m cells=29 rms=2.8cm[681] DRIVE goal=(3.07,3.20) dist=0.57m front=0.87m cells=29 rms=2.8cm[682] DRIVE goal=(3.07,3.20) dist=0.57m front=0.87m cells=29 rms=2.8cm[683] DRIVE goal=(3.07,3.20) dist=0.57m front=0.87m cells=29 rms=2.8cm[684] DRIVE goal=(3.07,3.20) dist=0.57m front=0.87m cells=29 rms=2.8cm[685] DRIVE goal=(3.07,3.20) dist=0.56m front=0.87m cells=29 rms=2.8cm[686] DRIVE goal=(3.07,3.20) dist=0.56m front=0.86m cells=29 rms=2.8cm[687] DRIVE goal=(3.07,3.20) dist=0.55m front=0.86m cells=29 rms=2.8cm[688] DRIVE goal=(3.07,3.20) dist=0.55m front=0.85m cells=29 rms=2.8cm[689] DRIVE goal=(3.07,3.20) dist=0.55m front=0.85m cells=29 rms=2.8cm[690] DRIVE goal=(3.07,3.20) dist=0.55m front=0.85m cells=29 rms=2.8cm[691] DRIVE goal=(3.07,3.20) dist=0.54m front=0.85m cells=29 rms=2.8cm[692] DRIVE goal=(3.07,3.20) dist=0.52m front=0.83m cells=30 rms=2.8cm[693] DRIVE goal=(3.07,3.20) dist=0.52m front=0.82m cells=30 rms=2.8cm[694] DRIVE goal=(3.07,3.20) dist=0.44m front=0.93m cells=30 rms=2.9cm[695] DRIVE goal=(3.07,3.20) dist=0.42m front=0.32m cells=30 rms=2.9cm
[152.6s] [REFINE] only 0 candidates, resampling with 150 angles (level 1)

[152.6s] [REFINE] only 1 candidates, resampling with 450 angles (level 2)

[152.6s] [REFINE] only 3 candidates, resampling with 1350 angles (level 3)

[152.6s] [GOAL SELECT] robot@(2.90,2.85) | 9 candidates (refined 3x) (scanned=356 walls=237 visited=30):
  #1 ang= +90° d=1.00m pos=(1.92,3.03) score=+12.0 [O=+2.5 U=+16.0 V=-1.0 W=-3.0 R=-0.0 F=-2.9] <-- BEST
  #2 ang= +90° d=1.00m pos=(1.92,3.03) score=+12.0 [O=+2.5 U=+16.0 V=-1.0 W=-3.0 R=-0.0 F=-2.9]
  #3 ang= +90° d=1.00m pos=(1.92,3.02) score=+11.9 [O=+2.5 U=+16.0 V=-1.0 W=-3.0 R=-0.0 F=-2.9]
  #4 ang= +90° d=1.00m pos=(1.92,3.02) score=+11.9 [O=+2.5 U=+16.0 V=-1.0 W=-3.0 R=-0.0 F=-2.9]
  #5 ang= +91° d=1.00m pos=(1.92,3.02) score=+11.9 [O=+2.5 U=+16.0 V=-1.0 W=-3.0 R=-0.0 F=-2.9]
  #6 ang= +91° d=1.00m pos=(1.92,3.01) score=+11.9 [O=+2.5 U=+16.0 V=-1.0 W=-3.0 R=-0.0 F=-3.0]
  #7 ang= +91° d=1.00m pos=(1.92,3.01) score=+11.9 [O=+2.5 U=+16.0 V=-1.0 W=-3.0 R=-0.0 F=-3.0]
  #8 ang= +91° d=1.00m pos=(1.92,3.00) score=+11.9 [O=+2.5 U=+16.0 V=-1.0 W=-3.0 R=-0.0 F=-3.0]
[152.6s] [GOAL] Selected: (1.92, 3.03) dist=1.00m timeout=35s angle=90° reason=reached
[696] DRIVE goal=(1.92,3.03) dist=1.00m front=0.25m cells=30 rms=2.9cm[697] DRIVE goal=(1.92,3.03) dist=1.04m front=0.71m cells=31 rms=3.3cm[698] DRIVE goal=(1.92,3.03) dist=1.08m front=0.45m cells=32 rms=3.8cm[699] DRIVE goal=(1.92,3.03) dist=1.15m front=0.70m cells=32 rms=4.6cm[700] DRIVE goal=(1.92,3.03) dist=1.25m front=0.69m cells=33 rms=5.7cm[701] DRIVE goal=(1.92,3.03) dist=1.32m front=0.67m cells=33 rms=6.8cm[702] DRIVE goal=(1.92,3.03) dist=1.37m front=0.71m cells=34 rms=7.9cm[703] DRIVE goal=(1.92,3.03) dist=1.46m front=0.67m cells=34 rms=9.1cm[704] DRIVE goal=(1.92,3.03) dist=1.61m front=0.67m cells=35 rms=10.5cm[705] DRIVE goal=(1.92,3.03) dist=1.67m front=0.68m cells=35 rms=11.8cm[706] DRIVE goal=(1.92,3.03) dist=1.79m front=0.72m cells=35 rms=13.3cm[707] DRIVE goal=(1.92,3.03) dist=1.91m front=0.73m cells=36 rms=14.8cm[708] DRIVE goal=(1.92,3.03) dist=2.11m front=0.75m cells=37 rms=16.6cm[709] DRIVE goal=(1.92,3.03) dist=2.25m front=0.76m cells=37 rms=18.5cm[710] DRIVE goal=(1.92,3.03) dist=2.33m front=0.77m cells=38 rms=20.3cm[711] DRIVE goal=(1.92,3.03) dist=2.48m front=0.78m cells=38 rms=22.2cm[712] DRIVE goal=(1.92,3.03) dist=2.64m front=0.76m cells=39 rms=24.2cm[713] DRIVE goal=(1.92,3.03) dist=2.80m front=0.76m cells=39 rms=26.3cm[714] DRIVE goal=(1.92,3.03) dist=2.97m front=0.78m cells=40 rms=28.4cm[715] DRIVE goal=(1.92,3.03) dist=3.14m front=0.77m cells=41 rms=30.7cm[716] DRIVE goal=(1.92,3.03) dist=3.32m front=0.76m cells=41 rms=33.1cm[717] DRIVE goal=(1.92,3.03) dist=3.51m front=0.77m cells=42 rms=35.5cm[718] DRIVE goal=(1.92,3.03) dist=1.43m front=0.80m cells=43 rms=35.8cm[719] DRIVE goal=(1.92,3.03) dist=1.44m front=0.82m cells=43 rms=36.1cm[720] DRIVE goal=(1.92,3.03) dist=1.50m front=0.82m cells=44 rms=36.4cm[721] DRIVE goal=(1.92,3.03) dist=1.52m front=0.81m cells=44 rms=36.8cm
[158.0s] [TURN ENTER] Entering TURN mode

[BLOCKED DEBUG] Goal angle: 31.4° (sector 5), goal_dist: 1.61m, goal_dir_min: 1.41m, margin: 0.15m
[BLOCKED DEBUG] Checking 1 sectors (robot angular width at 1.6m = 6.4°): {5: 1.407}
[BLOCKED DEBUG] Check: 1.41 < 1.61 - 0.15 = 1.46? True
[BLOCKED DEBUG] (Full front arc for reference: {55: 1.252, 56: 1.235, 57: 1.223, 58: 1.224, 59: 0.827, 0: 0.819, 1: 1.284, 2: 1.341, 3: 1.43, 4: 1.536, 5: 1.407})

[BLOCKED TURN] goal_sector=5, best_sector=5 (dist=1.41m), target_angle=30.0°, angle_error=30.0°, v=0.00, w=0.50
[722] TURN goal=(1.92,3.03) dist=1.61m front=0.82m cells=45 rms=37.2cm[723] DRIVE goal=(1.92,3.03) dist=1.68m front=0.82m cells=46 rms=37.6cm[724] DRIVE goal=(1.92,3.03) dist=1.69m front=0.81m cells=46 rms=38.1cm[725] DRIVE goal=(1.92,3.03) dist=1.73m front=0.81m cells=46 rms=38.6cm
[158.8s] [TURN ENTER] Entering TURN mode

[BLOCKED DEBUG] Goal angle: 12.3° (sector 2), goal_dist: 1.73m, goal_dir_min: 1.50m, margin: 0.15m
[BLOCKED DEBUG] Checking 1 sectors (robot angular width at 1.7m = 5.9°): {2: 1.501}
[BLOCKED DEBUG] Check: 1.50 < 1.73 - 0.15 = 1.58? True
[BLOCKED DEBUG] (Full front arc for reference: {55: 1.733, 56: 1.394, 57: 0.806, 58: 0.824, 59: 2.17, 0: 2.39, 1: 1.746, 2: 1.501, 3: 1.407, 4: 1.308, 5: 1.31})

[BLOCKED TURN] goal_sector=2, best_sector=2 (dist=1.50m), target_angle=12.0°, angle_error=12.0°, v=0.00, w=0.31
[726] TURN goal=(1.92,3.03) dist=1.73m front=0.81m cells=46 rms=39.0cm[727] TURN goal=(1.92,3.03) dist=1.73m front=0.80m cells=46 rms=39.5cm[728] TURN goal=(1.92,3.03) dist=1.73m front=0.79m cells=46 rms=40.0cm[729] TURN goal=(1.92,3.03) dist=1.69m front=0.78m cells=46 rms=40.4cm[730] TURN goal=(1.92,3.03) dist=1.69m front=0.78m cells=46 rms=40.8cm[731] TURN goal=(1.92,3.03) dist=1.60m front=0.78m cells=46 rms=41.2cm[732] TURN goal=(1.92,3.03) dist=1.68m front=0.78m cells=46 rms=41.6cm[733] TURN goal=(1.92,3.03) dist=1.70m front=0.78m cells=46 rms=42.0cm[734] TURN goal=(1.92,3.03) dist=1.65m front=0.78m cells=46 rms=42.4cm[735] TURN goal=(1.92,3.03) dist=1.66m front=0.78m cells=46 rms=42.8cm[736] TURN goal=(1.92,3.03) dist=1.66m front=0.78m cells=46 rms=43.2cm[737] TURN goal=(1.92,3.03) dist=1.66m front=0.78m cells=46 rms=43.6cm[738] TURN goal=(1.92,3.03) dist=1.66m front=0.78m cells=46 rms=43.9cm[739] TURN goal=(1.92,3.03) dist=1.64m front=0.78m cells=46 rms=44.3cm[740] TURN goal=(1.92,3.03) dist=1.63m front=0.78m cells=46 rms=44.7cm[741] TURN goal=(1.92,3.03) dist=1.60m front=0.77m cells=46 rms=45.0cm[742] TURN goal=(1.92,3.03) dist=1.60m front=0.78m cells=46 rms=45.3cm[743] TURN goal=(1.92,3.03) dist=1.60m front=0.78m cells=46 rms=45.6cm[744] TURN goal=(1.92,3.03) dist=1.60m front=0.78m cells=46 rms=46.0cm[745] TURN goal=(1.92,3.03) dist=1.61m front=0.78m cells=46 rms=46.3cm[746] TURN goal=(1.92,3.03) dist=1.60m front=0.78m cells=46 rms=46.6cm[747] TURN goal=(1.92,3.03) dist=1.64m front=0.77m cells=46 rms=46.9cm[748] TURN goal=(1.92,3.03) dist=1.65m front=0.77m cells=46 rms=47.3cm[749] TURN goal=(1.92,3.03) dist=1.65m front=0.79m cells=46 rms=47.6cm[750] TURN goal=(1.92,3.03) dist=1.74m front=1.17m cells=46 rms=48.0cm
[163.9s] [TURN STUCK] In TURN mode for 5.1s, backing up
[TURN STUCK] Position history (25 samples):
  First: (2.03, 1.30) heading=81.2°
  Mid:   (2.00, 1.39) heading=69.0°
  Last:  (1.85, 1.24) heading=75.8°
  Movement: 0.198m, heading change: 5.4°
[TURN STUCK] Current front sectors: s55=1.54 s56=1.44 s57=1.37 s58=1.32 s59=1.21 s0=1.17 s1=1.19 s2=1.20 s3=1.27 s4=1.31 s5=1.35 

[BACKUP CLEAR] Reversing and turning toward clearer side...
[BACKUP CLEAR] Turning right (L_avg=1.26m R_avg=1.38m)

[168.9s] [REFINE] only 2 candidates, resampling with 150 angles (level 1)

[168.9s] [GOAL SELECT] robot@(1.84,1.35) | 8 candidates (refined 1x) (scanned=467 walls=392 visited=46):
  #1 ang=+113° d=0.50m pos=(1.36,1.50) score=+23.9 [O=+2.2 U=+24.5 V=-0.0 W=-3.0 R=-0.0 F=+0.0] <-- BEST
  #2 ang=+115° d=0.50m pos=(1.36,1.48) score=+23.7 [O=+2.4 U=+24.2 V=-0.0 W=-3.0 R=-0.0 F=+0.0]
  #3 ang=+119° d=0.50m pos=(1.35,1.45) score=+23.3 [O=+2.4 U=+23.8 V=-0.0 W=-3.0 R=-0.0 F=+0.0]
  #4 ang=+117° d=0.50m pos=(1.35,1.46) score=+23.2 [O=+2.4 U=+23.7 V=-0.0 W=-3.0 R=-0.0 F=+0.0]
  #5 ang=+121° d=0.50m pos=(1.34,1.43) score=+23.0 [O=+2.3 U=+23.5 V=-0.0 W=-3.0 R=-0.0 F=+0.0]
  #6 ang=+123° d=0.50m pos=(1.34,1.41) score=+22.5 [O=+2.3 U=+23.0 V=-0.0 W=-3.0 R=-0.0 F=+0.0]
  #7 ang=+125° d=0.50m pos=(1.34,1.39) score=+22.0 [O=+2.3 U=+22.5 V=-0.0 W=-3.0 R=-0.0 F=+0.0]
  #8 ang=+127° d=0.50m pos=(1.34,1.38) score=+20.3 [O=+1.6 U=+21.5 V=-0.0 W=-3.0 R=-0.0 F=+0.0]
[168.9s] [GOAL] Selected: (1.36, 1.50) dist=0.50m timeout=28s angle=113° reason=no goal
[752] DRIVE goal=(1.36,1.50) dist=0.50m front=0.85m cells=46 rms=47.9cm[753] DRIVE goal=(1.36,1.50) dist=0.53m front=0.85m cells=46 rms=47.9cm[754] DRIVE goal=(1.36,1.50) dist=0.51m front=0.85m cells=46 rms=47.9cm[755] DRIVE goal=(1.36,1.50) dist=0.51m front=0.85m cells=46 rms=47.8cm[756] DRIVE goal=(1.36,1.50) dist=0.51m front=0.85m cells=46 rms=47.8cm[757] DRIVE goal=(1.36,1.50) dist=0.51m front=0.85m cells=46 rms=47.8cm[758] DRIVE goal=(1.36,1.50) dist=0.48m front=0.85m cells=46 rms=47.8cm[759] DRIVE goal=(1.36,1.50) dist=0.49m front=0.85m cells=46 rms=47.7cm[760] DRIVE goal=(1.36,1.50) dist=0.49m front=0.85m cells=46 rms=47.7cm[761] DRIVE goal=(1.36,1.50) dist=0.47m front=0.85m cells=46 rms=47.7cm[762] DRIVE goal=(1.36,1.50) dist=0.47m front=0.85m cells=46 rms=47.6cm[763] DRIVE goal=(1.36,1.50) dist=0.46m front=0.85m cells=47 rms=47.6cm[764] DRIVE goal=(1.36,1.50) dist=0.47m front=0.84m cells=47 rms=47.6cm[765] DRIVE goal=(1.36,1.50) dist=0.47m front=0.85m cells=47 rms=47.5cm[766] DRIVE goal=(1.36,1.50) dist=0.45m front=0.85m cells=47 rms=47.5cm[767] DRIVE goal=(1.36,1.50) dist=0.45m front=0.85m cells=47 rms=47.5cm[768] DRIVE goal=(1.36,1.50) dist=0.46m front=0.86m cells=47 rms=47.4cm[769] DRIVE goal=(1.36,1.50) dist=0.47m front=0.85m cells=47 rms=47.4cm[770] DRIVE goal=(1.36,1.50) dist=0.47m front=0.85m cells=47 rms=47.4cm[771] DRIVE goal=(1.36,1.50) dist=0.47m front=0.85m cells=47 rms=47.3cm[772] DRIVE goal=(1.36,1.50) dist=0.47m front=0.85m cells=47 rms=47.3cm[773] DRIVE goal=(1.36,1.50) dist=0.47m front=0.85m cells=47 rms=47.3cm[774] DRIVE goal=(1.36,1.50) dist=0.47m front=0.85m cells=47 rms=47.3cm[775] DRIVE goal=(1.36,1.50) dist=0.46m front=0.85m cells=47 rms=47.2cm[776] DRIVE goal=(1.36,1.50) dist=0.47m front=0.85m cells=47 rms=47.2cm[777] DRIVE goal=(1.36,1.50) dist=0.47m front=0.84m cells=47 rms=47.2cm[778] DRIVE goal=(1.36,1.50) dist=0.48m front=1.39m cells=47 rms=47.1cm[779] DRIVE goal=(1.36,1.50) dist=0.47m front=1.39m cells=47 rms=47.1cm[780] DRIVE goal=(1.36,1.50) dist=0.47m front=1.39m cells=47 rms=47.1cm[781] DRIVE goal=(1.36,1.50) dist=0.48m front=1.39m cells=47 rms=47.0cm[782] DRIVE goal=(1.36,1.50) dist=0.50m front=1.40m cells=47 rms=47.0cm[783] DRIVE goal=(1.36,1.50) dist=0.49m front=1.40m cells=47 rms=47.0cm[784] DRIVE goal=(1.36,1.50) dist=0.49m front=1.40m cells=47 rms=47.0cm[785] DRIVE goal=(1.36,1.50) dist=0.49m front=1.19m cells=47 rms=46.9cm[786] DRIVE goal=(1.36,1.50) dist=0.47m front=1.18m cells=47 rms=46.9cm[787] DRIVE goal=(1.36,1.50) dist=0.47m front=1.18m cells=47 rms=46.9cm[788] DRIVE goal=(1.36,1.50) dist=0.47m front=1.18m cells=47 rms=46.8cm[789] DRIVE goal=(1.36,1.50) dist=0.46m front=1.18m cells=47 rms=46.8cmWaiting for LiDAR...
Waiting for LiDAR...


Stopping (Ctrl+C)...
[MARKER] Publisher stopped

=======================================================
NBV NAVIGATION COMPLETE
=======================================================
Final state: exploring
Duration: 178.6s
Iterations: 791
Goals reached: 7
Backups: 3
Unique cells visited: 47
Cells scanned by LiDAR: 469
Walls detected: 398

--- Drive Accuracy ---
Cross-track RMS error: 46.8cm
Total distance traveled: 18.86m
Ideal distance (sum of goals): 13.50m
Drive efficiency: 71.6%
Revisit rate: 100.0%

--- Map Accuracy Suggestions ---
To measure map accuracy, consider:
1. Ground truth comparison: Place markers at known positions,
   compare measured vs actual distances between them
2. Loop closure error: After returning to origin, check
   odometry drift (final_dist to origin should be ~0)
3. Feature alignment: Compare map walls to actual room layout
4. Consistency check: Run multiple times, overlay maps
5. Tape measure validation: Measure actual room dimensions,
   compare to map scale (resolution * pixels)
[OUTPUT] Map saved to: /home/ws/ugv_cont/mission/outputs/20251221_205457/maps
