[OUTPUT] Logging to: /home/ws/ugv_cont/mission/outputs/20251222_205730
[OUTPUT] Log file: /home/ws/ugv_cont/mission/outputs/20251222_205730/logs/navigation.log
=======================================================
NEXT-BEST-VIEW (NBV) NAVIGATION
=======================================================
Speed: 0.08 m/s
Goal distance: 0.5-2.0m
Press Ctrl+C to stop

[DEBUG] Marker publishing enabled - check /nav_goal in RViz
[MARKER] Persistent marker publisher started - add /nav_goal in RViz
[START] Initial position: (0.01, 0.01)
[MARKER] Origin marker (blue) started at (0.01, 0.01) - add /nav_origin in RViz

[  5.3s] [GOAL SELECT] robot@(0.01,0.01) | 9 candidates (scanned=35 walls=21 visited=1):
  #1 ang= -58° d=0.50m pos=(-0.26,0.42) score=+23.2 [O=+1.9 U=+37.2 V=-3.0 W=-3.0 R=-0.0 F=+0.0 T=-10.0] <-- BEST
  #2 ang= -64° d=0.50m pos=(-0.22,0.45) score=+21.2 [O=+1.9 U=+35.2 V=-3.0 W=-3.0 R=-0.0 F=+0.0 T=-10.0]
  #3 ang= -70° d=0.50m pos=(-0.17,0.47) score=+19.2 [O=+1.8 U=+33.2 V=-3.0 W=-3.0 R=-0.0 F=+0.0 T=-10.0]
  #4 ang= -94° d=0.50m pos=(0.04,0.51) score=+15.9 [O=+2.5 U=+29.2 V=-3.0 W=-3.0 R=-0.0 F=+0.0 T=-10.0]
  #5 ang= -82° d=0.50m pos=(-0.07,0.50) score=+15.7 [O=+2.3 U=+29.2 V=-3.0 W=-3.0 R=-0.0 F=+0.0 T=-10.0]
  #6 ang= -76° d=0.50m pos=(-0.12,0.49) score=+15.2 [O=+1.8 U=+29.2 V=-3.0 W=-3.0 R=-0.0 F=+0.0 T=-10.0]
  #7 ang=-107° d=0.50m pos=(0.15,0.49) score=+14.9 [O=+1.5 U=+29.2 V=-3.0 W=-3.0 R=-0.0 F=+0.0 T=-10.0]
  #8 ang= -88° d=0.50m pos=(-0.01,0.51) score=+7.7 [O=+2.3 U=+21.2 V=-3.0 W=-3.0 R=-0.0 F=+0.0 T=-10.0]
[  5.3s] [GOAL] Selected: (-0.26, 0.42) dist=0.50m timeout=28s angle=-58° reason=no goal
[  1] DRIVE goal=(-0.26,0.42) dist=0.50m front=0.45m cells=1 rms=0.0cm[  2] DRIVE goal=(-0.26,0.42) dist=0.50m front=0.46m cells=1 rms=0.1cm[  3] DRIVE goal=(-0.26,0.42) dist=0.50m front=0.47m cells=1 rms=0.1cm[  4] DRIVE goal=(-0.26,0.42) dist=0.51m front=0.49m cells=1 rms=0.4cm[  5] DRIVE goal=(-0.26,0.42) dist=0.51m front=0.52m cells=1 rms=0.7cm[  6] DRIVE goal=(-0.26,0.42) dist=0.51m front=0.54m cells=1 rms=0.8cm[  7] DRIVE goal=(-0.26,0.42) dist=0.51m front=0.54m cells=1 rms=0.8cm[  8] DRIVE goal=(-0.26,0.42) dist=0.51m front=0.54m cells=1 rms=0.9cm[  9] DRIVE goal=(-0.26,0.42) dist=0.52m front=0.55m cells=1 rms=1.0cm[ 10] DRIVE goal=(-0.26,0.42) dist=0.52m front=0.55m cells=1 rms=1.0cm[ 11] DRIVE goal=(-0.26,0.42) dist=0.52m front=0.55m cells=1 rms=1.1cm[ 12] DRIVE goal=(-0.26,0.42) dist=0.52m front=0.55m cells=1 rms=1.1cm[ 13] DRIVE goal=(-0.26,0.42) dist=0.52m front=0.56m cells=1 rms=1.1cm[ 14] DRIVE goal=(-0.26,0.42) dist=0.52m front=0.56m cells=1 rms=1.1cm[ 15] DRIVE goal=(-0.26,0.42) dist=0.52m front=0.56m cells=1 rms=1.0cm[ 16] DRIVE goal=(-0.26,0.42) dist=0.52m front=0.56m cells=1 rms=1.0cm[ 17] DRIVE goal=(-0.26,0.42) dist=0.51m front=0.56m cells=1 rms=1.0cm[ 18] DRIVE goal=(-0.26,0.42) dist=0.52m front=0.57m cells=1 rms=1.0cm[ 19] DRIVE goal=(-0.26,0.42) dist=0.52m front=0.58m cells=1 rms=1.0cm[ 20] DRIVE goal=(-0.26,0.42) dist=0.52m front=0.58m cells=1 rms=1.0cm[ 21] DRIVE goal=(-0.26,0.42) dist=0.52m front=0.58m cells=1 rms=1.0cm[ 22] DRIVE goal=(-0.26,0.42) dist=0.52m front=0.60m cells=1 rms=1.0cm[ 23] DRIVE goal=(-0.26,0.42) dist=0.51m front=0.64m cells=1 rms=1.0cm[ 24] DRIVE goal=(-0.26,0.42) dist=0.52m front=0.66m cells=1 rms=1.0cm[ 25] DRIVE goal=(-0.26,0.42) dist=0.52m front=0.67m cells=1 rms=0.9cm[ 26] DRIVE goal=(-0.26,0.42) dist=0.50m front=0.81m cells=1 rms=0.9cm[ 27] DRIVE goal=(-0.26,0.42) dist=0.49m front=0.80m cells=1 rms=0.9cm[ 28] DRIVE goal=(-0.26,0.42) dist=0.47m front=0.79m cells=1 rms=0.9cm[ 29] DRIVE goal=(-0.26,0.42) dist=0.46m front=0.77m cells=1 rms=0.9cm[ 30] DRIVE goal=(-0.26,0.42) dist=0.44m front=0.76m cells=1 rms=0.9cm[ 31] DRIVE goal=(-0.26,0.42) dist=0.42m front=0.74m cells=1 rms=0.9cm[ 32] DRIVE goal=(-0.26,0.42) dist=0.40m front=0.72m cells=1 rms=0.9cm
[ 11.9s] [REFINE] best score 18.4 < 20.0, resampling with 150 angles (level 1)

[ 11.9s] [REFINE] best score 18.4 < 20.0, resampling with 450 angles (level 2)

[ 11.9s] [REFINE] best score 18.4 < 20.0, resampling with 1350 angles (level 3)

[ 11.9s] [GOAL SELECT] robot@(-0.03,0.11) | 205 candidates (refined 3x) (scanned=60 walls=35 visited=1):
  #1 ang=  -7° d=0.50m pos=(-0.12,0.60) score=+18.4 [O=+2.2 U=+28.0 V=-0.0 W=-3.0 R=-8.9 F=+0.0] <-- BEST
  #2 ang=  -7° d=0.50m pos=(-0.11,0.60) score=+18.4 [O=+2.2 U=+28.0 V=-0.0 W=-3.0 R=-8.9 F=+0.0]
  #3 ang=  -7° d=0.50m pos=(-0.11,0.61) score=+18.4 [O=+2.2 U=+28.0 V=-0.0 W=-3.0 R=-8.9 F=+0.0]
  #4 ang=  -7° d=0.50m pos=(-0.11,0.61) score=+18.4 [O=+2.2 U=+28.0 V=-0.0 W=-3.0 R=-8.9 F=+0.0]
  #5 ang=  -8° d=0.50m pos=(-0.11,0.61) score=+18.4 [O=+2.2 U=+28.0 V=-0.0 W=-3.0 R=-8.9 F=+0.0]
  #6 ang=  -8° d=0.50m pos=(-0.11,0.61) score=+18.4 [O=+2.2 U=+28.0 V=-0.0 W=-3.0 R=-8.9 F=+0.0]
  #7 ang=  -8° d=0.50m pos=(-0.11,0.61) score=+18.4 [O=+2.2 U=+28.0 V=-0.0 W=-3.0 R=-8.9 F=+0.0]
  #8 ang=  -8° d=0.50m pos=(-0.10,0.61) score=+18.4 [O=+2.2 U=+28.0 V=-0.0 W=-3.0 R=-8.9 F=+0.0]
[ 11.9s] [GOAL] Selected: (-0.12, 0.60) dist=0.50m timeout=28s angle=-7° reason=reached
[ 33] DRIVE goal=(-0.12,0.60) dist=0.50m front=0.73m cells=1 rms=0.9cm[ 34] DRIVE goal=(-0.12,0.60) dist=0.48m front=0.70m cells=1 rms=0.9cm[ 35] DRIVE goal=(-0.12,0.60) dist=0.48m front=0.69m cells=1 rms=0.9cm[ 36] DRIVE goal=(-0.12,0.60) dist=0.46m front=0.67m cells=1 rms=0.9cm[ 37] DRIVE goal=(-0.12,0.60) dist=0.46m front=0.67m cells=1 rms=0.9cm[ 38] DRIVE goal=(-0.12,0.60) dist=0.46m front=0.67m cells=1 rms=0.9cm[ 39] DRIVE goal=(-0.12,0.60) dist=0.44m front=0.66m cells=1 rms=1.0cm[ 40] DRIVE goal=(-0.12,0.60) dist=0.43m front=0.68m cells=1 rms=1.0cm[ 41] DRIVE goal=(-0.12,0.60) dist=0.43m front=0.70m cells=1 rms=1.1cm[ 42] DRIVE goal=(-0.12,0.60) dist=0.42m front=0.69m cells=1 rms=1.1cm[ 43] DRIVE goal=(-0.12,0.60) dist=0.41m front=0.73m cells=1 rms=1.2cm
[ 14.3s] [REFINE] best score 13.8 < 20.0, resampling with 150 angles (level 1)

[ 14.3s] [REFINE] best score 13.8 < 20.0, resampling with 450 angles (level 2)

[ 14.3s] [REFINE] best score 13.8 < 20.0, resampling with 1350 angles (level 3)

[ 14.3s] [GOAL SELECT] robot@(-0.07,0.23) | 181 candidates (refined 3x) (scanned=65 walls=37 visited=1):
  #1 ang= +16° d=0.50m pos=(-0.30,0.67) score=+13.9 [O=+1.6 U=+38.1 V=-0.0 W=-3.0 R=-22.9 F=+0.0] <-- BEST
  #2 ang= +15° d=0.50m pos=(-0.30,0.67) score=+13.8 [O=+1.6 U=+38.0 V=-0.0 W=-3.0 R=-22.9 F=+0.0]
  #3 ang= +15° d=0.50m pos=(-0.30,0.67) score=+13.8 [O=+1.6 U=+38.0 V=-0.0 W=-3.0 R=-22.9 F=+0.0]
  #4 ang= +15° d=0.50m pos=(-0.29,0.67) score=+13.8 [O=+1.6 U=+38.0 V=-0.0 W=-3.0 R=-22.9 F=+0.0]
  #5 ang= +15° d=0.50m pos=(-0.29,0.68) score=+13.8 [O=+1.6 U=+38.0 V=-0.0 W=-3.0 R=-22.9 F=+0.0]
  #6 ang= +15° d=0.50m pos=(-0.29,0.68) score=+13.8 [O=+1.6 U=+38.0 V=-0.0 W=-3.0 R=-22.9 F=+0.0]
  #7 ang= +14° d=0.50m pos=(-0.29,0.68) score=+13.8 [O=+1.6 U=+38.0 V=-0.0 W=-3.0 R=-22.9 F=+0.0]
  #8 ang= +14° d=0.50m pos=(-0.29,0.68) score=+13.8 [O=+1.6 U=+38.0 V=-0.0 W=-3.0 R=-22.9 F=+0.0]
[ 14.3s] [GOAL] Selected: (-0.30, 0.67) dist=0.50m timeout=28s angle=16° reason=reached
[ 44] DRIVE goal=(-0.30,0.67) dist=0.50m front=0.73m cells=1 rms=1.2cm[ 45] DRIVE goal=(-0.30,0.67) dist=0.46m front=0.72m cells=1 rms=1.1cm[ 46] DRIVE goal=(-0.30,0.67) dist=0.44m front=0.88m cells=1 rms=1.2cm[ 47] DRIVE goal=(-0.30,0.67) dist=0.43m front=0.88m cells=1 rms=1.2cm[ 48] DRIVE goal=(-0.30,0.67) dist=0.42m front=0.96m cells=2 rms=1.2cm[ 49] DRIVE goal=(-0.30,0.67) dist=0.42m front=0.61m cells=2 rms=1.2cm[ 50] DRIVE goal=(-0.30,0.67) dist=0.42m front=0.62m cells=2 rms=1.3cm[ 51] DRIVE goal=(-0.30,0.67) dist=0.42m front=0.58m cells=2 rms=1.3cm[ 52] DRIVE goal=(-0.30,0.67) dist=0.42m front=0.56m cells=2 rms=1.3cm[ 53] DRIVE goal=(-0.30,0.67) dist=0.41m front=0.55m cells=2 rms=1.4cm
[ 16.4s] [REFINE] only 0 candidates, resampling with 150 angles (level 1)

[ 16.4s] [REFINE] only 0 candidates, resampling with 450 angles (level 2)

[ 16.4s] [REFINE] only 0 candidates, resampling with 1350 angles (level 3)

[ 16.4s] [NO GOAL] No valid viewpoint found (1/3), backing up

[BACKUP] Reversing...
[BACKUP] Turning right (L_openings=0 R_openings=6)
[ 55] DRIVE goal=(-0.30,0.67) dist=0.51m front=1.05m cells=2 rms=1.4cm[ 56] DRIVE goal=(-0.30,0.67) dist=0.51m front=1.02m cells=2 rms=1.4cm[ 57] DRIVE goal=(-0.30,0.67) dist=0.51m front=1.05m cells=2 rms=1.4cm[ 58] DRIVE goal=(-0.30,0.67) dist=0.51m front=1.05m cells=2 rms=1.4cm[ 59] DRIVE goal=(-0.30,0.67) dist=0.51m front=1.05m cells=2 rms=1.4cm[ 60] DRIVE goal=(-0.30,0.67) dist=0.51m front=1.05m cells=2 rms=1.4cm[ 61] DRIVE goal=(-0.30,0.67) dist=0.51m front=1.05m cells=2 rms=1.4cm[ 62] DRIVE goal=(-0.30,0.67) dist=0.51m front=1.04m cells=2 rms=1.5cm[ 63] DRIVE goal=(-0.30,0.67) dist=0.51m front=1.04m cells=2 rms=1.5cm[ 64] DRIVE goal=(-0.30,0.67) dist=0.51m front=1.04m cells=2 rms=1.5cm[ 65] DRIVE goal=(-0.30,0.67) dist=0.51m front=1.02m cells=2 rms=1.5cm[ 66] DRIVE goal=(-0.30,0.67) dist=0.51m front=1.04m cells=2 rms=1.5cm[ 67] DRIVE goal=(-0.30,0.67) dist=0.52m front=1.05m cells=2 rms=1.5cm[ 68] DRIVE goal=(-0.30,0.67) dist=0.52m front=0.71m cells=2 rms=1.5cm[ 69] DRIVE goal=(-0.30,0.67) dist=0.51m front=0.66m cells=2 rms=1.5cm[ 70] DRIVE goal=(-0.30,0.67) dist=0.51m front=0.65m cells=2 rms=1.5cm[ 71] DRIVE goal=(-0.30,0.67) dist=0.50m front=0.61m cells=2 rms=1.5cm[ 72] DRIVE goal=(-0.30,0.67) dist=0.49m front=0.59m cells=2 rms=1.5cm[ 73] DRIVE goal=(-0.30,0.67) dist=0.48m front=0.57m cells=2 rms=1.5cm[ 74] DRIVE goal=(-0.30,0.67) dist=0.47m front=0.56m cells=2 rms=1.5cm[ 75] DRIVE goal=(-0.30,0.67) dist=0.45m front=0.53m cells=2 rms=1.5cm[ 76] DRIVE goal=(-0.30,0.67) dist=0.43m front=0.51m cells=2 rms=1.4cm[ 77] DRIVE goal=(-0.30,0.67) dist=0.41m front=0.49m cells=2 rms=1.4cm
[ 24.7s] [REFINE] only 1 candidates, resampling with 150 angles (level 1)

[ 24.7s] [REFINE] only 3 candidates, resampling with 450 angles (level 2)

[ 24.7s] [GOAL SELECT] robot@(-0.14,0.32) | 10 candidates (refined 2x) (scanned=80 walls=61 visited=2):
  #1 ang= -53° d=1.50m pos=(0.36,1.74) score=+36.5 [O=+2.2 U=+26.3 V=-0.0 W=-3.0 R=-0.0 F=+10.6] <-- BEST
  #2 ang= -54° d=1.50m pos=(0.38,1.73) score=+36.1 [O=+2.0 U=+26.3 V=-0.0 W=-3.0 R=-0.0 F=+10.5]
  #3 ang= -55° d=1.50m pos=(0.40,1.73) score=+36.0 [O=+2.0 U=+26.3 V=-0.0 W=-3.0 R=-0.0 F=+10.3]
  #4 ang= -57° d=1.50m pos=(0.46,1.70) score=+35.2 [O=+2.0 U=+26.0 V=-0.0 W=-3.0 R=-0.0 F=+9.8]
  #5 ang= -58° d=1.50m pos=(0.48,1.69) score=+35.1 [O=+2.0 U=+26.0 V=-0.0 W=-3.0 R=-0.0 F=+9.7]
  #6 ang= -59° d=1.50m pos=(0.49,1.69) score=+35.0 [O=+2.0 U=+26.0 V=-0.0 W=-3.0 R=-0.0 F=+9.5]
  #7 ang= -59° d=1.50m pos=(0.51,1.68) score=+34.8 [O=+2.0 U=+26.0 V=-0.0 W=-3.0 R=-0.0 F=+9.4]
  #8 ang= -55° d=1.50m pos=(0.41,1.72) score=+33.7 [O=+2.0 U=+24.0 V=-0.0 W=-3.0 R=-0.0 F=+10.2]
[ 24.7s] [GOAL] Selected: (0.36, 1.74) dist=1.50m timeout=42s angle=-53° reason=reached
[ 78] DRIVE goal=(0.36,1.74) dist=1.50m front=0.47m cells=2 rms=1.4cm[ 79] DRIVE goal=(0.36,1.74) dist=1.48m front=0.45m cells=2 rms=1.4cm[ 80] DRIVE goal=(0.36,1.74) dist=1.47m front=0.43m cells=2 rms=1.5cm[ 81] DRIVE goal=(0.36,1.74) dist=1.47m front=0.42m cells=2 rms=1.6cm[ 82] DRIVE goal=(0.36,1.74) dist=1.46m front=0.42m cells=2 rms=1.6cm[ 83] DRIVE goal=(0.36,1.74) dist=1.46m front=0.42m cells=2 rms=1.7cm[ 84] DRIVE goal=(0.36,1.74) dist=1.46m front=0.43m cells=2 rms=1.8cm[ 85] DRIVE goal=(0.36,1.74) dist=1.46m front=0.45m cells=2 rms=1.9cm[ 86] DRIVE goal=(0.36,1.74) dist=1.46m front=0.48m cells=2 rms=2.0cm[ 87] DRIVE goal=(0.36,1.74) dist=1.46m front=0.48m cells=2 rms=2.0cm[ 88] DRIVE goal=(0.36,1.74) dist=1.46m front=0.53m cells=2 rms=2.1cm[ 89] DRIVE goal=(0.36,1.74) dist=1.46m front=0.88m cells=2 rms=2.1cm[ 90] DRIVE goal=(0.36,1.74) dist=1.46m front=0.88m cells=2 rms=2.2cm[ 91] DRIVE goal=(0.36,1.74) dist=1.47m front=0.87m cells=2 rms=2.3cm[ 92] DRIVE goal=(0.36,1.74) dist=1.46m front=0.87m cells=2 rms=2.3cm[ 93] DRIVE goal=(0.36,1.74) dist=1.46m front=0.87m cells=2 rms=2.4cm[ 94] DRIVE goal=(0.36,1.74) dist=1.46m front=0.87m cells=2 rms=2.4cm[ 95] DRIVE goal=(0.36,1.74) dist=1.46m front=0.87m cells=2 rms=2.5cm[ 96] DRIVE goal=(0.36,1.74) dist=1.46m front=0.86m cells=2 rms=2.5cm[ 97] DRIVE goal=(0.36,1.74) dist=1.45m front=0.86m cells=2 rms=2.6cm[ 98] DRIVE goal=(0.36,1.74) dist=1.45m front=0.86m cells=2 rms=2.6cm[ 99] DRIVE goal=(0.36,1.74) dist=1.44m front=0.85m cells=2 rms=2.7cm[100] DRIVE goal=(0.36,1.74) dist=1.43m front=0.84m cells=2 rms=2.8cm[101] DRIVE goal=(0.36,1.74) dist=1.41m front=0.83m cells=2 rms=2.8cm[102] DRIVE goal=(0.36,1.74) dist=1.39m front=0.80m cells=2 rms=2.9cm[103] DRIVE goal=(0.36,1.74) dist=1.38m front=0.78m cells=2 rms=2.9cm[104] DRIVE goal=(0.36,1.74) dist=1.36m front=0.77m cells=2 rms=3.0cm[105] DRIVE goal=(0.36,1.74) dist=1.34m front=0.75m cells=2 rms=3.0cm[106] DRIVE goal=(0.36,1.74) dist=1.32m front=0.73m cells=2 rms=3.1cm[107] DRIVE goal=(0.36,1.74) dist=1.30m front=0.71m cells=2 rms=3.1cm[108] DRIVE goal=(0.36,1.74) dist=1.27m front=1.18m cells=2 rms=3.2cm[109] DRIVE goal=(0.36,1.74) dist=1.26m front=1.18m cells=2 rms=3.2cm[110] DRIVE goal=(0.36,1.74) dist=1.25m front=1.16m cells=2 rms=3.2cm[111] DRIVE goal=(0.36,1.74) dist=1.22m front=1.14m cells=3 rms=3.3cm[112] DRIVE goal=(0.36,1.74) dist=1.20m front=1.13m cells=3 rms=3.3cm[113] DRIVE goal=(0.36,1.74) dist=1.20m front=1.12m cells=3 rms=3.3cm[114] DRIVE goal=(0.36,1.74) dist=1.18m front=1.10m cells=3 rms=3.4cm[115] DRIVE goal=(0.36,1.74) dist=1.16m front=1.08m cells=3 rms=3.4cm[116] DRIVE goal=(0.36,1.74) dist=1.14m front=1.06m cells=3 rms=3.4cm[117] DRIVE goal=(0.36,1.74) dist=1.12m front=1.04m cells=3 rms=3.5cm[118] DRIVE goal=(0.36,1.74) dist=1.10m front=1.03m cells=3 rms=3.5cm[119] DRIVE goal=(0.36,1.74) dist=1.08m front=1.01m cells=3 rms=3.5cm[120] DRIVE goal=(0.36,1.74) dist=1.06m front=0.99m cells=3 rms=3.5cm[121] DRIVE goal=(0.36,1.74) dist=1.04m front=0.97m cells=3 rms=3.6cm[122] DRIVE goal=(0.36,1.74) dist=1.02m front=0.95m cells=3 rms=3.6cm[123] DRIVE goal=(0.36,1.74) dist=1.00m front=0.93m cells=3 rms=3.6cm[124] DRIVE goal=(0.36,1.74) dist=0.98m front=0.91m cells=3 rms=3.6cm[125] DRIVE goal=(0.36,1.74) dist=0.96m front=0.89m cells=3 rms=3.7cm[126] DRIVE goal=(0.36,1.74) dist=0.94m front=0.87m cells=3 rms=3.7cm[127] DRIVE goal=(0.36,1.74) dist=0.92m front=0.85m cells=3 rms=3.7cm[128] DRIVE goal=(0.36,1.74) dist=0.91m front=0.84m cells=4 rms=3.7cm[129] DRIVE goal=(0.36,1.74) dist=0.88m front=0.82m cells=4 rms=3.7cm[130] DRIVE goal=(0.36,1.74) dist=0.86m front=0.80m cells=4 rms=3.8cm[131] DRIVE goal=(0.36,1.74) dist=0.85m front=0.78m cells=4 rms=3.8cm[132] DRIVE goal=(0.36,1.74) dist=0.83m front=0.76m cells=4 rms=3.8cm[133] DRIVE goal=(0.36,1.74) dist=0.80m front=0.74m cells=4 rms=3.8cm[134] DRIVE goal=(0.36,1.74) dist=0.79m front=0.72m cells=4 rms=3.8cm[135] DRIVE goal=(0.36,1.74) dist=0.77m front=0.71m cells=4 rms=3.8cm[136] DRIVE goal=(0.36,1.74) dist=0.75m front=0.69m cells=4 rms=3.8cm[137] DRIVE goal=(0.36,1.74) dist=0.73m front=0.67m cells=4 rms=3.9cm[138] DRIVE goal=(0.36,1.74) dist=0.71m front=0.66m cells=4 rms=3.9cm[139] DRIVE goal=(0.36,1.74) dist=0.69m front=0.63m cells=4 rms=3.9cm[140] DRIVE goal=(0.36,1.74) dist=0.67m front=0.61m cells=4 rms=3.9cm[141] DRIVE goal=(0.36,1.74) dist=0.65m front=0.60m cells=4 rms=3.9cm[142] DRIVE goal=(0.36,1.74) dist=0.63m front=0.59m cells=4 rms=3.9cm[143] DRIVE goal=(0.36,1.74) dist=0.61m front=0.58m cells=4 rms=3.9cm[144] DRIVE goal=(0.36,1.74) dist=0.59m front=0.66m cells=4 rms=3.9cm[145] DRIVE goal=(0.36,1.74) dist=0.58m front=0.66m cells=5 rms=3.9cm[146] DRIVE goal=(0.36,1.74) dist=0.55m front=0.90m cells=5 rms=4.0cm[147] DRIVE goal=(0.36,1.74) dist=0.54m front=0.90m cells=5 rms=4.0cm[148] DRIVE goal=(0.36,1.74) dist=0.52m front=0.89m cells=5 rms=4.0cm[149] DRIVE goal=(0.36,1.74) dist=0.50m front=0.88m cells=5 rms=4.0cm[150] DRIVE goal=(0.36,1.74) dist=0.48m front=0.87m cells=5 rms=4.0cm[151] DRIVE goal=(0.36,1.74) dist=0.46m front=0.86m cells=5 rms=4.0cm[152] DRIVE goal=(0.36,1.74) dist=0.44m front=0.86m cells=5 rms=4.0cm[153] DRIVE goal=(0.36,1.74) dist=0.42m front=0.84m cells=5 rms=4.0cm[154] DRIVE goal=(0.36,1.74) dist=0.40m front=0.83m cells=5 rms=4.0cm
[ 40.1s] [REFINE] only 1 candidates, resampling with 150 angles (level 1)

[ 40.1s] [REFINE] only 2 candidates, resampling with 450 angles (level 2)

[ 40.1s] [REFINE] best score 17.8 < 20.0, resampling with 1350 angles (level 3)

[ 40.1s] [GOAL SELECT] robot@(0.19,1.39) | 18 candidates (refined 3x) (scanned=117 walls=83 visited=5):
  #1 ang= -15° d=0.50m pos=(0.50,1.79) score=+17.9 [O=+1.9 U=+20.0 V=-3.0 W=-3.0 R=-11.1 F=+13.0] <-- BEST
  #2 ang= -16° d=0.50m pos=(0.50,1.79) score=+17.9 [O=+1.9 U=+20.0 V=-3.0 W=-3.0 R=-11.1 F=+13.0]
  #3 ang= -16° d=0.50m pos=(0.50,1.79) score=+17.8 [O=+1.9 U=+20.0 V=-3.0 W=-3.0 R=-11.1 F=+12.9]
  #4 ang= -16° d=0.50m pos=(0.50,1.79) score=+17.8 [O=+1.9 U=+20.0 V=-3.0 W=-3.0 R=-11.1 F=+12.9]
  #5 ang= -16° d=0.50m pos=(0.50,1.79) score=+17.8 [O=+1.9 U=+20.0 V=-3.0 W=-3.0 R=-11.1 F=+12.9]
  #6 ang= -17° d=0.50m pos=(0.51,1.78) score=+17.8 [O=+1.9 U=+20.0 V=-3.0 W=-3.0 R=-11.1 F=+12.8]
  #7 ang= -17° d=0.50m pos=(0.51,1.78) score=+17.7 [O=+1.9 U=+20.0 V=-3.0 W=-3.0 R=-11.1 F=+12.8]
  #8 ang= -17° d=0.50m pos=(0.51,1.78) score=+17.7 [O=+1.9 U=+20.0 V=-3.0 W=-3.0 R=-11.1 F=+12.8]
[ 40.1s] [GOAL] Selected: (0.50, 1.79) dist=0.50m timeout=28s angle=-15° reason=reached
[155] DRIVE goal=(0.50,1.79) dist=0.50m front=0.81m cells=5 rms=4.0cm[156] DRIVE goal=(0.50,1.79) dist=0.48m front=0.83m cells=5 rms=4.0cm[157] DRIVE goal=(0.50,1.79) dist=0.46m front=0.79m cells=5 rms=4.0cm[158] DRIVE goal=(0.50,1.79) dist=0.45m front=0.78m cells=5 rms=3.9cm[159] DRIVE goal=(0.50,1.79) dist=0.44m front=0.76m cells=5 rms=3.9cm[160] DRIVE goal=(0.50,1.79) dist=0.44m front=0.76m cells=5 rms=3.9cm[161] DRIVE goal=(0.50,1.79) dist=0.43m front=0.73m cells=5 rms=3.9cm[162] DRIVE goal=(0.50,1.79) dist=0.42m front=0.73m cells=5 rms=3.9cm[163] DRIVE goal=(0.50,1.79) dist=0.41m front=0.71m cells=5 rms=3.9cm[164] DRIVE goal=(0.50,1.79) dist=0.40m front=0.70m cells=5 rms=3.9cm
[ 42.3s] [REFINE] only 2 candidates, resampling with 150 angles (level 1)

[ 42.3s] [GOAL SELECT] robot@(0.24,1.50) | 5 candidates (refined 1x) (scanned=117 walls=85 visited=5):
  #1 ang= +15° d=1.00m pos=(0.55,2.45) score=+39.1 [O=+1.0 U=+26.0 V=-0.0 W=-3.0 R=-0.0 F=+14.8] <-- BEST
  #2 ang= +13° d=1.00m pos=(0.58,2.44) score=+37.0 [O=+1.0 U=+24.0 V=-0.0 W=-3.0 R=-0.0 F=+14.7]
  #3 ang=-109° d=1.00m pos=(0.84,0.70) score=+15.9 [O=+2.2 U=+32.0 V=-0.0 W=-3.0 R=-5.1 F=-10.5]
  #4 ang=-111° d=1.00m pos=(0.82,0.68) score=+15.6 [O=+2.2 U=+32.0 V=-0.0 W=-3.0 R=-5.1 F=-10.8]
  #5 ang=-113° d=1.00m pos=(0.79,0.66) score=+15.2 [O=+2.2 U=+32.0 V=-0.0 W=-3.0 R=-5.1 F=-11.2]
[ 42.3s] [GOAL] Selected: (0.55, 2.45) dist=1.00m timeout=35s angle=15° reason=reached
[165] DRIVE goal=(0.55,2.45) dist=1.00m front=0.70m cells=5 rms=3.9cm[166] DRIVE goal=(0.55,2.45) dist=0.99m front=0.69m cells=6 rms=3.9cm[167] DRIVE goal=(0.55,2.45) dist=0.98m front=0.68m cells=6 rms=3.9cm[168] DRIVE goal=(0.55,2.45) dist=0.97m front=0.68m cells=6 rms=3.8cm[169] DRIVE goal=(0.55,2.45) dist=0.96m front=0.67m cells=6 rms=3.8cm[170] DRIVE goal=(0.55,2.45) dist=0.95m front=0.67m cells=6 rms=3.8cm[171] DRIVE goal=(0.55,2.45) dist=0.95m front=0.67m cells=6 rms=3.8cm[172] DRIVE goal=(0.55,2.45) dist=0.94m front=0.67m cells=6 rms=3.8cm[173] DRIVE goal=(0.55,2.45) dist=0.93m front=0.67m cells=6 rms=3.8cm[174] DRIVE goal=(0.55,2.45) dist=0.93m front=0.66m cells=6 rms=3.8cm[175] DRIVE goal=(0.55,2.45) dist=0.92m front=0.67m cells=6 rms=3.8cm[176] DRIVE goal=(0.55,2.45) dist=0.91m front=0.66m cells=6 rms=3.8cm[177] DRIVE goal=(0.55,2.45) dist=0.90m front=0.70m cells=6 rms=3.8cm[178] DRIVE goal=(0.55,2.45) dist=0.90m front=0.70m cells=6 rms=3.8cm[179] DRIVE goal=(0.55,2.45) dist=0.89m front=1.04m cells=6 rms=3.8cm[180] DRIVE goal=(0.55,2.45) dist=0.88m front=1.05m cells=7 rms=3.8cm[181] DRIVE goal=(0.55,2.45) dist=0.86m front=1.05m cells=7 rms=3.7cm[182] DRIVE goal=(0.55,2.45) dist=0.84m front=1.04m cells=7 rms=3.7cm[183] DRIVE goal=(0.55,2.45) dist=0.82m front=1.03m cells=7 rms=3.7cm[184] DRIVE goal=(0.55,2.45) dist=0.80m front=1.04m cells=7 rms=3.7cm[185] DRIVE goal=(0.55,2.45) dist=0.78m front=1.03m cells=7 rms=3.7cm[186] DRIVE goal=(0.55,2.45) dist=0.76m front=1.03m cells=7 rms=3.7cm[187] DRIVE goal=(0.55,2.45) dist=0.75m front=1.02m cells=7 rms=3.7cm[188] DRIVE goal=(0.55,2.45) dist=0.72m front=1.02m cells=7 rms=3.7cm[189] DRIVE goal=(0.55,2.45) dist=0.70m front=1.01m cells=7 rms=3.7cm[190] DRIVE goal=(0.55,2.45) dist=0.68m front=1.00m cells=7 rms=3.7cm[191] DRIVE goal=(0.55,2.45) dist=0.67m front=0.99m cells=8 rms=3.7cm[192] DRIVE goal=(0.55,2.45) dist=0.64m front=0.99m cells=8 rms=3.7cm[193] DRIVE goal=(0.55,2.45) dist=0.62m front=0.98m cells=8 rms=3.7cm[194] DRIVE goal=(0.55,2.45) dist=0.60m front=0.98m cells=8 rms=3.7cm[195] DRIVE goal=(0.55,2.45) dist=0.58m front=0.98m cells=8 rms=3.7cm[196] DRIVE goal=(0.55,2.45) dist=0.56m front=0.97m cells=8 rms=3.7cm[197] DRIVE goal=(0.55,2.45) dist=0.55m front=0.96m cells=8 rms=3.7cm[198] DRIVE goal=(0.55,2.45) dist=0.53m front=0.96m cells=8 rms=3.7cm[199] DRIVE goal=(0.55,2.45) dist=0.51m front=0.96m cells=8 rms=3.7cm[200] DRIVE goal=(0.55,2.45) dist=0.49m front=0.95m cells=8 rms=3.7cm[201] DRIVE goal=(0.55,2.45) dist=0.48m front=0.95m cells=8 rms=3.7cm[202] DRIVE goal=(0.55,2.45) dist=0.46m front=0.94m cells=8 rms=3.7cm[203] DRIVE goal=(0.55,2.45) dist=0.44m front=0.94m cells=8 rms=3.7cm[204] DRIVE goal=(0.55,2.45) dist=0.42m front=0.93m cells=8 rms=3.7cm
[ 50.4s] [GOAL SELECT] robot@(0.46,2.07) | 12 candidates (scanned=130 walls=88 visited=8):
  #1 ang= +21° d=2.00m pos=(0.26,4.06) score=+56.7 [O=+2.3 U=+39.6 V=-0.0 W=-0.0 R=-0.0 F=+14.3] <-- BEST
  #2 ang=  -3° d=1.00m pos=(0.78,3.02) score=+49.9 [O=+1.7 U=+36.0 V=-0.0 W=-3.0 R=-0.0 F=+14.9]
  #3 ang= -21° d=1.50m pos=(1.36,3.27) score=+45.6 [O=+2.5 U=+32.1 V=-0.0 W=-3.0 R=-0.0 F=+13.6]
  #4 ang= +21° d=1.50m pos=(0.31,3.56) score=+44.2 [O=+2.5 U=+28.0 V=-0.0 W=-1.0 R=-0.0 F=+14.3]
  #5 ang=  -9° d=0.50m pos=(0.67,2.52) score=+35.5 [O=+2.3 U=+30.0 V=-0.0 W=-3.0 R=-8.6 F=+14.6]
  #6 ang=  -3° d=0.50m pos=(0.62,2.54) score=+33.6 [O=+2.2 U=+28.0 V=-0.0 W=-3.0 R=-8.6 F=+14.9]
  #7 ang= -15° d=0.50m pos=(0.72,2.50) score=+33.2 [O=+2.5 U=+28.0 V=-0.0 W=-3.0 R=-8.6 F=+14.2]
  #8 ang= +15° d=1.00m pos=(0.47,3.07) score=+31.3 [O=+1.6 U=+22.0 V=-0.0 W=-3.0 R=-4.3 F=+14.7]
[ 50.4s] [GOAL] Selected: (0.26, 4.06) dist=2.00m timeout=50s angle=21° reason=reached
[205] DRIVE goal=(0.26,4.06) dist=2.00m front=0.92m cells=8 rms=3.7cm[206] DRIVE goal=(0.26,4.06) dist=1.98m front=0.90m cells=8 rms=3.7cm[207] DRIVE goal=(0.26,4.06) dist=1.96m front=0.90m cells=9 rms=3.7cm[208] DRIVE goal=(0.26,4.06) dist=1.95m front=1.53m cells=9 rms=3.7cm[209] DRIVE goal=(0.26,4.06) dist=1.94m front=1.52m cells=9 rms=3.7cm[210] DRIVE goal=(0.26,4.06) dist=1.93m front=1.52m cells=9 rms=3.7cm[211] DRIVE goal=(0.26,4.06) dist=1.92m front=1.51m cells=9 rms=3.7cm[212] DRIVE goal=(0.26,4.06) dist=1.92m front=1.50m cells=9 rms=3.7cm[213] DRIVE goal=(0.26,4.06) dist=1.91m front=1.50m cells=9 rms=3.7cm[214] DRIVE goal=(0.26,4.06) dist=1.90m front=1.49m cells=9 rms=3.7cm[215] DRIVE goal=(0.26,4.06) dist=1.89m front=1.48m cells=9 rms=3.7cm[216] DRIVE goal=(0.26,4.06) dist=1.87m front=0.97m cells=9 rms=3.7cm[217] DRIVE goal=(0.26,4.06) dist=1.85m front=0.96m cells=9 rms=3.7cm[218] DRIVE goal=(0.26,4.06) dist=1.83m front=0.95m cells=9 rms=3.7cm[219] DRIVE goal=(0.26,4.06) dist=1.81m front=0.96m cells=9 rms=3.7cm[220] DRIVE goal=(0.26,4.06) dist=1.79m front=0.86m cells=9 rms=3.7cm[221] DRIVE goal=(0.26,4.06) dist=1.77m front=0.88m cells=9 rms=3.7cm[222] DRIVE goal=(0.26,4.06) dist=1.75m front=0.87m cells=9 rms=3.7cm[223] DRIVE goal=(0.26,4.06) dist=1.73m front=0.84m cells=9 rms=3.7cm[224] DRIVE goal=(0.26,4.06) dist=1.71m front=0.83m cells=9 rms=3.7cm[225] DRIVE goal=(0.26,4.06) dist=1.68m front=0.86m cells=9 rms=3.7cm[226] DRIVE goal=(0.26,4.06) dist=1.66m front=0.84m cells=10 rms=3.7cm[227] DRIVE goal=(0.26,4.06) dist=1.63m front=0.83m cells=10 rms=3.7cm[228] DRIVE goal=(0.26,4.06) dist=1.61m front=0.85m cells=10 rms=3.7cm[229] DRIVE goal=(0.26,4.06) dist=1.59m front=0.79m cells=10 rms=3.7cm[230] DRIVE goal=(0.26,4.06) dist=1.57m front=0.80m cells=10 rms=3.7cm[231] DRIVE goal=(0.26,4.06) dist=1.55m front=0.81m cells=10 rms=3.7cm[232] DRIVE goal=(0.26,4.06) dist=1.53m front=0.76m cells=10 rms=3.7cm[233] DRIVE goal=(0.26,4.06) dist=1.51m front=0.76m cells=10 rms=3.7cm[234] DRIVE goal=(0.26,4.06) dist=1.49m front=0.77m cells=10 rms=3.7cm[235] DRIVE goal=(0.26,4.06) dist=1.46m front=0.79m cells=10 rms=3.7cm[236] DRIVE goal=(0.26,4.06) dist=1.44m front=0.74m cells=10 rms=3.7cm[237] DRIVE goal=(0.26,4.06) dist=1.42m front=0.72m cells=10 rms=3.7cm[238] DRIVE goal=(0.26,4.06) dist=1.41m front=0.74m cells=10 rms=3.7cm[239] DRIVE goal=(0.26,4.06) dist=1.39m front=0.76m cells=10 rms=3.8cm[240] DRIVE goal=(0.26,4.06) dist=1.37m front=0.71m cells=11 rms=3.8cm[241] DRIVE goal=(0.26,4.06) dist=1.35m front=0.74m cells=11 rms=3.8cm[242] DRIVE goal=(0.26,4.06) dist=1.33m front=0.75m cells=11 rms=3.8cm[243] DRIVE goal=(0.26,4.06) dist=1.31m front=0.71m cells=11 rms=3.8cm[244] DRIVE goal=(0.26,4.06) dist=1.28m front=0.76m cells=11 rms=3.8cm[245] DRIVE goal=(0.26,4.06) dist=1.26m front=0.71m cells=11 rms=3.8cm[246] DRIVE goal=(0.26,4.06) dist=1.24m front=0.76m cells=11 rms=3.8cm[247] DRIVE goal=(0.26,4.06) dist=1.22m front=0.70m cells=11 rms=3.8cm[248] DRIVE goal=(0.26,4.06) dist=1.20m front=0.74m cells=11 rms=3.8cm[249] DRIVE goal=(0.26,4.06) dist=1.19m front=0.70m cells=11 rms=3.8cm[250] DRIVE goal=(0.26,4.06) dist=1.17m front=0.70m cells=11 rms=3.8cm[251] DRIVE goal=(0.26,4.06) dist=1.15m front=0.72m cells=11 rms=3.8cm[252] DRIVE goal=(0.26,4.06) dist=1.13m front=0.72m cells=11 rms=3.8cm[253] DRIVE goal=(0.26,4.06) dist=1.11m front=0.69m cells=11 rms=3.8cm[254] DRIVE goal=(0.26,4.06) dist=1.09m front=0.71m cells=11 rms=3.8cm[255] DRIVE goal=(0.26,4.06) dist=1.08m front=0.69m cells=11 rms=3.8cm[256] DRIVE goal=(0.26,4.06) dist=1.07m front=0.71m cells=11 rms=3.8cm[257] DRIVE goal=(0.26,4.06) dist=1.05m front=0.81m cells=12 rms=3.8cm[258] DRIVE goal=(0.26,4.06) dist=1.03m front=0.75m cells=12 rms=3.8cm[259] DRIVE goal=(0.26,4.06) dist=1.01m front=0.79m cells=12 rms=3.8cm[260] DRIVE goal=(0.26,4.06) dist=0.99m front=0.77m cells=12 rms=3.8cm[261] DRIVE goal=(0.26,4.06) dist=0.98m front=0.77m cells=12 rms=3.8cm[262] DRIVE goal=(0.26,4.06) dist=0.96m front=0.78m cells=12 rms=3.8cm[263] DRIVE goal=(0.26,4.06) dist=0.94m front=0.78m cells=12 rms=3.8cm[264] DRIVE goal=(0.26,4.06) dist=0.92m front=0.78m cells=12 rms=3.8cm[265] DRIVE goal=(0.26,4.06) dist=0.90m front=0.81m cells=12 rms=3.8cm[266] DRIVE goal=(0.26,4.06) dist=0.88m front=0.80m cells=12 rms=3.8cm[267] DRIVE goal=(0.26,4.06) dist=0.86m front=0.79m cells=12 rms=3.8cm[268] DRIVE goal=(0.26,4.06) dist=0.85m front=0.78m cells=12 rms=3.8cm[269] DRIVE goal=(0.26,4.06) dist=0.83m front=0.78m cells=12 rms=3.8cm[270] DRIVE goal=(0.26,4.06) dist=0.81m front=0.76m cells=12 rms=3.8cm[271] DRIVE goal=(0.26,4.06) dist=0.79m front=0.79m cells=12 rms=3.8cm[272] DRIVE goal=(0.26,4.06) dist=0.77m front=0.78m cells=12 rms=3.8cm[273] DRIVE goal=(0.26,4.06) dist=0.75m front=0.79m cells=13 rms=3.8cm[274] DRIVE goal=(0.26,4.06) dist=0.73m front=0.78m cells=13 rms=3.8cm[275] DRIVE goal=(0.26,4.06) dist=0.72m front=0.78m cells=13 rms=3.8cm[276] DRIVE goal=(0.26,4.06) dist=0.70m front=0.78m cells=13 rms=3.8cm[277] DRIVE goal=(0.26,4.06) dist=0.68m front=0.78m cells=13 rms=3.8cm[278] DRIVE goal=(0.26,4.06) dist=0.66m front=0.76m cells=13 rms=3.8cm[279] DRIVE goal=(0.26,4.06) dist=0.65m front=0.78m cells=13 rms=3.8cm[280] DRIVE goal=(0.26,4.06) dist=0.62m front=0.78m cells=13 rms=3.8cm[281] DRIVE goal=(0.26,4.06) dist=0.61m front=0.79m cells=13 rms=3.8cm[282] DRIVE goal=(0.26,4.06) dist=0.59m front=0.79m cells=13 rms=3.8cm[283] DRIVE goal=(0.26,4.06) dist=0.57m front=0.80m cells=13 rms=3.8cm[284] DRIVE goal=(0.26,4.06) dist=0.55m front=0.79m cells=13 rms=3.8cm[285] DRIVE goal=(0.26,4.06) dist=0.53m front=0.79m cells=13 rms=3.8cm[286] DRIVE goal=(0.26,4.06) dist=0.51m front=0.78m cells=13 rms=3.8cm[287] DRIVE goal=(0.26,4.06) dist=0.49m front=0.75m cells=13 rms=3.8cm[288] DRIVE goal=(0.26,4.06) dist=0.47m front=0.80m cells=13 rms=3.8cm[289] DRIVE goal=(0.26,4.06) dist=0.46m front=0.80m cells=14 rms=3.8cm[290] DRIVE goal=(0.26,4.06) dist=0.44m front=0.79m cells=14 rms=3.8cm[291] DRIVE goal=(0.26,4.06) dist=0.43m front=0.80m cells=14 rms=3.8cm[292] DRIVE goal=(0.26,4.06) dist=0.41m front=0.79m cells=14 rms=3.8cm[293] DRIVE goal=(0.26,4.06) dist=0.41m front=0.72m cells=14 rms=3.8cm[294] DRIVE goal=(0.26,4.06) dist=0.41m front=0.74m cells=14 rms=3.8cm[295] DRIVE goal=(0.26,4.06) dist=0.41m front=0.75m cells=14 rms=3.8cm[296] DRIVE goal=(0.26,4.06) dist=0.41m front=0.74m cells=14 rms=3.8cm[297] DRIVE goal=(0.26,4.06) dist=0.41m front=0.73m cells=14 rms=3.8cm[298] DRIVE goal=(0.26,4.06) dist=0.41m front=0.72m cells=14 rms=3.8cm[299] DRIVE goal=(0.26,4.06) dist=0.41m front=0.72m cells=14 rms=3.9cm[300] DRIVE goal=(0.26,4.06) dist=0.41m front=0.73m cells=14 rms=3.9cm[301] DRIVE goal=(0.26,4.06) dist=0.42m front=0.72m cells=14 rms=3.9cm[302] DRIVE goal=(0.26,4.06) dist=0.42m front=0.73m cells=14 rms=3.9cm[303] DRIVE goal=(0.26,4.06) dist=0.42m front=0.74m cells=14 rms=3.9cm[304] DRIVE goal=(0.26,4.06) dist=0.41m front=0.73m cells=14 rms=3.9cm[305] DRIVE goal=(0.26,4.06) dist=0.41m front=0.72m cells=14 rms=3.9cm[306] DRIVE goal=(0.26,4.06) dist=0.41m front=0.71m cells=14 rms=3.9cm[307] DRIVE goal=(0.26,4.06) dist=0.41m front=0.74m cells=14 rms=3.9cm[308] DRIVE goal=(0.26,4.06) dist=0.41m front=0.75m cells=14 rms=3.9cm[309] DRIVE goal=(0.26,4.06) dist=0.41m front=0.74m cells=14 rms=3.9cm[310] DRIVE goal=(0.26,4.06) dist=0.41m front=0.74m cells=14 rms=3.9cm[311] DRIVE goal=(0.26,4.06) dist=0.42m front=0.75m cells=14 rms=3.9cm[312] DRIVE goal=(0.26,4.06) dist=0.41m front=0.74m cells=14 rms=3.9cm[313] DRIVE goal=(0.26,4.06) dist=0.41m front=0.73m cells=14 rms=3.9cm[314] DRIVE goal=(0.26,4.06) dist=0.42m front=0.74m cells=14 rms=3.9cm[315] DRIVE goal=(0.26,4.06) dist=0.42m front=0.74m cells=14 rms=3.9cm[316] DRIVE goal=(0.26,4.06) dist=0.41m front=0.72m cells=14 rms=3.9cm[317] DRIVE goal=(0.26,4.06) dist=0.41m front=0.72m cells=14 rms=3.9cm[318] DRIVE goal=(0.26,4.06) dist=0.41m front=0.73m cells=14 rms=3.9cm[319] DRIVE goal=(0.26,4.06) dist=0.41m front=0.73m cells=14 rms=3.9cm[320] DRIVE goal=(0.26,4.06) dist=0.41m front=0.73m cells=14 rms=3.9cm[321] DRIVE goal=(0.26,4.06) dist=0.41m front=0.74m cells=14 rms=3.9cm
[ 74.0s] [DRIVE STUCK] Goal distance unchanged for 6.8s
[DRIVE STUCK] dist_oldest=0.47m, dist_now=0.41m, change=0.06m < margin=0.08m
[DRIVE STUCK] Front sectors: s55=0.74 s56=0.84 s57=1.01 s58=1.36 s59=1.87 s0=1.93 s1=2.69 s2=2.70 s3=2.74 s4=2.78 s5=2.86 
[DRIVE STUCK] Marked front sectors [55, 56, 57, 58, 59, 0, 1, 2, 3, 4, 5] as blocked for 30s

[BACKUP CLEAR] Reversing and turning toward clearer side...
[BACKUP CLEAR] Turning left (L_avg=2.75m R_avg=1.17m)

[ 78.8s] [REFINE] best score -33.1 < 20.0, resampling with 150 angles (level 1)

[ 78.8s] [REFINE] best score -33.1 < 20.0, resampling with 450 angles (level 2)

[ 78.8s] [REFINE] best score -33.1 < 20.0, resampling with 1350 angles (level 3)

[ 78.8s] [GOAL SELECT] robot@(0.35,3.55) | 307 candidates (refined 3x) (scanned=198 walls=135 visited=14):
  #1 ang= -33° d=0.50m pos=(0.45,4.04) score=-33.1 [O=+1.7 U=+20.2 V=-2.6 W=-3.0 R=-5.3 F=+14.9 B=-50.0 T=-9.2] <-- BEST
  #2 ang= -33° d=0.50m pos=(0.46,4.04) score=-33.1 [O=+1.7 U=+20.2 V=-2.6 W=-3.0 R=-5.3 F=+14.9 B=-50.0 T=-9.2]
  #3 ang= -33° d=0.50m pos=(0.46,4.04) score=-33.1 [O=+1.7 U=+20.2 V=-2.6 W=-3.0 R=-5.3 F=+14.9 B=-50.0 T=-9.2]
  #4 ang= -33° d=0.50m pos=(0.46,4.04) score=-33.1 [O=+1.7 U=+20.2 V=-2.6 W=-3.0 R=-5.3 F=+14.9 B=-50.0 T=-9.2]
  #5 ang= -34° d=0.50m pos=(0.46,4.04) score=-33.1 [O=+1.7 U=+20.2 V=-2.6 W=-3.0 R=-5.3 F=+14.9 B=-50.0 T=-9.2]
  #6 ang= -34° d=0.50m pos=(0.46,4.04) score=-33.1 [O=+1.7 U=+20.2 V=-2.6 W=-3.0 R=-5.3 F=+14.9 B=-50.0 T=-9.2]
  #7 ang= -34° d=0.50m pos=(0.46,4.04) score=-33.2 [O=+1.7 U=+20.2 V=-2.6 W=-3.0 R=-5.3 F=+14.9 B=-50.0 T=-9.2]
  #8 ang= -34° d=0.50m pos=(0.47,4.04) score=-33.2 [O=+1.7 U=+20.2 V=-2.6 W=-3.0 R=-5.3 F=+14.9 B=-50.0 T=-9.2]
[ 78.8s] [GOAL] Selected: (0.45, 4.04) dist=0.50m timeout=28s angle=-33° reason=no goal
[323] DRIVE goal=(0.45,4.04) dist=0.50m front=0.50m cells=14 rms=3.9cm[324] DRIVE goal=(0.45,4.04) dist=0.50m front=0.48m cells=14 rms=3.9cm[325] DRIVE goal=(0.45,4.04) dist=0.50m front=0.46m cells=14 rms=3.9cm[326] DRIVE goal=(0.45,4.04) dist=0.50m front=0.45m cells=14 rms=3.9cm[327] DRIVE goal=(0.45,4.04) dist=0.50m front=0.48m cells=14 rms=3.9cm[328] DRIVE goal=(0.45,4.04) dist=0.50m front=0.48m cells=14 rms=3.9cm[329] DRIVE goal=(0.45,4.04) dist=0.50m front=0.48m cells=14 rms=3.9cm[330] DRIVE goal=(0.45,4.04) dist=0.50m front=0.51m cells=14 rms=3.9cm[331] DRIVE goal=(0.45,4.04) dist=0.50m front=0.54m cells=14 rms=3.9cm[332] DRIVE goal=(0.45,4.04) dist=0.50m front=0.56m cells=14 rms=3.9cm[333] DRIVE goal=(0.45,4.04) dist=0.50m front=0.60m cells=14 rms=3.9cm[334] DRIVE goal=(0.45,4.04) dist=0.50m front=0.64m cells=14 rms=3.9cm[335] DRIVE goal=(0.45,4.04) dist=0.50m front=0.72m cells=14 rms=3.8cm[336] DRIVE goal=(0.45,4.04) dist=0.50m front=0.73m cells=14 rms=3.8cm[337] DRIVE goal=(0.45,4.04) dist=0.50m front=0.76m cells=14 rms=3.8cm[338] DRIVE goal=(0.45,4.04) dist=0.50m front=0.75m cells=14 rms=3.8cm[339] DRIVE goal=(0.45,4.04) dist=0.49m front=0.68m cells=14 rms=3.8cm[340] DRIVE goal=(0.45,4.04) dist=0.49m front=0.66m cells=14 rms=3.8cm[341] DRIVE goal=(0.45,4.04) dist=0.48m front=0.64m cells=14 rms=3.8cm[342] DRIVE goal=(0.45,4.04) dist=0.48m front=0.62m cells=14 rms=3.8cm[343] DRIVE goal=(0.45,4.04) dist=0.47m front=0.61m cells=14 rms=3.8cm[344] DRIVE goal=(0.45,4.04) dist=0.45m front=0.60m cells=14 rms=3.8cm[345] DRIVE goal=(0.45,4.04) dist=0.44m front=0.60m cells=14 rms=3.8cm[346] DRIVE goal=(0.45,4.04) dist=0.42m front=0.58m cells=14 rms=3.8cm
[ 83.6s] [REFINE] best score -9.7 < 20.0, resampling with 150 angles (level 1)

[ 83.6s] [REFINE] best score -6.3 < 20.0, resampling with 450 angles (level 2)

[ 83.6s] [REFINE] best score -1.0 < 20.0, resampling with 1350 angles (level 3)

[ 83.7s] [GOAL SELECT] robot@(0.36,3.66) | 356 candidates (refined 3x) (scanned=199 walls=135 visited=14):
  #1 ang= +36° d=2.00m pos=(-0.55,5.44) score=-1.0 [O=+1.8 U=+34.0 V=-0.0 W=-0.0 R=-0.0 F=+12.7 B=-50.0] <-- BEST
  #2 ang= +36° d=2.00m pos=(-0.55,5.44) score=-1.0 [O=+1.8 U=+34.0 V=-0.0 W=-0.0 R=-0.0 F=+12.6 B=-50.0]
  #3 ang= +36° d=2.00m pos=(-0.56,5.43) score=-1.0 [O=+1.8 U=+34.0 V=-0.0 W=-0.0 R=-0.0 F=+12.6 B=-50.0]
  #4 ang= +36° d=2.00m pos=(-0.57,5.43) score=-1.1 [O=+1.8 U=+34.0 V=-0.0 W=-0.0 R=-0.0 F=+12.6 B=-50.0]
  #5 ang= +37° d=2.00m pos=(-0.58,5.42) score=-1.1 [O=+1.8 U=+34.0 V=-0.0 W=-0.0 R=-0.0 F=+12.5 B=-50.0]
  #6 ang= +36° d=1.50m pos=(-0.32,4.99) score=-4.2 [O=+2.3 U=+30.4 V=-0.0 W=-0.0 R=-0.0 F=+12.7 B=-50.0]
  #7 ang= +36° d=1.50m pos=(-0.33,4.99) score=-4.2 [O=+2.3 U=+30.4 V=-0.0 W=-0.0 R=-0.0 F=+12.6 B=-50.0]
  #8 ang= +36° d=1.50m pos=(-0.33,4.99) score=-4.3 [O=+2.3 U=+30.4 V=-0.0 W=-0.0 R=-0.0 F=+12.6 B=-50.0]
[ 83.7s] [GOAL] Selected: (-0.55, 5.44) dist=2.00m timeout=50s angle=36° reason=reached
[347] DRIVE goal=(-0.55,5.44) dist=2.00m front=0.58m cells=14 rms=3.8cm[348] DRIVE goal=(-0.55,5.44) dist=2.00m front=0.68m cells=14 rms=3.8cm[349] DRIVE goal=(-0.55,5.44) dist=2.00m front=0.72m cells=14 rms=3.8cm[350] DRIVE goal=(-0.55,5.44) dist=2.00m front=0.70m cells=14 rms=3.8cm[351] DRIVE goal=(-0.55,5.44) dist=2.00m front=0.70m cells=14 rms=3.8cm[352] DRIVE goal=(-0.55,5.44) dist=2.00m front=0.72m cells=14 rms=3.8cm[353] DRIVE goal=(-0.55,5.44) dist=2.00m front=0.72m cells=14 rms=3.7cm[354] DRIVE goal=(-0.55,5.44) dist=2.00m front=0.71m cells=14 rms=3.7cm[355] DRIVE goal=(-0.55,5.44) dist=2.00m front=0.74m cells=14 rms=3.7cm[356] DRIVE goal=(-0.55,5.44) dist=2.00m front=0.75m cells=14 rms=3.7cm[357] DRIVE goal=(-0.55,5.44) dist=2.00m front=0.76m cells=14 rms=3.7cm[358] DRIVE goal=(-0.55,5.44) dist=2.00m front=0.77m cells=14 rms=3.7cm[359] DRIVE goal=(-0.55,5.44) dist=2.00m front=0.76m cells=14 rms=3.7cm[360] DRIVE goal=(-0.55,5.44) dist=2.00m front=0.76m cells=14 rms=3.7cm[361] DRIVE goal=(-0.55,5.44) dist=2.00m front=0.76m cells=14 rms=3.7cm[362] DRIVE goal=(-0.55,5.44) dist=2.00m front=0.76m cells=14 rms=3.7cm[363] DRIVE goal=(-0.55,5.44) dist=2.00m front=0.71m cells=14 rms=3.7cm[364] DRIVE goal=(-0.55,5.44) dist=2.00m front=0.74m cells=14 rms=3.7cm[365] DRIVE goal=(-0.55,5.44) dist=2.00m front=0.72m cells=14 rms=3.7cm[366] DRIVE goal=(-0.55,5.44) dist=2.00m front=0.72m cells=14 rms=3.7cm[367] DRIVE goal=(-0.55,5.44) dist=2.00m front=0.71m cells=14 rms=3.7cm[368] DRIVE goal=(-0.55,5.44) dist=2.00m front=0.73m cells=14 rms=3.7cm[369] DRIVE goal=(-0.55,5.44) dist=2.00m front=0.71m cells=14 rms=3.7cm[370] DRIVE goal=(-0.55,5.44) dist=2.00m front=0.75m cells=14 rms=3.7cm[371] DRIVE goal=(-0.55,5.44) dist=2.00m front=0.77m cells=14 rms=3.7cm[372] DRIVE goal=(-0.55,5.44) dist=2.00m front=0.78m cells=14 rms=3.7cm[373] DRIVE goal=(-0.55,5.44) dist=2.00m front=0.77m cells=14 rms=3.6cm[374] DRIVE goal=(-0.55,5.44) dist=2.00m front=0.77m cells=14 rms=3.6cm[375] DRIVE goal=(-0.55,5.44) dist=2.00m front=0.76m cells=14 rms=3.6cm[376] DRIVE goal=(-0.55,5.44) dist=2.01m front=0.77m cells=14 rms=3.6cm[377] DRIVE goal=(-0.55,5.44) dist=2.00m front=0.74m cells=14 rms=3.6cm[378] DRIVE goal=(-0.55,5.44) dist=2.00m front=0.71m cells=14 rms=3.6cm[379] DRIVE goal=(-0.55,5.44) dist=2.00m front=0.71m cells=14 rms=3.6cm[380] DRIVE goal=(-0.55,5.44) dist=2.00m front=0.71m cells=14 rms=3.6cm[381] DRIVE goal=(-0.55,5.44) dist=2.00m front=0.70m cells=14 rms=3.6cm[382] DRIVE goal=(-0.55,5.44) dist=2.00m front=0.72m cells=14 rms=3.6cm[383] DRIVE goal=(-0.55,5.44) dist=2.00m front=0.70m cells=14 rms=3.6cm[384] DRIVE goal=(-0.55,5.44) dist=2.00m front=0.72m cells=14 rms=3.6cm[385] DRIVE goal=(-0.55,5.44) dist=2.00m front=0.73m cells=14 rms=3.6cm
[ 91.5s] [DRIVE STUCK] Goal distance unchanged for 6.2s
[DRIVE STUCK] dist_oldest=2.00m, dist_now=2.00m, change=0.00m < margin=0.08m
[DRIVE STUCK] Front sectors: s55=0.73 s56=0.83 s57=0.97 s58=1.27 s59=1.61 s0=1.88 s1=2.69 s2=2.70 s3=2.74 s4=2.79 s5=2.87 
[DRIVE STUCK] Marked front sectors [55, 56, 57, 58, 59, 0, 1, 2, 3, 4, 5] as blocked for 30s

[BACKUP CLEAR] Reversing and turning toward clearer side...
[BACKUP CLEAR] Turning left (L_avg=2.76m R_avg=1.08m)

[ 96.2s] [REFINE] best score -15.4 < 20.0, resampling with 150 angles (level 1)

[ 96.2s] [REFINE] best score -15.3 < 20.0, resampling with 450 angles (level 2)

[ 96.2s] [REFINE] best score -15.3 < 20.0, resampling with 1350 angles (level 3)

[ 96.3s] [GOAL SELECT] robot@(0.39,3.54) | 324 candidates (refined 3x) (scanned=201 walls=136 visited=14):
  #1 ang= -40° d=0.50m pos=(0.51,4.02) score=-15.3 [O=+1.5 U=+20.9 V=-2.6 W=-3.0 R=-13.0 F=+14.9 B=-25.0 T=-9.2] <-- BEST
  #2 ang= -41° d=0.50m pos=(0.51,4.02) score=-15.3 [O=+1.5 U=+20.9 V=-2.6 W=-3.0 R=-13.0 F=+14.9 B=-25.0 T=-9.2]
  #3 ang= -41° d=0.50m pos=(0.51,4.02) score=-15.3 [O=+1.5 U=+20.9 V=-2.6 W=-3.0 R=-13.0 F=+14.9 B=-25.0 T=-9.2]
  #4 ang= -41° d=0.50m pos=(0.51,4.02) score=-15.3 [O=+1.5 U=+20.9 V=-2.6 W=-3.0 R=-13.0 F=+14.9 B=-25.0 T=-9.2]
  #5 ang= -41° d=0.50m pos=(0.52,4.02) score=-15.3 [O=+1.5 U=+20.9 V=-2.6 W=-3.0 R=-13.0 F=+14.8 B=-25.0 T=-9.2]
  #6 ang= -37° d=0.50m pos=(0.48,4.03) score=-15.3 [O=+1.5 U=+20.8 V=-2.6 W=-3.0 R=-13.0 F=+15.0 B=-25.0 T=-9.2]
  #7 ang= -41° d=0.50m pos=(0.52,4.02) score=-15.3 [O=+1.5 U=+20.9 V=-2.6 W=-3.0 R=-13.0 F=+14.8 B=-25.0 T=-9.2]
  #8 ang= -37° d=0.50m pos=(0.48,4.03) score=-15.3 [O=+1.5 U=+20.8 V=-2.6 W=-3.0 R=-13.0 F=+15.0 B=-25.0 T=-9.2]
[ 96.3s] [GOAL] Selected: (0.51, 4.02) dist=0.50m timeout=28s angle=-40° reason=no goal
[387] DRIVE goal=(0.51,4.02) dist=0.50m front=0.52m cells=14 rms=3.6cm[388] DRIVE goal=(0.51,4.02) dist=0.50m front=0.47m cells=14 rms=3.6cm[389] DRIVE goal=(0.51,4.02) dist=0.50m front=0.49m cells=14 rms=3.6cm[390] DRIVE goal=(0.51,4.02) dist=0.50m front=0.48m cells=14 rms=3.6cm[391] DRIVE goal=(0.51,4.02) dist=0.50m front=0.47m cells=14 rms=3.6cm[392] DRIVE goal=(0.51,4.02) dist=0.50m front=0.48m cells=14 rms=3.6cm[393] DRIVE goal=(0.51,4.02) dist=0.50m front=0.51m cells=14 rms=3.6cm[394] DRIVE goal=(0.51,4.02) dist=0.50m front=0.53m cells=14 rms=3.6cm[395] DRIVE goal=(0.51,4.02) dist=0.51m front=0.55m cells=14 rms=3.5cm[396] DRIVE goal=(0.51,4.02) dist=0.51m front=0.58m cells=14 rms=3.5cm[397] DRIVE goal=(0.51,4.02) dist=0.50m front=0.63m cells=14 rms=3.5cm[398] DRIVE goal=(0.51,4.02) dist=0.51m front=0.67m cells=14 rms=3.5cm[399] DRIVE goal=(0.51,4.02) dist=0.51m front=0.72m cells=14 rms=3.5cm[400] DRIVE goal=(0.51,4.02) dist=0.51m front=0.77m cells=14 rms=3.5cm[401] DRIVE goal=(0.51,4.02) dist=0.51m front=0.79m cells=14 rms=3.5cm[402] DRIVE goal=(0.51,4.02) dist=0.51m front=0.76m cells=14 rms=3.5cm[403] DRIVE goal=(0.51,4.02) dist=0.51m front=0.70m cells=14 rms=3.5cm[404] DRIVE goal=(0.51,4.02) dist=0.50m front=0.64m cells=14 rms=3.5cm[405] DRIVE goal=(0.51,4.02) dist=0.50m front=0.60m cells=14 rms=3.5cm[406] DRIVE goal=(0.51,4.02) dist=0.49m front=0.57m cells=14 rms=3.5cm[407] DRIVE goal=(0.51,4.02) dist=0.48m front=0.57m cells=14 rms=3.5cm[408] DRIVE goal=(0.51,4.02) dist=0.46m front=0.52m cells=14 rms=3.5cm[409] DRIVE goal=(0.51,4.02) dist=0.45m front=0.49m cells=14 rms=3.5cm[410] DRIVE goal=(0.51,4.02) dist=0.44m front=0.47m cells=14 rms=3.5cm[411] DRIVE goal=(0.51,4.02) dist=0.42m front=0.46m cells=14 rms=3.5cm[412] DRIVE goal=(0.51,4.02) dist=0.41m front=0.47m cells=14 rms=3.5cm
[101.6s] [GOAL SELECT] robot@(0.43,3.64) | 19 candidates (scanned=223 walls=154 visited=14):
  #1 ang=-101° d=2.00m pos=(2.00,2.40) score=+25.4 [O=+1.7 U=+34.0 V=-0.0 W=-3.0 R=-0.0 F=-7.9] <-- BEST
  #2 ang=-107° d=2.00m pos=(1.86,2.24) score=+24.0 [O=+1.6 U=+34.0 V=-0.0 W=-3.0 R=-0.0 F=-9.2]
  #3 ang=-131° d=0.50m pos=(0.61,3.17) score=-12.0 [O=+1.8 U=+23.9 V=-4.8 W=-3.0 R=-0.0 F=-13.3 T=-16.8]
  #4 ang=-125° d=0.50m pos=(0.66,3.19) score=-13.4 [O=+1.8 U=+21.8 V=-4.8 W=-3.0 R=-0.0 F=-12.5 T=-16.8]
  #5 ang=-113° d=0.50m pos=(0.75,3.25) score=-14.4 [O=+2.1 U=+18.4 V=-4.8 W=-3.0 R=-0.0 F=-10.4 T=-16.8]
  #6 ang=-119° d=0.50m pos=(0.70,3.22) score=-14.9 [O=+1.9 U=+19.2 V=-4.8 W=-3.0 R=-0.0 F=-11.5 T=-16.8]
  #7 ang=-107° d=0.50m pos=(0.79,3.29) score=-17.6 [O=+2.5 U=+10.4 V=-4.8 W=-3.0 R=-0.0 F=-9.2 T=-13.6]
  #8 ang= +33° d=2.00m pos=(0.20,5.62) score=-57.0 [O=+1.8 U=+33.0 V=-0.0 W=-0.0 R=-7.0 F=+14.6 B=-100.0]
[101.6s] [GOAL] Selected: (2.00, 2.40) dist=2.00m timeout=50s angle=-101° reason=reached
[413] DRIVE goal=(2.00,2.40) dist=2.00m front=0.52m cells=14 rms=3.5cm[414] DRIVE goal=(2.00,2.40) dist=2.00m front=0.58m cells=14 rms=3.5cm[415] DRIVE goal=(2.00,2.40) dist=2.00m front=0.61m cells=14 rms=3.5cm[416] DRIVE goal=(2.00,2.40) dist=2.00m front=0.62m cells=14 rms=3.5cm[417] DRIVE goal=(2.00,2.40) dist=2.00m front=0.61m cells=14 rms=3.5cm[418] DRIVE goal=(2.00,2.40) dist=2.00m front=0.61m cells=14 rms=3.5cm[419] DRIVE goal=(2.00,2.40) dist=1.99m front=0.61m cells=14 rms=3.6cm[420] DRIVE goal=(2.00,2.40) dist=2.00m front=0.60m cells=14 rms=3.6cm[421] DRIVE goal=(2.00,2.40) dist=2.00m front=0.59m cells=14 rms=3.5cm[422] DRIVE goal=(2.00,2.40) dist=2.00m front=0.54m cells=14 rms=3.5cm[423] DRIVE goal=(2.00,2.40) dist=2.00m front=0.55m cells=14 rms=3.5cm[424] DRIVE goal=(2.00,2.40) dist=2.00m front=0.54m cells=14 rms=3.5cm[425] DRIVE goal=(2.00,2.40) dist=2.00m front=0.51m cells=14 rms=3.5cm[426] DRIVE goal=(2.00,2.40) dist=2.00m front=0.49m cells=14 rms=3.5cm[427] DRIVE goal=(2.00,2.40) dist=2.00m front=0.49m cells=14 rms=3.5cm[428] DRIVE goal=(2.00,2.40) dist=2.00m front=0.49m cells=14 rms=3.5cm[429] DRIVE goal=(2.00,2.40) dist=1.99m front=0.48m cells=14 rms=3.5cm[430] DRIVE goal=(2.00,2.40) dist=1.99m front=0.45m cells=14 rms=3.5cm[431] DRIVE goal=(2.00,2.40) dist=1.99m front=0.45m cells=14 rms=3.5cm[432] DRIVE goal=(2.00,2.40) dist=1.99m front=0.45m cells=14 rms=3.5cm[433] DRIVE goal=(2.00,2.40) dist=1.99m front=0.45m cells=14 rms=3.5cm[434] DRIVE goal=(2.00,2.40) dist=1.99m front=0.44m cells=14 rms=3.5cm[435] DRIVE goal=(2.00,2.40) dist=1.99m front=0.42m cells=14 rms=3.5cm[436] DRIVE goal=(2.00,2.40) dist=1.99m front=0.41m cells=14 rms=3.5cm[437] DRIVE goal=(2.00,2.40) dist=1.99m front=0.40m cells=14 rms=3.5cm[438] DRIVE goal=(2.00,2.40) dist=1.98m front=0.40m cells=14 rms=3.5cm[439] DRIVE goal=(2.00,2.40) dist=1.98m front=0.40m cells=14 rms=3.5cm[440] DRIVE goal=(2.00,2.40) dist=1.98m front=0.40m cells=14 rms=3.5cm[441] DRIVE goal=(2.00,2.40) dist=1.98m front=0.40m cells=14 rms=3.5cm[442] DRIVE goal=(2.00,2.40) dist=1.98m front=0.40m cells=14 rms=3.5cm[443] DRIVE goal=(2.00,2.40) dist=1.99m front=0.41m cells=14 rms=3.5cm[444] DRIVE goal=(2.00,2.40) dist=1.99m front=0.41m cells=14 rms=3.5cm[445] DRIVE goal=(2.00,2.40) dist=1.99m front=0.41m cells=14 rms=3.5cm[446] DRIVE goal=(2.00,2.40) dist=1.99m front=0.41m cells=14 rms=3.5cm[447] DRIVE goal=(2.00,2.40) dist=1.99m front=0.41m cells=14 rms=3.6cm[448] DRIVE goal=(2.00,2.40) dist=1.98m front=0.41m cells=14 rms=3.6cm[449] DRIVE goal=(2.00,2.40) dist=1.98m front=0.40m cells=14 rms=3.6cm[450] DRIVE goal=(2.00,2.40) dist=1.98m front=0.39m cells=14 rms=3.6cm[451] DRIVE goal=(2.00,2.40) dist=1.98m front=0.39m cells=14 rms=3.6cm[452] DRIVE goal=(2.00,2.40) dist=1.99m front=0.40m cells=14 rms=3.6cm[453] DRIVE goal=(2.00,2.40) dist=1.98m front=0.40m cells=14 rms=3.6cm[454] DRIVE goal=(2.00,2.40) dist=1.98m front=0.40m cells=14 rms=3.6cm
[110.0s] [TURN ENTER] Entering TURN mode

[BLOCKED DEBUG] Goal angle: -45.5° (sector 52), goal_dist: 2.00m, goal_dir_min: 1.20m, margin: 0.15m
[BLOCKED DEBUG] Checking 1 sectors (robot angular width at 2.0m = 5.2°): {52: 1.203}
[BLOCKED DEBUG] Check: 1.20 < 2.00 - 0.15 = 1.85? True
[BLOCKED DEBUG] (Full front arc for reference: {55: 1.655, 56: 2.562, 57: 3.444, 58: 2.98, 59: 2.994, 0: 3.296, 1: 0.445, 2: 0.425, 3: 0.42, 4: 0.413, 5: 0.425})

[BLOCKED TURN] goal_sector=52, best_sector=52 (dist=1.20m), target_angle=-48.0°, angle_error=-48.0°, v=0.00, w=-0.50
[455] TURN goal=(2.00,2.40) dist=2.00m front=0.41m cells=14 rms=3.6cm[456] TURN goal=(2.00,2.40) dist=1.99m front=0.42m cells=14 rms=3.6cm[457] TURN goal=(2.00,2.40) dist=1.99m front=0.42m cells=14 rms=3.6cm[458] TURN goal=(2.00,2.40) dist=1.99m front=0.42m cells=14 rms=3.6cm[459] TURN goal=(2.00,2.40) dist=2.00m front=0.42m cells=14 rms=3.6cm[460] TURN goal=(2.00,2.40) dist=1.99m front=0.43m cells=14 rms=3.6cm[461] TURN goal=(2.00,2.40) dist=1.99m front=0.43m cells=14 rms=3.6cm[462] TURN goal=(2.00,2.40) dist=2.00m front=0.43m cells=14 rms=3.6cm[463] TURN goal=(2.00,2.40) dist=1.99m front=0.44m cells=14 rms=3.6cm[464] TURN goal=(2.00,2.40) dist=1.99m front=0.44m cells=14 rms=3.7cm[465] TURN goal=(2.00,2.40) dist=2.00m front=0.44m cells=14 rms=3.7cm[466] TURN goal=(2.00,2.40) dist=1.99m front=0.46m cells=14 rms=3.7cm[467] TURN goal=(2.00,2.40) dist=2.00m front=0.46m cells=14 rms=3.7cm[468] TURN goal=(2.00,2.40) dist=1.99m front=1.19m cells=14 rms=3.7cm[469] TURN goal=(2.00,2.40) dist=1.99m front=1.19m cells=14 rms=3.7cm[470] TURN goal=(2.00,2.40) dist=1.99m front=1.20m cells=14 rms=3.7cm[471] TURN goal=(2.00,2.40) dist=1.99m front=1.19m cells=14 rms=3.7cm[472] TURN goal=(2.00,2.40) dist=1.99m front=1.19m cells=14 rms=3.7cm[473] TURN goal=(2.00,2.40) dist=1.99m front=1.19m cells=14 rms=3.7cm[474] TURN goal=(2.00,2.40) dist=1.99m front=1.19m cells=14 rms=3.7cm[475] TURN goal=(2.00,2.40) dist=1.99m front=1.19m cells=14 rms=3.7cm[476] TURN goal=(2.00,2.40) dist=2.00m front=1.19m cells=14 rms=3.7cm[477] TURN goal=(2.00,2.40) dist=1.99m front=1.19m cells=14 rms=3.7cm[478] TURN goal=(2.00,2.40) dist=1.99m front=1.19m cells=14 rms=3.8cm[479] TURN goal=(2.00,2.40) dist=1.99m front=1.19m cells=14 rms=3.8cm[480] TURN goal=(2.00,2.40) dist=2.00m front=1.19m cells=14 rms=3.8cm
[115.2s] [TURN STUCK] In TURN mode for 5.2s, backing up
[TURN STUCK] Position history (26 samples):
  First: (0.40, 3.58) heading=5.9°
  Mid:   (0.40, 3.58) heading=-18.4°
  Last:  (0.39, 3.59) heading=-21.1°
  Movement: 0.012m, heading change: 27.0°
[TURN STUCK] Current front sectors: s55=1.54 s56=1.31 s57=1.19 s58=1.21 s59=1.36 s0=1.53 s1=2.53 s2=2.82 s3=3.16 s4=3.34 s5=3.30 

[BACKUP CLEAR] Reversing and turning toward clearer side...
[BACKUP CLEAR] Turning left (L_avg=3.03m R_avg=1.32m)

[119.9s] [GOAL SELECT] robot@(0.22,3.59) | 8 candidates (scanned=264 walls=195 visited=15):
  #1 ang= +82° d=1.00m pos=(0.13,4.59) score=+33.4 [O=+1.7 U=+17.5 V=-0.0 W=-1.0 R=-0.0 F=+14.8] <-- BEST
  #2 ang= +88° d=1.00m pos=(0.02,4.57) score=+33.3 [O=+1.9 U=+17.6 V=-0.0 W=-1.0 R=-0.0 F=+14.5]
  #3 ang= -94° d=2.00m pos=(0.48,1.61) score=+6.6 [O=+2.5 U=+23.9 V=-2.7 W=-3.0 R=-0.0 F=-14.7]
  #4 ang= -94° d=1.00m pos=(0.35,2.60) score=-9.3 [O=+2.5 U=+9.0 V=-3.2 W=-3.0 R=-0.0 F=-14.7 T=-0.1]
  #5 ang= -52° d=0.50m pos=(0.60,3.27) score=-22.5 [O=+1.9 U=+11.0 V=-3.7 W=-3.0 R=-0.0 F=-8.9 T=-20.0]
  #6 ang= -58° d=0.50m pos=(0.57,3.23) score=-28.5 [O=+2.2 U=+11.3 V=-8.9 W=-3.0 R=-0.0 F=-10.1 T=-20.0]
  #7 ang= -64° d=0.50m pos=(0.53,3.20) score=-29.6 [O=+2.3 U=+11.1 V=-8.9 W=-3.0 R=-0.0 F=-11.2 T=-20.0]
  #8 ang= -70° d=0.50m pos=(0.48,3.17) score=-30.2 [O=+2.3 U=+11.6 V=-8.9 W=-3.0 R=-0.0 F=-12.2 T=-20.0]
[119.9s] [GOAL] Selected: (0.13, 4.59) dist=1.00m timeout=35s angle=82° reason=no goal
[482] DRIVE goal=(0.13,4.59) dist=1.00m front=0.57m cells=15 rms=3.8cm[483] DRIVE goal=(0.13,4.59) dist=1.00m front=0.57m cells=15 rms=3.8cm[484] DRIVE goal=(0.13,4.59) dist=1.00m front=0.57m cells=15 rms=3.8cm[485] DRIVE goal=(0.13,4.59) dist=1.00m front=0.57m cells=15 rms=3.8cm[486] DRIVE goal=(0.13,4.59) dist=1.00m front=0.57m cells=15 rms=3.8cm[487] DRIVE goal=(0.13,4.59) dist=1.00m front=0.57m cells=15 rms=3.7cm[488] DRIVE goal=(0.13,4.59) dist=1.00m front=0.57m cells=15 rms=3.7cm[489] DRIVE goal=(0.13,4.59) dist=1.00m front=0.57m cells=15 rms=3.7cm[490] DRIVE goal=(0.13,4.59) dist=1.00m front=0.58m cells=15 rms=3.7cm[491] DRIVE goal=(0.13,4.59) dist=1.00m front=0.59m cells=15 rms=3.7cm[492] DRIVE goal=(0.13,4.59) dist=1.01m front=0.59m cells=15 rms=3.7cm[493] DRIVE goal=(0.13,4.59) dist=1.01m front=0.59m cells=15 rms=3.7cm[494] DRIVE goal=(0.13,4.59) dist=1.01m front=0.59m cells=15 rms=3.7cm[495] DRIVE goal=(0.13,4.59) dist=1.01m front=0.59m cells=15 rms=3.7cm[496] DRIVE goal=(0.13,4.59) dist=1.00m front=0.59m cells=15 rms=3.7cm[497] DRIVE goal=(0.13,4.59) dist=1.01m front=0.59m cells=15 rms=3.7cm[498] DRIVE goal=(0.13,4.59) dist=1.01m front=0.59m cells=15 rms=3.7cm[499] DRIVE goal=(0.13,4.59) dist=1.01m front=0.59m cells=15 rms=3.7cm[500] DRIVE goal=(0.13,4.59) dist=1.01m front=0.59m cells=15 rms=3.7cm[501] DRIVE goal=(0.13,4.59) dist=1.01m front=0.58m cells=15 rms=3.7cm[502] DRIVE goal=(0.13,4.59) dist=1.01m front=0.58m cells=15 rms=3.7cm[503] DRIVE goal=(0.13,4.59) dist=1.01m front=0.57m cells=15 rms=3.7cm[504] DRIVE goal=(0.13,4.59) dist=1.00m front=0.57m cells=15 rms=3.7cm[505] DRIVE goal=(0.13,4.59) dist=1.01m front=0.57m cells=15 rms=3.7cm[506] DRIVE goal=(0.13,4.59) dist=1.01m front=0.57m cells=15 rms=3.7cm[507] DRIVE goal=(0.13,4.59) dist=1.01m front=0.58m cells=15 rms=3.7cm[508] DRIVE goal=(0.13,4.59) dist=1.01m front=0.58m cells=15 rms=3.7cm[509] DRIVE goal=(0.13,4.59) dist=1.01m front=0.58m cells=15 rms=3.7cm[510] DRIVE goal=(0.13,4.59) dist=1.01m front=0.59m cells=15 rms=3.7cm[511] DRIVE goal=(0.13,4.59) dist=1.02m front=0.59m cells=15 rms=3.7cm[512] DRIVE goal=(0.13,4.59) dist=1.02m front=0.59m cells=15 rms=3.7cm[513] DRIVE goal=(0.13,4.59) dist=1.02m front=0.60m cells=15 rms=3.7cm[514] DRIVE goal=(0.13,4.59) dist=1.02m front=0.62m cells=15 rms=3.7cm[515] DRIVE goal=(0.13,4.59) dist=1.02m front=0.63m cells=15 rms=3.7cm[516] DRIVE goal=(0.13,4.59) dist=1.02m front=0.63m cells=15 rms=3.7cm[517] DRIVE goal=(0.13,4.59) dist=1.02m front=0.63m cells=15 rms=3.6cm[518] DRIVE goal=(0.13,4.59) dist=1.01m front=0.64m cells=15 rms=3.6cm[519] DRIVE goal=(0.13,4.59) dist=1.01m front=0.66m cells=15 rms=3.6cm[520] DRIVE goal=(0.13,4.59) dist=1.01m front=0.67m cells=15 rms=3.6cm[521] DRIVE goal=(0.13,4.59) dist=1.01m front=0.70m cells=15 rms=3.6cm[522] DRIVE goal=(0.13,4.59) dist=1.01m front=0.74m cells=15 rms=3.6cm[523] DRIVE goal=(0.13,4.59) dist=1.01m front=0.76m cells=15 rms=3.6cm[524] DRIVE goal=(0.13,4.59) dist=0.99m front=0.78m cells=15 rms=3.6cm[525] DRIVE goal=(0.13,4.59) dist=0.98m front=0.80m cells=16 rms=3.6cm[526] DRIVE goal=(0.13,4.59) dist=0.97m front=0.80m cells=16 rms=3.6cm[527] DRIVE goal=(0.13,4.59) dist=0.96m front=0.86m cells=16 rms=3.6cm[528] DRIVE goal=(0.13,4.59) dist=0.96m front=0.64m cells=16 rms=3.6cm[529] DRIVE goal=(0.13,4.59) dist=0.97m front=0.62m cells=16 rms=3.6cm[530] DRIVE goal=(0.13,4.59) dist=0.97m front=0.62m cells=16 rms=3.6cm[531] DRIVE goal=(0.13,4.59) dist=0.96m front=0.65m cells=16 rms=3.6cm[532] DRIVE goal=(0.13,4.59) dist=0.96m front=0.63m cells=16 rms=3.6cm[533] DRIVE goal=(0.13,4.59) dist=0.97m front=0.64m cells=16 rms=3.6cm[534] DRIVE goal=(0.13,4.59) dist=0.97m front=0.65m cells=16 rms=3.6cm[535] DRIVE goal=(0.13,4.59) dist=0.97m front=0.62m cells=16 rms=3.6cm[536] DRIVE goal=(0.13,4.59) dist=0.96m front=0.62m cells=16 rms=3.6cm[537] DRIVE goal=(0.13,4.59) dist=0.97m front=0.66m cells=16 rms=3.6cm[538] DRIVE goal=(0.13,4.59) dist=0.97m front=0.62m cells=16 rms=3.6cm[539] DRIVE goal=(0.13,4.59) dist=0.96m front=0.62m cells=16 rms=3.6cm[540] DRIVE goal=(0.13,4.59) dist=0.96m front=0.66m cells=16 rms=3.6cm[541] DRIVE goal=(0.13,4.59) dist=0.96m front=0.87m cells=16 rms=3.6cm[542] DRIVE goal=(0.13,4.59) dist=0.96m front=0.62m cells=16 rms=3.6cm[543] DRIVE goal=(0.13,4.59) dist=0.96m front=0.89m cells=16 rms=3.6cm[544] DRIVE goal=(0.13,4.59) dist=0.96m front=0.65m cells=16 rms=3.6cm
[132.5s] [DRIVE STUCK] Goal distance unchanged for 5.1s
[DRIVE STUCK] dist_oldest=1.01m, dist_now=0.96m, change=0.05m < margin=0.08m
[DRIVE STUCK] Front sectors: s55=0.90 s56=1.03 s57=1.33 s58=2.17 s59=1.97 s0=1.99 s1=2.70 s2=2.70 s3=2.74 s4=2.78 s5=0.64 
[DRIVE STUCK] Marked front sectors [55, 56, 57, 58, 59, 0, 1, 2, 3, 4, 5] as blocked for 30s

[BACKUP CLEAR] Reversing and turning toward clearer side...
[BACKUP CLEAR] Turning left (L_avg=2.31m R_avg=1.48m)


Stopping (Ctrl+C)...
[MARKER] Publisher stopped

=======================================================
NBV NAVIGATION COMPLETE
=======================================================
Final state: exploring
Duration: 136.5s
Iterations: 545
Goals reached: 9
Backups: 4
Unique cells visited: 16
Cells scanned by LiDAR: 264
Walls detected: 196

--- Drive Accuracy ---
Cross-track RMS error: 3.6cm
Total distance traveled: 5.73m
Ideal distance (sum of goals): 12.50m
Drive efficiency: 218.1%
Revisit rate: 100.0%

--- Map Accuracy Suggestions ---
To measure map accuracy, consider:
1. Ground truth comparison: Place markers at known positions,
   compare measured vs actual distances between them
2. Loop closure error: After returning to origin, check
   odometry drift (final_dist to origin should be ~0)
3. Feature alignment: Compare map walls to actual room layout
4. Consistency check: Run multiple times, overlay maps
5. Tape measure validation: Measure actual room dimensions,
   compare to map scale (resolution * pixels)
