[OUTPUT] Logging to: /home/ws/ugv_cont/mission/outputs/20251225_181529
[OUTPUT] Log file: /home/ws/ugv_cont/mission/outputs/20251225_181529/logs/navigation.log
=======================================================
NEXT-BEST-VIEW (NBV) NAVIGATION
=======================================================
Speed: 0.08 m/s
Goal distance: 0.5-2.0m
Press Ctrl+C to stop

[DEBUG] Marker publishing enabled - check /nav_goal in RViz
[MARKER] Persistent marker publisher started - add /nav_goal in RViz
[START] Initial position: (-0.01, -0.01)
[START] Origin wall signature: ['0.56', '0.60', '0.60', '0.60', '0.62', '0.64', '0.66', '0.69', '1.01', '0.91', '0.83', '0.63', '0.59', '0.56', '0.54', '0.52', '0.51', '0.53', '0.54', '0.54', '0.53', '0.63', '0.68', '5.00', '5.00', '5.00', '5.00', '5.00', '5.00', '5.00', '5.00', '5.00', '5.00', '5.00', '5.00', '5.00', '5.00', '5.00', '0.69', '0.73', '0.83', '2.00', '3.80', '3.76', '5.21', '1.81', '1.81', '1.32', '1.33', '1.36', '1.30', '1.24', '1.08', '0.96', '0.70', '0.65', '0.60', '0.57', '0.54', '0.54']
[MARKER] Origin marker (blue) started at (-0.01, -0.01) - add /nav_origin in RViz

[  2.4s] [GOAL SELECT] robot@(-0.01,-0.01) | 21 candidates (scanned=48 walls=21 visited=1):
  #1 ang= -58° d=0.50m pos=(0.24,-0.44) score=+37.2 [O=+1.8 U=+41.2 V=-3.0 W=-3.0 R=-0.0 F=+0.0] <-- BEST
  #2 ang= -52° d=0.50m pos=(0.28,-0.41) score=+37.1 [O=+1.7 U=+41.2 V=-3.0 W=-3.0 R=-0.0 F=+0.0]
  #3 ang= -94° d=1.50m pos=(-0.18,-1.50) score=+36.4 [O=+2.5 U=+34.4 V=-0.0 W=-1.0 R=-0.0 F=+0.0]
  #4 ang=-107° d=2.00m pos=(-0.65,-1.91) score=+36.1 [O=+2.5 U=+34.0 V=-0.0 W=-1.0 R=-0.0 F=+0.0]
  #5 ang= -64° d=0.50m pos=(0.19,-0.47) score=+35.2 [O=+1.9 U=+39.2 V=-3.0 W=-3.0 R=-0.0 F=+0.0]
  #6 ang= -82° d=1.00m pos=(0.09,-1.00) score=+33.1 [O=+1.8 U=+34.0 V=-0.0 W=-3.0 R=-0.0 F=+0.0]
  #7 ang= -88° d=1.00m pos=(-0.02,-1.01) score=+31.1 [O=+1.8 U=+32.0 V=-0.0 W=-3.0 R=-0.0 F=+0.0]
  #8 ang=-101° d=1.50m pos=(-0.34,-1.48) score=+31.0 [O=+2.5 U=+28.0 V=-0.0 W=-0.0 R=-0.0 F=+0.0]
[  2.4s] [GOAL] Selected: (0.24, -0.44) dist=0.50m timeout=28s angle=-58° reason=no goal
[  1] DRIVE goal=(0.24,-0.44) dist=0.50m front=0.54m cells=1 rms=0.0cm[  2] DRIVE goal=(0.24,-0.44) dist=0.50m front=0.54m cells=1 rms=0.1cm[  3] DRIVE goal=(0.24,-0.44) dist=0.50m front=0.54m cells=1 rms=0.1cm[  4] DRIVE goal=(0.24,-0.44) dist=0.50m front=0.54m cells=1 rms=0.1cm[  5] DRIVE goal=(0.24,-0.44) dist=0.50m front=0.54m cells=1 rms=0.1cm[  6] DRIVE goal=(0.24,-0.44) dist=0.50m front=0.54m cells=1 rms=0.1cm[  7] DRIVE goal=(0.24,-0.44) dist=0.50m front=0.54m cells=1 rms=0.1cm[  8] DRIVE goal=(0.24,-0.44) dist=0.50m front=0.54m cells=1 rms=0.1cm[  9] DRIVE goal=(0.24,-0.44) dist=0.50m front=0.54m cells=1 rms=0.1cm[ 10] DRIVE goal=(0.24,-0.44) dist=0.49m front=0.54m cells=1 rms=0.2cm[ 11] DRIVE goal=(0.24,-0.44) dist=0.50m front=0.54m cells=1 rms=0.2cm[ 12] DRIVE goal=(0.24,-0.44) dist=0.50m front=0.54m cells=1 rms=0.2cm[ 13] DRIVE goal=(0.24,-0.44) dist=0.49m front=0.53m cells=1 rms=0.2cm[ 14] DRIVE goal=(0.24,-0.44) dist=0.48m front=0.53m cells=1 rms=0.2cm[ 15] DRIVE goal=(0.24,-0.44) dist=0.48m front=0.53m cells=1 rms=0.3cm[ 16] DRIVE goal=(0.24,-0.44) dist=0.48m front=0.53m cells=1 rms=0.4cm[ 17] DRIVE goal=(0.24,-0.44) dist=0.47m front=0.52m cells=1 rms=0.4cm[ 18] DRIVE goal=(0.24,-0.44) dist=0.47m front=0.52m cells=1 rms=0.4cm[ 19] DRIVE goal=(0.24,-0.44) dist=0.47m front=0.52m cells=1 rms=0.5cm[ 20] DRIVE goal=(0.24,-0.44) dist=0.47m front=0.52m cells=1 rms=0.5cm[ 21] DRIVE goal=(0.24,-0.44) dist=0.47m front=0.52m cells=1 rms=0.6cm[ 22] DRIVE goal=(0.24,-0.44) dist=0.47m front=0.52m cells=1 rms=0.7cm[ 23] DRIVE goal=(0.24,-0.44) dist=0.46m front=0.52m cells=1 rms=0.8cm[ 24] DRIVE goal=(0.24,-0.44) dist=0.46m front=0.53m cells=1 rms=0.9cm[ 25] DRIVE goal=(0.24,-0.44) dist=0.46m front=0.53m cells=1 rms=1.0cm[ 26] DRIVE goal=(0.24,-0.44) dist=0.46m front=0.53m cells=1 rms=1.1cm[ 27] DRIVE goal=(0.24,-0.44) dist=0.45m front=0.52m cells=1 rms=1.3cm[ 28] DRIVE goal=(0.24,-0.44) dist=0.45m front=0.55m cells=1 rms=1.4cm[ 29] DRIVE goal=(0.24,-0.44) dist=0.44m front=0.55m cells=1 rms=1.5cm[ 30] DRIVE goal=(0.24,-0.44) dist=0.43m front=0.55m cells=1 rms=1.6cm[ 31] DRIVE goal=(0.24,-0.44) dist=0.40m front=0.54m cells=1 rms=1.7cm
[  9.0s] [GOAL SELECT] robot@(0.01,-0.12) | 21 candidates (scanned=57 walls=28 visited=1):
  #1 ang= -58° d=2.00m pos=(-0.62,-2.01) score=+33.5 [O=+1.9 U=+32.0 V=-0.0 W=-1.0 R=-0.0 F=+0.0] <-- BEST
  #2 ang= -52° d=1.50m pos=(-0.31,-1.58) score=+30.0 [O=+2.5 U=+28.0 V=-0.0 W=-1.0 R=-0.0 F=+0.0]
  #3 ang= -33° d=1.00m pos=(0.12,-1.11) score=+28.7 [O=+1.7 U=+34.2 V=-0.0 W=-3.0 R=-4.5 F=+0.0]
  #4 ang= -27° d=0.50m pos=(0.12,-0.61) score=+26.0 [O=+1.7 U=+36.1 V=-0.0 W=-3.0 R=-8.9 F=+0.0]
  #5 ang= -58° d=1.50m pos=(-0.46,-1.54) score=+25.8 [O=+2.4 U=+24.0 V=-0.0 W=-1.0 R=-0.0 F=+0.0]
  #6 ang= -39° d=1.00m pos=(0.01,-1.12) score=+24.7 [O=+1.7 U=+30.1 V=-0.0 W=-3.0 R=-4.5 F=+0.0]
  #7 ang= -70° d=1.00m pos=(-0.50,-0.98) score=+23.1 [O=+1.7 U=+22.1 V=-0.0 W=-1.0 R=-0.0 F=+0.0]
  #8 ang=  -9° d=0.50m pos=(0.27,-0.55) score=+22.6 [O=+1.8 U=+40.0 V=-3.0 W=-3.0 R=-13.4 F=+0.0]
[  9.0s] [GOAL] Selected: (-0.62, -2.01) dist=2.00m timeout=50s angle=-58° reason=reached
[ 32] DRIVE goal=(-0.62,-2.01) dist=2.00m front=0.53m cells=1 rms=1.7cm[ 33] DRIVE goal=(-0.62,-2.01) dist=1.99m front=0.50m cells=1 rms=1.7cm[ 34] DRIVE goal=(-0.62,-2.01) dist=1.98m front=0.50m cells=1 rms=1.8cm[ 35] DRIVE goal=(-0.62,-2.01) dist=1.97m front=0.53m cells=1 rms=1.8cm[ 36] DRIVE goal=(-0.62,-2.01) dist=1.96m front=0.55m cells=1 rms=1.9cm[ 37] DRIVE goal=(-0.62,-2.01) dist=1.96m front=0.59m cells=1 rms=2.0cm[ 38] DRIVE goal=(-0.62,-2.01) dist=1.94m front=0.82m cells=1 rms=2.0cm[ 39] DRIVE goal=(-0.62,-2.01) dist=1.94m front=0.90m cells=1 rms=2.0cm[ 40] DRIVE goal=(-0.62,-2.01) dist=1.94m front=0.96m cells=1 rms=2.0cm[ 41] DRIVE goal=(-0.62,-2.01) dist=1.94m front=1.09m cells=1 rms=2.0cm[ 42] DRIVE goal=(-0.62,-2.01) dist=1.94m front=1.09m cells=1 rms=2.0cm[ 43] DRIVE goal=(-0.62,-2.01) dist=1.94m front=1.09m cells=1 rms=2.0cm[ 44] DRIVE goal=(-0.62,-2.01) dist=1.93m front=1.09m cells=1 rms=2.0cm[ 45] DRIVE goal=(-0.62,-2.01) dist=1.94m front=1.10m cells=1 rms=2.0cm[ 46] DRIVE goal=(-0.62,-2.01) dist=1.94m front=1.11m cells=1 rms=1.9cm[ 47] DRIVE goal=(-0.62,-2.01) dist=1.94m front=1.17m cells=1 rms=1.9cm[ 48] DRIVE goal=(-0.62,-2.01) dist=1.94m front=1.21m cells=1 rms=1.9cm[ 49] DRIVE goal=(-0.62,-2.01) dist=1.94m front=1.22m cells=1 rms=1.9cm[ 50] DRIVE goal=(-0.62,-2.01) dist=1.94m front=1.19m cells=1 rms=1.9cm[ 51] DRIVE goal=(-0.62,-2.01) dist=1.94m front=1.21m cells=1 rms=1.9cm[ 52] DRIVE goal=(-0.62,-2.01) dist=1.94m front=1.21m cells=1 rms=1.9cm[ 53] DRIVE goal=(-0.62,-2.01) dist=1.93m front=1.17m cells=1 rms=1.8cm[ 54] DRIVE goal=(-0.62,-2.01) dist=1.93m front=1.20m cells=1 rms=1.8cm[ 55] DRIVE goal=(-0.62,-2.01) dist=1.92m front=1.20m cells=1 rms=1.8cm[ 56] DRIVE goal=(-0.62,-2.01) dist=1.92m front=1.19m cells=1 rms=1.8cm[ 57] DRIVE goal=(-0.62,-2.01) dist=1.91m front=1.18m cells=1 rms=1.8cm[ 58] DRIVE goal=(-0.62,-2.01) dist=1.91m front=1.18m cells=1 rms=1.8cm[ 59] DRIVE goal=(-0.62,-2.01) dist=1.91m front=1.17m cells=1 rms=1.8cm[ 60] DRIVE goal=(-0.62,-2.01) dist=1.90m front=1.17m cells=1 rms=1.7cm[ 61] DRIVE goal=(-0.62,-2.01) dist=1.88m front=1.15m cells=1 rms=1.7cm[ 62] DRIVE goal=(-0.62,-2.01) dist=1.88m front=0.73m cells=1 rms=1.7cm[ 63] DRIVE goal=(-0.62,-2.01) dist=1.87m front=0.69m cells=1 rms=1.7cm[ 64] DRIVE goal=(-0.62,-2.01) dist=1.86m front=0.68m cells=1 rms=1.7cm[ 65] DRIVE goal=(-0.62,-2.01) dist=1.84m front=0.66m cells=1 rms=1.7cm[ 66] DRIVE goal=(-0.62,-2.01) dist=1.83m front=0.66m cells=1 rms=1.7cm[ 67] DRIVE goal=(-0.62,-2.01) dist=1.81m front=0.64m cells=1 rms=1.7cm[ 68] DRIVE goal=(-0.62,-2.01) dist=1.79m front=0.64m cells=2 rms=1.7cm[ 69] DRIVE goal=(-0.62,-2.01) dist=1.77m front=0.63m cells=2 rms=1.7cm[ 70] DRIVE goal=(-0.62,-2.01) dist=1.75m front=0.62m cells=2 rms=1.7cm[ 71] DRIVE goal=(-0.62,-2.01) dist=1.73m front=0.62m cells=2 rms=1.7cm[ 72] DRIVE goal=(-0.62,-2.01) dist=1.71m front=1.00m cells=2 rms=1.7cm[ 73] DRIVE goal=(-0.62,-2.01) dist=1.69m front=0.98m cells=2 rms=1.7cm[ 74] DRIVE goal=(-0.62,-2.01) dist=1.68m front=0.97m cells=2 rms=1.6cm[ 75] DRIVE goal=(-0.62,-2.01) dist=1.66m front=0.95m cells=2 rms=1.6cm[ 76] DRIVE goal=(-0.62,-2.01) dist=1.64m front=0.95m cells=2 rms=1.6cm[ 77] DRIVE goal=(-0.62,-2.01) dist=1.62m front=1.25m cells=2 rms=1.6cm[ 78] DRIVE goal=(-0.62,-2.01) dist=1.59m front=1.25m cells=2 rms=1.6cm[ 79] DRIVE goal=(-0.62,-2.01) dist=1.58m front=1.24m cells=2 rms=1.6cm[ 80] DRIVE goal=(-0.62,-2.01) dist=1.55m front=1.23m cells=2 rms=1.6cm[ 81] DRIVE goal=(-0.62,-2.01) dist=1.53m front=1.22m cells=2 rms=1.6cm[ 82] DRIVE goal=(-0.62,-2.01) dist=1.52m front=1.22m cells=2 rms=1.6cm[ 83] DRIVE goal=(-0.62,-2.01) dist=1.50m front=1.21m cells=2 rms=1.6cm[ 84] DRIVE goal=(-0.62,-2.01) dist=1.49m front=1.20m cells=3 rms=1.5cm[ 85] DRIVE goal=(-0.62,-2.01) dist=1.48m front=1.21m cells=3 rms=1.5cm[ 86] DRIVE goal=(-0.62,-2.01) dist=1.46m front=1.19m cells=3 rms=1.5cm[ 87] DRIVE goal=(-0.62,-2.01) dist=1.44m front=1.19m cells=3 rms=1.5cm[ 88] DRIVE goal=(-0.62,-2.01) dist=1.42m front=1.18m cells=3 rms=1.5cm[ 89] DRIVE goal=(-0.62,-2.01) dist=1.39m front=1.15m cells=3 rms=1.5cm[ 90] DRIVE goal=(-0.62,-2.01) dist=1.37m front=1.14m cells=3 rms=1.5cm[ 91] DRIVE goal=(-0.62,-2.01) dist=1.36m front=1.13m cells=3 rms=1.5cm[ 92] DRIVE goal=(-0.62,-2.01) dist=1.34m front=1.10m cells=3 rms=1.5cm[ 93] DRIVE goal=(-0.62,-2.01) dist=1.32m front=1.08m cells=3 rms=1.5cm[ 94] DRIVE goal=(-0.62,-2.01) dist=1.30m front=1.06m cells=3 rms=1.5cm[ 95] DRIVE goal=(-0.62,-2.01) dist=1.28m front=1.04m cells=3 rms=1.5cm[ 96] DRIVE goal=(-0.62,-2.01) dist=1.27m front=1.03m cells=3 rms=1.5cm[ 97] DRIVE goal=(-0.62,-2.01) dist=1.24m front=1.01m cells=3 rms=1.5cm[ 98] DRIVE goal=(-0.62,-2.01) dist=1.22m front=0.99m cells=3 rms=1.5cm[ 99] DRIVE goal=(-0.62,-2.01) dist=1.20m front=0.96m cells=3 rms=1.5cm[100] DRIVE goal=(-0.62,-2.01) dist=1.18m front=0.94m cells=3 rms=1.5cm[101] DRIVE goal=(-0.62,-2.01) dist=1.17m front=0.94m cells=4 rms=1.5cm[102] DRIVE goal=(-0.62,-2.01) dist=1.15m front=0.92m cells=4 rms=1.5cm[103] DRIVE goal=(-0.62,-2.01) dist=1.12m front=0.89m cells=4 rms=1.5cm[104] DRIVE goal=(-0.62,-2.01) dist=1.10m front=0.87m cells=4 rms=1.5cm[105] DRIVE goal=(-0.62,-2.01) dist=1.08m front=0.85m cells=4 rms=1.5cm[106] DRIVE goal=(-0.62,-2.01) dist=1.07m front=0.83m cells=4 rms=1.5cm[107] DRIVE goal=(-0.62,-2.01) dist=1.06m front=0.82m cells=4 rms=1.5cm[108] DRIVE goal=(-0.62,-2.01) dist=1.03m front=0.80m cells=4 rms=1.5cm[109] DRIVE goal=(-0.62,-2.01) dist=1.01m front=0.79m cells=4 rms=1.5cm[110] DRIVE goal=(-0.62,-2.01) dist=0.99m front=0.77m cells=4 rms=1.5cm[111] DRIVE goal=(-0.62,-2.01) dist=0.98m front=0.75m cells=4 rms=1.5cm[112] DRIVE goal=(-0.62,-2.01) dist=0.95m front=0.73m cells=4 rms=1.5cm[113] DRIVE goal=(-0.62,-2.01) dist=0.93m front=0.70m cells=5 rms=1.5cm[114] DRIVE goal=(-0.62,-2.01) dist=0.91m front=0.69m cells=5 rms=1.5cm[115] DRIVE goal=(-0.62,-2.01) dist=0.89m front=0.67m cells=5 rms=1.6cm[116] DRIVE goal=(-0.62,-2.01) dist=0.87m front=0.65m cells=5 rms=1.6cm[117] DRIVE goal=(-0.62,-2.01) dist=0.85m front=0.64m cells=6 rms=1.6cm[118] DRIVE goal=(-0.62,-2.01) dist=0.83m front=0.62m cells=6 rms=1.6cm[119] DRIVE goal=(-0.62,-2.01) dist=0.82m front=0.61m cells=6 rms=1.6cm[120] DRIVE goal=(-0.62,-2.01) dist=0.81m front=0.59m cells=6 rms=1.6cm[121] DRIVE goal=(-0.62,-2.01) dist=0.79m front=0.59m cells=6 rms=1.6cm[122] DRIVE goal=(-0.62,-2.01) dist=0.77m front=0.58m cells=6 rms=1.6cm[123] DRIVE goal=(-0.62,-2.01) dist=0.75m front=0.55m cells=6 rms=1.6cm[124] DRIVE goal=(-0.62,-2.01) dist=0.73m front=0.88m cells=6 rms=1.7cm[125] DRIVE goal=(-0.62,-2.01) dist=0.70m front=0.61m cells=6 rms=1.7cm[126] DRIVE goal=(-0.62,-2.01) dist=0.68m front=0.87m cells=6 rms=1.7cm[127] DRIVE goal=(-0.62,-2.01) dist=0.66m front=0.85m cells=6 rms=1.7cm[128] DRIVE goal=(-0.62,-2.01) dist=0.64m front=0.85m cells=6 rms=1.7cm[129] DRIVE goal=(-0.62,-2.01) dist=0.62m front=0.88m cells=6 rms=1.7cm[130] DRIVE goal=(-0.62,-2.01) dist=0.60m front=0.87m cells=6 rms=1.7cm[131] DRIVE goal=(-0.62,-2.01) dist=0.58m front=1.27m cells=6 rms=1.7cm[132] DRIVE goal=(-0.62,-2.01) dist=0.56m front=1.23m cells=6 rms=1.7cm[133] DRIVE goal=(-0.62,-2.01) dist=0.56m front=1.24m cells=6 rms=1.7cm[134] DRIVE goal=(-0.62,-2.01) dist=0.54m front=1.24m cells=7 rms=1.7cm[135] DRIVE goal=(-0.62,-2.01) dist=0.51m front=1.23m cells=7 rms=1.7cm[136] DRIVE goal=(-0.62,-2.01) dist=0.49m front=1.23m cells=7 rms=1.8cm[137] DRIVE goal=(-0.62,-2.01) dist=0.48m front=1.23m cells=7 rms=1.8cm[138] DRIVE goal=(-0.62,-2.01) dist=0.46m front=1.21m cells=7 rms=1.8cm[139] DRIVE goal=(-0.62,-2.01) dist=0.44m front=1.21m cells=7 rms=1.8cm[140] DRIVE goal=(-0.62,-2.01) dist=0.41m front=1.18m cells=7 rms=1.8cm
[ 31.1s] [GOAL SELECT] robot@(-0.47,-1.65) | 18 candidates (scanned=98 walls=56 visited=7):
  #1 ang= +15° d=2.00m pos=(-0.56,-3.65) score=+55.3 [O=+2.5 U=+37.6 V=-0.0 W=-0.0 R=-0.0 F=+14.6] <-- BEST
  #2 ang=  -9° d=1.50m pos=(-1.16,-2.99) score=+54.0 [O=+1.9 U=+38.0 V=-0.0 W=-1.0 R=-0.0 F=+14.7]
  #3 ang= +15° d=1.50m pos=(-0.54,-3.15) score=+47.0 [O=+2.5 U=+30.4 V=-0.0 W=-1.0 R=-0.0 F=+14.6]
  #4 ang=  -9° d=1.00m pos=(-0.93,-2.54) score=+46.4 [O=+2.4 U=+30.0 V=-0.0 W=-1.0 R=-0.0 F=+14.7]
  #5 ang=  +9° d=1.50m pos=(-0.70,-3.14) score=+45.0 [O=+1.6 U=+28.0 V=-0.0 W=-0.0 R=-0.0 F=+14.9]
  #6 ang= +15° d=1.00m pos=(-0.52,-2.65) score=+36.5 [O=+2.5 U=+22.0 V=-0.0 W=-3.0 R=-0.0 F=+14.6]
  #7 ang=  +9° d=1.00m pos=(-0.62,-2.64) score=+36.1 [O=+2.1 U=+22.0 V=-0.0 W=-0.0 R=-3.2 F=+14.9]
  #8 ang= -33° d=0.50m pos=(-0.86,-1.96) score=+30.5 [O=+1.6 U=+30.1 V=-3.0 W=-1.0 R=-9.5 F=+12.1]
[ 31.1s] [GOAL] Selected: (-0.56, -3.65) dist=2.00m timeout=50s angle=15° reason=reached
[141] DRIVE goal=(-0.56,-3.65) dist=2.00m front=1.17m cells=7 rms=1.8cm[142] DRIVE goal=(-0.56,-3.65) dist=1.97m front=1.15m cells=7 rms=1.8cm[143] DRIVE goal=(-0.56,-3.65) dist=1.96m front=1.17m cells=7 rms=1.8cm[144] DRIVE goal=(-0.56,-3.65) dist=1.94m front=1.11m cells=7 rms=1.8cm[145] DRIVE goal=(-0.56,-3.65) dist=1.93m front=1.18m cells=7 rms=1.8cm[146] DRIVE goal=(-0.56,-3.65) dist=1.93m front=1.10m cells=7 rms=1.8cm[147] DRIVE goal=(-0.56,-3.65) dist=1.93m front=1.09m cells=7 rms=1.8cm[148] DRIVE goal=(-0.56,-3.65) dist=1.92m front=1.09m cells=7 rms=1.8cm[149] DRIVE goal=(-0.56,-3.65) dist=1.91m front=1.08m cells=7 rms=1.8cm[150] DRIVE goal=(-0.56,-3.65) dist=1.89m front=1.06m cells=7 rms=1.8cm[151] DRIVE goal=(-0.56,-3.65) dist=1.87m front=1.04m cells=7 rms=1.8cm[152] DRIVE goal=(-0.56,-3.65) dist=1.85m front=0.96m cells=7 rms=1.7cm[153] DRIVE goal=(-0.56,-3.65) dist=1.83m front=1.01m cells=8 rms=1.7cm[154] DRIVE goal=(-0.56,-3.65) dist=1.81m front=0.99m cells=8 rms=1.7cm[155] DRIVE goal=(-0.56,-3.65) dist=1.79m front=0.97m cells=8 rms=1.7cm[156] DRIVE goal=(-0.56,-3.65) dist=1.77m front=0.95m cells=8 rms=1.7cm[157] DRIVE goal=(-0.56,-3.65) dist=1.75m front=0.93m cells=8 rms=1.7cm[158] DRIVE goal=(-0.56,-3.65) dist=1.72m front=0.90m cells=8 rms=1.7cm[159] DRIVE goal=(-0.56,-3.65) dist=1.72m front=0.89m cells=8 rms=1.7cm[160] DRIVE goal=(-0.56,-3.65) dist=1.69m front=0.87m cells=8 rms=1.7cm[161] DRIVE goal=(-0.56,-3.65) dist=1.66m front=0.85m cells=8 rms=1.7cm[162] DRIVE goal=(-0.56,-3.65) dist=1.66m front=0.84m cells=8 rms=1.7cm[163] DRIVE goal=(-0.56,-3.65) dist=1.63m front=0.82m cells=8 rms=1.7cm[164] DRIVE goal=(-0.56,-3.65) dist=1.61m front=0.79m cells=8 rms=1.8cm[165] DRIVE goal=(-0.56,-3.65) dist=1.60m front=0.78m cells=8 rms=1.8cm[166] DRIVE goal=(-0.56,-3.65) dist=1.58m front=0.76m cells=8 rms=1.8cm[167] DRIVE goal=(-0.56,-3.65) dist=1.55m front=0.73m cells=9 rms=1.8cm[168] DRIVE goal=(-0.56,-3.65) dist=1.53m front=0.72m cells=9 rms=1.8cm[169] DRIVE goal=(-0.56,-3.65) dist=1.53m front=0.70m cells=9 rms=1.8cm[170] DRIVE goal=(-0.56,-3.65) dist=1.50m front=0.68m cells=9 rms=1.8cm[171] DRIVE goal=(-0.56,-3.65) dist=1.48m front=0.67m cells=9 rms=1.8cm[172] DRIVE goal=(-0.56,-3.65) dist=1.46m front=0.65m cells=9 rms=1.8cm[173] DRIVE goal=(-0.56,-3.65) dist=1.44m front=0.63m cells=9 rms=1.8cm[174] DRIVE goal=(-0.56,-3.65) dist=1.43m front=0.61m cells=9 rms=1.8cm[175] DRIVE goal=(-0.56,-3.65) dist=1.41m front=0.59m cells=9 rms=1.8cm[176] DRIVE goal=(-0.56,-3.65) dist=1.41m front=0.59m cells=9 rms=1.8cm[177] DRIVE goal=(-0.56,-3.65) dist=1.39m front=0.57m cells=9 rms=1.8cm[178] DRIVE goal=(-0.56,-3.65) dist=1.37m front=0.56m cells=9 rms=1.8cm[179] DRIVE goal=(-0.56,-3.65) dist=1.35m front=0.53m cells=9 rms=1.8cm[180] DRIVE goal=(-0.56,-3.65) dist=1.33m front=0.51m cells=9 rms=1.8cm[181] DRIVE goal=(-0.56,-3.65) dist=1.31m front=0.55m cells=9 rms=1.8cm[182] DRIVE goal=(-0.56,-3.65) dist=1.29m front=0.53m cells=9 rms=1.9cm[183] DRIVE goal=(-0.56,-3.65) dist=1.27m front=0.57m cells=9 rms=1.9cm[184] DRIVE goal=(-0.56,-3.65) dist=1.25m front=0.63m cells=9 rms=1.9cm[185] DRIVE goal=(-0.56,-3.65) dist=1.23m front=0.59m cells=10 rms=1.9cm[186] DRIVE goal=(-0.56,-3.65) dist=1.21m front=0.64m cells=10 rms=1.9cm[187] DRIVE goal=(-0.56,-3.65) dist=1.19m front=0.63m cells=10 rms=1.9cm[188] DRIVE goal=(-0.56,-3.65) dist=1.17m front=0.58m cells=10 rms=1.9cm[189] DRIVE goal=(-0.56,-3.65) dist=1.17m front=0.60m cells=10 rms=1.9cm[190] DRIVE goal=(-0.56,-3.65) dist=1.15m front=0.55m cells=10 rms=1.9cm[191] DRIVE goal=(-0.56,-3.65) dist=1.13m front=0.53m cells=10 rms=1.9cm[192] DRIVE goal=(-0.56,-3.65) dist=1.11m front=0.55m cells=10 rms=2.0cm[193] DRIVE goal=(-0.56,-3.65) dist=1.08m front=0.54m cells=10 rms=2.0cm[194] DRIVE goal=(-0.56,-3.65) dist=1.06m front=0.59m cells=10 rms=2.0cm[195] DRIVE goal=(-0.56,-3.65) dist=1.05m front=0.53m cells=10 rms=2.0cm[196] DRIVE goal=(-0.56,-3.65) dist=1.02m front=0.58m cells=10 rms=2.0cm[197] DRIVE goal=(-0.56,-3.65) dist=1.01m front=0.59m cells=10 rms=2.0cm[198] DRIVE goal=(-0.56,-3.65) dist=0.97m front=0.59m cells=10 rms=2.0cm[199] DRIVE goal=(-0.56,-3.65) dist=0.96m front=0.69m cells=10 rms=2.0cm[200] DRIVE goal=(-0.56,-3.65) dist=0.93m front=0.78m cells=11 rms=2.0cm[201] DRIVE goal=(-0.56,-3.65) dist=0.90m front=0.64m cells=11 rms=2.0cm[202] DRIVE goal=(-0.56,-3.65) dist=0.88m front=0.79m cells=11 rms=2.0cm[203] DRIVE goal=(-0.56,-3.65) dist=0.85m front=0.68m cells=11 rms=2.1cm[204] DRIVE goal=(-0.56,-3.65) dist=0.82m front=0.64m cells=11 rms=2.1cm[205] DRIVE goal=(-0.56,-3.65) dist=0.81m front=0.68m cells=11 rms=2.1cm[206] DRIVE goal=(-0.56,-3.65) dist=0.79m front=0.45m cells=11 rms=2.1cm[207] DRIVE goal=(-0.56,-3.65) dist=0.76m front=0.51m cells=11 rms=2.1cm[208] DRIVE goal=(-0.56,-3.65) dist=0.73m front=0.48m cells=11 rms=2.1cm[209] DRIVE goal=(-0.56,-3.65) dist=0.72m front=0.52m cells=11 rms=2.1cm[210] DRIVE goal=(-0.56,-3.65) dist=0.71m front=0.54m cells=11 rms=2.1cm[211] DRIVE goal=(-0.56,-3.65) dist=0.69m front=0.48m cells=11 rms=2.1cm[212] DRIVE goal=(-0.56,-3.65) dist=0.66m front=0.47m cells=11 rms=2.1cm[213] DRIVE goal=(-0.56,-3.65) dist=0.65m front=0.49m cells=11 rms=2.1cm[214] DRIVE goal=(-0.56,-3.65) dist=0.63m front=0.50m cells=12 rms=2.1cm[215] DRIVE goal=(-0.56,-3.65) dist=0.60m front=0.56m cells=12 rms=2.1cm[216] DRIVE goal=(-0.56,-3.65) dist=0.57m front=0.62m cells=12 rms=2.1cm[217] DRIVE goal=(-0.56,-3.65) dist=0.57m front=0.59m cells=12 rms=2.1cm[218] DRIVE goal=(-0.56,-3.65) dist=0.54m front=0.49m cells=12 rms=2.1cm[219] DRIVE goal=(-0.56,-3.65) dist=0.53m front=0.50m cells=12 rms=2.1cm[220] DRIVE goal=(-0.56,-3.65) dist=0.52m front=0.55m cells=12 rms=2.1cm[221] DRIVE goal=(-0.56,-3.65) dist=0.50m front=0.81m cells=12 rms=2.1cm[222] DRIVE goal=(-0.56,-3.65) dist=0.49m front=0.82m cells=12 rms=2.1cm[223] DRIVE goal=(-0.56,-3.65) dist=0.47m front=0.83m cells=12 rms=2.1cm[224] DRIVE goal=(-0.56,-3.65) dist=0.45m front=0.82m cells=12 rms=2.1cm[225] DRIVE goal=(-0.56,-3.65) dist=0.42m front=0.74m cells=12 rms=2.1cm[226] DRIVE goal=(-0.56,-3.65) dist=0.41m front=0.72m cells=12 rms=2.1cm
[ 48.7s] [GOAL SELECT] robot@(-0.58,-3.27) | 24 candidates (scanned=156 walls=81 visited=12):
  #1 ang= +15° d=2.00m pos=(-0.24,-5.24) score=+56.4 [O=+2.1 U=+39.6 V=-0.0 W=-0.0 R=-0.0 F=+14.1] <-- BEST
  #2 ang= +15° d=1.50m pos=(-0.32,-4.75) score=+46.1 [O=+2.5 U=+30.0 V=-0.0 W=-1.0 R=-0.0 F=+14.1]
  #3 ang=  +3° d=1.50m pos=(-0.64,-4.77) score=+40.0 [O=+1.6 U=+26.0 V=-0.0 W=-3.0 R=-0.0 F=+14.9]
  #4 ang=  +9° d=1.50m pos=(-0.48,-4.77) score=+39.7 [O=+1.7 U=+24.0 V=-0.0 W=-1.0 R=-0.0 F=+14.6]
  #5 ang= -88° d=2.00m pos=(-2.58,-3.13) score=+38.6 [O=+2.5 U=+34.0 V=-0.0 W=-0.0 R=-0.0 F=+1.5]
  #6 ang= -82° d=2.00m pos=(-2.58,-3.34) score=+37.2 [O=+2.4 U=+32.0 V=-0.0 W=-1.0 R=-0.0 F=+3.1]
  #7 ang= -94° d=2.00m pos=(-2.55,-2.92) score=+36.1 [O=+1.5 U=+34.1 V=-0.0 W=-0.0 R=-0.0 F=-0.1]
  #8 ang=  +3° d=1.00m pos=(-0.62,-4.27) score=+32.3 [O=+2.1 U=+18.0 V=-0.0 W=-3.0 R=-0.0 F=+14.9]
[ 48.7s] [GOAL] Selected: (-0.24, -5.24) dist=2.00m timeout=50s angle=15° reason=reached
[227] DRIVE goal=(-0.24,-5.24) dist=2.00m front=0.78m cells=12 rms=2.1cm[228] DRIVE goal=(-0.24,-5.24) dist=1.99m front=0.77m cells=12 rms=2.1cm[229] DRIVE goal=(-0.24,-5.24) dist=1.98m front=0.69m cells=12 rms=2.1cm[230] DRIVE goal=(-0.24,-5.24) dist=1.97m front=0.68m cells=13 rms=2.1cm[231] DRIVE goal=(-0.24,-5.24) dist=1.96m front=0.66m cells=13 rms=2.1cm[232] DRIVE goal=(-0.24,-5.24) dist=1.96m front=0.67m cells=13 rms=2.1cm[233] DRIVE goal=(-0.24,-5.24) dist=1.96m front=0.73m cells=13 rms=2.1cm[234] DRIVE goal=(-0.24,-5.24) dist=1.95m front=0.73m cells=13 rms=2.1cm[235] DRIVE goal=(-0.24,-5.24) dist=1.94m front=0.75m cells=13 rms=2.1cm[236] DRIVE goal=(-0.24,-5.24) dist=1.94m front=0.75m cells=13 rms=2.1cm[237] DRIVE goal=(-0.24,-5.24) dist=1.93m front=0.78m cells=13 rms=2.1cm[238] DRIVE goal=(-0.24,-5.24) dist=1.93m front=0.80m cells=13 rms=2.1cm[239] DRIVE goal=(-0.24,-5.24) dist=1.92m front=0.81m cells=13 rms=2.1cm[240] DRIVE goal=(-0.24,-5.24) dist=1.91m front=0.76m cells=13 rms=2.1cm[241] DRIVE goal=(-0.24,-5.24) dist=1.90m front=0.77m cells=13 rms=2.1cm[242] DRIVE goal=(-0.24,-5.24) dist=1.89m front=0.74m cells=13 rms=2.1cm[243] DRIVE goal=(-0.24,-5.24) dist=1.89m front=0.69m cells=13 rms=2.1cm[244] DRIVE goal=(-0.24,-5.24) dist=1.88m front=0.69m cells=13 rms=2.1cm[245] DRIVE goal=(-0.24,-5.24) dist=1.87m front=0.68m cells=13 rms=2.1cm[246] DRIVE goal=(-0.24,-5.24) dist=1.85m front=0.67m cells=13 rms=2.1cm[247] DRIVE goal=(-0.24,-5.24) dist=1.83m front=0.68m cells=13 rms=2.1cm[248] DRIVE goal=(-0.24,-5.24) dist=1.81m front=0.67m cells=13 rms=2.1cm[249] DRIVE goal=(-0.24,-5.24) dist=1.79m front=0.68m cells=13 rms=2.1cm[250] DRIVE goal=(-0.24,-5.24) dist=1.77m front=0.68m cells=13 rms=2.1cm[251] DRIVE goal=(-0.24,-5.24) dist=1.74m front=0.67m cells=13 rms=2.1cm[252] DRIVE goal=(-0.24,-5.24) dist=1.72m front=0.62m cells=13 rms=2.1cm[253] DRIVE goal=(-0.24,-5.24) dist=1.70m front=0.62m cells=13 rms=2.1cm[254] DRIVE goal=(-0.24,-5.24) dist=1.69m front=0.58m cells=13 rms=2.1cm[255] DRIVE goal=(-0.24,-5.24) dist=1.67m front=0.59m cells=14 rms=2.1cm[256] DRIVE goal=(-0.24,-5.24) dist=1.65m front=0.57m cells=14 rms=2.1cm[257] DRIVE goal=(-0.24,-5.24) dist=1.64m front=0.60m cells=14 rms=2.1cm[258] DRIVE goal=(-0.24,-5.24) dist=1.64m front=0.64m cells=14 rms=2.1cm[259] DRIVE goal=(-0.24,-5.24) dist=1.63m front=0.86m cells=14 rms=2.1cm[260] DRIVE goal=(-0.24,-5.24) dist=1.64m front=0.86m cells=14 rms=2.2cm[261] DRIVE goal=(-0.24,-5.24) dist=1.63m front=0.84m cells=14 rms=2.2cm[262] DRIVE goal=(-0.24,-5.24) dist=1.63m front=0.84m cells=14 rms=2.2cm[263] DRIVE goal=(-0.24,-5.24) dist=1.63m front=0.86m cells=14 rms=2.2cm[264] DRIVE goal=(-0.24,-5.24) dist=1.63m front=0.84m cells=14 rms=2.2cm[265] DRIVE goal=(-0.24,-5.24) dist=1.63m front=0.84m cells=14 rms=2.2cm[266] DRIVE goal=(-0.24,-5.24) dist=1.64m front=0.67m cells=14 rms=2.3cm[267] DRIVE goal=(-0.24,-5.24) dist=1.63m front=0.83m cells=14 rms=2.3cm[268] DRIVE goal=(-0.24,-5.24) dist=1.64m front=0.86m cells=14 rms=2.3cm[269] DRIVE goal=(-0.24,-5.24) dist=1.63m front=0.85m cells=14 rms=2.3cm[270] DRIVE goal=(-0.24,-5.24) dist=1.63m front=0.85m cells=14 rms=2.3cm[271] DRIVE goal=(-0.24,-5.24) dist=1.63m front=0.85m cells=14 rms=2.3cm[272] DRIVE goal=(-0.24,-5.24) dist=1.64m front=0.84m cells=14 rms=2.4cm[273] DRIVE goal=(-0.24,-5.24) dist=1.64m front=0.84m cells=14 rms=2.4cm[274] DRIVE goal=(-0.24,-5.24) dist=1.64m front=0.84m cells=14 rms=2.4cm[275] DRIVE goal=(-0.24,-5.24) dist=1.63m front=0.85m cells=14 rms=2.4cm[276] DRIVE goal=(-0.24,-5.24) dist=1.63m front=0.84m cells=14 rms=2.4cm[277] DRIVE goal=(-0.24,-5.24) dist=1.63m front=0.84m cells=14 rms=2.4cm[278] DRIVE goal=(-0.24,-5.24) dist=1.63m front=0.84m cells=14 rms=2.4cm[279] DRIVE goal=(-0.24,-5.24) dist=1.63m front=0.83m cells=14 rms=2.5cm[280] DRIVE goal=(-0.24,-5.24) dist=1.63m front=0.85m cells=14 rms=2.5cm[281] DRIVE goal=(-0.24,-5.24) dist=1.63m front=0.84m cells=14 rms=2.5cm[282] DRIVE goal=(-0.24,-5.24) dist=1.63m front=0.85m cells=14 rms=2.5cm[283] DRIVE goal=(-0.24,-5.24) dist=1.63m front=0.84m cells=14 rms=2.5cm[284] DRIVE goal=(-0.24,-5.24) dist=1.63m front=0.83m cells=14 rms=2.5cm[285] DRIVE goal=(-0.24,-5.24) dist=1.63m front=0.84m cells=14 rms=2.5cm[286] DRIVE goal=(-0.24,-5.24) dist=1.63m front=0.84m cells=14 rms=2.6cm[287] DRIVE goal=(-0.24,-5.24) dist=1.63m front=0.85m cells=14 rms=2.6cm
[ 61.1s] [DRIVE STUCK] Goal distance unchanged for 7.0s
[DRIVE STUCK] dist_oldest=1.70m, dist_now=1.63m, change=0.07m < margin=0.08m
[DRIVE STUCK] Front sectors: s55=0.84 s56=0.96 s57=1.13 s58=2.17 s59=1.94 s0=1.96 s1=2.70 s2=2.70 s3=2.74 s4=2.78 s5=2.85 
[DRIVE STUCK] Marked front sectors [55, 56, 57, 58, 59, 0, 1, 2, 3, 4, 5] as blocked for 30s

[BACKUP CLEAR] Reversing and turning toward clearer side...
[BACKUP CLEAR] Turning left (L_avg=2.76m R_avg=1.41m)

[ 65.9s] [GOAL SELECT] robot@(-0.52,-3.53) | 11 candidates (scanned=175 walls=95 visited=14):
  #1 ang= -45° d=1.00m pos=(-0.70,-4.51) score=+32.6 [O=+1.7 U=+18.6 V=-0.0 W=-3.0 R=-0.0 F=+15.0] <-- BEST
  #2 ang= -58° d=0.50m pos=(-0.71,-3.99) score=+29.4 [O=+1.5 U=+20.8 V=-2.6 W=-3.0 R=-2.1 F=+14.5]
  #3 ang= -52° d=0.50m pos=(-0.66,-4.01) score=+23.8 [O=+1.7 U=+14.8 V=-2.6 W=-3.0 R=-2.1 F=+14.8]
  #4 ang= -45° d=0.50m pos=(-0.61,-4.02) score=+20.5 [O=+2.2 U=+10.8 V=-2.6 W=-3.0 R=-2.1 F=+15.0]
  #5 ang= -39° d=1.00m pos=(-0.59,-4.53) score=+7.4 [O=+1.9 U=+16.3 V=-0.0 W=-1.0 R=-0.0 F=+15.0 B=-25.0]
  #6 ang= -33° d=1.00m pos=(-0.48,-4.53) score=-17.8 [O=+2.0 U=+16.2 V=-0.0 W=-1.0 R=-0.0 F=+14.8 B=-50.0]
  #7 ang= -27° d=2.00m pos=(-0.23,-5.51) score=-57.0 [O=+1.8 U=+33.3 V=-0.0 W=-0.0 R=-7.1 F=+14.4 B=-100.0]
  #8 ang= -27° d=1.50m pos=(-0.31,-5.01) score=-62.3 [O=+2.3 U=+24.1 V=-0.0 W=-0.0 R=-3.6 F=+14.4 B=-100.0]
[ 65.9s] [GOAL] Selected: (-0.70, -4.51) dist=1.00m timeout=35s angle=-45° reason=no goal
[289] DRIVE goal=(-0.70,-4.51) dist=1.00m front=0.28m cells=14 rms=2.6cm[290] DRIVE goal=(-0.70,-4.51) dist=1.00m front=0.28m cells=14 rms=2.6cm[291] DRIVE goal=(-0.70,-4.51) dist=1.00m front=0.28m cells=14 rms=2.6cm[292] DRIVE goal=(-0.70,-4.51) dist=1.00m front=0.28m cells=14 rms=2.6cm[293] DRIVE goal=(-0.70,-4.51) dist=1.00m front=0.29m cells=14 rms=2.5cm[294] DRIVE goal=(-0.70,-4.51) dist=1.00m front=0.30m cells=14 rms=2.5cm[295] DRIVE goal=(-0.70,-4.51) dist=1.00m front=0.30m cells=14 rms=2.5cm[296] DRIVE goal=(-0.70,-4.51) dist=1.00m front=0.32m cells=14 rms=2.5cm[297] DRIVE goal=(-0.70,-4.51) dist=1.00m front=0.32m cells=14 rms=2.5cm[298] DRIVE goal=(-0.70,-4.51) dist=1.01m front=0.31m cells=14 rms=2.5cm[299] DRIVE goal=(-0.70,-4.51) dist=1.02m front=0.33m cells=14 rms=2.5cm[300] DRIVE goal=(-0.70,-4.51) dist=1.02m front=0.49m cells=14 rms=2.6cm[301] DRIVE goal=(-0.70,-4.51) dist=1.03m front=0.52m cells=14 rms=2.6cm[302] DRIVE goal=(-0.70,-4.51) dist=1.03m front=0.56m cells=14 rms=2.6cm[303] DRIVE goal=(-0.70,-4.51) dist=1.03m front=0.58m cells=14 rms=2.6cm[304] DRIVE goal=(-0.70,-4.51) dist=1.03m front=0.58m cells=14 rms=2.6cm[305] DRIVE goal=(-0.70,-4.51) dist=1.03m front=0.61m cells=14 rms=2.7cm[306] DRIVE goal=(-0.70,-4.51) dist=1.02m front=0.59m cells=14 rms=2.7cm[307] DRIVE goal=(-0.70,-4.51) dist=1.02m front=0.58m cells=14 rms=2.7cm[308] DRIVE goal=(-0.70,-4.51) dist=1.01m front=0.61m cells=14 rms=2.7cm[309] DRIVE goal=(-0.70,-4.51) dist=1.00m front=0.64m cells=14 rms=2.7cm[310] DRIVE goal=(-0.70,-4.51) dist=1.00m front=0.69m cells=14 rms=2.8cm[311] DRIVE goal=(-0.70,-4.51) dist=0.99m front=0.70m cells=14 rms=2.8cm[312] DRIVE goal=(-0.70,-4.51) dist=0.97m front=0.73m cells=14 rms=2.8cm[313] DRIVE goal=(-0.70,-4.51) dist=0.97m front=0.72m cells=14 rms=2.8cm[314] DRIVE goal=(-0.70,-4.51) dist=0.96m front=0.72m cells=14 rms=2.8cm[315] DRIVE goal=(-0.70,-4.51) dist=0.95m front=0.69m cells=14 rms=2.8cm[316] DRIVE goal=(-0.70,-4.51) dist=0.93m front=0.62m cells=14 rms=2.8cm[317] DRIVE goal=(-0.70,-4.51) dist=0.91m front=0.66m cells=14 rms=2.8cm[318] DRIVE goal=(-0.70,-4.51) dist=0.90m front=0.81m cells=14 rms=2.9cm[319] DRIVE goal=(-0.70,-4.51) dist=0.89m front=0.79m cells=14 rms=2.9cm[320] DRIVE goal=(-0.70,-4.51) dist=0.89m front=0.82m cells=14 rms=2.9cm[321] DRIVE goal=(-0.70,-4.51) dist=0.89m front=0.82m cells=14 rms=2.9cm[322] DRIVE goal=(-0.70,-4.51) dist=0.89m front=0.83m cells=14 rms=2.9cm[323] DRIVE goal=(-0.70,-4.51) dist=0.89m front=0.83m cells=14 rms=2.9cm[324] DRIVE goal=(-0.70,-4.51) dist=0.89m front=0.81m cells=14 rms=2.9cm[325] DRIVE goal=(-0.70,-4.51) dist=0.89m front=0.82m cells=14 rms=2.9cm[326] DRIVE goal=(-0.70,-4.51) dist=0.89m front=0.84m cells=14 rms=2.9cm[327] DRIVE goal=(-0.70,-4.51) dist=0.89m front=0.81m cells=14 rms=2.9cm[328] DRIVE goal=(-0.70,-4.51) dist=0.89m front=0.81m cells=14 rms=2.9cm[329] DRIVE goal=(-0.70,-4.51) dist=0.89m front=0.82m cells=14 rms=2.9cm[330] DRIVE goal=(-0.70,-4.51) dist=0.89m front=0.80m cells=14 rms=2.9cm[331] DRIVE goal=(-0.70,-4.51) dist=0.89m front=0.81m cells=14 rms=2.9cm[332] DRIVE goal=(-0.70,-4.51) dist=0.89m front=0.81m cells=14 rms=3.0cm[333] DRIVE goal=(-0.70,-4.51) dist=0.89m front=0.82m cells=14 rms=3.0cm[334] DRIVE goal=(-0.70,-4.51) dist=0.90m front=0.81m cells=14 rms=3.0cm[335] DRIVE goal=(-0.70,-4.51) dist=0.89m front=0.81m cells=14 rms=3.0cm[336] DRIVE goal=(-0.70,-4.51) dist=0.89m front=0.82m cells=14 rms=3.0cm[337] DRIVE goal=(-0.70,-4.51) dist=0.90m front=0.83m cells=14 rms=3.0cm[338] DRIVE goal=(-0.70,-4.51) dist=0.89m front=0.81m cells=14 rms=3.0cm[339] DRIVE goal=(-0.70,-4.51) dist=0.89m front=0.81m cells=14 rms=3.0cm[340] DRIVE goal=(-0.70,-4.51) dist=0.90m front=0.82m cells=14 rms=3.0cm[341] DRIVE goal=(-0.70,-4.51) dist=0.90m front=0.82m cells=14 rms=3.0cm[342] DRIVE goal=(-0.70,-4.51) dist=0.90m front=0.82m cells=14 rms=3.0cm[343] DRIVE goal=(-0.70,-4.51) dist=0.90m front=0.81m cells=14 rms=3.0cm[344] DRIVE goal=(-0.70,-4.51) dist=0.89m front=0.79m cells=14 rms=3.1cm[345] DRIVE goal=(-0.70,-4.51) dist=0.89m front=0.80m cells=14 rms=3.1cm[346] DRIVE goal=(-0.70,-4.51) dist=0.89m front=0.80m cells=14 rms=3.1cm
[ 77.7s] [DRIVE STUCK] Goal distance unchanged for 7.0s
[DRIVE STUCK] dist_oldest=0.97m, dist_now=0.89m, change=0.08m < margin=0.08m
[DRIVE STUCK] Front sectors: s55=0.82 s56=0.93 s57=1.10 s58=1.58 s59=1.97 s0=2.71 s1=2.70 s2=2.71 s3=2.75 s4=2.79 s5=2.87 
[DRIVE STUCK] Marked front sectors [55, 56, 57, 58, 59, 0, 1, 2, 3, 4, 5] as blocked for 30s

[BACKUP CLEAR] Reversing and turning toward clearer side...
[BACKUP CLEAR] Turning left (L_avg=2.76m R_avg=1.28m)

[ 82.5s] [GOAL SELECT] robot@(-0.56,-3.50) | 13 candidates (scanned=176 walls=97 visited=14):
  #1 ang=-113° d=2.00m pos=(-2.55,-3.32) score=+36.1 [O=+2.5 U=+33.1 V=-0.0 W=-1.0 R=-0.0 F=+0.9] <-- BEST
  #2 ang=-119° d=2.00m pos=(-2.52,-3.11) score=+34.4 [O=+2.5 U=+32.0 V=-0.0 W=-0.0 R=-0.0 F=-0.7]
  #3 ang=-125° d=2.00m pos=(-2.47,-2.90) score=+31.0 [O=+1.6 U=+32.1 V=-0.0 W=-1.0 R=-0.0 F=-2.3]
  #4 ang=-119° d=1.50m pos=(-2.03,-3.20) score=+25.3 [O=+2.5 U=+24.0 V=-0.0 W=-1.0 R=-0.0 F=-0.7]
  #5 ang=-125° d=1.50m pos=(-1.99,-3.05) score=+23.4 [O=+2.1 U=+24.1 V=-0.0 W=-1.0 R=-0.0 F=-2.3]
  #6 ang=-125° d=1.00m pos=(-1.51,-3.20) score=+13.7 [O=+2.5 U=+16.2 V=-0.0 W=-3.0 R=-0.0 F=-2.3]
  #7 ang= -33° d=0.50m pos=(-0.69,-3.98) score=-28.8 [O=+1.7 U=+14.4 V=-2.6 W=-3.0 R=-4.3 F=+14.9 B=-50.0]
  #8 ang= -27° d=1.00m pos=(-0.73,-4.49) score=-75.2 [O=+1.6 U=+18.1 V=-0.0 W=-3.0 R=-7.2 F=+15.0 B=-100.0]
[ 82.5s] [GOAL] Selected: (-2.55, -3.32) dist=2.00m timeout=50s angle=-113° reason=no goal
[348] DRIVE goal=(-2.55,-3.32) dist=2.00m front=0.44m cells=14 rms=3.1cm[349] DRIVE goal=(-2.55,-3.32) dist=2.00m front=0.43m cells=14 rms=3.1cm[350] DRIVE goal=(-2.55,-3.32) dist=2.00m front=0.42m cells=14 rms=3.1cm[351] DRIVE goal=(-2.55,-3.32) dist=2.00m front=0.42m cells=14 rms=3.0cm[352] DRIVE goal=(-2.55,-3.32) dist=2.00m front=0.42m cells=14 rms=3.0cm[353] DRIVE goal=(-2.55,-3.32) dist=2.00m front=0.45m cells=14 rms=3.0cm[354] DRIVE goal=(-2.55,-3.32) dist=2.00m front=0.51m cells=14 rms=3.0cm[355] DRIVE goal=(-2.55,-3.32) dist=2.00m front=0.53m cells=14 rms=3.0cm[356] DRIVE goal=(-2.55,-3.32) dist=1.99m front=0.59m cells=14 rms=3.0cm[357] DRIVE goal=(-2.55,-3.32) dist=1.99m front=0.61m cells=14 rms=3.0cm[358] DRIVE goal=(-2.55,-3.32) dist=1.99m front=0.63m cells=14 rms=3.0cm[359] DRIVE goal=(-2.55,-3.32) dist=1.98m front=0.72m cells=14 rms=3.0cm[360] DRIVE goal=(-2.55,-3.32) dist=1.97m front=0.75m cells=14 rms=3.0cm[361] DRIVE goal=(-2.55,-3.32) dist=1.97m front=0.76m cells=14 rms=3.0cm[362] DRIVE goal=(-2.55,-3.32) dist=1.97m front=0.71m cells=14 rms=3.0cm[363] DRIVE goal=(-2.55,-3.32) dist=1.96m front=0.63m cells=15 rms=3.0cm[364] DRIVE goal=(-2.55,-3.32) dist=1.96m front=0.63m cells=15 rms=3.0cm[365] DRIVE goal=(-2.55,-3.32) dist=1.96m front=0.63m cells=15 rms=3.0cm[366] DRIVE goal=(-2.55,-3.32) dist=1.95m front=0.60m cells=15 rms=3.0cm[367] DRIVE goal=(-2.55,-3.32) dist=1.94m front=0.58m cells=15 rms=3.0cm[368] DRIVE goal=(-2.55,-3.32) dist=1.93m front=0.53m cells=15 rms=3.0cm[369] DRIVE goal=(-2.55,-3.32) dist=1.92m front=0.53m cells=15 rms=3.0cm[370] DRIVE goal=(-2.55,-3.32) dist=1.91m front=0.52m cells=15 rms=3.0cm[371] DRIVE goal=(-2.55,-3.32) dist=1.89m front=0.51m cells=15 rms=3.0cm[372] DRIVE goal=(-2.55,-3.32) dist=1.89m front=0.51m cells=15 rms=3.0cm[373] DRIVE goal=(-2.55,-3.32) dist=1.89m front=0.51m cells=15 rms=3.0cm[374] DRIVE goal=(-2.55,-3.32) dist=1.88m front=0.51m cells=15 rms=3.0cm[375] DRIVE goal=(-2.55,-3.32) dist=1.88m front=0.51m cells=15 rms=3.0cm[376] DRIVE goal=(-2.55,-3.32) dist=1.88m front=0.51m cells=15 rms=3.0cm[377] DRIVE goal=(-2.55,-3.32) dist=1.88m front=0.51m cells=15 rms=3.0cm[378] DRIVE goal=(-2.55,-3.32) dist=1.89m front=0.52m cells=15 rms=3.0cm[379] DRIVE goal=(-2.55,-3.32) dist=1.89m front=0.52m cells=15 rms=3.0cm[380] DRIVE goal=(-2.55,-3.32) dist=1.88m front=0.52m cells=15 rms=3.0cm[381] DRIVE goal=(-2.55,-3.32) dist=1.88m front=0.52m cells=15 rms=3.0cm[382] DRIVE goal=(-2.55,-3.32) dist=1.88m front=0.52m cells=15 rms=3.0cm[383] DRIVE goal=(-2.55,-3.32) dist=1.87m front=0.52m cells=15 rms=3.0cm[384] DRIVE goal=(-2.55,-3.32) dist=1.87m front=0.52m cells=15 rms=3.0cm

=======================================================
[90.1s] RETURNING TO ORIGIN
=======================================================
Time elapsed: 90.1s / 120.0s (75%)
Origin: (-0.01, -0.01)
Current: (-0.70, -3.46)
Distance to origin: 3.51m
=======================================================


[A* PLAN] ========== PATH PLANNING START ==========
[A* PLAN] From cell (-2, -11) to cell (0, 0)
[A* PLAN] World: (-0.70,-3.46) -> (-0.01,-0.01)
[A* PLAN] Distance: 3.51m
[A* PLAN] Grid res: 0.3m, Inflation: 2 cells = 0.60m clearance
[A* PLAN] Map: 102 walls, 184 scanned, 15 visited
[A* PLAN] Inflated obstacles: 346 cells (inflation=2, unreachable=0)
[A* PLAN] Closest wall to START: (-1, -11) at 1.0 cells = 0.30m
[A* PLAN] Closest wall to GOAL: (0, 1) at 1.0 cells = 0.30m
[A* PLAN] Cleared 15 visited cells from obstacles (guaranteed traversable)
[A* DEBUG] Cleared 7 cells around goal (radius=1)
[A* PLAN] Start in obstacles: False, Goal in obstacles: False
[A* RESULT] Path found! 12 cells, 15 iterations
[A* RESULT] Total cost: 34.5, Path length: ~3.30m
[A* RESULT] Min wall clearance: 0.0 cells = 0.00m at (-1, -10)
[A* WARN] Path passes very close to walls! May cause collisions.
[A* DEBUG] Found approach point with clearance=0.30m
[A* DEBUG] Using clear approach point (0.15, -0.75)
[A* RESULT] Simplified to 11 waypoints
[A* PLAN] ========== PATH PLANNING END ==========

[A*] Planned path with 11 waypoints
  WP0: (-0.45, -3.15)
  WP1: (-0.15, -2.85)
  WP2: (-0.15, -2.85)
  WP3: (-0.15, -2.55)
  WP4: (-0.15, -2.55)
  WP5: (-0.15, -2.25)
  WP6: (-0.15, -2.25)
  WP7: (-0.15, -1.95)
  WP8: (-0.15, -1.95)
  WP9: (0.15, -0.75)
  WP10: (0.15, 0.15)
[385] RETURN DRIVE WP0/11 goal=(-0.45,-3.15) origin_dist=3.51m front=0.51m[386] RETURN DRIVE WP0/11 goal=(-0.45,-3.15) origin_dist=3.52m front=0.50m[387] RETURN DRIVE WP0/11 goal=(-0.45,-3.15) origin_dist=3.52m front=0.50m[388] RETURN DRIVE WP0/11 goal=(-0.45,-3.15) origin_dist=3.52m front=0.49m[389] RETURN DRIVE WP0/11 goal=(-0.45,-3.15) origin_dist=3.52m front=0.49m[390] RETURN DRIVE WP0/11 goal=(-0.45,-3.15) origin_dist=3.51m front=0.50m[391] RETURN DRIVE WP0/11 goal=(-0.45,-3.15) origin_dist=3.51m front=0.51m[392] RETURN DRIVE WP0/11 goal=(-0.45,-3.15) origin_dist=3.51m front=0.50m[393] RETURN DRIVE WP0/11 goal=(-0.45,-3.15) origin_dist=3.50m front=0.52m[394] RETURN DRIVE WP0/11 goal=(-0.45,-3.15) origin_dist=3.50m front=0.52m[395] RETURN DRIVE WP0/11 goal=(-0.45,-3.15) origin_dist=3.49m front=0.54m[396] RETURN DRIVE WP0/11 goal=(-0.45,-3.15) origin_dist=3.49m front=0.60m[397] RETURN DRIVE WP0/11 goal=(-0.45,-3.15) origin_dist=3.49m front=0.71m[398] RETURN DRIVE WP0/11 goal=(-0.45,-3.15) origin_dist=3.49m front=1.20m[399] RETURN DRIVE WP0/11 goal=(-0.45,-3.15) origin_dist=3.48m front=1.20m[400] RETURN DRIVE WP0/11 goal=(-0.45,-3.15) origin_dist=3.48m front=1.20m[401] RETURN DRIVE WP0/11 goal=(-0.45,-3.15) origin_dist=3.48m front=1.20m[402] RETURN DRIVE WP0/11 goal=(-0.45,-3.15) origin_dist=3.48m front=1.19m[403] RETURN DRIVE WP0/11 goal=(-0.45,-3.15) origin_dist=3.47m front=1.20m[404] RETURN DRIVE WP0/11 goal=(-0.45,-3.15) origin_dist=3.47m front=1.20m[405] RETURN DRIVE WP0/11 goal=(-0.45,-3.15) origin_dist=3.47m front=1.20m[406] RETURN DRIVE WP0/11 goal=(-0.45,-3.15) origin_dist=3.47m front=1.20m[407] RETURN DRIVE WP0/11 goal=(-0.45,-3.15) origin_dist=3.46m front=1.20m[408] RETURN DRIVE WP0/11 goal=(-0.45,-3.15) origin_dist=3.46m front=1.20m[409] RETURN DRIVE WP0/11 goal=(-0.45,-3.15) origin_dist=3.46m front=1.19m
[ 95.1s] [A*] Reached WP0, heading to WP1 (-0.15, -2.85)
[410] RETURN DRIVE WP1/11 goal=(-0.15,-2.85) origin_dist=3.45m front=1.20m[411] RETURN DRIVE WP1/11 goal=(-0.15,-2.85) origin_dist=3.45m front=1.20m[412] RETURN DRIVE WP1/11 goal=(-0.15,-2.85) origin_dist=3.45m front=1.20m[413] RETURN DRIVE WP1/11 goal=(-0.15,-2.85) origin_dist=3.45m front=1.20m[414] RETURN DRIVE WP1/11 goal=(-0.15,-2.85) origin_dist=3.44m front=1.20m[415] RETURN DRIVE WP1/11 goal=(-0.15,-2.85) origin_dist=3.44m front=1.20m[416] RETURN DRIVE WP1/11 goal=(-0.15,-2.85) origin_dist=3.44m front=1.20m[417] RETURN DRIVE WP1/11 goal=(-0.15,-2.85) origin_dist=3.44m front=1.20m[418] RETURN DRIVE WP1/11 goal=(-0.15,-2.85) origin_dist=3.43m front=1.20m[419] RETURN DRIVE WP1/11 goal=(-0.15,-2.85) origin_dist=3.43m front=1.25m[420] RETURN DRIVE WP1/11 goal=(-0.15,-2.85) origin_dist=3.43m front=0.69m[421] RETURN DRIVE WP1/11 goal=(-0.15,-2.85) origin_dist=3.43m front=0.66m[422] RETURN DRIVE WP1/11 goal=(-0.15,-2.85) origin_dist=3.42m front=0.65m[423] RETURN DRIVE WP1/11 goal=(-0.15,-2.85) origin_dist=3.42m front=0.57m[424] RETURN DRIVE WP1/11 goal=(-0.15,-2.85) origin_dist=3.42m front=0.52m[425] RETURN DRIVE WP1/11 goal=(-0.15,-2.85) origin_dist=3.42m front=0.48m[426] RETURN DRIVE WP1/11 goal=(-0.15,-2.85) origin_dist=3.42m front=0.47m[427] RETURN TURN WP1/11 goal=(-0.15,-2.85) origin_dist=3.42m front=0.43m[428] RETURN TURN WP1/11 goal=(-0.15,-2.85) origin_dist=3.42m front=0.42m[429] RETURN TURN WP1/11 goal=(-0.15,-2.85) origin_dist=3.41m front=0.38m[430] RETURN TURN WP1/11 goal=(-0.15,-2.85) origin_dist=3.42m front=0.37m[431] RETURN TURN WP1/11 goal=(-0.15,-2.85) origin_dist=3.42m front=0.36m[432] RETURN TURN WP1/11 goal=(-0.15,-2.85) origin_dist=3.42m front=0.37m[433] RETURN TURN WP1/11 goal=(-0.15,-2.85) origin_dist=3.42m front=0.36m[434] RETURN TURN WP1/11 goal=(-0.15,-2.85) origin_dist=3.42m front=0.34m[435] RETURN TURN WP1/11 goal=(-0.15,-2.85) origin_dist=3.42m front=0.34m[436] RETURN TURN WP1/11 goal=(-0.15,-2.85) origin_dist=3.42m front=0.32m[437] RETURN TURN WP1/11 goal=(-0.15,-2.85) origin_dist=3.41m front=0.31m[438] RETURN TURN WP1/11 goal=(-0.15,-2.85) origin_dist=3.40m front=0.30m[439] RETURN TURN WP1/11 goal=(-0.15,-2.85) origin_dist=3.38m front=0.30m[440] RETURN TURN WP1/11 goal=(-0.15,-2.85) origin_dist=3.37m front=0.29m[441] RETURN TURN WP1/11 goal=(-0.15,-2.85) origin_dist=3.36m front=0.29m[442] RETURN TURN WP1/11 goal=(-0.15,-2.85) origin_dist=3.35m front=0.29m[443] RETURN TURN WP1/11 goal=(-0.15,-2.85) origin_dist=3.34m front=0.28m[444] RETURN TURN WP1/11 goal=(-0.15,-2.85) origin_dist=3.33m front=0.28m[445] RETURN TURN WP1/11 goal=(-0.15,-2.85) origin_dist=3.32m front=0.27m[446] RETURN TURN WP1/11 goal=(-0.15,-2.85) origin_dist=3.31m front=0.27m[447] RETURN TURN WP1/11 goal=(-0.15,-2.85) origin_dist=3.29m front=0.27m[448] RETURN TURN WP1/11 goal=(-0.15,-2.85) origin_dist=3.28m front=0.27m[449] RETURN TURN WP1/11 goal=(-0.15,-2.85) origin_dist=3.27m front=0.26m[450] RETURN TURN WP1/11 goal=(-0.15,-2.85) origin_dist=3.26m front=0.26m[451] RETURN TURN WP1/11 goal=(-0.15,-2.85) origin_dist=3.25m front=0.27m[452] RETURN TURN WP1/11 goal=(-0.15,-2.85) origin_dist=3.24m front=0.26m[453] RETURN TURN WP1/11 goal=(-0.15,-2.85) origin_dist=3.23m front=0.26m[454] RETURN TURN WP1/11 goal=(-0.15,-2.85) origin_dist=3.22m front=0.27m[455] RETURN TURN WP1/11 goal=(-0.15,-2.85) origin_dist=3.21m front=0.26m[456] RETURN TURN WP1/11 goal=(-0.15,-2.85) origin_dist=3.20m front=0.26m[457] RETURN TURN WP1/11 goal=(-0.15,-2.85) origin_dist=3.19m front=0.26m[458] RETURN TURN WP1/11 goal=(-0.15,-2.85) origin_dist=3.19m front=0.26m[459] RETURN TURN WP1/11 goal=(-0.15,-2.85) origin_dist=3.18m front=0.26m[460] RETURN TURN WP1/11 goal=(-0.15,-2.85) origin_dist=3.17m front=0.26m[461] RETURN TURN WP1/11 goal=(-0.15,-2.85) origin_dist=3.16m front=0.25m[462] RETURN TURN WP1/11 goal=(-0.15,-2.85) origin_dist=3.15m front=0.25m[463] RETURN TURN WP1/11 goal=(-0.15,-2.85) origin_dist=3.14m front=0.24m[464] RETURN TURN WP1/11 goal=(-0.15,-2.85) origin_dist=3.13m front=0.24m[465] RETURN DRIVE WP1/11 goal=(-0.15,-2.85) origin_dist=3.12m front=0.23m[466] RETURN DRIVE WP1/11 goal=(-0.15,-2.85) origin_dist=3.11m front=0.23m[467] RETURN DRIVE WP1/11 goal=(-0.15,-2.85) origin_dist=3.10m front=0.23m[468] RETURN DRIVE WP1/11 goal=(-0.15,-2.85) origin_dist=3.10m front=0.23m[469] RETURN DRIVE WP1/11 goal=(-0.15,-2.85) origin_dist=3.10m front=0.22m[470] RETURN TURN WP1/11 goal=(-0.15,-2.85) origin_dist=3.10m front=0.22m[471] RETURN TURN WP1/11 goal=(-0.15,-2.85) origin_dist=3.10m front=0.21m[472] RETURN TURN WP1/11 goal=(-0.15,-2.85) origin_dist=3.10m front=0.20m[473] RETURN TURN WP1/11 goal=(-0.15,-2.85) origin_dist=3.10m front=0.20m[474] RETURN TURN WP1/11 goal=(-0.15,-2.85) origin_dist=3.10m front=0.19m[475] RETURN TURN WP1/11 goal=(-0.15,-2.85) origin_dist=3.09m front=0.19m[476] RETURN TURN WP1/11 goal=(-0.15,-2.85) origin_dist=3.09m front=0.20m[477] RETURN TURN WP1/11 goal=(-0.15,-2.85) origin_dist=3.09m front=0.20m[478] RETURN TURN WP1/11 goal=(-0.15,-2.85) origin_dist=3.09m front=0.20m[479] RETURN TURN WP1/11 goal=(-0.15,-2.85) origin_dist=3.09m front=0.20m[480] RETURN TURN WP1/11 goal=(-0.15,-2.85) origin_dist=3.09m front=0.20m[481] RETURN TURN WP1/11 goal=(-0.15,-2.85) origin_dist=3.09m front=0.21m[482] RETURN TURN WP1/11 goal=(-0.15,-2.85) origin_dist=3.09m front=0.21m

Stopping (Ctrl+C)...
[MARKER] Publisher stopped

=======================================================
NBV NAVIGATION COMPLETE
=======================================================
Final state: returning
Duration: 109.7s
Iterations: 482
Goals reached: 3
Backups: 2
Unique cells visited: 15
Cells scanned by LiDAR: 187
Walls detected: 107

--- Drive Accuracy ---
Cross-track RMS error: 3.0cm
Total distance traveled: 4.75m
Ideal distance (sum of goals): 9.50m
Drive efficiency: 199.8%

--- Return Phase ---
Return phase duration: 19.6s
Final distance to origin: 3.09m
Revisit rate: 100.0%

--- Map Accuracy Suggestions ---
To measure map accuracy, consider:
1. Ground truth comparison: Place markers at known positions,
   compare measured vs actual distances between them
2. Loop closure error: After returning to origin, check
   odometry drift (final_dist to origin should be ~0)
3. Feature alignment: Compare map walls to actual room layout
4. Consistency check: Run multiple times, overlay maps
5. Tape measure validation: Measure actual room dimensions,
   compare to map scale (resolution * pixels)
