[OUTPUT] Logging to: /home/ws/ugv_cont/mission/outputs/20251221_205052
[OUTPUT] Log file: /home/ws/ugv_cont/mission/outputs/20251221_205052/logs/navigation.log
=======================================================
NEXT-BEST-VIEW (NBV) NAVIGATION
=======================================================
Speed: 0.08 m/s
Goal distance: 0.5-2.0m
Press Ctrl+C to stop

[DEBUG] Marker publishing enabled - check /nav_goal in RViz
[MARKER] Persistent marker publisher started - add /nav_goal in RViz
[START] Initial position: (-0.01, 0.01)
[MARKER] Origin marker (blue) started at (-0.01, 0.01) - add /nav_origin in RViz

[  4.1s] [GOAL SELECT] robot@(-0.01,0.01) | 18 candidates (scanned=51 walls=18 visited=1):
  #1 ang= -58° d=0.50m pos=(-0.13,0.50) score=+40.8 [O=+1.6 U=+40.0 V=-0.0 W=-1.0 R=-0.0 F=+0.0] <-- BEST
  #2 ang= -70° d=0.50m pos=(-0.03,0.51) score=+38.7 [O=+1.6 U=+38.0 V=-0.0 W=-1.0 R=-0.0 F=+0.0]
  #3 ang= -76° d=0.50m pos=(0.03,0.51) score=+37.0 [O=+1.8 U=+36.0 V=-0.0 W=-1.0 R=-0.0 F=+0.0]
  #4 ang= -64° d=0.50m pos=(-0.08,0.51) score=+36.7 [O=+1.6 U=+36.0 V=-0.0 W=-1.0 R=-0.0 F=+0.0]
  #5 ang=-101° d=2.00m pos=(0.94,1.78) score=+34.1 [O=+2.5 U=+32.0 V=-0.0 W=-1.0 R=-0.0 F=+0.0]
  #6 ang=-107° d=2.00m pos=(1.12,1.67) score=+34.1 [O=+2.5 U=+32.0 V=-0.0 W=-1.0 R=-0.0 F=+0.0]
  #7 ang= -88° d=0.50m pos=(0.13,0.49) score=+29.5 [O=+2.3 U=+28.0 V=-0.0 W=-1.0 R=-0.0 F=+0.0]
  #8 ang= -82° d=0.50m pos=(0.08,0.50) score=+29.5 [O=+2.3 U=+28.0 V=-0.0 W=-1.0 R=-0.0 F=+0.0]
[  4.1s] [GOAL] Selected: (-0.13, 0.50) dist=0.50m timeout=28s angle=-58° reason=no goal
[  1] DRIVE goal=(-0.13,0.50) dist=0.50m front=0.41m cells=1 rms=0.0cm[  2] DRIVE goal=(-0.13,0.50) dist=0.50m front=0.41m cells=1 rms=0.1cm[  3] DRIVE goal=(-0.13,0.50) dist=0.50m front=0.41m cells=1 rms=0.1cm[  4] DRIVE goal=(-0.13,0.50) dist=0.50m front=0.41m cells=1 rms=0.1cm[  5] DRIVE goal=(-0.13,0.50) dist=0.50m front=0.41m cells=1 rms=0.1cm[  6] DRIVE goal=(-0.13,0.50) dist=0.50m front=0.42m cells=1 rms=0.1cm[  7] DRIVE goal=(-0.13,0.50) dist=0.50m front=0.44m cells=1 rms=0.1cm[  8] DRIVE goal=(-0.13,0.50) dist=0.50m front=0.57m cells=1 rms=0.1cm[  9] DRIVE goal=(-0.13,0.50) dist=0.51m front=0.57m cells=1 rms=0.1cm[ 10] DRIVE goal=(-0.13,0.50) dist=0.51m front=0.57m cells=1 rms=0.1cm[ 11] DRIVE goal=(-0.13,0.50) dist=0.51m front=0.57m cells=1 rms=0.1cm[ 12] DRIVE goal=(-0.13,0.50) dist=0.50m front=0.57m cells=1 rms=0.1cm[ 13] DRIVE goal=(-0.13,0.50) dist=0.50m front=0.56m cells=1 rms=0.2cm[ 14] DRIVE goal=(-0.13,0.50) dist=0.50m front=0.56m cells=1 rms=0.2cm[ 15] DRIVE goal=(-0.13,0.50) dist=0.51m front=0.57m cells=1 rms=0.2cm[ 16] DRIVE goal=(-0.13,0.50) dist=0.51m front=0.60m cells=1 rms=0.3cm[ 17] DRIVE goal=(-0.13,0.50) dist=0.51m front=0.62m cells=1 rms=0.3cm[ 18] DRIVE goal=(-0.13,0.50) dist=0.51m front=0.89m cells=1 rms=0.3cm[ 19] DRIVE goal=(-0.13,0.50) dist=0.51m front=0.88m cells=1 rms=0.3cm[ 20] DRIVE goal=(-0.13,0.50) dist=0.50m front=0.88m cells=1 rms=0.4cm[ 21] DRIVE goal=(-0.13,0.50) dist=0.49m front=0.87m cells=1 rms=0.4cm[ 22] DRIVE goal=(-0.13,0.50) dist=0.48m front=0.86m cells=1 rms=0.5cm[ 23] DRIVE goal=(-0.13,0.50) dist=0.48m front=0.86m cells=1 rms=0.5cm[ 24] DRIVE goal=(-0.13,0.50) dist=0.48m front=0.86m cells=1 rms=0.6cm[ 25] DRIVE goal=(-0.13,0.50) dist=0.46m front=0.84m cells=1 rms=0.6cm[ 26] DRIVE goal=(-0.13,0.50) dist=0.44m front=0.82m cells=1 rms=0.7cm[ 27] DRIVE goal=(-0.13,0.50) dist=0.43m front=0.81m cells=1 rms=0.7cm[ 28] DRIVE goal=(-0.13,0.50) dist=0.40m front=0.79m cells=1 rms=0.8cm
[ 10.0s] [GOAL SELECT] robot@(-0.06,0.12) | 10 candidates (scanned=58 walls=30 visited=1):
  #1 ang= -64° d=2.00m pos=(1.02,1.80) score=+34.1 [O=+2.5 U=+32.0 V=-0.0 W=-1.0 R=-0.0 F=+0.0] <-- BEST
  #2 ang= -64° d=1.50m pos=(0.75,1.38) score=+28.0 [O=+2.5 U=+26.0 V=-0.0 W=-1.0 R=-0.0 F=+0.0]
  #3 ang= -58° d=1.00m pos=(0.39,1.01) score=+21.8 [O=+2.5 U=+22.0 V=-0.0 W=-3.0 R=-0.0 F=+0.0]
  #4 ang= -64° d=1.00m pos=(0.48,0.96) score=+17.8 [O=+2.5 U=+18.0 V=-0.0 W=-3.0 R=-0.0 F=+0.0]
  #5 ang= -70° d=1.00m pos=(0.57,0.90) score=+16.7 [O=+1.9 U=+22.0 V=-0.0 W=-3.0 R=-4.5 F=+0.0]
  #6 ang= -52° d=0.50m pos=(0.12,0.58) score=+4.2 [O=+2.5 U=+18.0 V=-0.0 W=-3.0 R=-13.5 F=+0.0]
  #7 ang= -76° d=0.50m pos=(0.30,0.47) score=+1.9 [O=+2.2 U=+16.0 V=-0.0 W=-3.0 R=-13.5 F=+0.0]
  #8 ang= -58° d=0.50m pos=(0.17,0.56) score=+0.1 [O=+2.5 U=+14.0 V=-0.0 W=-3.0 R=-13.5 F=+0.0]
[ 10.1s] [GOAL] Selected: (1.02, 1.80) dist=2.00m timeout=50s angle=-64° reason=reached
[ 29] DRIVE goal=(1.02,1.80) dist=2.00m front=0.77m cells=1 rms=0.8cm[ 30] DRIVE goal=(1.02,1.80) dist=2.00m front=0.76m cells=1 rms=0.8cm[ 31] DRIVE goal=(1.02,1.80) dist=2.00m front=0.76m cells=1 rms=0.8cm[ 32] DRIVE goal=(1.02,1.80) dist=2.00m front=0.76m cells=1 rms=0.8cm[ 33] DRIVE goal=(1.02,1.80) dist=2.00m front=0.76m cells=1 rms=0.8cm[ 34] DRIVE goal=(1.02,1.80) dist=2.00m front=0.75m cells=1 rms=0.8cm[ 35] DRIVE goal=(1.02,1.80) dist=2.00m front=0.75m cells=1 rms=0.8cm[ 36] DRIVE goal=(1.02,1.80) dist=2.00m front=0.76m cells=1 rms=0.8cm[ 37] DRIVE goal=(1.02,1.80) dist=2.00m front=0.76m cells=1 rms=0.8cm[ 38] DRIVE goal=(1.02,1.80) dist=2.00m front=0.76m cells=1 rms=0.9cm[ 39] DRIVE goal=(1.02,1.80) dist=2.00m front=0.76m cells=1 rms=0.9cm[ 40] DRIVE goal=(1.02,1.80) dist=2.00m front=0.76m cells=1 rms=0.9cm[ 41] DRIVE goal=(1.02,1.80) dist=2.00m front=0.76m cells=1 rms=0.9cm[ 42] DRIVE goal=(1.02,1.80) dist=2.00m front=0.75m cells=1 rms=1.0cm[ 43] DRIVE goal=(1.02,1.80) dist=1.99m front=0.76m cells=1 rms=1.0cm[ 44] DRIVE goal=(1.02,1.80) dist=1.99m front=0.76m cells=1 rms=1.0cm[ 45] DRIVE goal=(1.02,1.80) dist=2.00m front=0.76m cells=1 rms=1.1cm[ 46] DRIVE goal=(1.02,1.80) dist=2.00m front=0.78m cells=1 rms=1.1cm[ 47] DRIVE goal=(1.02,1.80) dist=2.00m front=0.80m cells=1 rms=1.1cm[ 48] DRIVE goal=(1.02,1.80) dist=2.00m front=0.80m cells=1 rms=1.1cm[ 49] DRIVE goal=(1.02,1.80) dist=2.00m front=0.80m cells=1 rms=1.1cm[ 50] DRIVE goal=(1.02,1.80) dist=2.01m front=0.86m cells=1 rms=1.1cm[ 51] DRIVE goal=(1.02,1.80) dist=2.01m front=0.94m cells=1 rms=1.2cm[ 52] DRIVE goal=(1.02,1.80) dist=2.01m front=0.94m cells=1 rms=1.2cm[ 53] DRIVE goal=(1.02,1.80) dist=2.01m front=0.94m cells=1 rms=1.2cm[ 54] DRIVE goal=(1.02,1.80) dist=2.01m front=0.94m cells=1 rms=1.2cm[ 55] DRIVE goal=(1.02,1.80) dist=2.00m front=0.94m cells=1 rms=1.2cm[ 56] DRIVE goal=(1.02,1.80) dist=2.00m front=0.78m cells=1 rms=1.2cm[ 57] DRIVE goal=(1.02,1.80) dist=1.98m front=0.73m cells=1 rms=1.3cm[ 58] DRIVE goal=(1.02,1.80) dist=1.97m front=0.75m cells=1 rms=1.3cm[ 59] DRIVE goal=(1.02,1.80) dist=1.97m front=0.78m cells=1 rms=1.3cm[ 60] DRIVE goal=(1.02,1.80) dist=1.95m front=0.72m cells=1 rms=1.4cm[ 61] DRIVE goal=(1.02,1.80) dist=1.92m front=0.72m cells=1 rms=1.4cm[ 62] DRIVE goal=(1.02,1.80) dist=1.91m front=0.69m cells=1 rms=1.4cm[ 63] DRIVE goal=(1.02,1.80) dist=1.90m front=0.68m cells=1 rms=1.5cm[ 64] DRIVE goal=(1.02,1.80) dist=1.88m front=0.64m cells=1 rms=1.5cm[ 65] DRIVE goal=(1.02,1.80) dist=1.87m front=0.64m cells=1 rms=1.6cm[ 66] DRIVE goal=(1.02,1.80) dist=1.86m front=0.62m cells=1 rms=1.6cm[ 67] DRIVE goal=(1.02,1.80) dist=1.84m front=0.61m cells=1 rms=1.6cm[ 68] DRIVE goal=(1.02,1.80) dist=1.82m front=0.61m cells=1 rms=1.6cm[ 69] DRIVE goal=(1.02,1.80) dist=1.79m front=0.60m cells=2 rms=1.7cm[ 70] DRIVE goal=(1.02,1.80) dist=1.77m front=0.59m cells=2 rms=1.7cm[ 71] DRIVE goal=(1.02,1.80) dist=1.75m front=0.58m cells=2 rms=1.7cm[ 72] DRIVE goal=(1.02,1.80) dist=1.73m front=0.57m cells=2 rms=1.7cm[ 73] DRIVE goal=(1.02,1.80) dist=1.71m front=0.56m cells=2 rms=1.7cm[ 74] DRIVE goal=(1.02,1.80) dist=1.70m front=0.55m cells=2 rms=1.7cm[ 75] DRIVE goal=(1.02,1.80) dist=1.67m front=0.54m cells=2 rms=1.7cm[ 76] DRIVE goal=(1.02,1.80) dist=1.65m front=0.53m cells=2 rms=1.7cm[ 77] DRIVE goal=(1.02,1.80) dist=1.63m front=0.52m cells=2 rms=1.7cm[ 78] DRIVE goal=(1.02,1.80) dist=1.61m front=0.50m cells=2 rms=1.7cm[ 79] DRIVE goal=(1.02,1.80) dist=1.59m front=1.11m cells=2 rms=1.7cm[ 80] DRIVE goal=(1.02,1.80) dist=1.57m front=1.11m cells=2 rms=1.7cm[ 81] DRIVE goal=(1.02,1.80) dist=1.56m front=1.12m cells=2 rms=1.7cm[ 82] DRIVE goal=(1.02,1.80) dist=1.54m front=1.09m cells=2 rms=1.7cm[ 83] DRIVE goal=(1.02,1.80) dist=1.51m front=1.09m cells=2 rms=1.7cm[ 84] DRIVE goal=(1.02,1.80) dist=1.50m front=1.08m cells=2 rms=1.6cm[ 85] DRIVE goal=(1.02,1.80) dist=1.48m front=1.07m cells=2 rms=1.6cm[ 86] DRIVE goal=(1.02,1.80) dist=1.46m front=1.06m cells=2 rms=1.6cm[ 87] DRIVE goal=(1.02,1.80) dist=1.44m front=1.06m cells=2 rms=1.6cm[ 88] DRIVE goal=(1.02,1.80) dist=1.42m front=1.05m cells=3 rms=1.6cm[ 89] DRIVE goal=(1.02,1.80) dist=1.39m front=1.04m cells=3 rms=1.6cm[ 90] DRIVE goal=(1.02,1.80) dist=1.36m front=1.00m cells=3 rms=1.6cm[ 91] DRIVE goal=(1.02,1.80) dist=1.36m front=1.01m cells=3 rms=1.6cm[ 92] DRIVE goal=(1.02,1.80) dist=1.33m front=0.97m cells=3 rms=1.6cm[ 93] DRIVE goal=(1.02,1.80) dist=1.30m front=0.95m cells=4 rms=1.6cm[ 94] DRIVE goal=(1.02,1.80) dist=1.28m front=0.95m cells=4 rms=1.6cm[ 95] DRIVE goal=(1.02,1.80) dist=1.26m front=0.98m cells=4 rms=1.6cm[ 96] DRIVE goal=(1.02,1.80) dist=1.24m front=0.95m cells=4 rms=1.6cm[ 97] DRIVE goal=(1.02,1.80) dist=1.22m front=0.93m cells=4 rms=1.5cm[ 98] DRIVE goal=(1.02,1.80) dist=1.21m front=0.92m cells=4 rms=1.5cm[ 99] DRIVE goal=(1.02,1.80) dist=1.19m front=0.91m cells=4 rms=1.5cm[100] DRIVE goal=(1.02,1.80) dist=1.19m front=0.90m cells=4 rms=1.5cm[101] DRIVE goal=(1.02,1.80) dist=1.18m front=0.89m cells=4 rms=1.5cm[102] DRIVE goal=(1.02,1.80) dist=1.16m front=0.90m cells=4 rms=1.5cm[103] DRIVE goal=(1.02,1.80) dist=1.13m front=0.86m cells=4 rms=1.5cm[104] DRIVE goal=(1.02,1.80) dist=1.11m front=0.85m cells=4 rms=1.5cm[105] DRIVE goal=(1.02,1.80) dist=1.10m front=0.85m cells=4 rms=1.5cm[106] DRIVE goal=(1.02,1.80) dist=1.08m front=0.87m cells=4 rms=1.5cm[107] DRIVE goal=(1.02,1.80) dist=1.06m front=0.85m cells=5 rms=1.5cm[108] DRIVE goal=(1.02,1.80) dist=1.02m front=0.85m cells=5 rms=1.5cm[109] DRIVE goal=(1.02,1.80) dist=1.01m front=0.82m cells=5 rms=1.5cm[110] DRIVE goal=(1.02,1.80) dist=0.99m front=0.83m cells=5 rms=1.5cm[111] DRIVE goal=(1.02,1.80) dist=0.97m front=0.82m cells=5 rms=1.5cm[112] DRIVE goal=(1.02,1.80) dist=0.95m front=0.84m cells=5 rms=1.5cm[113] DRIVE goal=(1.02,1.80) dist=0.94m front=0.87m cells=5 rms=1.4cm[114] DRIVE goal=(1.02,1.80) dist=0.92m front=0.79m cells=5 rms=1.4cm[115] DRIVE goal=(1.02,1.80) dist=0.90m front=0.84m cells=5 rms=1.4cm[116] DRIVE goal=(1.02,1.80) dist=0.89m front=0.83m cells=5 rms=1.4cm[117] DRIVE goal=(1.02,1.80) dist=0.86m front=0.82m cells=5 rms=1.4cm[118] DRIVE goal=(1.02,1.80) dist=0.84m front=0.81m cells=5 rms=1.4cm[119] DRIVE goal=(1.02,1.80) dist=0.82m front=0.81m cells=5 rms=1.4cm[120] DRIVE goal=(1.02,1.80) dist=0.79m front=0.80m cells=5 rms=1.4cm[121] DRIVE goal=(1.02,1.80) dist=0.77m front=0.82m cells=6 rms=1.4cm[122] DRIVE goal=(1.02,1.80) dist=0.73m front=0.81m cells=6 rms=1.4cm[123] DRIVE goal=(1.02,1.80) dist=0.71m front=0.59m cells=7 rms=1.4cm[124] DRIVE goal=(1.02,1.80) dist=0.70m front=0.58m cells=7 rms=1.4cm[125] DRIVE goal=(1.02,1.80) dist=0.67m front=0.55m cells=7 rms=1.4cm[126] DRIVE goal=(1.02,1.80) dist=0.67m front=1.30m cells=7 rms=1.4cm[127] DRIVE goal=(1.02,1.80) dist=0.66m front=1.26m cells=7 rms=1.4cm[128] DRIVE goal=(1.02,1.80) dist=0.66m front=0.78m cells=7 rms=1.4cm[129] DRIVE goal=(1.02,1.80) dist=0.64m front=0.70m cells=7 rms=1.4cm[130] DRIVE goal=(1.02,1.80) dist=0.62m front=0.69m cells=7 rms=1.4cm[131] DRIVE goal=(1.02,1.80) dist=0.60m front=0.76m cells=7 rms=1.4cm[132] DRIVE goal=(1.02,1.80) dist=0.59m front=1.16m cells=7 rms=1.4cm[133] DRIVE goal=(1.02,1.80) dist=0.58m front=1.20m cells=7 rms=1.4cm[134] DRIVE goal=(1.02,1.80) dist=0.54m front=1.22m cells=7 rms=1.4cm[135] DRIVE goal=(1.02,1.80) dist=0.52m front=1.19m cells=7 rms=1.4cm[136] DRIVE goal=(1.02,1.80) dist=0.51m front=1.23m cells=7 rms=1.4cm[137] DRIVE goal=(1.02,1.80) dist=0.49m front=1.01m cells=7 rms=1.4cm[138] DRIVE goal=(1.02,1.80) dist=0.46m front=0.88m cells=7 rms=1.4cm[139] DRIVE goal=(1.02,1.80) dist=0.45m front=0.76m cells=7 rms=1.5cm[140] DRIVE goal=(1.02,1.80) dist=0.43m front=0.76m cells=7 rms=1.5cm[141] DRIVE goal=(1.02,1.80) dist=0.43m front=0.85m cells=7 rms=1.5cm[142] DRIVE goal=(1.02,1.80) dist=0.43m front=1.04m cells=7 rms=1.5cm[143] DRIVE goal=(1.02,1.80) dist=0.42m front=1.02m cells=7 rms=1.6cm[144] DRIVE goal=(1.02,1.80) dist=0.42m front=1.13m cells=7 rms=1.6cm[145] DRIVE goal=(1.02,1.80) dist=0.42m front=1.14m cells=7 rms=1.6cm[146] DRIVE goal=(1.02,1.80) dist=0.42m front=1.14m cells=7 rms=1.6cm[147] DRIVE goal=(1.02,1.80) dist=0.42m front=1.14m cells=7 rms=1.7cm[148] DRIVE goal=(1.02,1.80) dist=0.42m front=1.10m cells=7 rms=1.7cm
[ 34.5s] [GOAL SELECT] robot@(0.77,1.49) | 17 candidates (scanned=137 walls=74 visited=7):
  #1 ang=  -3° d=1.50m pos=(1.66,2.70) score=+43.1 [O=+1.7 U=+36.1 V=-0.0 W=-0.0 R=-0.0 F=+4.9] <-- BEST
  #2 ang=  -9° d=1.50m pos=(1.79,2.60) score=+43.1 [O=+1.8 U=+36.0 V=-0.0 W=-0.0 R=-0.0 F=+4.8]
  #3 ang=  +3° d=1.50m pos=(1.53,2.79) score=+35.0 [O=+1.6 U=+28.0 V=-0.0 W=-0.0 R=-0.0 F=+5.0]
  #4 ang=  +9° d=1.50m pos=(1.39,2.86) score=+35.0 [O=+1.5 U=+28.0 V=-0.0 W=-0.0 R=-0.0 F=+5.0]
  #5 ang= +15° d=1.50m pos=(1.24,2.92) score=+33.0 [O=+1.6 U=+26.0 V=-0.0 W=-0.0 R=-0.0 F=+4.9]
  #6 ang=-119° d=0.50m pos=(1.00,1.05) score=+32.2 [O=+1.6 U=+36.3 V=-0.0 W=-3.0 R=-0.0 F=-2.8]
  #7 ang=-125° d=0.50m pos=(0.96,1.02) score=+31.8 [O=+1.7 U=+36.2 V=-0.0 W=-3.0 R=-0.0 F=-3.3]
  #8 ang=  -3° d=1.00m pos=(1.37,2.30) score=+31.5 [O=+2.2 U=+28.1 V=-0.0 W=-1.0 R=-3.0 F=+4.9]
[ 34.5s] [GOAL] Selected: (1.66, 2.70) dist=1.50m timeout=42s angle=-3° reason=reached
[149] DRIVE goal=(1.66,2.70) dist=1.50m front=1.10m cells=7 rms=1.7cm[150] DRIVE goal=(1.66,2.70) dist=1.49m front=1.11m cells=7 rms=1.7cm[151] DRIVE goal=(1.66,2.70) dist=1.47m front=1.09m cells=8 rms=1.7cm[152] DRIVE goal=(1.66,2.70) dist=1.45m front=1.07m cells=8 rms=1.7cm[153] DRIVE goal=(1.66,2.70) dist=1.45m front=1.09m cells=8 rms=1.7cm[154] DRIVE goal=(1.66,2.70) dist=1.44m front=1.08m cells=8 rms=1.7cm[155] DRIVE goal=(1.66,2.70) dist=1.43m front=1.13m cells=8 rms=1.7cm[156] DRIVE goal=(1.66,2.70) dist=1.42m front=1.11m cells=8 rms=1.7cm[157] DRIVE goal=(1.66,2.70) dist=1.40m front=1.09m cells=8 rms=1.7cm[158] DRIVE goal=(1.66,2.70) dist=1.39m front=0.98m cells=8 rms=1.7cm[159] DRIVE goal=(1.66,2.70) dist=1.37m front=1.03m cells=8 rms=1.6cm[160] DRIVE goal=(1.66,2.70) dist=1.35m front=1.00m cells=8 rms=1.6cm[161] DRIVE goal=(1.66,2.70) dist=1.33m front=1.06m cells=8 rms=1.6cm[162] DRIVE goal=(1.66,2.70) dist=1.32m front=1.07m cells=8 rms=1.6cm[163] DRIVE goal=(1.66,2.70) dist=1.28m front=1.04m cells=8 rms=1.6cm[164] DRIVE goal=(1.66,2.70) dist=1.28m front=1.01m cells=8 rms=1.6cm[165] DRIVE goal=(1.66,2.70) dist=1.25m front=1.04m cells=9 rms=1.6cm[166] DRIVE goal=(1.66,2.70) dist=1.23m front=1.01m cells=9 rms=1.6cm[167] DRIVE goal=(1.66,2.70) dist=1.22m front=1.01m cells=9 rms=1.6cm[168] DRIVE goal=(1.66,2.70) dist=1.17m front=0.98m cells=9 rms=1.6cm[169] DRIVE goal=(1.66,2.70) dist=1.14m front=0.96m cells=9 rms=1.6cm[170] DRIVE goal=(1.66,2.70) dist=1.12m front=0.97m cells=10 rms=1.6cm[171] DRIVE goal=(1.66,2.70) dist=1.11m front=0.93m cells=10 rms=1.6cm[172] DRIVE goal=(1.66,2.70) dist=1.08m front=0.88m cells=10 rms=1.6cm[173] DRIVE goal=(1.66,2.70) dist=1.06m front=0.88m cells=10 rms=1.6cm[174] DRIVE goal=(1.66,2.70) dist=1.04m front=0.85m cells=10 rms=1.6cm[175] DRIVE goal=(1.66,2.70) dist=1.02m front=0.85m cells=10 rms=1.6cm[176] DRIVE goal=(1.66,2.70) dist=1.01m front=0.84m cells=10 rms=1.6cm[177] DRIVE goal=(1.66,2.70) dist=0.99m front=0.83m cells=10 rms=1.6cm[178] DRIVE goal=(1.66,2.70) dist=0.97m front=0.82m cells=10 rms=1.6cm[179] DRIVE goal=(1.66,2.70) dist=0.96m front=0.81m cells=10 rms=1.6cm[180] DRIVE goal=(1.66,2.70) dist=0.94m front=0.80m cells=10 rms=1.6cm[181] DRIVE goal=(1.66,2.70) dist=0.92m front=0.81m cells=10 rms=1.6cm[182] DRIVE goal=(1.66,2.70) dist=0.90m front=0.80m cells=10 rms=1.6cm[183] DRIVE goal=(1.66,2.70) dist=0.88m front=1.39m cells=10 rms=1.6cm[184] DRIVE goal=(1.66,2.70) dist=0.86m front=1.36m cells=10 rms=1.6cm[185] DRIVE goal=(1.66,2.70) dist=0.84m front=1.34m cells=10 rms=1.6cm[186] DRIVE goal=(1.66,2.70) dist=0.82m front=1.32m cells=10 rms=1.6cm[187] DRIVE goal=(1.66,2.70) dist=0.80m front=1.30m cells=10 rms=1.6cm[188] DRIVE goal=(1.66,2.70) dist=0.78m front=1.28m cells=10 rms=1.6cm[189] DRIVE goal=(1.66,2.70) dist=0.76m front=1.26m cells=11 rms=1.6cm[190] DRIVE goal=(1.66,2.70) dist=0.75m front=1.24m cells=11 rms=1.6cm[191] DRIVE goal=(1.66,2.70) dist=0.72m front=1.23m cells=12 rms=1.6cm[192] DRIVE goal=(1.66,2.70) dist=0.70m front=1.21m cells=12 rms=1.6cm[193] DRIVE goal=(1.66,2.70) dist=0.69m front=1.19m cells=12 rms=1.6cm[194] DRIVE goal=(1.66,2.70) dist=0.67m front=1.17m cells=12 rms=1.5cm[195] DRIVE goal=(1.66,2.70) dist=0.65m front=1.15m cells=12 rms=1.5cm[196] DRIVE goal=(1.66,2.70) dist=0.63m front=1.12m cells=12 rms=1.5cm[197] DRIVE goal=(1.66,2.70) dist=0.61m front=1.10m cells=12 rms=1.5cm[198] DRIVE goal=(1.66,2.70) dist=0.59m front=1.09m cells=12 rms=1.5cm[199] DRIVE goal=(1.66,2.70) dist=0.57m front=1.06m cells=12 rms=1.5cm[200] DRIVE goal=(1.66,2.70) dist=0.55m front=1.05m cells=12 rms=1.5cm[201] DRIVE goal=(1.66,2.70) dist=0.53m front=1.03m cells=12 rms=1.5cm[202] DRIVE goal=(1.66,2.70) dist=0.51m front=1.01m cells=12 rms=1.5cm[203] DRIVE goal=(1.66,2.70) dist=0.50m front=0.99m cells=12 rms=1.5cm[204] DRIVE goal=(1.66,2.70) dist=0.47m front=0.97m cells=12 rms=1.5cm[205] DRIVE goal=(1.66,2.70) dist=0.45m front=0.95m cells=12 rms=1.5cm[206] DRIVE goal=(1.66,2.70) dist=0.43m front=0.93m cells=12 rms=1.5cm[207] DRIVE goal=(1.66,2.70) dist=0.41m front=0.91m cells=12 rms=1.5cm
[ 46.3s] [GOAL SELECT] robot@(1.42,2.39) | 32 candidates (scanned=186 walls=93 visited=12):
  #1 ang= +27° d=2.00m pos=(1.66,4.37) score=+40.8 [O=+1.6 U=+34.0 V=-0.0 W=-0.0 R=-0.0 F=+4.6] <-- BEST
  #2 ang= -15° d=0.50m pos=(1.80,2.71) score=+39.5 [O=+1.6 U=+38.0 V=-0.0 W=-1.0 R=-4.0 F=+4.7]
  #3 ang= +33° d=2.00m pos=(1.44,4.39) score=+38.8 [O=+1.7 U=+33.2 V=-0.0 W=-1.0 R=-0.0 F=+4.3]
  #4 ang= -64° d=2.00m pos=(3.40,2.09) score=+38.6 [O=+2.1 U=+34.0 V=-0.0 W=-0.0 R=-0.0 F=+1.9]
  #5 ang= -58° d=2.00m pos=(3.42,2.30) score=+38.1 [O=+2.1 U=+34.0 V=-0.0 W=-1.0 R=-0.0 F=+2.4]
  #6 ang= +58° d=0.50m pos=(1.22,2.85) score=+38.0 [O=+2.0 U=+38.0 V=-0.0 W=-1.0 R=-4.0 F=+2.9]
  #7 ang= -45° d=1.50m pos=(2.90,2.64) score=+36.9 [O=+2.1 U=+32.1 V=-0.0 W=-1.0 R=-0.0 F=+3.3]
  #8 ang= +45° d=1.00m pos=(1.22,3.37) score=+35.5 [O=+2.5 U=+32.0 V=-0.0 W=-3.0 R=-0.0 F=+3.7]
[ 46.4s] [GOAL] Selected: (1.66, 4.37) dist=2.00m timeout=50s angle=27° reason=reached
[208] DRIVE goal=(1.66,4.37) dist=2.00m front=0.89m cells=12 rms=1.5cm[209] DRIVE goal=(1.66,4.37) dist=1.98m front=0.87m cells=13 rms=1.5cm[210] DRIVE goal=(1.66,4.37) dist=1.97m front=0.85m cells=13 rms=1.5cm[211] DRIVE goal=(1.66,4.37) dist=1.96m front=0.84m cells=13 rms=1.5cm[212] DRIVE goal=(1.66,4.37) dist=1.96m front=0.84m cells=13 rms=1.5cm[213] DRIVE goal=(1.66,4.37) dist=1.96m front=0.84m cells=13 rms=1.5cm[214] DRIVE goal=(1.66,4.37) dist=1.96m front=0.84m cells=13 rms=1.5cm[215] DRIVE goal=(1.66,4.37) dist=1.96m front=0.84m cells=13 rms=1.5cm[216] DRIVE goal=(1.66,4.37) dist=1.95m front=0.84m cells=13 rms=1.5cm[217] DRIVE goal=(1.66,4.37) dist=1.95m front=0.83m cells=13 rms=1.6cm[218] DRIVE goal=(1.66,4.37) dist=1.95m front=0.83m cells=13 rms=1.6cm[219] DRIVE goal=(1.66,4.37) dist=1.95m front=0.83m cells=13 rms=1.6cm[220] DRIVE goal=(1.66,4.37) dist=1.95m front=0.83m cells=13 rms=1.6cm[221] DRIVE goal=(1.66,4.37) dist=1.95m front=0.83m cells=13 rms=1.6cm[222] DRIVE goal=(1.66,4.37) dist=1.94m front=0.82m cells=13 rms=1.6cm[223] DRIVE goal=(1.66,4.37) dist=1.94m front=0.81m cells=13 rms=1.6cm[224] DRIVE goal=(1.66,4.37) dist=1.93m front=0.81m cells=13 rms=1.6cm[225] DRIVE goal=(1.66,4.37) dist=1.93m front=0.80m cells=13 rms=1.7cm[226] DRIVE goal=(1.66,4.37) dist=1.93m front=0.80m cells=13 rms=1.7cm[227] DRIVE goal=(1.66,4.37) dist=1.92m front=0.79m cells=13 rms=1.7cm[228] DRIVE goal=(1.66,4.37) dist=1.92m front=0.79m cells=13 rms=1.7cm[229] DRIVE goal=(1.66,4.37) dist=1.92m front=0.79m cells=13 rms=1.8cm[230] DRIVE goal=(1.66,4.37) dist=1.92m front=0.79m cells=13 rms=1.8cm[231] DRIVE goal=(1.66,4.37) dist=1.90m front=0.78m cells=13 rms=1.8cm[232] DRIVE goal=(1.66,4.37) dist=1.89m front=0.76m cells=13 rms=1.8cm[233] DRIVE goal=(1.66,4.37) dist=1.88m front=0.75m cells=13 rms=1.9cm[234] DRIVE goal=(1.66,4.37) dist=1.87m front=0.74m cells=13 rms=1.9cm[235] DRIVE goal=(1.66,4.37) dist=1.85m front=0.73m cells=13 rms=1.9cm[236] DRIVE goal=(1.66,4.37) dist=1.83m front=0.71m cells=13 rms=1.9cm[237] DRIVE goal=(1.66,4.37) dist=1.82m front=0.70m cells=13 rms=2.0cm[238] DRIVE goal=(1.66,4.37) dist=1.80m front=0.68m cells=13 rms=2.0cm[239] DRIVE goal=(1.66,4.37) dist=1.79m front=0.67m cells=13 rms=2.0cm[240] DRIVE goal=(1.66,4.37) dist=1.77m front=0.65m cells=13 rms=2.0cm[241] DRIVE goal=(1.66,4.37) dist=1.74m front=0.63m cells=13 rms=2.0cm[242] DRIVE goal=(1.66,4.37) dist=1.72m front=0.62m cells=13 rms=2.0cm[243] DRIVE goal=(1.66,4.37) dist=1.69m front=0.61m cells=14 rms=2.1cm[244] DRIVE goal=(1.66,4.37) dist=1.68m front=0.61m cells=14 rms=2.1cm[245] DRIVE goal=(1.66,4.37) dist=1.67m front=0.60m cells=15 rms=2.1cm[246] DRIVE goal=(1.66,4.37) dist=1.64m front=0.57m cells=15 rms=2.1cm[247] DRIVE goal=(1.66,4.37) dist=1.63m front=0.57m cells=15 rms=2.1cm[248] DRIVE goal=(1.66,4.37) dist=1.60m front=0.58m cells=15 rms=2.1cm[249] DRIVE goal=(1.66,4.37) dist=1.57m front=0.55m cells=15 rms=2.1cm[250] DRIVE goal=(1.66,4.37) dist=1.56m front=0.52m cells=15 rms=2.1cm[251] DRIVE goal=(1.66,4.37) dist=1.53m front=0.53m cells=15 rms=2.1cm[252] DRIVE goal=(1.66,4.37) dist=1.51m front=0.50m cells=15 rms=2.1cm[253] DRIVE goal=(1.66,4.37) dist=1.50m front=0.48m cells=15 rms=2.1cm[254] DRIVE goal=(1.66,4.37) dist=1.49m front=0.47m cells=15 rms=2.1cm[255] DRIVE goal=(1.66,4.37) dist=1.46m front=0.46m cells=15 rms=2.1cm[256] DRIVE goal=(1.66,4.37) dist=1.45m front=0.47m cells=15 rms=2.1cm[257] DRIVE goal=(1.66,4.37) dist=1.42m front=0.56m cells=15 rms=2.2cm[258] DRIVE goal=(1.66,4.37) dist=1.41m front=0.56m cells=15 rms=2.2cm[259] DRIVE goal=(1.66,4.37) dist=1.38m front=0.54m cells=15 rms=2.2cm[260] DRIVE goal=(1.66,4.37) dist=1.36m front=0.62m cells=16 rms=2.2cm[261] DRIVE goal=(1.66,4.37) dist=1.34m front=0.65m cells=16 rms=2.2cm[262] DRIVE goal=(1.66,4.37) dist=1.33m front=0.81m cells=16 rms=2.2cm[263] DRIVE goal=(1.66,4.37) dist=1.32m front=0.81m cells=16 rms=2.2cm[264] DRIVE goal=(1.66,4.37) dist=1.30m front=0.64m cells=16 rms=2.2cm[265] DRIVE goal=(1.66,4.37) dist=1.28m front=0.64m cells=16 rms=2.2cm[266] DRIVE goal=(1.66,4.37) dist=1.27m front=0.68m cells=16 rms=2.2cm[267] DRIVE goal=(1.66,4.37) dist=1.24m front=0.56m cells=16 rms=2.2cm[268] DRIVE goal=(1.66,4.37) dist=1.22m front=0.55m cells=16 rms=2.2cm[269] DRIVE goal=(1.66,4.37) dist=1.20m front=0.64m cells=16 rms=2.2cm[270] DRIVE goal=(1.66,4.37) dist=1.18m front=0.65m cells=16 rms=2.2cm[271] DRIVE goal=(1.66,4.37) dist=1.16m front=0.62m cells=16 rms=2.2cm[272] DRIVE goal=(1.66,4.37) dist=1.14m front=0.70m cells=16 rms=2.2cm[273] DRIVE goal=(1.66,4.37) dist=1.14m front=0.81m cells=16 rms=2.2cm[274] DRIVE goal=(1.66,4.37) dist=1.12m front=0.76m cells=16 rms=2.2cm[275] DRIVE goal=(1.66,4.37) dist=1.11m front=0.69m cells=16 rms=2.2cm[276] DRIVE goal=(1.66,4.37) dist=1.11m front=0.66m cells=16 rms=2.2cm[277] DRIVE goal=(1.66,4.37) dist=1.11m front=0.63m cells=16 rms=2.2cm[278] DRIVE goal=(1.66,4.37) dist=1.10m front=0.58m cells=16 rms=2.2cm[279] DRIVE goal=(1.66,4.37) dist=1.11m front=0.54m cells=16 rms=2.2cm[280] DRIVE goal=(1.66,4.37) dist=1.10m front=0.51m cells=16 rms=2.2cm[281] DRIVE goal=(1.66,4.37) dist=1.10m front=0.51m cells=16 rms=2.2cm[282] DRIVE goal=(1.66,4.37) dist=1.11m front=0.50m cells=16 rms=2.2cm[283] DRIVE goal=(1.66,4.37) dist=1.10m front=0.51m cells=16 rms=2.2cm[284] DRIVE goal=(1.66,4.37) dist=1.10m front=0.50m cells=16 rms=2.2cm[285] DRIVE goal=(1.66,4.37) dist=1.10m front=0.51m cells=16 rms=2.2cm[286] DRIVE goal=(1.66,4.37) dist=1.10m front=0.50m cells=16 rms=2.2cm[287] DRIVE goal=(1.66,4.37) dist=1.10m front=0.51m cells=16 rms=2.2cm[288] DRIVE goal=(1.66,4.37) dist=1.10m front=0.52m cells=16 rms=2.2cm[289] DRIVE goal=(1.66,4.37) dist=1.10m front=0.51m cells=16 rms=2.2cm[290] DRIVE goal=(1.66,4.37) dist=1.10m front=0.50m cells=16 rms=2.2cm[291] DRIVE goal=(1.66,4.37) dist=1.10m front=0.52m cells=16 rms=2.1cm[292] DRIVE goal=(1.66,4.37) dist=1.10m front=0.51m cells=16 rms=2.1cm[293] DRIVE goal=(1.66,4.37) dist=1.10m front=0.51m cells=16 rms=2.1cm[294] DRIVE goal=(1.66,4.37) dist=1.10m front=0.50m cells=16 rms=2.1cm[295] DRIVE goal=(1.66,4.37) dist=1.10m front=0.51m cells=16 rms=2.1cm[296] DRIVE goal=(1.66,4.37) dist=1.10m front=0.51m cells=16 rms=2.1cm[297] DRIVE goal=(1.66,4.37) dist=1.10m front=0.52m cells=16 rms=2.1cm[298] DRIVE goal=(1.66,4.37) dist=1.11m front=0.52m cells=16 rms=2.1cm[299] DRIVE goal=(1.66,4.37) dist=1.10m front=0.51m cells=16 rms=2.1cm[300] DRIVE goal=(1.66,4.37) dist=1.10m front=0.51m cells=16 rms=2.1cm[301] DRIVE goal=(1.66,4.37) dist=1.10m front=0.50m cells=16 rms=2.1cm[302] DRIVE goal=(1.66,4.37) dist=1.11m front=0.51m cells=16 rms=2.1cm[303] DRIVE goal=(1.66,4.37) dist=1.11m front=0.51m cells=16 rms=2.1cm
[ 65.9s] [DRIVE STUCK] Goal distance unchanged for 6.9s
[DRIVE STUCK] dist_oldest=1.18m, dist_now=1.11m, change=0.07m < margin=0.08m
[DRIVE STUCK] Front sectors: s55=0.52 s56=0.60 s57=0.70 s58=0.86 s59=1.42 s0=1.91 s1=1.96 s2=2.70 s3=2.73 s4=2.79 s5=2.87 
[DRIVE STUCK] Marked front sectors [55, 56, 57, 58, 59, 0, 1, 2, 3, 4, 5] as blocked for 30s

[BACKUP CLEAR] Reversing and turning toward clearer side...
[BACKUP CLEAR] Turning left (L_avg=2.61m R_avg=0.82m)

[ 70.7s] [GOAL SELECT] robot@(1.51,3.22) | 22 candidates (scanned=226 walls=121 visited=16):
  #1 ang=-119° d=2.00m pos=(3.27,2.26) score=+31.5 [O=+1.9 U=+32.0 V=-0.0 W=-3.0 R=-0.0 F=+0.0] <-- BEST
  #2 ang=-119° d=1.50m pos=(2.83,2.50) score=+26.2 [O=+2.4 U=+24.3 V=-0.0 W=-1.0 R=-0.0 F=+0.0]
  #3 ang=-125° d=1.50m pos=(2.74,2.37) score=+22.1 [O=+1.9 U=+20.7 V=-0.0 W=-1.0 R=-0.0 F=+0.0]
  #4 ang=-125° d=1.00m pos=(2.33,2.65) score=+10.6 [O=+2.4 U=+12.8 V=-0.0 W=-3.0 R=-2.0 F=+0.0]
  #5 ang=-119° d=0.50m pos=(1.95,2.98) score=+8.7 [O=+2.5 U=+9.0 V=-0.0 W=-1.0 R=-2.0 F=+0.0]
  #6 ang=-125° d=0.50m pos=(1.92,2.94) score=+5.0 [O=+2.5 U=+5.4 V=-0.0 W=-1.0 R=-2.0 F=+0.0]
  #7 ang= -21° d=1.50m pos=(2.04,4.62) score=-95.8 [O=+2.5 U=+32.2 V=-0.0 W=-3.0 R=-3.0 F=+0.0 B=-125.0]
  #8 ang= -21° d=0.50m pos=(1.69,3.69) score=-109.8 [O=+2.5 U=+18.6 V=-0.0 W=-3.0 R=-3.0 F=+0.0 B=-125.0]
[ 70.8s] [GOAL] Selected: (3.27, 2.26) dist=2.00m timeout=50s angle=-119° reason=no goal
[305] DRIVE goal=(3.27,2.26) dist=2.00m front=0.80m cells=16 rms=2.1cm[306] DRIVE goal=(3.27,2.26) dist=2.00m front=0.80m cells=16 rms=2.1cm[307] DRIVE goal=(3.27,2.26) dist=2.00m front=0.80m cells=16 rms=2.1cm[308] DRIVE goal=(3.27,2.26) dist=2.00m front=0.80m cells=16 rms=2.1cm[309] DRIVE goal=(3.27,2.26) dist=2.00m front=0.79m cells=16 rms=2.1cm[310] DRIVE goal=(3.27,2.26) dist=2.00m front=0.74m cells=16 rms=2.1cm[311] DRIVE goal=(3.27,2.26) dist=2.00m front=0.74m cells=16 rms=2.1cm[312] DRIVE goal=(3.27,2.26) dist=2.00m front=0.73m cells=16 rms=2.1cm[313] DRIVE goal=(3.27,2.26) dist=2.00m front=0.69m cells=16 rms=2.1cm[314] DRIVE goal=(3.27,2.26) dist=2.00m front=0.60m cells=16 rms=2.1cm[315] DRIVE goal=(3.27,2.26) dist=2.00m front=0.53m cells=16 rms=2.1cm[316] DRIVE goal=(3.27,2.26) dist=2.00m front=0.53m cells=16 rms=2.1cm[317] DRIVE goal=(3.27,2.26) dist=2.00m front=0.47m cells=16 rms=2.1cm[318] DRIVE goal=(3.27,2.26) dist=2.00m front=0.45m cells=16 rms=2.1cm[319] DRIVE goal=(3.27,2.26) dist=2.00m front=0.45m cells=16 rms=2.1cm[320] DRIVE goal=(3.27,2.26) dist=2.00m front=0.45m cells=16 rms=2.1cm[321] DRIVE goal=(3.27,2.26) dist=2.00m front=0.42m cells=16 rms=2.1cm[322] DRIVE goal=(3.27,2.26) dist=2.00m front=0.42m cells=16 rms=2.1cm[323] DRIVE goal=(3.27,2.26) dist=2.00m front=0.42m cells=16 rms=2.0cm[324] DRIVE goal=(3.27,2.26) dist=2.00m front=0.41m cells=16 rms=2.0cm[325] DRIVE goal=(3.27,2.26) dist=2.00m front=0.40m cells=16 rms=2.0cm[326] DRIVE goal=(3.27,2.26) dist=2.00m front=0.40m cells=16 rms=2.0cm[327] DRIVE goal=(3.27,2.26) dist=2.01m front=0.40m cells=16 rms=2.0cm[328] DRIVE goal=(3.27,2.26) dist=2.00m front=0.41m cells=16 rms=2.0cm[329] DRIVE goal=(3.27,2.26) dist=2.00m front=0.40m cells=16 rms=2.0cm[330] DRIVE goal=(3.27,2.26) dist=2.00m front=0.41m cells=16 rms=2.0cm[331] DRIVE goal=(3.27,2.26) dist=2.00m front=0.37m cells=16 rms=2.0cm[332] DRIVE goal=(3.27,2.26) dist=2.01m front=0.37m cells=16 rms=2.0cm[333] DRIVE goal=(3.27,2.26) dist=2.01m front=0.36m cells=16 rms=2.0cm[334] DRIVE goal=(3.27,2.26) dist=2.01m front=0.35m cells=16 rms=2.0cm[335] DRIVE goal=(3.27,2.26) dist=2.01m front=0.36m cells=17 rms=2.0cm[336] DRIVE goal=(3.27,2.26) dist=2.01m front=0.36m cells=17 rms=2.0cm[337] DRIVE goal=(3.27,2.26) dist=2.02m front=0.37m cells=17 rms=2.0cm[338] DRIVE goal=(3.27,2.26) dist=2.02m front=0.38m cells=17 rms=2.1cm[339] DRIVE goal=(3.27,2.26) dist=2.02m front=0.38m cells=17 rms=2.1cm[340] DRIVE goal=(3.27,2.26) dist=2.02m front=0.38m cells=17 rms=2.1cm[341] DRIVE goal=(3.27,2.26) dist=2.03m front=0.39m cells=17 rms=2.1cm[342] DRIVE goal=(3.27,2.26) dist=2.03m front=0.39m cells=17 rms=2.1cm[343] DRIVE goal=(3.27,2.26) dist=2.03m front=0.40m cells=17 rms=2.2cm[344] DRIVE goal=(3.27,2.26) dist=2.05m front=0.41m cells=17 rms=2.2cm[345] DRIVE goal=(3.27,2.26) dist=2.05m front=0.42m cells=17 rms=2.3cm[346] DRIVE goal=(3.27,2.26) dist=2.05m front=0.42m cells=17 rms=2.3cm[347] DRIVE goal=(3.27,2.26) dist=2.06m front=0.43m cells=17 rms=2.4cm[348] DRIVE goal=(3.27,2.26) dist=2.06m front=0.44m cells=17 rms=2.4cm[349] DRIVE goal=(3.27,2.26) dist=2.06m front=0.44m cells=17 rms=2.5cm[350] DRIVE goal=(3.27,2.26) dist=2.06m front=0.44m cells=17 rms=2.5cm[351] DRIVE goal=(3.27,2.26) dist=2.06m front=0.44m cells=17 rms=2.6cm[352] DRIVE goal=(3.27,2.26) dist=2.06m front=0.44m cells=17 rms=2.6cm[353] DRIVE goal=(3.27,2.26) dist=2.06m front=0.43m cells=17 rms=2.7cm[354] DRIVE goal=(3.27,2.26) dist=2.05m front=0.42m cells=17 rms=2.7cm[355] DRIVE goal=(3.27,2.26) dist=2.05m front=0.42m cells=17 rms=2.7cm[356] DRIVE goal=(3.27,2.26) dist=2.05m front=0.43m cells=17 rms=2.8cm[357] DRIVE goal=(3.27,2.26) dist=2.05m front=0.42m cells=17 rms=2.8cm[358] DRIVE goal=(3.27,2.26) dist=2.04m front=0.43m cells=17 rms=2.8cm[359] DRIVE goal=(3.27,2.26) dist=2.03m front=0.43m cells=17 rms=2.9cm[360] DRIVE goal=(3.27,2.26) dist=2.02m front=0.46m cells=17 rms=2.9cm[361] DRIVE goal=(3.27,2.26) dist=2.00m front=0.65m cells=17 rms=2.9cm[362] DRIVE goal=(3.27,2.26) dist=1.98m front=0.57m cells=17 rms=2.9cm[363] DRIVE goal=(3.27,2.26) dist=1.97m front=0.37m cells=17 rms=3.0cm[364] DRIVE goal=(3.27,2.26) dist=1.94m front=0.40m cells=17 rms=3.0cm[365] DRIVE goal=(3.27,2.26) dist=1.92m front=0.48m cells=17 rms=3.0cm[366] DRIVE goal=(3.27,2.26) dist=1.89m front=0.40m cells=17 rms=3.0cm[367] DRIVE goal=(3.27,2.26) dist=1.88m front=0.41m cells=17 rms=3.1cm[368] DRIVE goal=(3.27,2.26) dist=1.85m front=0.64m cells=17 rms=3.1cm[369] DRIVE goal=(3.27,2.26) dist=1.85m front=0.60m cells=17 rms=3.1cm[370] DRIVE goal=(3.27,2.26) dist=1.83m front=0.81m cells=17 rms=3.1cm[371] DRIVE goal=(3.27,2.26) dist=1.81m front=0.52m cells=17 rms=3.1cm[372] DRIVE goal=(3.27,2.26) dist=1.80m front=0.48m cells=17 rms=3.2cm[373] DRIVE goal=(3.27,2.26) dist=1.78m front=0.44m cells=17 rms=3.2cm[374] DRIVE goal=(3.27,2.26) dist=1.76m front=0.37m cells=17 rms=3.2cm[375] DRIVE goal=(3.27,2.26) dist=1.75m front=0.37m cells=17 rms=3.2cm[376] DRIVE goal=(3.27,2.26) dist=1.72m front=0.47m cells=17 rms=3.2cm[377] DRIVE goal=(3.27,2.26) dist=1.71m front=0.47m cells=17 rms=3.2cm[378] DRIVE goal=(3.27,2.26) dist=1.69m front=0.36m cells=17 rms=3.2cm[379] DRIVE goal=(3.27,2.26) dist=1.67m front=0.36m cells=17 rms=3.2cm[380] DRIVE goal=(3.27,2.26) dist=1.66m front=0.45m cells=17 rms=3.2cm[381] DRIVE goal=(3.27,2.26) dist=1.64m front=0.58m cells=18 rms=3.2cm[382] DRIVE goal=(3.27,2.26) dist=1.63m front=0.59m cells=18 rms=3.2cm[383] DRIVE goal=(3.27,2.26) dist=1.61m front=0.48m cells=18 rms=3.2cm[384] DRIVE goal=(3.27,2.26) dist=1.60m front=0.48m cells=18 rms=3.2cm[385] DRIVE goal=(3.27,2.26) dist=1.57m front=0.66m cells=19 rms=3.2cm[386] DRIVE goal=(3.27,2.26) dist=1.55m front=0.66m cells=19 rms=3.2cm[387] DRIVE goal=(3.27,2.26) dist=1.54m front=0.97m cells=19 rms=3.2cm[388] DRIVE goal=(3.27,2.26) dist=1.52m front=0.91m cells=19 rms=3.2cm[389] DRIVE goal=(3.27,2.26) dist=1.50m front=0.87m cells=19 rms=3.2cm[390] DRIVE goal=(3.27,2.26) dist=1.49m front=0.87m cells=19 rms=3.2cm[391] DRIVE goal=(3.27,2.26) dist=1.46m front=0.89m cells=19 rms=3.2cm[392] DRIVE goal=(3.27,2.26) dist=1.45m front=0.89m cells=19 rms=3.2cm[393] DRIVE goal=(3.27,2.26) dist=1.44m front=0.86m cells=19 rms=3.2cm[394] DRIVE goal=(3.27,2.26) dist=1.41m front=0.91m cells=19 rms=3.2cm[395] DRIVE goal=(3.27,2.26) dist=1.39m front=0.88m cells=19 rms=3.2cm[396] DRIVE goal=(3.27,2.26) dist=1.39m front=0.86m cells=19 rms=3.2cm[397] DRIVE goal=(3.27,2.26) dist=1.37m front=0.84m cells=19 rms=3.2cm[398] DRIVE goal=(3.27,2.26) dist=1.35m front=0.81m cells=19 rms=3.2cm[399] DRIVE goal=(3.27,2.26) dist=1.34m front=0.80m cells=19 rms=3.2cm[400] DRIVE goal=(3.27,2.26) dist=1.32m front=0.80m cells=19 rms=3.2cm[401] DRIVE goal=(3.27,2.26) dist=1.29m front=0.78m cells=20 rms=3.2cm[402] DRIVE goal=(3.27,2.26) dist=1.28m front=0.78m cells=20 rms=3.2cm[403] DRIVE goal=(3.27,2.26) dist=1.26m front=0.77m cells=20 rms=3.2cm[404] DRIVE goal=(3.27,2.26) dist=1.24m front=0.78m cells=20 rms=3.2cm[405] DRIVE goal=(3.27,2.26) dist=1.22m front=0.77m cells=20 rms=3.2cm[406] DRIVE goal=(3.27,2.26) dist=1.20m front=0.77m cells=20 rms=3.2cm[407] DRIVE goal=(3.27,2.26) dist=1.19m front=0.77m cells=20 rms=3.2cm[408] DRIVE goal=(3.27,2.26) dist=1.17m front=0.76m cells=20 rms=3.2cm[409] DRIVE goal=(3.27,2.26) dist=1.15m front=0.77m cells=20 rms=3.2cm[410] DRIVE goal=(3.27,2.26) dist=1.12m front=1.04m cells=20 rms=3.2cm[411] DRIVE goal=(3.27,2.26) dist=1.10m front=1.01m cells=20 rms=3.2cm[412] DRIVE goal=(3.27,2.26) dist=1.08m front=1.00m cells=20 rms=3.2cm[413] DRIVE goal=(3.27,2.26) dist=1.05m front=1.20m cells=20 rms=3.2cm[414] DRIVE goal=(3.27,2.26) dist=1.04m front=0.96m cells=20 rms=3.2cm[415] DRIVE goal=(3.27,2.26) dist=1.02m front=0.95m cells=20 rms=3.2cm[416] DRIVE goal=(3.27,2.26) dist=0.99m front=1.15m cells=20 rms=3.3cm[417] DRIVE goal=(3.27,2.26) dist=0.98m front=1.13m cells=21 rms=3.3cm[418] DRIVE goal=(3.27,2.26) dist=0.95m front=1.10m cells=22 rms=3.3cm[419] DRIVE goal=(3.27,2.26) dist=0.93m front=1.09m cells=22 rms=3.3cm[420] DRIVE goal=(3.27,2.26) dist=0.91m front=1.07m cells=22 rms=3.3cm[421] DRIVE goal=(3.27,2.26) dist=0.89m front=1.06m cells=22 rms=3.3cm[422] DRIVE goal=(3.27,2.26) dist=0.88m front=1.04m cells=22 rms=3.2cm[423] DRIVE goal=(3.27,2.26) dist=0.88m front=1.04m cells=22 rms=3.2cm[424] DRIVE goal=(3.27,2.26) dist=0.87m front=1.04m cells=22 rms=3.2cm[425] DRIVE goal=(3.27,2.26) dist=0.86m front=1.03m cells=22 rms=3.2cm[426] DRIVE goal=(3.27,2.26) dist=0.86m front=1.03m cells=22 rms=3.2cm[427] DRIVE goal=(3.27,2.26) dist=0.85m front=1.02m cells=22 rms=3.2cm[428] DRIVE goal=(3.27,2.26) dist=0.83m front=0.99m cells=22 rms=3.2cm[429] DRIVE goal=(3.27,2.26) dist=0.81m front=0.98m cells=22 rms=3.2cm[430] DRIVE goal=(3.27,2.26) dist=0.81m front=0.97m cells=22 rms=3.2cm[431] DRIVE goal=(3.27,2.26) dist=0.80m front=0.97m cells=22 rms=3.2cm[432] DRIVE goal=(3.27,2.26) dist=0.78m front=0.98m cells=22 rms=3.2cm[433] DRIVE goal=(3.27,2.26) dist=0.78m front=1.19m cells=22 rms=3.2cm[434] DRIVE goal=(3.27,2.26) dist=0.76m front=1.18m cells=22 rms=3.2cm[435] DRIVE goal=(3.27,2.26) dist=0.75m front=1.17m cells=22 rms=3.2cm[436] DRIVE goal=(3.27,2.26) dist=0.73m front=1.14m cells=22 rms=3.2cm[437] DRIVE goal=(3.27,2.26) dist=0.71m front=1.12m cells=22 rms=3.2cm[438] DRIVE goal=(3.27,2.26) dist=0.68m front=0.86m cells=22 rms=3.2cm[439] DRIVE goal=(3.27,2.26) dist=0.67m front=0.85m cells=22 rms=3.2cm[440] DRIVE goal=(3.27,2.26) dist=0.65m front=1.07m cells=23 rms=3.2cm[441] DRIVE goal=(3.27,2.26) dist=0.64m front=1.07m cells=23 rms=3.2cm[442] DRIVE goal=(3.27,2.26) dist=0.62m front=1.05m cells=23 rms=3.2cm[443] DRIVE goal=(3.27,2.26) dist=0.61m front=1.04m cells=23 rms=3.2cm[444] DRIVE goal=(3.27,2.26) dist=0.59m front=1.03m cells=23 rms=3.2cm[445] DRIVE goal=(3.27,2.26) dist=0.59m front=1.01m cells=23 rms=3.2cm[446] DRIVE goal=(3.27,2.26) dist=0.57m front=1.00m cells=23 rms=3.2cm[447] DRIVE goal=(3.27,2.26) dist=0.55m front=0.98m cells=23 rms=3.2cm[448] DRIVE goal=(3.27,2.26) dist=0.54m front=0.97m cells=23 rms=3.2cm[449] DRIVE goal=(3.27,2.26) dist=0.52m front=0.96m cells=23 rms=3.2cm[450] DRIVE goal=(3.27,2.26) dist=0.49m front=0.93m cells=23 rms=3.2cm[451] DRIVE goal=(3.27,2.26) dist=0.47m front=0.92m cells=23 rms=3.2cm[452] DRIVE goal=(3.27,2.26) dist=0.45m front=0.89m cells=23 rms=3.2cm[453] DRIVE goal=(3.27,2.26) dist=0.42m front=0.87m cells=23 rms=3.2cm[454] DRIVE goal=(3.27,2.26) dist=0.41m front=0.85m cells=23 rms=3.2cm
[101.4s] [GOAL SELECT] robot@(2.93,2.47) | 16 candidates (scanned=317 walls=192 visited=23):
  #1 ang=  -9° d=1.00m pos=(3.73,1.87) score=+38.4 [O=+2.0 U=+38.0 V=-0.0 W=-3.0 R=-0.0 F=+1.1] <-- BEST
  #2 ang= -21° d=1.50m pos=(3.91,1.33) score=+37.3 [O=+1.8 U=+38.0 V=-0.0 W=-3.0 R=-0.0 F=+0.1]
  #3 ang=  -3° d=1.00m pos=(3.79,1.96) score=+36.9 [O=+1.9 U=+36.1 V=-0.0 W=-3.0 R=-0.0 F=+1.6]
  #4 ang=  +9° d=1.00m pos=(3.88,2.15) score=+33.3 [O=+1.7 U=+34.1 V=-0.0 W=-3.0 R=-2.4 F=+2.6]
  #5 ang=+107° d=1.00m pos=(3.12,3.45) score=+25.1 [O=+1.9 U=+22.0 V=-0.0 W=-3.0 R=-0.0 F=+3.9]
  #6 ang=+101° d=1.00m pos=(3.22,3.43) score=+23.3 [O=+1.8 U=+20.0 V=-0.0 W=-3.0 R=-0.0 F=+4.2]
  #7 ang=+113° d=1.00m pos=(3.01,3.47) score=+20.8 [O=+2.5 U=+17.5 V=-0.0 W=-3.0 R=-0.0 F=+3.5]
  #8 ang= -21° d=0.50m pos=(3.26,2.09) score=+18.8 [O=+2.5 U=+24.0 V=-0.0 W=-3.0 R=-4.9 F=+0.1]
[101.4s] [GOAL] Selected: (3.73, 1.87) dist=1.00m timeout=35s angle=-9° reason=reached
[455] DRIVE goal=(3.73,1.87) dist=1.00m front=0.84m cells=23 rms=3.1cm[456] DRIVE goal=(3.73,1.87) dist=0.96m front=0.81m cells=23 rms=3.1cm[457] DRIVE goal=(3.73,1.87) dist=0.96m front=0.81m cells=23 rms=3.1cm[458] DRIVE goal=(3.73,1.87) dist=0.94m front=0.79m cells=23 rms=3.1cm[459] DRIVE goal=(3.73,1.87) dist=0.91m front=0.77m cells=24 rms=3.1cm[460] DRIVE goal=(3.73,1.87) dist=0.91m front=0.75m cells=24 rms=3.1cm[461] DRIVE goal=(3.73,1.87) dist=0.89m front=0.74m cells=24 rms=3.1cm[462] DRIVE goal=(3.73,1.87) dist=0.87m front=0.72m cells=24 rms=3.1cm[463] DRIVE goal=(3.73,1.87) dist=0.83m front=0.70m cells=25 rms=3.1cm[464] DRIVE goal=(3.73,1.87) dist=0.80m front=0.66m cells=25 rms=3.1cm[465] DRIVE goal=(3.73,1.87) dist=0.77m front=0.64m cells=25 rms=3.1cm[466] DRIVE goal=(3.73,1.87) dist=0.74m front=0.61m cells=25 rms=3.1cm[467] DRIVE goal=(3.73,1.87) dist=0.73m front=0.60m cells=25 rms=3.1cm[468] DRIVE goal=(3.73,1.87) dist=0.72m front=0.58m cells=25 rms=3.1cm[469] DRIVE goal=(3.73,1.87) dist=0.68m front=0.55m cells=25 rms=3.1cm[470] DRIVE goal=(3.73,1.87) dist=0.66m front=0.53m cells=25 rms=3.1cm[471] DRIVE goal=(3.73,1.87) dist=0.63m front=0.51m cells=25 rms=3.1cm[472] DRIVE goal=(3.73,1.87) dist=0.60m front=0.48m cells=25 rms=3.1cm[473] DRIVE goal=(3.73,1.87) dist=0.59m front=0.47m cells=25 rms=3.1cm[474] DRIVE goal=(3.73,1.87) dist=0.58m front=0.46m cells=25 rms=3.1cm[475] DRIVE goal=(3.73,1.87) dist=0.56m front=0.44m cells=25 rms=3.1cm[476] DRIVE goal=(3.73,1.87) dist=0.54m front=0.42m cells=25 rms=3.1cm[477] DRIVE goal=(3.73,1.87) dist=0.52m front=0.40m cells=26 rms=3.1cm[478] DRIVE goal=(3.73,1.87) dist=0.50m front=0.39m cells=26 rms=3.1cm[479] DRIVE goal=(3.73,1.87) dist=0.49m front=0.37m cells=26 rms=3.1cm[480] DRIVE goal=(3.73,1.87) dist=0.47m front=0.36m cells=26 rms=3.1cm[481] DRIVE goal=(3.73,1.87) dist=0.45m front=0.35m cells=26 rms=3.1cm[482] DRIVE goal=(3.73,1.87) dist=0.42m front=0.69m cells=26 rms=3.1cm
[107.3s] [GOAL SELECT] robot@(3.40,2.09) | 15 candidates (scanned=337 walls=205 visited=27):
  #1 ang=  -9° d=1.00m pos=(4.07,1.35) score=+39.8 [O=+1.6 U=+40.0 V=-0.0 W=-3.0 R=-0.0 F=+0.9] <-- BEST
  #2 ang= -15° d=1.00m pos=(3.99,1.28) score=+37.5 [O=+1.8 U=+38.0 V=-0.0 W=-3.0 R=-0.0 F=+0.4]
  #3 ang= -27° d=1.00m pos=(3.81,1.17) score=+35.7 [O=+1.0 U=+38.0 V=-0.0 W=-3.0 R=-0.0 F=-0.7]
  #4 ang= -21° d=1.00m pos=(3.90,1.22) score=+33.2 [O=+2.0 U=+34.0 V=-0.0 W=-3.0 R=-0.0 F=-0.1]
  #5 ang= -58° d=1.00m pos=(3.28,1.10) score=+28.2 [O=+2.0 U=+32.0 V=-0.0 W=-3.0 R=-0.0 F=-3.1]
  #6 ang= +27° d=0.50m pos=(3.89,1.99) score=+26.9 [O=+1.6 U=+38.0 V=-0.0 W=-3.0 R=-13.5 F=+3.7]
  #7 ang= -82° d=1.00m pos=(2.88,1.24) score=+26.6 [O=+1.7 U=+32.0 V=-0.0 W=-3.0 R=-0.0 F=-4.4]
  #8 ang= +21° d=0.50m pos=(3.88,1.94) score=+26.6 [O=+1.6 U=+38.0 V=-0.0 W=-3.0 R=-13.5 F=+3.3]
[107.3s] [GOAL] Selected: (4.07, 1.35) dist=1.00m timeout=35s angle=-9° reason=reached
[483] DRIVE goal=(4.07,1.35) dist=1.00m front=0.66m cells=27 rms=3.1cm[484] DRIVE goal=(4.07,1.35) dist=0.99m front=0.64m cells=27 rms=3.1cm[485] DRIVE goal=(4.07,1.35) dist=0.97m front=0.64m cells=27 rms=3.1cm[486] DRIVE goal=(4.07,1.35) dist=0.96m front=0.62m cells=27 rms=3.1cm[487] DRIVE goal=(4.07,1.35) dist=0.94m front=0.60m cells=27 rms=3.1cm[488] DRIVE goal=(4.07,1.35) dist=0.94m front=0.61m cells=27 rms=3.1cm[489] DRIVE goal=(4.07,1.35) dist=0.94m front=0.60m cells=27 rms=3.1cm[490] DRIVE goal=(4.07,1.35) dist=0.93m front=0.60m cells=27 rms=3.0cm[491] DRIVE goal=(4.07,1.35) dist=0.92m front=0.59m cells=27 rms=3.0cm[492] DRIVE goal=(4.07,1.35) dist=0.91m front=0.57m cells=27 rms=3.0cm[493] DRIVE goal=(4.07,1.35) dist=0.91m front=0.57m cells=27 rms=3.0cm[494] DRIVE goal=(4.07,1.35) dist=0.90m front=0.57m cells=27 rms=3.0cm[495] DRIVE goal=(4.07,1.35) dist=0.89m front=0.55m cells=27 rms=3.0cm[496] DRIVE goal=(4.07,1.35) dist=0.89m front=0.55m cells=27 rms=3.0cm[497] DRIVE goal=(4.07,1.35) dist=0.89m front=0.54m cells=27 rms=3.0cm[498] DRIVE goal=(4.07,1.35) dist=0.88m front=0.54m cells=27 rms=3.0cm[499] DRIVE goal=(4.07,1.35) dist=0.88m front=0.53m cells=27 rms=3.0cm[500] DRIVE goal=(4.07,1.35) dist=0.86m front=0.52m cells=27 rms=3.0cm[501] DRIVE goal=(4.07,1.35) dist=0.86m front=0.51m cells=27 rms=3.0cm[502] DRIVE goal=(4.07,1.35) dist=0.85m front=0.51m cells=27 rms=3.0cm[503] DRIVE goal=(4.07,1.35) dist=0.84m front=0.50m cells=27 rms=3.0cm[504] DRIVE goal=(4.07,1.35) dist=0.83m front=0.49m cells=27 rms=3.0cm[505] DRIVE goal=(4.07,1.35) dist=0.81m front=0.47m cells=27 rms=3.0cm[506] DRIVE goal=(4.07,1.35) dist=0.80m front=0.46m cells=27 rms=3.0cm[507] DRIVE goal=(4.07,1.35) dist=0.78m front=0.44m cells=27 rms=3.0cm[508] DRIVE goal=(4.07,1.35) dist=0.75m front=0.42m cells=27 rms=3.0cm[509] DRIVE goal=(4.07,1.35) dist=0.73m front=0.38m cells=28 rms=3.0cm[510] DRIVE goal=(4.07,1.35) dist=0.71m front=0.37m cells=28 rms=3.0cm[511] DRIVE goal=(4.07,1.35) dist=0.69m front=0.36m cells=28 rms=3.0cm[512] DRIVE goal=(4.07,1.35) dist=0.67m front=0.34m cells=28 rms=3.0cm[513] DRIVE goal=(4.07,1.35) dist=0.66m front=0.33m cells=28 rms=3.0cm[514] DRIVE goal=(4.07,1.35) dist=0.65m front=0.32m cells=28 rms=3.0cm[515] DRIVE goal=(4.07,1.35) dist=0.64m front=0.90m cells=28 rms=3.0cm[516] DRIVE goal=(4.07,1.35) dist=0.63m front=0.86m cells=28 rms=3.0cm[517] DRIVE goal=(4.07,1.35) dist=0.61m front=0.85m cells=28 rms=3.0cm[518] DRIVE goal=(4.07,1.35) dist=0.61m front=0.83m cells=28 rms=3.0cm[519] DRIVE goal=(4.07,1.35) dist=0.57m front=0.80m cells=29 rms=3.0cm[520] DRIVE goal=(4.07,1.35) dist=0.54m front=0.78m cells=29 rms=3.0cm[521] DRIVE goal=(4.07,1.35) dist=0.52m front=0.75m cells=29 rms=3.0cm[522] DRIVE goal=(4.07,1.35) dist=0.48m front=0.71m cells=29 rms=3.0cm[523] DRIVE goal=(4.07,1.35) dist=0.47m front=0.65m cells=29 rms=3.0cm
[115.8s] [BACKUP] front=0.13m

[BACKUP] Reversing...
[BACKUP] Turning right (L_openings=5 R_openings=7)

[119.4s] [GOAL SELECT] robot@(3.72,1.70) | 10 candidates (scanned=347 walls=230 visited=29):
  #1 ang=-119° d=1.00m pos=(3.02,0.99) score=+30.6 [O=+1.7 U=+31.7 V=-0.0 W=-3.0 R=-0.0 F=+0.0] <-- BEST
  #2 ang= -33° d=0.50m pos=(4.05,1.33) score=+24.7 [O=+1.5 U=+38.0 V=-0.0 W=-3.0 R=-12.0 F=+0.0]
  #3 ang= -39° d=0.50m pos=(4.01,1.29) score=+22.9 [O=+1.7 U=+36.0 V=-0.0 W=-3.0 R=-12.0 F=+0.0]
  #4 ang= -45° d=0.50m pos=(3.96,1.27) score=+19.1 [O=+1.9 U=+32.0 V=-0.0 W=-3.0 R=-12.0 F=+0.0]
  #5 ang= -52° d=0.50m pos=(3.92,1.24) score=+17.4 [O=+2.2 U=+30.0 V=-0.0 W=-3.0 R=-12.0 F=+0.0]
  #6 ang=+101° d=0.50m pos=(3.76,2.20) score=+2.3 [O=+1.8 U=+11.2 V=-0.0 W=-3.0 R=-7.9 F=+0.0]
  #7 ang= +88° d=0.50m pos=(3.86,2.18) score=-1.2 [O=+2.5 U=+7.1 V=-0.0 W=-3.0 R=-7.9 F=+0.0]
  #8 ang=+107° d=0.50m pos=(3.71,2.20) score=-3.4 [O=+1.8 U=+5.5 V=-0.0 W=-3.0 R=-7.9 F=+0.0]
[119.4s] [GOAL] Selected: (3.02, 0.99) dist=1.00m timeout=35s angle=-119° reason=no goal
[525] DRIVE goal=(3.02,0.99) dist=1.00m front=0.21m cells=29 rms=3.0cm[526] DRIVE goal=(3.02,0.99) dist=1.00m front=0.21m cells=29 rms=3.0cm[527] DRIVE goal=(3.02,0.99) dist=1.00m front=0.21m cells=29 rms=3.0cm[528] DRIVE goal=(3.02,0.99) dist=0.99m front=0.21m cells=29 rms=3.0cm[529] DRIVE goal=(3.02,0.99) dist=0.99m front=0.21m cells=29 rms=3.0cm[530] DRIVE goal=(3.02,0.99) dist=0.99m front=0.21m cells=29 rms=3.0cm[531] DRIVE goal=(3.02,0.99) dist=0.99m front=0.21m cells=29 rms=3.0cm[532] DRIVE goal=(3.02,0.99) dist=0.99m front=0.21m cells=29 rms=3.0cm[533] DRIVE goal=(3.02,0.99) dist=0.99m front=0.21m cells=29 rms=3.0cm[534] DRIVE goal=(3.02,0.99) dist=0.99m front=0.21m cells=29 rms=3.0cm[535] DRIVE goal=(3.02,0.99) dist=0.99m front=0.21m cells=29 rms=3.0cm[536] DRIVE goal=(3.02,0.99) dist=0.99m front=0.21m cells=29 rms=3.0cm[537] DRIVE goal=(3.02,0.99) dist=0.99m front=0.22m cells=29 rms=3.0cm[538] DRIVE goal=(3.02,0.99) dist=0.99m front=0.22m cells=29 rms=3.0cm[539] DRIVE goal=(3.02,0.99) dist=0.99m front=0.22m cells=29 rms=3.0cm[540] DRIVE goal=(3.02,0.99) dist=0.99m front=0.22m cells=29 rms=3.0cm[541] DRIVE goal=(3.02,0.99) dist=0.98m front=0.22m cells=29 rms=3.0cm[542] DRIVE goal=(3.02,0.99) dist=0.99m front=0.22m cells=29 rms=3.0cm[543] DRIVE goal=(3.02,0.99) dist=0.99m front=0.22m cells=29 rms=3.0cm[544] DRIVE goal=(3.02,0.99) dist=0.98m front=0.22m cells=29 rms=3.0cm[545] DRIVE goal=(3.02,0.99) dist=0.98m front=0.22m cells=29 rms=3.0cm[546] DRIVE goal=(3.02,0.99) dist=0.98m front=0.22m cells=29 rms=3.0cm[547] DRIVE goal=(3.02,0.99) dist=0.98m front=0.23m cells=29 rms=3.0cm[548] DRIVE goal=(3.02,0.99) dist=0.98m front=0.23m cells=29 rms=3.0cm[549] DRIVE goal=(3.02,0.99) dist=0.98m front=0.23m cells=29 rms=3.0cm[550] DRIVE goal=(3.02,0.99) dist=0.98m front=0.23m cells=29 rms=3.0cm[551] DRIVE goal=(3.02,0.99) dist=0.98m front=0.23m cells=29 rms=3.0cm[552] DRIVE goal=(3.02,0.99) dist=0.97m front=0.23m cells=29 rms=3.0cm[553] DRIVE goal=(3.02,0.99) dist=0.97m front=0.23m cells=29 rms=3.0cm[554] DRIVE goal=(3.02,0.99) dist=0.97m front=0.24m cells=29 rms=3.0cm[555] DRIVE goal=(3.02,0.99) dist=0.96m front=0.24m cells=29 rms=3.0cm[556] DRIVE goal=(3.02,0.99) dist=0.96m front=0.24m cells=29 rms=3.0cm[557] DRIVE goal=(3.02,0.99) dist=0.96m front=0.24m cells=29 rms=3.0cm[558] DRIVE goal=(3.02,0.99) dist=0.96m front=0.24m cells=29 rms=3.0cm[559] DRIVE goal=(3.02,0.99) dist=0.96m front=0.24m cells=29 rms=3.0cm[560] DRIVE goal=(3.02,0.99) dist=0.96m front=0.24m cells=29 rms=3.0cm[561] DRIVE goal=(3.02,0.99) dist=0.96m front=0.24m cells=29 rms=3.0cm[562] DRIVE goal=(3.02,0.99) dist=0.96m front=0.25m cells=29 rms=3.0cm[563] DRIVE goal=(3.02,0.99) dist=0.96m front=0.25m cells=29 rms=3.0cm[564] DRIVE goal=(3.02,0.99) dist=0.96m front=0.25m cells=29 rms=3.0cm[565] DRIVE goal=(3.02,0.99) dist=0.96m front=0.25m cells=29 rms=3.0cm[566] DRIVE goal=(3.02,0.99) dist=0.96m front=0.26m cells=29 rms=3.0cm[567] DRIVE goal=(3.02,0.99) dist=0.96m front=0.26m cells=29 rms=3.0cm[568] DRIVE goal=(3.02,0.99) dist=0.96m front=0.26m cells=29 rms=3.0cm[569] DRIVE goal=(3.02,0.99) dist=0.95m front=0.26m cells=29 rms=3.0cm[570] DRIVE goal=(3.02,0.99) dist=0.95m front=0.26m cells=29 rms=3.0cm[571] DRIVE goal=(3.02,0.99) dist=0.95m front=0.27m cells=29 rms=3.0cm[572] DRIVE goal=(3.02,0.99) dist=0.95m front=0.27m cells=29 rms=3.0cm[573] DRIVE goal=(3.02,0.99) dist=0.95m front=0.27m cells=29 rms=3.0cm[574] DRIVE goal=(3.02,0.99) dist=0.95m front=0.27m cells=29 rms=3.0cm[575] DRIVE goal=(3.02,0.99) dist=0.95m front=0.27m cells=29 rms=3.0cm[576] DRIVE goal=(3.02,0.99) dist=0.95m front=0.27m cells=29 rms=3.0cm[577] DRIVE goal=(3.02,0.99) dist=0.95m front=0.27m cells=29 rms=3.0cm[578] DRIVE goal=(3.02,0.99) dist=0.95m front=0.27m cells=29 rms=3.0cm[579] DRIVE goal=(3.02,0.99) dist=0.95m front=0.27m cells=29 rms=3.0cm[580] DRIVE goal=(3.02,0.99) dist=0.95m front=0.28m cells=29 rms=3.0cm[581] DRIVE goal=(3.02,0.99) dist=0.95m front=0.28m cells=29 rms=3.0cm[582] DRIVE goal=(3.02,0.99) dist=0.95m front=0.28m cells=29 rms=3.0cm[583] DRIVE goal=(3.02,0.99) dist=0.94m front=0.28m cells=29 rms=3.0cm[584] DRIVE goal=(3.02,0.99) dist=0.94m front=0.28m cells=29 rms=3.0cm[585] DRIVE goal=(3.02,0.99) dist=0.94m front=0.28m cells=29 rms=3.0cm[586] DRIVE goal=(3.02,0.99) dist=0.94m front=0.28m cells=29 rms=3.0cm[587] DRIVE goal=(3.02,0.99) dist=0.94m front=0.28m cells=29 rms=3.0cm[588] DRIVE goal=(3.02,0.99) dist=0.94m front=0.28m cells=29 rms=3.0cm[589] DRIVE goal=(3.02,0.99) dist=0.94m front=0.28m cells=29 rms=3.0cm[590] DRIVE goal=(3.02,0.99) dist=0.94m front=0.28m cells=29 rms=3.0cm[591] DRIVE goal=(3.02,0.99) dist=0.94m front=0.29m cells=29 rms=3.0cm[592] DRIVE goal=(3.02,0.99) dist=0.93m front=0.29m cells=29 rms=3.0cm[593] DRIVE goal=(3.02,0.99) dist=0.93m front=0.29m cells=29 rms=3.1cm[594] DRIVE goal=(3.02,0.99) dist=0.93m front=0.29m cells=29 rms=3.1cm[595] DRIVE goal=(3.02,0.99) dist=0.93m front=0.29m cells=29 rms=3.1cm[596] DRIVE goal=(3.02,0.99) dist=0.93m front=0.30m cells=29 rms=3.1cm[597] DRIVE goal=(3.02,0.99) dist=0.93m front=0.30m cells=29 rms=3.1cm[598] DRIVE goal=(3.02,0.99) dist=0.92m front=0.30m cells=29 rms=3.1cm[599] DRIVE goal=(3.02,0.99) dist=0.92m front=0.31m cells=29 rms=3.1cm[600] DRIVE goal=(3.02,0.99) dist=0.92m front=0.31m cells=29 rms=3.1cm[601] DRIVE goal=(3.02,0.99) dist=0.92m front=0.31m cells=29 rms=3.1cm[602] DRIVE goal=(3.02,0.99) dist=0.92m front=0.32m cells=29 rms=3.1cm[603] DRIVE goal=(3.02,0.99) dist=0.92m front=0.32m cells=29 rms=3.2cm[604] DRIVE goal=(3.02,0.99) dist=0.91m front=0.32m cells=29 rms=3.2cm[605] DRIVE goal=(3.02,0.99) dist=0.91m front=0.33m cells=30 rms=3.2cm[606] DRIVE goal=(3.02,0.99) dist=0.91m front=0.33m cells=30 rms=3.2cm[607] DRIVE goal=(3.02,0.99) dist=0.91m front=0.33m cells=30 rms=3.2cm[608] DRIVE goal=(3.02,0.99) dist=0.91m front=0.33m cells=30 rms=3.3cm[609] DRIVE goal=(3.02,0.99) dist=0.91m front=0.34m cells=30 rms=3.3cm[610] DRIVE goal=(3.02,0.99) dist=0.90m front=0.34m cells=30 rms=3.3cm[611] DRIVE goal=(3.02,0.99) dist=0.90m front=0.34m cells=30 rms=3.3cm[612] DRIVE goal=(3.02,0.99) dist=0.90m front=0.34m cells=30 rms=3.3cm[613] DRIVE goal=(3.02,0.99) dist=0.90m front=0.35m cells=30 rms=3.4cm[614] DRIVE goal=(3.02,0.99) dist=0.90m front=0.35m cells=30 rms=3.4cm[615] DRIVE goal=(3.02,0.99) dist=0.90m front=0.34m cells=30 rms=3.4cm[616] DRIVE goal=(3.02,0.99) dist=0.90m front=0.34m cells=30 rms=3.4cm[617] DRIVE goal=(3.02,0.99) dist=0.90m front=0.35m cells=30 rms=3.4cm[618] DRIVE goal=(3.02,0.99) dist=0.90m front=0.35m cells=30 rms=3.5cm[619] DRIVE goal=(3.02,0.99) dist=0.90m front=0.35m cells=30 rms=3.5cm[620] DRIVE goal=(3.02,0.99) dist=0.90m front=0.35m cells=30 rms=3.5cm[621] DRIVE goal=(3.02,0.99) dist=0.90m front=0.35m cells=30 rms=3.5cm[622] DRIVE goal=(3.02,0.99) dist=0.90m front=0.35m cells=30 rms=3.5cm[623] DRIVE goal=(3.02,0.99) dist=0.90m front=0.35m cells=30 rms=3.6cm[624] DRIVE goal=(3.02,0.99) dist=0.90m front=0.35m cells=30 rms=3.6cm[625] DRIVE goal=(3.02,0.99) dist=0.90m front=0.34m cells=30 rms=3.6cm[626] DRIVE goal=(3.02,0.99) dist=0.90m front=0.35m cells=30 rms=3.6cm[627] DRIVE goal=(3.02,0.99) dist=0.90m front=0.35m cells=30 rms=3.7cm[628] DRIVE goal=(3.02,0.99) dist=0.90m front=0.35m cells=30 rms=3.7cm[629] DRIVE goal=(3.02,0.99) dist=0.90m front=0.34m cells=30 rms=3.7cm[630] DRIVE goal=(3.02,0.99) dist=0.90m front=0.35m cells=30 rms=3.7cm[631] DRIVE goal=(3.02,0.99) dist=0.90m front=0.35m cells=30 rms=3.7cm[632] DRIVE goal=(3.02,0.99) dist=0.90m front=0.35m cells=30 rms=3.7cm[633] DRIVE goal=(3.02,0.99) dist=0.90m front=0.35m cells=30 rms=3.8cm[634] DRIVE goal=(3.02,0.99) dist=0.90m front=0.35m cells=30 rms=3.8cm[635] DRIVE goal=(3.02,0.99) dist=0.90m front=0.35m cells=30 rms=3.8cm[636] DRIVE goal=(3.02,0.99) dist=0.90m front=0.35m cells=30 rms=3.8cm[637] DRIVE goal=(3.02,0.99) dist=0.90m front=0.35m cells=30 rms=3.8cm[638] DRIVE goal=(3.02,0.99) dist=0.90m front=0.35m cells=30 rms=3.9cm[639] DRIVE goal=(3.02,0.99) dist=0.90m front=0.35m cells=30 rms=3.9cm[640] DRIVE goal=(3.02,0.99) dist=0.90m front=0.35m cells=30 rms=3.9cm[641] DRIVE goal=(3.02,0.99) dist=0.90m front=0.35m cells=30 rms=3.9cm[642] DRIVE goal=(3.02,0.99) dist=0.90m front=0.35m cells=30 rms=3.9cm[643] DRIVE goal=(3.02,0.99) dist=0.90m front=0.35m cells=30 rms=3.9cm[644] DRIVE goal=(3.02,0.99) dist=0.90m front=0.35m cells=30 rms=4.0cm[645] DRIVE goal=(3.02,0.99) dist=0.90m front=0.35m cells=30 rms=4.0cm[646] DRIVE goal=(3.02,0.99) dist=0.90m front=0.35m cells=30 rms=4.0cm[647] DRIVE goal=(3.02,0.99) dist=0.90m front=0.35m cells=30 rms=4.0cm[648] DRIVE goal=(3.02,0.99) dist=0.90m front=0.35m cells=30 rms=4.0cm[649] DRIVE goal=(3.02,0.99) dist=0.90m front=0.35m cells=30 rms=4.0cm[650] DRIVE goal=(3.02,0.99) dist=0.90m front=0.35m cells=30 rms=4.0cm[651] DRIVE goal=(3.02,0.99) dist=0.90m front=0.35m cells=30 rms=4.1cm[652] DRIVE goal=(3.02,0.99) dist=0.90m front=0.35m cells=30 rms=4.1cm[653] DRIVE goal=(3.02,0.99) dist=0.90m front=0.35m cells=30 rms=4.1cm[654] DRIVE goal=(3.02,0.99) dist=0.90m front=0.35m cells=30 rms=4.1cm[655] DRIVE goal=(3.02,0.99) dist=0.89m front=0.35m cells=30 rms=4.1cm[656] DRIVE goal=(3.02,0.99) dist=0.90m front=0.35m cells=30 rms=4.1cm[657] DRIVE goal=(3.02,0.99) dist=0.90m front=0.35m cells=30 rms=4.2cm[658] DRIVE goal=(3.02,0.99) dist=0.90m front=0.35m cells=30 rms=4.2cm[659] DRIVE goal=(3.02,0.99) dist=0.90m front=0.35m cells=30 rms=4.2cm[660] DRIVE goal=(3.02,0.99) dist=0.90m front=0.35m cells=30 rms=4.2cm[661] DRIVE goal=(3.02,0.99) dist=0.90m front=0.35m cells=30 rms=4.2cm[662] DRIVE goal=(3.02,0.99) dist=0.90m front=0.35m cells=30 rms=4.2cm[663] DRIVE goal=(3.02,0.99) dist=0.90m front=0.35m cells=30 rms=4.2cm[664] DRIVE goal=(3.02,0.99) dist=0.90m front=0.34m cells=30 rms=4.2cm[665] DRIVE goal=(3.02,0.99) dist=0.90m front=0.35m cells=30 rms=4.3cm[666] DRIVE goal=(3.02,0.99) dist=0.90m front=0.35m cells=30 rms=4.3cm[667] DRIVE goal=(3.02,0.99) dist=0.90m front=0.35m cells=30 rms=4.3cm[668] DRIVE goal=(3.02,0.99) dist=0.90m front=0.35m cells=30 rms=4.3cm[669] DRIVE goal=(3.02,0.99) dist=0.90m front=0.35m cells=30 rms=4.3cm[670] DRIVE goal=(3.02,0.99) dist=0.90m front=0.35m cells=30 rms=4.3cm[671] DRIVE goal=(3.02,0.99) dist=0.90m front=0.35m cells=30 rms=4.3cm[672] DRIVE goal=(3.02,0.99) dist=0.90m front=0.35m cells=30 rms=4.4cm[673] DRIVE goal=(3.02,0.99) dist=0.90m front=0.35m cells=30 rms=4.4cm[674] DRIVE goal=(3.02,0.99) dist=0.90m front=0.35m cells=30 rms=4.4cm[675] DRIVE goal=(3.02,0.99) dist=0.90m front=0.35m cells=30 rms=4.4cm[676] DRIVE goal=(3.02,0.99) dist=0.90m front=0.35m cells=30 rms=4.4cm[677] DRIVE goal=(3.02,0.99) dist=0.90m front=0.35m cells=30 rms=4.4cm[678] DRIVE goal=(3.02,0.99) dist=0.90m front=0.35m cells=30 rms=4.4cm[679] DRIVE goal=(3.02,0.99) dist=0.90m front=0.34m cells=30 rms=4.5cm[680] DRIVE goal=(3.02,0.99) dist=0.90m front=0.35m cells=30 rms=4.5cm[681] DRIVE goal=(3.02,0.99) dist=0.90m front=0.35m cells=30 rms=4.5cm[682] DRIVE goal=(3.02,0.99) dist=0.90m front=0.35m cells=30 rms=4.5cm[683] DRIVE goal=(3.02,0.99) dist=0.90m front=0.35m cells=30 rms=4.5cm[684] DRIVE goal=(3.02,0.99) dist=0.90m front=0.35m cells=30 rms=4.5cm[685] DRIVE goal=(3.02,0.99) dist=0.90m front=0.35m cells=30 rms=4.5cm[686] DRIVE goal=(3.02,0.99) dist=0.90m front=0.35m cells=30 rms=4.5cm[687] DRIVE goal=(3.02,0.99) dist=0.90m front=0.35m cells=30 rms=4.6cm[688] DRIVE goal=(3.02,0.99) dist=0.90m front=0.35m cells=30 rms=4.6cm[689] DRIVE goal=(3.02,0.99) dist=0.90m front=0.35m cells=30 rms=4.6cm[690] DRIVE goal=(3.02,0.99) dist=0.90m front=0.35m cells=30 rms=4.6cm[691] DRIVE goal=(3.02,0.99) dist=0.90m front=0.35m cells=30 rms=4.6cm[692] DRIVE goal=(3.02,0.99) dist=0.90m front=0.35m cells=30 rms=4.6cm[693] DRIVE goal=(3.02,0.99) dist=0.90m front=0.35m cells=30 rms=4.6cm[694] DRIVE goal=(3.02,0.99) dist=0.90m front=0.35m cells=30 rms=4.6cm[695] DRIVE goal=(3.02,0.99) dist=0.90m front=0.35m cells=30 rms=4.6cm
[154.4s] [GOAL SELECT] robot@(3.58,1.69) | 10 candidates (scanned=347 walls=233 visited=30):
  #1 ang= -15° d=0.50m pos=(3.99,1.42) score=+38.0 [O=+1.5 U=+40.0 V=-0.0 W=-3.0 R=-3.2 F=+2.6] <-- BEST
  #2 ang= -21° d=0.50m pos=(3.96,1.37) score=+35.6 [O=+1.6 U=+38.0 V=-0.0 W=-3.0 R=-3.2 F=+2.1]
  #3 ang= -27° d=0.50m pos=(3.93,1.33) score=+35.3 [O=+1.7 U=+38.0 V=-0.0 W=-3.0 R=-3.2 F=+1.6]
  #4 ang= -64° d=0.50m pos=(3.64,1.20) score=+20.6 [O=+2.2 U=+26.0 V=-0.0 W=-3.0 R=-3.2 F=-1.5]
  #5 ang=+101° d=0.50m pos=(3.64,2.19) score=+15.3 [O=+1.8 U=+14.8 V=-0.0 W=-3.0 R=-1.2 F=+2.7]
  #6 ang= +88° d=0.50m pos=(3.75,2.16) score=+15.1 [O=+2.5 U=+13.0 V=-0.0 W=-3.0 R=-1.2 F=+3.5]
  #7 ang= +70° d=0.50m pos=(3.89,2.09) score=+14.7 [O=+1.9 U=+14.0 V=-1.1 W=-3.0 R=-1.7 F=+4.5]
  #8 ang= +82° d=0.50m pos=(3.80,2.14) score=+14.5 [O=+2.5 U=+12.1 V=-0.0 W=-3.0 R=-1.2 F=+3.9]
[154.5s] [GOAL] Selected: (3.99, 1.42) dist=0.50m timeout=28s angle=-15° reason=timeout
[696] DRIVE goal=(3.99,1.42) dist=0.50m front=0.35m cells=30 rms=4.6cm[697] DRIVE goal=(3.99,1.42) dist=0.50m front=0.35m cells=30 rms=4.6cm[698] DRIVE goal=(3.99,1.42) dist=0.50m front=0.35m cells=30 rms=4.6cm[699] DRIVE goal=(3.99,1.42) dist=0.50m front=0.35m cells=30 rms=4.6cm[700] DRIVE goal=(3.99,1.42) dist=0.50m front=0.34m cells=30 rms=4.6cm[701] DRIVE goal=(3.99,1.42) dist=0.48m front=0.33m cells=30 rms=4.6cm[702] DRIVE goal=(3.99,1.42) dist=0.47m front=0.32m cells=30 rms=4.6cm[703] DRIVE goal=(3.99,1.42) dist=0.47m front=0.32m cells=30 rms=4.6cm[704] DRIVE goal=(3.99,1.42) dist=0.46m front=0.30m cells=30 rms=4.6cm[705] DRIVE goal=(3.99,1.42) dist=0.44m front=0.29m cells=30 rms=4.6cm[706] DRIVE goal=(3.99,1.42) dist=0.44m front=0.29m cells=30 rms=4.6cm[707] DRIVE goal=(3.99,1.42) dist=0.44m front=0.28m cells=30 rms=4.6cm[708] DRIVE goal=(3.99,1.42) dist=0.42m front=0.26m cells=30 rms=4.6cm[709] DRIVE goal=(3.99,1.42) dist=0.42m front=0.26m cells=30 rms=4.6cm[710] DRIVE goal=(3.99,1.42) dist=0.41m front=0.25m cells=30 rms=4.6cm[711] DRIVE goal=(3.99,1.42) dist=0.41m front=0.25m cells=30 rms=4.6cm[712] DRIVE goal=(3.99,1.42) dist=0.40m front=0.24m cells=30 rms=4.6cm
[158.0s] [GOAL SELECT] robot@(3.69,1.67) | 15 candidates (scanned=347 walls=233 visited=30):
  #1 ang= -70° d=0.50m pos=(3.71,1.17) score=+22.1 [O=+2.1 U=+32.0 V=-0.0 W=-3.0 R=-7.3 F=-1.9] <-- BEST
  #2 ang= -27° d=0.50m pos=(4.05,1.31) score=+22.0 [O=+1.5 U=+38.0 V=-0.0 W=-3.0 R=-16.4 F=+1.8]
  #3 ang= -52° d=0.50m pos=(3.87,1.20) score=+21.8 [O=+2.2 U=+30.0 V=-0.0 W=-3.0 R=-7.3 F=-0.3]
  #4 ang= -33° d=0.50m pos=(4.01,1.28) score=+21.6 [O=+1.6 U=+38.0 V=-0.0 W=-3.0 R=-16.4 F=+1.3]
  #5 ang= -64° d=0.50m pos=(3.77,1.17) score=+20.7 [O=+2.2 U=+30.0 V=-0.0 W=-3.0 R=-7.3 F=-1.4]
  #6 ang= -58° d=0.50m pos=(3.82,1.18) score=+20.6 [O=+1.6 U=+30.0 V=-0.0 W=-3.0 R=-7.3 F=-0.9]
  #7 ang= -76° d=0.50m pos=(3.66,1.17) score=+19.7 [O=+2.1 U=+30.0 V=-0.0 W=-3.0 R=-7.3 F=-2.4]
  #8 ang= -39° d=0.50m pos=(3.96,1.25) score=+19.3 [O=+1.8 U=+36.0 V=-0.0 W=-3.0 R=-16.4 F=+0.7]
[158.0s] [GOAL] Selected: (3.71, 1.17) dist=0.50m timeout=28s angle=-70° reason=reached
[713] DRIVE goal=(3.71,1.17) dist=0.50m front=0.23m cells=30 rms=4.6cm[714] DRIVE goal=(3.71,1.17) dist=0.50m front=0.21m cells=30 rms=4.6cm[715] DRIVE goal=(3.71,1.17) dist=0.50m front=0.21m cells=30 rms=4.6cm[716] DRIVE goal=(3.71,1.17) dist=0.50m front=0.20m cells=30 rms=4.6cm[717] DRIVE goal=(3.71,1.17) dist=0.50m front=0.20m cells=30 rms=4.6cm[718] DRIVE goal=(3.71,1.17) dist=0.50m front=0.20m cells=30 rms=4.6cm[719] DRIVE goal=(3.71,1.17) dist=0.50m front=0.21m cells=30 rms=4.6cm[720] DRIVE goal=(3.71,1.17) dist=0.50m front=0.21m cells=30 rms=4.6cm[721] DRIVE goal=(3.71,1.17) dist=0.50m front=0.22m cells=30 rms=4.6cm[722] DRIVE goal=(3.71,1.17) dist=0.51m front=0.23m cells=30 rms=4.6cm[723] DRIVE goal=(3.71,1.17) dist=0.51m front=0.23m cells=30 rms=4.6cm[724] DRIVE goal=(3.71,1.17) dist=0.51m front=0.24m cells=30 rms=4.6cm[725] DRIVE goal=(3.71,1.17) dist=0.51m front=0.25m cells=30 rms=4.6cm[726] DRIVE goal=(3.71,1.17) dist=0.51m front=0.25m cells=30 rms=4.6cm[727] DRIVE goal=(3.71,1.17) dist=0.51m front=0.26m cells=30 rms=4.6cm[728] DRIVE goal=(3.71,1.17) dist=0.51m front=0.26m cells=30 rms=4.6cm[729] DRIVE goal=(3.71,1.17) dist=0.51m front=0.27m cells=30 rms=4.6cm[730] DRIVE goal=(3.71,1.17) dist=0.51m front=0.28m cells=30 rms=4.6cm[731] DRIVE goal=(3.71,1.17) dist=0.52m front=0.28m cells=30 rms=4.6cm[732] DRIVE goal=(3.71,1.17) dist=0.51m front=0.28m cells=30 rms=4.6cm[733] DRIVE goal=(3.71,1.17) dist=0.52m front=0.28m cells=30 rms=4.6cm[734] DRIVE goal=(3.71,1.17) dist=0.52m front=0.29m cells=30 rms=4.6cm[735] DRIVE goal=(3.71,1.17) dist=0.52m front=0.29m cells=30 rms=4.6cm[736] DRIVE goal=(3.71,1.17) dist=0.52m front=0.29m cells=30 rms=4.6cm[737] DRIVE goal=(3.71,1.17) dist=0.52m front=0.30m cells=30 rms=4.6cm[738] DRIVE goal=(3.71,1.17) dist=0.52m front=0.30m cells=30 rms=4.6cm[739] DRIVE goal=(3.71,1.17) dist=0.52m front=0.30m cells=30 rms=4.6cm[740] DRIVE goal=(3.71,1.17) dist=0.52m front=0.30m cells=30 rms=4.6cm[741] DRIVE goal=(3.71,1.17) dist=0.52m front=0.31m cells=30 rms=4.6cm[742] DRIVE goal=(3.71,1.17) dist=0.52m front=0.32m cells=30 rms=4.6cm[743] DRIVE goal=(3.71,1.17) dist=0.53m front=0.33m cells=30 rms=4.6cm[744] DRIVE goal=(3.71,1.17) dist=0.53m front=0.33m cells=30 rms=4.6cm[745] DRIVE goal=(3.71,1.17) dist=0.53m front=0.33m cells=30 rms=4.6cm[746] DRIVE goal=(3.71,1.17) dist=0.53m front=0.33m cells=30 rms=4.7cm[747] DRIVE goal=(3.71,1.17) dist=0.53m front=0.33m cells=30 rms=4.7cm[748] DRIVE goal=(3.71,1.17) dist=0.53m front=0.33m cells=30 rms=4.7cm[749] DRIVE goal=(3.71,1.17) dist=0.53m front=0.34m cells=30 rms=4.7cm[750] DRIVE goal=(3.71,1.17) dist=0.53m front=0.35m cells=30 rms=4.7cm[751] DRIVE goal=(3.71,1.17) dist=0.53m front=0.34m cells=30 rms=4.7cm[752] DRIVE goal=(3.71,1.17) dist=0.53m front=0.34m cells=30 rms=4.7cm[753] DRIVE goal=(3.71,1.17) dist=0.53m front=0.35m cells=30 rms=4.8cm[754] DRIVE goal=(3.71,1.17) dist=0.54m front=0.35m cells=30 rms=4.8cm[755] DRIVE goal=(3.71,1.17) dist=0.53m front=0.35m cells=30 rms=4.8cm[756] DRIVE goal=(3.71,1.17) dist=0.54m front=0.35m cells=30 rms=4.8cm[757] DRIVE goal=(3.71,1.17) dist=0.53m front=0.35m cells=30 rms=4.8cm[758] DRIVE goal=(3.71,1.17) dist=0.53m front=0.35m cells=30 rms=4.8cm[759] DRIVE goal=(3.71,1.17) dist=0.54m front=0.35m cells=30 rms=4.9cm[760] DRIVE goal=(3.71,1.17) dist=0.54m front=0.35m cells=30 rms=4.9cm[761] DRIVE goal=(3.71,1.17) dist=0.53m front=0.35m cells=30 rms=4.9cm[762] DRIVE goal=(3.71,1.17) dist=0.54m front=0.35m cells=30 rms=4.9cm[763] DRIVE goal=(3.71,1.17) dist=0.53m front=0.35m cells=30 rms=4.9cm[764] DRIVE goal=(3.71,1.17) dist=0.53m front=0.35m cells=30 rms=4.9cm[765] DRIVE goal=(3.71,1.17) dist=0.54m front=0.35m cells=30 rms=5.0cm[766] DRIVE goal=(3.71,1.17) dist=0.54m front=0.35m cells=30 rms=5.0cm[767] DRIVE goal=(3.71,1.17) dist=0.54m front=0.35m cells=30 rms=5.0cm[768] DRIVE goal=(3.71,1.17) dist=0.54m front=0.35m cells=30 rms=5.0cm[769] DRIVE goal=(3.71,1.17) dist=0.53m front=0.35m cells=30 rms=5.0cm[770] DRIVE goal=(3.71,1.17) dist=0.53m front=0.35m cells=30 rms=5.0cm[771] DRIVE goal=(3.71,1.17) dist=0.53m front=0.35m cells=30 rms=5.1cm[772] DRIVE goal=(3.71,1.17) dist=0.54m front=0.35m cells=30 rms=5.1cm[773] DRIVE goal=(3.71,1.17) dist=0.54m front=0.35m cells=30 rms=5.1cm[774] DRIVE goal=(3.71,1.17) dist=0.54m front=0.35m cells=30 rms=5.1cm[775] DRIVE goal=(3.71,1.17) dist=0.54m front=0.35m cells=30 rms=5.1cm[776] DRIVE goal=(3.71,1.17) dist=0.54m front=0.35m cells=30 rms=5.1cm[777] DRIVE goal=(3.71,1.17) dist=0.54m front=0.35m cells=30 rms=5.2cm[778] DRIVE goal=(3.71,1.17) dist=0.54m front=0.35m cells=30 rms=5.2cm[779] DRIVE goal=(3.71,1.17) dist=0.54m front=0.35m cells=30 rms=5.2cm[780] DRIVE goal=(3.71,1.17) dist=0.54m front=0.35m cells=30 rms=5.2cm[781] DRIVE goal=(3.71,1.17) dist=0.53m front=0.34m cells=30 rms=5.2cm[782] DRIVE goal=(3.71,1.17) dist=0.54m front=0.35m cells=30 rms=5.2cm[783] DRIVE goal=(3.71,1.17) dist=0.53m front=0.35m cells=30 rms=5.3cm[784] DRIVE goal=(3.71,1.17) dist=0.53m front=0.35m cells=30 rms=5.3cm[785] DRIVE goal=(3.71,1.17) dist=0.53m front=0.34m cells=30 rms=5.3cm[786] DRIVE goal=(3.71,1.17) dist=0.54m front=0.35m cells=30 rms=5.3cm[787] DRIVE goal=(3.71,1.17) dist=0.54m front=0.35m cells=30 rms=5.3cm[788] DRIVE goal=(3.71,1.17) dist=0.54m front=0.35m cells=30 rms=5.3cm[789] DRIVE goal=(3.71,1.17) dist=0.54m front=0.35m cells=30 rms=5.3cm[790] DRIVE goal=(3.71,1.17) dist=0.54m front=0.35m cells=30 rms=5.4cm[791] DRIVE goal=(3.71,1.17) dist=0.54m front=0.34m cells=30 rms=5.4cm[792] DRIVE goal=(3.71,1.17) dist=0.54m front=0.35m cells=30 rms=5.4cm[793] DRIVE goal=(3.71,1.17) dist=0.53m front=0.35m cells=30 rms=5.4cmWaiting for LiDAR...


Stopping (Ctrl+C)...
[MARKER] Publisher stopped

=======================================================
NBV NAVIGATION COMPLETE
=======================================================
Final state: exploring
Duration: 175.1s
Iterations: 794
Goals reached: 6
Backups: 2
Unique cells visited: 30
Cells scanned by LiDAR: 347
Walls detected: 233

--- Drive Accuracy ---
Cross-track RMS error: 5.4cm
Total distance traveled: 8.05m
Ideal distance (sum of goals): 12.00m
Drive efficiency: 149.0%
Revisit rate: 100.0%

--- Map Accuracy Suggestions ---
To measure map accuracy, consider:
1. Ground truth comparison: Place markers at known positions,
   compare measured vs actual distances between them
2. Loop closure error: After returning to origin, check
   odometry drift (final_dist to origin should be ~0)
3. Feature alignment: Compare map walls to actual room layout
4. Consistency check: Run multiple times, overlay maps
5. Tape measure validation: Measure actual room dimensions,
   compare to map scale (resolution * pixels)
[OUTPUT] Map saved to: /home/ws/ugv_cont/mission/outputs/20251221_205052/maps
