[OUTPUT] Logging to: /home/ws/ugv_cont/mission/outputs/20251224_220844
[OUTPUT] Log file: /home/ws/ugv_cont/mission/outputs/20251224_220844/logs/navigation.log
=======================================================
NEXT-BEST-VIEW (NBV) NAVIGATION
=======================================================
Speed: 0.08 m/s
Goal distance: 0.5-2.0m
Press Ctrl+C to stop

[DEBUG] Marker publishing enabled - check /nav_goal in RViz
[MARKER] Persistent marker publisher started - add /nav_goal in RViz
[START] Initial position: (0.00, 0.00)
[START] Origin wall signature: ['0.58', '0.57', '0.56', '0.56', '0.56', '0.57', '0.58', '0.59', '1.01', '0.92', '0.84', '0.79', '0.60', '0.57', '0.55', '0.51', '0.49', '0.51', '0.55', '0.55', '0.54', '0.64', '0.68', '5.00', '5.00', '5.00', '5.00', '5.00', '5.00', '5.00', '5.00', '5.00', '5.00', '5.00', '5.00', '5.00', '5.00', '5.00', '0.75', '0.84', '1.75', '1.99', '3.69', '3.75', '5.16', '1.80', '1.80', '1.31', '1.32', '1.35', '1.39', '1.45', '0.93', '0.79', '0.73', '0.71', '0.65', '0.61', '0.59', '0.60']
[MARKER] Origin marker (blue) started at (0.00, 0.00) - add /nav_origin in RViz

[  3.8s] [GOAL SELECT] robot@(0.00,0.00) | 21 candidates (scanned=49 walls=21 visited=1):
  #1 ang=-107° d=2.00m pos=(0.65,1.89) score=+35.1 [O=+2.5 U=+32.0 V=-0.0 W=-0.0 R=-0.0 F=+0.0] <-- BEST
  #2 ang= -52° d=0.50m pos=(-0.29,0.40) score=+33.3 [O=+1.9 U=+37.2 V=-3.0 W=-3.0 R=-0.0 F=+0.0]
  #3 ang= -82° d=1.00m pos=(-0.09,1.00) score=+33.1 [O=+1.8 U=+34.0 V=-0.0 W=-3.0 R=-0.0 F=+0.0]
  #4 ang=-101° d=1.50m pos=(0.34,1.46) score=+30.0 [O=+2.5 U=+28.0 V=-0.0 W=-1.0 R=-0.0 F=+0.0]
  #5 ang= -88° d=1.00m pos=(0.01,1.00) score=+29.1 [O=+1.8 U=+30.0 V=-0.0 W=-3.0 R=-0.0 F=+0.0]
  #6 ang=-107° d=1.50m pos=(0.49,1.42) score=+26.0 [O=+2.5 U=+24.0 V=-0.0 W=-1.0 R=-0.0 F=+0.0]
  #7 ang= -94° d=1.00m pos=(0.12,0.99) score=+23.8 [O=+2.5 U=+24.0 V=-0.0 W=-3.0 R=-0.0 F=+0.0]
  #8 ang=-113° d=1.00m pos=(0.43,0.91) score=+23.3 [O=+2.0 U=+22.0 V=-0.0 W=-1.0 R=-0.0 F=+0.0]
[  3.8s] [GOAL] Selected: (0.65, 1.89) dist=2.00m timeout=50s angle=-107° reason=no goal
[  2] DRIVE goal=(0.65,1.89) dist=2.00m front=0.56m cells=1 rms=0.0cm[  3] DRIVE goal=(0.65,1.89) dist=2.00m front=0.56m cells=1 rms=0.0cm[  4] DRIVE goal=(0.65,1.89) dist=2.00m front=0.56m cells=1 rms=0.3cm[  5] DRIVE goal=(0.65,1.89) dist=2.01m front=0.55m cells=1 rms=1.0cm[  6] DRIVE goal=(0.65,1.89) dist=2.01m front=0.55m cells=1 rms=1.7cm[  7] DRIVE goal=(0.65,1.89) dist=2.01m front=0.55m cells=1 rms=1.7cm[  8] DRIVE goal=(0.65,1.89) dist=2.01m front=0.56m cells=1 rms=1.7cm[  9] DRIVE goal=(0.65,1.89) dist=2.01m front=0.56m cells=1 rms=1.7cm[ 10] DRIVE goal=(0.65,1.89) dist=2.01m front=0.56m cells=1 rms=1.6cm[ 11] DRIVE goal=(0.65,1.89) dist=2.01m front=0.57m cells=1 rms=1.5cm[ 12] DRIVE goal=(0.65,1.89) dist=2.01m front=0.57m cells=1 rms=1.5cm[ 13] DRIVE goal=(0.65,1.89) dist=2.00m front=0.58m cells=1 rms=2.0cm[ 14] DRIVE goal=(0.65,1.89) dist=2.01m front=0.58m cells=1 rms=2.2cm[ 15] DRIVE goal=(0.65,1.89) dist=2.00m front=0.59m cells=1 rms=2.3cm[ 16] DRIVE goal=(0.65,1.89) dist=2.00m front=0.60m cells=1 rms=2.6cm[ 17] DRIVE goal=(0.65,1.89) dist=2.01m front=0.62m cells=1 rms=2.7cm[ 18] DRIVE goal=(0.65,1.89) dist=2.00m front=0.65m cells=1 rms=2.7cm[ 19] DRIVE goal=(0.65,1.89) dist=2.00m front=0.67m cells=1 rms=2.9cm[ 20] DRIVE goal=(0.65,1.89) dist=1.99m front=0.69m cells=1 rms=3.2cm[ 21] DRIVE goal=(0.65,1.89) dist=2.00m front=0.72m cells=1 rms=3.4cm
[  8.2s] [TURN ENTER] Entering TURN mode

[BLOCKED DEBUG] Goal angle: -42.7° (sector 52), goal_dist: 2.00m, goal_dir_min: 1.80m, margin: 0.15m
[BLOCKED DEBUG] Checking 1 sectors (robot angular width at 2.0m = 5.1°): {52: 1.801}
[BLOCKED DEBUG] Check: 1.80 < 2.00 - 0.15 = 1.85? True
[BLOCKED DEBUG] (Full front arc for reference: {55: 3.718, 56: 5.111, 57: 1.766, 58: 1.264, 59: 1.281, 0: 1.295, 1: 1.326, 2: 1.371, 3: 1.432, 4: 0.903, 5: 0.764})

[BLOCKED TURN] goal_sector=52, best_sector=52 (dist=1.80m), target_angle=-48.0°, angle_error=-48.0°, v=0.00, w=-0.50
[ 22] TURN goal=(0.65,1.89) dist=2.00m front=0.76m cells=1 rms=3.5cm[ 23] TURN goal=(0.65,1.89) dist=2.00m front=0.77m cells=1 rms=3.6cm[ 24] TURN goal=(0.65,1.89) dist=2.00m front=0.75m cells=1 rms=3.7cm[ 25] TURN goal=(0.65,1.89) dist=2.00m front=0.77m cells=1 rms=3.7cm[ 26] TURN goal=(0.65,1.89) dist=2.00m front=0.76m cells=1 rms=3.8cm[ 27] DRIVE goal=(0.65,1.89) dist=2.00m front=0.76m cells=1 rms=3.9cm[ 28] DRIVE goal=(0.65,1.89) dist=2.00m front=0.76m cells=1 rms=4.0cm[ 29] DRIVE goal=(0.65,1.89) dist=2.01m front=0.78m cells=1 rms=4.0cm[ 30] DRIVE goal=(0.65,1.89) dist=2.00m front=0.77m cells=1 rms=4.0cm
[ 10.0s] [TURN ENTER] Entering TURN mode

[BLOCKED DEBUG] Goal angle: -38.0° (sector 53), goal_dist: 1.99m, goal_dir_min: 1.76m, margin: 0.15m
[BLOCKED DEBUG] Checking 1 sectors (robot angular width at 2.0m = 5.2°): {53: 1.763}
[BLOCKED DEBUG] Check: 1.76 < 1.99 - 0.15 = 1.84? True
[BLOCKED DEBUG] (Full front arc for reference: {55: 3.746, 56: 3.715, 57: 5.469, 58: 1.764, 59: 1.767, 0: 1.277, 1: 1.29, 2: 1.317, 3: 1.356, 4: 1.411, 5: 0.956})

[BLOCKED TURN] goal_sector=53, best_sector=53 (dist=1.76m), target_angle=-42.0°, angle_error=-42.0°, v=0.00, w=-0.50
[ 31] TURN goal=(0.65,1.89) dist=1.99m front=0.96m cells=1 rms=4.1cm[ 32] TURN goal=(0.65,1.89) dist=1.99m front=1.28m cells=1 rms=4.2cm[ 33] TURN goal=(0.65,1.89) dist=1.99m front=1.28m cells=1 rms=4.2cm[ 34] TURN goal=(0.65,1.89) dist=1.99m front=1.28m cells=1 rms=4.3cm[ 35] TURN goal=(0.65,1.89) dist=1.99m front=1.27m cells=1 rms=4.3cm[ 36] TURN goal=(0.65,1.89) dist=1.99m front=1.28m cells=1 rms=4.4cm[ 37] DRIVE goal=(0.65,1.89) dist=2.00m front=1.28m cells=1 rms=4.4cm
[ 11.4s] [TURN ENTER] Entering TURN mode

[BLOCKED DEBUG] Goal angle: -26.3° (sector 55), goal_dist: 2.01m, goal_dir_min: 1.71m, margin: 0.15m
[BLOCKED DEBUG] Checking 1 sectors (robot angular width at 2.0m = 5.1°): {55: 1.707}
[BLOCKED DEBUG] Check: 1.71 < 2.01 - 0.15 = 1.86? True
[BLOCKED DEBUG] (Full front arc for reference: {55: 1.707, 56: 1.925, 57: 3.766, 58: 3.718, 59: 5.496, 0: 1.769, 1: 1.772, 2: 1.287, 3: 1.291, 4: 1.313, 5: 1.352})

[BLOCKED TURN] goal_sector=55, best_sector=55 (dist=1.71m), target_angle=-30.0°, angle_error=-30.0°, v=0.00, w=-0.50
[ 38] TURN goal=(0.65,1.89) dist=2.01m front=1.29m cells=1 rms=4.4cm[ 39] DRIVE goal=(0.65,1.89) dist=2.00m front=1.29m cells=1 rms=4.5cm
[ 11.8s] [TURN ENTER] Entering TURN mode

[BLOCKED DEBUG] Goal angle: -20.4° (sector 56), goal_dist: 2.00m, goal_dir_min: 1.78m, margin: 0.15m
[BLOCKED DEBUG] Checking 1 sectors (robot angular width at 2.0m = 5.1°): {56: 1.783}
[BLOCKED DEBUG] Check: 1.78 < 2.00 - 0.15 = 1.85? True
[BLOCKED DEBUG] (Full front arc for reference: {55: 1.602, 56: 1.783, 57: 2.026, 58: 3.72, 59: 3.714, 0: 5.433, 1: 1.764, 2: 1.768, 3: 1.283, 4: 1.293, 5: 1.323})

[BLOCKED TURN] goal_sector=56, best_sector=56 (dist=1.78m), target_angle=-24.0°, angle_error=-24.0°, v=0.00, w=-0.50
[ 40] TURN goal=(0.65,1.89) dist=2.00m front=1.28m cells=1 rms=4.5cm[ 41] TURN goal=(0.65,1.89) dist=2.01m front=0.78m cells=1 rms=4.5cm[ 42] TURN goal=(0.65,1.89) dist=2.03m front=0.68m cells=1 rms=4.5cm[ 43] TURN goal=(0.65,1.89) dist=2.02m front=0.66m cells=1 rms=4.5cm[ 44] DRIVE goal=(0.65,1.89) dist=2.03m front=0.66m cells=1 rms=4.5cm
[ 12.8s] [TURN ENTER] Entering TURN mode

[BLOCKED DEBUG] Goal angle: -11.9° (sector 58), goal_dist: 2.03m, goal_dir_min: 1.84m, margin: 0.15m
[BLOCKED DEBUG] Checking 1 sectors (robot angular width at 2.0m = 5.1°): {58: 1.844}
[BLOCKED DEBUG] Check: 1.84 < 2.03 - 0.15 = 1.88? True
[BLOCKED DEBUG] (Full front arc for reference: {55: 0.638, 56: 0.744, 57: 1.644, 58: 1.844, 59: 3.471, 0: 3.72, 1: 3.739, 2: 1.783, 3: 1.777, 4: 1.297, 5: 1.297})

[BLOCKED TURN] goal_sector=58, best_sector=58 (dist=1.84m), target_angle=-12.0°, angle_error=-12.0°, v=0.00, w=-0.31
[ 45] TURN goal=(0.65,1.89) dist=2.03m front=0.64m cells=1 rms=4.5cm[ 46] TURN goal=(0.65,1.89) dist=2.03m front=0.63m cells=1 rms=4.4cm[ 47] TURN goal=(0.65,1.89) dist=2.02m front=0.66m cells=1 rms=4.4cm[ 48] TURN goal=(0.65,1.89) dist=2.02m front=0.67m cells=1 rms=4.4cm[ 49] DRIVE goal=(0.65,1.89) dist=2.02m front=0.67m cells=1 rms=4.4cm[ 50] DRIVE goal=(0.65,1.89) dist=2.02m front=0.66m cells=1 rms=4.4cm
[ 14.0s] [TURN ENTER] Entering TURN mode

[BLOCKED DEBUG] Goal angle: -12.2° (sector 57), goal_dist: 2.02m, goal_dir_min: 1.68m, margin: 0.15m
[BLOCKED DEBUG] Checking 1 sectors (robot angular width at 2.0m = 5.1°): {57: 1.681}
[BLOCKED DEBUG] Check: 1.68 < 2.02 - 0.15 = 1.87? True
[BLOCKED DEBUG] (Full front arc for reference: {55: 0.66, 56: 0.782, 57: 1.681, 58: 1.896, 59: 3.463, 0: 3.721, 1: 5.48, 2: 1.774, 3: 1.774, 4: 1.291, 5: 1.297})

[BLOCKED TURN] goal_sector=57, best_sector=57 (dist=1.68m), target_angle=-18.0°, angle_error=-18.0°, v=0.00, w=-0.47
[ 51] TURN goal=(0.65,1.89) dist=2.02m front=0.66m cells=1 rms=4.4cm[ 52] DRIVE goal=(0.65,1.89) dist=2.00m front=0.67m cells=1 rms=4.4cm[ 53] DRIVE goal=(0.65,1.89) dist=1.99m front=0.67m cells=1 rms=4.4cm
[ 14.6s] [TURN ENTER] Entering TURN mode

[BLOCKED DEBUG] Goal angle: -12.7° (sector 57), goal_dist: 1.95m, goal_dir_min: 1.73m, margin: 0.15m
[BLOCKED DEBUG] Checking 1 sectors (robot angular width at 2.0m = 5.3°): {57: 1.725}
[BLOCKED DEBUG] Check: 1.73 < 1.95 - 0.15 = 1.80? True
[BLOCKED DEBUG] (Full front arc for reference: {55: 0.7, 56: 1.574, 57: 1.725, 58: 1.953, 59: 3.716, 0: 3.709, 1: 5.477, 2: 1.76, 3: 1.765, 4: 1.278, 5: 1.29})

[BLOCKED TURN] goal_sector=57, best_sector=57 (dist=1.73m), target_angle=-18.0°, angle_error=-18.0°, v=0.00, w=-0.47
[ 54] TURN goal=(0.65,1.89) dist=1.95m front=0.70m cells=1 rms=4.4cm[ 55] DRIVE goal=(0.65,1.89) dist=1.93m front=1.26m cells=1 rms=4.5cm
[ 15.0s] [TURN ENTER] Entering TURN mode

[BLOCKED DEBUG] Goal angle: -20.5° (sector 56), goal_dist: 1.93m, goal_dir_min: 1.68m, margin: 0.15m
[BLOCKED DEBUG] Checking 1 sectors (robot angular width at 1.9m = 5.3°): {56: 1.676}
[BLOCKED DEBUG] Check: 1.68 < 1.93 - 0.15 = 1.78? True
[BLOCKED DEBUG] (Full front arc for reference: {55: 1.536, 56: 1.676, 57: 1.887, 58: 3.445, 59: 3.692, 0: 3.856, 1: 1.738, 2: 1.739, 3: 1.259, 4: 1.264, 5: 1.288})

[BLOCKED TURN] goal_sector=56, best_sector=56 (dist=1.68m), target_angle=-24.0°, angle_error=-24.0°, v=0.00, w=-0.50
[ 56] TURN goal=(0.65,1.89) dist=1.93m front=1.26m cells=1 rms=4.5cm[ 57] TURN goal=(0.65,1.89) dist=1.92m front=0.79m cells=1 rms=4.5cm[ 58] DRIVE goal=(0.65,1.89) dist=1.90m front=0.75m cells=1 rms=4.6cm
[ 15.6s] [TURN ENTER] Entering TURN mode

[BLOCKED DEBUG] Goal angle: -14.0° (sector 57), goal_dist: 1.90m, goal_dir_min: 1.63m, margin: 0.15m
[BLOCKED DEBUG] Checking 1 sectors (robot angular width at 1.9m = 5.4°): {57: 1.634}
[BLOCKED DEBUG] Check: 1.63 < 1.90 - 0.15 = 1.75? True
[BLOCKED DEBUG] (Full front arc for reference: {55: 0.639, 56: 0.762, 57: 1.634, 58: 1.837, 59: 3.428, 0: 3.673, 1: 3.714, 2: 1.73, 3: 1.728, 4: 1.251, 5: 1.25})

[BLOCKED TURN] goal_sector=57, best_sector=57 (dist=1.63m), target_angle=-18.0°, angle_error=-18.0°, v=0.00, w=-0.47
[ 59] TURN goal=(0.65,1.89) dist=1.90m front=0.64m cells=1 rms=4.6cm[ 60] DRIVE goal=(0.65,1.89) dist=1.88m front=0.62m cells=1 rms=4.7cm
[ 16.0s] [TURN ENTER] Entering TURN mode

[BLOCKED DEBUG] Goal angle: -10.8° (sector 58), goal_dist: 1.88m, goal_dir_min: 1.65m, margin: 0.15m
[BLOCKED DEBUG] Checking 1 sectors (robot angular width at 1.9m = 5.5°): {58: 1.649}
[BLOCKED DEBUG] Check: 1.65 < 1.88 - 0.15 = 1.73? True
[BLOCKED DEBUG] (Full front arc for reference: {55: 0.589, 56: 0.669, 57: 0.765, 58: 1.649, 59: 1.856, 0: 3.413, 1: 3.67, 2: 3.696, 3: 1.73, 4: 1.722, 5: 1.244})

[BLOCKED TURN] goal_sector=58, best_sector=58 (dist=1.65m), target_angle=-12.0°, angle_error=-12.0°, v=0.00, w=-0.31
[ 61] TURN goal=(0.65,1.89) dist=1.88m front=0.59m cells=1 rms=4.7cm[ 62] TURN goal=(0.65,1.89) dist=1.87m front=0.59m cells=1 rms=4.8cm[ 63] DRIVE goal=(0.65,1.89) dist=1.87m front=0.57m cells=1 rms=4.9cm
[ 16.6s] [TURN ENTER] Entering TURN mode

[BLOCKED DEBUG] Goal angle: -6.1° (sector 58), goal_dist: 1.87m, goal_dir_min: 1.63m, margin: 0.15m
[BLOCKED DEBUG] Checking 1 sectors (robot angular width at 1.9m = 5.5°): {58: 1.629}
[BLOCKED DEBUG] Check: 1.63 < 1.87 - 0.15 = 1.72? True
[BLOCKED DEBUG] (Full front arc for reference: {55: 0.574, 56: 0.647, 57: 0.753, 58: 1.629, 59: 1.83, 0: 3.404, 1: 3.667, 2: 3.669, 3: 1.753, 4: 1.722, 5: 1.725})

[BLOCKED TURN] goal_sector=58, best_sector=58 (dist=1.63m), target_angle=-12.0°, angle_error=-12.0°, v=0.00, w=-0.31
[ 64] TURN goal=(0.65,1.89) dist=1.87m front=0.57m cells=1 rms=4.9cm[ 65] TURN goal=(0.65,1.89) dist=1.87m front=0.57m cells=1 rms=5.0cm[ 66] DRIVE goal=(0.65,1.89) dist=1.86m front=0.55m cells=1 rms=5.0cm
[ 17.2s] [TURN ENTER] Entering TURN mode

[BLOCKED DEBUG] Goal angle: -2.1° (sector 59), goal_dist: 1.86m, goal_dir_min: 1.66m, margin: 0.15m
[BLOCKED DEBUG] Checking 1 sectors (robot angular width at 1.9m = 5.6°): {59: 1.66}
[BLOCKED DEBUG] Check: 1.66 < 1.86 - 0.15 = 1.71? True
[BLOCKED DEBUG] (Full front arc for reference: {55: 0.533, 56: 0.593, 57: 0.675, 58: 1.521, 59: 1.66, 0: 1.875, 1: 3.155, 2: 3.658, 3: 5.148, 4: 1.717, 5: 1.718})

[BLOCKED TURN] goal_sector=59, best_sector=59 (dist=1.66m), target_angle=-6.0°, angle_error=-6.0°, v=0.05, w=-0.16
[ 67] TURN goal=(0.65,1.89) dist=1.86m front=0.53m cells=1 rms=5.0cm[ 68] DRIVE goal=(0.65,1.89) dist=1.85m front=0.54m cells=1 rms=5.1cm
[ 17.6s] [TURN ENTER] Entering TURN mode

[BLOCKED DEBUG] Goal angle: -2.2° (sector 59), goal_dist: 1.81m, goal_dir_min: 1.65m, margin: 0.15m
[BLOCKED DEBUG] Checking 1 sectors (robot angular width at 1.8m = 5.7°): {59: 1.654}
[BLOCKED DEBUG] Check: 1.65 < 1.81 - 0.15 = 1.66? True
[BLOCKED DEBUG] (Full front arc for reference: {55: 0.517, 56: 0.574, 57: 0.659, 58: 1.498, 59: 1.654, 0: 1.831, 1: 3.13, 2: 3.653, 3: 3.748, 4: 1.715, 5: 1.713})

[BLOCKED TURN] goal_sector=59, best_sector=59 (dist=1.65m), target_angle=-6.0°, angle_error=-6.0°, v=0.05, w=-0.16
[ 69] TURN goal=(0.65,1.89) dist=1.81m front=0.52m cells=1 rms=5.1cm[ 70] DRIVE goal=(0.65,1.89) dist=1.78m front=0.53m cells=1 rms=5.2cm[ 71] DRIVE goal=(0.65,1.89) dist=1.75m front=0.53m cells=1 rms=5.2cm[ 72] DRIVE goal=(0.65,1.89) dist=1.70m front=0.50m cells=2 rms=5.3cm[ 73] DRIVE goal=(0.65,1.89) dist=1.67m front=0.48m cells=2 rms=5.3cm[ 74] DRIVE goal=(0.65,1.89) dist=1.61m front=0.51m cells=2 rms=5.3cm[ 75] DRIVE goal=(0.65,1.89) dist=1.56m front=0.49m cells=2 rms=5.3cm[ 76] DRIVE goal=(0.65,1.89) dist=1.52m front=0.48m cells=2 rms=5.4cm[ 77] DRIVE goal=(0.65,1.89) dist=1.47m front=0.45m cells=2 rms=5.4cm[ 78] DRIVE goal=(0.65,1.89) dist=1.39m front=0.44m cells=2 rms=5.4cm[ 79] DRIVE goal=(0.65,1.89) dist=1.33m front=0.43m cells=3 rms=5.4cm[ 80] DRIVE goal=(0.65,1.89) dist=1.28m front=0.40m cells=3 rms=5.3cm[ 81] DRIVE goal=(0.65,1.89) dist=1.21m front=0.40m cells=3 rms=5.3cm[ 82] DRIVE goal=(0.65,1.89) dist=1.15m front=0.40m cells=3 rms=5.3cm[ 83] DRIVE goal=(0.65,1.89) dist=1.13m front=0.43m cells=3 rms=5.2cm[ 84] DRIVE goal=(0.65,1.89) dist=1.11m front=0.44m cells=3 rms=5.2cm[ 85] DRIVE goal=(0.65,1.89) dist=1.07m front=0.46m cells=4 rms=5.2cm[ 86] DRIVE goal=(0.65,1.89) dist=1.01m front=0.48m cells=5 rms=5.1cm[ 87] DRIVE goal=(0.65,1.89) dist=0.99m front=0.48m cells=5 rms=5.1cm[ 88] DRIVE goal=(0.65,1.89) dist=0.93m front=1.14m cells=5 rms=5.1cm[ 89] DRIVE goal=(0.65,1.89) dist=0.86m front=1.14m cells=5 rms=5.1cm[ 90] DRIVE goal=(0.65,1.89) dist=0.79m front=1.15m cells=5 rms=5.0cm[ 91] DRIVE goal=(0.65,1.89) dist=0.71m front=1.12m cells=6 rms=5.0cm[ 92] DRIVE goal=(0.65,1.89) dist=0.68m front=1.11m cells=6 rms=5.0cm[ 93] DRIVE goal=(0.65,1.89) dist=0.64m front=1.11m cells=6 rms=5.0cm[ 94] DRIVE goal=(0.65,1.89) dist=0.59m front=1.11m cells=6 rms=5.0cm[ 95] DRIVE goal=(0.65,1.89) dist=0.56m front=1.12m cells=6 rms=5.0cm[ 96] DRIVE goal=(0.65,1.89) dist=0.54m front=1.16m cells=6 rms=5.0cm[ 97] DRIVE goal=(0.65,1.89) dist=0.52m front=1.15m cells=6 rms=5.0cm[ 98] DRIVE goal=(0.65,1.89) dist=0.50m front=1.14m cells=6 rms=5.0cm[ 99] DRIVE goal=(0.65,1.89) dist=0.48m front=1.12m cells=6 rms=5.0cm[100] DRIVE goal=(0.65,1.89) dist=0.48m front=1.11m cells=6 rms=5.0cm[101] DRIVE goal=(0.65,1.89) dist=0.45m front=1.10m cells=6 rms=5.0cm[102] DRIVE goal=(0.65,1.89) dist=0.43m front=0.99m cells=7 rms=5.0cm[103] DRIVE goal=(0.65,1.89) dist=0.41m front=0.99m cells=7 rms=5.0cm[104] DRIVE goal=(0.65,1.89) dist=0.40m front=0.99m cells=7 rms=5.1cm
[ 24.8s] [GOAL SELECT] robot@(0.47,1.55) | 9 candidates (scanned=116 walls=81 visited=7):
  #1 ang= +15° d=2.00m pos=(0.91,3.51) score=+48.2 [O=+1.7 U=+32.0 V=-0.0 W=-1.0 R=-0.0 F=+15.0] <-- BEST
  #2 ang= +15° d=1.50m pos=(0.80,3.02) score=+40.6 [O=+2.2 U=+24.0 V=-0.0 W=-1.0 R=-0.0 F=+15.0]
  #3 ang=  +9° d=1.00m pos=(0.79,2.50) score=+29.3 [O=+2.2 U=+18.0 V=-0.0 W=-3.0 R=-3.2 F=+15.0]
  #4 ang= +15° d=1.00m pos=(0.69,2.53) score=+27.5 [O=+2.5 U=+16.0 V=-0.0 W=-3.0 R=-3.2 F=+15.0]
  #5 ang= +45° d=0.50m pos=(0.32,2.03) score=+19.9 [O=+1.7 U=+28.2 V=-3.0 W=-3.0 R=-6.5 F=+12.3 T=-10.0]
  #6 ang= +39° d=0.50m pos=(0.37,2.04) score=+16.9 [O=+1.7 U=+24.4 V=-3.0 W=-3.0 R=-6.5 F=+13.2 T=-10.0]
  #7 ang= +33° d=0.50m pos=(0.42,2.05) score=+14.3 [O=+2.5 U=+20.3 V=-3.0 W=-3.0 R=-6.5 F=+13.9 T=-10.0]
  #8 ang= +27° d=0.50m pos=(0.47,2.05) score=+6.8 [O=+2.5 U=+12.2 V=-3.0 W=-3.0 R=-6.5 F=+14.4 T=-10.0]
[ 24.8s] [GOAL] Selected: (0.91, 3.51) dist=2.00m timeout=50s angle=15° reason=reached
[105] DRIVE goal=(0.91,3.51) dist=2.00m front=0.98m cells=7 rms=5.0cm[106] DRIVE goal=(0.91,3.51) dist=1.95m front=0.97m cells=7 rms=5.0cm[107] DRIVE goal=(0.91,3.51) dist=1.91m front=0.96m cells=7 rms=5.0cm[108] DRIVE goal=(0.91,3.51) dist=1.88m front=0.95m cells=7 rms=5.0cm[109] DRIVE goal=(0.91,3.51) dist=1.86m front=0.94m cells=7 rms=5.0cm[110] DRIVE goal=(0.91,3.51) dist=1.84m front=0.94m cells=7 rms=5.0cm[111] DRIVE goal=(0.91,3.51) dist=1.81m front=0.97m cells=7 rms=5.0cm[112] DRIVE goal=(0.91,3.51) dist=1.80m front=1.02m cells=7 rms=5.0cm[113] DRIVE goal=(0.91,3.51) dist=1.79m front=1.03m cells=7 rms=5.0cm[114] DRIVE goal=(0.91,3.51) dist=1.76m front=1.02m cells=7 rms=5.0cm[115] DRIVE goal=(0.91,3.51) dist=1.69m front=0.98m cells=8 rms=5.0cm[116] DRIVE goal=(0.91,3.51) dist=1.65m front=0.92m cells=8 rms=5.0cm[117] DRIVE goal=(0.91,3.51) dist=1.60m front=0.93m cells=9 rms=5.0cm[118] DRIVE goal=(0.91,3.51) dist=1.55m front=0.94m cells=9 rms=5.0cm[119] DRIVE goal=(0.91,3.51) dist=1.52m front=0.98m cells=9 rms=5.0cm[120] DRIVE goal=(0.91,3.51) dist=1.48m front=1.02m cells=9 rms=5.0cm[121] DRIVE goal=(0.91,3.51) dist=1.42m front=1.03m cells=10 rms=5.0cm[122] DRIVE goal=(0.91,3.51) dist=1.35m front=1.01m cells=10 rms=5.1cm[123] DRIVE goal=(0.91,3.51) dist=1.30m front=0.98m cells=10 rms=5.1cm[124] DRIVE goal=(0.91,3.51) dist=1.25m front=0.97m cells=10 rms=5.1cm[125] DRIVE goal=(0.91,3.51) dist=1.18m front=0.95m cells=10 rms=5.0cm[126] DRIVE goal=(0.91,3.51) dist=1.15m front=0.93m cells=10 rms=5.0cm[127] DRIVE goal=(0.91,3.51) dist=1.06m front=0.91m cells=11 rms=5.0cm[128] DRIVE goal=(0.91,3.51) dist=0.99m front=0.88m cells=11 rms=5.0cm[129] DRIVE goal=(0.91,3.51) dist=0.95m front=0.86m cells=11 rms=5.0cm[130] DRIVE goal=(0.91,3.51) dist=0.90m front=0.85m cells=11 rms=5.0cm[131] DRIVE goal=(0.91,3.51) dist=0.86m front=0.83m cells=11 rms=5.0cm[132] DRIVE goal=(0.91,3.51) dist=0.81m front=0.82m cells=12 rms=5.0cm[133] DRIVE goal=(0.91,3.51) dist=0.77m front=0.80m cells=12 rms=4.9cm[134] DRIVE goal=(0.91,3.51) dist=0.70m front=0.78m cells=12 rms=4.9cm[135] DRIVE goal=(0.91,3.51) dist=0.61m front=0.75m cells=12 rms=4.9cm[136] DRIVE goal=(0.91,3.51) dist=0.57m front=0.73m cells=12 rms=4.9cm[137] DRIVE goal=(0.91,3.51) dist=0.54m front=0.71m cells=12 rms=4.9cm[138] DRIVE goal=(0.91,3.51) dist=0.53m front=0.71m cells=12 rms=4.9cm[139] DRIVE goal=(0.91,3.51) dist=0.50m front=0.71m cells=13 rms=4.8cm[140] DRIVE goal=(0.91,3.51) dist=0.49m front=0.70m cells=13 rms=4.8cm[141] DRIVE goal=(0.91,3.51) dist=0.46m front=0.70m cells=13 rms=4.8cm[142] DRIVE goal=(0.91,3.51) dist=0.42m front=0.69m cells=13 rms=4.8cm
[ 32.6s] [REFINE] only 3 candidates, resampling with 150 angles (level 1)

[ 32.6s] [REFINE] best score 11.9 < 20.0, resampling with 450 angles (level 2)

[ 32.6s] [REFINE] best score 11.9 < 20.0, resampling with 1350 angles (level 3)

[ 32.6s] [GOAL SELECT] robot@(0.78,3.13) | 75 candidates (refined 3x) (scanned=170 walls=137 visited=13):
  #1 ang= -11° d=0.50m pos=(0.93,3.61) score=+11.9 [O=+2.5 U=+16.0 V=-0.0 W=-3.0 R=-8.7 F=+15.0 T=-10.0] <-- BEST
  #2 ang= -11° d=0.50m pos=(0.93,3.60) score=+11.9 [O=+2.5 U=+16.0 V=-0.0 W=-3.0 R=-8.7 F=+15.0 T=-10.0]
  #3 ang= -11° d=0.50m pos=(0.94,3.60) score=+11.9 [O=+2.5 U=+16.0 V=-0.0 W=-3.0 R=-8.7 F=+15.0 T=-10.0]
  #4 ang= -11° d=0.50m pos=(0.94,3.60) score=+11.9 [O=+2.5 U=+16.0 V=-0.0 W=-3.0 R=-8.7 F=+15.0 T=-10.0]
  #5 ang= -11° d=0.50m pos=(0.94,3.60) score=+11.9 [O=+2.5 U=+16.0 V=-0.0 W=-3.0 R=-8.7 F=+15.0 T=-10.0]
  #6 ang= -12° d=0.50m pos=(0.94,3.60) score=+11.9 [O=+2.5 U=+16.0 V=-0.0 W=-3.0 R=-8.7 F=+15.0 T=-10.0]
  #7 ang= -12° d=0.50m pos=(0.94,3.60) score=+11.9 [O=+2.5 U=+16.0 V=-0.0 W=-3.0 R=-8.7 F=+14.9 T=-10.0]
  #8 ang= -12° d=0.50m pos=(0.94,3.60) score=+11.9 [O=+2.5 U=+16.0 V=-0.0 W=-3.0 R=-8.7 F=+14.9 T=-10.0]
[ 32.6s] [GOAL] Selected: (0.93, 3.61) dist=0.50m timeout=28s angle=-11° reason=reached
[143] DRIVE goal=(0.93,3.61) dist=0.50m front=0.67m cells=13 rms=4.8cm[144] DRIVE goal=(0.93,3.61) dist=0.49m front=0.66m cells=13 rms=4.8cm[145] DRIVE goal=(0.93,3.61) dist=0.46m front=0.66m cells=13 rms=4.8cm[146] DRIVE goal=(0.93,3.61) dist=0.43m front=0.65m cells=13 rms=4.8cm[147] DRIVE goal=(0.93,3.61) dist=0.42m front=0.64m cells=13 rms=4.7cm[148] DRIVE goal=(0.93,3.61) dist=0.41m front=0.64m cells=13 rms=4.7cm
[ 33.9s] [REFINE] only 4 candidates, resampling with 150 angles (level 1)

[ 33.9s] [REFINE] best score 9.3 < 20.0, resampling with 450 angles (level 2)

[ 33.9s] [REFINE] best score 9.4 < 20.0, resampling with 1350 angles (level 3)

[ 33.9s] [GOAL SELECT] robot@(0.80,3.23) | 103 candidates (refined 3x) (scanned=173 walls=142 visited=13):
  #1 ang= -15° d=0.50m pos=(0.97,3.70) score=+9.4 [O=+2.5 U=+18.0 V=-0.0 W=-3.0 R=-23.2 F=+14.9] <-- BEST
  #2 ang= -15° d=0.50m pos=(0.97,3.70) score=+9.4 [O=+2.5 U=+18.0 V=-0.0 W=-3.0 R=-23.2 F=+14.9]
  #3 ang= -15° d=0.50m pos=(0.97,3.70) score=+9.4 [O=+2.5 U=+18.0 V=-0.0 W=-3.0 R=-23.2 F=+14.9]
  #4 ang= -16° d=0.50m pos=(0.98,3.70) score=+9.4 [O=+2.5 U=+18.0 V=-0.0 W=-3.0 R=-23.2 F=+14.9]
  #5 ang= -16° d=0.50m pos=(0.98,3.70) score=+9.4 [O=+2.5 U=+18.0 V=-0.0 W=-3.0 R=-23.2 F=+14.9]
  #6 ang= -16° d=0.50m pos=(0.98,3.70) score=+9.4 [O=+2.5 U=+18.0 V=-0.0 W=-3.0 R=-23.2 F=+14.9]
  #7 ang= -16° d=0.50m pos=(0.98,3.70) score=+9.3 [O=+2.5 U=+18.0 V=-0.0 W=-3.0 R=-23.2 F=+14.9]
  #8 ang= -17° d=0.50m pos=(0.98,3.70) score=+9.3 [O=+2.5 U=+18.0 V=-0.0 W=-3.0 R=-23.2 F=+14.8]
[ 33.9s] [GOAL] Selected: (0.97, 3.70) dist=0.50m timeout=28s angle=-15° reason=reached
[149] DRIVE goal=(0.97,3.70) dist=0.50m front=0.63m cells=13 rms=4.7cm[150] DRIVE goal=(0.97,3.70) dist=0.47m front=0.63m cells=13 rms=4.7cm[151] DRIVE goal=(0.97,3.70) dist=0.44m front=0.62m cells=13 rms=4.7cm[152] DRIVE goal=(0.97,3.70) dist=0.41m front=0.61m cells=14 rms=4.7cm[153] DRIVE goal=(0.97,3.70) dist=0.40m front=0.62m cells=14 rms=4.7cm
[ 35.0s] [REFINE] only 4 candidates, resampling with 150 angles (level 1)

[ 35.0s] [REFINE] best score -17.7 < 20.0, resampling with 450 angles (level 2)

[ 35.0s] [REFINE] best score -17.4 < 20.0, resampling with 1350 angles (level 3)

[ 35.1s] [GOAL SELECT] robot@(0.80,3.35) | 124 candidates (refined 3x) (scanned=181 walls=149 visited=14):
  #1 ang=-114° d=0.50m pos=(1.20,3.04) score=-17.3 [O=+1.6 U=+36.0 V=-8.6 W=-3.0 R=-18.0 F=-6.2 T=-19.3] <-- BEST
  #2 ang=-114° d=0.50m pos=(1.20,3.04) score=-17.4 [O=+1.6 U=+36.0 V=-8.6 W=-3.0 R=-18.0 F=-6.2 T=-19.3]
  #3 ang=-114° d=0.50m pos=(1.20,3.04) score=-17.4 [O=+1.6 U=+36.0 V=-8.6 W=-3.0 R=-18.0 F=-6.3 T=-19.3]
  #4 ang=-114° d=0.50m pos=(1.20,3.04) score=-17.5 [O=+1.6 U=+36.0 V=-8.6 W=-3.0 R=-18.0 F=-6.3 T=-19.3]
  #5 ang=-115° d=0.50m pos=(1.19,3.04) score=-17.5 [O=+1.6 U=+36.0 V=-8.6 W=-3.0 R=-18.0 F=-6.4 T=-19.3]
  #6 ang=-115° d=0.50m pos=(1.19,3.04) score=-17.6 [O=+1.6 U=+36.0 V=-8.6 W=-3.0 R=-18.0 F=-6.5 T=-19.3]
  #7 ang=-115° d=0.50m pos=(1.19,3.04) score=-17.7 [O=+1.6 U=+36.0 V=-8.6 W=-3.0 R=-18.0 F=-6.5 T=-19.3]
  #8 ang=-115° d=0.50m pos=(1.19,3.03) score=-17.7 [O=+1.6 U=+36.0 V=-8.6 W=-3.0 R=-18.0 F=-6.6 T=-19.3]
[ 35.1s] [GOAL] Selected: (1.20, 3.04) dist=0.50m timeout=28s angle=-114° reason=reached
[154] DRIVE goal=(1.20,3.04) dist=0.50m front=0.72m cells=14 rms=4.6cm[155] DRIVE goal=(1.20,3.04) dist=0.52m front=0.80m cells=14 rms=4.6cm[156] DRIVE goal=(1.20,3.04) dist=0.52m front=0.77m cells=14 rms=4.6cm[157] DRIVE goal=(1.20,3.04) dist=0.52m front=0.76m cells=14 rms=4.6cm[158] DRIVE goal=(1.20,3.04) dist=0.52m front=0.75m cells=14 rms=4.6cm[159] DRIVE goal=(1.20,3.04) dist=0.52m front=0.75m cells=14 rms=4.6cm[160] DRIVE goal=(1.20,3.04) dist=0.52m front=0.74m cells=14 rms=4.6cm[161] DRIVE goal=(1.20,3.04) dist=0.52m front=0.73m cells=14 rms=4.6cm[162] DRIVE goal=(1.20,3.04) dist=0.52m front=0.72m cells=14 rms=4.6cm[163] DRIVE goal=(1.20,3.04) dist=0.52m front=0.72m cells=14 rms=4.6cm[164] DRIVE goal=(1.20,3.04) dist=0.52m front=0.72m cells=14 rms=4.6cm[165] DRIVE goal=(1.20,3.04) dist=0.52m front=0.71m cells=14 rms=4.6cm[166] DRIVE goal=(1.20,3.04) dist=0.52m front=0.71m cells=14 rms=4.6cm[167] DRIVE goal=(1.20,3.04) dist=0.52m front=0.71m cells=14 rms=4.6cm[168] DRIVE goal=(1.20,3.04) dist=0.52m front=0.71m cells=14 rms=4.6cm[169] DRIVE goal=(1.20,3.04) dist=0.52m front=0.71m cells=14 rms=4.6cm[170] DRIVE goal=(1.20,3.04) dist=0.52m front=0.71m cells=14 rms=4.6cm[171] DRIVE goal=(1.20,3.04) dist=0.52m front=0.71m cells=14 rms=4.6cm[172] DRIVE goal=(1.20,3.04) dist=0.52m front=0.71m cells=14 rms=4.6cm[173] DRIVE goal=(1.20,3.04) dist=0.53m front=0.71m cells=14 rms=4.6cm[174] DRIVE goal=(1.20,3.04) dist=0.54m front=0.72m cells=14 rms=4.6cm[175] DRIVE goal=(1.20,3.04) dist=0.54m front=0.73m cells=14 rms=4.6cm[176] DRIVE goal=(1.20,3.04) dist=0.54m front=0.72m cells=14 rms=4.6cm[177] DRIVE goal=(1.20,3.04) dist=0.54m front=0.72m cells=14 rms=4.6cm[178] DRIVE goal=(1.20,3.04) dist=0.54m front=0.72m cells=14 rms=4.5cm[179] DRIVE goal=(1.20,3.04) dist=0.53m front=0.72m cells=14 rms=4.5cm[180] DRIVE goal=(1.20,3.04) dist=0.52m front=0.72m cells=14 rms=4.5cm[181] DRIVE goal=(1.20,3.04) dist=0.51m front=0.72m cells=14 rms=4.5cm[182] DRIVE goal=(1.20,3.04) dist=0.51m front=0.68m cells=14 rms=4.5cm[183] DRIVE goal=(1.20,3.04) dist=0.50m front=0.68m cells=14 rms=4.5cm[184] DRIVE goal=(1.20,3.04) dist=0.47m front=0.60m cells=14 rms=4.5cm[185] DRIVE goal=(1.20,3.04) dist=0.47m front=0.60m cells=14 rms=4.5cm[186] DRIVE goal=(1.20,3.04) dist=0.45m front=0.59m cells=14 rms=4.5cm[187] DRIVE goal=(1.20,3.04) dist=0.40m front=0.59m cells=15 rms=4.5cm
[ 42.1s] [REFINE] best score -26.6 < 20.0, resampling with 150 angles (level 1)

[ 42.1s] [REFINE] best score -24.7 < 20.0, resampling with 450 angles (level 2)

[ 42.1s] [REFINE] best score -24.7 < 20.0, resampling with 1350 angles (level 3)

[ 42.1s] [GOAL SELECT] robot@(0.96,3.28) | 330 candidates (refined 3x) (scanned=194 walls=155 visited=16):
  #1 ang= +92° d=0.50m pos=(1.20,3.72) score=-24.5 [O=+2.5 U=+14.2 V=-5.9 W=-3.0 R=-37.1 F=+14.6 T=-10.0] <-- BEST
  #2 ang= +92° d=0.50m pos=(1.20,3.72) score=-24.5 [O=+2.5 U=+14.2 V=-5.9 W=-3.0 R=-37.1 F=+14.6 T=-10.0]
  #3 ang= +93° d=0.50m pos=(1.19,3.72) score=-24.6 [O=+2.5 U=+14.0 V=-5.9 W=-3.0 R=-37.1 F=+14.7 T=-10.0]
  #4 ang= +93° d=0.50m pos=(1.19,3.72) score=-24.7 [O=+2.5 U=+14.0 V=-5.9 W=-3.0 R=-37.1 F=+14.7 T=-10.0]
  #5 ang= +93° d=0.50m pos=(1.19,3.72) score=-24.7 [O=+2.5 U=+14.0 V=-5.9 W=-3.0 R=-37.1 F=+14.7 T=-10.0]
  #6 ang= +93° d=0.50m pos=(1.20,3.72) score=-24.7 [O=+2.5 U=+14.0 V=-5.9 W=-3.0 R=-37.1 F=+14.7 T=-10.0]
  #7 ang= +97° d=0.50m pos=(1.16,3.74) score=-26.5 [O=+2.5 U=+12.0 V=-5.9 W=-3.0 R=-37.1 F=+14.9 T=-10.0]
  #8 ang= +97° d=0.50m pos=(1.16,3.74) score=-26.5 [O=+2.5 U=+12.0 V=-5.9 W=-3.0 R=-37.1 F=+14.9 T=-10.0]
[ 42.1s] [GOAL] Selected: (1.20, 3.72) dist=0.50m timeout=27s angle=92° reason=reached
[188] DRIVE goal=(1.20,3.72) dist=0.50m front=0.57m cells=16 rms=4.5cm[189] DRIVE goal=(1.20,3.72) dist=0.51m front=0.61m cells=16 rms=4.5cm[190] DRIVE goal=(1.20,3.72) dist=0.51m front=0.58m cells=16 rms=4.5cm[191] DRIVE goal=(1.20,3.72) dist=0.51m front=0.60m cells=16 rms=4.5cm[192] DRIVE goal=(1.20,3.72) dist=0.51m front=0.60m cells=16 rms=4.5cm[193] DRIVE goal=(1.20,3.72) dist=0.51m front=0.60m cells=16 rms=4.6cm[194] DRIVE goal=(1.20,3.72) dist=0.51m front=0.61m cells=16 rms=4.6cm[195] DRIVE goal=(1.20,3.72) dist=0.51m front=0.61m cells=16 rms=4.6cm[196] DRIVE goal=(1.20,3.72) dist=0.51m front=0.65m cells=16 rms=4.6cm[197] DRIVE goal=(1.20,3.72) dist=0.51m front=0.65m cells=16 rms=4.6cm[198] DRIVE goal=(1.20,3.72) dist=0.51m front=0.65m cells=16 rms=4.6cm[199] DRIVE goal=(1.20,3.72) dist=0.51m front=0.66m cells=16 rms=4.6cm[200] DRIVE goal=(1.20,3.72) dist=0.51m front=0.66m cells=16 rms=4.6cm[201] DRIVE goal=(1.20,3.72) dist=0.51m front=0.66m cells=16 rms=4.6cm[202] DRIVE goal=(1.20,3.72) dist=0.51m front=0.66m cells=16 rms=4.6cm[203] DRIVE goal=(1.20,3.72) dist=0.51m front=0.66m cells=16 rms=4.6cm[204] DRIVE goal=(1.20,3.72) dist=0.52m front=0.66m cells=16 rms=4.6cm[205] DRIVE goal=(1.20,3.72) dist=0.52m front=0.66m cells=16 rms=4.5cm[206] DRIVE goal=(1.20,3.72) dist=0.52m front=0.67m cells=16 rms=4.5cm[207] DRIVE goal=(1.20,3.72) dist=0.52m front=0.67m cells=16 rms=4.5cm[208] DRIVE goal=(1.20,3.72) dist=0.52m front=0.67m cells=16 rms=4.5cm[209] DRIVE goal=(1.20,3.72) dist=0.52m front=0.66m cells=16 rms=4.5cm[210] DRIVE goal=(1.20,3.72) dist=0.52m front=0.67m cells=16 rms=4.5cm[211] DRIVE goal=(1.20,3.72) dist=0.52m front=0.67m cells=16 rms=4.5cm[212] DRIVE goal=(1.20,3.72) dist=0.52m front=0.67m cells=16 rms=4.5cm[213] DRIVE goal=(1.20,3.72) dist=0.52m front=0.67m cells=16 rms=4.5cm[214] DRIVE goal=(1.20,3.72) dist=0.53m front=0.67m cells=16 rms=4.5cm[215] DRIVE goal=(1.20,3.72) dist=0.52m front=0.67m cells=16 rms=4.4cm[216] DRIVE goal=(1.20,3.72) dist=0.53m front=0.67m cells=16 rms=4.4cm[217] DRIVE goal=(1.20,3.72) dist=0.52m front=0.67m cells=16 rms=4.4cm[218] DRIVE goal=(1.20,3.72) dist=0.53m front=0.67m cells=16 rms=4.4cm[219] DRIVE goal=(1.20,3.72) dist=0.53m front=0.67m cells=16 rms=4.4cm[220] DRIVE goal=(1.20,3.72) dist=0.54m front=0.68m cells=16 rms=4.4cm[221] DRIVE goal=(1.20,3.72) dist=0.52m front=0.68m cells=16 rms=4.4cm[222] DRIVE goal=(1.20,3.72) dist=0.51m front=0.69m cells=16 rms=4.4cm[223] DRIVE goal=(1.20,3.72) dist=0.50m front=0.69m cells=16 rms=4.4cm[224] DRIVE goal=(1.20,3.72) dist=0.49m front=0.68m cells=16 rms=4.4cm[225] DRIVE goal=(1.20,3.72) dist=0.47m front=0.69m cells=16 rms=4.3cm
[ 49.9s] [REFINE] only 4 candidates, resampling with 150 angles (level 1)

[ 49.9s] [REFINE] best score -31.0 < 20.0, resampling with 450 angles (level 2)

[ 49.9s] [REFINE] best score -31.0 < 20.0, resampling with 1350 angles (level 3)

[ 49.9s] [GOAL SELECT] robot@(1.03,3.36) | 115 candidates (refined 3x) (scanned=197 walls=159 visited=16):
  #1 ang= +18° d=0.50m pos=(1.18,3.84) score=-31.0 [O=+2.5 U=+14.0 V=-5.3 W=-3.0 R=-44.3 F=+15.0 T=-10.0] <-- BEST
  #2 ang= +18° d=0.50m pos=(1.18,3.84) score=-31.0 [O=+2.5 U=+14.0 V=-5.3 W=-3.0 R=-44.3 F=+15.0 T=-10.0]
  #3 ang= +18° d=0.50m pos=(1.17,3.84) score=-31.0 [O=+2.5 U=+14.0 V=-5.3 W=-3.0 R=-44.3 F=+15.0 T=-10.0]
  #4 ang= +18° d=0.50m pos=(1.18,3.84) score=-31.0 [O=+2.5 U=+14.0 V=-5.3 W=-3.0 R=-44.3 F=+15.0 T=-10.0]
  #5 ang= +19° d=0.50m pos=(1.17,3.84) score=-31.0 [O=+2.5 U=+14.0 V=-5.3 W=-3.0 R=-44.3 F=+15.0 T=-10.0]
  #6 ang= +17° d=0.50m pos=(1.18,3.84) score=-31.0 [O=+2.5 U=+14.0 V=-5.3 W=-3.0 R=-44.3 F=+15.0 T=-10.0]
  #7 ang= +19° d=0.50m pos=(1.17,3.84) score=-31.0 [O=+2.5 U=+14.0 V=-5.3 W=-3.0 R=-44.3 F=+15.0 T=-10.0]
  #8 ang= +17° d=0.50m pos=(1.18,3.84) score=-31.0 [O=+2.5 U=+14.0 V=-5.3 W=-3.0 R=-44.3 F=+15.0 T=-10.0]
[ 49.9s] [GOAL] Selected: (1.18, 3.84) dist=0.50m timeout=27s angle=18° reason=reached
[226] DRIVE goal=(1.18,3.84) dist=0.50m front=0.68m cells=16 rms=4.3cm[227] DRIVE goal=(1.18,3.84) dist=0.45m front=0.68m cells=16 rms=4.3cm[228] DRIVE goal=(1.18,3.84) dist=0.42m front=0.67m cells=16 rms=4.3cm
[ 50.6s] [REFINE] only 0 candidates, resampling with 150 angles (level 1)

[ 50.6s] [REFINE] only 0 candidates, resampling with 450 angles (level 2)

[ 50.6s] [REFINE] only 0 candidates, resampling with 1350 angles (level 3)

[ 50.6s] [NO GOAL] No valid viewpoint found (1/3), backing up

[BACKUP] Reversing...
[BACKUP] Turning right (L_openings=6 R_openings=7)
[230] DRIVE goal=(1.18,3.84) dist=0.64m front=0.67m cells=16 rms=4.3cm[231] DRIVE goal=(1.18,3.84) dist=0.64m front=0.68m cells=16 rms=4.3cm[232] DRIVE goal=(1.18,3.84) dist=0.64m front=0.67m cells=16 rms=4.3cm[233] DRIVE goal=(1.18,3.84) dist=0.64m front=0.67m cells=16 rms=4.3cm[234] DRIVE goal=(1.18,3.84) dist=0.64m front=0.68m cells=16 rms=4.3cm[235] DRIVE goal=(1.18,3.84) dist=0.65m front=0.68m cells=16 rms=4.3cm[236] DRIVE goal=(1.18,3.84) dist=0.64m front=0.69m cells=16 rms=4.3cm[237] DRIVE goal=(1.18,3.84) dist=0.63m front=0.70m cells=16 rms=4.3cm[238] DRIVE goal=(1.18,3.84) dist=0.63m front=0.70m cells=16 rms=4.2cm[239] DRIVE goal=(1.18,3.84) dist=0.62m front=0.70m cells=16 rms=4.2cm
[ 56.3s] [DRIVE STUCK] Goal distance unchanged for 6.4s
[DRIVE STUCK] dist_oldest=0.50m, dist_now=0.57m, change=0.07m < margin=0.08m
[DRIVE STUCK] Front sectors: s55=0.72 s56=0.76 s57=0.80 s58=0.86 s59=1.47 s0=1.67 s1=2.62 s2=2.51 s3=2.51 s4=4.28 s5=4.31 
[DRIVE STUCK] Marked front sectors [55, 56, 57, 58, 59, 0, 1, 2, 3, 4, 5] as blocked for 30s

[BACKUP CLEAR] Reversing and turning toward clearer side...
[BACKUP CLEAR] Turning left (L_avg=3.25m R_avg=0.92m)

[ 61.1s] [REFINE] best score -77.6 < 20.0, resampling with 150 angles (level 1)

[ 61.1s] [REFINE] best score -74.9 < 20.0, resampling with 450 angles (level 2)

[ 61.1s] [REFINE] best score -74.9 < 20.0, resampling with 1350 angles (level 3)

[ 61.1s] [GOAL SELECT] robot@(0.91,3.00) | 151 candidates (refined 3x) (scanned=199 walls=164 visited=17):
  #1 ang= -40° d=0.50m pos=(1.17,3.43) score=-74.8 [O=+2.2 U=+14.3 V=-16.6 W=-3.0 R=-37.3 F=+14.6 B=-25.0 T=-24.2] <-- BEST
  #2 ang= -40° d=0.50m pos=(1.17,3.43) score=-74.9 [O=+2.2 U=+14.3 V=-16.6 W=-3.0 R=-37.3 F=+14.6 B=-25.0 T=-24.2]
  #3 ang= -40° d=0.50m pos=(1.17,3.43) score=-74.9 [O=+2.2 U=+14.3 V=-16.6 W=-3.0 R=-37.3 F=+14.6 B=-25.0 T=-24.2]
  #4 ang= -41° d=0.50m pos=(1.17,3.43) score=-74.9 [O=+2.2 U=+14.3 V=-16.6 W=-3.0 R=-37.3 F=+14.5 B=-25.0 T=-24.2]
  #5 ang= -41° d=0.50m pos=(1.17,3.42) score=-74.9 [O=+2.2 U=+14.3 V=-16.6 W=-3.0 R=-37.3 F=+14.5 B=-25.0 T=-24.2]
  #6 ang= -41° d=0.50m pos=(1.17,3.42) score=-74.9 [O=+2.2 U=+14.3 V=-16.6 W=-3.0 R=-37.3 F=+14.5 B=-25.0 T=-24.2]
  #7 ang= -41° d=0.50m pos=(1.18,3.42) score=-74.9 [O=+2.2 U=+14.3 V=-16.6 W=-3.0 R=-37.3 F=+14.5 B=-25.0 T=-24.2]
  #8 ang= -41° d=0.50m pos=(1.18,3.42) score=-74.9 [O=+2.2 U=+14.3 V=-16.6 W=-3.0 R=-37.3 F=+14.5 B=-25.0 T=-24.2]
[ 61.1s] [GOAL] Selected: (1.17, 3.43) dist=0.50m timeout=28s angle=-40° reason=no goal
[241] DRIVE goal=(1.17,3.43) dist=0.50m front=0.72m cells=17 rms=4.2cm[242] DRIVE goal=(1.17,3.43) dist=0.49m front=0.69m cells=17 rms=4.2cm[243] DRIVE goal=(1.17,3.43) dist=0.48m front=0.66m cells=17 rms=4.2cm[244] DRIVE goal=(1.17,3.43) dist=0.48m front=0.71m cells=17 rms=4.2cm[245] DRIVE goal=(1.17,3.43) dist=0.48m front=0.71m cells=17 rms=4.2cm[246] DRIVE goal=(1.17,3.43) dist=0.48m front=0.71m cells=17 rms=4.2cm[247] DRIVE goal=(1.17,3.43) dist=0.48m front=0.71m cells=17 rms=4.2cm[248] DRIVE goal=(1.17,3.43) dist=0.49m front=0.71m cells=17 rms=4.2cm[249] DRIVE goal=(1.17,3.43) dist=0.49m front=0.71m cells=17 rms=4.2cm[250] DRIVE goal=(1.17,3.43) dist=0.49m front=0.71m cells=17 rms=4.2cm[251] DRIVE goal=(1.17,3.43) dist=0.49m front=0.71m cells=17 rms=4.2cm[252] DRIVE goal=(1.17,3.43) dist=0.49m front=0.71m cells=17 rms=4.1cm[253] DRIVE goal=(1.17,3.43) dist=0.49m front=0.71m cells=17 rms=4.1cm[254] DRIVE goal=(1.17,3.43) dist=0.49m front=0.71m cells=17 rms=4.1cm[255] DRIVE goal=(1.17,3.43) dist=0.49m front=0.71m cells=17 rms=4.1cm[256] DRIVE goal=(1.17,3.43) dist=0.48m front=0.71m cells=17 rms=4.1cm[257] DRIVE goal=(1.17,3.43) dist=0.48m front=0.71m cells=17 rms=4.1cm[258] DRIVE goal=(1.17,3.43) dist=0.48m front=0.71m cells=17 rms=4.1cm[259] DRIVE goal=(1.17,3.43) dist=0.47m front=0.71m cells=17 rms=4.1cm[260] DRIVE goal=(1.17,3.43) dist=0.46m front=0.74m cells=17 rms=4.1cm[261] DRIVE goal=(1.17,3.43) dist=0.46m front=0.72m cells=17 rms=4.1cm[262] DRIVE goal=(1.17,3.43) dist=0.45m front=0.82m cells=17 rms=4.1cm[263] DRIVE goal=(1.17,3.43) dist=0.44m front=0.80m cells=17 rms=4.1cm[264] DRIVE goal=(1.17,3.43) dist=0.40m front=0.77m cells=17 rms=4.1cm
[ 66.1s] [REFINE] best score -166.0 < 20.0, resampling with 150 angles (level 1)

[ 66.1s] [REFINE] best score -141.3 < 20.0, resampling with 450 angles (level 2)

[ 66.1s] [REFINE] best score -139.8 < 20.0, resampling with 1350 angles (level 3)

[ 66.1s] [GOAL SELECT] robot@(0.94,3.14) | 139 candidates (refined 3x) (scanned=199 walls=164 visited=17):
  #1 ang= +31° d=0.50m pos=(0.91,3.64) score=-139.8 [O=+2.5 U=+11.4 V=-3.3 W=-3.0 R=-48.2 F=+14.1 B=-100.0 T=-13.3] <-- BEST
  #2 ang= +31° d=0.50m pos=(0.91,3.64) score=-139.8 [O=+2.5 U=+11.4 V=-3.3 W=-3.0 R=-48.2 F=+14.1 B=-100.0 T=-13.3]
  #3 ang= +32° d=0.50m pos=(0.90,3.64) score=-139.8 [O=+2.5 U=+11.4 V=-3.3 W=-3.0 R=-48.2 F=+14.0 B=-100.0 T=-13.3]
  #4 ang= +32° d=0.50m pos=(0.90,3.64) score=-139.9 [O=+2.5 U=+11.4 V=-3.3 W=-3.0 R=-48.2 F=+14.0 B=-100.0 T=-13.3]
  #5 ang= +32° d=0.50m pos=(0.90,3.64) score=-139.9 [O=+2.5 U=+11.4 V=-3.3 W=-3.0 R=-48.2 F=+14.0 B=-100.0 T=-13.3]
  #6 ang= +30° d=0.50m pos=(0.92,3.64) score=-141.2 [O=+2.5 U=+9.8 V=-3.3 W=-3.0 R=-48.2 F=+14.2 B=-100.0 T=-13.3]
  #7 ang= +30° d=0.50m pos=(0.92,3.64) score=-141.2 [O=+2.5 U=+9.8 V=-3.3 W=-3.0 R=-48.2 F=+14.2 B=-100.0 T=-13.3]
  #8 ang= +30° d=0.50m pos=(0.92,3.64) score=-141.3 [O=+2.5 U=+9.8 V=-3.3 W=-3.0 R=-48.2 F=+14.2 B=-100.0 T=-13.3]
[ 66.1s] [GOAL] Selected: (0.91, 3.64) dist=0.50m timeout=27s angle=31° reason=reached
[265] DRIVE goal=(0.91,3.64) dist=0.50m front=0.72m cells=17 rms=4.1cm[266] DRIVE goal=(0.91,3.64) dist=0.47m front=0.71m cells=17 rms=4.1cm[267] DRIVE goal=(0.91,3.64) dist=0.46m front=0.69m cells=17 rms=4.1cm[268] DRIVE goal=(0.91,3.64) dist=0.46m front=0.70m cells=17 rms=4.1cm[269] DRIVE goal=(0.91,3.64) dist=0.46m front=0.69m cells=17 rms=4.1cm[270] DRIVE goal=(0.91,3.64) dist=0.45m front=0.70m cells=17 rms=4.1cm[271] DRIVE goal=(0.91,3.64) dist=0.45m front=0.70m cells=17 rms=4.1cm[272] DRIVE goal=(0.91,3.64) dist=0.44m front=0.71m cells=17 rms=4.1cm[273] DRIVE goal=(0.91,3.64) dist=0.45m front=0.74m cells=17 rms=4.1cm[274] DRIVE goal=(0.91,3.64) dist=0.47m front=0.77m cells=17 rms=4.0cm[275] DRIVE goal=(0.91,3.64) dist=0.48m front=0.84m cells=17 rms=4.0cm[276] DRIVE goal=(0.91,3.64) dist=0.49m front=0.84m cells=17 rms=4.0cm[277] DRIVE goal=(0.91,3.64) dist=0.49m front=0.70m cells=17 rms=4.0cm[278] DRIVE goal=(0.91,3.64) dist=0.47m front=0.68m cells=17 rms=4.0cm[279] DRIVE goal=(0.91,3.64) dist=0.46m front=0.73m cells=17 rms=4.0cm[280] DRIVE goal=(0.91,3.64) dist=0.44m front=0.67m cells=17 rms=4.0cm
[ 69.5s] [REFINE] only 4 candidates, resampling with 150 angles (level 1)

[ 69.5s] [REFINE] best score -167.5 < 20.0, resampling with 450 angles (level 2)

[ 69.5s] [REFINE] best score -167.5 < 20.0, resampling with 1350 angles (level 3)

[ 69.5s] [GOAL SELECT] robot@(0.97,3.25) | 108 candidates (refined 3x) (scanned=204 walls=169 visited=17):
  #1 ang= -18° d=0.50m pos=(1.18,3.71) score=-167.5 [O=+2.2 U=+10.7 V=-3.0 W=-3.0 R=-57.5 F=+14.8 B=-125.0 T=-6.9] <-- BEST
  #2 ang= -19° d=0.50m pos=(1.19,3.71) score=-167.5 [O=+2.2 U=+10.7 V=-3.0 W=-3.0 R=-57.5 F=+14.8 B=-125.0 T=-6.9]
  #3 ang= -19° d=0.50m pos=(1.19,3.70) score=-167.5 [O=+2.2 U=+10.7 V=-3.0 W=-3.0 R=-57.5 F=+14.8 B=-125.0 T=-6.9]
  #4 ang= -19° d=0.50m pos=(1.19,3.70) score=-167.5 [O=+2.2 U=+10.7 V=-3.0 W=-3.0 R=-57.5 F=+14.8 B=-125.0 T=-6.9]
  #5 ang= -19° d=0.50m pos=(1.19,3.70) score=-167.5 [O=+2.2 U=+10.7 V=-3.0 W=-3.0 R=-57.5 F=+14.8 B=-125.0 T=-6.9]
  #6 ang= -19° d=0.50m pos=(1.19,3.70) score=-167.5 [O=+2.2 U=+10.7 V=-3.0 W=-3.0 R=-57.5 F=+14.8 B=-125.0 T=-6.9]
  #7 ang= -20° d=0.50m pos=(1.20,3.70) score=-167.5 [O=+2.2 U=+10.7 V=-3.0 W=-3.0 R=-57.5 F=+14.8 B=-125.0 T=-6.9]
  #8 ang= -20° d=0.50m pos=(1.20,3.70) score=-167.6 [O=+2.2 U=+10.7 V=-3.0 W=-3.0 R=-57.5 F=+14.8 B=-125.0 T=-6.9]
[ 69.5s] [GOAL] Selected: (1.18, 3.71) dist=0.50m timeout=28s angle=-18° reason=reached
[281] DRIVE goal=(1.18,3.71) dist=0.50m front=0.66m cells=17 rms=4.0cm[282] DRIVE goal=(1.18,3.71) dist=0.46m front=0.63m cells=17 rms=4.0cm[283] DRIVE goal=(1.18,3.71) dist=0.45m front=0.63m cells=17 rms=4.0cm[284] DRIVE goal=(1.18,3.71) dist=0.44m front=0.62m cells=17 rms=4.0cm[285] DRIVE goal=(1.18,3.71) dist=0.44m front=0.62m cells=17 rms=4.0cm[286] DRIVE goal=(1.18,3.71) dist=0.44m front=0.62m cells=17 rms=4.0cm[287] DRIVE goal=(1.18,3.71) dist=0.43m front=0.62m cells=17 rms=4.0cm[288] DRIVE goal=(1.18,3.71) dist=0.42m front=0.62m cells=17 rms=4.0cm[289] DRIVE goal=(1.18,3.71) dist=0.41m front=0.61m cells=17 rms=4.0cm[290] DRIVE goal=(1.18,3.71) dist=0.42m front=0.72m cells=17 rms=4.0cm[291] DRIVE goal=(1.18,3.71) dist=0.42m front=0.55m cells=17 rms=4.0cm[292] DRIVE goal=(1.18,3.71) dist=0.41m front=0.54m cells=17 rms=4.0cm
[ 72.1s] [REFINE] only 4 candidates, resampling with 150 angles (level 1)

[ 72.1s] [REFINE] best score -187.9 < 20.0, resampling with 450 angles (level 2)

[ 72.1s] [REFINE] best score -187.8 < 20.0, resampling with 1350 angles (level 3)

[ 72.1s] [GOAL SELECT] robot@(0.99,3.39) | 115 candidates (refined 3x) (scanned=204 walls=169 visited=17):
  #1 ang= +25° d=0.50m pos=(0.94,3.88) score=-186.4 [O=+2.5 U=+11.7 V=-4.2 W=-3.0 R=-67.6 F=+13.9 B=-125.0 T=-14.9] <-- BEST
  #2 ang= +25° d=0.50m pos=(0.94,3.88) score=-186.4 [O=+2.5 U=+11.7 V=-4.2 W=-3.0 R=-67.6 F=+13.9 B=-125.0 T=-14.9]
  #3 ang= +24° d=0.50m pos=(0.95,3.89) score=-187.8 [O=+2.5 U=+10.2 V=-4.2 W=-3.0 R=-67.6 F=+14.0 B=-125.0 T=-14.9]
  #4 ang= +24° d=0.50m pos=(0.95,3.89) score=-187.8 [O=+2.5 U=+10.2 V=-4.2 W=-3.0 R=-67.6 F=+14.0 B=-125.0 T=-14.9]
  #5 ang= +24° d=0.50m pos=(0.94,3.89) score=-187.8 [O=+2.5 U=+10.2 V=-4.2 W=-3.0 R=-67.6 F=+14.0 B=-125.0 T=-14.9]
  #6 ang= +24° d=0.50m pos=(0.94,3.88) score=-187.8 [O=+2.5 U=+10.2 V=-4.2 W=-3.0 R=-67.6 F=+14.0 B=-125.0 T=-14.9]
  #7 ang= +25° d=0.50m pos=(0.94,3.88) score=-187.9 [O=+2.5 U=+10.2 V=-4.2 W=-3.0 R=-67.6 F=+14.0 B=-125.0 T=-14.9]
  #8 ang= +18° d=0.50m pos=(1.00,3.89) score=-207.5 [O=+2.5 U=+10.1 V=-4.2 W=-3.0 R=-67.6 F=+14.5 B=-150.0 T=-10.0]
[ 72.1s] [GOAL] Selected: (0.94, 3.88) dist=0.50m timeout=28s angle=25° reason=reached
[293] DRIVE goal=(0.94,3.88) dist=0.50m front=0.52m cells=17 rms=4.0cm[294] DRIVE goal=(0.94,3.88) dist=0.46m front=0.46m cells=17 rms=4.0cm[295] DRIVE goal=(0.94,3.88) dist=0.46m front=0.47m cells=17 rms=4.0cm[296] DRIVE goal=(0.94,3.88) dist=0.46m front=0.76m cells=17 rms=4.0cm[297] DRIVE goal=(0.94,3.88) dist=0.46m front=0.78m cells=17 rms=4.0cm[298] DRIVE goal=(0.94,3.88) dist=0.46m front=0.69m cells=17 rms=3.9cm[299] DRIVE goal=(0.94,3.88) dist=0.47m front=0.58m cells=17 rms=3.9cm[300] DRIVE goal=(0.94,3.88) dist=0.47m front=0.51m cells=17 rms=3.9cm[301] DRIVE goal=(0.94,3.88) dist=0.47m front=0.50m cells=17 rms=3.9cm[302] DRIVE goal=(0.94,3.88) dist=0.46m front=0.53m cells=17 rms=3.9cm[303] DRIVE goal=(0.94,3.88) dist=0.46m front=0.49m cells=17 rms=3.9cm[304] DRIVE goal=(0.94,3.88) dist=0.46m front=0.46m cells=17 rms=3.9cm[305] DRIVE goal=(0.94,3.88) dist=0.49m front=0.43m cells=17 rms=3.9cm[306] DRIVE goal=(0.94,3.88) dist=0.49m front=0.43m cells=17 rms=3.9cm

=======================================================
[75.0s] RETURNING TO ORIGIN
=======================================================
Time elapsed: 75.0s / 100.0s (75%)
Origin: (0.00, 0.00)
Current: (1.00, 3.42)
Distance to origin: 3.56m
=======================================================


[A* PLAN] ========== PATH PLANNING START ==========
[A* PLAN] From cell (3, 11) to cell (0, 0)
[A* PLAN] World: (1.00,3.42) -> (0.00,0.00)
[A* PLAN] Distance: 3.56m
[A* PLAN] Grid res: 0.3m, Inflation: 2 cells = 0.60m clearance
[A* PLAN] Map: 170 walls, 204 scanned, 17 visited
[A* PLAN] Inflated obstacles: 367 cells (inflation=2, unreachable=0)
[A* PLAN] Closest wall to START: (4, 11) at 1.0 cells = 0.30m
[A* PLAN] Closest wall to GOAL: (0, -1) at 1.0 cells = 0.30m
[A* PLAN] Cleared 17 visited cells from obstacles (guaranteed traversable)
[A* DEBUG] Cleared 7 cells around goal (radius=1)
[A* PLAN] Start in obstacles: False, Goal in obstacles: False
[A* RESULT] Path found! 12 cells, 17 iterations
[A* RESULT] Total cost: 29.6, Path length: ~3.30m
[A* RESULT] Min wall clearance: 0.0 cells = 0.00m at (1, 3)
[A* WARN] Path passes very close to walls! May cause collisions.
[A* RESULT] Simplified to 23 waypoints
[A* PLAN] ========== PATH PLANNING END ==========

[A*] Planned path with 23 waypoints
  WP0: (1.05, 3.45)
  WP1: (1.05, 3.15)
  WP2: (1.05, 3.15)
  WP3: (0.75, 2.85)
  WP4: (0.75, 2.85)
  WP5: (0.75, 2.55)
  WP6: (0.75, 2.55)
  WP7: (0.75, 2.25)
  WP8: (0.75, 2.25)
  WP9: (0.45, 1.95)
  WP10: (0.45, 1.95)
  WP11: (0.45, 1.65)
  WP12: (0.45, 1.65)
  WP13: (0.45, 1.35)
  WP14: (0.45, 1.35)
  WP15: (0.45, 1.05)
  WP16: (0.45, 1.05)
  WP17: (0.15, 0.75)
  WP18: (0.15, 0.75)
  WP19: (-0.05, 0.60)
  WP20: (0.15, 0.45)
  WP21: (-0.05, 0.30)
  WP22: (0.15, 0.15)

[ 75.0s] [A*] Reached WP0, heading to WP1 (1.05, 3.15)
[307] RETURN DRIVE WP1/23 goal=(1.05,3.15) origin_dist=3.56m front=0.42m
[ 75.2s] [A*] Reached WP1, heading to WP2 (1.05, 3.15)
[308] RETURN DRIVE WP2/23 goal=(1.05,3.15) origin_dist=3.59m front=0.41m
[ 75.4s] [A*] Reached WP2, heading to WP3 (0.75, 2.85)
[309] RETURN DRIVE WP3/23 goal=(0.75,2.85) origin_dist=3.59m front=0.38m[310] RETURN DRIVE WP3/23 goal=(0.75,2.85) origin_dist=3.56m front=0.40m[311] RETURN DRIVE WP3/23 goal=(0.75,2.85) origin_dist=3.55m front=0.41m[312] RETURN DRIVE WP3/23 goal=(0.75,2.85) origin_dist=3.52m front=0.40m[313] RETURN DRIVE WP3/23 goal=(0.75,2.85) origin_dist=3.52m front=0.39m[314] RETURN DRIVE WP3/23 goal=(0.75,2.85) origin_dist=3.51m front=0.61m[315] RETURN DRIVE WP3/23 goal=(0.75,2.85) origin_dist=3.50m front=0.61m[316] RETURN DRIVE WP3/23 goal=(0.75,2.85) origin_dist=3.49m front=0.61m[317] RETURN DRIVE WP3/23 goal=(0.75,2.85) origin_dist=3.49m front=0.61m[318] RETURN DRIVE WP3/23 goal=(0.75,2.85) origin_dist=3.48m front=0.61m[319] RETURN DRIVE WP3/23 goal=(0.75,2.85) origin_dist=3.48m front=0.62m[320] RETURN DRIVE WP3/23 goal=(0.75,2.85) origin_dist=3.51m front=0.61m[321] RETURN DRIVE WP3/23 goal=(0.75,2.85) origin_dist=3.52m front=0.60m[322] RETURN DRIVE WP3/23 goal=(0.75,2.85) origin_dist=3.51m front=0.60m[323] RETURN DRIVE WP3/23 goal=(0.75,2.85) origin_dist=3.52m front=0.57m[324] RETURN DRIVE WP3/23 goal=(0.75,2.85) origin_dist=3.52m front=0.55m[325] RETURN DRIVE WP3/23 goal=(0.75,2.85) origin_dist=3.52m front=0.53m[326] RETURN DRIVE WP3/23 goal=(0.75,2.85) origin_dist=3.52m front=0.50m[327] RETURN DRIVE WP3/23 goal=(0.75,2.85) origin_dist=3.52m front=0.47m[328] RETURN DRIVE WP3/23 goal=(0.75,2.85) origin_dist=3.52m front=0.47m[329] RETURN DRIVE WP3/23 goal=(0.75,2.85) origin_dist=3.52m front=0.46m[330] RETURN DRIVE WP3/23 goal=(0.75,2.85) origin_dist=3.53m front=0.45m[331] RETURN DRIVE WP3/23 goal=(0.75,2.85) origin_dist=3.53m front=0.44m[332] RETURN DRIVE WP3/23 goal=(0.75,2.85) origin_dist=3.53m front=0.44m[333] RETURN DRIVE WP3/23 goal=(0.75,2.85) origin_dist=3.53m front=0.44m[334] RETURN DRIVE WP3/23 goal=(0.75,2.85) origin_dist=3.53m front=0.43m[335] RETURN DRIVE WP3/23 goal=(0.75,2.85) origin_dist=3.54m front=0.43m[336] RETURN DRIVE WP3/23 goal=(0.75,2.85) origin_dist=3.54m front=0.42m[337] RETURN DRIVE WP3/23 goal=(0.75,2.85) origin_dist=3.54m front=0.42m[338] RETURN DRIVE WP3/23 goal=(0.75,2.85) origin_dist=3.54m front=0.42m[339] RETURN DRIVE WP3/23 goal=(0.75,2.85) origin_dist=3.54m front=0.42m[340] RETURN DRIVE WP3/23 goal=(0.75,2.85) origin_dist=3.54m front=0.42m[341] RETURN DRIVE WP3/23 goal=(0.75,2.85) origin_dist=3.54m front=0.42m[342] RETURN DRIVE WP3/23 goal=(0.75,2.85) origin_dist=3.54m front=0.42m[343] RETURN DRIVE WP3/23 goal=(0.75,2.85) origin_dist=3.54m front=0.42m[344] RETURN DRIVE WP3/23 goal=(0.75,2.85) origin_dist=3.54m front=0.42m[345] RETURN DRIVE WP3/23 goal=(0.75,2.85) origin_dist=3.54m front=0.42m[346] RETURN DRIVE WP3/23 goal=(0.75,2.85) origin_dist=3.54m front=0.42m[347] RETURN DRIVE WP3/23 goal=(0.75,2.85) origin_dist=3.54m front=0.42m[348] RETURN DRIVE WP3/23 goal=(0.75,2.85) origin_dist=3.54m front=0.42m[349] RETURN DRIVE WP3/23 goal=(0.75,2.85) origin_dist=3.54m front=0.41m[350] RETURN DRIVE WP3/23 goal=(0.75,2.85) origin_dist=3.54m front=0.41m[351] RETURN DRIVE WP3/23 goal=(0.75,2.85) origin_dist=3.53m front=0.41m[352] RETURN DRIVE WP3/23 goal=(0.75,2.85) origin_dist=3.53m front=0.41m[353] RETURN DRIVE WP3/23 goal=(0.75,2.85) origin_dist=3.53m front=0.41m[354] RETURN DRIVE WP3/23 goal=(0.75,2.85) origin_dist=3.52m front=0.41m[355] RETURN DRIVE WP3/23 goal=(0.75,2.85) origin_dist=3.52m front=0.41m[356] RETURN DRIVE WP3/23 goal=(0.75,2.85) origin_dist=3.52m front=0.41m[357] RETURN DRIVE WP3/23 goal=(0.75,2.85) origin_dist=3.52m front=0.41m[358] RETURN DRIVE WP3/23 goal=(0.75,2.85) origin_dist=3.52m front=0.41m[359] RETURN DRIVE WP3/23 goal=(0.75,2.85) origin_dist=3.52m front=0.41m[360] RETURN DRIVE WP3/23 goal=(0.75,2.85) origin_dist=3.52m front=0.41m[361] RETURN DRIVE WP3/23 goal=(0.75,2.85) origin_dist=3.52m front=0.45m[362] RETURN DRIVE WP3/23 goal=(0.75,2.85) origin_dist=3.52m front=0.52m[363] RETURN DRIVE WP3/23 goal=(0.75,2.85) origin_dist=3.52m front=0.56m[364] RETURN DRIVE WP3/23 goal=(0.75,2.85) origin_dist=3.52m front=0.56m[365] RETURN DRIVE WP3/23 goal=(0.75,2.85) origin_dist=3.52m front=0.56m[366] RETURN DRIVE WP3/23 goal=(0.75,2.85) origin_dist=3.52m front=0.56m[367] RETURN DRIVE WP3/23 goal=(0.75,2.85) origin_dist=3.52m front=0.56m[368] RETURN DRIVE WP3/23 goal=(0.75,2.85) origin_dist=3.52m front=0.56m[369] RETURN DRIVE WP3/23 goal=(0.75,2.85) origin_dist=3.53m front=0.56m[370] RETURN DRIVE WP3/23 goal=(0.75,2.85) origin_dist=3.53m front=0.56m[371] RETURN DRIVE WP3/23 goal=(0.75,2.85) origin_dist=3.53m front=0.57m[372] RETURN DRIVE WP3/23 goal=(0.75,2.85) origin_dist=3.53m front=0.59m[373] RETURN DRIVE WP3/23 goal=(0.75,2.85) origin_dist=3.53m front=0.63m[374] RETURN DRIVE WP3/23 goal=(0.75,2.85) origin_dist=3.53m front=0.64m[375] RETURN DRIVE WP3/23 goal=(0.75,2.85) origin_dist=3.52m front=0.65m[376] RETURN DRIVE WP3/23 goal=(0.75,2.85) origin_dist=3.50m front=0.67m[377] RETURN DRIVE WP3/23 goal=(0.75,2.85) origin_dist=3.49m front=0.70m[378] RETURN DRIVE WP3/23 goal=(0.75,2.85) origin_dist=3.47m front=0.99m[379] RETURN DRIVE WP3/23 goal=(0.75,2.85) origin_dist=3.44m front=0.98m[380] RETURN DRIVE WP3/23 goal=(0.75,2.85) origin_dist=3.42m front=0.97m[381] RETURN DRIVE WP3/23 goal=(0.75,2.85) origin_dist=3.37m front=0.99m[382] RETURN DRIVE WP3/23 goal=(0.75,2.85) origin_dist=3.32m front=1.04m
[ 90.3s] [A*] Reached WP3, heading to WP4 (0.75, 2.85)
[383] RETURN DRIVE WP4/23 goal=(0.75,2.85) origin_dist=3.27m front=1.06m
[ 90.5s] [A*] Reached WP4, heading to WP5 (0.75, 2.55)
[384] RETURN DRIVE WP5/23 goal=(0.75,2.55) origin_dist=3.22m front=1.07m[385] RETURN DRIVE WP5/23 goal=(0.75,2.55) origin_dist=3.16m front=1.06m[386] RETURN DRIVE WP5/23 goal=(0.75,2.55) origin_dist=3.12m front=1.08m[387] RETURN DRIVE WP5/23 goal=(0.75,2.55) origin_dist=3.10m front=1.08m[388] RETURN DRIVE WP5/23 goal=(0.75,2.55) origin_dist=3.07m front=1.08m[389] RETURN DRIVE WP5/23 goal=(0.75,2.55) origin_dist=3.05m front=1.09m[390] RETURN DRIVE WP5/23 goal=(0.75,2.55) origin_dist=3.02m front=1.13m[391] RETURN DRIVE WP5/23 goal=(0.75,2.55) origin_dist=3.00m front=1.14m
[ 92.1s] [A*] Reached WP5, heading to WP6 (0.75, 2.55)
[392] RETURN DRIVE WP6/23 goal=(0.75,2.55) origin_dist=2.98m front=0.72m
[ 92.3s] [A*] Reached WP6, heading to WP7 (0.75, 2.25)
[393] RETURN DRIVE WP7/23 goal=(0.75,2.25) origin_dist=2.93m front=0.70m[394] RETURN DRIVE WP7/23 goal=(0.75,2.25) origin_dist=2.88m front=1.20m[395] RETURN DRIVE WP7/23 goal=(0.75,2.25) origin_dist=2.83m front=0.68m[396] RETURN DRIVE WP7/23 goal=(0.75,2.25) origin_dist=2.77m front=0.64m[397] RETURN DRIVE WP7/23 goal=(0.75,2.25) origin_dist=2.73m front=0.61m
[ 93.3s] [A*] Reached WP7, heading to WP8 (0.75, 2.25)
[398] RETURN DRIVE WP8/23 goal=(0.75,2.25) origin_dist=2.68m front=0.59m
[ 93.5s] [A*] Reached WP8, heading to WP9 (0.45, 1.95)
[399] RETURN DRIVE WP9/23 goal=(0.45,1.95) origin_dist=2.63m front=0.57m[400] RETURN DRIVE WP9/23 goal=(0.45,1.95) origin_dist=2.58m front=0.57m[401] RETURN DRIVE WP9/23 goal=(0.45,1.95) origin_dist=2.54m front=0.56m[402] RETURN DRIVE WP9/23 goal=(0.45,1.95) origin_dist=2.54m front=0.56m[403] RETURN DRIVE WP9/23 goal=(0.45,1.95) origin_dist=2.53m front=1.17m[404] RETURN DRIVE WP9/23 goal=(0.45,1.95) origin_dist=2.53m front=1.16m[405] RETURN DRIVE WP9/23 goal=(0.45,1.95) origin_dist=2.52m front=1.16m[406] RETURN DRIVE WP9/23 goal=(0.45,1.95) origin_dist=2.52m front=1.14m[407] RETURN DRIVE WP9/23 goal=(0.45,1.95) origin_dist=2.50m front=1.12m[408] RETURN DRIVE WP9/23 goal=(0.45,1.95) origin_dist=2.49m front=1.08m[409] RETURN DRIVE WP9/23 goal=(0.45,1.95) origin_dist=2.51m front=0.99m[410] RETURN DRIVE WP9/23 goal=(0.45,1.95) origin_dist=2.51m front=0.98m[411] RETURN DRIVE WP9/23 goal=(0.45,1.95) origin_dist=2.50m front=0.95m[412] RETURN DRIVE WP9/23 goal=(0.45,1.95) origin_dist=2.48m front=0.94m[413] RETURN DRIVE WP9/23 goal=(0.45,1.95) origin_dist=2.46m front=0.93m[414] RETURN DRIVE WP9/23 goal=(0.45,1.95) origin_dist=2.43m front=0.86m[415] RETURN DRIVE WP9/23 goal=(0.45,1.95) origin_dist=2.39m front=0.82m[416] RETURN DRIVE WP9/23 goal=(0.45,1.95) origin_dist=2.36m front=0.85m
[ 97.1s] [A*] Reached WP9, heading to WP10 (0.45, 1.95)
[417] RETURN DRIVE WP10/23 goal=(0.45,1.95) origin_dist=2.31m front=0.88m
[ 97.3s] [A*] Reached WP10, heading to WP11 (0.45, 1.65)
[418] RETURN DRIVE WP11/23 goal=(0.45,1.65) origin_dist=2.24m front=0.83m[419] RETURN DRIVE WP11/23 goal=(0.45,1.65) origin_dist=2.17m front=0.79m[420] RETURN DRIVE WP11/23 goal=(0.45,1.65) origin_dist=2.15m front=0.81m[421] RETURN DRIVE WP11/23 goal=(0.45,1.65) origin_dist=2.12m front=0.78m[422] RETURN DRIVE WP11/23 goal=(0.45,1.65) origin_dist=2.11m front=0.73m[423] RETURN DRIVE WP11/23 goal=(0.45,1.65) origin_dist=2.08m front=0.75m[424] RETURN DRIVE WP11/23 goal=(0.45,1.65) origin_dist=2.06m front=0.80m[425] RETURN DRIVE WP11/23 goal=(0.45,1.65) origin_dist=2.07m front=0.81m[426] RETURN DRIVE WP11/23 goal=(0.45,1.65) origin_dist=2.09m front=0.84m[427] RETURN DRIVE WP11/23 goal=(0.45,1.65) origin_dist=2.10m front=0.93m[428] RETURN DRIVE WP11/23 goal=(0.45,1.65) origin_dist=2.08m front=0.96m[429] RETURN DRIVE WP11/23 goal=(0.45,1.65) origin_dist=2.07m front=0.97m
[ 99.8s] [A*] Reached WP11, heading to WP12 (0.45, 1.65)
[430] RETURN DRIVE WP12/23 goal=(0.45,1.65) origin_dist=2.03m front=0.99m
[100.0s] [A*] Reached WP12, heading to WP13 (0.45, 1.35)
[431] RETURN DRIVE WP13/23 goal=(0.45,1.35) origin_dist=1.96m front=1.03m[432] RETURN DRIVE WP13/23 goal=(0.45,1.35) origin_dist=1.92m front=1.01m[433] RETURN DRIVE WP13/23 goal=(0.45,1.35) origin_dist=1.86m front=0.97m[434] RETURN DRIVE WP13/23 goal=(0.45,1.35) origin_dist=1.78m front=0.91m
[100.8s] [A*] Reached WP13, heading to WP14 (0.45, 1.35)
[435] RETURN DRIVE WP14/23 goal=(0.45,1.35) origin_dist=1.73m front=0.89m
[101.0s] [A*] Reached WP14, heading to WP15 (0.45, 1.05)
[436] RETURN DRIVE WP15/23 goal=(0.45,1.05) origin_dist=1.69m front=0.94m[437] RETURN DRIVE WP15/23 goal=(0.45,1.05) origin_dist=1.65m front=0.94m[438] RETURN DRIVE WP15/23 goal=(0.45,1.05) origin_dist=1.64m front=0.92m[439] RETURN DRIVE WP15/23 goal=(0.45,1.05) origin_dist=1.59m front=0.90m[440] RETURN DRIVE WP15/23 goal=(0.45,1.05) origin_dist=1.57m front=0.88m[441] RETURN DRIVE WP15/23 goal=(0.45,1.05) origin_dist=1.52m front=0.75m
[102.2s] [A*] Reached WP15, heading to WP16 (0.45, 1.05)
[442] RETURN DRIVE WP16/23 goal=(0.45,1.05) origin_dist=1.47m front=0.70m
[102.4s] [A*] Reached WP16, heading to WP17 (0.15, 0.75)
[443] RETURN DRIVE WP17/23 goal=(0.15,0.75) origin_dist=1.44m front=0.65m[444] RETURN DRIVE WP17/23 goal=(0.15,0.75) origin_dist=1.42m front=0.66m[445] RETURN DRIVE WP17/23 goal=(0.15,0.75) origin_dist=1.41m front=0.65m[446] RETURN DRIVE WP17/23 goal=(0.15,0.75) origin_dist=1.42m front=0.81m[447] RETURN DRIVE WP17/23 goal=(0.15,0.75) origin_dist=1.44m front=0.82m[448] RETURN DRIVE WP17/23 goal=(0.15,0.75) origin_dist=1.45m front=0.83m[449] RETURN DRIVE WP17/23 goal=(0.15,0.75) origin_dist=1.44m front=0.83m[450] RETURN DRIVE WP17/23 goal=(0.15,0.75) origin_dist=1.44m front=0.83m[451] RETURN DRIVE WP17/23 goal=(0.15,0.75) origin_dist=1.44m front=0.84m[452] RETURN DRIVE WP17/23 goal=(0.15,0.75) origin_dist=1.44m front=0.83m[453] RETURN DRIVE WP17/23 goal=(0.15,0.75) origin_dist=1.45m front=0.87m[454] RETURN DRIVE WP17/23 goal=(0.15,0.75) origin_dist=1.46m front=0.90m[455] RETURN DRIVE WP17/23 goal=(0.15,0.75) origin_dist=1.46m front=0.90m[456] RETURN DRIVE WP17/23 goal=(0.15,0.75) origin_dist=1.46m front=0.90m[457] RETURN DRIVE WP17/23 goal=(0.15,0.75) origin_dist=1.46m front=0.90m[458] RETURN DRIVE WP17/23 goal=(0.15,0.75) origin_dist=1.46m front=0.90m[459] RETURN DRIVE WP17/23 goal=(0.15,0.75) origin_dist=1.45m front=0.90m[460] RETURN DRIVE WP17/23 goal=(0.15,0.75) origin_dist=1.43m front=0.90m[461] RETURN DRIVE WP17/23 goal=(0.15,0.75) origin_dist=1.39m front=0.89m[462] RETURN DRIVE WP17/23 goal=(0.15,0.75) origin_dist=1.39m front=0.88m[463] RETURN DRIVE WP17/23 goal=(0.15,0.75) origin_dist=1.37m front=0.88m[464] RETURN DRIVE WP17/23 goal=(0.15,0.75) origin_dist=1.33m front=0.88m[465] RETURN DRIVE WP17/23 goal=(0.15,0.75) origin_dist=1.30m front=0.86m[466] RETURN DRIVE WP17/23 goal=(0.15,0.75) origin_dist=1.29m front=0.83m[467] RETURN DRIVE WP17/23 goal=(0.15,0.75) origin_dist=1.26m front=0.82m[468] RETURN DRIVE WP17/23 goal=(0.15,0.75) origin_dist=1.21m front=0.84m[469] RETURN DRIVE WP17/23 goal=(0.15,0.75) origin_dist=1.17m front=0.82m[470] RETURN DRIVE WP17/23 goal=(0.15,0.75) origin_dist=1.15m front=0.81m[471] RETURN DRIVE WP17/23 goal=(0.15,0.75) origin_dist=1.13m front=0.79m[472] RETURN DRIVE WP17/23 goal=(0.15,0.75) origin_dist=1.11m front=0.77m
[108.4s] [A*] Reached WP17, heading to WP18 (0.15, 0.75)
[473] RETURN DRIVE WP18/23 goal=(0.15,0.75) origin_dist=1.09m front=0.75m
[108.6s] [A*] Reached WP18, heading to WP19 (-0.05, 0.60)
[474] RETURN DRIVE WP19/23 goal=(-0.05,0.60) origin_dist=1.06m front=0.75m[475] RETURN DRIVE WP19/23 goal=(-0.05,0.60) origin_dist=1.00m front=0.72m[476] RETURN DRIVE WP19/23 goal=(-0.05,0.60) origin_dist=0.95m front=0.71m[477] RETURN DRIVE WP19/23 goal=(-0.05,0.60) origin_dist=0.91m front=0.70m[478] RETURN DRIVE WP19/23 goal=(-0.05,0.60) origin_dist=0.89m front=0.69m[479] RETURN DRIVE WP19/23 goal=(-0.05,0.60) origin_dist=0.87m front=0.68m
[109.8s] [A*] Reached WP19, heading to WP20 (0.15, 0.45)
[480] RETURN DRIVE WP20/23 goal=(0.15,0.45) origin_dist=0.85m front=0.67m[481] RETURN DRIVE WP20/23 goal=(0.15,0.45) origin_dist=0.83m front=0.67m[482] RETURN DRIVE WP20/23 goal=(0.15,0.45) origin_dist=0.82m front=0.67m
[110.4s] [A*] Reached WP20, heading to WP21 (-0.05, 0.30)
[483] RETURN DRIVE WP21/23 goal=(-0.05,0.30) origin_dist=0.81m front=0.66m[484] RETURN DRIVE WP21/23 goal=(-0.05,0.30) origin_dist=0.81m front=0.66m[485] RETURN DRIVE WP21/23 goal=(-0.05,0.30) origin_dist=0.80m front=0.66m[486] RETURN DRIVE WP21/23 goal=(-0.05,0.30) origin_dist=0.78m front=0.66m[487] RETURN DRIVE WP21/23 goal=(-0.05,0.30) origin_dist=0.75m front=0.66m[488] RETURN DRIVE WP21/23 goal=(-0.05,0.30) origin_dist=0.73m front=0.66m[489] RETURN DRIVE WP21/23 goal=(-0.05,0.30) origin_dist=0.71m front=0.65m[490] RETURN DRIVE WP21/23 goal=(-0.05,0.30) origin_dist=0.67m front=0.65m
[112.0s] [A*] Reached WP21, heading to WP22 (0.15, 0.15)
[491] RETURN DRIVE WP22/23 goal=(0.15,0.15) origin_dist=0.62m front=0.65m[492] RETURN DRIVE WP22/23 goal=(0.15,0.15) origin_dist=0.57m front=0.63m[493] RETURN DRIVE WP22/23 goal=(0.15,0.15) origin_dist=0.54m front=0.63m[494] RETURN DRIVE WP22/23 goal=(0.15,0.15) origin_dist=0.52m front=0.62m[495] RETURN DRIVE WP22/23 goal=(0.15,0.15) origin_dist=0.51m front=0.63m[496] RETURN DRIVE WP22/23 goal=(0.15,0.15) origin_dist=0.51m front=0.64m[497] RETURN DRIVE WP22/23 goal=(0.15,0.15) origin_dist=0.51m front=0.63m[498] RETURN DRIVE WP22/23 goal=(0.15,0.15) origin_dist=0.51m front=0.61m[499] RETURN DRIVE WP22/23 goal=(0.15,0.15) origin_dist=0.51m front=0.61m[500] RETURN DRIVE WP22/23 goal=(0.15,0.15) origin_dist=0.51m front=0.61m[501] RETURN DRIVE WP22/23 goal=(0.15,0.15) origin_dist=0.51m front=0.61m[502] RETURN DRIVE WP22/23 goal=(0.15,0.15) origin_dist=0.51m front=0.61m[503] RETURN DRIVE WP22/23 goal=(0.15,0.15) origin_dist=0.51m front=0.60m[504] RETURN DRIVE WP22/23 goal=(0.15,0.15) origin_dist=0.51m front=0.60m[505] RETURN DRIVE WP22/23 goal=(0.15,0.15) origin_dist=0.51m front=0.60m[506] RETURN DRIVE WP22/23 goal=(0.15,0.15) origin_dist=0.53m front=0.61m[507] RETURN DRIVE WP22/23 goal=(0.15,0.15) origin_dist=0.54m front=0.61m[508] RETURN DRIVE WP22/23 goal=(0.15,0.15) origin_dist=0.54m front=0.62m[509] RETURN DRIVE WP22/23 goal=(0.15,0.15) origin_dist=0.53m front=0.61m[510] RETURN DRIVE WP22/23 goal=(0.15,0.15) origin_dist=0.53m front=0.61m[511] RETURN DRIVE WP22/23 goal=(0.15,0.15) origin_dist=0.48m front=0.60m
[116.2s] [A*] All waypoints reached, heading to origin
[512] RETURN DRIVE WP23/23 goal=(0.00,0.00) origin_dist=0.44m front=0.58m[513] RETURN DRIVE WP23/23 goal=(0.00,0.00) origin_dist=0.40m front=0.57m[514] RETURN DRIVE WP23/23 goal=(0.00,0.00) origin_dist=0.40m front=0.56m[515] RETURN DRIVE WP23/23 goal=(0.00,0.00) origin_dist=0.38m front=0.56m[516] RETURN DRIVE WP23/23 goal=(0.00,0.00) origin_dist=0.38m front=0.55m[517] RETURN DRIVE WP23/23 goal=(0.00,0.00) origin_dist=0.38m front=0.55m[518] RETURN DRIVE WP23/23 goal=(0.00,0.00) origin_dist=0.38m front=0.55m[519] RETURN DRIVE WP23/23 goal=(0.00,0.00) origin_dist=0.37m front=0.55m[520] RETURN DRIVE WP23/23 goal=(0.00,0.00) origin_dist=0.37m front=0.55m[521] RETURN DRIVE WP23/23 goal=(0.00,0.00) origin_dist=0.34m front=0.55m[522] RETURN DRIVE WP23/23 goal=(0.00,0.00) origin_dist=0.34m front=0.54m[523] RETURN DRIVE WP23/23 goal=(0.00,0.00) origin_dist=0.33m front=0.54m[524] RETURN DRIVE WP23/23 goal=(0.00,0.00) origin_dist=0.31m front=0.53m[525] RETURN DRIVE WP23/23 goal=(0.00,0.00) origin_dist=0.31m front=0.53m[526] RETURN DRIVE WP23/23 goal=(0.00,0.00) origin_dist=0.30m front=0.53m[527] RETURN DRIVE WP23/23 goal=(0.00,0.00) origin_dist=0.26m front=0.52m[528] RETURN DRIVE WP23/23 goal=(0.00,0.00) origin_dist=0.24m front=0.51m[529] RETURN DRIVE WP23/23 goal=(0.00,0.00) origin_dist=0.19m front=0.50m[530] RETURN DRIVE WP23/23 goal=(0.00,0.00) origin_dist=0.18m front=0.49m[531] RETURN DRIVE WP23/23 goal=(0.00,0.00) origin_dist=0.12m front=0.48m[532] RETURN DRIVE WP23/23 goal=(0.00,0.00) origin_dist=0.07m front=0.47m

=======================================================
[120.4s] MISSION COMPLETE!
=======================================================
Successfully returned to origin!
Final position: (0.02, 0.02)
Origin: (0.00, 0.00)
Distance error: 0.03m

[DRIFT CHECK] Comparing wall signatures:
  Original: ['0.58', '0.57', '0.56', '0.56', '0.56', '0.57', '0.58', '0.59', '1.01', '0.92', '0.84', '0.79', '0.60', '0.57', '0.55', '0.51', '0.49', '0.51', '0.55', '0.55', '0.54', '0.64', '0.68', '5.00', '5.00', '5.00', '5.00', '5.00', '5.00', '5.00', '5.00', '5.00', '5.00', '5.00', '5.00', '5.00', '5.00', '5.00', '0.75', '0.84', '1.75', '1.99', '3.69', '3.75', '5.16', '1.80', '1.80', '1.31', '1.32', '1.35', '1.39', '1.45', '0.93', '0.79', '0.73', '0.71', '0.65', '0.61', '0.59', '0.60']
  Current:  ['0.51', '0.50', '0.49', '0.48', '0.43', '0.44', '0.49', '0.50', '0.49', '0.49', '0.60', '0.65', '0.72', '0.57', '0.57', '0.60', '0.60', '0.61', '0.62', '0.64', '0.66', '0.65', '0.66', '5.00', '5.00', '5.00', '5.00', '5.00', '5.00', '5.00', '5.00', '5.00', '5.00', '5.00', '5.00', '5.00', '5.00', '5.00', '1.02', '0.83', '0.78', '0.75', '0.69', '0.65', '0.63', '0.62', '0.61', '0.59', '0.58', '0.58', '0.58', '0.58', '0.60', '1.01', '0.96', '0.86', '0.80', '0.59', '0.56', '0.53']
  Avg drift: 0.39m, Max drift: 4.53m
=======================================================

[MARKER] Publisher stopped

=======================================================
NBV NAVIGATION COMPLETE
=======================================================
Final state: returning
Duration: 120.5s
Iterations: 533
Goals reached: 10
Backups: 2
Unique cells visited: 18
Cells scanned by LiDAR: 208
Walls detected: 174

--- Drive Accuracy ---
Cross-track RMS error: 3.9cm
Total distance traveled: 5.99m
Ideal distance (sum of goals): 8.50m
Drive efficiency: 141.9%

--- Return Phase ---
Return phase duration: 45.5s
Final distance to origin: 0.03m
Revisit rate: 100.0%

--- Map Accuracy Suggestions ---
To measure map accuracy, consider:
1. Ground truth comparison: Place markers at known positions,
   compare measured vs actual distances between them
2. Loop closure error: After returning to origin, check
   odometry drift (final_dist to origin should be ~0)
3. Feature alignment: Compare map walls to actual room layout
4. Consistency check: Run multiple times, overlay maps
5. Tape measure validation: Measure actual room dimensions,
   compare to map scale (resolution * pixels)
[OUTPUT] Map saved to: /home/ws/ugv_cont/mission/outputs/20251224_220844/maps
