[OUTPUT] Logging to: /home/ws/ugv_cont/mission/outputs/20251221_205932
[OUTPUT] Log file: /home/ws/ugv_cont/mission/outputs/20251221_205932/logs/navigation.log
=======================================================
NEXT-BEST-VIEW (NBV) NAVIGATION
=======================================================
Speed: 0.08 m/s
Goal distance: 0.5-2.0m
Press Ctrl+C to stop

[DEBUG] Marker publishing enabled - check /nav_goal in RViz
[MARKER] Persistent marker publisher started - add /nav_goal in RViz
[START] Initial position: (0.01, -0.02)
[MARKER] Origin marker (blue) started at (0.01, -0.02) - add /nav_origin in RViz

[  2.3s] [GOAL SELECT] robot@(0.01,-0.02) | 16 candidates (scanned=47 walls=19 visited=1):
  #1 ang= -58° d=0.50m pos=(-0.20,0.44) score=+38.7 [O=+1.6 U=+38.0 V=-0.0 W=-1.0 R=-0.0 F=+0.0] <-- BEST
  #2 ang= -64° d=0.50m pos=(-0.15,0.46) score=+38.7 [O=+1.6 U=+38.0 V=-0.0 W=-1.0 R=-0.0 F=+0.0]
  #3 ang=-101° d=2.00m pos=(0.66,1.87) score=+36.1 [O=+2.5 U=+34.0 V=-0.0 W=-1.0 R=-0.0 F=+0.0]
  #4 ang= -70° d=0.50m pos=(-0.10,0.47) score=+34.7 [O=+1.6 U=+34.0 V=-0.0 W=-1.0 R=-0.0 F=+0.0]
  #5 ang=-107° d=2.00m pos=(0.85,1.79) score=+34.1 [O=+2.5 U=+32.0 V=-0.0 W=-1.0 R=-0.0 F=+0.0]
  #6 ang= -82° d=0.50m pos=(0.01,0.48) score=+33.4 [O=+2.3 U=+32.0 V=-0.0 W=-1.0 R=-0.0 F=+0.0]
  #7 ang= -76° d=0.50m pos=(-0.04,0.48) score=+33.0 [O=+1.8 U=+32.0 V=-0.0 W=-1.0 R=-0.0 F=+0.0]
  #8 ang= -94° d=1.50m pos=(0.34,1.45) score=+32.0 [O=+2.5 U=+32.0 V=-0.0 W=-3.0 R=-0.0 F=+0.0]
[  2.3s] [GOAL] Selected: (-0.20, 0.44) dist=0.50m timeout=28s angle=-58° reason=no goal
[  1] DRIVE goal=(-0.20,0.44) dist=0.50m front=0.42m cells=1 rms=0.0cm[  2] DRIVE goal=(-0.20,0.44) dist=0.50m front=0.42m cells=1 rms=0.0cm[  3] DRIVE goal=(-0.20,0.44) dist=0.50m front=0.41m cells=1 rms=0.1cm[  4] DRIVE goal=(-0.20,0.44) dist=0.50m front=0.41m cells=1 rms=0.2cm[  5] DRIVE goal=(-0.20,0.44) dist=0.50m front=0.41m cells=1 rms=0.2cm[  6] DRIVE goal=(-0.20,0.44) dist=0.50m front=0.42m cells=1 rms=0.3cm[  7] DRIVE goal=(-0.20,0.44) dist=0.50m front=0.42m cells=1 rms=0.3cm[  8] DRIVE goal=(-0.20,0.44) dist=0.50m front=0.47m cells=1 rms=0.3cm[  9] DRIVE goal=(-0.20,0.44) dist=0.50m front=0.57m cells=1 rms=0.3cm[ 10] DRIVE goal=(-0.20,0.44) dist=0.50m front=0.57m cells=1 rms=0.4cm[ 11] DRIVE goal=(-0.20,0.44) dist=0.50m front=0.57m cells=1 rms=0.4cm[ 12] DRIVE goal=(-0.20,0.44) dist=0.51m front=0.58m cells=1 rms=0.4cm[ 13] DRIVE goal=(-0.20,0.44) dist=0.51m front=0.58m cells=1 rms=0.4cm[ 14] DRIVE goal=(-0.20,0.44) dist=0.51m front=0.58m cells=1 rms=0.4cm[ 15] DRIVE goal=(-0.20,0.44) dist=0.51m front=0.58m cells=1 rms=0.4cm[ 16] DRIVE goal=(-0.20,0.44) dist=0.51m front=0.58m cells=1 rms=0.3cm[ 17] DRIVE goal=(-0.20,0.44) dist=0.52m front=0.59m cells=1 rms=0.3cm[ 18] DRIVE goal=(-0.20,0.44) dist=0.51m front=0.59m cells=1 rms=0.3cm[ 19] DRIVE goal=(-0.20,0.44) dist=0.52m front=0.59m cells=1 rms=0.3cm[ 20] DRIVE goal=(-0.20,0.44) dist=0.52m front=0.60m cells=1 rms=0.3cm[ 21] DRIVE goal=(-0.20,0.44) dist=0.52m front=0.61m cells=1 rms=0.3cm[ 22] DRIVE goal=(-0.20,0.44) dist=0.52m front=0.61m cells=1 rms=0.3cm[ 23] DRIVE goal=(-0.20,0.44) dist=0.52m front=0.90m cells=1 rms=0.3cm[ 24] DRIVE goal=(-0.20,0.44) dist=0.52m front=0.64m cells=1 rms=0.3cm[ 25] DRIVE goal=(-0.20,0.44) dist=0.51m front=0.89m cells=1 rms=0.3cm[ 26] DRIVE goal=(-0.20,0.44) dist=0.50m front=0.88m cells=1 rms=0.3cm[ 27] DRIVE goal=(-0.20,0.44) dist=0.48m front=0.86m cells=1 rms=0.4cm[ 28] DRIVE goal=(-0.20,0.44) dist=0.47m front=0.85m cells=1 rms=0.4cm[ 29] DRIVE goal=(-0.20,0.44) dist=0.46m front=0.84m cells=1 rms=0.5cm[ 30] DRIVE goal=(-0.20,0.44) dist=0.44m front=0.83m cells=1 rms=0.5cm[ 31] DRIVE goal=(-0.20,0.44) dist=0.43m front=0.82m cells=1 rms=0.5cm[ 32] DRIVE goal=(-0.20,0.44) dist=0.42m front=0.80m cells=1 rms=0.6cm[ 33] DRIVE goal=(-0.20,0.44) dist=0.41m front=0.79m cells=1 rms=0.6cm
[  9.2s] [REFINE] best score 19.8 < 20.0, resampling with 150 angles (level 1)

[  9.2s] [GOAL SELECT] robot@(-0.05,0.08) | 31 candidates (refined 1x) (scanned=70 walls=38 visited=1):
  #1 ang= -19° d=0.50m pos=(-0.14,0.57) score=+23.6 [O=+1.7 U=+38.0 V=-0.0 W=-3.0 R=-13.3 F=+0.0] <-- BEST
  #2 ang= -51° d=1.00m pos=(0.32,1.01) score=+19.8 [O=+2.5 U=+20.0 V=-0.0 W=-3.0 R=-0.0 F=+0.0]
  #3 ang= -21° d=0.50m pos=(-0.12,0.57) score=+19.6 [O=+1.7 U=+34.0 V=-0.0 W=-3.0 R=-13.3 F=+0.0]
  #4 ang= -23° d=0.50m pos=(-0.10,0.58) score=+19.6 [O=+1.7 U=+34.0 V=-0.0 W=-3.0 R=-13.3 F=+0.0]
  #5 ang= -25° d=0.50m pos=(-0.09,0.58) score=+18.1 [O=+2.2 U=+32.0 V=-0.0 W=-3.0 R=-13.3 F=+0.0]
  #6 ang= -53° d=1.00m pos=(0.36,0.99) score=+17.8 [O=+2.5 U=+18.0 V=-0.0 W=-3.0 R=-0.0 F=+0.0]
  #7 ang= -59° d=1.00m pos=(0.45,0.94) score=+17.3 [O=+2.0 U=+18.0 V=-0.0 W=-3.0 R=-0.0 F=+0.0]
  #8 ang= -61° d=1.00m pos=(0.48,0.93) score=+17.1 [O=+1.8 U=+18.0 V=-0.0 W=-3.0 R=-0.0 F=+0.0]
[  9.2s] [GOAL] Selected: (-0.14, 0.57) dist=0.50m timeout=28s angle=-19° reason=reached
[ 34] DRIVE goal=(-0.14,0.57) dist=0.50m front=0.76m cells=1 rms=0.6cm[ 35] DRIVE goal=(-0.14,0.57) dist=0.46m front=0.74m cells=1 rms=0.6cm[ 36] DRIVE goal=(-0.14,0.57) dist=0.45m front=0.72m cells=1 rms=0.7cm[ 37] DRIVE goal=(-0.14,0.57) dist=0.44m front=0.71m cells=1 rms=0.8cm[ 38] DRIVE goal=(-0.14,0.57) dist=0.43m front=0.70m cells=1 rms=0.8cm[ 39] DRIVE goal=(-0.14,0.57) dist=0.43m front=0.70m cells=1 rms=0.9cm[ 40] DRIVE goal=(-0.14,0.57) dist=0.42m front=0.69m cells=1 rms=1.0cm[ 41] DRIVE goal=(-0.14,0.57) dist=0.42m front=0.69m cells=1 rms=1.1cm
[ 11.0s] [GOAL SELECT] robot@(-0.10,0.17) | 13 candidates (scanned=91 walls=45 visited=1):
  #1 ang= -64° d=1.00m pos=(0.58,0.91) score=+24.9 [O=+1.6 U=+26.0 V=-0.0 W=-3.0 R=-0.0 F=+0.0] <-- BEST
  #2 ang= -52° d=1.00m pos=(0.40,1.04) score=+19.2 [O=+1.9 U=+20.0 V=-0.0 W=-3.0 R=-0.0 F=+0.0]
  #3 ang= -45° d=1.00m pos=(0.31,1.09) score=+17.8 [O=+2.5 U=+18.0 V=-0.0 W=-3.0 R=-0.0 F=+0.0]
  #4 ang= -58° d=1.00m pos=(0.49,0.98) score=+17.1 [O=+1.7 U=+18.0 V=-0.0 W=-3.0 R=-0.0 F=+0.0]
  #5 ang= -15° d=0.50m pos=(-0.16,0.67) score=+14.5 [O=+1.6 U=+34.0 V=-0.0 W=-3.0 R=-18.2 F=+0.0]
  #6 ang= -21° d=0.50m pos=(-0.10,0.67) score=+11.0 [O=+2.1 U=+30.0 V=-0.0 W=-3.0 R=-18.2 F=+0.0]
  #7 ang= -27° d=0.50m pos=(-0.05,0.67) score=+9.0 [O=+2.1 U=+28.0 V=-0.0 W=-3.0 R=-18.2 F=+0.0]
  #8 ang= -33° d=0.50m pos=(0.00,0.66) score=+1.5 [O=+2.5 U=+20.1 V=-0.0 W=-3.0 R=-18.2 F=+0.0]
[ 11.0s] [GOAL] Selected: (0.58, 0.91) dist=1.00m timeout=35s angle=-64° reason=reached
[ 42] DRIVE goal=(0.58,0.91) dist=1.00m front=0.67m cells=1 rms=1.1cm[ 43] DRIVE goal=(0.58,0.91) dist=1.00m front=0.66m cells=1 rms=1.1cm[ 44] DRIVE goal=(0.58,0.91) dist=1.00m front=0.66m cells=1 rms=1.1cm[ 45] DRIVE goal=(0.58,0.91) dist=1.00m front=0.66m cells=1 rms=1.1cm[ 46] DRIVE goal=(0.58,0.91) dist=0.99m front=0.66m cells=1 rms=1.1cm[ 47] DRIVE goal=(0.58,0.91) dist=1.00m front=0.67m cells=1 rms=1.1cm[ 48] DRIVE goal=(0.58,0.91) dist=1.00m front=0.67m cells=1 rms=1.1cm[ 49] DRIVE goal=(0.58,0.91) dist=1.00m front=0.68m cells=1 rms=1.1cm[ 50] DRIVE goal=(0.58,0.91) dist=1.00m front=0.68m cells=1 rms=1.1cm[ 51] DRIVE goal=(0.58,0.91) dist=1.00m front=0.70m cells=1 rms=1.2cm[ 52] DRIVE goal=(0.58,0.91) dist=1.00m front=0.73m cells=1 rms=1.2cm[ 53] DRIVE goal=(0.58,0.91) dist=1.00m front=0.73m cells=1 rms=1.2cm[ 54] DRIVE goal=(0.58,0.91) dist=1.00m front=0.73m cells=1 rms=1.2cm[ 55] DRIVE goal=(0.58,0.91) dist=1.00m front=0.74m cells=1 rms=1.2cm
[ 14.0s] [TURN ENTER] Entering TURN mode

[BLOCKED DEBUG] Goal angle: -45.3° (sector 52), goal_dist: 1.00m, goal_dir_min: 0.80m, margin: 0.15m
[BLOCKED DEBUG] Checking 1 sectors (robot angular width at 1.0m = 10.3°): {52: 0.798}
[BLOCKED DEBUG] Check: 0.80 < 1.00 - 0.15 = 0.85? True
[BLOCKED DEBUG] (Full front arc for reference: {55: 2.709, 56: 3.548, 57: 3.54, 58: 1.58, 59: 1.569, 0: 1.074, 1: 0.862, 2: 0.821, 3: 0.83, 4: 0.85, 5: 0.879})

[BLOCKED TURN] goal_sector=52, best_sector=52 (dist=0.80m), target_angle=-48.0°, angle_error=-48.0°, v=0.00, w=-0.50
[ 56] TURN goal=(0.58,0.91) dist=1.00m front=0.82m cells=1 rms=1.2cm[ 57] TURN goal=(0.58,0.91) dist=1.00m front=0.82m cells=1 rms=1.2cm[ 58] TURN goal=(0.58,0.91) dist=1.00m front=0.82m cells=1 rms=1.2cm[ 59] TURN goal=(0.58,0.91) dist=1.00m front=0.83m cells=1 rms=1.2cm[ 60] TURN goal=(0.58,0.91) dist=1.00m front=0.82m cells=1 rms=1.2cm[ 61] TURN goal=(0.58,0.91) dist=1.00m front=0.82m cells=1 rms=1.2cm[ 62] DRIVE goal=(0.58,0.91) dist=1.00m front=0.82m cells=1 rms=1.3cm
[ 15.4s] [TURN ENTER] Entering TURN mode

[BLOCKED DEBUG] Goal angle: -30.8° (sector 54), goal_dist: 1.00m, goal_dir_min: 0.79m, margin: 0.15m
[BLOCKED DEBUG] Checking 1 sectors (robot angular width at 1.0m = 10.3°): {54: 0.788}
[BLOCKED DEBUG] Check: 0.79 < 1.00 - 0.15 = 0.85? True
[BLOCKED DEBUG] (Full front arc for reference: {55: 1.574, 56: 1.739, 57: 2.615, 58: 3.572, 59: 3.538, 0: 5.304, 1: 1.57, 2: 1.569, 3: 1.077, 4: 0.826, 5: 0.829})

[BLOCKED TURN] goal_sector=54, best_sector=54 (dist=0.79m), target_angle=-36.0°, angle_error=-36.0°, v=0.00, w=-0.50
[ 63] TURN goal=(0.58,0.91) dist=1.00m front=0.83m cells=1 rms=1.3cm[ 64] DRIVE goal=(0.58,0.91) dist=1.00m front=0.83m cells=1 rms=1.3cm[ 65] DRIVE goal=(0.58,0.91) dist=1.00m front=0.82m cells=1 rms=1.3cm
[ 16.0s] [TURN ENTER] Entering TURN mode

[BLOCKED DEBUG] Goal angle: -25.9° (sector 55), goal_dist: 1.00m, goal_dir_min: 0.79m, margin: 0.15m
[BLOCKED DEBUG] Checking 1 sectors (robot angular width at 1.0m = 10.3°): {55: 0.787}
[BLOCKED DEBUG] Check: 0.79 < 1.00 - 0.15 = 0.85? True
[BLOCKED DEBUG] (Full front arc for reference: {55: 0.787, 56: 1.589, 57: 1.755, 58: 2.599, 59: 3.575, 0: 3.541, 1: 5.033, 2: 1.566, 3: 1.568, 4: 1.074, 5: 0.823})

[BLOCKED TURN] goal_sector=55, best_sector=55 (dist=0.79m), target_angle=-30.0°, angle_error=-30.0°, v=0.00, w=-0.50
[ 66] TURN goal=(0.58,0.91) dist=1.00m front=0.79m cells=1 rms=1.3cm[ 67] TURN goal=(0.58,0.91) dist=1.00m front=0.78m cells=1 rms=1.3cm[ 68] DRIVE goal=(0.58,0.91) dist=1.00m front=0.77m cells=1 rms=1.3cm
[ 16.6s] [TURN ENTER] Entering TURN mode

[BLOCKED DEBUG] Goal angle: -20.6° (sector 56), goal_dist: 1.00m, goal_dir_min: 0.77m, margin: 0.15m
[BLOCKED DEBUG] Checking 1 sectors (robot angular width at 1.0m = 10.3°): {56: 0.768}
[BLOCKED DEBUG] Check: 0.77 < 1.00 - 0.15 = 0.85? True
[BLOCKED DEBUG] (Full front arc for reference: {55: 0.723, 56: 0.768, 57: 1.531, 58: 1.683, 59: 1.879, 0: 3.592, 1: 3.531, 2: 3.596, 3: 1.562, 4: 1.562, 5: 1.071})

[BLOCKED TURN] goal_sector=56, best_sector=56 (dist=0.77m), target_angle=-24.0°, angle_error=-24.0°, v=0.00, w=-0.50
[ 69] TURN goal=(0.58,0.91) dist=1.00m front=0.72m cells=1 rms=1.3cm[ 70] TURN goal=(0.58,0.91) dist=0.99m front=0.68m cells=1 rms=1.4cm[ 71] TURN goal=(0.58,0.91) dist=0.98m front=0.66m cells=1 rms=1.4cm[ 72] DRIVE goal=(0.58,0.91) dist=0.98m front=0.66m cells=1 rms=1.4cm
[ 17.4s] [TURN ENTER] Entering TURN mode

[BLOCKED DEBUG] Goal angle: -2.8° (sector 59), goal_dist: 0.98m, goal_dir_min: 0.75m, margin: 0.15m
[BLOCKED DEBUG] Checking 1 sectors (robot angular width at 1.0m = 10.5°): {59: 0.753}
[BLOCKED DEBUG] Check: 0.75 < 0.98 - 0.15 = 0.83? True
[BLOCKED DEBUG] (Full front arc for reference: {55: 0.657, 56: 0.665, 57: 0.684, 58: 0.715, 59: 0.753, 0: 1.54, 1: 1.697, 2: 2.574, 3: 3.558, 4: 3.52, 5: 5.025})

[BLOCKED TURN] goal_sector=59, best_sector=59 (dist=0.75m), target_angle=-6.0°, angle_error=-6.0°, v=0.05, w=-0.16
[ 73] TURN goal=(0.58,0.91) dist=0.98m front=0.66m cells=1 rms=1.5cm[ 74] TURN goal=(0.58,0.91) dist=0.98m front=0.66m cells=1 rms=1.5cm[ 75] TURN goal=(0.58,0.91) dist=0.98m front=0.66m cells=1 rms=1.6cm[ 76] DRIVE goal=(0.58,0.91) dist=0.97m front=0.64m cells=1 rms=1.6cm
[ 18.2s] [TURN ENTER] Entering TURN mode

[BLOCKED DEBUG] Goal angle: -2.9° (sector 59), goal_dist: 0.95m, goal_dir_min: 0.72m, margin: 0.15m
[BLOCKED DEBUG] Checking 1 sectors (robot angular width at 0.9m = 10.9°): {59: 0.723}
[BLOCKED DEBUG] Check: 0.72 < 0.95 - 0.15 = 0.80? True
[BLOCKED DEBUG] (Full front arc for reference: {55: 0.633, 56: 0.641, 57: 0.657, 58: 0.689, 59: 0.723, 0: 1.509, 1: 1.664, 2: 2.538, 3: 3.524, 4: 3.486, 5: 5.238})

[BLOCKED TURN] goal_sector=59, best_sector=59 (dist=0.72m), target_angle=-6.0°, angle_error=-6.0°, v=0.05, w=-0.16
[ 77] TURN goal=(0.58,0.91) dist=0.95m front=0.63m cells=1 rms=1.6cm[ 78] DRIVE goal=(0.58,0.91) dist=0.94m front=0.63m cells=1 rms=1.7cm
[ 18.6s] [TURN ENTER] Entering TURN mode

[BLOCKED DEBUG] Goal angle: -7.4° (sector 58), goal_dist: 0.92m, goal_dir_min: 0.70m, margin: 0.15m
[BLOCKED DEBUG] Checking 1 sectors (robot angular width at 0.9m = 11.1°): {58: 0.703}
[BLOCKED DEBUG] Check: 0.70 < 0.92 - 0.15 = 0.77? True
[BLOCKED DEBUG] (Full front arc for reference: {55: 0.625, 56: 0.64, 57: 0.672, 58: 0.703, 59: 1.457, 0: 1.597, 1: 1.776, 2: 3.538, 3: 3.463, 4: 3.517, 5: 1.504})

[BLOCKED TURN] goal_sector=58, best_sector=58 (dist=0.70m), target_angle=-12.0°, angle_error=-12.0°, v=0.00, w=-0.31
[ 79] TURN goal=(0.58,0.91) dist=0.92m front=0.62m cells=1 rms=1.7cm[ 80] TURN goal=(0.58,0.91) dist=0.91m front=0.61m cells=1 rms=1.7cm[ 81] DRIVE goal=(0.58,0.91) dist=0.87m front=0.58m cells=1 rms=1.8cm[ 82] DRIVE goal=(0.58,0.91) dist=0.85m front=0.58m cells=2 rms=1.8cm[ 83] DRIVE goal=(0.58,0.91) dist=0.85m front=0.58m cells=2 rms=1.8cm[ 84] DRIVE goal=(0.58,0.91) dist=0.84m front=0.58m cells=2 rms=1.9cm[ 85] DRIVE goal=(0.58,0.91) dist=0.83m front=0.57m cells=2 rms=1.9cm[ 86] DRIVE goal=(0.58,0.91) dist=0.83m front=0.57m cells=2 rms=1.9cm[ 87] DRIVE goal=(0.58,0.91) dist=0.82m front=0.57m cells=2 rms=2.0cm[ 88] DRIVE goal=(0.58,0.91) dist=0.82m front=0.56m cells=2 rms=2.0cm[ 89] DRIVE goal=(0.58,0.91) dist=0.80m front=0.54m cells=2 rms=2.1cm[ 90] DRIVE goal=(0.58,0.91) dist=0.79m front=0.53m cells=2 rms=2.1cm[ 91] DRIVE goal=(0.58,0.91) dist=0.78m front=0.50m cells=2 rms=2.1cm[ 92] DRIVE goal=(0.58,0.91) dist=0.75m front=0.49m cells=2 rms=2.2cm[ 93] DRIVE goal=(0.58,0.91) dist=0.73m front=0.49m cells=2 rms=2.2cm[ 94] DRIVE goal=(0.58,0.91) dist=0.70m front=0.50m cells=2 rms=2.2cm[ 95] DRIVE goal=(0.58,0.91) dist=0.70m front=0.48m cells=2 rms=2.3cm[ 96] DRIVE goal=(0.58,0.91) dist=0.67m front=0.48m cells=2 rms=2.3cm[ 97] DRIVE goal=(0.58,0.91) dist=0.66m front=1.16m cells=2 rms=2.4cm[ 98] DRIVE goal=(0.58,0.91) dist=0.66m front=1.16m cells=2 rms=2.4cm[ 99] DRIVE goal=(0.58,0.91) dist=0.65m front=1.16m cells=2 rms=2.5cm[100] DRIVE goal=(0.58,0.91) dist=0.65m front=1.15m cells=2 rms=2.5cm[101] DRIVE goal=(0.58,0.91) dist=0.65m front=1.11m cells=2 rms=2.6cm[102] DRIVE goal=(0.58,0.91) dist=0.65m front=0.46m cells=2 rms=2.6cm[103] DRIVE goal=(0.58,0.91) dist=0.65m front=0.46m cells=2 rms=2.7cm[104] DRIVE goal=(0.58,0.91) dist=0.65m front=0.45m cells=2 rms=2.7cm[105] DRIVE goal=(0.58,0.91) dist=0.64m front=0.44m cells=2 rms=2.8cm[106] DRIVE goal=(0.58,0.91) dist=0.63m front=0.43m cells=2 rms=2.9cm[107] DRIVE goal=(0.58,0.91) dist=0.63m front=0.43m cells=2 rms=2.9cm[108] DRIVE goal=(0.58,0.91) dist=0.61m front=0.41m cells=2 rms=3.0cm[109] DRIVE goal=(0.58,0.91) dist=0.59m front=0.39m cells=2 rms=3.0cm[110] DRIVE goal=(0.58,0.91) dist=0.57m front=0.37m cells=2 rms=3.1cm[111] DRIVE goal=(0.58,0.91) dist=0.54m front=0.34m cells=2 rms=3.1cm[112] DRIVE goal=(0.58,0.91) dist=0.53m front=0.33m cells=2 rms=3.1cm[113] DRIVE goal=(0.58,0.91) dist=0.51m front=0.32m cells=2 rms=3.1cm[114] DRIVE goal=(0.58,0.91) dist=0.49m front=0.30m cells=2 rms=3.1cm[115] DRIVE goal=(0.58,0.91) dist=0.48m front=0.29m cells=2 rms=3.1cm[116] DRIVE goal=(0.58,0.91) dist=0.46m front=0.28m cells=2 rms=3.1cm[117] DRIVE goal=(0.58,0.91) dist=0.46m front=0.28m cells=2 rms=3.1cm[118] DRIVE goal=(0.58,0.91) dist=0.45m front=0.28m cells=3 rms=3.1cm[119] DRIVE goal=(0.58,0.91) dist=0.44m front=0.27m cells=3 rms=3.1cm[120] DRIVE goal=(0.58,0.91) dist=0.43m front=0.26m cells=3 rms=3.1cm[121] DRIVE goal=(0.58,0.91) dist=0.43m front=0.26m cells=3 rms=3.1cm[122] DRIVE goal=(0.58,0.91) dist=0.42m front=0.84m cells=3 rms=3.1cm[123] DRIVE goal=(0.58,0.91) dist=0.41m front=0.25m cells=3 rms=3.1cm[124] DRIVE goal=(0.58,0.91) dist=0.41m front=0.26m cells=3 rms=3.1cm
[ 27.8s] [GOAL SELECT] robot@(0.29,0.65) | 10 candidates (scanned=126 walls=79 visited=3):
  #1 ang= +27° d=1.50m pos=(0.85,2.04) score=+32.0 [O=+1.6 U=+26.0 V=-0.0 W=-1.0 R=-0.0 F=+5.0] <-- BEST
  #2 ang= +33° d=1.50m pos=(0.70,2.09) score=+30.9 [O=+2.5 U=+24.0 V=-0.0 W=-1.0 R=-0.0 F=+5.0]
  #3 ang= +27° d=1.00m pos=(0.66,1.57) score=+22.4 [O=+2.1 U=+18.0 V=-0.0 W=-3.0 R=-0.0 F=+5.0]
  #4 ang= +45° d=0.50m pos=(0.32,1.15) score=+15.6 [O=+2.5 U=+22.0 V=-0.0 W=-3.0 R=-10.8 F=+4.7]
  #5 ang= +39° d=0.50m pos=(0.37,1.14) score=+9.7 [O=+2.5 U=+16.0 V=-0.0 W=-3.0 R=-10.8 F=+4.9]
  #6 ang=-131° d=0.50m pos=(0.28,0.15) score=+8.8 [O=+1.8 U=+32.4 V=-5.2 W=-3.0 R=-12.7 F=-4.6]
  #7 ang= +15° d=0.50m pos=(0.57,1.06) score=+5.0 [O=+1.6 U=+12.2 V=-0.0 W=-3.0 R=-10.8 F=+4.9]
  #8 ang= +27° d=0.50m pos=(0.47,1.11) score=+3.8 [O=+2.5 U=+10.0 V=-0.0 W=-3.0 R=-10.8 F=+5.0]
[ 27.8s] [GOAL] Selected: (0.85, 2.04) dist=1.50m timeout=42s angle=27° reason=reached
[125] DRIVE goal=(0.85,2.04) dist=1.50m front=0.82m cells=3 rms=3.1cm[126] DRIVE goal=(0.85,2.04) dist=1.49m front=0.23m cells=3 rms=3.1cm[127] DRIVE goal=(0.85,2.04) dist=1.48m front=0.80m cells=4 rms=3.1cm[128] DRIVE goal=(0.85,2.04) dist=1.48m front=0.80m cells=4 rms=3.0cm[129] DRIVE goal=(0.85,2.04) dist=1.49m front=0.82m cells=4 rms=3.0cm[130] DRIVE goal=(0.85,2.04) dist=1.50m front=0.83m cells=4 rms=3.0cm[131] DRIVE goal=(0.85,2.04) dist=1.50m front=0.83m cells=4 rms=3.0cm[132] DRIVE goal=(0.85,2.04) dist=1.50m front=0.84m cells=4 rms=3.0cm[133] DRIVE goal=(0.85,2.04) dist=1.49m front=0.83m cells=4 rms=3.0cm[134] DRIVE goal=(0.85,2.04) dist=1.48m front=0.81m cells=4 rms=3.0cm[135] DRIVE goal=(0.85,2.04) dist=1.47m front=0.81m cells=4 rms=3.0cm[136] DRIVE goal=(0.85,2.04) dist=1.46m front=0.81m cells=4 rms=3.0cm[137] DRIVE goal=(0.85,2.04) dist=1.45m front=0.82m cells=4 rms=3.0cm[138] DRIVE goal=(0.85,2.04) dist=1.44m front=0.82m cells=4 rms=3.0cm[139] DRIVE goal=(0.85,2.04) dist=1.43m front=0.83m cells=4 rms=3.0cm[140] DRIVE goal=(0.85,2.04) dist=1.42m front=0.84m cells=4 rms=3.0cm[141] DRIVE goal=(0.85,2.04) dist=1.41m front=0.86m cells=4 rms=3.0cm[142] DRIVE goal=(0.85,2.04) dist=1.38m front=0.90m cells=4 rms=3.0cm[143] DRIVE goal=(0.85,2.04) dist=1.36m front=0.91m cells=4 rms=3.0cm[144] DRIVE goal=(0.85,2.04) dist=1.34m front=0.91m cells=4 rms=3.0cm[145] DRIVE goal=(0.85,2.04) dist=1.32m front=0.89m cells=4 rms=3.0cm[146] DRIVE goal=(0.85,2.04) dist=1.31m front=0.83m cells=4 rms=3.0cm[147] DRIVE goal=(0.85,2.04) dist=1.28m front=0.80m cells=4 rms=3.0cm[148] DRIVE goal=(0.85,2.04) dist=1.26m front=0.81m cells=4 rms=3.0cm[149] DRIVE goal=(0.85,2.04) dist=1.25m front=0.80m cells=4 rms=3.0cm[150] DRIVE goal=(0.85,2.04) dist=1.23m front=0.78m cells=4 rms=3.0cm[151] DRIVE goal=(0.85,2.04) dist=1.20m front=0.82m cells=5 rms=3.0cm[152] DRIVE goal=(0.85,2.04) dist=1.18m front=0.81m cells=5 rms=3.0cm[153] DRIVE goal=(0.85,2.04) dist=1.16m front=0.75m cells=5 rms=3.0cm[154] DRIVE goal=(0.85,2.04) dist=1.13m front=0.83m cells=5 rms=3.0cm[155] DRIVE goal=(0.85,2.04) dist=1.13m front=0.83m cells=5 rms=3.0cm[156] DRIVE goal=(0.85,2.04) dist=1.10m front=0.75m cells=5 rms=3.0cm[157] DRIVE goal=(0.85,2.04) dist=1.07m front=0.70m cells=5 rms=2.9cm[158] DRIVE goal=(0.85,2.04) dist=1.06m front=0.75m cells=5 rms=2.9cm[159] DRIVE goal=(0.85,2.04) dist=1.05m front=0.81m cells=5 rms=2.9cm[160] DRIVE goal=(0.85,2.04) dist=1.03m front=0.78m cells=5 rms=2.9cm[161] DRIVE goal=(0.85,2.04) dist=1.00m front=0.76m cells=5 rms=2.9cm[162] DRIVE goal=(0.85,2.04) dist=0.99m front=0.73m cells=5 rms=2.9cm[163] DRIVE goal=(0.85,2.04) dist=0.97m front=0.69m cells=5 rms=2.9cm[164] DRIVE goal=(0.85,2.04) dist=0.94m front=0.66m cells=5 rms=2.9cm[165] DRIVE goal=(0.85,2.04) dist=0.93m front=0.65m cells=5 rms=2.9cm[166] DRIVE goal=(0.85,2.04) dist=0.91m front=0.66m cells=5 rms=2.9cm[167] DRIVE goal=(0.85,2.04) dist=0.90m front=0.68m cells=5 rms=2.9cm[168] DRIVE goal=(0.85,2.04) dist=0.90m front=0.66m cells=6 rms=2.9cm[169] DRIVE goal=(0.85,2.04) dist=0.87m front=0.66m cells=6 rms=2.9cm[170] DRIVE goal=(0.85,2.04) dist=0.86m front=0.64m cells=6 rms=2.9cm[171] DRIVE goal=(0.85,2.04) dist=0.84m front=0.62m cells=6 rms=2.9cm[172] DRIVE goal=(0.85,2.04) dist=0.81m front=0.61m cells=6 rms=2.8cm[173] DRIVE goal=(0.85,2.04) dist=0.79m front=0.63m cells=6 rms=2.8cm[174] DRIVE goal=(0.85,2.04) dist=0.78m front=1.13m cells=6 rms=2.8cm[175] DRIVE goal=(0.85,2.04) dist=0.77m front=1.22m cells=6 rms=2.8cm[176] DRIVE goal=(0.85,2.04) dist=0.77m front=1.24m cells=6 rms=2.8cm[177] DRIVE goal=(0.85,2.04) dist=0.75m front=1.24m cells=6 rms=2.8cm[178] DRIVE goal=(0.85,2.04) dist=0.72m front=1.16m cells=6 rms=2.8cm[179] DRIVE goal=(0.85,2.04) dist=0.71m front=1.24m cells=6 rms=2.8cm[180] DRIVE goal=(0.85,2.04) dist=0.69m front=1.23m cells=7 rms=2.8cm[181] DRIVE goal=(0.85,2.04) dist=0.68m front=1.23m cells=7 rms=2.8cm[182] DRIVE goal=(0.85,2.04) dist=0.68m front=1.18m cells=7 rms=2.8cm[183] DRIVE goal=(0.85,2.04) dist=0.67m front=1.21m cells=7 rms=2.8cm[184] DRIVE goal=(0.85,2.04) dist=0.65m front=1.19m cells=7 rms=2.8cm[185] DRIVE goal=(0.85,2.04) dist=0.64m front=1.18m cells=7 rms=2.8cm[186] DRIVE goal=(0.85,2.04) dist=0.62m front=1.16m cells=7 rms=2.8cm[187] DRIVE goal=(0.85,2.04) dist=0.60m front=1.14m cells=7 rms=2.8cm[188] DRIVE goal=(0.85,2.04) dist=0.59m front=1.13m cells=7 rms=2.8cm[189] DRIVE goal=(0.85,2.04) dist=0.58m front=1.12m cells=8 rms=2.8cm[190] DRIVE goal=(0.85,2.04) dist=0.55m front=1.12m cells=8 rms=2.8cm[191] DRIVE goal=(0.85,2.04) dist=0.54m front=1.11m cells=8 rms=2.8cm[192] DRIVE goal=(0.85,2.04) dist=0.52m front=1.11m cells=8 rms=2.8cm[193] DRIVE goal=(0.85,2.04) dist=0.50m front=1.05m cells=8 rms=2.7cm[194] DRIVE goal=(0.85,2.04) dist=0.49m front=1.03m cells=8 rms=2.7cm[195] DRIVE goal=(0.85,2.04) dist=0.47m front=1.02m cells=8 rms=2.7cm[196] DRIVE goal=(0.85,2.04) dist=0.45m front=1.00m cells=8 rms=2.7cm[197] DRIVE goal=(0.85,2.04) dist=0.42m front=0.97m cells=8 rms=2.7cm[198] DRIVE goal=(0.85,2.04) dist=0.40m front=0.97m cells=8 rms=2.7cm
[ 42.7s] [GOAL SELECT] robot@(0.67,1.68) | 11 candidates (scanned=155 walls=94 visited=8):
  #1 ang=  +3° d=2.00m pos=(0.88,3.67) score=+43.4 [O=+2.5 U=+35.4 V=-0.0 W=-0.0 R=-0.0 F=+4.8] <-- BEST
  #2 ang= -27° d=1.50m pos=(1.57,2.89) score=+39.9 [O=+1.6 U=+36.0 V=-0.0 W=-3.0 R=-0.0 F=+4.8]
  #3 ang= -33° d=1.50m pos=(1.69,2.79) score=+39.9 [O=+1.8 U=+36.0 V=-0.0 W=-3.0 R=-0.0 F=+4.7]
  #4 ang=  +3° d=1.50m pos=(0.83,3.18) score=+36.0 [O=+2.5 U=+28.2 V=-0.0 W=-0.0 R=-0.0 F=+4.8]
  #5 ang= -21° d=1.00m pos=(1.18,2.55) score=+34.2 [O=+2.0 U=+28.0 V=-0.0 W=-1.0 R=-0.0 F=+4.9]
  #6 ang= -21° d=0.50m pos=(0.93,2.12) score=+22.8 [O=+2.5 U=+20.0 V=-0.0 W=-1.0 R=-3.8 F=+4.9]
  #7 ang= -39° d=0.50m pos=(1.05,2.01) score=+21.8 [O=+1.6 U=+24.2 V=-0.0 W=-1.0 R=-7.5 F=+4.4]
  #8 ang= -27° d=0.50m pos=(0.97,2.09) score=+19.0 [O=+2.5 U=+20.0 V=-0.0 W=-1.0 R=-7.5 F=+4.8]
[ 42.7s] [GOAL] Selected: (0.88, 3.67) dist=2.00m timeout=50s angle=3° reason=reached
[199] DRIVE goal=(0.88,3.67) dist=2.00m front=0.96m cells=8 rms=2.7cm[200] DRIVE goal=(0.88,3.67) dist=1.98m front=0.94m cells=8 rms=2.7cm[201] DRIVE goal=(0.88,3.67) dist=1.96m front=0.91m cells=8 rms=2.7cm[202] DRIVE goal=(0.88,3.67) dist=1.94m front=0.90m cells=8 rms=2.7cm[203] DRIVE goal=(0.88,3.67) dist=1.93m front=0.88m cells=8 rms=2.7cm[204] DRIVE goal=(0.88,3.67) dist=1.91m front=0.94m cells=8 rms=2.7cm[205] DRIVE goal=(0.88,3.67) dist=1.90m front=1.72m cells=8 rms=2.7cm[206] DRIVE goal=(0.88,3.67) dist=1.88m front=1.69m cells=9 rms=2.7cm[207] DRIVE goal=(0.88,3.67) dist=1.87m front=1.68m cells=9 rms=2.7cm[208] DRIVE goal=(0.88,3.67) dist=1.87m front=1.68m cells=9 rms=2.7cm[209] DRIVE goal=(0.88,3.67) dist=1.85m front=1.67m cells=9 rms=2.7cm[210] DRIVE goal=(0.88,3.67) dist=1.85m front=1.66m cells=9 rms=2.7cm[211] DRIVE goal=(0.88,3.67) dist=1.85m front=1.66m cells=9 rms=2.7cm[212] DRIVE goal=(0.88,3.67) dist=1.84m front=1.65m cells=9 rms=2.7cm[213] DRIVE goal=(0.88,3.67) dist=1.83m front=1.64m cells=9 rms=2.7cm[214] DRIVE goal=(0.88,3.67) dist=1.82m front=1.63m cells=9 rms=2.7cm[215] DRIVE goal=(0.88,3.67) dist=1.81m front=1.62m cells=9 rms=2.7cm[216] DRIVE goal=(0.88,3.67) dist=1.78m front=0.97m cells=9 rms=2.7cm[217] DRIVE goal=(0.88,3.67) dist=1.77m front=1.58m cells=9 rms=2.7cm[218] DRIVE goal=(0.88,3.67) dist=1.77m front=1.58m cells=9 rms=2.7cm[219] DRIVE goal=(0.88,3.67) dist=1.76m front=1.57m cells=9 rms=2.7cm[220] DRIVE goal=(0.88,3.67) dist=1.76m front=0.94m cells=9 rms=2.7cm[221] DRIVE goal=(0.88,3.67) dist=1.74m front=0.93m cells=9 rms=2.7cm[222] DRIVE goal=(0.88,3.67) dist=1.73m front=1.54m cells=9 rms=2.7cm[223] DRIVE goal=(0.88,3.67) dist=1.73m front=1.53m cells=9 rms=2.7cm[224] DRIVE goal=(0.88,3.67) dist=1.73m front=1.53m cells=9 rms=2.8cm[225] DRIVE goal=(0.88,3.67) dist=1.73m front=1.53m cells=9 rms=2.8cm[226] DRIVE goal=(0.88,3.67) dist=1.73m front=1.52m cells=9 rms=2.8cm[227] DRIVE goal=(0.88,3.67) dist=1.72m front=1.51m cells=9 rms=2.8cm[228] DRIVE goal=(0.88,3.67) dist=1.71m front=1.50m cells=9 rms=2.8cm[229] DRIVE goal=(0.88,3.67) dist=1.70m front=1.49m cells=9 rms=2.8cm[230] DRIVE goal=(0.88,3.67) dist=1.70m front=1.49m cells=9 rms=2.9cm[231] DRIVE goal=(0.88,3.67) dist=1.69m front=1.48m cells=9 rms=2.9cm[232] DRIVE goal=(0.88,3.67) dist=1.68m front=1.47m cells=9 rms=2.9cm[233] DRIVE goal=(0.88,3.67) dist=1.68m front=1.47m cells=9 rms=2.9cm[234] DRIVE goal=(0.88,3.67) dist=1.68m front=1.46m cells=9 rms=3.0cm[235] DRIVE goal=(0.88,3.67) dist=1.67m front=1.45m cells=9 rms=3.0cm[236] DRIVE goal=(0.88,3.67) dist=1.66m front=1.05m cells=9 rms=3.0cm[237] DRIVE goal=(0.88,3.67) dist=1.65m front=1.01m cells=9 rms=3.1cm[238] DRIVE goal=(0.88,3.67) dist=1.64m front=0.91m cells=9 rms=3.1cm[239] DRIVE goal=(0.88,3.67) dist=1.64m front=0.90m cells=9 rms=3.1cm[240] DRIVE goal=(0.88,3.67) dist=1.62m front=0.85m cells=9 rms=3.2cm[241] DRIVE goal=(0.88,3.67) dist=1.60m front=0.87m cells=9 rms=3.2cm[242] DRIVE goal=(0.88,3.67) dist=1.59m front=0.83m cells=9 rms=3.2cm[243] DRIVE goal=(0.88,3.67) dist=1.58m front=0.77m cells=10 rms=3.2cm[244] DRIVE goal=(0.88,3.67) dist=1.56m front=0.79m cells=10 rms=3.3cm[245] DRIVE goal=(0.88,3.67) dist=1.54m front=0.78m cells=10 rms=3.3cm[246] DRIVE goal=(0.88,3.67) dist=1.51m front=0.77m cells=10 rms=3.3cm[247] DRIVE goal=(0.88,3.67) dist=1.49m front=0.72m cells=10 rms=3.4cm[248] DRIVE goal=(0.88,3.67) dist=1.48m front=0.74m cells=10 rms=3.4cm[249] DRIVE goal=(0.88,3.67) dist=1.45m front=0.72m cells=10 rms=3.4cm[250] DRIVE goal=(0.88,3.67) dist=1.43m front=0.72m cells=10 rms=3.4cm[251] DRIVE goal=(0.88,3.67) dist=1.41m front=0.70m cells=10 rms=3.5cm[252] DRIVE goal=(0.88,3.67) dist=1.39m front=0.69m cells=10 rms=3.5cm[253] DRIVE goal=(0.88,3.67) dist=1.37m front=0.70m cells=10 rms=3.5cm[254] DRIVE goal=(0.88,3.67) dist=1.35m front=0.66m cells=10 rms=3.5cm[255] DRIVE goal=(0.88,3.67) dist=1.32m front=0.65m cells=10 rms=3.6cm[256] DRIVE goal=(0.88,3.67) dist=1.31m front=0.65m cells=10 rms=3.6cm[257] DRIVE goal=(0.88,3.67) dist=1.29m front=0.65m cells=10 rms=3.6cm[258] DRIVE goal=(0.88,3.67) dist=1.27m front=0.65m cells=11 rms=3.6cm[259] DRIVE goal=(0.88,3.67) dist=1.24m front=0.65m cells=11 rms=3.6cm[260] DRIVE goal=(0.88,3.67) dist=1.23m front=0.65m cells=11 rms=3.7cm[261] DRIVE goal=(0.88,3.67) dist=1.21m front=0.63m cells=11 rms=3.7cm[262] DRIVE goal=(0.88,3.67) dist=1.19m front=0.64m cells=11 rms=3.7cm[263] DRIVE goal=(0.88,3.67) dist=1.17m front=0.62m cells=11 rms=3.7cm[264] DRIVE goal=(0.88,3.67) dist=1.15m front=0.66m cells=11 rms=3.7cm[265] DRIVE goal=(0.88,3.67) dist=1.13m front=0.65m cells=11 rms=3.7cm[266] DRIVE goal=(0.88,3.67) dist=1.11m front=0.67m cells=11 rms=3.7cm[267] DRIVE goal=(0.88,3.67) dist=1.07m front=0.64m cells=11 rms=3.8cm[268] DRIVE goal=(0.88,3.67) dist=1.06m front=0.61m cells=11 rms=3.8cm[269] DRIVE goal=(0.88,3.67) dist=1.04m front=0.61m cells=11 rms=3.8cm[270] DRIVE goal=(0.88,3.67) dist=1.02m front=0.62m cells=11 rms=3.8cm[271] DRIVE goal=(0.88,3.67) dist=1.00m front=0.62m cells=11 rms=3.8cm[272] DRIVE goal=(0.88,3.67) dist=0.99m front=0.61m cells=11 rms=3.8cm[273] DRIVE goal=(0.88,3.67) dist=0.97m front=0.62m cells=12 rms=3.8cm[274] DRIVE goal=(0.88,3.67) dist=0.95m front=0.62m cells=12 rms=3.8cm[275] DRIVE goal=(0.88,3.67) dist=0.93m front=0.61m cells=12 rms=3.8cm[276] DRIVE goal=(0.88,3.67) dist=0.91m front=0.62m cells=12 rms=3.8cm[277] DRIVE goal=(0.88,3.67) dist=0.89m front=0.63m cells=12 rms=3.9cm[278] DRIVE goal=(0.88,3.67) dist=0.87m front=0.61m cells=12 rms=3.9cm[279] DRIVE goal=(0.88,3.67) dist=0.86m front=0.64m cells=12 rms=3.9cm[280] DRIVE goal=(0.88,3.67) dist=0.85m front=0.61m cells=12 rms=3.9cm[281] DRIVE goal=(0.88,3.67) dist=0.82m front=0.59m cells=12 rms=3.9cm[282] DRIVE goal=(0.88,3.67) dist=0.81m front=0.58m cells=12 rms=3.9cm[283] DRIVE goal=(0.88,3.67) dist=0.79m front=0.63m cells=12 rms=3.9cm[284] DRIVE goal=(0.88,3.67) dist=0.77m front=0.65m cells=12 rms=3.9cm[285] DRIVE goal=(0.88,3.67) dist=0.75m front=0.66m cells=12 rms=3.9cm[286] DRIVE goal=(0.88,3.67) dist=0.73m front=0.70m cells=12 rms=3.9cm[287] DRIVE goal=(0.88,3.67) dist=0.71m front=0.73m cells=12 rms=3.9cm[288] DRIVE goal=(0.88,3.67) dist=0.70m front=0.69m cells=12 rms=3.9cm[289] DRIVE goal=(0.88,3.67) dist=0.68m front=0.69m cells=12 rms=3.9cm[290] DRIVE goal=(0.88,3.67) dist=0.66m front=0.76m cells=13 rms=3.9cm[291] DRIVE goal=(0.88,3.67) dist=0.65m front=0.68m cells=13 rms=3.9cm[292] DRIVE goal=(0.88,3.67) dist=0.63m front=0.67m cells=13 rms=3.9cm[293] DRIVE goal=(0.88,3.67) dist=0.60m front=0.72m cells=13 rms=3.9cm[294] DRIVE goal=(0.88,3.67) dist=0.59m front=0.68m cells=13 rms=4.0cm[295] DRIVE goal=(0.88,3.67) dist=0.57m front=0.68m cells=13 rms=4.0cm[296] DRIVE goal=(0.88,3.67) dist=0.55m front=0.66m cells=13 rms=4.0cm[297] DRIVE goal=(0.88,3.67) dist=0.53m front=0.70m cells=13 rms=4.0cm[298] DRIVE goal=(0.88,3.67) dist=0.51m front=0.72m cells=13 rms=4.0cm[299] DRIVE goal=(0.88,3.67) dist=0.50m front=0.67m cells=13 rms=4.0cm[300] DRIVE goal=(0.88,3.67) dist=0.48m front=0.67m cells=13 rms=4.0cm[301] DRIVE goal=(0.88,3.67) dist=0.46m front=0.67m cells=13 rms=4.0cm[302] DRIVE goal=(0.88,3.67) dist=0.44m front=0.67m cells=13 rms=4.0cm[303] DRIVE goal=(0.88,3.67) dist=0.42m front=0.68m cells=13 rms=4.0cm[304] DRIVE goal=(0.88,3.67) dist=0.40m front=0.68m cells=13 rms=4.0cm
[ 64.2s] [GOAL SELECT] robot@(0.88,3.29) | 21 candidates (scanned=208 walls=129 visited=13):
  #1 ang=  +9° d=2.00m pos=(0.68,5.28) score=+41.1 [O=+1.8 U=+34.0 V=-0.0 W=-0.0 R=-0.0 F=+4.7] <-- BEST
  #2 ang=  +3° d=2.00m pos=(0.90,5.29) score=+39.3 [O=+1.8 U=+32.0 V=-0.0 W=-0.0 R=-0.0 F=+4.8]
  #3 ang=  +9° d=1.50m pos=(0.73,4.78) score=+36.7 [O=+2.3 U=+29.2 V=-0.0 W=-0.0 R=-0.0 F=+4.7]
  #4 ang=-101° d=2.00m pos=(2.82,2.79) score=+36.1 [O=+2.5 U=+34.0 V=-0.0 W=-1.0 R=-0.0 F=+0.0]
  #5 ang=-107° d=2.00m pos=(2.76,2.59) score=+35.0 [O=+1.9 U=+34.0 V=-0.0 W=-1.0 R=-0.0 F=-0.5]
  #6 ang=  +3° d=1.50m pos=(0.89,4.79) score=+32.8 [O=+2.3 U=+25.2 V=-0.0 W=-0.0 R=-0.0 F=+4.8]
  #7 ang=  -9° d=1.00m pos=(1.10,4.27) score=+31.1 [O=+1.8 U=+24.0 V=-0.0 W=-0.0 R=-0.0 F=+5.0]
  #8 ang=  +9° d=1.00m pos=(0.78,4.29) score=+28.7 [O=+2.5 U=+24.4 V=-0.0 W=-0.0 R=-3.2 F=+4.7]
[ 64.2s] [GOAL] Selected: (0.68, 5.28) dist=2.00m timeout=50s angle=9° reason=reached
[305] DRIVE goal=(0.68,5.28) dist=2.00m front=0.67m cells=13 rms=4.0cm[306] DRIVE goal=(0.68,5.28) dist=1.98m front=0.65m cells=14 rms=4.0cm[307] DRIVE goal=(0.68,5.28) dist=1.96m front=0.64m cells=14 rms=4.0cm[308] DRIVE goal=(0.68,5.28) dist=1.94m front=0.65m cells=14 rms=4.0cm[309] DRIVE goal=(0.68,5.28) dist=1.94m front=0.64m cells=14 rms=3.9cm[310] DRIVE goal=(0.68,5.28) dist=1.92m front=0.64m cells=14 rms=3.9cm[311] DRIVE goal=(0.68,5.28) dist=1.92m front=0.60m cells=14 rms=3.9cm[312] DRIVE goal=(0.68,5.28) dist=1.91m front=0.56m cells=14 rms=3.9cm[313] DRIVE goal=(0.68,5.28) dist=1.90m front=0.58m cells=14 rms=3.9cm[314] DRIVE goal=(0.68,5.28) dist=1.89m front=0.63m cells=14 rms=3.9cm[315] DRIVE goal=(0.68,5.28) dist=1.89m front=0.82m cells=14 rms=3.9cm[316] DRIVE goal=(0.68,5.28) dist=1.88m front=0.83m cells=14 rms=3.9cm[317] DRIVE goal=(0.68,5.28) dist=1.88m front=0.83m cells=14 rms=3.9cm[318] DRIVE goal=(0.68,5.28) dist=1.88m front=0.83m cells=14 rms=3.9cm[319] DRIVE goal=(0.68,5.28) dist=1.88m front=0.83m cells=14 rms=3.9cm[320] DRIVE goal=(0.68,5.28) dist=1.88m front=0.83m cells=14 rms=3.9cm[321] DRIVE goal=(0.68,5.28) dist=1.88m front=0.81m cells=14 rms=3.9cm[322] DRIVE goal=(0.68,5.28) dist=1.88m front=0.83m cells=14 rms=3.9cm[323] DRIVE goal=(0.68,5.28) dist=1.88m front=0.83m cells=14 rms=3.9cm[324] DRIVE goal=(0.68,5.28) dist=1.88m front=0.82m cells=14 rms=3.9cm[325] DRIVE goal=(0.68,5.28) dist=1.88m front=0.83m cells=14 rms=3.9cm[326] DRIVE goal=(0.68,5.28) dist=1.88m front=0.82m cells=14 rms=3.9cm[327] DRIVE goal=(0.68,5.28) dist=1.88m front=0.82m cells=14 rms=3.9cm[328] DRIVE goal=(0.68,5.28) dist=1.88m front=0.83m cells=14 rms=3.8cm[329] DRIVE goal=(0.68,5.28) dist=1.88m front=0.83m cells=14 rms=3.8cm[330] DRIVE goal=(0.68,5.28) dist=1.87m front=0.83m cells=14 rms=3.8cm[331] DRIVE goal=(0.68,5.28) dist=1.87m front=0.82m cells=14 rms=3.8cm[332] DRIVE goal=(0.68,5.28) dist=1.87m front=0.83m cells=14 rms=3.8cm[333] DRIVE goal=(0.68,5.28) dist=1.87m front=0.82m cells=14 rms=3.8cm[334] DRIVE goal=(0.68,5.28) dist=1.88m front=0.83m cells=14 rms=3.8cm[335] DRIVE goal=(0.68,5.28) dist=1.87m front=0.83m cells=14 rms=3.8cm[336] DRIVE goal=(0.68,5.28) dist=1.88m front=0.84m cells=14 rms=3.8cm[337] DRIVE goal=(0.68,5.28) dist=1.88m front=0.82m cells=14 rms=3.8cm[338] DRIVE goal=(0.68,5.28) dist=1.88m front=0.84m cells=14 rms=3.8cm[339] DRIVE goal=(0.68,5.28) dist=1.87m front=0.83m cells=14 rms=3.8cm[340] DRIVE goal=(0.68,5.28) dist=1.88m front=0.83m cells=14 rms=3.8cm[341] DRIVE goal=(0.68,5.28) dist=1.88m front=0.83m cells=14 rms=3.8cm
[ 71.7s] [DRIVE STUCK] Goal distance unchanged for 6.9s
[DRIVE STUCK] dist_oldest=1.94m, dist_now=1.88m, change=0.06m < margin=0.08m
[DRIVE STUCK] Front sectors: s55=0.82 s56=0.93 s57=1.09 s58=1.46 s59=1.97 s0=2.03 s1=2.70 s2=2.70 s3=2.74 s4=2.78 s5=2.85 
[DRIVE STUCK] Marked front sectors [55, 56, 57, 58, 59, 0, 1, 2, 3, 4, 5] as blocked for 30s

[BACKUP CLEAR] Reversing and turning toward clearer side...
[BACKUP CLEAR] Turning left (L_avg=2.75m R_avg=1.25m)

[ 76.6s] [GOAL SELECT] robot@(0.88,3.32) | 19 candidates (scanned=221 walls=143 visited=14):
  #1 ang=-113° d=2.00m pos=(2.81,2.79) score=+36.2 [O=+2.5 U=+34.2 V=-0.0 W=-1.0 R=-0.0 F=+0.0] <-- BEST
  #2 ang=-119° d=2.00m pos=(2.74,2.59) score=+35.5 [O=+1.9 U=+34.0 V=-0.0 W=-1.0 R=-0.0 F=+0.0]
  #3 ang=-125° d=1.50m pos=(2.21,2.62) score=+29.3 [O=+1.7 U=+28.1 V=-0.0 W=-1.0 R=-0.0 F=+0.0]
  #4 ang=-113° d=1.50m pos=(2.33,2.92) score=+28.4 [O=+2.5 U=+26.5 V=-0.0 W=-1.0 R=-0.0 F=+0.0]
  #5 ang=-119° d=1.50m pos=(2.28,2.77) score=+27.8 [O=+2.4 U=+26.0 V=-0.0 W=-1.0 R=-0.0 F=+0.0]
  #6 ang=-125° d=1.00m pos=(1.77,2.86) score=+19.6 [O=+2.2 U=+20.1 V=-0.0 W=-3.0 R=-0.0 F=+0.0]
  #7 ang=-119° d=1.00m pos=(1.81,2.95) score=+17.8 [O=+2.5 U=+18.0 V=-0.0 W=-3.0 R=-0.0 F=+0.0]
  #8 ang= -33° d=0.50m pos=(1.10,3.77) score=-35.4 [O=+1.6 U=+20.2 V=-0.0 W=-3.0 R=-4.4 F=+0.0 B=-50.0]
[ 76.6s] [GOAL] Selected: (2.81, 2.79) dist=2.00m timeout=50s angle=-113° reason=no goal
[343] DRIVE goal=(2.81,2.79) dist=2.00m front=0.47m cells=14 rms=3.8cm[344] DRIVE goal=(2.81,2.79) dist=2.00m front=0.47m cells=14 rms=3.8cm[345] DRIVE goal=(2.81,2.79) dist=2.00m front=0.47m cells=14 rms=3.8cm[346] DRIVE goal=(2.81,2.79) dist=2.00m front=0.46m cells=14 rms=3.8cm[347] DRIVE goal=(2.81,2.79) dist=2.00m front=0.46m cells=14 rms=3.8cm[348] DRIVE goal=(2.81,2.79) dist=2.00m front=0.48m cells=14 rms=3.8cm[349] DRIVE goal=(2.81,2.79) dist=2.01m front=0.56m cells=14 rms=3.7cm[350] DRIVE goal=(2.81,2.79) dist=2.01m front=0.73m cells=14 rms=3.7cm[351] DRIVE goal=(2.81,2.79) dist=2.00m front=0.73m cells=14 rms=3.7cm[352] DRIVE goal=(2.81,2.79) dist=2.01m front=0.81m cells=14 rms=3.7cm[353] DRIVE goal=(2.81,2.79) dist=2.01m front=0.75m cells=14 rms=3.7cm[354] DRIVE goal=(2.81,2.79) dist=2.01m front=0.71m cells=14 rms=3.7cm[355] DRIVE goal=(2.81,2.79) dist=2.01m front=0.70m cells=14 rms=3.7cm[356] DRIVE goal=(2.81,2.79) dist=2.01m front=0.67m cells=14 rms=3.7cm[357] DRIVE goal=(2.81,2.79) dist=2.01m front=0.65m cells=14 rms=3.7cm[358] DRIVE goal=(2.81,2.79) dist=2.01m front=0.61m cells=14 rms=3.7cm[359] DRIVE goal=(2.81,2.79) dist=2.01m front=0.61m cells=14 rms=3.7cm[360] DRIVE goal=(2.81,2.79) dist=2.01m front=0.60m cells=14 rms=3.7cm[361] DRIVE goal=(2.81,2.79) dist=2.01m front=0.59m cells=14 rms=3.7cm[362] DRIVE goal=(2.81,2.79) dist=2.01m front=0.59m cells=14 rms=3.7cm[363] DRIVE goal=(2.81,2.79) dist=2.01m front=0.58m cells=14 rms=3.7cm[364] DRIVE goal=(2.81,2.79) dist=2.01m front=0.56m cells=14 rms=3.7cm[365] DRIVE goal=(2.81,2.79) dist=2.01m front=0.54m cells=14 rms=3.7cm[366] DRIVE goal=(2.81,2.79) dist=2.01m front=0.54m cells=14 rms=3.7cm[367] DRIVE goal=(2.81,2.79) dist=2.01m front=0.54m cells=14 rms=3.7cm[368] DRIVE goal=(2.81,2.79) dist=2.01m front=0.54m cells=14 rms=3.7cm[369] DRIVE goal=(2.81,2.79) dist=2.01m front=0.54m cells=14 rms=3.6cm[370] DRIVE goal=(2.81,2.79) dist=2.02m front=0.54m cells=14 rms=3.6cm[371] DRIVE goal=(2.81,2.79) dist=2.01m front=0.54m cells=14 rms=3.6cm[372] DRIVE goal=(2.81,2.79) dist=2.01m front=0.54m cells=14 rms=3.6cm[373] DRIVE goal=(2.81,2.79) dist=2.01m front=0.54m cells=14 rms=3.6cm[374] DRIVE goal=(2.81,2.79) dist=2.02m front=0.54m cells=14 rms=3.6cm[375] DRIVE goal=(2.81,2.79) dist=2.01m front=0.53m cells=14 rms=3.6cm[376] DRIVE goal=(2.81,2.79) dist=2.01m front=0.53m cells=14 rms=3.6cm[377] DRIVE goal=(2.81,2.79) dist=2.01m front=0.53m cells=14 rms=3.6cm[378] DRIVE goal=(2.81,2.79) dist=2.01m front=0.53m cells=14 rms=3.6cm[379] DRIVE goal=(2.81,2.79) dist=2.01m front=0.53m cells=14 rms=3.6cm[380] DRIVE goal=(2.81,2.79) dist=2.00m front=0.53m cells=14 rms=3.6cm[381] DRIVE goal=(2.81,2.79) dist=2.01m front=0.54m cells=14 rms=3.6cm[382] DRIVE goal=(2.81,2.79) dist=2.01m front=0.53m cells=14 rms=3.6cm[383] DRIVE goal=(2.81,2.79) dist=2.00m front=0.53m cells=14 rms=3.6cm[384] DRIVE goal=(2.81,2.79) dist=2.00m front=0.53m cells=14 rms=3.6cm[385] DRIVE goal=(2.81,2.79) dist=2.00m front=0.53m cells=14 rms=3.6cm[386] DRIVE goal=(2.81,2.79) dist=1.99m front=0.52m cells=14 rms=3.6cm[387] DRIVE goal=(2.81,2.79) dist=1.98m front=0.51m cells=15 rms=3.6cm[388] DRIVE goal=(2.81,2.79) dist=1.96m front=0.51m cells=15 rms=3.6cm[389] DRIVE goal=(2.81,2.79) dist=1.96m front=0.51m cells=15 rms=3.6cm[390] DRIVE goal=(2.81,2.79) dist=1.95m front=0.51m cells=15 rms=3.6cm[391] DRIVE goal=(2.81,2.79) dist=1.93m front=0.68m cells=15 rms=3.6cm[392] DRIVE goal=(2.81,2.79) dist=1.91m front=1.16m cells=15 rms=3.5cm[393] DRIVE goal=(2.81,2.79) dist=1.89m front=1.15m cells=16 rms=3.5cm[394] DRIVE goal=(2.81,2.79) dist=1.88m front=1.13m cells=16 rms=3.5cm[395] DRIVE goal=(2.81,2.79) dist=1.86m front=1.12m cells=16 rms=3.5cm[396] DRIVE goal=(2.81,2.79) dist=1.86m front=1.12m cells=16 rms=3.5cm[397] DRIVE goal=(2.81,2.79) dist=1.86m front=0.64m cells=16 rms=3.5cm[398] DRIVE goal=(2.81,2.79) dist=1.85m front=0.56m cells=16 rms=3.5cm[399] DRIVE goal=(2.81,2.79) dist=1.83m front=0.43m cells=16 rms=3.5cm[400] DRIVE goal=(2.81,2.79) dist=1.82m front=0.39m cells=16 rms=3.5cm[401] DRIVE goal=(2.81,2.79) dist=1.78m front=0.36m cells=16 rms=3.5cm[402] DRIVE goal=(2.81,2.79) dist=1.77m front=0.35m cells=16 rms=3.5cm[403] DRIVE goal=(2.81,2.79) dist=1.75m front=0.33m cells=16 rms=3.5cm[404] DRIVE goal=(2.81,2.79) dist=1.73m front=0.31m cells=16 rms=3.5cm[405] DRIVE goal=(2.81,2.79) dist=1.71m front=0.30m cells=16 rms=3.5cm[406] DRIVE goal=(2.81,2.79) dist=1.70m front=0.28m cells=16 rms=3.5cm[407] DRIVE goal=(2.81,2.79) dist=1.68m front=0.27m cells=16 rms=3.5cm[408] DRIVE goal=(2.81,2.79) dist=1.68m front=0.27m cells=16 rms=3.5cm[409] DRIVE goal=(2.81,2.79) dist=1.65m front=0.26m cells=17 rms=3.5cm[410] DRIVE goal=(2.81,2.79) dist=1.64m front=0.23m cells=17 rms=3.5cm[411] DRIVE goal=(2.81,2.79) dist=1.63m front=0.24m cells=17 rms=3.5cm[412] DRIVE goal=(2.81,2.79) dist=1.61m front=0.23m cells=17 rms=3.5cm[413] DRIVE goal=(2.81,2.79) dist=1.60m front=0.22m cells=17 rms=3.5cm[414] DRIVE goal=(2.81,2.79) dist=1.59m front=0.20m cells=17 rms=3.5cm[415] DRIVE goal=(2.81,2.79) dist=1.58m front=0.18m cells=17 rms=3.5cm[416] DRIVE goal=(2.81,2.79) dist=1.58m front=0.18m cells=17 rms=3.5cm[417] DRIVE goal=(2.81,2.79) dist=1.57m front=0.19m cells=17 rms=3.5cm[418] DRIVE goal=(2.81,2.79) dist=1.55m front=0.20m cells=17 rms=3.4cm[419] DRIVE goal=(2.81,2.79) dist=1.55m front=0.19m cells=17 rms=3.4cm[420] DRIVE goal=(2.81,2.79) dist=1.53m front=0.18m cells=17 rms=3.4cm[421] DRIVE goal=(2.81,2.79) dist=1.53m front=0.21m cells=17 rms=3.4cm[422] DRIVE goal=(2.81,2.79) dist=1.51m front=0.24m cells=17 rms=3.4cm[423] DRIVE goal=(2.81,2.79) dist=1.49m front=0.22m cells=17 rms=3.4cm[424] DRIVE goal=(2.81,2.79) dist=1.49m front=0.19m cells=17 rms=3.4cm[425] DRIVE goal=(2.81,2.79) dist=1.49m front=0.19m cells=17 rms=3.4cm[426] DRIVE goal=(2.81,2.79) dist=1.48m front=0.19m cells=17 rms=3.4cm[427] DRIVE goal=(2.81,2.79) dist=1.48m front=0.18m cells=17 rms=3.4cm[428] DRIVE goal=(2.81,2.79) dist=1.47m front=0.15m cells=17 rms=3.4cm[429] DRIVE goal=(2.81,2.79) dist=1.47m front=0.15m cells=17 rms=3.4cm
[ 94.1s] [BACKUP] front=0.14m

[BACKUP] Reversing...
[BACKUP] Turning right (L_openings=1 R_openings=6)

[ 97.8s] [GOAL SELECT] robot@(1.32,3.19) | 40 candidates (scanned=234 walls=161 visited=17):
  #1 ang=+125° d=2.00m pos=(0.36,4.94) score=+31.3 [O=+2.4 U=+30.5 V=-0.0 W=-0.0 R=-2.2 F=+0.0] <-- BEST
  #2 ang= -45° d=0.50m pos=(1.62,2.79) score=+30.7 [O=+1.5 U=+32.0 V=-0.0 W=-3.0 R=-0.0 F=+0.0]
  #3 ang= -64° d=0.50m pos=(1.48,2.71) score=+30.0 [O=+1.5 U=+31.3 V=-0.0 W=-3.0 R=-0.0 F=+0.0]
  #4 ang=+119° d=2.00m pos=(0.55,5.04) score=+29.6 [O=+2.3 U=+29.0 V=-0.0 W=-0.0 R=-2.2 F=+0.0]
  #5 ang=+101° d=2.00m pos=(1.17,5.18) score=+29.3 [O=+2.0 U=+32.2 V=-0.0 W=-1.0 R=-4.4 F=+0.0]
  #6 ang=+107° d=2.00m pos=(0.96,5.16) score=+27.8 [O=+2.0 U=+30.6 V=-0.0 W=-1.0 R=-4.4 F=+0.0]
  #7 ang=+125° d=1.50m pos=(0.60,4.51) score=+26.8 [O=+2.5 U=+23.8 V=-0.0 W=-0.0 R=-0.0 F=+0.0]
  #8 ang=+107° d=1.50m pos=(1.05,4.66) score=+24.5 [O=+2.5 U=+22.6 V=-0.0 W=-1.0 R=-0.0 F=+0.0]
[ 97.8s] [GOAL] Selected: (0.36, 4.94) dist=2.00m timeout=50s angle=125° reason=no goal
[431] DRIVE goal=(0.36,4.94) dist=2.00m front=0.27m cells=17 rms=3.4cm[432] DRIVE goal=(0.36,4.94) dist=2.00m front=0.28m cells=17 rms=3.4cm[433] DRIVE goal=(0.36,4.94) dist=2.00m front=0.28m cells=17 rms=3.4cm[434] DRIVE goal=(0.36,4.94) dist=2.00m front=0.27m cells=17 rms=3.4cm[435] DRIVE goal=(0.36,4.94) dist=2.00m front=0.27m cells=17 rms=3.4cm[436] DRIVE goal=(0.36,4.94) dist=2.00m front=0.24m cells=17 rms=3.4cm[437] DRIVE goal=(0.36,4.94) dist=2.00m front=0.24m cells=17 rms=3.4cm[438] DRIVE goal=(0.36,4.94) dist=2.00m front=0.23m cells=17 rms=3.4cm[439] DRIVE goal=(0.36,4.94) dist=2.00m front=0.23m cells=17 rms=3.4cm[440] DRIVE goal=(0.36,4.94) dist=2.00m front=0.21m cells=17 rms=3.4cm[441] DRIVE goal=(0.36,4.94) dist=2.00m front=0.21m cells=17 rms=3.4cm[442] DRIVE goal=(0.36,4.94) dist=2.00m front=0.21m cells=17 rms=3.4cm[443] DRIVE goal=(0.36,4.94) dist=2.00m front=0.20m cells=17 rms=3.4cm[444] DRIVE goal=(0.36,4.94) dist=1.99m front=0.20m cells=17 rms=3.4cm[445] DRIVE goal=(0.36,4.94) dist=2.00m front=0.20m cells=17 rms=3.4cm[446] DRIVE goal=(0.36,4.94) dist=2.00m front=0.21m cells=17 rms=3.4cm[447] DRIVE goal=(0.36,4.94) dist=2.00m front=0.20m cells=17 rms=3.4cm[448] DRIVE goal=(0.36,4.94) dist=2.00m front=0.20m cells=17 rms=3.4cm[449] DRIVE goal=(0.36,4.94) dist=1.99m front=0.20m cells=17 rms=3.4cm[450] DRIVE goal=(0.36,4.94) dist=2.00m front=0.20m cells=17 rms=3.4cm[451] DRIVE goal=(0.36,4.94) dist=2.00m front=0.20m cells=17 rms=3.4cm[452] DRIVE goal=(0.36,4.94) dist=2.00m front=0.21m cells=17 rms=3.4cm[453] DRIVE goal=(0.36,4.94) dist=2.00m front=0.21m cells=17 rms=3.4cm[454] DRIVE goal=(0.36,4.94) dist=2.00m front=0.21m cells=17 rms=3.4cm[455] DRIVE goal=(0.36,4.94) dist=2.00m front=0.22m cells=17 rms=3.4cm[456] DRIVE goal=(0.36,4.94) dist=2.00m front=0.22m cells=17 rms=3.4cm[457] DRIVE goal=(0.36,4.94) dist=2.00m front=0.22m cells=17 rms=3.4cm[458] DRIVE goal=(0.36,4.94) dist=2.00m front=0.22m cells=17 rms=3.4cm[459] DRIVE goal=(0.36,4.94) dist=2.00m front=0.22m cells=17 rms=3.4cm[460] DRIVE goal=(0.36,4.94) dist=2.00m front=0.22m cells=17 rms=3.4cm[461] DRIVE goal=(0.36,4.94) dist=2.00m front=0.22m cells=17 rms=3.4cm[462] DRIVE goal=(0.36,4.94) dist=2.00m front=0.23m cells=17 rms=3.4cm[463] DRIVE goal=(0.36,4.94) dist=2.00m front=0.23m cells=17 rms=3.5cm[464] DRIVE goal=(0.36,4.94) dist=2.00m front=0.23m cells=17 rms=3.5cm[465] DRIVE goal=(0.36,4.94) dist=2.00m front=0.23m cells=17 rms=3.5cm[466] DRIVE goal=(0.36,4.94) dist=2.00m front=0.24m cells=17 rms=3.5cm[467] DRIVE goal=(0.36,4.94) dist=2.00m front=0.25m cells=17 rms=3.5cm[468] DRIVE goal=(0.36,4.94) dist=2.00m front=0.25m cells=17 rms=3.5cm[469] DRIVE goal=(0.36,4.94) dist=2.00m front=0.26m cells=17 rms=3.5cm[470] DRIVE goal=(0.36,4.94) dist=2.00m front=0.26m cells=17 rms=3.6cm[471] DRIVE goal=(0.36,4.94) dist=2.00m front=0.26m cells=17 rms=3.6cm[472] DRIVE goal=(0.36,4.94) dist=2.00m front=0.26m cells=17 rms=3.6cm[473] DRIVE goal=(0.36,4.94) dist=2.01m front=0.27m cells=17 rms=3.6cm[474] DRIVE goal=(0.36,4.94) dist=2.01m front=0.27m cells=17 rms=3.7cm[475] DRIVE goal=(0.36,4.94) dist=2.01m front=0.27m cells=17 rms=3.7cm[476] DRIVE goal=(0.36,4.94) dist=2.01m front=0.28m cells=17 rms=3.7cm[477] DRIVE goal=(0.36,4.94) dist=2.02m front=0.31m cells=17 rms=3.7cm[478] DRIVE goal=(0.36,4.94) dist=2.03m front=0.31m cells=17 rms=3.8cm[479] DRIVE goal=(0.36,4.94) dist=2.03m front=0.32m cells=17 rms=3.8cm[480] DRIVE goal=(0.36,4.94) dist=2.03m front=0.34m cells=17 rms=3.8cm[481] DRIVE goal=(0.36,4.94) dist=2.04m front=0.35m cells=17 rms=3.9cm[482] DRIVE goal=(0.36,4.94) dist=2.04m front=0.35m cells=17 rms=3.9cm[483] DRIVE goal=(0.36,4.94) dist=2.05m front=0.36m cells=17 rms=4.0cm[484] DRIVE goal=(0.36,4.94) dist=2.06m front=0.40m cells=17 rms=4.0cm[485] DRIVE goal=(0.36,4.94) dist=2.07m front=0.55m cells=17 rms=4.0cm[486] DRIVE goal=(0.36,4.94) dist=2.08m front=0.63m cells=17 rms=4.1cm[487] DRIVE goal=(0.36,4.94) dist=2.09m front=0.84m cells=17 rms=4.1cm[488] DRIVE goal=(0.36,4.94) dist=2.10m front=0.77m cells=17 rms=4.2cm[489] DRIVE goal=(0.36,4.94) dist=2.09m front=0.74m cells=17 rms=4.2cm[490] DRIVE goal=(0.36,4.94) dist=2.09m front=0.73m cells=17 rms=4.2cm[491] DRIVE goal=(0.36,4.94) dist=2.07m front=0.71m cells=17 rms=4.3cm[492] DRIVE goal=(0.36,4.94) dist=2.05m front=0.69m cells=17 rms=4.3cm[493] DRIVE goal=(0.36,4.94) dist=2.05m front=0.69m cells=17 rms=4.3cm[494] DRIVE goal=(0.36,4.94) dist=2.03m front=0.68m cells=17 rms=4.4cm[495] DRIVE goal=(0.36,4.94) dist=2.01m front=0.66m cells=17 rms=4.4cm[496] DRIVE goal=(0.36,4.94) dist=1.98m front=0.70m cells=17 rms=4.5cm[497] DRIVE goal=(0.36,4.94) dist=1.96m front=0.67m cells=17 rms=4.5cm[498] DRIVE goal=(0.36,4.94) dist=1.93m front=0.62m cells=17 rms=4.5cm[499] DRIVE goal=(0.36,4.94) dist=1.92m front=0.57m cells=17 rms=4.6cm[500] DRIVE goal=(0.36,4.94) dist=1.91m front=0.63m cells=17 rms=4.6cm[501] DRIVE goal=(0.36,4.94) dist=1.88m front=0.67m cells=17 rms=4.6cm[502] DRIVE goal=(0.36,4.94) dist=1.86m front=0.60m cells=17 rms=4.7cm[503] DRIVE goal=(0.36,4.94) dist=1.85m front=0.58m cells=17 rms=4.7cm[504] DRIVE goal=(0.36,4.94) dist=1.84m front=0.56m cells=17 rms=4.7cm[505] DRIVE goal=(0.36,4.94) dist=1.83m front=0.56m cells=17 rms=4.7cm[506] DRIVE goal=(0.36,4.94) dist=1.80m front=0.53m cells=17 rms=4.8cm[507] DRIVE goal=(0.36,4.94) dist=1.78m front=0.46m cells=17 rms=4.8cm[508] DRIVE goal=(0.36,4.94) dist=1.78m front=0.44m cells=17 rms=4.8cm[509] DRIVE goal=(0.36,4.94) dist=1.76m front=0.43m cells=17 rms=4.9cm[510] DRIVE goal=(0.36,4.94) dist=1.76m front=0.42m cells=17 rms=4.9cm[511] DRIVE goal=(0.36,4.94) dist=1.75m front=0.42m cells=17 rms=4.9cm[512] DRIVE goal=(0.36,4.94) dist=1.75m front=0.41m cells=17 rms=5.0cm[513] DRIVE goal=(0.36,4.94) dist=1.74m front=0.41m cells=17 rms=5.0cm[514] DRIVE goal=(0.36,4.94) dist=1.74m front=0.40m cells=17 rms=5.0cm[515] DRIVE goal=(0.36,4.94) dist=1.74m front=0.40m cells=17 rms=5.1cm[516] DRIVE goal=(0.36,4.94) dist=1.73m front=0.40m cells=17 rms=5.1cm[517] DRIVE goal=(0.36,4.94) dist=1.73m front=0.40m cells=17 rms=5.1cm[518] DRIVE goal=(0.36,4.94) dist=1.72m front=0.43m cells=17 rms=5.2cm[519] DRIVE goal=(0.36,4.94) dist=1.72m front=0.43m cells=17 rms=5.2cm[520] DRIVE goal=(0.36,4.94) dist=1.72m front=0.43m cells=17 rms=5.3cm[521] DRIVE goal=(0.36,4.94) dist=1.72m front=0.44m cells=17 rms=5.3cm[522] DRIVE goal=(0.36,4.94) dist=1.71m front=0.47m cells=17 rms=5.4cm[523] DRIVE goal=(0.36,4.94) dist=1.70m front=0.51m cells=17 rms=5.4cm[524] DRIVE goal=(0.36,4.94) dist=1.70m front=0.54m cells=17 rms=5.5cm[525] DRIVE goal=(0.36,4.94) dist=1.69m front=0.63m cells=17 rms=5.5cm[526] DRIVE goal=(0.36,4.94) dist=1.68m front=0.70m cells=17 rms=5.5cm[527] DRIVE goal=(0.36,4.94) dist=1.68m front=0.73m cells=17 rms=5.6cm[528] DRIVE goal=(0.36,4.94) dist=1.67m front=0.76m cells=17 rms=5.6cm[529] DRIVE goal=(0.36,4.94) dist=1.67m front=0.77m cells=17 rms=5.7cm[530] DRIVE goal=(0.36,4.94) dist=1.67m front=0.82m cells=17 rms=5.7cm[531] DRIVE goal=(0.36,4.94) dist=1.67m front=0.79m cells=17 rms=5.7cm[532] DRIVE goal=(0.36,4.94) dist=1.67m front=0.83m cells=17 rms=5.8cm[533] DRIVE goal=(0.36,4.94) dist=1.68m front=0.72m cells=17 rms=5.8cm[534] DRIVE goal=(0.36,4.94) dist=1.67m front=0.85m cells=17 rms=5.9cm[535] DRIVE goal=(0.36,4.94) dist=1.67m front=0.73m cells=17 rms=5.9cm[536] DRIVE goal=(0.36,4.94) dist=1.67m front=0.70m cells=17 rms=5.9cm[537] DRIVE goal=(0.36,4.94) dist=1.67m front=0.66m cells=17 rms=6.0cm[538] DRIVE goal=(0.36,4.94) dist=1.67m front=0.67m cells=17 rms=6.0cm[539] DRIVE goal=(0.36,4.94) dist=1.67m front=0.67m cells=17 rms=6.0cm[540] DRIVE goal=(0.36,4.94) dist=1.67m front=0.67m cells=17 rms=6.1cm[541] DRIVE goal=(0.36,4.94) dist=1.67m front=0.67m cells=17 rms=6.1cm[542] DRIVE goal=(0.36,4.94) dist=1.67m front=0.69m cells=17 rms=6.1cm[543] DRIVE goal=(0.36,4.94) dist=1.67m front=0.84m cells=17 rms=6.2cm[544] DRIVE goal=(0.36,4.94) dist=1.65m front=0.75m cells=17 rms=6.2cm[545] DRIVE goal=(0.36,4.94) dist=1.65m front=0.76m cells=17 rms=6.2cm[546] DRIVE goal=(0.36,4.94) dist=1.65m front=0.73m cells=17 rms=6.3cm[547] DRIVE goal=(0.36,4.94) dist=1.65m front=0.72m cells=17 rms=6.3cm[548] DRIVE goal=(0.36,4.94) dist=1.65m front=0.72m cells=17 rms=6.3cm[549] DRIVE goal=(0.36,4.94) dist=1.65m front=0.74m cells=17 rms=6.4cm[550] DRIVE goal=(0.36,4.94) dist=1.65m front=0.79m cells=17 rms=6.4cm[551] DRIVE goal=(0.36,4.94) dist=1.65m front=0.81m cells=17 rms=6.4cm[552] DRIVE goal=(0.36,4.94) dist=1.66m front=0.84m cells=17 rms=6.4cm
[122.4s] [DRIVE STUCK] Goal distance unchanged for 6.9s
[DRIVE STUCK] dist_oldest=1.72m, dist_now=1.66m, change=0.06m < margin=0.08m
[DRIVE STUCK] Front sectors: s55=0.89 s56=1.08 s57=1.51 s58=1.88 s59=1.92 s0=2.70 s1=2.73 s2=2.77 s3=2.84 s4=2.93 s5=0.70 
[DRIVE STUCK] Marked front sectors [55, 56, 57, 58, 59, 0, 1, 2, 3, 4, 5] as blocked for 30s

[BACKUP CLEAR] Reversing and turning toward clearer side...
[BACKUP CLEAR] Turning left (L_avg=2.39m R_avg=1.46m)

[127.3s] [GOAL SELECT] robot@(1.03,3.30) | 18 candidates (scanned=242 walls=170 visited=17):
  #1 ang=-125° d=2.00m pos=(2.97,2.84) score=+28.4 [O=+2.3 U=+30.8 V=-0.0 W=-3.0 R=-2.3 F=+0.0] <-- BEST
  #2 ang=-125° d=1.50m pos=(2.49,2.96) score=+24.2 [O=+2.5 U=+23.8 V=-0.0 W=-1.0 R=-1.6 F=+0.0]
  #3 ang= -39° d=0.50m pos=(1.18,3.78) score=-11.0 [O=+1.9 U=+15.0 V=-0.0 W=-3.0 R=-0.0 F=+0.0 B=-25.0]
  #4 ang= -33° d=0.50m pos=(1.13,3.79) score=-39.0 [O=+2.4 U=+11.5 V=-0.0 W=-3.0 R=-0.0 F=+0.0 B=-50.0]
  #5 ang= -27° d=1.00m pos=(1.12,4.30) score=-82.3 [O=+1.9 U=+16.5 V=-0.0 W=-1.0 R=-0.0 F=+0.0 B=-100.0]
  #6 ang= -21° d=2.00m pos=(1.00,5.30) score=-90.8 [O=+1.8 U=+32.7 V=-0.0 W=-1.0 R=-0.0 F=+0.0 B=-125.0]
  #7 ang= -27° d=0.50m pos=(1.07,3.80) score=-91.9 [O=+2.4 U=+8.5 V=-0.0 W=-3.0 R=-0.0 F=+0.0 B=-100.0]
  #8 ang= -21° d=1.50m pos=(1.01,4.80) score=-101.0 [O=+2.3 U=+24.7 V=-0.0 W=-1.0 R=-2.5 F=+0.0 B=-125.0]
[127.3s] [GOAL] Selected: (2.97, 2.84) dist=2.00m timeout=50s angle=-125° reason=no goal
[554] DRIVE goal=(2.97,2.84) dist=2.00m front=0.48m cells=17 rms=6.4cm[555] DRIVE goal=(2.97,2.84) dist=2.00m front=0.47m cells=17 rms=6.4cm[556] DRIVE goal=(2.97,2.84) dist=2.00m front=0.48m cells=17 rms=6.4cm[557] DRIVE goal=(2.97,2.84) dist=2.00m front=0.48m cells=17 rms=6.4cm[558] DRIVE goal=(2.97,2.84) dist=2.00m front=0.46m cells=17 rms=6.4cm[559] DRIVE goal=(2.97,2.84) dist=2.00m front=0.45m cells=17 rms=6.4cm[560] DRIVE goal=(2.97,2.84) dist=2.00m front=0.49m cells=17 rms=6.4cm[561] DRIVE goal=(2.97,2.84) dist=2.00m front=0.49m cells=17 rms=6.4cm[562] DRIVE goal=(2.97,2.84) dist=2.00m front=0.57m cells=17 rms=6.4cm[563] DRIVE goal=(2.97,2.84) dist=2.01m front=0.66m cells=17 rms=6.4cm[564] DRIVE goal=(2.97,2.84) dist=2.00m front=0.68m cells=17 rms=6.4cm[565] DRIVE goal=(2.97,2.84) dist=2.00m front=0.69m cells=17 rms=6.4cm[566] DRIVE goal=(2.97,2.84) dist=2.01m front=0.70m cells=17 rms=6.4cm[567] DRIVE goal=(2.97,2.84) dist=2.00m front=0.73m cells=17 rms=6.4cm[568] DRIVE goal=(2.97,2.84) dist=2.00m front=0.73m cells=17 rms=6.4cm[569] DRIVE goal=(2.97,2.84) dist=2.00m front=0.74m cells=17 rms=6.3cm[570] DRIVE goal=(2.97,2.84) dist=2.00m front=0.79m cells=17 rms=6.3cm[571] DRIVE goal=(2.97,2.84) dist=2.00m front=0.71m cells=17 rms=6.3cm[572] DRIVE goal=(2.97,2.84) dist=2.00m front=0.70m cells=17 rms=6.3cm[573] DRIVE goal=(2.97,2.84) dist=2.00m front=0.69m cells=17 rms=6.3cm[574] DRIVE goal=(2.97,2.84) dist=2.01m front=0.60m cells=17 rms=6.3cm[575] DRIVE goal=(2.97,2.84) dist=2.01m front=0.56m cells=17 rms=6.3cm[576] DRIVE goal=(2.97,2.84) dist=2.01m front=0.56m cells=17 rms=6.3cm[577] DRIVE goal=(2.97,2.84) dist=2.01m front=0.56m cells=17 rms=6.3cm[578] DRIVE goal=(2.97,2.84) dist=2.01m front=0.54m cells=17 rms=6.3cm[579] DRIVE goal=(2.97,2.84) dist=2.01m front=0.53m cells=17 rms=6.3cm[580] DRIVE goal=(2.97,2.84) dist=2.01m front=0.54m cells=17 rms=6.3cm[581] DRIVE goal=(2.97,2.84) dist=2.01m front=0.52m cells=17 rms=6.3cm[582] DRIVE goal=(2.97,2.84) dist=2.01m front=0.47m cells=17 rms=6.3cm[583] DRIVE goal=(2.97,2.84) dist=2.01m front=0.47m cells=17 rms=6.3cm[584] DRIVE goal=(2.97,2.84) dist=2.01m front=0.47m cells=17 rms=6.3cm[585] DRIVE goal=(2.97,2.84) dist=2.01m front=0.46m cells=17 rms=6.3cm[586] DRIVE goal=(2.97,2.84) dist=2.02m front=0.46m cells=17 rms=6.3cm[587] DRIVE goal=(2.97,2.84) dist=2.02m front=0.46m cells=17 rms=6.3cm[588] DRIVE goal=(2.97,2.84) dist=2.02m front=0.46m cells=17 rms=6.3cm[589] DRIVE goal=(2.97,2.84) dist=2.02m front=0.46m cells=17 rms=6.2cm[590] DRIVE goal=(2.97,2.84) dist=2.02m front=0.46m cells=17 rms=6.2cm[591] DRIVE goal=(2.97,2.84) dist=2.02m front=0.46m cells=17 rms=6.2cm[592] DRIVE goal=(2.97,2.84) dist=2.02m front=0.46m cells=17 rms=6.2cm[593] DRIVE goal=(2.97,2.84) dist=2.02m front=0.46m cells=17 rms=6.2cm[594] DRIVE goal=(2.97,2.84) dist=2.02m front=0.45m cells=17 rms=6.2cm[595] DRIVE goal=(2.97,2.84) dist=2.02m front=0.45m cells=17 rms=6.2cm[596] DRIVE goal=(2.97,2.84) dist=2.01m front=0.45m cells=17 rms=6.2cm[597] DRIVE goal=(2.97,2.84) dist=2.01m front=0.44m cells=17 rms=6.2cm[598] DRIVE goal=(2.97,2.84) dist=2.01m front=0.45m cells=17 rms=6.2cm[599] DRIVE goal=(2.97,2.84) dist=2.01m front=0.45m cells=17 rms=6.2cm[600] DRIVE goal=(2.97,2.84) dist=2.01m front=0.44m cells=17 rms=6.2cm[601] DRIVE goal=(2.97,2.84) dist=2.01m front=0.44m cells=17 rms=6.2cm[602] DRIVE goal=(2.97,2.84) dist=2.01m front=0.44m cells=17 rms=6.2cm[603] DRIVE goal=(2.97,2.84) dist=2.00m front=0.43m cells=17 rms=6.2cm[604] DRIVE goal=(2.97,2.84) dist=2.00m front=0.43m cells=17 rms=6.2cm[605] DRIVE goal=(2.97,2.84) dist=2.00m front=0.43m cells=17 rms=6.2cm[606] DRIVE goal=(2.97,2.84) dist=2.00m front=0.43m cells=17 rms=6.2cm[607] DRIVE goal=(2.97,2.84) dist=2.00m front=0.43m cells=17 rms=6.2cm[608] DRIVE goal=(2.97,2.84) dist=2.00m front=0.43m cells=17 rms=6.2cm[609] DRIVE goal=(2.97,2.84) dist=2.00m front=0.43m cells=17 rms=6.2cm[610] DRIVE goal=(2.97,2.84) dist=1.99m front=0.42m cells=17 rms=6.2cm[611] DRIVE goal=(2.97,2.84) dist=1.98m front=0.42m cells=17 rms=6.2cm[612] DRIVE goal=(2.97,2.84) dist=1.97m front=0.41m cells=17 rms=6.2cm[613] DRIVE goal=(2.97,2.84) dist=1.97m front=0.40m cells=17 rms=6.1cm[614] DRIVE goal=(2.97,2.84) dist=1.96m front=0.40m cells=17 rms=6.1cm[615] DRIVE goal=(2.97,2.84) dist=1.95m front=0.39m cells=17 rms=6.1cm[616] DRIVE goal=(2.97,2.84) dist=1.93m front=0.40m cells=17 rms=6.1cm[617] DRIVE goal=(2.97,2.84) dist=1.90m front=0.38m cells=17 rms=6.1cm[618] DRIVE goal=(2.97,2.84) dist=1.88m front=0.35m cells=17 rms=6.1cm[619] DRIVE goal=(2.97,2.84) dist=1.87m front=0.36m cells=17 rms=6.1cm[620] DRIVE goal=(2.97,2.84) dist=1.84m front=0.40m cells=17 rms=6.1cm[621] DRIVE goal=(2.97,2.84) dist=1.83m front=0.36m cells=17 rms=6.1cm[622] DRIVE goal=(2.97,2.84) dist=1.81m front=0.30m cells=17 rms=6.1cm[623] DRIVE goal=(2.97,2.84) dist=1.79m front=0.28m cells=17 rms=6.1cm[624] DRIVE goal=(2.97,2.84) dist=1.78m front=0.27m cells=17 rms=6.1cm[625] DRIVE goal=(2.97,2.84) dist=1.74m front=0.28m cells=17 rms=6.1cm[626] DRIVE goal=(2.97,2.84) dist=1.73m front=0.24m cells=17 rms=6.1cm[627] DRIVE goal=(2.97,2.84) dist=1.72m front=0.21m cells=17 rms=6.1cm[628] DRIVE goal=(2.97,2.84) dist=1.70m front=0.19m cells=17 rms=6.1cm[629] DRIVE goal=(2.97,2.84) dist=1.69m front=0.18m cells=17 rms=6.1cm[630] DRIVE goal=(2.97,2.84) dist=1.69m front=0.18m cells=17 rms=6.1cm[631] DRIVE goal=(2.97,2.84) dist=1.68m front=0.18m cells=17 rms=6.1cm[632] DRIVE goal=(2.97,2.84) dist=1.66m front=0.23m cells=17 rms=6.1cm[633] DRIVE goal=(2.97,2.84) dist=1.65m front=0.22m cells=17 rms=6.1cm[634] DRIVE goal=(2.97,2.84) dist=1.65m front=0.24m cells=17 rms=6.1cm[635] DRIVE goal=(2.97,2.84) dist=1.64m front=0.30m cells=17 rms=6.0cm[636] DRIVE goal=(2.97,2.84) dist=1.61m front=0.29m cells=17 rms=6.0cm[637] DRIVE goal=(2.97,2.84) dist=1.61m front=0.28m cells=17 rms=6.0cm[638] DRIVE goal=(2.97,2.84) dist=1.60m front=0.21m cells=17 rms=6.0cm[639] DRIVE goal=(2.97,2.84) dist=1.60m front=0.18m cells=17 rms=6.0cm[640] DRIVE goal=(2.97,2.84) dist=1.60m front=0.18m cells=17 rms=6.0cm[641] DRIVE goal=(2.97,2.84) dist=1.59m front=0.18m cells=17 rms=6.0cm[642] DRIVE goal=(2.97,2.84) dist=1.59m front=0.18m cells=17 rms=6.0cm[643] DRIVE goal=(2.97,2.84) dist=1.58m front=0.15m cells=17 rms=6.0cm
[145.3s] [BACKUP] front=0.14m

[BACKUP] Reversing...
[BACKUP] Turning right (L_openings=1 R_openings=6)


Stopping (Ctrl+C)...
[MARKER] Publisher stopped

=======================================================
NBV NAVIGATION COMPLETE
=======================================================
Final state: exploring
Duration: 148.1s
Iterations: 644
Goals reached: 5
Backups: 3
Unique cells visited: 17
Cells scanned by LiDAR: 244
Walls detected: 172

--- Drive Accuracy ---
Cross-track RMS error: 6.0cm
Total distance traveled: 6.44m
Ideal distance (sum of goals): 13.50m
Drive efficiency: 209.5%
Revisit rate: 100.0%

--- Map Accuracy Suggestions ---
To measure map accuracy, consider:
1. Ground truth comparison: Place markers at known positions,
   compare measured vs actual distances between them
2. Loop closure error: After returning to origin, check
   odometry drift (final_dist to origin should be ~0)
3. Feature alignment: Compare map walls to actual room layout
4. Consistency check: Run multiple times, overlay maps
5. Tape measure validation: Measure actual room dimensions,
   compare to map scale (resolution * pixels)
